druh,obsah,datace,zobrazeno,xid,signatura,start_date,end_date,geolocation_position_lon,geolocation_position_lat,geolocation_type,geolocation_endpoint,autor,poznámka,scan_count,scan_previews,scan_zoomify_paths
pozitiv,Pohled do dvora domu čp. 791 (U Lhotků) na nároží Václavského náměstí a Vodičkovy ulice na Novém Městě krátce před zbořením. Uprostřed kašna.,kol.1912,56x,A1186FFAB67611DF820F00166F1163D4,V 9/6 b,1912-01-01,1912-12-31,14.42553,50.08197,regional.address,geocode,"Bufka, Vladimír Jindřich",,,[],[]
pozitiv,Pohled do zahrady Valdštejnského paláce (dům čp. 17) na Malé Straně se salou terrenou.,před 1923,36x,3925B7315A6311E7A69B406186009F3A,I 12118,1800-01-01,1922-12-31,14.40535,50.09003,regional.address,geocode,,,,[],[]
negativ,"Průhled Kaprovou ulicí s domy čp. 33, 31 (zprava) na Starém Městě krátce před zbořením.",26.8.1906,33x,A14CE1A8B67611DF820F00166F1163D4,VIII 907,1906-08-26,1906-08-26,14.41835,50.08793,regional.address,geocode,Eckert-ateliér,,,[],[]
negativ,Pohled do dnešní ulice Magdalény Rettigové s domem čp. 47 na Novém Městě (škola u Nejsvětější Trojice). Vlevo část kostela Nejsvětější Trojice ve Spálené ulici.,18.10.1910,28x,569AE984187311E28DC36C626D41E503,XII 1232,1910-10-18,1910-10-18,14.42036,50.07983,regional.address,geocode,Eckert-ateliér,,0.0,[],[]
pozitiv,Pohled na orloj Staroměstské radnice (dům čp. 1 na Starém Městě) na Staroměstském náměstí. V popředí stanice tramvaje č. 5.,1894,66x,D79635DE90E111E8B3B474D435EEBE90,V 69/1 b,1894-01-01,1894-12-31,14.42009,50.087,regional.address,suggest,,,,[],[]
negativ,"Pohled na spojovací můstek chrámu sv. Víta na Pražském hradě mezi věží a ""trubačským schodištěm"" - při stavbě.",[1863-1905],37x,F155D6E1070C11E286836C626D41E503,XII 654,,,14.39995,50.09041,regional.address,geocode,"Eckert, Jindřich (1833-1905)",Datace neznámá. Za účelem vyhledávání byla nastavena na časový rozsah celé sbírky.,0.0,[],[]
pozitiv,Pohled na vilu Amerika (dům čp. 462) v ulici Ke Karlovu na Novém Městě.,1890,39x,EF3563EDBDCC11E493C10024BE7CD9AC,V 4/13,1890-01-01,1890-12-31,14.42692,50.07369,regional.address,geocode,Bellmann,,,[],[]
pozitiv,Pohled do zahrady bývalého Tereziánského ústavu šlechtičen na Pražském hradě (dům čp. 2 na Hradčanech).,před 1926,34x,A0C502EFB67611DF820F00166F1163D4,I 4239,1800-01-01,1925-12-31,14.40339,50.09134,regional.address,geocode,"Vojta, Tomáš (1885-1934)",,,[],[]
negativ,"Pohled na sochu Panny Marie, která je součástí sousoší Panna Marie se svatým Dominikem a svatým Tomášem Akvinským na Karlově mostě.",1908,38x,73200747748B11E49FFF0024BE7CD9AC,XI 652,1908-01-01,1908-12-31,14.41126,50.0865,poi,suggest,"Kříženecký, Jan (1868-1921)",Autorství J. Kříženeckého není jisté.,0.0,[],[]
pozitiv,"Pohled na vstupní portál domu čp. 384 (""U zlaté lopaty"") v ulici Na Můstku na Starém Městě.",15.8.1913,12x,A0C4F5DFB67611DF820F00166F1163D4,VI 15/31,1913-08-15,1913-08-15,14.42269,50.08469,regional.address,geocode,,,,[],[]
negativ,"Panoramatický pohled od Petřína na Nebozísku na Pražský hrad a Malou Stranu, v popředí Petřínské sady, vpravo kostel sv. Mikuláše.",kol.1971,34x,A0C51239B67611DF820F00166F1163D4,VII 306,1971-01-01,1971-12-31,14.39885,50.0819,regional.address,geocode,"Chalupníček, Miroslav -, Chalupníčková, Věra (dokument 1941-1948)",,,[],[]
pozitiv,"Pohled na vstupní portál bývalého domu čp. 471 (""Melantrichův dům"") v Melantrichově ulici na Starém Městě, který byl zbořen v1893.",1893,21x,A0C4F5E5B67611DF820F00166F1163D4,VI 16/11,1893-01-01,1893-12-31,14.42091,50.08566,regional.address,geocode,,,,[],[]
pozitiv,"Pohled do interiéru Valdštejnského paláce (dům čp. 17 na Malé Straně) - Antikamera (zrcadlový salonek sousedící s Valdštejnovou pracovnou, kde stávala jeho osobní stráž).",,18x,A14CEB30B67611DF820F00166F1163D4,VI 60/18 b,,,14.40535,50.09003,regional.address,geocode,Eckert-ateliér,,,[],[]
pozitiv,Pohled do Prokopského údolí s kostelem sv. Prokopa na skále.,22.7.1923,102x,A14CE005B67611DF820F00166F1163D4,I 4547,1923-07-22,1923-07-22,14.38197,50.0411,regional.address,geocode,"Bernau, Karel, Ing. (1880-1948)",,,[],[]
pozitiv,"Celkový pohled na zahradní průčelí Dienzenhoferova pavilonu (dům čp. 74 - ""dům botanické zahrady"") v Nábřežní ulici na Smíchově.",kol.1895,38x,A14CE95FB67611DF820F00166F1163D4,VI 14/10,1895-01-01,1895-12-31,14.40004,50.06379,regional.address,geocode,"Eckert, Jindřich (1833-1905)",,,[],[]
pozitiv,Pohled do dvora domu čp. 384 z východní strany v Podskalské ulici na Novém Městě před zbořením roku 1911.,30.8.1906,53x,A14CEB2CB67611DF820F00166F1163D4,VI 58/22,1906-08-30,1906-08-30,14.53331,50.05804,regional.address,geocode,Eckert-ateliér,,,[],[]
pozitiv,"Pohled do Dlouhé ulice s domem čp. 609 (vlevo) na Starém Městě krátce před zbořením. Vpravo dům čp. 929, v pozadí část Staroměstské radnice.",4.5.1905,32x,A14CE945B67611DF820F00166F1163D4,VI 47/27 c,1905-05-04,1905-05-04,14.4218,50.08853,regional.address,geocode,Eckert-ateliér,,,[],[]
pozitiv,Sovětská okupace v Praze 21. srpna 1968 - zničené autobusy nad budovou rozhlasu na křižovatce ulic Italské (v popředí) a Vinohradské. V pozadí domy čp. 495 a čp. 1255. Vpravo dům čp. 1202 na Vinohradech.,21.8.1968,151x,A11889F3B67611DF820F00166F1163D4,I 4513,1968-08-21,1968-08-21,14.43564,50.0769,regional.address,geocode,"Sedláček, Karel",,,[],[]
pozitiv,Pohled na vstupní portál kostela P. Marie před Týnem na Starém Městě.,20.8.1907,12x,A11880B3B67611DF820F00166F1163D4,VI 27/9,1907-08-20,1907-08-20,14.42396,50.08884,regional.address,geocode,,,,[],[]
pozitiv,"Pohled na část novoměstské hradební zdi místech Neklanovy ulice, Botiče a železniční trati. Vpravo železniční most přes Botič. V pozadí vpravo kostel Nanebevzetí P. Marie a sv. Karla Velikého na Karlově.",před 1926,151x,A14CDD0EB67611DF820F00166F1163D4,I 4046,1800-01-01,1925-12-31,14.42103,50.06639,regional.address,geocode,"Vojta, Tomáš (1885-1934)",,,[],[]
pozitiv,Pohled přes Vltavu na dnešní Dvořákovo a Alšovo nábřeží s Rudolfinem. V pozadí panorama Starého Města.,kol.1890,54x,A14CDD16B67611DF820F00166F1163D4,II 508,1890-01-01,1890-12-31,14.41521,50.09017,regional.address,geocode,,,,[],[]
negativ,Pohled na část průčelí domu čp. 513 v Sokolovské ulici v Libni - opatrovna a mateřská škola.,kol.1905,62x,A0C4F448B67611DF820F00166F1163D4,VIII 764,1905-01-01,1905-12-31,14.47574,50.10217,regional.address,geocode,Eckert-ateliér,,,[],[]
pozitiv,Pohled na průčelí domu čp. 923 do Dlouhé ulice na Starém Městě.,kol.1910,30x,A1188679B67611DF820F00166F1163D4,VI 3/13,1910-01-01,1910-12-31,14.42207,50.08923,regional.address,geocode,"Svoboda, Josef ml. (dokument 1914-1920)",,,[],[]
negativ,"""Tycho Brahe v Praze"" - výstava 1901. Jeden z ""astronomických"" rukopisů Mikuláše Koperníka.",1901,11x,BB3D77BA0BB111E2AEA36C626D41E503,XII 904,1901-01-01,1901-12-31,14.41994,50.08663,regional.address,geocode,"Eckert, Jindřich (1833-1905)",,0.0,[],[]
negativ,Pohled na část domu čp. 7 s portálem v Malé Lazarské ulici na Novém Městě (bývalý špitál u sv. Lazara) krátce před zbořením.,1898-1900,40x,A1187A49B67611DF820F00166F1163D4,VIII 113,1898-01-01,1900-12-31,14.42152,50.07923,regional.address,geocode,"Eckert, Jindřich (1833-1905)",,,[],[]
pozitiv,Pohled na zahradní portál býv. domu čp. 1002 v Hybernské ulici na Novém Městě s balkonem.,15.4.1911,26x,A1188C93B67611DF820F00166F1163D4,VI 19/32,1911-04-15,1911-04-15,14.43134,50.08713,regional.address,geocode,,,,[],[]
negativ,"Celkový pohled na dům čp. 580 (""U Hroznu"") na nároží Ovocného trhu a Havířské ulice na Starém Městě. Vlevo dům čp. 579 (Kolovratský palác). Zcela vlevo část Tylova divadla.",1899,28x,A1188227B67611DF820F00166F1163D4,VIII 336,1899-01-01,1899-12-31,14.42422,50.08601,regional.address,geocode,"Eckert, Jindřich (1833-1905)",,,[],[]
pozitiv,Pohled do Vladislavského sálu Pražského hradu.,,23x,C5C45E605F5911E8A52374D435EEBE90,V 14/45,,,14.40198,50.09066,poi,suggest,,,,[],[]
pozitiv,"Pohled přes Vltavu na Staré Město - Dvořákovo nábřeží, vpravo Rudolfinum (dům čp. 79 na Starém Městě). V pozadí vlevo kostel P. Marie před Týnem, uprostřed věže kostela sv. Mikuláše na Staroměstském náměstí. V popředí část Jezuitské zahrady se zahradním domkem, vpravo malá část domu čp. 128 na Malé Straně ""letní dům Jezuitů"". Vlevo Občanská plovárna s parkem.",kol.1885,98x,A1187E17B67611DF820F00166F1163D4,VI 13/48,1885-01-01,1885-12-31,14.41139,50.09203,regional.address,geocode,"Fridrich, František (1829-1892)",,,[],[]
pozitiv,"Pražské povstání - 8.5.1945 - boje na Staroměstském náměstí - pohled na náměstí od Kynzlových domů směrem k Pařížské ulici. Vlevo část poškozeného východního křídla Staroměstské radnice s balkonem, uprostřed hořící dům čp. 934 na nároží Pařížské ulice, v popředí na zemi sutiny.",8.5.1945,140x,A1187E0DB67611DF820F00166F1163D4,IV 74/33,1945-05-08,1945-05-08,14.4207,50.08803,regional.address,geocode,"Stehno, Josef (?)",,,[],[]
pozitiv,"Socha sv. Augustina na Karlově mostě (J.Kohl, 1708).",1898,97x,A0C5071EB67611DF820F00166F1163D4,II 1418,1898-01-01,1898-12-31,14.41126,50.0865,poi,suggest,"Kříženecký, Jan (1868-1921)",Autorství J. Kříženeckého není jisté.,0.0,[],[]
pozitiv,Pohled na detaily fasády kostela sv. Jakuba na Starém Městě - střed jižní část štukatury.,19.7.1904,15x,A0C4F956B67611DF820F00166F1163D4,VI 35/4 a,1904-07-19,1904-07-19,14.42455,50.08856,regional.address,geocode,"Eckert, Jindřich (1833-1905)",,,[],[]
pozitiv,Pohled na Letenskou vodárenskou věž (dům čp. 1000 v Bubenči).,,101x,A0C50E33B67611DF820F00166F1163D4,I 8636,,,14.41987,50.10017,regional.address,geocode,,,,[],[]
pozitiv,Pohled na usedlost Hadovka (dům čp. 10) v Dejvicích z protějšího svahu. V popředí dům čp. 168.,26.5.1924,75x,6C6448A5611311E4B88BD4BED94BB14D,I 11033,1924-05-26,1924-05-26,14.37685,50.10006,regional.address,geocode,"Fink, František (1854-1935)",,,[],[]
negativ,Pohled na slavnost položení základního kamene novostavby domu čp. 191 na Starém Městě (Křižovnický klášter) - při čtení svědčícího listu.,13.11.1910,20x,96427754193711E28B046C626D41E503,XII 1241,1910-11-13,1910-11-13,14.41405,50.08641,regional.address,geocode,Eckert-ateliér,,0.0,[],[]
pozitiv,Panoramatický pohled z novoměstské vodárenské věže na Švehlovo nábřeží (dnes Ludvíka Svobody). V pozadí ostrov Štvanice s domem čp. 1340 a Holešovice s kostelem sv. Antonína Paduánského a budovou Úrazové pojišťovny (dům čp. 1000). Druhý díl panoramatu.,31.7.1937,79x,A4734D5FFA3511E5B79C406186009F3A,A 11330,1937-07-31,1937-07-31,14.43399,50.09709,regional.address,geocode,"Alexander, Antonín (1892-působnost do 1948)",,0.0,[],[]
pozitiv,Pohled do dvora domu čp. 425 na Malé Straně. V pozadí dvorní průčelí Umělecké besedy čp. 487.,25.2.1927,43x,A1186C2BB67611DF820F00166F1163D4,I 4244,1927-02-25,1927-02-25,14.40458,50.08208,regional.address,geocode,"Alexander, Antonín (1892-působnost do 1948)",,,[],[]
negativ,"Pohled ze Slovanského ostrova přes Vltavu k severu. Uprostřed Národní divadlo (dům čp. 223 na Novém Městě) a lávka, která spojovala nábřeží se Slovanským ostrovem. Vpravo Nové lázně (dům čp. 228 na Novém Městě) po přestavbě roku 1885.",kol.1890,47x,E07337949E9711E1AB206C626D41E503,XII 805,1890-01-01,1890-12-31,14.41471,50.07955,regional.address,geocode,"Eckert, Jindřich (1833-1905)",,0.0,[],[]
pozitiv,Celkový pohled na novostavbu Elektrických podniků hl. m. Prahy v Holešovicích (dům čp. 1477). Vlevo kostel sv. Antonína na Strossmayerově náměstí.,31.8.1937,53x,A7983AE0E68D11E89E7C74D435EEBE90,A 11382,1937-08-31,1937-08-31,14.4368,50.09865,regional.address,geocode,"Alexander, Antonín (1892-působnost do 1948)",,0.0,[],[]
pozitiv,"Pohled na vstupní portál domu čp. 70 (""U Künzlů"") v Míšeňské ulici na Malé Straně.",22.8.1906,14x,A0C51120B67611DF820F00166F1163D4,VI 20/16,1906-08-22,1906-08-22,14.40829,50.08777,regional.address,geocode,,,,[],[]
negativ,Průhled Šerlinskou uličkou s domy čp. 236 (vlevo) a čp. 213 a 215 (zprava) na Novém Městě před zbořením v letech 1902-1903.,kol.1900,25x,A0C5187CB67611DF820F00166F1163D4,VIII 80,1900-01-01,1900-12-31,14.4324,50.09015,regional.address,geocode,"Eckert, Jindřich (1833-1905)",,,[],[]
negativ,Celkový pohled na klášter Na Slovanech (v Emauzích) - dům čp. 320 na Novém Městě. V popředí původní domovní zástavba v Podskalí na dnešním Palackého náměstí.,14.10.1910,63x,6D90FC2B0ADB11E1BEC2000C766D2371,XII 391,1910-10-14,1910-10-14,14.41719,50.07215,regional.address,geocode,Eckert-ateliér,,0.0,[],[]
negativ,"Pohled do ulice Na Zderaze s domem čp. 267 (""Stoletá kavárna"") na nároží ulic na Zderaze a Na Zbořenci krátce před zbořením. Zleva domy čp. 260 a 1702 na Novém Městě.",27.3.1908,36x,A14CDADFB67611DF820F00166F1163D4,VIII 604,1908-03-27,1908-03-27,14.41664,50.07719,regional.address,geocode,Eckert-ateliér,,,[],[]
pozitiv,Pohled na dveře (č.22) v 1. patře a portál z roku 1560 odkryté při přestavbě Novoměstské radnice (dům čp. 1-2 na Novém Městě).,15.6.1904,44x,A14CEA29B67611DF820F00166F1163D4,VI 53/3,1904-06-15,1904-06-15,14.42113,50.07822,poi,suggest,"Eckert, Jindřich (1833-1905)",,,[],[]
negativ,"Pohled na ""Malířskou"" baštu na Karlově - zbytek novoměstských hradeb. V pozadí část kostela Nanebevzetí P. Marie a sv. Karla Velikého na Karlově.",1892,46x,B1AC91657C1F11E2BF19525400E46D25,VIII 1240,1892-01-01,1892-12-31,14.42851,50.0692,regional.address,geocode,"Eckert, Jindřich (1833-1905)",,,[],[]
pozitiv,Pohled na detail terasní zeď kostela sv. Jana Nepomuckého na Skalce ve Vyšehradské ulici na Novém Městě.,3.6.1923,59x,9DCB66D5978E11E6BAC1406186009F3A,A 77,1923-06-03,1923-06-03,14.41719,50.07215,regional.address,geocode,"Alexander, Antonín (1892-působnost do 1948)",,0.0,[],[]
pozitiv,Pohled na různě profilované kameny nalezené ve zdech zbořeného domu čp. 16 na Starém Městě (Andělská kolej) v Mikulášské ulici (dnes náměstí Franze Kafky).,1909,28x,B354CCC7808B11E4AAB4406186009F3A,V 1/8 c,1909-01-01,1909-12-31,14.41873,50.08783,regional.address,geocode,"Kříženecký, Jan (1868-1921)",,,[],[]
pozitiv,Pohled na západní průčelí Stavovského divadla (dům čp. 540 na Starém Městě).,kol.1925,33x,E570EEC8B0E411E29177406186009F3A,I 9724,1925-01-01,1925-12-31,14.42349,50.08599,regional.address,geocode,"Vojta, Tomáš (1885-1934)",,,[],[]
negativ,Pohled do interiéru domu čp. 1563 na Novém Městě - zasedací síň děkanátu lékařské fakulty německé univerzity v Anatomickém ústavu.,,14x,A0C5091BB67611DF820F00166F1163D4,X 210,,,14.42212,50.07375,regional.address,geocode,"Reach, Zikmund (1859-1935)",,,[],[]
pozitiv,Celkový pohled na Národní divadlo (dům čp. 223 na Novém Městě) z mostu Legií.,1984,86x,A0C50B74B67611DF820F00166F1163D4,I 4705,1984-01-01,1984-12-31,14.41347,50.08126,regional.address,geocode,"Doležal, Michal",,,[],[]
negativ,Sousoší Piety na Karlově mostě.,1900-1905,35x,673EA95A031711E293456C626D41E503,XII 612,1900-01-01,1905-12-31,14.41126,50.0865,poi,suggest,"Eckert, Jindřich (1833-1905)",,0.0,[],[]
pozitiv,Pohled na dům čp. 490 (palác Metychů z Čečova - Hrzánský) na Velkopřevorském náměstí na Malé Straně s renesančním portálem.,1970,27x,05C3657005B911E389696C626D41E503,I 9765,1970-01-01,1970-12-31,14.40739,50.08615,regional.address,geocode,"Vopravil, Josef (1902-1972)",,,[],[]
pozitiv,Pohled do Vyšehradské ulice s kostelem sv. Bartoloměje a s chudobincem (dům čp. 427) na Novém Městě před zbořením roku 1884.,kol.1880,89x,A0C5005BB67611DF820F00166F1163D4,VI 30/27 b,1880-01-01,1880-12-31,14.41883,50.06985,regional.address,geocode,"Eckert, Jindřich (1833-1905)",,,[],[]
negativ,Celkový pohled na nárožní dům čp. 36 (Thunovský palác) na Novém Městě na křižovatce Národní a Jungmannovy ulice.,kol.1910,49x,A1187B4CB67611DF820F00166F1163D4,X 2035,1910-01-01,1910-12-31,14.42213,50.08248,regional.address,geocode,,,,[],[]
negativ,"Pohled na dům čp. 897 na Novém Městě (""U Rajtknechtů"") na nároží ulic Jindřišské a Panské - průčelí do Jindřišské krátce před zbořením.",20.1.1907,40x,A118793FB67611DF820F00166F1163D4,VIII 134,1907-01-20,1907-01-20,14.42772,50.08394,regional.address,geocode,Eckert-ateliér,,,[],[]
pozitiv,Celkový pohled na dům čp. 59 ve Slivenecké ulici v Hlubočepích.,11.10.1925,59x,133FF8E4125411E8A338406186009F3A,A 2198,1925-10-11,1925-10-11,14.3878,50.04124,regional.address,geocode,"Alexander, Antonín (1892-působnost do 1948)",,0.0,[],[]
pozitiv,Pohled do dvora usedlosti Kotlaska (dům čp. 64) v Libni.,5.6.1928,77x,E12647CAEF2D11E9A3D5406186009F3A,A 4274,1928-06-05,1928-06-05,14.47916,50.10626,regional.address,geocode,"Alexander, Antonín (1892-působnost do 1948)",,0.0,[],[]
pozitiv,Pohled do interiéru domu čp. 216 (Obecná a měšťanská dívčí škola u sv. Vojtěcha) ve Vojtěšské ulici na Novém Městě - sborovna.,5.6.1907,30x,A0C5078CB67611DF820F00166F1163D4,V 11/6 d,1907-06-05,1907-06-05,14.41497,50.07885,regional.address,geocode,"Kříženecký, Jan (1868-1921)",,,[],[]
pozitiv,"Bruslení na Vltavě u Sovových mlýnů (dům čp. 503 vlevo). V pozadí Karlův most, Novotného lávka a Smetanovo nábřeží. Vpravo část Střeleckého ostrova.",únor 1907,82x,A14CE8E6B67611DF820F00166F1163D4,VI 13/10,1907-02-01,1907-02-28,14.40839,50.08359,regional.address,geocode,"Klíma, Alois, Ing. (1873-1955)",,,[],[]
pozitiv,Pohled do Astronomicko-astrologické chodby v 2. poschodí Valdštejnského paláce (dům čp. 17 na Malé Straně).,,19x,A14CE1A6B67611DF820F00166F1163D4,VI 9/8 b,,,14.40535,50.09003,regional.address,geocode,Eckert-ateliér,,,[],[]
pozitiv,Pohled na Loretánské náměstí na Hradčanech s domem čp. 101 (Černínský palác) vlevo a domem čp. 100 (Loreta) vpravo na Hradčanech.,15.8.1907,29x,A14CE8DEB67611DF820F00166F1163D4,VI 13/36,1907-08-15,1907-08-15,14.39151,50.08925,regional.address,geocode,"Klíma, Alois, Ing. (1873-1955)",,,[],[]
pozitiv,"Generál Dwight David Eisenhower na návštěvě v Praze - přijetí Dr. Petrem Zenklem na pražské radnici11.10.1945. V pozadí JUDr. Ladislav Pičman (třetí osoba zleva), druhý náměstek primátora, a Rúžena Pelantová, čtvrtá náměstkyně primátora.",11.10.1945,70x,A0C4FA34B67611DF820F00166F1163D4,I 1641,1945-10-11,1945-10-11,14.41783,50.08711,regional.address,geocode,,,,[],[]
pozitiv,Pohled na vchod do Havlíčkových sadů z křižovatky ulic Koperníkovy a U Havlíčkových sadů na Vinohradech.,1940-1945,44x,A1188C05B67611DF820F00166F1163D4,I 1853,1940-01-01,1945-12-31,14.44274,50.07006,regional.address,geocode,,,,[],[]
pozitiv,Pohled na hlavní průčelí kaple sv. Anny v Dolnokrčské ulici 1 (dům čp. 1908 v Krči).,28.4.1944,72x,259E4279510411E38E526C626D41E503,I 9818,1944-04-28,1944-04-28,14.44237,50.03563,regional.address,geocode,"Alexander, Antonín (1892-působnost do 1948)",,,[],[]
negativ,Pohled do tunelu novoměstské kanalizace pod nádražím v Hybernské ulici - skupina osob s cedulí s textem o proražení tunelu.,20.11.1907,70x,3663EC650D6A11E295A66C626D41E503,XII 1049,1907-11-20,1907-11-20,14.43085,50.08731,regional.address,geocode,Eckert-ateliér,,0.0,[],[]
pozitiv,Pohled ze střechy Clam-Gallasovského paláce na část budovy Magistrátu hlavního města Prahy (dům čp. 2) na Starém Městě.,1969,32x,A1188C1FB67611DF820F00166F1163D4,I 9316,1969-01-01,1969-12-31,14.41783,50.08711,regional.address,geocode,"Vopravil, Josef (1902-1972)",,,[],[]
pozitiv,Pohled na pravý portál kostela sv. Jakuba v ulici Malá Štupartská na Starém Městě.,23.8.1907,17x,A1187F1CB67611DF820F00166F1163D4,VI 29/14,1907-08-23,1907-08-23,14.42455,50.08856,regional.address,geocode,,,,[],[]
pozitiv,Odhlasování nové ústavy Československé republiky ve Vladislavském sále na Pražském hradě 9. května 1948.,9.5.1948,43x,A118742FB67611DF820F00166F1163D4,I 1635,1948-05-09,1948-05-09,14.40198,50.09066,poi,suggest,,,,[],[]
negativ,Pohled do interiéru Kinského vily čp. 98 na Smíchově.,před 1897,50x,0026A75307B511E28BD16C626D41E503,XII 753,1800-01-01,1896-12-31,14.39886,50.07673,regional.address,geocode,"Eckert, Jindřich (1833-1905)",,0.0,[],[]
negativ,Pohled do Královské třídy (dnes Sokolovská) z Jungmannova (dnes Karlínské) náměstí k východu. Uprostřed nárožní dům čp. 145 v Karlíně.,kol.1900,83x,F507FAEE310911E9978874D435EEBE90,IX 323 a,1900-01-01,1900-12-31,14.44836,50.09326,regional.address,geocode,Bellmann-ateliér,,,[],[]
pozitiv,Pohled na bourání (Braunova) domu čp. 730 na nároží Vodičkovy a Jungmannovy ulice na Novém Městě.,23.9.1911,71x,3B23D6ABE28B11E89F1B74D435EEBE90,V 8/29 a,1911-09-23,1911-09-23,14.42265,50.07965,regional.address,geocode,"Kříženecký, Jan (1868-1921)",,,[],[]
pozitiv,Portrét císaře Františka Josefa I. v oválu ve zdobeném rámečku s erbem.,kol.1900,90x,A1188BA8B67611DF820F00166F1163D4,II 1074,1900-01-01,1900-12-31,14.39861,50.08948,regional.address,geocode,"Pietzner, Carl",,0.0,[],[]
negativ,Novostavba Prvního pražského měšťanského pivovaru na Maninách (dům čp. 800 v Holešovicích).,kol.1896,69x,F26C4F21922E11E2BF28525400E46D25,VIII 1479,1896-01-01,1896-12-31,14.45112,50.10524,regional.address,geocode,"Eckert, Jindřich (1833-1905)",,,[],[]
pozitiv,"Pohled do Říční ulice s kostelem sv. Jana Na Prádle. Za ním dům čp. 440 na Malé Straně. V popředí vpravo přízemní dům (""Americká kamna""). V pozadí Petřín.",14.5.1931,49x,A1187A47B67611DF820F00166F1163D4,I 4651,1931-05-14,1931-05-14,14.40608,50.08189,regional.address,geocode,"Alexander, Antonín (1892-působnost do 1948)",,,[],[]
pozitiv,Pohled na průčelí domu čp. 471 v Melantrichově ulici na Starém Městě.,1893,15x,65E613DEE28411E4B65C0024BE7CD9AC,V 5/15 b,1893-01-01,1893-12-31,14.42091,50.08566,regional.address,geocode,,,,[],[]
pohlednice,Pražské povstání - květen 1945. Barikáda v Melantrichově ulice při ústí do Rytířské ulice na Starém Městě.,květen 1945,147x,A14CE6DBB67611DF820F00166F1163D4,I 6517,1945-05-01,1945-05-31,14.42055,50.0856,regional.address,geocode,"Turčín, Vilém (?)",,,[],[]
pozitiv,"Pohled na bourané domy čp. 179, 182, 180, 185, 173 v Cikánské a Masařské ulici v Josefově při asanaci.",21.6.1905,31x,A0C4F45EB67611DF820F00166F1163D4,VI 54/18,1905-06-21,1905-06-21,14.42123,50.09107,regional.address,geocode,Eckert-ateliér,,,[],[]
negativ,Panoramatický pohled na Malešice z Žernovské ulice ve starých Strašnicích. Pátá část pětidílného panoramatu.,kol.1955,60x,A0C50997B67611DF820F00166F1163D4,VII 250,1955-01-01,1955-12-31,14.50217,50.06619,regional.address,geocode,"Chalupníček, Miroslav -, Chalupníčková, Věra (dokument 1941-1948)",,,[],[]
pozitiv,Pohled na dům čp. 279 (hostinec) v Holešovicích na nároží ulic Na Zátorách a Vrbenského.,20.10.1959,89x,A0C5034EB67611DF820F00166F1163D4,I 4299,1959-10-20,1959-10-20,14.44565,50.10934,regional.address,geocode,"Hnilička, Eduard (1887-1967)",,,[],[]
negativ,"Celkový pohled na dům čp. 342 (kavárna Union - ""Braunerův dům"") na nároží ulic Národní a Na Perštýně na Starém Městě.",1913,103x,82560BEC6AFA11E295C66C626D41E503,XII 1359,1913-01-01,1913-12-31,14.4189,50.0826,regional.address,geocode,Eckert-ateliér,,0.0,[],[]
pozitiv,Pohled do interiéru starého královského paláce na pražském hradě - dvorská kancelář.,1904,16x,A0C50708B67611DF820F00166F1163D4,VI 10/9 b,1904-01-01,1904-12-31,14.40176,50.09062,poi,suggest,"Eckert, Jindřich (1833-1905)",,,[],[]
negativ,Pohled do interiéru hradu Karlštejn - křídová kresba sv. Ondřeje pod deskovým obrazem (N 14) na stěně kaple sv. Kříže. Reprodukce fotografie s razítkem Eckert.,30.8.1905,15x,EB6D8AD6DAB011DFBD5D000C766D2371,XII 219,1905-08-30,1905-08-30,14.25487,49.94465,poi,suggest,Eckert-ateliér,,0.0,[],[]
negativ,Projekt úpravy Letné architekta Františka Velicha - architektonické motivy v okolí průkopu.,20.2.1908,39x,31C15422F63711E3AB180024BE7CD9AC,XI 530,1908-02-20,1908-02-20,14.4171,50.093,regional.street,suggest,"Kříženecký, Jan (1868-1921)",,0.0,[],[]
pozitiv,Pohled na vchod do kvadratury Strahovského kláštera - domu čp. 132 na Hradčanech při stavebních úpravách.,léto 1906,29x,0B11A887656F11E8B6E074D435EEBE90,V 14/27,,,14.38967,50.08671,regional.address,geocode,,,,[],[]
pozitiv,Pohled do Smetanovy síně Obecního domu (dům čp. 1090 na Starém Městě) - varhany se záběrem pravé části prospektu. Pendentiv s plastikou Karla Nováka.,kol.1920,35x,A1186EF5B67611DF820F00166F1163D4,II 913,1920-01-01,1920-12-31,14.42825,50.08762,regional.address,geocode,,,,[],[]
negativ,1. světová válka - zásoby zeleniny ve Staroměstské radnici.,1915,27x,722EAD6FA3AC11E3A35E0024BE7CD9AC,XI 3765,1915-01-01,1915-12-31,14.41994,50.08663,regional.address,geocode,"Kříženecký, Jan (1868-1921)",,0.0,[],[]
pozitiv,Pohled na průvod studentů na Národní třídě 17.11.1989.,17.11.1989,108x,A11867E0B67611DF820F00166F1163D4,I 1655,1989-11-17,1989-11-17,14.41794,50.08191,regional.address,geocode,,,,[],[]
negativ,Pohled na pomník M. Jana Husa na Staroměstském náměstí. V pozadí kostel sv. Mikuláše na Starém Městě.,po 1915,32x,5C2EF40D2A2511E9A7CF406186009F3A,XI 5013,1916-01-01,2000-12-31,14.41994,50.08663,regional.address,geocode,"Vojta, Tomáš (1885-1934)",,0.0,[],[]
negativ,Pohled na sanatorium (dům čp. 157 v Podolí) na Podolském nábřeží. Vpravo v pozadí věže kostela sv. Petra a Pavla na Vyšehradě.,kol.1915,65x,A0C4F6EAB67611DF820F00166F1163D4,VIII 646,1915-01-01,1915-12-31,14.41925,50.06214,regional.address,geocode,,,,[],[]
negativ,Reprodukce nákresu a půdorysu kostela P. Marie Vítězné v Karmelitské ulici na Malé Straně.,28.8.1911,19x,05772FB9432A11E489DAD4BED94BB14D,X 8380,1911-08-28,1911-08-28,14.4039,50.08553,regional.address,geocode,Eckert-ateliér,,,[],[]
negativ,"Celkový pohled na náměstí Pod Emauzy s pomníkem ""Praha svým vítězným synům"" a domy čp. 375 (Ministerstvo sociální péče) a čp. 376 (Zemský úřad) na Novém Městě. V pozadí kostel P. Marie Na Slovanech (v Emauzích) a kaple sv. Kosmy a Damiána.",15.4.1936,67x,2C1E35182DE111E89EFF406186009F3A,X 3488,1936-04-15,1936-04-15,14.41536,50.07303,regional.address,geocode,"Alexander, Antonín (1892-působnost do 1948)",,,[],[]
pozitiv,Průhled Ústřední ulicí od křižovatky s Výrobní (vlevo).,1981,28x,A0C501DAB67611DF820F00166F1163D4,I 358,1981-01-01,1981-12-31,14.54617,50.06998,regional.address,geocode,"Rameš, František",,,[],[]
negativ,Pohled do dvora domu čp. 909 s věží (budova hlavní pošty) v Jindřišské ulici na Novém Městě s poštovními vozy.,20.5.1908,34x,0CD9AB7B8B1D11E2BF22525400E46D25,VIII 1406,1908-05-20,1908-05-20,14.42901,50.08293,regional.address,geocode,Eckert-ateliér,,,[],[]
pozitiv,"Postava krále z 2.pol. 13.stol. ""Mladý král"" - nástěnná malba z domu čp. 102 na Mariánském náměstí na Starém Městě. Dnes v Muzeu hl. města Prahy.",1906,26x,A0C508A2B67611DF820F00166F1163D4,VI 76/23,1906-01-01,1906-12-31,14.41783,50.08711,regional.address,geocode,"Kříženecký, Rudolf (dokument 1897-1931)",Autorství R. Kříženeckého není jisté.,,[],[]
negativ,"Panoramatický pohled na Prahu ze Staroměstské věže,v popředí Vltava, Malá Strana, Kampa, Sovovy mlýny (dům čp. 503, 527), v pozadí Petřín.",kol.1960,42x,A0C501E2B67611DF820F00166F1163D4,VII 263,1960-01-01,1960-12-31,14.40839,50.08359,regional.address,geocode,"Chalupníček, Miroslav -, Chalupníčková, Věra (dokument 1941-1948)",,,[],[]
pozitiv,Celkový pohled na budovu Národního muzea čp. 1700 na Novém Městě na Václavském náměstí.,1895-1900,44x,2C56794CD85511E89C7B74D435EEBE90,V 24/6 a,1895-01-01,1900-12-31,14.43056,50.07918,regional.address,geocode,,,,[],[]
pozitiv,Pohled na detail sochařské výzdoby fasády kostela sv. Mikuláše na Staroměstském náměstí při opravě.,říjen 1931,32x,A11878BEB67611DF820F00166F1163D4,I 8387,1931-10-01,1931-10-31,14.41994,50.08663,regional.address,geocode,"Vojta, Tomáš (1885-1934)",,,[],[]
negativ,Pohled na monstranci z pokladu pražské Lorety (dům čp. 100 na Hradčanech).,před 1886,11x,FE6DBB4B904711E080250010DCCFBEC5,XII 349,1800-01-01,1885-12-31,14.39151,50.08925,regional.address,geocode,"Eckert, Jindřich (1833-1905)",,0.0,[],[]
pozitiv,Celkový pohled na průčelí domu čp. 922 do Dlouhé ulice na Starém Městě.,kol.1900,31x,A11878C6B67611DF820F00166F1163D4,VI 2/41 c,1900-01-01,1900-12-31,14.42215,50.08953,regional.address,geocode,"Svoboda, Josef ml. (dokument 1914-1920)",,,[],[]
pozitiv,Detail pomníku Františka Palackého na Palackého náměstí.,kol.1940,59x,A1188AABB67611DF820F00166F1163D4,I 4070,1940-01-01,1940-12-31,14.41536,50.07303,regional.address,geocode,"Gotsche, Rudolf",,,[],[]
negativ,Celkový pohled na zahradní průčelí domu čp. 462 (Vila Amerika - Michnův letohrádek) v ulici Ke Karlovu na Novém Městě.,,16x,A1186D78B67611DF820F00166F1163D4,VIII 435,,,14.42693,50.07369,regional.address,geocode,Eckert-ateliér,,,[],[]
pozitiv,Pohled do Washingtonovy ulice s domem čp. 555 na Vinohradech před postavením budovy FS (dům čp. 52).,kol.1965,44x,A11883C4B67611DF820F00166F1163D4,I 4866,1965-01-01,1965-12-31,14.43178,50.0816,regional.address,geocode,"Krofta, J. S.",,,[],[]
negativ,Pohled do dvora domu čp. 924 na Starém Městě na nároží ulic Dušní a Dlouhé krátce před zbořením.,1.5.1904,37x,A14CE312B67611DF820F00166F1163D4,VIII 74,1904-05-01,1904-05-01,14.42173,50.08904,regional.address,geocode,"Eckert, Jindřich (1833-1905)",,,[],[]
pozitiv,"Pohled na východní stranu Staroměstského náměstí s domy čp. (zleva) 606, 605, 604 a 603. V pozadí kostel P. Marie před Týnem, v popředí mariánský sloup.",1890-1899,82x,A0C50DB0B67611DF820F00166F1163D4,II 170,1890-01-01,1899-12-31,14.42211,50.08746,regional.address,geocode,Bellmann-ateliér,,,[],[]
pozitiv,Pohled do dvora domu čp. 190 v Cikánské ulici v Josefově krátce před zbořením.,17.8.1906,30x,A14CEA27B67611DF820F00166F1163D4,VI 52/2,1906-08-17,1906-08-17,14.42034,50.08826,regional.address,geocode,Eckert-ateliér,,,[],[]
negativ,Pohled do interiéru kostela Nanebevzetí P. Marie a sv. Karla Velikého na Karlově - Svaté schody.,kol.1890,31x,A14CE093B67611DF820F00166F1163D4,VIII 1013,1890-01-01,1890-12-31,14.42851,50.0692,regional.address,geocode,"Eckert, Jindřich (1833-1905)",,,[],[]
pozitiv,Pohled na dvorní partii domu čp. 1047 na Novém Městě (U Rozvařilů) - stavení při levé východní hranici staveniště (zpěvní síň) při pohledu od jihovýchodu k severovýchodu.,24.1.1936,32x,A0C50DCCB67611DF820F00166F1163D4,I 4060,1936-01-24,1936-01-24,14.43394,50.08971,regional.address,geocode,"Alexander, Antonín (1892-působnost do 1948)",,,[],[]
pozitiv,Pohled do dvora za domem čp. 112 na Starém Městě na nároží ulic Platnéřské a Žatecké před zbořením v roce 1908.,3.6.1906,32x,A14CEA3DB67611DF820F00166F1163D4,VI 56/13,1906-06-03,1906-06-03,14.41796,50.08755,regional.address,geocode,Eckert-ateliér,,,[],[]
pozitiv,Celkový pohled na kostel sv. Norberta ve Střešovicích.,,63x,59698DCE8A5111E2A145406186009F3A,I 9712,,,14.37791,50.09157,poi,suggest,Bellmann,,,[],[]
pozitiv,Pohled na dům čp. 44 (U Vosků) v Břevnově ve Veleslavínské ulici (dnes Radimova).,1968,45x,17235DADBAD711E5A77074D435EEBE90,II 1651,1968-01-01,1968-12-31,14.36466,50.08754,regional.address,geocode,,"Dub, Václav (repro)",,[],[]
pozitiv,Pražské povstání - 5.5.1945. Pokácené stromy pro stavbu barikády u Vincentina v Radimově ulici na Břevnově.,5.5.1945,55x,A14CDD80B67611DF820F00166F1163D4,II 1185,1945-05-05,1945-05-05,14.37799,50.08823,regional.address,geocode,"Dub, Václav (dokumenty 1928-1983)",,,[],[]
pozitiv,"Pohled na portál domu čp. 169 (""U tří seker"") v ulici Úvoz na Hradčanech.",1907,23x,A14CE5D8B67611DF820F00166F1163D4,VI 24/28,1907-01-01,1907-12-31,14.39609,50.08848,regional.address,geocode,,,,[],[]
pozitiv,"Pohled na zvon ""Vojtěch"" z roku 1826 přelitý 1903 z levé věže kostela P. Marie před Týnem na Starém Městě.",,17x,4865ABEA19E111E2BEFD000C766D2371,II 1565,,,14.42203,50.08761,regional.address,geocode,,,,[],[]
pozitiv,Pohled ze Štupartské ulice na východní stranu kostela P. Marie před Týnem na Starém Městě.,kol.1890,37x,A11881DFB67611DF820F00166F1163D4,II 534,1890-01-01,1890-12-31,14.42455,50.08856,regional.address,geocode,,,,[],[]
pozitiv,Pohled do Sněmovní ulice s domem čp. 176 (sněmovna) na Malé Straně.,,39x,A11874DCB67611DF820F00166F1163D4,I 9126,,,14.40395,50.08915,regional.address,geocode,,,,[],[]
negativ,Pohled do Vltavské ulice v Holešovicích. Vpravo část provizorního dřevěného mostu přes Štvanici (předchůdce Hlávkova mostu).,9.2.1906,63x,A11888A5B67611DF820F00166F1163D4,VIII 617,1906-02-09,1906-02-09,14.4369,50.09567,regional.street,suggest,Eckert-ateliér,,,[],[]
negativ,Celkový pohled na kostel sv. Matěje v Dejvicích v pozadí na kopci.,kol.1895,102x,FFE9BA149F5911E18C606C626D41E503,XII 852,1895-01-01,1895-12-31,14.37985,50.11309,regional.address,geocode,"Eckert, Jindřich (1833-1905)",,0.0,[],[]
pozitiv,Pohled z jižní části vyšehradských hradeb k východu na Podolí. Součást panoramatu.,10.9.1923,61x,8A5484BF611F11E995BC74D435EEBE90,Voj 115,1923-09-10,1923-09-10,14.4233,50.06216,regional.address,geocode,"Vojta, Tomáš (1885-1934)",,0.0,[],[]
negativ,Zvony z kostela sv. Mikuláše na Starém Městě sejmuté za 1. světové války k roztavení.,1914-1918,23x,526B6CEED39811E8AE88406186009F3A,XI 3842,1914-01-01,1918-12-31,14.4199,50.08778,regional.address,geocode,,,0.0,[],[]
pozitiv,Průhled ulicí V Kolkovně s domem čp. 909 na Starém Městě. V pozadí kostel sv. Ducha.,27.9.1944,37x,A0C512DAB67611DF820F00166F1163D4,I 1513,1944-09-27,1944-09-27,14.42165,50.08984,regional.address,geocode,"Alexander, Antonín (1892-působnost do 1948)",,,[],[]
pozitiv,Panoramatický pohled na pláň v Bohnicích s ústavním hřbitovem. Druhá část dvoudílného panoramatu.,20.9.1923,90x,E95B1C20DC9411E6B80F406186009F3A,A 262,1923-09-20,1923-09-20,14.4036,50.13858,poi,suggest,"Alexander, Antonín (1892-působnost do 1948)",,0.0,[],[]
negativ,"Pohled do interiéru domu čp. 73 (Uměleckoprůmyslové muzeum) v Sanytrové ulici (dnes 17. listopadu) na Starém Městě - ""pařížský interiér"".",28.4.1908,21x,E3DB5E1E121F11E28E4C6C626D41E503,XII 1121,1908-04-28,1908-04-28,14.32317,50.05001,regional.address,geocode,Eckert-ateliér,,0.0,[],[]
pozitiv,Pohled na dům čp. 452 na nároží ulic Na Slupi a Horské na Novém Městě.,,41x,A14CE7B9B67611DF820F00166F1163D4,VI 6/25,,,14.48844,50.07349,regional.address,geocode,,,,[],[]
negativ,Pohled na nároží Staroměstské radnice s arkýřovou kaplí (dům čp. 1 na Starém Městě) na Staroměstském náměstí.,1890-1899,33x,DED251027B0011E996DD406186009F3A,XI 5894,1890-01-01,1899-12-31,14.34054,50.07267,regional.address,suggest,Bellmann-ateliér,,0.0,[],[]
pozitiv,"Pohled na Masarykovo nábřeží s domy čp. (zprava) 2014, 2015, 2016, 2017, 2018 na Novém Městě.",20.4.1945,45x,A1188908B67611DF820F00166F1163D4,I 4422,1945-04-20,1945-04-20,14.41432,50.0765,regional.address,geocode,"Alexander, Antonín (1892-působnost do 1948)",,,[],[]
pozitiv,Pohled na část bývalého kláštera a kostela sv. Michala mezi Michalskou a Melantrichovou ulicí na Starém Městě (dům čp. 971) - nejvyšší patro severní domovní fronty s částí kostela.,13.9.1935,15x,A1188048B67611DF820F00166F1163D4,I 4813,1935-09-13,1935-09-13,14.42063,50.08608,regional.address,geocode,"Alexander, Antonín (1892-působnost do 1948)",,,[],[]
negativ,Pohled na plastickou výzdobu kostela sv. Mikuláše na Starém Městě. Ornamentální náplň pasu nad chorem.,září 1905,21x,3881E0F3739911E3B7C100110989F46F,XI 6,1905-09-01,1905-09-30,14.4199,50.08778,regional.address,geocode,"Kříženecký, Jan (1868-1921)",,0.0,[],[]
negativ,Pohled na prodej vánočních stromků před Staroměstskou radnicí (dům čp. 1 na Starém Městě).,kol.1935,25x,98C1A646056511E1BEBC000C766D2371,X 2259,1935-01-01,1935-12-31,14.41994,50.08663,regional.address,geocode,,,,[],[]
pozitiv,Pohled na hlavní průčelí domu čp. 221 (kadetní škola) na Mariánské baště na Hradčanech.,,98x,F7F408D4580711E7A695406186009F3A,I 12107,,,14.40328,50.09504,regional.address,geocode,Bellmann (?),,,[],[]
negativ,"Mariánská výstava v Klementinu 9.8. - 3.10.1904 - obraz: ""Nizozemská Madona""",1904,22x,B8F9F8E90CA311E2AEA36C626D41E503,XII 1003,1904-01-01,1904-12-31,14.4172,50.08697,regional.address,geocode,"Eckert, Jindřich (1833-1905)",,0.0,[],[]
pozitiv,Pohled na jihovýchodní (obytné) stavení usedlosti Skalka (dům čp. 120) na Smíchově.,5.4.1923,72x,A1187ACAB67611DF820F00166F1163D4,I 8629,1923-04-05,1923-04-05,14.36851,50.07335,regional.address,geocode,"Bernau, Karel, Ing. (1880-1948)",,,[],[]
negativ,Pohled od Mánesova mostu na Palachovo náměstí a Vysokou školu uměleckoprůmyslovou (dům čp. 80 na Starém Městě) na Starém Městě.,kol.1950,55x,A0C503C3B67611DF820F00166F1163D4,VII 2,1950-01-01,1950-12-31,14.41492,50.08868,regional.address,geocode,"Chalupníček, Miroslav -, Chalupníčková, Věra (dokument 1941-1948)",,,[],[]
pozitiv,"Pohled na vstupní portál domu čp. 359 (""U bílého lva"") ve Vlašské ulici na Malé Straně.",13.7.1906,14x,A0C4FFA6B67611DF820F00166F1163D4,VI 22/30 a,1906-07-13,1906-07-13,14.40012,50.08735,regional.address,geocode,,,,[],[]
pozitiv,Celkový pohled na novostavbu školní budovy gymnázia (dům čp. 1510) v ulici Nad Štolou v Holešovicích.,kol. 1960,64x,B8AF0CFBC98511E4A4AD406186009F3A,I 11172,,,14.42203,50.09751,regional.address,geocode,,,,[],[]
pozitiv,"Průhled Vratislavovou ulicí s domy (zleva) čp. 29 (Učitelský dům), 30 (Vyšehradská záložna).",12.7.1931,125x,A0C51711B67611DF820F00166F1163D4,I 817,1931-07-12,1931-07-12,14.41767,50.06673,regional.address,geocode,"Alexander, Antonín (1892-působnost do 1948)",,,[],[]
pozitiv,"Pohled na zahradní portál domu čp. 366 (""Vratislavský palác"") v ulici Tržiště na Malé Straně.",20.8.1906,25x,A1186735B67611DF820F00166F1163D4,VI 23/3,1906-08-20,1906-08-20,14.40199,50.08726,regional.address,geocode,,,,[],[]
negativ,Pohled na kostel Nejsvětější Trojice v Podskalí v Trojické ulici na Novém Městě.,21.11.1907,36x,6CB05E54E26F11E3A5BD406186009F3A,XI 475,1907-11-21,1907-11-21,14.41597,50.07061,regional.address,geocode,"Kříženecký, Jan (1868-1921)",,0.0,[],[]
pozitiv,Pohled z hráze rybníka do Vinohradské ulice (v místech dnešní ulice Ke Strašnické) ve Strašnicích. Vlevo v pozadí dům čp. 42 s věžičkou (obecní úřad). Vpravo statek čp. 18.,20.11.1942,58x,0ED7C279C49011E78A03D4BED94BB14D,A 14859,1942-11-20,1942-11-20,14.48201,50.06921,regional.address,geocode,"Alexander, Antonín (1892-působnost do 1948)",,0.0,[],[]
pozitiv,Pohled na Zelený rybník v Královské oboře (Stromovce) v zimě.,zima 1919,85x,A0C4FD0AB67611DF820F00166F1163D4,I 4416,,,14.42742,50.10533,regional.address,geocode,"Fink, František (1854-1935)",,,[],[]
pozitiv,Pohled na astronomický ciferník ve střední části orloje v jižním průčelí Staroměstské radnice (dům čp. 1 na Starém Městě) na Staroměstském náměstí při restaurování.,26.9.1911,37x,78F1AA7E90E411E8B3B474D435EEBE90,V 69/6 c,1911-09-26,1911-09-26,14.42009,50.087,regional.address,suggest,"Kříženecký, Jan (1868-1921)",,,[],[]
negativ,Mříže renesanční kašny na Malém náměstí na Starém Městě.,,19x,A118728AB67611DF820F00166F1163D4,VIII 167,,,14.41979,50.08642,regional.address,geocode,"Eckert, Jindřich (1833-1905)",,,[],[]
pozitiv,Pohled na vstupní portál domu čp. 250 (Židovská radnice) v Josefově.,21.4.1908,27x,A118878DB67611DF820F00166F1163D4,VI 26/4,1908-04-21,1908-04-21,14.41844,50.08972,regional.address,geocode,,,,[],[]
pozitiv,"Pohled dolní průčelí domu čp. 26 (""U zlatého jelena"") se vstupním portálem a domovním znamením v Tomášské ulici na Malé Straně.",11.7.1906,15x,A1187C26B67611DF820F00166F1163D4,VI 20/8,1906-07-11,1906-07-11,14.40492,50.08882,regional.address,geocode,,,,[],[]
pozitiv,Pohled na portál Císařského mlýna (dům čp. 22) v Bubenči.,10.4.1909,48x,A1188797B67611DF820F00166F1163D4,VI 26/15,1909-04-10,1909-04-10,14.4055,50.10847,regional.address,geocode,,,,[],[]
pozitiv,"Pohled na dům čp. 727 na nároží ulic Dlouhé a Hradební na Starém Městě - ""Pražákova staročeská restaurace"".",,81x,A1188351B67611DF820F00166F1163D4,II 1062,,,14.60156,50.02864,regional.address,geocode,"Lederer, Arnold",,,[],[]
pozitiv,Socha apoštola Tomáše z orloje Staroměstské radnice (dům čp. 1 na Starém Městě) na Staroměstském náměstí po restaurování.,říjen 1930,37x,AA7CF0D4D39411E8A2B874D435EEBE90,Voj 4104,1930-10-01,1930-10-31,14.34054,50.07267,regional.address,suggest,"Vojta, Tomáš (1885-1934)",,0.0,[],[]
negativ,Panoramatický pohled z Evropské (dříve Velvarské) ulice na Vítězné náměstí v Dejvicích. Čtvrtá část pětidílného panoramatu.,kol.1965,60x,A0C4FC4FB67611DF820F00166F1163D4,VII 595,1965-01-01,1965-12-31,14.39656,50.10114,regional.address,geocode,"Chalupníček, Miroslav -, Chalupníčková, Věra (dokument 1941-1948)",,,[],[]
pozitiv,"Pohled do společného dvora domů čp. 149 (zcela vlevo), 148, 271 (uprostřed) a 153 (vpravo) v Josefově v ulici U Staré školy.",16.7.1905,44x,A14CEAEAB67611DF820F00166F1163D4,VI 54/13,1905-07-16,1905-07-16,14.42118,50.09061,regional.address,geocode,Eckert-ateliér,,,[],[]
pozitiv,Kamna v interiéru Schönbornského paláce - domu čp. 365 na Malé Straně.,červen 1931,21x,681794F77C7211E3BFE4406186009F3A,I 9863,1931-06-01,1931-06-30,14.40131,50.08733,regional.address,geocode,"Vojta, Tomáš (1885-1934)",,,[],[]
negativ,Pohled na část průčelí Krenova domu čp. 936 na Staroměstském náměstí krátce před zbořením.,1901,26x,A0C4F820B67611DF820F00166F1163D4,VIII 699,1901-01-01,1901-12-31,14.4202,50.08848,regional.address,geocode,"Eckert, Jindřich (1833-1905)",,,[],[]
pozitiv,"Pohled na Prahu ze Střeleckého ostrova k severu. Druhá část třídílného panoramatu - Karlův most, v pozadí Mariánské hradby a Letná.",1860,83x,A14CEAD2B67611DF820F00166F1163D4,VI 62/13,1860-01-01,1860-12-31,14.41016,50.08058,regional.address,geocode,"Rupp, Wilhelm (1821-1893)",,,[],[]
negativ,Pohled do interiéru Národního divadla - strop budoiru královské lóže (dům čp. 223 na Novém Městě).,kol.1895,32x,D34039F69EA011E1AB206C626D41E503,XII 822,1895-01-01,1895-12-31,14.41723,50.08595,regional.address,suggest,"Eckert, Jindřich (1833-1905)",,0.0,[],[]
negativ,Pohled na most přes Labe v Poděbradech.,,11x,489ABEE196DF11E2BF2B525400E46D25,VIII 1586,,,14.44997,50.07858,regional.address,geocode,Eckert-ateliér,,,[],[]
negativ,Pohled na orloj Staroměstské radnice (dům čp. 1 na Starém Městě) na Staroměstském náměstí.,,23x,B4AECEE590B511E8B3B474D435EEBE90,IX 393 a,,,14.42009,50.087,regional.address,suggest,,,,[],[]
pozitiv,"Pražské povstání - květen 1945. Pražané pomáhají při záchraně cenných památek městského archivu, který byl umístěn ve Staroměstské radnici - provizorní stěhování do kostela sv. Mikuláše.",9.5.1945,197x,A0C51056B67611DF820F00166F1163D4,I 6511,1945-05-09,1945-05-09,14.42009,50.087,regional.address,suggest,,,,[],[]
pozitiv,Pohled na vstupní portál domu čp. 165 (U zlaté labutě) ve Sněmovní ulici na Malé Straně.,2.8.1907,20x,A0C51916B67611DF820F00166F1163D4,VI 20/26,1907-08-02,1907-08-02,14.40404,50.09035,regional.address,geocode,,,,[],[]
negativ,Pohled na votivní desku císaře Františka Josefa I. v kostele sv. Jana Nepomuckého na Hradčanech.,1.3.1909,37x,9782D3A687DE11E2BF21525400E46D25,VIII 1350,1909-03-01,1909-03-01,14.3941,50.09038,regional.street,suggest,Eckert-ateliér,,,[],[]
pozitiv,Pohled na dům čp. 839 na Václavském náměstí na Novém Městě (hotel U Zlaté husy).,květen 1909,66x,0F37EAB4E29711E89F1B74D435EEBE90,V 9/10,1909-05-01,1909-05-31,14.42488,50.08361,regional.address,geocode,,,,[],[]
negativ,Pohled na odkryté zbytky zdiva bývalé kaple sv. Ludmily při kostelu P. Marie před Týnem na Starém Městě - sloupy s ozdobnými hlavicemi.,1890,29x,BB054E4D9E9111E1AB206C626D41E503,XII 797,1890-01-01,1890-12-31,14.42203,50.08761,regional.address,geocode,"Eckert, Jindřich (1833-1905)",,0.0,[],[]
negativ,Pohled na Kohlovu kašnu na druhém (čestném) nádvoří Pražského hradu.,kol.1880,24x,32BE0DECEB2311DFBD74000C766D2371,XII 14,1880-01-01,1880-12-31,14.39836,50.09051,poi,suggest,"Eckert, Jindřich (1833-1905)",,0.0,[],[]
negativ,Celkový pohled na průčelí paláce Golz-Kinských na Staroměstském náměstí (dům čp. 606 na Starém Městě).,1926,62x,A14CDCC4B67611DF820F00166F1163D4,XI 6303,1926-01-01,1926-12-31,14.42698,50.0866,regional.address,geocode,Eckert-ateliér,,0.0,[],[]
pozitiv,Pohled na portál domu čp. 673 (U dvou černých jelínků) v Jakubské ulici na Starém Městě.,1906,15x,A118849CB67611DF820F00166F1163D4,VI 17/7,1906-01-01,1906-12-31,14.42583,50.08822,regional.address,geocode,,,,[],[]
pozitiv,Pohled na vstupní portál domu čp. 269 (býv. probošství křižovníků - strážců Božího hrobu) v ulici Na Zderaze na Novém Městě.,20.5.1906,30x,A1188701B67611DF820F00166F1163D4,VI 18/13,1906-05-20,1906-05-20,14.41686,50.07652,regional.address,geocode,,,,[],[]
pozitiv,Celkový pohled na kostel sv. Petra a Pavla Na Zderaze na Novém Městě při bourání.,1.7.1904,51x,A14CE7B7B67611DF820F00166F1163D4,VI 6/15,1904-07-01,1904-07-01,14.41668,50.07566,regional.address,geocode,"Eckert, Jindřich (1833-1905)",,,[],[]
pozitiv,Rudá armáda v Praze v květnu 1945 - vojáci na tanku před Staroměstskou radnicí. Na obloze letadlo.,9.5.1945,210x,A0C50220B67611DF820F00166F1163D4,I 5820,1945-05-09,1945-05-09,14.42009,50.087,regional.address,suggest,"Pacovský, Jaroslav",,,[],[]
pozitiv,"Pohled do Karmelitské ulice se zbytkem původní Újezdské brány v ""Malé"" Karmelitské ulici - od Malostranského náměstí. Uprostřed domy čp. 516 a 267 (část vpravo) po odbourání protějšího domu čp. 268 na Malé Straně.",7.9.1904,75x,A14CE7CDB67611DF820F00166F1163D4,VI 8/9,1904-09-07,1904-09-07,14.40365,50.08764,regional.address,geocode,"Eckert, Jindřich (1833-1905)",,,[],[]
pozitiv,Pohled na dům čp. 490 (palác Metychů z Čečova - Hrzánský) na Velkopřevorském náměstí na Malé Straně s renesančním portálem.,1925,29x,0E0C9E2305B711E389696C626D41E503,I 9758,1925-01-01,1925-12-31,14.40739,50.08615,regional.address,geocode,"Vojta, Tomáš (1885-1934)",,,[],[]
pozitiv,"Pohled z Barrandovské skály na vltavské údolí. V popředí kamenitá stráň, za řekou Braník s kostelem sv. Prokopa. Součást panoramatu.",15.4.1926,96x,A0C5023CB67611DF820F00166F1163D4,I 8816,1926-04-15,1926-04-15,14.41192,50.03591,regional.street,suggest,"Alexander, Antonín (1892-působnost do 1948)",,,[],[]
pozitiv,Pohled do interiéru radnice v Karlíně (dům čp. 316).,,50x,A14CE9B0B67611DF820F00166F1163D4,VI 44/3 b,,,14.44877,50.09077,regional.address,geocode,"Gabriel, Josef ([1853]-1921)",,,[],[]
pozitiv,Pohled na model kostela sv. Jindřicha na Novém Městě.,1914,12x,A14CE9CCB67611DF820F00166F1163D4,VI 51/11 a,1914-01-01,1914-12-31,14.42837,50.08378,regional.address,geocode,"Eckert, Jindřich (1833-1905)",,,[],[]
negativ,Nástěnná malba Zmrtvýchvstání v domě čp. 131 na Klárově (Klárův ústav slepců) na Malé Straně.,1885,28x,AE0A7B230BB411E1BEC4000C766D2371,XII 414,1885-01-01,1885-12-31,14.40367,50.08755,poi,suggest,"Eckert, Jindřich (1833-1905)",,0.0,[],[]
negativ,Pohled do interiéru školy čp. 1286 na Novém Městě ve Štěpánské ulici (obecná škola u sv. Štěpána) - tělocvična.,kol.1890,35x,5DED2C1EA41C11E1BEEB000C766D2371,VIII 1122,1890-01-01,1890-12-31,14.42478,50.07677,regional.address,geocode,"Eckert, Jindřich (1833-1905)",,,[],[]
pohlednice,"Průhled Národní třídou s domy čp. 223 na Novém Městě, 1012 na Starém Městě, 1014 na Starém Městě. V pozadí řetězový most císaře Františka I.",kol.1890,197x,A0C50567B67611DF820F00166F1163D4,I 281,1890-01-01,1890-12-31,14.41321,50.08173,regional.address,geocode,,,,[],[]
pozitiv,Pohled na vánoční prodej ryb v Masné ulici - před domem čp. 686 na nároží Rybné a Masné ulice na Starém Městě (vpravo).,kol.1910,55x,A1188B73B67611DF820F00166F1163D4,II 954,1910-01-01,1910-12-31,14.42578,50.08961,regional.address,geocode,,,,[],[]
pozitiv,"Pohled na usedlost Klikovku (dům čp. 118, 119) na Smíchově.",15.1.1923,141x,A118891EB67611DF820F00166F1163D4,I 855,1923-01-15,1923-01-15,14.37226,50.07276,regional.address,geocode,"Bernau, Karel, Ing. (1880-1948)",,,[],[]
pozitiv,Pohled na vorovou propust nového Helmovského mlýnu během velké vody. V pozadí provizorní dřevěný most (Hlávkův).,8.4.1908,49x,D08CB6425E0D11E6A550000C76270B94,I 11779,1908-04-08,1908-04-08,14.4369,50.09567,regional.street,suggest,,,,[],[]
pozitiv,Průvod během VII. všesokolského sletu u Národního muzea na Václavském náměstí na Novém Městě.,1920,57x,A0C51A74B67611DF820F00166F1163D4,I 9242,1920-01-01,1920-12-31,14.42863,50.08014,regional.address,geocode,,,,[],[]
pozitiv,Celkový pohled na Kolovratský palác (dům čp. 154) ve Valdštejnské ulici na Malé Straně.,kol.1920,19x,DE37A4578E0611E1A9956C626D41E503,II 1561,1920-01-01,1920-12-31,14.40643,50.09055,regional.address,geocode,,,,[],[]
negativ,Pohled do interiéru budovy Zemské banky (dům čp. 858) na Novém Městě - kancelář centrálního ředitele.,16.2.1903,23x,233A1BB885B411E2BF1F525400E46D25,VIII 1328,1903-02-16,1903-02-16,14.42743,50.08554,regional.address,geocode,"Eckert, Jindřich (1833-1905)",,,[],[]
pozitiv,Pohled na usedlost Cibulku v Košířích (dům čp. 118).,kol.1955,50x,A0C5135BB67611DF820F00166F1163D4,I 4630,1955-01-01,1955-12-31,14.35655,50.06696,regional.address,geocode,"Hnilička, Eduard (1887-1967)",,,[],[]
pozitiv,"Pohled na Troju (Podhoří), Dejvice a Sedlec. Součást devítidílného kruhového panoramatu.",24.7.1926,26x,de6884afed4448bd9fd6c90621da6e6a,A 2566,1926-07-24,1926-07-24,14.41135,50.11784,regional.address,geocode,"Alexander, Antonín (1892-působnost do 1948)",,0.0,[],[]
negativ,Pohled na kolejiště s vlaky a nádraží v Bubnech.,kol.1885,173x,9CE5D6F19AB911E191A46C626D41E503,XII 731,1885-01-01,1885-12-31,14.43856,50.10231,regional.address,geocode,"Eckert, Jindřich (1833-1905)",,0.0,[],[]
negativ,Pohled na dům čp. 383 na Novém Městě v Podskalské ulici krátce před zbořením.,28.2.1911,54x,A11877EDB67611DF820F00166F1163D4,VIII 53,1911-02-28,1911-02-28,14.41445,50.07129,regional.address,geocode,Eckert-ateliér,,,[],[]
pozitiv,Pohled přes Vltavu na dnešní Dvořákovo nábřeží. V pozadí panorama Starého Města.,28.8.1909,52x,A0C507F3B67611DF820F00166F1163D4,II 15,1909-08-28,1909-08-28,14.41547,50.09073,regional.address,geocode,"Kříženecký, Jan (1868-1921)",,,[],[]
pozitiv,Průhled Národní třídou při oslavě 50. let zavedení koňky v Praze (1. jízda 23.9.1875). V pozadí dům čp. 761 na Novém Městě.,28.9.1925,143x,A0C4F9C3B67611DF820F00166F1163D4,I 1505,1925-09-28,1925-09-28,14.42233,50.08309,regional.address,geocode,,,,[],[]
negativ,"Pohled na západní stranu Staroměstského náměstí se Staroměstskou radnicí (dům čp. 1 na Starém Městě), s domem čp. 936 (Krenův dům) a s domy severní strany náměstí. Vpravo mariánský sloup.",,57x,A0C50EDEB67611DF820F00166F1163D4,X 2661,,,14.42009,50.087,regional.address,suggest,"Fridrich, František (1829-1892)",Reprodukce původní fotografie.,,[],[]
pozitiv,Pohled na usedlost Šutku (dům čp. 112 v Troji).,5.7.1928,49x,ea0ca219a7294bb296d55dabd2532958,A 4404,1928-07-05,1928-07-05,14.47916,50.10626,regional.address,geocode,"Alexander, Antonín (1892-působnost do 1948)",,0.0,[],[]
pozitiv,Pohled na křižovatku ulic Bratrské a Na hrázi v Libni.,1974,117x,A1188418B67611DF820F00166F1163D4,V 147/1,1974-01-01,1974-12-31,14.47321,50.10512,regional.address,geocode,"Michálek, Ladislav",,0.0,[],[]
pozitiv,"Panoramatický pohled na Prahu z Petřína (čtyři díly). Zleva Pražský hrad, Malá Strana a Smíchov. Za řekou Staré Město, Nové Město a vpravo Vyšehrad.",1898,92x,A11868CBB67611DF820F00166F1163D4,VI 77/1,1898-01-01,1898-12-31,14.39508,50.08354,poi,suggest,"Vilím, J.",,,[],[]
negativ,Pohled do románských sklepů odkrytých při bourání domu čp. 128 v Linhartské ulici na Starém Městě.,15.5.1909,10x,997a4f4724284ceeb28f423501b6305d,XI 1081,1909-05-15,1909-05-15,14.37366,50.09637,regional.address,geocode,"Kříženecký, Jan (1868-1921)",,0.0,[],[]
pozitiv,"Panoramatický pohled na Hlubočepy a okolí. V pozadí železniční viadukt (Pražský Semmering), Prokopské údolí.",22.9.1925,85x,8FA2DFA321E211E2A1E8406186009F3A,I 9638,1925-09-22,1925-09-22,14.40355,50.04138,regional.address,geocode,"Alexander, Antonín (1892-působnost do 1948)",,,[],[]
pozitiv,Pohled do interieru Francouzské restaurace Obecního domu (dům čp. 1090 na Starém Městě) - výzdoba stěn.,kol.1920,31x,FDCF856F3E9E11E1B434000BCDD04BFA,II 1531,1920-01-01,1920-12-31,14.42825,50.08762,regional.address,geocode,,,,[],[]
pozitiv,Pohled do nádvoří Schönbornského paláce - domu čp. 365 na Malé Straně.,červen 1931,26x,A0C4F629B67611DF820F00166F1163D4,I 8521,1931-06-01,1931-06-30,14.40131,50.08733,regional.address,geocode,"Vojta, Tomáš (1885-1934)",Autorství T. Vojty není jisté.,,[],[]
negativ,Pohled na vyobrazení měsíců Josefa Mánesa (znamení Rak) na orloji Staroměstské radnice (dům čp. 1 na Starém Městě) na Staroměstském náměstí.,,23x,C99C6E6990B811E8B3B474D435EEBE90,IX 395 e,,,14.42009,50.087,regional.address,suggest,,,,[],[]
pozitiv,Pohled na kostel sv. Mikuláše na Staroměstském náměstí - pravá část jižního průčelí.,říjen 1905,25x,A0C518AFB67611DF820F00166F1163D4,II 1116,1905-10-01,1905-10-31,14.4199,50.08778,regional.address,geocode,"Kříženecký, Jan (1868-1921)",,,[],[]
pozitiv,"Erb rodu Bassevi von Threuenberg v domě čp. 73 (""Bassewiho"") v Praze v Maiselově ulici v Josefově.",kol.1895,34x,FDCF85753E9E11E1B434000BCDD04BFA,V 16/1 b,1895-01-01,1895-12-31,14.41826,50.08957,regional.address,geocode,,,,[],[]
pozitiv,"Panoramatický pohled na staré Dejvice z novostavby na rohu Podbabské silnice (dnes Jugoslávských partyzánů) a Bučkovy (dnes Rooseveltova) - na stráně Strakovky, Hanspaulky a kostela v Šárce (od jihu směrem k Růžku přes západ k severu). Čtvrtá část čtyřdílného panoramatu.",17.5.1925,96x,A14CDF77B67611DF820F00166F1163D4,I 4826,1925-05-17,1925-05-17,14.39479,50.10283,regional.address,geocode,"Alexander, Antonín (1892-působnost do 1948)",,,[],[]
negativ,Pohled do chrámu sv. Víta na Pražském hradě - fresky na stěně mezi starou a novou částí katedrály před probouráním.,1924,32x,A667AD2B3D9611E499B8406186009F3A,XI 6272,1924-01-01,1924-12-31,14.39995,50.09041,regional.address,geocode,Eckert-ateliér,,0.0,[],[]
pozitiv,Pohled na mlátičku při klášteře v Břevnově.,,38x,6F7913EDBADD11E5A77074D435EEBE90,II 1660,,,14.35747,50.08511,regional.address,geocode,"Dub, Václav (dokumenty 1928-1983)",,,[],[]
negativ,"Panoramatický pohled na Nové Město. Vlevo Studničkova ulice (dříve Preslova) s domy čp. 2028 (Hygienický ústav - uprostřed), čp. 2049 a čp. 2038 (Přírodovědecký ústav - vlevo) na Novém Městě.",2.4.1910,28x,2697CA454BE911EABE1574D435EEBE90,XI 3550,1910-04-02,1910-04-02,14.42451,50.06987,regional.address,geocode,"Kříženecký, Jan (1868-1921)",,0.0,[],[]
pozitiv,Pohled na lóži v interiéru Smetanovy síně v Obecním domě (dům čp. 1090 na Starém Městě).,kol.1920,14x,C439D7939FD911E581F5001E33288342,V 7/9 h,1920-01-01,1920-12-31,14.42825,50.08762,regional.address,geocode,Štenc,,,[],[]
pozitiv,Pohled na levou dolní část ciferníku orloje Staroměstské radnice při restaurování (dům čp. 1 na Starém Městě) na Staroměstském náměstí.,26.9.1911,33x,2BB3D3F590E711E8B3B474D435EEBE90,V 69/9,1911-09-26,1911-09-26,14.42009,50.087,regional.address,suggest,,,,[],[]
pozitiv,Pohled na portál kostela sv. Vojtěcha na Novém Městě.,15.5.1907,40x,A11879ECB67611DF820F00166F1163D4,VI 30/37,1907-05-15,1907-05-15,14.41516,50.07801,regional.address,geocode,,,,[],[]
pozitiv,Pohled na stavbu přístavu v Libni - dvouřetězový parní drapák firmy Lanna.,1894-1895,72x,A1187BBFB67611DF820F00166F1163D4,V 18/13 bb,1894-01-01,1895-12-31,14.41735,50.06113,regional.address,geocode,,,,[],[]
pozitiv,"Panoramatický pohled z novoměstské vodárenské věže na Švehlovo nábřeží (dnes Ludvíka Svobody). Vpravo domy čp. 1238, 1373 a 1235 na Novém Městě. V pozadí Hlávkův most - železná část, ostrov Štvanice s domem čp. 1340 a Holešovice s kostelem sv. Antonína Paduánského a budovou Úrazové pojišťovny (dům čp. 1000). Třetí díl panoramatu.",31.7.1937,108x,F89EA139FA3911E5B79C406186009F3A,A 11331,1937-07-31,1937-07-31,14.43399,50.09709,regional.address,geocode,"Alexander, Antonín (1892-působnost do 1948)",,0.0,[],[]
pozitiv,Pohled na jihozápadní stranu chrámu sv. Víta z třetího nádvoří Pražského hradu. Na nádvoří kašna se sochou sv. Jiří.,,36x,A11879D0B67611DF820F00166F1163D4,II 992,,,14.39995,50.09041,regional.address,geocode,,,,[],[]
pozitiv,Pohled do Křižíkovy (Palackého) ulice od křižovatky s ulicí Sadovou (dnes Ke Štvanici) k východu. Uprostřed nárožní dům čp. 332 v Karlíně.,kol.1900,117x,A11866C3B67611DF820F00166F1163D4,I 1969,1900-01-01,1900-12-31,14.43965,50.09011,regional.address,geocode,Bellmann-ateliér,,,[],[]
pozitiv,"Pohled přes Vltavu na Nové mlýny na Novém Městě. Uprostřed Veselého mlýn (dům čp. 1242), vpravo městská vodárna (dům čp. 1240) s vodárenskou věží a Eliščiny (Kandertovy) lázně (dům čp. 1248 na Novém Městě). Vpravo část mostu císaře Františka Josefa I. (Štefánikův).",2.8.1910,60x,A1186DAEB67611DF820F00166F1163D4,VI 48/31,1910-08-02,1910-08-02,14.42835,50.0923,poi,suggest,Eckert-ateliér,,,[],[]
pozitiv,"Pohled na Staroměstské náměstí od Malého náměstí k východu. Zleva jižní část Staroměstské radnice (dům čp. 1 na Starém Městě) s věží, orlojem a portálem, domy čp. 604, 603 na Starém Městě, nad nimi kostel P. Marie před Týnem. Vpravo domy jižní části náměstí.",,124x,A14CDA3FB67611DF820F00166F1163D4,I 8676,,,14.42009,50.087,regional.address,suggest,"Eckert, Jindřich (1833-1905)",Reprodukce původní fotografie.,,[],[]
pozitiv,Průhled ulicí Do kopečka od ulice V Listnáčích v Lipanech.,1983,29x,A0C516A7B67611DF820F00166F1163D4,I 212,1983-01-01,1983-12-31,14.61518,50.00112,regional.address,geocode,"Rameš, František",,,[],[]
pozitiv,Pohled na dům čp. 150 v ulici U Staré školy v Josefově.,16.7.1905,37x,A14CEAE9B67611DF820F00166F1163D4,VI 54/12,1905-07-16,1905-07-16,14.42118,50.09061,regional.address,geocode,Eckert-ateliér,,,[],[]
negativ,Pohled do interiéru domu čp. 527 na Novém Městě (Mariánský ústav).,kol.1890,40x,A11879E5B67611DF820F00166F1163D4,VIII 674,1890-01-01,1890-12-31,14.42652,50.07567,regional.address,geocode,"Eckert, Jindřich (1833-1905)",,,[],[]
pozitiv,Pohled do Koželužské ulice v Libni při povodni v září 1890.,září 1890,104x,7B0EE6E78B5711E8AFC474D435EEBE90,V 18/6,1890-09-01,1890-09-30,14.47147,50.10551,regional.address,geocode,,,,[],[]
negativ,Pohled na zámek Dolní Břežany.,kol.1890,13x,186E4475904311E080250010DCCFBEC5,XII 336,1890-01-01,1890-12-31,14.4585,49.96321,regional.municipality,suggest,"Eckert, Jindřich (1833-1905)",,0.0,[],[]
pozitiv,Celkový pohled na kostel sv. Václava od východu z Pecháčkovy (Dvořákovy) ulice. V pozadí smíchovská radnice čp. 236 ve Štefánikově ulici na Smíchově.,25.4.1927,52x,A11879DFB67611DF820F00166F1163D4,I 8760,1927-04-25,1927-04-25,14.40874,50.07316,regional.address,geocode,"Alexander, Antonín (1892-působnost do 1948)",,,[],[]
pozitiv,Pohled z Barrandovské skály nad pamětní deskou Joachima Barranda na vltavské údolí. Za řekou Braník s kostelem sv. Prokopa.,4.4.1926,59x,A11870A5B67611DF820F00166F1163D4,I 8841,1926-04-04,1926-04-04,14.32996,50.08645,regional.address,geocode,"Alexander, Antonín (1892-působnost do 1948)",,,[],[]
pozitiv,"Pohled na vstupní portál domu čp. 365 (""palác Schönbornský"") v ulici Tržiště na Malé Straně.",8.8.1907,19x,A1187BB0B67611DF820F00166F1163D4,VI 22/34,1907-08-08,1907-08-08,14.40131,50.08733,regional.address,geocode,,,,[],[]
negativ,Pohled do Sanytrové ulice (dnes 17. listopadu) s domem čp. 73 (Uměleckoprůmyslové muzeum) na Starém Městě.,30.4.1908,35x,A0C500C1B67611DF820F00166F1163D4,VIII 253,1908-04-30,1908-04-30,14.41631,50.08993,poi,suggest,Eckert-ateliér,,,[],[]
pozitiv,"Sousoší ""Vyšehrad"" od Ladislava Šalouna v interiéru Obecního domu (dům čp. 1090 na Starém Městě).",kol.1920,30x,C439D7869FD911E581F5001E33288342,V 7/8 a,1920-01-01,1920-12-31,14.42737,50.08767,regional.address,geocode,Štenc,,,[],[]
pozitiv,Pražské povstání - květen 1945. Obrněné vozy na náměstí Na Hanspaulce v Dejvicích.,květen 1945,98x,A0C507FEB67611DF820F00166F1163D4,I 5476,1945-05-01,1945-05-31,14.37842,50.10616,regional.address,geocode,,,,[],[]
pozitiv,"Pohled do dvora domu čp. 16 (Andělská kolej) na Starém Městě před zbořením v roce 1908 - směrem k Mikulášskému náměstí. Dnes nároží ulic Platnéřské, Kaprovy a náměstí Franze Kafky.",27.5.1906,97x,A11877E2B67611DF820F00166F1163D4,VI 1/34,1906-05-27,1906-05-27,14.41873,50.08783,regional.address,geocode,Eckert-ateliér,,,[],[]
pozitiv,"Pohled na vstupní portál domu čp. 67 (""U zlatého beránka"") s domovním znamením v Míšeňské ulici na Malé Straně.",26.6.1906,17x,A11877DAB67611DF820F00166F1163D4,VI 20/14,1906-06-26,1906-06-26,14.40769,50.08769,regional.address,geocode,,,,[],[]
pozitiv,Pohled na domek rozdělovny družstva Včely č. 149 ve Vysočanech.,,9x,FDCF85603E9E11E1B434000BCDD04BFA,VI 79/6,,,14.50266,50.11165,regional.address,geocode,"Dítě, Otto",,,[],[]
negativ,Pohled do zahrady Valdštejnského paláce s kašnou a salou terrenou (dům čp. 17 na Malé Straně).,,19x,A14CDF62B67611DF820F00166F1163D4,VIII 1002,,,14.40535,50.09003,regional.address,geocode,Eckert-ateliér,,,[],[]
negativ,"Pohled na usedlost Cibulka (dům čp. 118) v Košířích, záběr od vstupní brány do dvora.",1974,50x,A0C511E0B67611DF820F00166F1163D4,VII 561,1974-01-01,1974-12-31,14.35655,50.06696,regional.address,geocode,"Chalupníček, Miroslav -, Chalupníčková, Věra (dokument 1941-1948)",,,[],[]
pozitiv,Odměňování školních dětí za sběr v Brožíkově síni na Staroměstské radnici.,16.6.1954,60x,A0C50C19B67611DF820F00166F1163D4,I 1669,1954-06-16,1954-06-16,14.42009,50.087,regional.address,suggest,,,,[],[]
pozitiv,Pohled na Uhelný trh s domem čp. 425 uprostřed na Starém Městě.,1905-1910,44x,FDCF857C3E9E11E1B434000BCDD04BFA,I 373,1905-01-01,1910-12-31,14.41993,50.08421,regional.address,geocode,,,,[],[]
negativ,"Reprodukce leptu Antonína Pucherny Císařský mlýn v Bubenči, 1820.",kol.1910,85x,493812C4DABB11DFBD5D000C766D2371,XII 304,1910-01-01,1910-12-31,14.41849,50.10171,regional.address,geocode,Eckert-ateliér,,0.0,[],[]
negativ,Reprodukce obrazu Simona de Vos v Nostickém paláci (dům čp. 471) na Maltézském náměstí (Nostická sbírka - nyní v Národní galerii).,22.3.1909,50x,9A3E5C1112EA11E2A6B56C626D41E503,XII 1178,1909-03-22,1909-03-22,14.40583,50.08546,regional.address,geocode,Eckert-ateliér,,0.0,[],[]
pozitiv,"Pohled do Zborovské ulice (Svornosti) s Albrechtskými kasárnami (Štefánikova - původně dům čp. 416 na Malé Straně, dnes dům čp. 234 na Smíchově).",,102x,A1187289B67611DF820F00166F1163D4,I 8737,,,14.40506,50.0789,regional.address,geocode,,,,[],[]
pozitiv,Celkový pohled na východní průčelí Staroměstské radnice s věží a arkýřem (dům čp. 1 na Starém Městě). V popředí pod balkonem vojenská strážnice. Vlevo jižní průčelí radnice.,kol.1870,46x,3BB4BE110D7F11E8874D74D435EEBE90,V 71/13,1870-01-01,1870-12-31,14.42009,50.087,regional.address,suggest,"Fridrich, František (1829-1892)",,,[],[]
pozitiv,Celkový pohled na Masarykovy domovy v Krči (dům čp. 800) z výšky.,8.12.1928,19x,920e3fef497f4be1b1a649862cf66263,A 4812,1928-12-08,1928-12-08,14.457,50.03007,regional.address,geocode,"Alexander, Antonín (1892-působnost do 1948)",,0.0,[],[]
negativ,Pohled do interiéru Národního divadla - předpokoj královské lóže (dům čp. 223 na Novém Městě).,kol.1895,35x,CA0CD21B0A2111E1BEC1000C766D2371,XII 365,1895-01-01,1895-12-31,14.41723,50.08595,regional.address,suggest,"Eckert, Jindřich (1833-1905)",,0.0,[],[]
pozitiv,Pohled na kostel sv. Jindřicha na Novém Městě v Jindřišské ulici v zimě.,31.1.1904,31x,A1188B66B67611DF820F00166F1163D4,VI 30/17 a,1904-01-31,1904-01-31,14.42837,50.08378,regional.address,geocode,"Eckert, Jindřich (1833-1905)",,,[],[]
pozitiv,Celkový pohled na Hybernský palác (dům čp. 1037 na Novém Městě) na náměstí Republiky.,kol.1930,46x,96FCD8D2174911EABE1274D435EEBE90,I 12687,1930-01-01,1930-12-31,14.42903,50.08791,regional.address,geocode,,,,[],[]
pozitiv,Pohled na detail spodní části průčelí domu čp. 228 v Husově ulici na Starém Městě - odkrytý pozdně gotický portál a nad ním nově osazená deska s domovním znamením s plastikou tygra z umělého kamene.,6.12.1935,30x,B8C2EFB904D811E3A4F66C626D41E503,I 9741,1935-12-06,1935-12-06,14.41804,50.08583,regional.address,geocode,"Alexander, Antonín (1892-působnost do 1948)",,,[],[]
pozitiv,"Pohled na část Negrelliho viaduktu v Karlíně. V popředí skupina osob ve vojenských uniformách, automobil a koňka, v pozadí nákladní vlak.",kol.1910,94x,A14CE9BFB67611DF820F00166F1163D4,VI 37/1 b,1910-01-01,1910-12-31,14.45354,50.09363,regional.address,geocode,"Faix, Josef",,,[],[]
pohlednice,Pohled na osvětlené Národní muzeum (dům čp. 1700 na Novém Městě) při příležitosti 10. výročí samostatnosti Československé republiky.,28.10.1928,57x,F8329A840DAA11E892C0406186009F3A,I 12030,1928-10-28,1928-10-28,14.43056,50.07918,regional.address,geocode,,,,[],[]
pozitiv,Pohled na nároží Staroměstské radnice s arkýřem a s orlojem na Staroměstském náměstí (dům čp. 1 na Starém Městě).,kol.1885,33x,A14CE9C5B67611DF820F00166F1163D4,VI 42/6,1885-01-01,1885-12-31,14.42009,50.087,regional.address,suggest,,,,[],[]
pozitiv,Pohled na průčelí starší části usedlosti Mlynářka (dům čp. 155) v Holečkově ulici na Smíchově. Vlevo v pozadí nárožní věž novější části usedlosti.,27.4.1927,90x,A1187AC9B67611DF820F00166F1163D4,I 8249,1927-04-27,1927-04-27,14.39606,50.07488,regional.address,geocode,"Alexander, Antonín (1892-působnost do 1948)",,,[],[]
pozitiv,Pohled do alkovny v 1. patře domu čp. 480 na Starém Městě. Pod stropem jsou na dřevěné rámy na zavěšování kožešin (souvisí s rukavičkářským závodem J. Z. Schütze).,1926,84x,884bc129ac0d400480f1148d1e6e4cc0,Voj 1320,1926-01-01,1926-12-31,14.42095,50.0867,regional.address,geocode,"Vojta, Tomáš (1885-1934)",,0.0,[],[]
pozitiv,Pohled do interiéru kostela P. Marie Vítězné na Malé Straně - postranní loď s oltářem Pražského Jezulátka.,před 1897,26x,A0C51A7BB67611DF820F00166F1163D4,VI 31/10 e,1800-01-01,1896-12-31,14.4039,50.08553,regional.address,geocode,"Eckert, Jindřich (1833-1905)",,,[],[]
negativ,"Průhled Linhartskou ulicí s domy čp. 128, čp. 133, čp. 132 (zprava) na Starém Městě při bourání.",25.6.1908,35x,bcc5ba480c72408abf369c11e9b06919,XI 786,1908-06-25,1908-06-25,14.37366,50.09637,regional.address,geocode,"Kříženecký, Jan (1868-1921)",,0.0,[],[]
pozitiv,Pohled na Masarykovo nábřeží s věží Šítkovské vodárny a domem čp. 250 na Novém Městě (Mánes) z protějšího břehu.,28.9.1930,52x,A0C51354B67611DF820F00166F1163D4,I 4420,1930-09-28,1930-09-28,14.41411,50.0775,regional.address,geocode,"Alexander, Antonín (1892-působnost do 1948)",,,[],[]
negativ,Pohled na část klenby gotického kostela v Sázavském klášteře.,květen 1904,16x,0D0F10650BDA11E2AEA36C626D41E503,XII 960,1904-05-01,1904-05-31,14.45055,50.0841,poi,suggest,"Eckert, Jindřich (1833-1905)",,0.0,[],[]
pozitiv,"Cyklus obrazů Alfonse Muchy ""Apoteóza Slovanů"" v Primátorském sále Obecního domu (dům čp. 1090 na Starém Městě) - Jan Ámos Komenský.",,21x,A14CE828B67611DF820F00166F1163D4,VI 40/1 f,,,14.42825,50.08762,regional.address,geocode,Štenc,,,[],[]
pozitiv,Pohled na hlavní průčelí budovy Ústavu pro zaopatřování slepců (Dolní Palata) - dům čp. 737 na Smíchově. V popředí zahrada.,kol.1950,74x,A1186E83B67611DF820F00166F1163D4,I 1753,1950-01-01,1950-12-31,14.38547,50.07583,regional.address,geocode,"Pacovský, Jaroslav",,,[],[]
pozitiv,Pohled do kaple sv. Františka Xaverského v domě čp. 504 na Karlově náměstí (kolej novoměstských jezuitů - kasárna grenadýrů - vojenská nemocnice) na Novém Městě.,11.6.1907,69x,A14CE7BAB67611DF820F00166F1163D4,VI 6/26 a,1907-06-11,1907-06-11,14.42048,50.07457,regional.address,geocode,Eckert-ateliér,,,[],[]
negativ,Pohled do interiéru hotelu Paříž (dům čp. 1080 na Starém Městě).,16.-17.10.1905,36x,7382AE678B0511E2BF22525400E46D25,VIII 1380,,,14.65102,50.17658,regional.address,geocode,Eckert-ateliér,,,[],[]
pozitiv,"Reprodukce kresby: Josef Böttinger, Dům čp. 1940 na Novém Městě (Ženský výrobní spolek - Českoslovanská dívčí obchodní akademie), 1895.",,31x,A0C512D9B67611DF820F00166F1163D4,I 9148,,,14.41593,50.07583,regional.address,geocode,,,,[],[]
pozitiv,Wimmerova kašna na Betlémském náměstí na Starém Městě.,1890-1891,50x,A14CE7C2B67611DF820F00166F1163D4,VI 5/22,1890-01-01,1891-12-31,14.41749,50.08425,regional.address,geocode,"Eckert, Jindřich (1833-1905)",,,[],[]
pozitiv,Průhled Zavátou ulicí.,1979,26x,A1187211B67611DF820F00166F1163D4,I 800,1979-01-01,1979-12-31,14.35328,50.02757,regional.address,geocode,"Vymazal, Jan",,,[],[]
pozitiv,Pohled na portál domu čp. 1036 v Hybernské ulici na Novém Městě.,9.5.1906,19x,A1188714B67611DF820F00166F1163D4,VI 19/1,1906-05-09,1906-05-09,14.43036,50.08731,regional.address,geocode,,,,[],[]
pozitiv,Pohled do ulice Ve Smečkách s domem čp. 598 na Novém Městě.,,23x,A14CEAE7B67611DF820F00166F1163D4,VI 48/17,,,14.4276,50.07994,regional.address,geocode,,,,[],[]
pozitiv,Pohled do interiéru domu čp. 851 v Holešovicích (opatrovna U Studánky) - děti v jídelně.,19.6.1907,34x,A0C516A9B67611DF820F00166F1163D4,V 62/3 i,1907-06-19,1907-06-19,14.42861,50.10242,regional.address,geocode,"Kříženecký, Jan (1868-1921)",,,[],[]
pozitiv,Pohled na severovýchodní část Staroměstského náměstí při ústí Dlouhé ulice s domy čp. 930 (vlevo) a 609 a 608 vpravo na Starém Městě krátce před zbouráním.,7.5.1905,36x,A14CEADDB67611DF820F00166F1163D4,VI 58/5,1905-05-07,1905-05-07,14.42168,50.08832,regional.address,geocode,Eckert-ateliér,,,[],[]
negativ,Pohled do Josefovské ulice s domem čp. 903 na Starém Městě krátce před zbořením. V pozadí část kostela sv. Ducha.,8.3.1906,26x,A0C4FC5CB67611DF820F00166F1163D4,VIII 832,1906-03-08,1906-03-08,14.41885,50.08921,regional.address,geocode,Eckert-ateliér,,,[],[]
negativ,Pohled do interiéru elektrárny v Holešovicích (městská centrála) krátce po dostavění roku 1900 - strojírna.,po 1900,44x,02F65BF58D5C11E2BF25525400E46D25,VIII 1427,1901-01-01,2000-12-31,14.43637,50.10853,regional.address,geocode,"Eckert, Jindřich (1833-1905)",,,[],[]
negativ,Pohled na letní kazatelnu ve zrušeného hřbitova Na Skalce (mezi Wolkerovou ulicí a zdí parku Stromovka) v Bubenči.,,11x,8d684c021f5c4a9aa7f5cf7dcb87712f,IX 998,,,14.40997,50.1032,regional.address,geocode,,,,[],[]
negativ,Pohled na zvonici kostela sv. Václava na Proseku.,13.2.1906,53x,95D0F7DDA60511E3BC040024BE7CD9AC,XI 115,1906-02-13,1906-02-13,14.49396,50.11726,regional.address,geocode,"Kříženecký, Jan (1868-1921)",,0.0,[],[]
negativ,"Partie ze sadů na Letné, v pozadí malý pomník.",16.10.1907,46x,2072D6C6E02F11E3A3D40024BE7CD9AC,XI 452,1907-10-16,1907-10-16,14.42324,50.09637,regional.address,geocode,"Kříženecký, Jan (1868-1921)",,0.0,[],[]
pozitiv,Pohled na pískovcový obeliskový památník na paměť povýšení Vršovic na městys 1885 v Heroldových sadech ve Vršovicích - severní strana se znakem.,14.8.1942,67x,A1188A6BB67611DF820F00166F1163D4,I 4179,1942-08-14,1942-08-14,14.45213,50.07067,regional.address,geocode,"Alexander, Antonín (1892-působnost do 1948)",,,[],[]
pozitiv,Pohled do interiéru Strakovy akademie (dům čp. 128 na Malé Straně) - čítárna.,kol.1925,41x,A118899FB67611DF820F00166F1163D4,I 9026,1925-01-01,1925-12-31,14.41139,50.09203,regional.address,geocode,"Vojta, Tomáš (1885-1934)",,,[],[]
pohlednice,Pohled na osvětlený kostel P. Marie v Emauzích a kapli sv. Kosmy a Damiána na Novém Městě při příležitosti 10. výročí samostatnosti Československé republiky. V popředí domy čp. 375 a 376.,28.10.1928,79x,4B57EBE40DA911E892C0406186009F3A,I 12029,1928-10-28,1928-10-28,14.41536,50.07303,regional.address,geocode,,,,[],[]
pozitiv,Pohled na pomník Ernsta Denise na Malostranském náměstí (k západu).,9.7.1933,44x,A1188344B67611DF820F00166F1163D4,I 8183,1933-07-09,1933-07-09,14.4032,50.08835,regional.address,geocode,"Alexander, Antonín (1892-působnost do 1948)",,,[],[]
pozitiv,Celkový pohled na portál průčelí Thunovského paláce - domu čp. 214 na Malé Straně v Nerudově ulici.,kol.1925,18x,A0C51043B67611DF820F00166F1163D4,II 1294,1925-01-01,1925-12-31,14.40038,50.08859,regional.address,geocode,,,,[],[]
pozitiv,"Sousoší ""Slovanské tance"" od Ladislava Šalouna v interiéru Obecního domu (dům čp. 1090 na Starém Městě).",kol.1920,19x,C439D7889FD911E581F5001E33288342,V 7/9 a,1920-01-01,1920-12-31,14.42825,50.08762,regional.address,geocode,Štenc,,,[],[]
negativ,Výstava prací chovanců Ernestina ve staré zasedací síni Staroměstské radnici.,30.6.1909,31x,3C13830212E611E2A6B56C626D41E503,XII 1168,1909-06-30,1909-06-30,14.39669,50.09028,regional.address,geocode,Eckert-ateliér,,0.0,[],[]
pozitiv,Pohled na požární nádrž u pomníku M. Jana Husa na Staroměstském náměstí z věže kostela P. Marie před Týnem. V pozadí vlevo tribuna před Staroměstskou radnicí.,květen 1945,15x,9BD40F611C8F11E8804174D435EEBE90,II 1694,1945-05-01,1945-05-31,14.41994,50.08663,regional.address,geocode,"Sudek, Josef (1896-1976)",,,[],[]
pozitiv,Pohled na fontánu se sochou Herakla v Královské zahradě.,1885,11x,A118673CB67611DF820F00166F1163D4,VI 75/17,1885-01-01,1885-12-31,14.44094,50.08172,regional.address,geocode,"Wlha, Josef",,,[],[]
pozitiv,Pohled do loggie na dvoře Thun-Salmovského paláce v Jungmannově ulici (dům čp. 35 na Novém Městě).,6.5.1923,57x,29DE368696DB11E6BE20406186009F3A,A 14,1923-05-06,1923-05-06,14.42225,50.08197,regional.address,suggest,"Alexander, Antonín (1892-působnost do 1948)",,0.0,[],[]
pozitiv,"Pohled na horní část kostela sv. Tomáše (věž, střechy) na Malé Straně.",21.10.1948,30x,A1186E15B67611DF820F00166F1163D4,I 1526,1948-10-21,1948-10-21,14.40517,50.08883,regional.address,geocode,"Poustecký, Josef",,,[],[]
pozitiv,Celkový pohled na hlavní průčelí domu čp. 146 do Královské třídy (Sokolovské) v Karlíně. Vlevo část domu čp. 182.,,117x,A1186F94B67611DF820F00166F1163D4,II 957,,,14.44898,50.09334,regional.address,geocode,,,,[],[]
pozitiv,Pohled na část průčelí domu čp. 346 na Starém Městě v Bartolomějské ulici.,kol.1920,16x,A0C51485B67611DF820F00166F1163D4,I 8200,1920-01-01,1920-12-31,14.41862,50.08307,regional.address,geocode,,,,[],[]
negativ,Pohled na dům čp. 620 na Starém Městě v Masné ulici (Obchodní akademie). Vpravo dům čp. 619 na Starém Městě.,19.8.1910,47x,81760F70E36A11E4B8D6D4BED94BB14D,XI 3280,1910-08-19,1910-08-19,14.4236,50.08931,regional.address,geocode,Eckert-ateliér,,0.0,[],[]
pozitiv,Pohled na Gröbeho vilu (dům čp. 58 na Vinohradech) nad vinicí - jižní průčelí.,1940-1945,48x,A1187C33B67611DF820F00166F1163D4,I 1859,1940-01-01,1945-12-31,14.44502,50.06921,regional.address,geocode,,,,[],[]
negativ,Celkový pohled na Velkopřevorský palác (dům čp. 485) na Velkopřevorském náměstí na Malé Straně.,27.3.1906,25x,3D5B4D2F0D6411E295A66C626D41E503,XII 1039,1906-03-27,1906-03-27,14.40627,50.08618,regional.address,geocode,Eckert-ateliér,,0.0,[],[]
pozitiv,Pohled na vstupní portál Rudolfovy štoly v Bubenči.,21.4.1908,38x,A118879AB67611DF820F00166F1163D4,VI 26/24,1908-04-21,1908-04-21,14.4196,50.10432,poi,suggest,,,,[],[]
pozitiv,Reprodukce odlitku pečeti polního vojska staroměstského z 1420.,,10x,A0C50C0DB67611DF820F00166F1163D4,XIII 768 - pozitiv,,,14.41994,50.08663,regional.address,geocode,,Datace neznámá. Za účelem vyhledávání byla nastavena na časový rozsah celé sbírky.,0.0,[],[]
negativ,"Pohled na dům čp. 934 na Starém Městě (""Oppeltův"") na Staroměstském náměstí.",kol.1880,26x,D80AB04C254411E0BDC9000C766D2371,XII 167,1880-01-01,1880-12-31,14.42047,50.08805,regional.address,geocode,"Eckert, Jindřich (1833-1905)",,0.0,[],[]
negativ,Pohled na dům čp. 1601 na nároží Václavského náměstí a Mariánské ulice (dnes Opletalova) na Novém Městě.,18.1.1910,46x,8420CB3B16D711E2B3CE6C626D41E503,XII 1192,1910-01-18,1910-01-18,14.43,50.07156,regional.address,geocode,Eckert-ateliér,,0.0,[],[]
pozitiv,Pohled na Jelení příkop a Šternberský palác (dům čp. 57 na Hradčanech). V pozadí vlevo chrám sv. Víta na Pražském hradě při dostavbě.,kol.1898,29x,A0C50122B67611DF820F00166F1163D4,VI 10/15 b,1898-01-01,1898-12-31,14.39669,50.09028,regional.address,geocode,"Eckert, Jindřich (1833-1905)",,,[],[]
CD-ROM,Prvá vlna povodně v Praze - Rybaření v Bráníku vedle ústí Kunratického potoka při 3.SPA - 10.8.2002 v 8:00. V pozadí Barrandovské terasy.,10.8.2002,103x,A0C4FD07B67611DF820F00166F1163D4,XXII 6/11,2002-08-10,2002-08-10,14.40238,50.02785,regional.address,geocode,"Elleder, Libor, Ing. (působnost 2002)",,0.0,[],[]
negativ,"Pohled do interiéru domu čp. 562 (""Dům Buquoyský"") v Celetné ulici na Starém Městě - jídelna hraběnky Ledeburgové.",20.4.1907,23x,053F25DD8B1011E2BF22525400E46D25,VIII 1392,1907-04-20,1907-04-20,14.4242,50.0871,regional.address,geocode,Eckert-ateliér,,,[],[]
pozitiv,"Pohled na Arbesovo náměstí s domy zprava čp. 753, 781, 782, 742, 80 na Smíchově.",1940-1945,127x,A0C515ACB67611DF820F00166F1163D4,I 1617,1940-01-01,1945-12-31,14.40569,50.07664,regional.address,geocode,"Vopravil, Josef (1902-1972)",,,[],[]
negativ,Pohled na vlak přijíždějící do Malé Chuchle. V pozadí část lázeňské budovy.,,23x,cf222b13cc5547d89e99fda238cea2ed,X 484,,,14.39232,50.02491,regional.address,geocode,,,,[],[]
pozitiv,"Pohled na průčelí domů (zleva) čp. 448, 447 ve Všehrdově ulici na Malé Straně.",14.7.1930,30x,A14CDB32B67611DF820F00166F1163D4,I 4233,1930-07-14,1930-07-14,14.40646,50.08232,regional.address,geocode,"Alexander, Antonín (1892-působnost do 1948)",,,[],[]
pozitiv,Socha kohouta z orloje Staroměstské radnice (dům čp. 1 na Starém Městě) na Staroměstském náměstí po restaurování.,říjen 1930,29x,982C1102D37A11E8A2B874D435EEBE90,Voj 4096,1930-10-01,1930-10-31,14.34054,50.07267,regional.address,suggest,"Vojta, Tomáš (1885-1934)",,0.0,[],[]
negativ,"Pohled do interiéru Kaiseršteinského paláce (dům čp. 37) na Malé Straně v době, kdy zde bydlela Ema Destinová (1908-1914) - hudební salon.",10.12.1910,42x,BD51BCFF1D1B11E287846C626D41E503,XII 1250,1910-12-10,1910-12-10,14.40471,50.08788,regional.address,geocode,Eckert-ateliér,,0.0,[],[]
pozitiv,Pohled na dům čp. 9 na nároží Tylova (Obchodního) náměstí a Lhotecké ulice v Modřanech.,1970,48x,A14CE621B67611DF820F00166F1163D4,I 9020,1970-01-01,1970-12-31,14.40557,50.00515,regional.address,geocode,"Vopravil, Josef (1902-1972)",,,[],[]
pozitiv,"Pohled na vykopávky bývalého kostela sv. Benedikta na zahradě zbořeného domu čp. 655 na Starém Městě (Ústav šlechtičen) při náměstí Republiky - detaily severního průčelí kostela. V pozadí vpravo dům čp. 1078 - 1079 (kasárna Jiřího z Poděbrad - Josefská), vlevo dům čp. 1080 na Novém Městě.",28.4.1928,88x,85207AD4161311E390486C626D41E503,I 9802,1928-04-28,1928-04-28,14.4277,50.0891,regional.address,geocode,"Alexander, Antonín (1892-působnost do 1948)",,,[],[]
pozitiv,Zimní pohled na sídliště v Malešicích. V popředí sáňkující a lyžující děti.,9.2.1965,57x,EF1C04512D1511E0823D00166F1163D4,I 9414,1965-02-09,1965-02-09,14.4979,50.08548,regional.address,geocode,,,,[],[]
pozitiv,"Pohled do židovské modlitebny domu čp. 160 (dům pro židovské studenty, v současnosti dům čp. 770) v ulici Na Popelce na Smíchově.",,65x,E5D2FEFA9DFF11E7AF7C406186009F3A,I 12228,,,14.38474,50.06917,regional.address,geocode,"Lederer, Arnold",,,[],[]
pozitiv,"Pohled na náhrobek Josefa Kukly na hřbitově na Malvazinkách (?). Vpravo náhrobek Aloise Pawlowského, vlevo náhrobek rodiny Jiránkovy (Jaroslav, Josefa, Marie).",kol.1900,46x,A0C503CEB67611DF820F00166F1163D4,VI 74/5,1900-01-01,1900-12-31,14.38947,50.06181,regional.address,geocode,"Smolka, Karel",,,[],[]
negativ,Pohled do ulice Nový Svět na Hradčanech z výšky. V pozadí vlevo chrám sv. Víta.,12.5.1909,33x,A11886ADB67611DF820F00166F1163D4,VIII 365,1909-05-12,1909-05-12,14.39305,50.09072,regional.address,geocode,Eckert-ateliér,,,[],[]
pozitiv,"Pražské povstání - květen 1945. Staroměstské náměstí - radnice a dům čp. 934 na nároží Pařížské ulice po požáru 8.5.1945. V popředí trosky radnice a žebříky, v pozadí Pařížská ulice.",květen 1945,220x,A11881ECB67611DF820F00166F1163D4,I 6527,1945-05-01,1945-05-31,14.42009,50.087,regional.address,suggest,"Zeman, Josef",,,[],[]
pozitiv,Panoramatický pohled na Záběhlice. Uprostřed hliniště a cihelna V Slatinách. Šestá část šestidílného panoramatu od jihu přes západ až k severovýchodu.,5.7.1929,83x,4B607561582011E88F1F74D435EEBE90,A 5123,1929-07-05,1929-07-05,14.49133,50.06572,regional.address,geocode,"Alexander, Antonín (1892-působnost do 1948)",,0.0,[],[]
pozitiv,"Cyklus obrazů Alfonse Muchy ""Apoteóza Slovanů"" v Primátorském sále Obecního domu (dům čp. 1090 na Starém Městě) - Jan Žižka.",,20x,A14CE826B67611DF820F00166F1163D4,VI 40/1 d,,,14.42825,50.08762,regional.address,geocode,Štenc,,,[],[]
pozitiv,Pohled na altán (sala terrena) u Freundova mlýna (dům čp. 1224 na Novém Městě) - v zahradě domu čp. 1318. V pozadí Helmovské mlýny.,kol. 1905,62x,0909E252FA4311E5B79C406186009F3A,F 376,,,14.42854,50.09225,regional.address,geocode,"Fink, František (1854-1935)",,0.0,[],[]
pozitiv,Pohled na mlýn (dům čp. 16) v Hostivaři.,1968,51x,A0C50FE4B67611DF820F00166F1163D4,I 9097,1968-01-01,1968-12-31,14.5109,50.0413,regional.address,geocode,"Vopravil, Josef (1902-1972)",,,[],[]
pozitiv,Palackého náměstí při slavnostním odhalení pomníku Františka Palackého.,1.7.1912,69x,A14CE166B67611DF820F00166F1163D4,I 4064,1912-07-01,1912-07-01,14.41536,50.07303,regional.address,geocode,,,,[],[]
pozitiv,"Pohled na pravou část průčelí domu čp. 76 (""U Šmerhovských"") ve Spálené ulici na Novém Městě před zbořením.",kol.1905,38x,A14CE83EB67611DF820F00166F1163D4,VI 6/6 b,1905-01-01,1905-12-31,14.41993,50.08059,regional.address,geocode,,,,[],[]
pozitiv,Pohled na dům čp. 183 na Starém Městě.,1914,19x,52EC1B4E847811E49AE9406186009F3A,V 1/35,1914-01-01,1914-12-31,14.41583,50.08603,regional.address,geocode,,,,[],[]
pozitiv,"Pohled do interiéru ústřední elektrárny v Holešovicích (dům čp. 1) - ""Křižíkův elektrický stroj"".",kol.1900,43x,A0C504F1B67611DF820F00166F1163D4,VI 76/11,1900-01-01,1900-12-31,14.43637,50.10853,regional.address,geocode,"Eckert, Jindřich (1833-1905)",,,[],[]
negativ,Pohled do Karmelitské ulice s domem čp. 388 na Malé Straně (četnická kasárna).,28.5.1904,46x,985823B7172511E0BDBB000C766D2371,XII 105,1904-05-28,1904-05-28,14.40367,50.08755,poi,suggest,"Eckert, Jindřich (1833-1905)",,0.0,[],[]
pozitiv,Pohled na přepravování lodi nad nový Helmovský jez vorovou propustí. V pozadí provizorní dřevěný most (Hlávkův).,26.3.1910,52x,05A6A89D62DB11E6A552000C76270B94,I 11817,1910-03-26,1910-03-26,14.4369,50.09567,regional.street,suggest,,,,[],[]
pozitiv,Pohled na náhrobek rodiny Pauly na hřbitově Malvazinky na Smíchově od Čeňka Vosmíka.,1959,55x,A14CDE75B67611DF820F00166F1163D4,I 8767,1959-01-01,1959-12-31,14.38698,50.06196,poi,suggest,"Mikšátko, Václav",,,[],[]
pozitiv,Pohled na portál domu čp. 345 ve Vlašské ulici na Malé Straně.,19.7.1906,13x,A0C512EDB67611DF820F00166F1163D4,VI 22/19,1906-07-19,1906-07-19,14.39557,50.08628,regional.address,geocode,,,,[],[]
pozitiv,Pohled do Podskalské ulice na Novém Městě k jihu. V pozadí věže kostela sv. Petra a Pavla na Vyšehradě.,16.5.1905,35x,A14CEA2AB67611DF820F00166F1163D4,VI 53/5,1905-05-16,1905-05-16,14.4153,50.06994,regional.address,geocode,Eckert-ateliér,,,[],[]
pozitiv,Pohled na nádraží císaře Františka Josefa I. (dům čp. 300 na Vinohradech) přes kolejiště - při bourání staré budovy (v pozadí).,27.3.1904,103x,A14CEA32B67611DF820F00166F1163D4,VI 61/7,1904-03-27,1904-03-27,14.43549,50.08356,regional.address,geocode,"Eckert, Jindřich (1833-1905)",,,[],[]
pozitiv,Pohled přes Vltavu na dnešní Dvořákovo a Alšovo nábřeží s částí Rudolfina. V pozadí panorama Starého Města.,kol.1890,49x,A0C50DC5B67611DF820F00166F1163D4,II 14,1890-01-01,1890-12-31,14.41521,50.09017,regional.address,geocode,,,,[],[]
pozitiv,"Pohled na vstupní portál domu čp. 755 (""U Pinkasů"") na Jungmannově náměstí na Novém Městě.",14.5.1907,20x,A11876B4B67611DF820F00166F1163D4,VI 19/11 a,1907-05-14,1907-05-14,14.42332,50.08323,regional.address,geocode,,,,[],[]
pozitiv,"Pohled na kašnu se sochou Vltavy Václava Prachnera z roku 1818 (""Terezka"") při zdi dvora Clam-Gallasovského paláce (dům čp. 158 na Starém Městě) na Mariánském náměstí.",kol.1895,29x,C141D13F9B9611E2BF2D525400E46D25,VI 38/2,1895-01-01,1895-12-31,14.41739,50.08739,regional.address,geocode,,,,[],[]
negativ,Pohled na Maltézské náměstí s domem čp. 471 (Nostický palác) na Malé Straně.,kol.1895,23x,A11883B1B67611DF820F00166F1163D4,VIII 201,1895-01-01,1895-12-31,14.40583,50.08546,regional.address,geocode,"Eckert, Jindřich (1833-1905)",,,[],[]
negativ,Pohled na severní portál kostela P. Marie před Týnem na Starém Městě.,13.3.1906,16x,9F7CFA1AA93011E3839F0024BE7CD9AC,XI 138,1906-03-13,1906-03-13,14.42396,50.08884,regional.address,geocode,"Kříženecký, Jan (1868-1921)",,0.0,[],[]
pozitiv,Pohled na renesanční portál domu čp. 490 (palác Metychů z Čečova - Hrzánský) na Velkopřevorském náměstí na Malé Straně.,1925,27x,E6C82E8505B611E389696C626D41E503,I 9757,1925-01-01,1925-12-31,14.40739,50.08615,regional.address,geocode,"Vojta, Tomáš (1885-1934)",,,[],[]
pozitiv,Pohled na nános ledu pod Negrelliho viaduktem mezi Rohanským ostrovem a Štvanicí. V pozadí provizorní dřevěný most (Hlávkův).,5.2.1909,106x,F5AB96E95ECC11E6A551000C76270B94,I 11786,1909-02-05,1909-02-05,14.44069,50.09758,poi,suggest,,,,[],[]
pozitiv,Pohled na portál kostela sv. Rocha v areálu kláštera Premonstrátů na Strahově.,11.7.1907,18x,A11869D2B67611DF820F00166F1163D4,VI 25/25 b,1907-07-11,1907-07-11,14.38967,50.08671,regional.address,geocode,,,,[],[]
pozitiv,Pohled z nábřeží Legií na Smíchově k severovýchodu na zdymadlo u Židovského ostrova (vpravo). Uprostřed můstek přes plavební kanál.,28.9.1930,67x,A1187739B67611DF820F00166F1163D4,I 8783,1930-09-28,1930-09-28,14.4099,50.07278,regional.address,geocode,"Alexander, Antonín (1892-působnost do 1948)",,,[],[]
negativ,Pohled do interiéru dezinfekční stanice král hl. města Prahy v Libni (dům čp. 99) v ulici Bulovka - kotle.,16.2.1911,91x,F32DA9D8CC9411E89DA974D435EEBE90,XI 1707,1911-02-16,1911-02-16,14.46158,50.11388,regional.address,geocode,"Kříženecký, Jan (1868-1921)",,0.0,[],[]
negativ,Interiér letohrádku Hvězda v Liboci - štuková výzdoba.,,19x,369D4C69F33F11E4BA8374D435EEBE90,XI 6368,,,14.3262,50.08337,poi,suggest,Eckert-ateliér,Datace neznámá. Za účelem vyhledávání byla nastavena na časový rozsah celé sbírky.,0.0,[],[]
negativ,Pohled na portrétní bustu Johany Bavorské v triforiu chrámu sv. Víta na Pražském hradě.,květen 1924,23x,9141DD123DA111E499B8406186009F3A,XI 6295,1924-05-01,1924-05-31,14.4006,50.09089,poi,suggest,Eckert-ateliér,,0.0,[],[]
pozitiv,Socha Atlanta s hvězdným globem sejmutá během opravy z věže Klementina (dům čp. 190) na Starém Městě.,5.6.1914,17x,0AE2A1E6B78111E4AB55406186009F3A,V 4/4 l,1914-06-05,1914-06-05,14.4172,50.08697,regional.address,geocode,,,,[],[]
negativ,Obraz P. Marie s Ježíškem a s jablkem z arcibiskupské kaple chrámu sv. Víta na Pražském hradě.,[1863-1905],32x,86399E4F92D411E193C36C626D41E503,XII 504,,,14.4006,50.09089,poi,suggest,"Eckert, Jindřich (1833-1905)",Datace neznámá. Za účelem vyhledávání byla nastavena na časový rozsah celé sbírky.,0.0,[],[]
pozitiv,Pohled od Strossmayerova náměstí směrem k Vltavě. Vlevo část novostavby Elektrických podniků hl. m. Prahy (dům čp. 1477) v Bubenské ulici vpravo část domu čp. 1297 v Holešovicích na Strossmayerově náměstí.,31.8.1937,87x,70A7B555669311E481D7D4BED94BB14D,I 11052,1937-08-31,1937-08-31,14.43474,50.09841,regional.address,geocode,"Alexander, Antonín (1892-působnost do 1948)",,,[],[]
negativ,Výzdoba konchy v kostele sv. Mikuláše na Malé Straně (po opravě).,4.10.1907,13x,E960CD35D53111E39F890024BE7CD9AC,XI 400,1907-10-04,1907-10-04,14.4032,50.08835,regional.address,geocode,"Kříženecký, Jan (1868-1921)",,0.0,[],[]
negativ,"Pohled na průčelí Kapitulního domu s portálem na Hradčanském náměstí (dům čp. 62-63 na Hradčanech - ""byt kanovníka Hory, kustoda chrámu sv. Víta"").",kol.1885,30x,93A5884C082D11E0BDAD000C766D2371,XII 74,1885-01-01,1885-12-31,14.39554,50.08992,regional.address,geocode,"Eckert, Jindřich (1833-1905)",,0.0,[],[]
pozitiv,Pohled na území Smíchova z letního cvičiště smíchovského Sokola nad Bertramkou. V pozadí uprostřed Vyšehrad. Součást panoramatu.,18.5.1927,77x,C98B4013532A11E19DFA6C626D41E503,I 9559,1927-05-18,1927-05-18,14.39601,50.0698,regional.address,geocode,"Alexander, Antonín (1892-působnost do 1948)",,,[],[]
pozitiv,Celkový pohled na Hybernský klášter (dům čp. 1037 na Novém Městě) na nároží Josefského náměstí (náměstí Republiky) a Hybernské ulice. Vlevo část krámu u Prašné brány.,kol.1880,41x,A1187CE6B67611DF820F00166F1163D4,VI 7/55,1880-01-01,1880-12-31,14.42903,50.08791,regional.address,geocode,"Eckert, Jindřich (1833-1905)",,,[],[]
negativ,"Pohled na usedlost Cibulka (dům čp. 118) v Košířích, záběr na plastiku Číňanky od Václava Prachnera, umístěnou na terase před hlavním vchodem.",1974,53x,A14CE440B67611DF820F00166F1163D4,VII 570,1974-01-01,1974-12-31,14.35655,50.06696,regional.address,geocode,"Chalupníček, Miroslav -, Chalupníčková, Věra (dokument 1941-1948)",,,[],[]
pozitiv,"Pohled na střední část nástropní fresky universitní knihovny Klementinum (dům čp. 190, 1040 na Starém Městě).",15.12.1902,37x,A0C4F6E7B67611DF820F00166F1163D4,VI 4/3 c,1902-12-15,1902-12-15,14.4172,50.08697,regional.address,geocode,"Eckert, Jindřich (1833-1905)",,,[],[]
pozitiv,Pohled na umělou romantickou zříceninu (rozhlednu) v zahradě usedlosti Cibulka v Košířích (dům čp. 118) zdálky.,kol.1955,50x,A0C4F6DDB67611DF820F00166F1163D4,I 4634,1955-01-01,1955-12-31,14.35655,50.06696,regional.address,geocode,"Hnilička, Eduard (1887-1967)",,,[],[]
pozitiv,Pohled na archeologické vykopávky na třetím nádvoří Pražského hradu.,1926,28x,1DE988E6670811E7AB4174D435EEBE90,V 93/9,1926-01-01,1926-12-31,14.40088,50.09006,poi,suggest,,,,[],[]
pozitiv,Pohled na stavbu Čechova mostu. V pozadí Letná.,prosinec 1905,60x,A14CE45CB67611DF820F00166F1163D4,II 86,1905-12-01,1905-12-31,14.4171,50.093,regional.street,suggest,"Kříženecký, Jan (1868-1921)",,,[],[]
pozitiv,Pohled na průčelí domů čp. 1185 (vpravo) a 1186 (vlevo) na Petrském náměstí.,24.4.1927,27x,A0C505A9B67611DF820F00166F1163D4,I 4643,1927-04-24,1927-04-24,14.432,50.09169,regional.address,geocode,"Alexander, Antonín (1892-působnost do 1948)",,,[],[]
negativ,Celkový pohled na průčelí domu čp. 73 (Uměleckoprůmyslové muzeum) v Sanytrové ulici (dnes 17. listopadu) na Starém Městě.,28.4.1908,30x,A0C51565B67611DF820F00166F1163D4,VIII 254,1908-04-28,1908-04-28,14.41631,50.08993,regional.address,geocode,Eckert-ateliér,,,[],[]
negativ,"Pohled na severovýchodní část Staroměstského náměstí s domy čp. (zleva) 934, 932, 930 a 607.",[1856-2014],27x,D17E69CF2A1411E9A7CF406186009F3A,XI 4431,,,14.42168,50.08832,regional.address,geocode,,Datace neznámá. Za účelem vyhledávání byla nastavena na časový rozsah celé sbírky.,0.0,[],[]
pozitiv,Pohled na břehy slepého vltavského ramena v Hodkovičkách. V pozadí Branický most.,22.8.1959,45x,64FE2BECD28F11E6BE58406186009F3A,I 12150,1959-08-22,1959-08-22,14.40238,50.02785,regional.address,geocode,"Hnilička, Eduard (1887-1967)",,,[],[]
negativ,Pohled na Staroměstské náměstí od Celetné ulice. Uprostřed východní průčelí Staroměstské radnice (dům čp. 1 na Starém Městě) a kostel sv. Mikuláše. Uprostřed mariánský sloup. Vpravo dům čp. 934 na Starém Městě.,29.4.1906,46x,A14CE6D4B67611DF820F00166F1163D4,VIII 893,1906-04-29,1906-04-29,14.42009,50.087,regional.address,suggest,Eckert-ateliér,,,[],[]
pozitiv,Pohled na dům čp. 59c (skleník - vivarium) na Vinohradech.,12.7.1931,82x,A1187367B67611DF820F00166F1163D4,I 1839,1931-07-12,1931-07-12,14.44571,50.06981,poi,suggest,"Alexander, Antonín (1892-působnost do 1948)",,,[],[]
pozitiv,Pohled na shromážděný dav při vyhlášení Československé republiky při první schůzi Národního shromáždění před domem čp. 176 (sněmovna) ve Sněmovní ulici na Malé Straně.,14.11.1918,93x,92578E795A4711E7A69B406186009F3A,I 12115 a,1918-11-14,1918-11-14,14.40395,50.08915,regional.address,geocode,"Reach, Zikmund (1859-1935)",,,[],[]
pozitiv,Pohled na část jižního a východního průčelí Staroměstské radnice s arkýřem (dům čp. 1 na Starém Městě).,kol.1895,38x,612F832F474611E180176C626D41E503,I 9545,1895-01-01,1895-12-31,14.42009,50.087,regional.address,suggest,,,,[],[]
pozitiv,Pohled na stavbu plavební komory u ostrova Štvanice pod nedokončenou železnou částí Hlávkova mostu.,13.11.1909,40x,5EB4B46C62A311E6A552000C76270B94,I 11797,1909-11-13,1909-11-13,14.4369,50.09567,regional.street,suggest,,,,[],[]
pozitiv,"Pohled dolní průčelí domu čp. 26 (""U zlatého jelena"") se vstupním portálem a domovním znamením v Tomášské ulici na Malé Straně.",1906,12x,A1188D4DB67611DF820F00166F1163D4,VI 20/9 a,1906-01-01,1906-12-31,14.40492,50.08882,regional.address,geocode,,,,[],[]
negativ,"Panoramatický pohled od Pražského hradu na Malou Stranu, Staré Město a Nové Město. Uprostřed kostel sv. Mikuláše.",14.1.1906,25x,A1187A4AB67611DF820F00166F1163D4,VIII 451,1906-01-14,1906-01-14,14.4032,50.08835,regional.address,geocode,Eckert-ateliér,,,[],[]
negativ,Pohled do interiéru domu čp. 909 (budova hlavní pošty) v Jindřišské ulici na Novém Městě - meziměstská telegrafní úřadovna telefonního a telegrafního úřadu.,19.4.1908,34x,A118743CB67611DF820F00166F1163D4,VIII 85,1908-04-19,1908-04-19,14.42901,50.08293,regional.address,geocode,Eckert-ateliér,,,[],[]
pozitiv,Odlet primátora Ludvíka Černého do Moskvy z ruzyňského letiště.,25.11.1964,11x,1f19a8b277034f7fa7e924f1dcf886a4,I 12947,1964-11-25,1964-11-25,14.32073,50.08848,regional.address,suggest,,,,[],[]
pozitiv,Pohled do interiéru domu čp. 56 (Arcibiskupský palác) na Hradčanech - kaple sv. Jana Křtitele.,,27x,A1188865B67611DF820F00166F1163D4,VI 32/21,,,14.39755,50.08984,regional.address,geocode,"Eckert, Jindřich (1833-1905)",,,[],[]
negativ,"Pohled na jižní stranu Malostranského náměstí. Vlevo část kostela sv. Mikuláše se zvonicí (dům čp. 556), vpravo domy s podloubími.",30.3.1907,26x,A1188C0CB67611DF820F00166F1163D4,VIII 889,1907-03-30,1907-03-30,14.40254,50.08766,regional.address,geocode,Eckert-ateliér,,,[],[]
negativ,Pohled do interiéru domu čp. 216 (Obecná a měšťanská dívčí škola u sv. Vojtěcha) na Novém Městě - schodiště.,1907,23x,BAA7335AB97D11E3AFA20024BE7CD9AC,XI 307,1907-01-01,1907-12-31,14.41497,50.07885,regional.address,geocode,"Kříženecký, Jan (1868-1921)",,0.0,[],[]
negativ,Pohled přes řeku na břeh v Podskalí (dnešní Rašínovo nábřeží) u železničního mostu. Uprostřed čp. 412 na Výtoni (bývalá celnice) v Podskalí. Součást panoramatu.,9.7.1904,102x,A1187E94B67611DF820F00166F1163D4,VIII 642,1904-07-09,1904-07-09,14.41538,50.06785,regional.address,geocode,"Eckert, Jindřich (1833-1905)",,,[],[]
negativ,Pohled do obecního dvora v Libni (dům čp. 2).,12.12.1906,77x,A118887FB67611DF820F00166F1163D4,XI 211,1906-12-12,1906-12-12,14.46857,50.09989,regional.address,geocode,"Kříženecký, Jan (1868-1921)",,0.0,[],[]
pozitiv,Pohled na mříž v kostele Nanebevzetí P. Marie na Strahově.,1885,16x,A0C50404B67611DF820F00166F1163D4,VI 75/12,1885-01-01,1885-12-31,14.38967,50.08671,regional.address,geocode,"Wlha, Josef",,,[],[]
pozitiv,Pohled do interiéru domu čp. 935 na Starém Městě (schodiště).,1895,9x,A0C50785B67611DF820F00166F1163D4,VI 58/7,1895-01-01,1895-12-31,14.42034,50.08826,regional.address,geocode,"Maloch, Jan (1825-1911)",Autorství J. Malocha není jisté.,,[],[]
pozitiv,Pohled na náhrobky na Starém židovském hřbitově v Josefově.,1908,32x,A14CE8D3B67611DF820F00166F1163D4,VI 12/3 o,1908-01-01,1908-12-31,14.45094,50.08172,poi,suggest,,,,[],[]
negativ,Pohled z Lobkovického paláce na Pražském hradě na Malou Stranu s kostelem sv. Mikuláše a sv. Tomáše. Vpravo v pozadí Petřín s rozhlednou.,kol.1900,22x,4828658D07D211E28BD16C626D41E503,XII 871,1900-01-01,1900-12-31,14.40339,50.09134,regional.address,geocode,"Eckert, Jindřich (1833-1905)",,0.0,[],[]
pozitiv,"Panoramatický pohled na Kobylisy a Troju od štěrkovny - jihovýchodně a jižně od Čimického háje přes vltavské údolí (od severovýchodu přes východ, jih k západu). Součást šestidílného panoramatu.",18.7.1926,41x,ce01137263564d35992bda509ed53aa4,A 2554,1926-07-18,1926-07-18,14.43758,50.12891,poi,suggest,"Alexander, Antonín (1892-působnost do 1948)",,0.0,[],[]
negativ,Pohled na nástropní fresku (západní pole) universitní knihovny Klementinum (dům čp. 1040 na Starém Městě).,15.12.1902,24x,A0C51222B67611DF820F00166F1163D4,VIII 376,1902-12-15,1902-12-15,14.41659,50.08616,poi,suggest,"Eckert, Jindřich (1833-1905)",,,[],[]
pozitiv,Pohled na hlavní schodiště ze 2. do 3. patra ve zničeném východním křídle Staroměstské radnice po požáru 8. května 1945 (dům čp. 1 na Starém Městě).,17.5.1945,80x,A14CE759B67611DF820F00166F1163D4,I 1597,1945-05-17,1945-05-17,14.42009,50.087,regional.address,suggest,"Alexander, Antonín (1892-působnost do 1948)",,,[],[]
negativ,"Tympanon severního portálu kostela P. Marie před Týnem na Starém Městě. 
                    
                
                    
                  Detail - pravá dolejší skupina.",kol. 1905,16x,F9AC5A79AA9811E3A45A0024BE7CD9AC,XI 180,,,14.42396,50.08884,regional.address,geocode,"Kříženecký, Jan (1868-1921)",,0.0,[],[]
negativ,Pohled na komplex budov Pražské strojírny akc. spol. (dříve Ruston a spol.) dům čp. 145 ve Švábkách v Libni - uliční průčelí. Vpravo ulice Švábky.,24.3.1912,82x,203575DCE80511E89B6974D435EEBE90,XI 2201,1912-03-24,1912-03-24,14.47713,50.10299,regional.address,geocode,"Kříženecký, Jan (1868-1921)",,0.0,[],[]
negativ,"Pohled do Rybné ulice s domem čp. 681 (""U Města Pešti"") na Starém Městě před zbořením v roce 1902. Vlevo čp. 678 na Starém Městě.",kol.1900,49x,A118792CB67611DF820F00166F1163D4,VIII 208,1900-01-01,1900-12-31,14.42592,50.08881,regional.address,geocode,"Eckert, Jindřich (1833-1905)",,,[],[]
pozitiv,Cvičení žen během VII. všesokolského sletu na Letné v Holešovicích.,27.-30.6.1920,75x,A1187B5FB67611DF820F00166F1163D4,I 8322,,,14.42032,50.09595,regional.address,geocode,"Vojta, Tomáš (1885-1934)",,,[],[]
pozitiv,Pohled na nosníky před schody na špičce ostrova Štvanice.,11.8.1909,33x,1BFC717D646611E6A554000C76270B94,I 11853,1909-08-11,1909-08-11,14.44021,50.09583,regional.address,geocode,,,,[],[]
negativ,Pohled do Fürstenberské zahrady na Malé Straně - uprostřed kašna.,kol.1900,25x,A0C4F744B67611DF820F00166F1163D4,VIII 1049,1900-01-01,1900-12-31,14.40696,50.09058,regional.address,geocode,"Eckert, Jindřich (1833-1905)",,,[],[]
negativ,"Pohled na jižní stranu Staroměstského náměstí s domy čp. 480, 479, 478 na Starém Městě.",kol.1895,27x,B07830BFE69D11DFBD6D000C766D2371,XII 11,1895-01-01,1895-12-31,14.42095,50.0867,regional.address,suggest,"Eckert, Jindřich (1833-1905)",,0.0,[],[]
pozitiv,Veřejný záchodek (paní Procházkové) v Čelakovského sadech vedle Národního muzea (dům čp. 1700 na Novém Městě) - v pozadí.,,96x,A0C50E26B67611DF820F00166F1163D4,II 1505,,,14.43056,50.07918,regional.address,geocode,"Kříženecký, Jan (1868-1921)","Kříženecký, Jan - Jelínková, Jana (repro)",,[],[]
pozitiv,Celkový pohled na kostel sv. Filipa a Jakuba na Malvazinkách.,kol.1900,31x,A118772DB67611DF820F00166F1163D4,VI 74/4,1900-01-01,1900-12-31,14.38952,50.0619,regional.address,geocode,"Smolka, Karel",,,[],[]
negativ,Pohled do Fürstenberské zahrady na Malé Straně. V pozadí Pražský hrad.,27.6.1907,36x,11CC6E85BE5811E3BF7C406186009F3A,XI 367,1907-06-27,1907-06-27,14.40573,50.09054,regional.address,geocode,"Kříženecký, Jan (1868-1921)",,0.0,[],[]
pozitiv,Pohled přes Vltavu na smíchovské nábřeží (domy).,8.3.1919,44x,A1187E02B67611DF820F00166F1163D4,II 580,1919-03-08,1919-03-08,14.4099,50.07278,regional.address,geocode,,,,[],[]
pozitiv,"Pohled na portál domu čp. 62 (""Kapitulní dům"") na Hradčanském náměstí na Hradčanech.",27.7.1906,20x,A1188232B67611DF820F00166F1163D4,VI 24/11,1906-07-27,1906-07-27,14.39577,50.08991,regional.address,geocode,,,,[],[]
pozitiv,"Panoramatický pohled přes Vltavu na Malou Stranu s Kampou. Vpravo část Karlova mostu, nad ním v pozadí Pražský hrad.",,70x,A1187F83B67611DF820F00166F1163D4,II 40,,,14.41321,50.08173,regional.address,geocode,,"Landergott, Josef (repro)",,[],[]
negativ,"Pohled na práce při stavbě kanalizace (Staroměstská shybková komora) na dnešním Dvořákově nábřeží - staveniště s rozestavěnými šachtami mezi Vltavou, Sanytrovou ulicí a Jánským náměstím. V pozadí domy v Sanytrové ulici a na Jánském náměstí. Zprava: dům čp. 881, čp. 879, čp. 877 na Starém Městě, ústí Břehové ulice (Stará Poštovská), čp. 286, čp. 278 v Josefově, čp. 974 a čp. 884 na Starém Městě.",19.10.1898,89x,20FADC4685B611E2BF1F525400E46D25,VIII 1329,1898-10-19,1898-10-19,14.41547,50.09073,regional.address,geocode,"Eckert, Jindřich (1833-1905)",,,[],[]
negativ,Zvon z kostela sv. Mikuláše na Malé Straně před jeho sejmutím za 1. světové války k roztavení.,1914-1918,29x,FC054E1AD37611E8AE88406186009F3A,XI 3819,1914-01-01,1918-12-31,14.4032,50.08835,regional.address,geocode,,,0.0,[],[]
pozitiv,Pohled na portál kaple Nejsvětější Trojice v Sedlci.,21.6.1908,29x,A1186851B67611DF820F00166F1163D4,VI 33/4,1908-06-21,1908-06-21,14.39198,50.13217,poi,suggest,,,,[],[]
pozitiv,Pohled na Červený dvůr čp. 43 ve Strašnicích.,24.8.1926,52x,9820BEC2F09611E7A65774D435EEBE90,A 2653,1926-08-24,1926-08-24,14.49625,50.0659,regional.address,geocode,"Alexander, Antonín (1892-působnost do 1948)",,0.0,[],[]
negativ,Pohled na dům čp. 339 na Novém Městě - Svatováclavské lázně krátce před zbořením (jižní a východní průčelí se schodištěm).,18.1.1908,34x,A11880C6B67611DF820F00166F1163D4,VIII 608,1908-01-18,1908-01-18,14.41678,50.07444,regional.address,geocode,Eckert-ateliér,,,[],[]
negativ,Pohled na spodní část průčelí domu čp. 256 (Morzinský palác) s portálem v Ostruhové ulici (dnes Nerudova) na Malé Straně.,kol.1885,42x,4BC89760F18711DFBD80000C766D2371,XII 45,1885-01-01,1885-12-31,14.40084,50.08849,regional.address,geocode,"Eckert, Jindřich (1833-1905)",,0.0,[],[]
negativ,Celkový pohled na dům čp. 939 v Jindřišské ulici na Novém Městě (Harrachovský palác).,kol.1880,49x,5346A95BF8AB11DFBD8B000C766D2371,XII 70,1880-01-01,1880-12-31,14.42876,50.08406,regional.address,geocode,"Eckert, Jindřich (1833-1905)",,0.0,[],[]
pozitiv,Pohled na průčelí domu čp. 585 v Celetné ulici na Starém Městě.,1907,17x,F17C4599E2B711E4B65C0024BE7CD9AC,V 6/2 b,1907-01-01,1907-12-31,14.42666,50.0873,regional.address,geocode,,,,[],[]
pozitiv,Pohled na plastiku vázy v zahradě Trojského zámku (dům čp. 1 v Troji).,,27x,A14CE950B67611DF820F00166F1163D4,VI 41/17,,,14.4124,50.11648,regional.address,geocode,,,,[],[]
pozitiv,Pohled na náměstí Míru s kostelem sv. Ludmily s parkovou úpravou.,kol.1900,173x,A14CE38BB67611DF820F00166F1163D4,I 283,1900-01-01,1900-12-31,14.43794,50.07563,regional.address,geocode,,,,[],[]
pozitiv,Celkový pohled na Novoměstské divadlo v zimě od jihu (dřevěná krytá aréna v místech dnešní Státní opery zbořená roku 1886 - dům čp. 101 na Vinohradech). Vpravo v pozadí dům čp. 98 v Resslově ulici (dnes U Divadla) na Vinohradech a část kolejiště. Vlevo původní dům čp. 101 na Vinohradech.,kol.1880,46x,A14CEB3FB67611DF820F00166F1163D4,VI 58/26,1880-01-01,1880-12-31,14.43263,50.08071,regional.address,geocode,"Eckert, Jindřich (1833-1905)",,,[],[]
pozitiv,Pohled na plastiku vázy v zahradě Trojského zámku (dům čp. 1 v Troji).,,26x,A14CE94CB67611DF820F00166F1163D4,VI 41/13,,,14.41109,50.11489,regional.address,geocode,,,,[],[]
pozitiv,"Pohled do dvora domu čp. 177 (""Malvazinka"") na Smíchově.",23.2.1927,60x,A0C505A7B67611DF820F00166F1163D4,I 8258,1927-02-23,1927-02-23,14.3937,50.06407,regional.address,geocode,"Alexander, Antonín (1892-působnost do 1948)",,,[],[]
pozitiv,"Pohled do ulice Na Poříčí s domem čp. 1045 ""U Zlatého slunce"" na Novém Městě.",15.1.1913,40x,A14CEB25B67611DF820F00166F1163D4,VI 48/29,1913-01-15,1913-01-15,14.43323,50.0897,regional.address,geocode,,,,[],[]
pozitiv,Pohled do interiéru kostela sv. Cyrila a Metoděje v Resslově ulici na Novém Městě - nástěnné malby objevené při oltáři.,27.9.1934,22x,5a9108a8a94e41d59db616541f737f97,A 9060,1934-09-27,1934-09-27,14.41762,50.07596,regional.address,geocode,"Alexander, Antonín (1892-působnost do 1948)",,0.0,[],[]
pozitiv,"Pohled na portál domu čp. 108 (""Šlikovský"") na Loretánském náměstí na Hradčanech.",3.7.1906,18x,A0C4FF68B67611DF820F00166F1163D4,VI 24/19,1906-07-03,1906-07-03,14.39152,50.08817,regional.address,geocode,,,,[],[]
negativ,Pohled na dům čp. 255 v Josefově na nároží ulic Rabínské a U Starého hřbitova krátce před zbořením.,20.1.1907,76x,A14CDD03B67611DF820F00166F1163D4,VIII 837,1907-01-20,1907-01-20,14.41826,50.08957,regional.address,geocode,Eckert-ateliér,,,[],[]
pozitiv,Pohled z břehu v Hlubočepích přes Vltavu na Braník s kostelem sv. Prokopa. Součást panoramatu.,28.7.1934,46x,A0C513BBB67611DF820F00166F1163D4,I 8846,1934-07-28,1934-07-28,14.41322,50.03797,regional.street,suggest,"Alexander, Antonín (1892-působnost do 1948)",,,[],[]
negativ,1. světová válka - prodej zeleniny před Staroměstskou radnicí.,1917,34x,58FCA02FA3AE11E3A35E0024BE7CD9AC,XI 4144,1917-01-01,1917-12-31,14.41994,50.08663,regional.address,geocode,,,0.0,[],[]
pozitiv,Celkový pohled na Králodvorská kasárna (dům čp. 654 - kadetní škola) na Josefském náměstí (náměstí Republiky). Vlevo část Prašné brány a kostela sv. Vojtěcha na Starém Městě.,kol.1895,106x,C14C824301A211E28D106C626D41E503,VI 2/48,1895-01-01,1895-12-31,14.42573,50.08795,regional.address,geocode,"Eckert, Jindřich (1833-1905)",,,[],[]
negativ,Pohled na závěr Karlova mostu s Malostranskými mostními věžemi.,kol.1890,38x,2EE020B1A2A411E293F36C626D41E503,XII 1719,1890-01-01,1890-12-31,14.40684,50.08724,poi,suggest,,,0.0,[],[]
pozitiv,Pohled na budova kina (dům čp. 1662) v Burešově ulici v Kobylisích.,1984,118x,0E441E5436DD11E79F33406186009F3A,I 11959,1984-01-01,1984-12-31,14.47037,50.12712,regional.address,geocode,"Jelínková, Jana (1951-)",,,[],[]
negativ,"Pohled na Staroměstské náměstí od Malého náměstí k východu. Zleva jižní část Staroměstské radnice s věží, orlojem a portálem (dům čp. 1 na Starém Městě), domy čp. 604, 603 na Starém Městě, nad nimi kostel P. Marie před Týnem. Vpravo domy jižní části náměstí.",kol.1890,33x,A14CE757B67611DF820F00166F1163D4,VIII 1070,1890-01-01,1890-12-31,14.42009,50.087,regional.address,suggest,"Eckert, Jindřich (1833-1905)",,,[],[]
negativ,Pohled do interiéru zámku Kysibl ve Stružné.,kol.1885,8x,E46E36DD362A11E1BECE000C766D2371,XII 451,1885-01-01,1885-12-31,14.55548,50.08221,regional.address,geocode,"Eckert, Jindřich (1833-1905)",,0.0,[],[]
negativ,Celkový pohled na pomník Vítězslava Hálka s kašnou na Karlově náměstí.,kol.1890,50x,A0C502DCB67611DF820F00166F1163D4,VIII 132,1890-01-01,1890-12-31,14.42112,50.07643,regional.address,geocode,"Eckert, Jindřich (1833-1905)",,,[],[]
negativ,Celkový pohled na hlavní průčelí domu čp. 283 v Karlíně (divadlo) v Palackého ulici (dnes Křižíkova). V pozadí vlevo část viaduktu.,kol.1900,65x,276EF61F310C11E9978874D435EEBE90,IX 327 b,1900-01-01,1900-12-31,14.44123,50.09021,regional.address,geocode,Bellmann-ateliér,,,[],[]
pozitiv,Reprodukce skicy nástěnné malby (č. 10) v interiéru Černínského paláce (dům čp. 101 na Hradčanech).,1891,25x,95EE1980DC5111DFBD60000C766D2371,VI 54/1 b,1891-01-01,1891-12-31,14.39071,50.08877,regional.address,geocode,"Eckert, Jindřich (1833-1905)",,,[],[]
pozitiv,Sovětští vojáci v ulici Na Příkopě před křižovatkou s Václavským náměstím v srpnu 1968 - pohled z okna.,srpen 1968,73x,E131526D2BB911E5A58874D435EEBE90,I 11236,1968-08-01,1968-08-31,14.42346,50.08434,regional.address,geocode,"Šubrtová, M. (?)",,,[],[]
pozitiv,Celkový pohled na budovu Hypotéční banky Království českého na Senovážném náměstí (dům čp. 991) na Novém Městě.,kol.1895,53x,A14CDD29B67611DF820F00166F1163D4,VI 7/53,1895-01-01,1895-12-31,14.43385,50.08625,regional.address,geocode,"Eckert, Jindřich (1833-1905)",,,[],[]
negativ,Pohled do interiéru Živnostenské banky (dům čp. 862) v ulici Na Příkopě na Novém Městě - hala s přepážkami (světlík).,9.4.1902,23x,7B7CD28E824C11E2BF1E525400E46D25,VIII 1301,1902-04-09,1902-04-09,14.42801,50.08681,regional.address,geocode,"Eckert, Jindřich (1833-1905)",,,[],[]
pozitiv,"Pohled na Ovocný trh. V pozadí Tylovo divadlo (dům čp. 540). Vlevo domy čp. 587, 573, 574, 575, 576 na Starém Městě.",1.5.1928,66x,A0C4FF42B67611DF820F00166F1163D4,I 4409,1928-05-01,1928-05-01,14.42349,50.08599,regional.address,geocode,"Alexander, Antonín (1892-působnost do 1948)",,,[],[]
negativ,"Pohled od domu čp. 1012 (kavárna Slavie) na Národní třídu, vlevo budova Akademie věd ČR (dům čp. 1009 na Starém Městě), vpravo dům čp. 139 na Novém Městě, kostel sv. Voršily a stavba Nové scény ND (dům čp. 1393 na Novém Městě).",kol.1977,95x,A0C4F477B67611DF820F00166F1163D4,VII 340,1977-01-01,1977-12-31,14.41423,50.08154,regional.address,geocode,"Chalupníček, Miroslav -, Chalupníčková, Věra (dokument 1941-1948)",,,[],[]
pozitiv,Celkový pohled z Karlova mostu na severovýchodní průčelí domu čp. 506 (Lichtenštejnský palác) na Kampě na Malé Straně.,kol.1940,47x,A1188646B67611DF820F00166F1163D4,I 9047,1940-01-01,1940-12-31,14.40853,50.08554,regional.address,geocode,,,,[],[]
pozitiv,Průhled Mosteckou ulicí. V pozadí kostel sv. Mikuláše na Malé Straně.,kol.1900,37x,A118799AB67611DF820F00166F1163D4,II 107,1900-01-01,1900-12-31,14.40702,50.08714,regional.address,geocode,,,,[],[]
negativ,Obecní zásobárna petroleje u mostu císaře Františka Josefa I.,1915,41x,6552D102CC9711E89DA974D435EEBE90,XI 3737,1915-01-01,1915-12-31,14.42709,50.09385,regional.street,suggest,"Kříženecký, Jan (1868-1921)",,0.0,[],[]
negativ,"Pohled od Smíchova na Vyšehradskou skálu s pevností, s Libušinou lázní a s kostelem sv. Petra a Pavla před přestavbou. Vlevo část dnešního Rašínova nábřeží.",kol.1890,49x,3F41715D3B8311EABE1574D435EEBE90,IX 3289,1890-01-01,1890-12-31,14.4233,50.06216,regional.address,geocode,,,,[],[]
pozitiv,Panoramatický pohled na úval Prokopského potoka a Butovické hradiště na skále ze stanoviště nad tehdejší osadou Nová Ves (Jinonice). První část třídílného panoramatu.,20.7.1925,18x,cc52785a5ea0473b9447d00e60856dda,A 1960,1925-07-20,1925-07-20,14.35383,50.04168,regional.address,geocode,"Alexander, Antonín (1892-působnost do 1948)","On-line výstava na webu AMP ""Pražské panorama 2. část - Prokopské a Dalejské údolí"".
                    
                
                    
                  Součást panoramatu A 1960, A 1961, A 1962.
                    
                
                    
                  List 20a bod 26
                    
                
                    
                  Plány sign. AMP XXXII.",0.0,[],[]
,"Pohled na část domu čp. 175 (""U zlaté studny"") na nároží ulic Karlovy a Seminářské na Starém Městě.",,18x,A11875A9B67611DF820F00166F1163D4,VI 1/8 b,,,14.41701,50.08605,regional.address,geocode,,,,[],[]
pozitiv,Nákres kovaných mřížových dveří v kapli sv. Barbory na Hradčanech.,1901,14x,A1186C96B67611DF820F00166F1163D4,VI 32/27 b,1901-01-01,1901-12-31,14.4006,50.09089,poi,suggest,"Němec, V.",,,[],[]
pozitiv,"Pohled na zvony a cymbály ve sběrně kovů na Maninách, kde byly za okupace uloženy.",1945,10x,AD05D9C91C8611E8804174D435EEBE90,II 1689,1945-01-01,1945-12-31,14.45689,50.10287,regional.address,geocode,"Sudek, Josef (1896-1976)",,,[],[]
pozitiv,"Pohled na průčelí domů čp. 606, 609 a 608 na Staroměstském náměstí na Starém Městě.",1901,37x,0C9C4A72E2B911E4B65C0024BE7CD9AC,V 6/3,1901-01-01,1901-12-31,14.42162,50.08786,regional.address,geocode,"Dvořák, František (dokumenty 1901-1908)",,,[],[]
pozitiv,"Pohled na portál domu čp. 467 (""U Jonáků"") v Nosticově ulici na Malé Straně.",24.6.1906,17x,A118829CB67611DF820F00166F1163D4,VI 23/19,1906-06-24,1906-06-24,14.40624,50.08478,regional.address,geocode,,,,[],[]
pozitiv,Pohled na pavilon Vojtěška nad studánkou v zahradě Břevnovského kláštera.,1996,37x,A1188280B67611DF820F00166F1163D4,V 137/8,1996-01-01,1996-12-31,14.35747,50.08511,regional.address,geocode,"Lašťovka, Marek","Lašťovka, Marek - Landergott, Josef (repro)",,[],[]
pozitiv,Celkový pohled na mariánský sloup na Staroměstském náměstí před ústím Celetné ulice.,kol.1890,74x,A0C50420B67611DF820F00166F1163D4,II 171,1890-01-01,1890-12-31,14.4219,50.08718,regional.address,geocode,,,,[],[]
pozitiv,Pohled na dům čp. 840 Na nábřeží na Františku při bourání. Za ním kostel sv. Salvátora - součást Anežského kláštera na Starém Městě.,1958,84x,A0C4FB84B67611DF820F00166F1163D4,I 859,1958-01-01,1958-12-31,14.42404,50.09215,regional.address,geocode,"Roleček, Jiří",,,[],[]
pozitiv,Pohled z okraje modřínového lesa nad Sklenářkou (dům čp. 60) na oblast Troje. Součást čtyřdílného panoramatu.,9.9.1923,18x,95d81c30f72443ae99bad58aaa8da3c4,A 836,1923-09-09,1923-09-09,14.40628,50.12116,regional.address,geocode,"Alexander, Antonín (1892-působnost do 1948)",,0.0,[],[]
pozitiv,Pohled do dvora domu čp. 404 v Rytířské ulici na Starém Městě (Stará rychta).,2.5.1913,9x,A14CE8F7B67611DF820F00166F1163D4,VI 47/19 a,1913-05-02,1913-05-02,14.43581,50.03852,regional.address,geocode,,,,[],[]
negativ,Pohled na stavbu zdi na Klárově u domu čp. 131 (Klárův ústav slepců) na Malé Straně.,30.8.1907,36x,E62BEE010E3311E2935B6C626D41E503,XII 1085,1907-08-30,1907-08-30,14.40367,50.08755,poi,suggest,Eckert-ateliér,,0.0,[],[]
pozitiv,Pohled na nápisy v prvním patře na průčelí domu čp. 346 na Starém Městě.,1910,14x,E4717CE3CBE311E4AB2C406186009F3A,V 5/5 b,1910-01-01,1910-12-31,14.41862,50.08307,regional.address,geocode,"Kříženecký, Jan (1868-1921)",,,[],[]
negativ,Pohled na Čertovku na Kampě na Malé Straně.,kol.1910,49x,6455B2C90A2511E1BEC1000C766D2371,XII 375,1910-01-01,1910-12-31,14.40801,50.08587,regional.address,geocode,Eckert-ateliér,,0.0,[],[]
pozitiv,Pražské typy - houslista Rath v Hlavsově ulici na Starém Městě.,,25x,A0C510AAB67611DF820F00166F1163D4,I 8607,,,14.41971,50.08587,regional.street,suggest,,,,[],[]
pozitiv,Pohled do interiéru arkýřové kaple Staroměstské radnice (dům čp. 1 na Starém Městě) - před oltářem věnce se stuhami.,,37x,A14CEA0EB67611DF820F00166F1163D4,VI 42/9 c,,,14.42009,50.087,regional.address,suggest,,,,[],[]
pozitiv,"Dům čp. 292 na Novém Městě (""Černý pivovar"") na Karlově náměstí - malba nad dveřmi.",kol.1930,20x,A0C51658B67611DF820F00166F1163D4,IV 40/6,1930-01-01,1930-12-31,14.41912,50.0768,regional.address,geocode,,,,[],[]
pozitiv,Pohled na detail hlavního schodiště Trojského zámku (dům čp. 1 v Troji).,,22x,A14CEA16B67611DF820F00166F1163D4,VI 51/8,,,14.4124,50.11648,regional.address,geocode,,,,[],[]
pozitiv,Celkový pohled na dům čp. 633 na nároží ulic Štupartské a Týnské (vpravo) na Starém Městě.,23.6.1935,40x,A504DF29157311E39CC26C626D41E503,I 9780,1935-06-23,1935-06-23,14.42413,50.08877,regional.address,geocode,"Alexander, Antonín (1892-působnost do 1948)",,,[],[]
pozitiv,Pohled na průčelí kaple Nejsvětější Trojice v Sedlci.,21.6.1908,33x,A1186D49B67611DF820F00166F1163D4,VI 33/3 b,1908-06-21,1908-06-21,14.39198,50.13217,poi,suggest,,,,[],[]
pozitiv,Pohled do dvora domu čp. 490 (palác Metychů z Čečova - Hrzánský) na Velkopřevorském náměstí na Malé Straně s pavlačemi.,1925,35x,30A4F0E805B811E389696C626D41E503,I 9763,1925-01-01,1925-12-31,14.40739,50.08615,regional.address,geocode,"Vojta, Tomáš (1885-1934)",,,[],[]
pozitiv,Pohled na dům čp. 144 v ulici Na dědince v Libni.,1975,63x,A1188ABCB67611DF820F00166F1163D4,V 147/11,1975-01-01,1975-12-31,14.47236,50.11508,regional.address,geocode,"Michálek, Ladislav",,,[],[]
pozitiv,"Panoramatický pohled na Kobylisy a Troju od štěrkovny - jihovýchodně a jižně od Čimického háje přes vltavské údolí (od severovýchodu přes východ, jih k západu). Součást šestidílného panoramatu.",18.7.1926,45x,e8d3771dbea54b8582a67ff199e5e549,A 2553,1926-07-18,1926-07-18,14.43758,50.12891,poi,suggest,"Alexander, Antonín (1892-působnost do 1948)",,0.0,[],[]
pozitiv,Pohled ze Smetanova nábřeží (dnešního) přes Vltavu na Kampu. V pozadí Petřín s rozhlednou. Návrh na úpravu domů na Malé Straně - zákresy do Bellmannovy fotografie.,,54x,C284E77EDB6111DFBD5E000C766D2371,VI 49/1 c,,,14.41321,50.08173,regional.address,geocode,"Bellmann, Karel",,,[],[]
pozitiv,Pohled na náves v Hloubětíně (dnes náměstí Ve Starém Hloubětíně) od rybníka k severu. V pozadí uprostřed dům čp. 1 (zájezdní hostinec).,30.3.1930,45x,AB37858B6EEC11E88F4674D435EEBE90,A 5600,1930-03-30,1930-03-30,14.54392,50.10747,regional.address,geocode,"Alexander, Antonín (1892-působnost do 1948)",,0.0,[],[]
negativ,Císař František Josef I. při slavnosti posvěcení závěrného kamene píliře Čechova mostu. V pozadí letenský svah.,17.4.1907,42x,78845D1E121F11E28E4C6C626D41E503,XII 1118,1907-04-17,1907-04-17,14.4171,50.093,regional.street,suggest,Eckert-ateliér,,0.0,[],[]
negativ,Pohled do interiéru chudobince u sv. Bartoloměje (dům čp. 427 na Novém Městě) - kuchyň.,kol.1890,50x,F897899EA41D11E1BEEB000C766D2371,VIII 1123,1890-01-01,1890-12-31,14.41883,50.06985,regional.address,geocode,"Eckert, Jindřich (1833-1905)",,,[],[]
negativ,Pohled do interiéru elektrárny na Karlově na Novém Městě.,1900-1901,21x,4669C7288D5E11E2BF25525400E46D25,VIII 1432,1900-01-01,1901-12-31,14.42886,50.07061,regional.address,geocode,"Eckert, Jindřich (1833-1905)",,,[],[]
pozitiv,Pohled na dům čp. 86 v ulici Havlovického v Hodkovičkách. V pozadí dům čp. 95.,,28x,7651CD6DD1B311E69F29406186009F3A,I 12167,,,14.42142,50.02285,regional.address,geocode,,,,[],[]
negativ,"Pohled na hradby před Strahovským klášterem. Vlevo budova kasáren v ulici Dlabačov (dům čp. 120 na Hradčanech) a bývalá vojenská strážnice (""Budka"") při bourání.",kol.1900,47x,A1188218B67611DF820F00166F1163D4,VIII 997,1900-01-01,1900-12-31,14.38561,50.08749,regional.address,geocode,"Eckert, Jindřich (1833-1905)",,,[],[]
pozitiv,Pohled na gotický strop nalezený při bourání domu čp. 16 na Starém Městě (Andělská kolej) v Mikulášské ulici (dnes náměstí Franze Kafky).,22.2.1909,30x,749F00AB808C11E4AAB4406186009F3A,V 1/10,1909-02-22,1909-02-22,14.41873,50.08783,regional.address,geocode,"Kříženecký, Jan (1868-1921)",,,[],[]
negativ,"Pohled do Dlouhé ulice s domy čp. 744 (část), čp. 743 (""U Zlaté lodě"") na Starém Městě před zbořením v roce 1902.",1901,29x,A0C4F969B67611DF820F00166F1163D4,VIII 574,1901-01-01,1901-12-31,14.4269,50.09079,regional.address,geocode,"Eckert, Jindřich (1833-1905)",,,[],[]
negativ,Pohled na nástropní fresku kostela sv. Františka Serafinského na Křižovnickém náměstí na Starém Městě - detail.,27.6.-16.7.1903,18x,CC4AC58C0BC711E2AEA36C626D41E503,XII 934,,,14.41405,50.08641,regional.address,geocode,"Eckert, Jindřich (1833-1905)",,0.0,[],[]
pozitiv,"Pohled na kapličku č. 4 poutní cesty do Hájku v Břevnově severovýchodně od usedlosti Ladronka s obrazem ""Anděl snáší dítě, Pannu Marii, sv. Anně"".",2.4.1923,85x,0A71920BB9ED11E59D58406186009F3A,I 11388,1923-04-02,1923-04-02,14.37316,50.08036,regional.address,geocode,"Bernau, Karel, Ing. (1880-1948)",,,[],[]
pozitiv,"Pohled na severozápadní stranu Staroměstského náměstí s domy (zleva) čp. 1 (Staroměstská radnice), čp. 936 (Krenův dům), čp. 934 na Starém Městě a vlevo mariánský sloup.",18.4.1901,68x,A0C50369B67611DF820F00166F1163D4,VI 2/45 c,1901-04-18,1901-04-18,14.42009,50.087,regional.address,suggest,"Eckert, Jindřich (1833-1905)",,,[],[]
negativ,Panoramatický pohled na Malešice z Žernovské ulice ve starých Strašnicích. Třetí část pětidílného panoramatu.,kol.1955,58x,A14CDD27B67611DF820F00166F1163D4,VII 248,1955-01-01,1955-12-31,14.50217,50.06619,regional.address,geocode,"Chalupníček, Miroslav -, Chalupníčková, Věra (dokument 1941-1948)",,,[],[]
pozitiv,"Průhled ulicí V Olšinách ve Strašnicích k východu na stodoly statku čp. 20 (vpravo), vlevo stará obecní sýpka a nad ní škola čp. 200.",14.9.1942,89x,639C7E2DC47311E78A03D4BED94BB14D,A 14610,1942-09-14,1942-09-14,14.48853,50.07004,regional.address,geocode,"Alexander, Antonín (1892-působnost do 1948)",,0.0,[],[]
negativ,Panoramatický pohled od Petřína na Nebozízku na Pražský hrad.,kol.1960,26x,A11875A7B67611DF820F00166F1163D4,VII 294,1960-01-01,1960-12-31,14.39885,50.0819,regional.address,geocode,"Chalupníček, Miroslav -, Chalupníčková, Věra (dokument 1941-1948)",,,[],[]
pozitiv,Pohled na území dnešní Proboštské ulice v Dejvicích. První část třídílného panoramatu A 559 - 561.,10.4.1924,9x,28be064ad6964e60aea4676374616ea1,A 559,1924-04-10,1924-04-10,14.37538,50.09767,regional.address,geocode,"Alexander, Antonín (1892-působnost do 1948)",,0.0,[],[]
negativ,Pohled do interiéru kostela sv. Mikuláše na Malé Straně - oltář sv. Ignáce.,11.12.1898,26x,A11889DAB67611DF820F00166F1163D4,VIII 555,1898-12-11,1898-12-11,14.40322,50.08798,poi,suggest,"Eckert, Jindřich (1833-1905)",,,[],[]
pozitiv,Pohled na nároží domu čp. 109 na Starém Městě při bourání. Domovní znamení U Bílého lva.,1908,54x,A1188BCDB67611DF820F00166F1163D4,VI 1/3,1908-01-01,1908-12-31,14.41868,50.08806,regional.address,geocode,,,,[],[]
pozitiv,"Průhled dnešní Hloubětínskou ulicí k návsi v Hloubětíně (dnes náměstí Ve Starém Hloubětíně) s rybníkem uprostřed. Vpravo dům čp. 20, v pozadí kostel sv. Jiří a zámek.",30.3.1930,51x,D00D43206EEA11E88F4674D435EEBE90,A 5598,1930-03-30,1930-03-30,14.53686,50.10361,regional.address,geocode,"Alexander, Antonín (1892-působnost do 1948)",,0.0,[],[]
pozitiv,Pohled na plastiku vázy v zahradě Trojského zámku (dům čp. 1 v Troji).,,25x,A14CE974B67611DF820F00166F1163D4,VI 41/45,,,14.4124,50.11648,regional.address,geocode,,,,[],[]
pozitiv,Pohled na smíchovskou stranu staré Újezdské brány na Malé Straně. Vlevo v pozadí chrám sv. Víta.,1862,83x,A14CEA9CB67611DF820F00166F1163D4,VI 62/7 a,1862-01-01,1862-12-31,14.40497,50.07961,regional.address,geocode,"Rupp, Wilhelm (1821-1893)",,,[],[]
pozitiv,Pohled na bagr při práci v prostoru stavby plavebních komor u ostrova Štvanice.,11.7.1910,31x,E112F627639211E6A553000C76270B94,I 11834,1910-07-11,1910-07-11,14.43872,50.09489,poi,suggest,,,,[],[]
pozitiv,Pohled do údolí Šárka pod Špičatými skalami.,2.9.1924,98x,D42C5999CC5211E69EB5406186009F3A,A 256,1924-09-02,1924-09-02,14.31872,50.09924,regional.address,geocode,"Alexander, Antonín (1892-působnost do 1948)",,0.0,[],[]
pozitiv,Pohled do interiéru kostela sv. Jiří na Pražském hradě na Hradčanech - vykopávky u severní stěny v hlavní lodi nad Helfenburským kůrem.,26.9.1899,16x,A14CEB1BB67611DF820F00166F1163D4,VI 63/22,1899-09-26,1899-09-26,14.42112,50.07643,regional.address,geocode,"Eckert, Jindřich (1833-1905)",,,[],[]
pozitiv,Pohled do Josefské ulice s domem čp. 34 na Malé Straně (Oettingenský - Lobkovický palác). V pozadí část kostela sv. Tomáše.,31.3.1914,25x,A0C505C3B67611DF820F00166F1163D4,II 1467,1914-03-31,1914-03-31,14.4058,50.08857,regional.address,geocode,"Kříženecký, Jan (1868-1921)",,,[],[]
pozitiv,Reprodukce plánu: Kostel sv. Jiří na Pražském hradě na Hradčanech - průčelí kostela a části kláštera na náměstí sv. Jiří podle plánů K. Brouska z roku 1879.,kol.1900,15x,A14CEB01B67611DF820F00166F1163D4,VI 63/8,1900-01-01,1900-12-31,14.40231,50.09093,regional.address,geocode,"Eckert, Jindřich (1833-1905)",,,[],[]
negativ,Průhled Václavským náměstím od Můstku k Muzeu.,29.4.1906,30x,A14CE773B67611DF820F00166F1163D4,VIII 900,1906-04-29,1906-04-29,14.42863,50.08014,regional.address,geocode,Eckert-ateliér,,,[],[]
negativ,Pohled na střechy Starého Města z věže kostela P. Marie před Týnem. V pozadí Letná s vodárenskou věží.,1.6.1904,45x,A0C4F5F4B67611DF820F00166F1163D4,VIII 191,1904-06-01,1904-06-01,14.42203,50.08761,regional.address,geocode,"Eckert, Jindřich (1833-1905)",,,[],[]
pozitiv,Pohled na poškozenou Herkulovu (?) sochu na nádvoří domu čp. 506 (Lichtenštejnský palác) na Malé Straně.,24.11.1938,20x,A0C51208B67611DF820F00166F1163D4,I 9045,1938-11-24,1938-11-24,14.40853,50.08554,regional.address,geocode,"Alexander, Antonín (1892-působnost do 1948)",,,[],[]
pozitiv,Pohled na malovaný strop domu čp. 889 na Starém Městě.,1911,15x,EBACAA429A7911E4A736406186009F3A,V 2/26 b,1911-01-01,1911-12-31,14.42521,50.08513,regional.address,geocode,,,,[],[]
negativ,"Pohled na ústí Pařížské ulice na Staroměstské náměstí. Vpravo dům čp. 934 na Starém Městě, vlevo kostel sv. Mikuláše pozadí. První část šestidílného panoramatu.",25.4.1909,47x,E36233C924AA11E9B9F9406186009F3A,XI 1046,1909-04-25,1909-04-25,14.42047,50.08805,regional.address,geocode,"Kříženecký, Jan (1868-1921)",,0.0,[],[]
pozitiv,Pohled na zmenšený model kostela sv. Jindřicha na Novém Městě.,1914,33x,A11887E5B67611DF820F00166F1163D4,VI 30/16 a,1914-01-01,1914-12-31,14.42837,50.08378,regional.address,geocode,Eckert,,,[],[]
pozitiv,"Pohled na vstupní portál domu čp. 598 (""Dům u zlatého jelena"") v Celetné ulici na Starém Městě.",27.6.1906,22x,A11872E0B67611DF820F00166F1163D4,VI 16/31 a,1906-06-27,1906-06-27,14.42369,50.08722,regional.address,geocode,,,,[],[]
negativ,Pohled přes Vltavu na svah Letné s Hanavským pavilonem (dům čp. 175 v Holešovicích). Vpravo část Občanské plovárny (dům čp. 337 v Holešovicích).,kol.1900,77x,A1186C98B67611DF820F00166F1163D4,VIII 236,1900-01-01,1900-12-31,14.41138,50.09203,regional.address,geocode,"Eckert, Jindřich (1833-1905)",,,[],[]
pozitiv,Pohled do Malé Fürstenberské zahrady na Malé Straně s pavilonem a s terasami.,kol.1900,29x,A14CE8F9B67611DF820F00166F1163D4,VI 8/13 a,1900-01-01,1900-12-31,14.4062,50.09097,regional.address,geocode,"Eckert, Jindřich (1833-1905)",,,[],[]
negativ,"Pohled do velké (""Nové"") zasedací síně Staroměstské radnice (dům čp. 1 na Starém Městě).",kol.1890,23x,A14CDC7CB67611DF820F00166F1163D4,VIII 1071,1890-01-01,1890-12-31,14.42009,50.087,regional.address,suggest,"Eckert, Jindřich (1833-1905)",,,[],[]
pozitiv,"Pohled na Malou Stranu od Černé Věže. V popředí vlevo Staré zámecké schody, vpravo Fürstenberská (Velká) zahrada. V pozadí Staré Město.",kol.1910,72x,A1188551B67611DF820F00166F1163D4,I 840,1910-01-01,1910-12-31,14.40835,50.09249,regional.address,geocode,"Fink, František (1854-1935)",,,[],[]
pozitiv,Pohled na starý Helmovský jez s dělníky přenášející vory. V pozadí most císaře Františka Josefa I. a rozestavěná nová vorová propust.,16.9.1908,57x,B6F7DBCF5E1111E6A550000C76270B94,I 11780,1908-09-16,1908-09-16,14.42709,50.09385,regional.street,suggest,,,,[],[]
negativ,Pohled na pobořený Karlův most po povodni 1890 z ostrůvku u Staroměstských mlýnů směrem k Malé Straně. V pozadí Pražský hrad s rozestavěným chrámem sv. Víta.,4.9.1890,96x,ED78A29B744A11E2A9206C626D41E503,X 9,1890-09-04,1890-09-04,14.4133,50.08541,regional.address,geocode,"Reach, Zikmund (1859-1935)",,,[],[]
pozitiv,"Dům čp. 292 na Novém Městě (""Černý pivovar"") na Karlově náměstí - krov a zbytky pivovarského zařízení.",kol.1930,18x,A1187B7BB67611DF820F00166F1163D4,IV 40/13,1930-01-01,1930-12-31,14.41912,50.0768,regional.address,geocode,,,,[],[]
pozitiv,Pohled na podstavec pomníku M. Jana Husa - stav prací na podzim 1913. V pozadí část východního křídla Staroměstské radnice.,podzim 1913,29x,A11869F8B67611DF820F00166F1163D4,I 8887,,,14.41994,50.08663,regional.address,geocode,,,,[],[]
pozitiv,Pohled na stavbu ústřední elektrárny v Holešovicích (dům čp. 1).,1899,66x,A1187914B67611DF820F00166F1163D4,VI 75/28,1899-01-01,1899-12-31,14.43637,50.10853,regional.address,geocode,Fischer?,,,[],[]
negativ,Pohled do interiéru domu čp. 216 (Obecná a měšťanská dívčí škola u sv. Vojtěcha) na Novém Městě - obecní zásobárna za 1. světové války.,1915,31x,01DB5E8123C611E4BF24406186009F3A,XI 3678,1915-01-01,1915-12-31,14.41497,50.07885,regional.address,geocode,,,0.0,[],[]
pozitiv,"Panoramatický pohled do Prokopského údolí ze stanoviště u kostela sv. Prokopa k západu. Vpravo, těsně pod cestou vedoucí ke kostelíku, stojí původní dřevěný kříž, postavený na paměť poustevny. Druhá část čtyřdílného panoramatu.",14.4.1926,7x,57c648b5487149bea15ae90e5cc5a9a9,A 2423,1926-04-14,1926-04-14,14.40444,50.08666,regional.street,suggest,"Alexander, Antonín (1892-působnost do 1948)","On-line výstava na webu AMP ""Pražské panorama 2. část - Prokopské a Dalejské údolí"".
                    
                
                    
                  Součást panoramatu A 2422, A 2423, A 2424, A 2425.
                    
                
                    
                  List 20a bod 16
                    
                
                    
                  Plány sign. AMP XXXII.",0.0,[],[]
pozitiv,Pohled na portál kláštera Na Slovanech (v Emauzích) - dům čp. 320 na Novém Městě.,15.5.1907,24x,A0C5092CB67611DF820F00166F1163D4,VI 30/10 c,1907-05-15,1907-05-15,14.41719,50.07215,regional.address,geocode,,,,[],[]
pozitiv,Celkový pohled na západní průčelí Černínského paláce (dům čp. 101) na Hradčanech přes Keplerovu ulici během restaurování objektu podle návrhu Pavla Janáka.,17.12.1930,76x,7A8C3CB057EF11E7A695406186009F3A,A 6463,1930-12-17,1930-12-17,14.39071,50.08877,regional.address,geocode,"Alexander, Antonín (1892-působnost do 1948)",,0.0,[],[]
pozitiv,"Pohled z Vyšehradu k Pražskému hradu. V popředí pivovar ""Libušinka"" čp. 48 v Libušině (Libušinské) ulici na Vyšehradě.",28.7.1906,35x,A14CEA18B67611DF820F00166F1163D4,VI 52/13 b,1906-07-28,1906-07-28,14.41594,50.06705,regional.address,geocode,Eckert-ateliér,,,[],[]
pozitiv,Pohled na část průčelí domu čp. 204 v Ludmilině ulici v Libni,1980,63x,A14CDAF4B67611DF820F00166F1163D4,V 147/6,1980-01-01,1980-12-31,14.47077,50.10526,regional.address,geocode,"Michálek, Ladislav",,,[],[]
negativ,Pohled do interiéru kostela Narození Páně na Hradčanech (Loreta) s varhanami - hlavní loď směrem ke kůru.,1917,20x,9D9FD811032211E293456C626D41E503,XII 627,1917-01-01,1917-12-31,14.39151,50.08925,regional.address,geocode,Eckert-ateliér,,0.0,[],[]
negativ,Pohled na dům čp. 339 na Novém Městě - Svatováclavské lázně krátce před zbořením (jižní a západní průčelí).,18.1.1908,43x,A0C5164EB67611DF820F00166F1163D4,VIII 64,1908-01-18,1908-01-18,14.41678,50.07444,regional.address,geocode,Eckert-ateliér,,,[],[]
pozitiv,Pohled na výtok levého turbínového potrubí (trumpety) hydroelektrárny Těšnov (dům čp. 1224 na Novém Městě). V pozadí železniční most mezi Rohanským ostrovem a nádražím na Těšnově.,12.4.1910,108x,F4DA2765638611E6A553000C76270B94,I 11827,1910-04-12,1910-04-12,14.43436,50.09335,regional.address,geocode,,,,[],[]
negativ,Pohled na část kostela sv. Salvátora v Dušní ulici na Starém Městě s věží.,,21x,A0C51851B67611DF820F00166F1163D4,VIII 760,,,14.42053,50.08904,regional.address,geocode,Eckert-ateliér,,,[],[]
pozitiv,Pohled na dům čp. 6 v Pražské ulici v Hostivaři.,1970,39x,A0C51290B67611DF820F00166F1163D4,I 9106,1970-01-01,1970-12-31,14.52306,50.05148,regional.address,geocode,"Vopravil, Josef (1902-1972)",,,[],[]
negativ,Pohled do interiérů Obecního domu (dm čp. 1090 na Starém Městě) - dvorana.,kol.1920,19x,D7BC3E4AF45911E7A828406186009F3A,XI 4002,1920-01-01,1920-12-31,14.29081,50.09402,regional.address,suggest,,,0.0,[],[]
pozitiv,Pohled na hotel Paříž (dům čp. 1080) - vchod z ulice U obecního domu na Starém Městě.,12.10.1944,16x,A0C4FDD8B67611DF820F00166F1163D4,I 4786,1944-10-12,1944-10-12,14.65102,50.17658,regional.address,geocode,"Alexander, Antonín (1892-působnost do 1948)",,,[],[]
negativ,První stráž členů Čs. obce střelecké na Pražském hradě.,říjen 1918,31x,04E2A9C747D711E49EB46C626D41E503,IX 3006,1918-10-01,1918-10-31,14.39534,50.08934,regional.address,geocode,,,,[],[]
negativ,Pohled na část jižního průčelí Staroměstské radnice s orlojem (dům čp. 1 na Starém Městě) na Staroměstském náměstí. V popředí stanice tramvaje č. 5.,,38x,6C10644290C311E8B3B474D435EEBE90,X 9668,,,14.41994,50.08663,regional.address,geocode,,,,[],[]
negativ,"Pohled do interiéru Šternberského paláce (Ernestinum - dům čp. 57 na Hradčanech) - živý obraz P. Marie, sv. Anny a dvou dětí.",1911,20x,C8EC20AF60AA11E293B96C626D41E503,XII 1303,1911-01-01,1911-12-31,14.39669,50.09028,regional.address,geocode,Eckert-ateliér,,0.0,[],[]
negativ,"Pohled na jižní stranu Staroměstského náměstí s domy čp. (zprava) 548, 549, 550, 551 a 552. Pátá část šestidílného panoramatu.",1909,28x,7A5E0C8C725B11E98754406186009F3A,XI 5240,1909-01-01,1909-12-31,14.42174,50.08677,regional.address,geocode,"Kříženecký, Jan (1868-1921)",,0.0,[],[]
pozitiv,"Panoramatický pohled na staré Dejvice z novostavby na rohu Podbabské silnice (dnes Jugoslávských partyzánů) a Bučkovy (dnes Rooseveltova) - na stráně Strakovky, Hanspaulky a kostela v Šárce (od jihu směrem k Růžku přes západ k severu). První část čtyřdílného panoramatu.",17.5.1925,137x,A1186875B67611DF820F00166F1163D4,I 4823,1925-05-17,1925-05-17,14.39664,50.10324,regional.address,geocode,"Alexander, Antonín (1892-působnost do 1948)",,,[],[]
mapa,"List 22 plánu Prahy a okolí z let 1910-1914 (nakreslené stavebním úřadem, vydané nákladem obce Pražské, reprodukce Unie v Praze) se zákresy stanovišť fotografů v rámci akce Památkového sboru fotografování pražských památek a panoramat periferních oblastí ve 20., 30. a 40. letech 20. století.",1910-1914 - 1923,403x,6424E0EC07F511E7A783406186009F3A,XXXII 1/22,,,14.45877,50.04974,regional.address,geocode,,,0.0,[],[]
pozitiv,Pohled na novostavbu Nové scény Národního divadla (dům čp. 1393 na Novém Městě) a na Národní divadlo (dům čp. 223 na Novém Městě).,1984,52x,A0C4FA93B67611DF820F00166F1163D4,II 1034,1984-01-01,1984-12-31,14.4148,50.08126,regional.address,geocode,"Doležal, Michal",,,[],[]
pozitiv,Pohled do interiéru domu čp. 216 (Obecná a měšťanská dívčí škola u sv. Vojtěcha) ve Vojtěšské ulici na Novém Městě - 1. obecná třída.,5.6.1907,31x,A0C50F83B67611DF820F00166F1163D4,V 11/10 a,1907-06-05,1907-06-05,14.41497,50.07885,regional.address,geocode,"Kříženecký, Jan (1868-1921)",,,[],[]
pozitiv,Pohled na Malé náměstí od ústí Linhartské ulice (vpravo) na Starém Městě k jihu.,kol.1915,41x,72D47D45157911E39CC26C626D41E503,I 9790,1915-01-01,1915-12-31,14.41979,50.08642,regional.address,geocode,"Reach, Zikmund (1859-1935)",,,[],[]
pozitiv,Celkový pohled na věž Mihulku (ve dvoře domu čp. 38 ve Vikářské ulici) na Pražském hradě.,před 1926,28x,F46188C12EC411E9B1A1406186009F3A,Voj 2814,1800-01-01,1925-12-31,14.40045,50.09117,regional.address,geocode,"Vojta, Tomáš (1885-1934)",,0.0,[],[]
pozitiv,Průhled Václavským náměstím od Národního muzea k Můstku.,kol.1905,135x,A0C50E1AB67611DF820F00166F1163D4,I 273,1905-01-01,1905-12-31,14.42863,50.08014,regional.address,geocode,,,,[],[]
pozitiv,Pohled na nouzové stavby v pískovně v Radimově ulici v Břevnově.,kol.1960,77x,A118818DB67611DF820F00166F1163D4,II 176,1960-01-01,1960-12-31,14.36088,50.08704,regional.address,geocode,"Dub, Václav (dokumenty 1928-1983)",,,[],[]
pozitiv,"Pohřeb Jana Zajíce - rakev, nad ní portrét.",únor 1969,36x,A118748AB67611DF820F00166F1163D4,I 1629,1969-02-01,1969-02-28,14.42784,50.08157,regional.address,geocode,,,0.0,[],[]
negativ,Celkový pohled na malostranskou sokolovnu (dům čp. 609 na Malé Straně) na svahu Petřína na Újezdě.,16.4.1912,40x,80CB0D5C662C11E2A1036C626D41E503,XII 1330,1912-04-16,1912-04-16,14.40334,50.08217,regional.address,geocode,Eckert-ateliér,,0.0,[],[]
pozitiv,Pohled na Smíchovskou arénu na Hořejším nábřeží u Vyšehradského železničního mostu.,kol.1935,199x,A1187492B67611DF820F00166F1163D4,I 1588,1935-01-01,1935-12-31,14.41041,50.07195,regional.address,geocode,"Posselt, Jan",,,[],[]
pozitiv,Pohled na archeologické vykopávky na Mariánském náměstí na Starém Městě.,1926-1927,21x,91855FD2332511E2BF04525400E46D25,I 9676,1926-01-01,1927-12-31,14.41739,50.08739,regional.address,geocode,"Pasternak, Jaroslav",,,[],[]
pozitiv,Socha Hvězdáře a archanděla Michaela z orloje v jižním průčelí Staroměstské radnice (dům čp. 1 na Starém Městě) na Staroměstském náměstí před restaurováním.,21.9.1911,42x,247A894590EB11E8B3B474D435EEBE90,V 69/15 e,1911-09-21,1911-09-21,14.42009,50.087,regional.address,suggest,"Kříženecký, Jan (1868-1921)",,,[],[]
pozitiv,Pohled na zajištění vodní jímky kolem jednoho z pilířů Negrelliho viaduktu během splavnění Vltavy u ostrova Štvanice.,17.8.1910,65x,F2337E61645311E6A554000C76270B94,I 11844,1910-08-17,1910-08-17,14.44069,50.09758,poi,suggest,,,,[],[]
CD-ROM,Pohled na Vltavu z oken údržby v areálu Trojského zámku při povodni 13.8.2002 dopoledne.,13.8.2002,7x,A11873B8B67611DF820F00166F1163D4,XXII 2/7 a,2002-08-13,2002-08-13,14.41109,50.11489,regional.address,geocode,"Malec, Milan - Malcová, Alena",,0.0,[],[]
pozitiv,Bruslení na Vltavě mezi Karlovým a Mánesovým mostem. V pozadí Pražský hrad.,22.12.1941,46x,A0C5136CB67611DF820F00166F1163D4,I 4228,1941-12-22,1941-12-22,14.41429,50.08809,regional.address,geocode,"Zeman, Josef",,,[],[]
pozitiv,Pohled z Letenské ulice na osvětlený Pražský hrad při příležitosti 10. výročí samostatnosti Československé republiky. V popředí neosvětlený dům čp. 121 na Malé Straně.,28.10.1928,50x,F03A042A205F11E88E87406186009F3A,I 12059,1928-10-28,1928-10-28,14.40828,50.09013,regional.address,geocode,"Vopravil, Josef (1902-1972)",,,[],[]
pozitiv,"Pohled od Vltavy na Barrandovskou skálu s plovárnou a restaurací. Na Barrandovské skále nápis ""BARRANDOV"".",28.7.1934,127x,A0C4FFB9B67611DF820F00166F1163D4,I 4576,1934-07-28,1934-07-28,14.40233,50.03758,regional.address,geocode,"Alexander, Antonín (1892-působnost do 1948)",,,[],[]
pozitiv,Celkový pohled na Prašnou bránu z Hybernské ulice před přestavbou.,1867-1870,211x,A0C50AC9B67611DF820F00166F1163D4,I 60,1867-01-01,1870-12-31,14.43085,50.08731,regional.address,geocode,,,,[],[]
pozitiv,Pohled do údolí Čimického potoka. Součást čtyřdílného panoramatu.,21.9.1924,31x,AD48BFDE456D11E99C7074D435EEBE90,A 1245,1924-09-21,1924-09-21,14.43565,50.13671,regional.address,geocode,"Alexander, Antonín (1892-působnost do 1948)",,0.0,[],[]
pozitiv,"Dům čp. 292 na Novém Městě (""Černý pivovar"") na Karlově náměstí - stropní malba v pokoji 1. poschodí.",kol.1930,22x,A118806DB67611DF820F00166F1163D4,IV 40/4,1930-01-01,1930-12-31,14.41912,50.0768,regional.address,geocode,,,,[],[]
pozitiv,Pohled do interiéru Průmyslového paláce na výstaviště v Bubenči - ze souboru stereofotografií Národopisné výstavy v roce 1895.,1895,65x,E344FC21476511E180176C626D41E503,I 9537,1895-01-01,1895-12-31,14.42967,50.10684,poi,suggest,,,,[],[]
pozitiv,Pohled do třídy nově postavené školy (dům čp. 460) na Lyčkově náměstí v Karlíně (dříve Riegrovy sady).,kol.1910,53x,A14CE9A1B67611DF820F00166F1163D4,VI 44/1 k,1910-01-01,1910-12-31,14.45836,50.09311,regional.address,geocode,,,,[],[]
pozitiv,Pohled na část domu čp. 55 na Malé Straně na nároží ulic Mostecké a Lázeňské.,19.1.1911,36x,A14CE7A6B67611DF820F00166F1163D4,II 1507,1911-01-19,1911-01-19,14.40648,50.08722,regional.address,geocode,"Kříženecký, Jan (1868-1921)",,,[],[]
negativ,Pohled na nároží Dušní a Bílkovy ulice s domem čp. 864 na Starém Městě před zbořením roku 1900.,1896-1897,35x,A1188730B67611DF820F00166F1163D4,VIII 210,1896-01-01,1897-12-31,14.42095,50.09122,regional.address,geocode,"Eckert, Jindřich (1833-1905)",,,[],[]
pozitiv,"Průhled Linhartskou ulicí s domy čp. 128, čp. 133, čp. 132 (zprava) na Starém Městě.",kol.1905,26x,7E800411266F11E6B917406186009F3A,F 23,1905-01-01,1905-12-31,14.37366,50.09637,regional.address,geocode,"Fink, František (1854-1935)",,0.0,[],[]
negativ,Pohled na domovní zástavbu v ulici V Cibulkách v Košířích.,kol. 1915,93x,42B53E4F7B0411E4A348406186009F3A,XI 684,,,14.36265,50.06568,regional.address,geocode,"Kříženecký, Jan (1868-1921)",,0.0,[],[]
negativ,Pohled na nástropní fresku Sv. Jana Evangelisty v kostele sv. Františka Serafinského na Křižovnickém náměstí na Starém Městě.,1904,19x,C678E9C1031D11E293456C626D41E503,XII 622,1904-01-01,1904-12-31,14.41405,50.08641,regional.address,geocode,"Eckert, Jindřich (1833-1905)",,0.0,[],[]
pozitiv,Celkový pohled na dům čp. 655 na Starém Městě (Ústav šlechtičen) v Revoluční třídě (Eliščině) směrem od náměstí Republiky (Josefské). Vpravo část domu čp. 1080 na Novém Městě.,,89x,178574C2161611E390486C626D41E503,I 9806,,,14.42827,50.08961,regional.address,geocode,Bellmann-ateliér,,,[],[]
pozitiv,Celkový pohled na kostel sv. Mikuláše na Starém Městě.,kol.1920,12x,3B295B91266E11E6B917406186009F3A,F 14,1920-01-01,1920-12-31,14.4199,50.08778,regional.address,geocode,"Fink, František (1854-1935)",,0.0,[],[]
pozitiv,Pohled na konečnou stanici autobusů v Dolních Měcholupech.,1978,61x,A0C5142DB67611DF820F00166F1163D4,I 4558,1978-01-01,1978-12-31,14.54791,50.06649,regional.address,geocode,"Hudeček, Jan",,,[],[]
negativ,Okno ve vlysu kostela sv. Mikuláše na Starém Městě.,20.4.1908,15x,F0AC24B29E3911E3B7D600110989F46F,XI 68,1908-04-20,1908-04-20,14.41994,50.08663,regional.address,geocode,"Kříženecký, Jan (1868-1921)",,0.0,[],[]
negativ,Děti z útulku v Břehové ulici v Josefově.,1908,19x,88FCA5486F0D11E4B6A20024BE7CD9AC,XI 627,1908-01-01,1908-12-31,14.41742,50.09096,regional.address,geocode,"Kříženecký, Jan (1868-1921)",,0.0,[],[]
pozitiv,Pohled na vstupní portál domu čp. 597 (Palác Millesimovský) v Celetné ulici na Starém Městě.,27.6.1906,17x,A11879FBB67611DF820F00166F1163D4,VI 18/24,1906-06-27,1906-06-27,14.42402,50.08722,regional.address,geocode,,,,[],[]
pozitiv,Pohled na náhrobky na bývalém vojenském hřbitově v Karlíně.,,109x,A11885C4B67611DF820F00166F1163D4,V 21/5 e,,,14.44168,50.09253,regional.address,geocode,,,,[],[]
negativ,Model komunikace na Letnou (pohled od Vltavy).,leden 1906,49x,30D1B1569FB411E38B756C626D41E503,XI 84,1906-01-01,1906-01-31,14.4171,50.093,regional.street,suggest,"Kříženecký, Jan (1868-1921)",,0.0,[],[]
negativ,Reprodukce detailního nákresu nového průčelí chrámu sv. Víta na Pražském hradě s podpisem autora Josefa Mockera.,[1863-1905],45x,2F375419070B11E286836C626D41E503,XII 648,,,14.4006,50.09089,poi,suggest,"Eckert, Jindřich (1833-1905)",Datace neznámá. Za účelem vyhledávání byla nastavena na časový rozsah celé sbírky.,0.0,[],[]
pozitiv,"Pohled (zleva) na průčelí domů čp. 510, 509, 508 na Malé Straně v ulici Na Kampě.",26.8.1907,662x,A0C509E5B67611DF820F00166F1163D4,I 4,1907-08-26,1907-08-26,14.40866,50.08594,regional.address,geocode,"Klíma, Alois, Ing. (1873-1955)",,,[],[]
pozitiv,"Pohled do Partyzánské (dříve Palackého) ulice. Zprava domy čp. 18, 17 (hostinec ""U zeleného stromu"") v Holešovicích.",únor 1959,104x,A14CE50AB67611DF820F00166F1163D4,I 851,1959-02-01,1959-02-28,14.43853,50.11156,regional.address,geocode,"Hnilička, Eduard (1887-1967)",,,[],[]
pozitiv,Částečný pohled na kostel sv. Vavřince na Petříně.,25.3.1931,33x,A0C50BCCB67611DF820F00166F1163D4,I 1716,1931-03-25,1931-03-25,14.39643,50.08301,regional.address,geocode,"Alexander, Antonín (1892-působnost do 1948)",,,[],[]
negativ,"Pohled do ulice U Staré školy. Uprostřed dům čp. 156 v Josefově, část Španělské synagogy čp. 141 v Josefově vpravo.",30.10.1909,5x,e33e3b788a174b3abaf2c203ea5f4701,XI 1783,1909-10-30,1909-10-30,14.41868,50.08806,regional.address,geocode,"Kříženecký, Jan (1868-1921)",,0.0,[],[]
pozitiv,"Průvod sokolů v Záhřebské (Klicperově) ulici. Pohled z křižovatky s Londýnskou (Hálkovou) na domy čp. zprava: 221, 532, 533, 534 na Vinohradech.",před 1907,36x,A1186DB2B67611DF820F00166F1163D4,I 9234,1800-01-01,1906-12-31,14.43559,50.07127,regional.address,geocode,,,,[],[]
pozitiv,Pohled na stavbu budovy Magistrátu hlavního města Prahy (dům čp. 2) na Mariánském náměstí na Starém Městě. V pozadí věž Staroměstské radnice.,,8x,6f1c1d118c35486c990baba828c9ea59,I 12895,,,14.41783,50.08711,regional.address,geocode,,,,[],[]
pozitiv,Pohled na vstupní portál domu čp. 858 v ulici Na Příkopě na Novém Městě.,kol.1905,30x,A1186DCAB67611DF820F00166F1163D4,VI 19/30,1905-01-01,1905-12-31,14.42743,50.08554,regional.address,geocode,,,,[],[]
pozitiv,Pohled na stavbu budovy Magistrátu hlavního města Prahy (dům čp. 2) na Mariánském náměstí na Starém Městě. V pozadí náměstí Franze Kafky.,1909,11x,3d8365d5afef49ab9b16fba8a45cb78f,I 12867,1909-01-01,1909-12-31,14.41783,50.08711,regional.address,geocode,,,,[],[]
pohlednice,Pohled na horní partii glorietu v Malé Fürstenberské zahradě na Malé Straně.,[1905-1934],52x,CA6D8AFE5A6011E7A69B406186009F3A,Voj 5934,,,14.4062,50.09097,regional.address,geocode,"Vojta, Tomáš (1885-1934)",Datace neznámá. Za účelem vyhledávání byla nastavena na časový rozsah celé sbírky.,0.0,[],[]
pozitiv,Pohled do dvora domu čp. 156 v Praze-Josefově.,1911,37x,FDCF85443E9E11E1B434000BCDD04BFA,V 15/17 a,1911-01-01,1911-12-31,14.41826,50.08957,regional.address,geocode,"Kříženecký, Jan (1868-1921)",,,[],[]
negativ,Pohled na parník zakotvený v novém Smíchovském přístavu u voroviště. V pozadí Vyšehradská skála.,,64x,A0C50848B67611DF820F00166F1163D4,X 483,,,14.41735,50.06113,regional.address,geocode,,,,[],[]
negativ,"Pohled do interiéru Staroměstské radnice (dům čp. 1 na Starém Městě) - velká (""Nová"") zasedací síň.",1885,36x,16B005C10D5911E295A66C626D41E503,XII 1024,1885-01-01,1885-12-31,14.34054,50.07267,regional.address,suggest,"Eckert, Jindřich (1833-1905)",,0.0,[],[]
negativ,Celkový pohled na hlavní průčelí kadetní školy čp. 221 na Hradčanech na Mariánské baště. V popředí kadeti při cvičení.,30.6.1911,32x,967CAB0F60A811E293B96C626D41E503,XII 1301,1911-06-30,1911-06-30,14.40328,50.09504,regional.address,geocode,Eckert-ateliér,,0.0,[],[]
pozitiv,Pohled na dům čp. 490 (palác Metychů z Čečova - Hrzánský) na Velkopřevorském náměstí na Malé Straně ze zahrady Velkopřevorského paláce (dům čp. 485 na Malé Straně).,kol.1910,35x,13BA8AEB04FB11E3A4F66C626D41E503,I 9746,1910-01-01,1910-12-31,14.40597,50.08626,regional.address,geocode,"Fink, František (1854-1935)",,,[],[]
pozitiv,Pohled na náhrobky starého obecního hřbitova v Braníku ve Vrbově ulici.,19.4.1933,32x,8b034c1868a74d7cbf4d0bce1c168a9b,A 7746,1933-04-19,1933-04-19,14.42527,50.03124,regional.address,geocode,"Alexander, Antonín (1892-působnost do 1948)",,0.0,[],[]
pozitiv,"Pohled na část domu čp. 642 s domovním znamením ""U černého medvěda"" na Starém Městě.",14.4.1909,15x,A1188429B67611DF820F00166F1163D4,VI 2/35,1909-04-14,1909-04-14,14.42384,50.0879,regional.address,geocode,,,,[],[]
negativ,Pohled do interiéru hradu Karlštejn - křídová kresba sv. Vojtěcha pod deskovým obrazem (N 25) na stěně kaple sv. Kříže.,30.8.1905,16x,84671FEE3DD911E0BDF1000C766D2371,XII 222,1905-08-30,1905-08-30,14.25487,49.94465,poi,suggest,Eckert-ateliér,,0.0,[],[]
negativ,Pohled přes Vltavu na Novotného lávku se staroměstskou vodárnou (dům čp. 201 na Starém Městě) a s vodárenskou věží. Vlevo část Karlova mostu.,1890-1891,49x,A1187C19B67611DF820F00166F1163D4,VIII 952,1890-01-01,1891-12-31,14.41294,50.08545,regional.address,geocode,"Eckert, Jindřich (1833-1905)",,,[],[]
pozitiv,"Pohled na dům čp. 897 na Novém Městě (""U Rajtknechtů"") na nároží ulic Jindřišské a Panské - průčelí do Jindřišské krátce před zbořením.",20.1.1907,48x,A14CE894B67611DF820F00166F1163D4,VI 7/48,1907-01-20,1907-01-20,14.42772,50.08394,regional.address,geocode,Eckert-ateliér,,,[],[]
pozitiv,Pohled na portál domu čp. 922 na Starém Městě.,1901,17x,17FB60FC9FBE11E4A5A7406186009F3A,V 2/39,1901-01-01,1901-12-31,14.42215,50.08953,regional.address,geocode,"Dvořák, František (dokumenty 1901-1908)",,,[],[]
pozitiv,"Pohled do pasáže domu čp. 371 (""Obchodní dům Perla"") v Perlové ulici na Starém Městě.",1988,36x,A0C50EF7B67611DF820F00166F1163D4,I 9183,1988-01-01,1988-12-31,14.42169,50.08331,regional.address,geocode,"Rameš, František",,,[],[]
pozitiv,Pohled do dvora domu čp. 39 s pavlačemi na Smíchově.,30.4.1948,47x,A14CE605B67611DF820F00166F1163D4,I 8712,1948-04-30,1948-04-30,14.38991,50.07207,regional.address,geocode,"Poustecký, Josef",,,[],[]
pozitiv,"Pohled na zahradu botanického ústavu Německé univerzity se skleníkem. V pozadí uprostřed dům čp. 1965. V pozadí vlevo část domu čp. 1594, vpravo kostel sv. Apolináře a část domu čp. 447 na Novém Městě.",kol.1905,116x,A0C50ABDB67611DF820F00166F1163D4,II 505,1905-01-01,1905-12-31,14.42441,50.07226,regional.address,geocode,,,,[],[]
negativ,Celkový pohled na budovu Hypotéční banky Království českého na Senovážném náměstí (dům čp. 991) na Novém Městě.,kol.1893,47x,A0C4FFCDB67611DF820F00166F1163D4,VIII 319,1893-01-01,1893-12-31,14.43385,50.08625,regional.address,geocode,"Eckert, Jindřich (1833-1905)",,,[],[]
pozitiv,Pohled na dřevěný kříž u mostu Barikádníků - provizorní pomník za padlé při pražském povstání. V pozadí nábřeží v Troji.,kol.1955,110x,A489D4D8273011E287E86C626D41E503,I 9656,1955-01-01,1955-12-31,14.44533,50.11349,regional.street,suggest,"Růžička, Jar.",,,[],[]
pozitiv,Stavba přístavu v Libni - pohled na nový přístav. V pozadí Voctářova ulice.,1895,102x,EDB685736D5B11E88D0474D435EEBE90,V 18/13 a,1895-01-01,1895-12-31,14.46997,50.1041,regional.address,geocode,,,0.0,[],[]
pozitiv,Pohled na nástropní malby v pokoji v 1. patře v domě 639 (Ungelt) na Starém Městě.,29.7.1935,22x,A11873CEB67611DF820F00166F1163D4,I 8377,1935-07-29,1935-07-29,14.42333,50.08809,regional.address,geocode,"Alexander, Antonín (1892-působnost do 1948)",,,[],[]
negativ,Meč sv. Štěpána v chrámu sv. Víta na Pražském hradě - rukojeť s poloviční střenkou.,kol.1900,22x,1F58696085AC11E2BF1F525400E46D25,VIII 1314,1900-01-01,1900-12-31,14.4006,50.09089,poi,suggest,"Eckert, Jindřich (1833-1905)",,,[],[]
negativ,Pohled od Střeleckého ostrova na Staroměstské mlýny s vodárenskou věží na Novotného lávce.,14.10.1907,74x,12966760DC0E11E3A3310024BE7CD9AC,XI 429,1907-10-14,1907-10-14,14.41294,50.08545,regional.address,geocode,"Kříženecký, Jan (1868-1921)",,0.0,[],[]
pozitiv,"Pohled přes Vltavu na klášter Křižovníků s červenou hvězdou (dům čp. 191 na Starém Městě). Vpravo část Karlova mostu s věží. Na nábřeží ""Obecní říčné lázně"".",26.8.1907,54x,A11873B6B67611DF820F00166F1163D4,VI 3/8,1907-08-26,1907-08-26,14.41406,50.08641,regional.address,geocode,"Klíma, Alois, Ing. (1873-1955)",,,[],[]
negativ,Pohled na vyobrazení měsíců Josefa Mánesa (znamení Váhy) na orloji Staroměstské radnice (dům čp. 1 na Starém Městě) na Staroměstském náměstí.,,20x,7DE6909990B811E8B3B474D435EEBE90,IX 395 b,,,14.42009,50.087,regional.address,suggest,,,,[],[]
pozitiv,Pohled na část Karlova mostu se Staroměstskou mosteckou věží. Vpravo pomník Karla IV. na Křižovnickém náměstí na Starém Městě.,kol.1885,78x,A0C4F889B67611DF820F00166F1163D4,II 976,1885-01-01,1885-12-31,14.41405,50.08641,regional.address,geocode,,,,[],[]
pozitiv,"Pohled do Josefovské ulice od křižovatky s Pinkasovou uličkou (vlevo). Uprostřed nárožní dům čp. 20 v Josefově. Zprava domy čp. 18, 19, 22, 25, 26... v Josefově.",10.3.1908,53x,097BFFA4155D11E39CC26C626D41E503,II 1584,1908-03-10,1908-03-10,14.4176,50.08846,regional.address,geocode,"Kříženecký, Jan (1868-1921)",,,[],[]
negativ,Celkový pohled na kostel sv. Rocha v areálu Olšanských hřbitovů na Žižkově.,[1863-1905],101x,3D60FBAC2AD911E0BDCF000C766D2371,XII 190,,,14.45891,50.08224,regional.address,geocode,"Eckert, Jindřich (1833-1905)",Datace neznámá. Za účelem vyhledávání byla nastavena na časový rozsah celé sbírky.,0.0,[],[]
negativ,Pohled na část orloje Staroměstské radnice (dům čp. 1 na Starém Městě) na Staroměstském náměstí při opravě.,kol.1910,22x,12B43AB590C811E8B3B474D435EEBE90,X 8777,1910-01-01,1910-12-31,14.42009,50.087,regional.address,suggest,,,,[],[]
pozitiv,Pohled do interiéru domu čp. 2 na Malé Straně - úřadovna vrchního zemského soudu (bývalá jezuitská kolej).,před 1926,32x,356283CAD51111E3AADC406186009F3A,I 10000,1800-01-01,1925-12-31,14.4032,50.08835,regional.address,geocode,"Vojta, Tomáš (1885-1934)",,,[],[]
negativ,Pohled na okna v zástřeší kostela sv. Mikuláše na Starém Městě.,září 1905,22x,F9ED5CE6739411E3B7C100110989F46F,XI 8,1905-09-01,1905-09-30,14.4199,50.08778,regional.address,geocode,"Kříženecký, Jan (1868-1921)",,0.0,[],[]
pozitiv,Pohled na převážení ostatků Karla Hynka Máchy na vyšehradský hřbitov - průvod s rakví na voze na Rašínově nábřeží před železničním mostem. V pozadí kostel sv. Petra a Pavla na Vyšehradě.,7.5.1939,128x,8AA6EAC3274B11E287E86C626D41E503,I 9663,1939-05-07,1939-05-07,14.41451,50.07097,regional.address,geocode,,,,[],[]
pozitiv,Pohled na původní vorovou propust Helmovského jezu. V pozadí most císaře Františka Josefa I.,25.11.1909,53x,F126B87D62AC11E6A552000C76270B94,I 11801,1909-11-25,1909-11-25,14.42709,50.09385,regional.street,suggest,,,,[],[]
pozitiv,Průhled Mosteckou ulicí. V pozadí kostel sv. Mikuláše na Malé Straně.,1905-1908,59x,A14CE7A8B67611DF820F00166F1163D4,I 9344,1905-01-01,1908-12-31,14.40702,50.08714,regional.address,geocode,"Fink, František (1854-1935)",,,[],[]
pozitiv,Pohled na portál kostela sv. Apolináře na Novém Městě.,17.8.1907,27x,A0C512F3B67611DF820F00166F1163D4,VI 30/20,1907-08-17,1907-08-17,14.42284,50.07067,regional.address,geocode,,,,[],[]
negativ,Pohled do interiéru Národního divadla - chodba před královskou lóží (dům čp. 223 na Novém Městě).,kol.1895,19x,8BAC427D0A2111E1BEC1000C766D2371,XII 364,1895-01-01,1895-12-31,14.41723,50.08595,regional.address,suggest,"Eckert, Jindřich (1833-1905)",,0.0,[],[]
pozitiv,Pohled na vzpěry při budování kanálů vedoucí k Šaškovým mlýnům na Těšnově.,11.11.1909,71x,43AE95B2651B11E6A555000C76270B94,I 11875,1909-11-11,1909-11-11,14.43633,50.09114,regional.address,geocode,,,,[],[]
negativ,"Mariánská výstava v Klementinu 9.8. - 3.10.1904 - obraz: Carlo Dolce, P. Marie s Ježíškem.",1904,28x,CC79C2E90CA011E2AEA36C626D41E503,XII 995,1904-01-01,1904-12-31,14.4172,50.08697,regional.address,geocode,"Eckert, Jindřich (1833-1905)",,0.0,[],[]
negativ,"Panoramatický pohled od Pražského hradu na centrum Prahy, v popředí zahrada Na valech, vpravo část Starého Města a Josefova.",kol.1955,37x,A11874F1B67611DF820F00166F1163D4,VII 291,1955-01-01,1955-12-31,14.40316,50.09058,poi,suggest,"Chalupníček, Miroslav -, Chalupníčková, Věra (dokument 1941-1948)",,,[],[]
negativ,Pohled na průčelí staroměstských masných krámů na nároží Štupartské a Masné ulice - čp. 956 (zbořeny ve 30. letech 20. století). Vpravo v pozadí Staroměstská obecná a měšťanská škola pro chlapce (dům čp. 977) na Starém Městě.,kol.1920,75x,A0C50FFCB67611DF820F00166F1163D4,X 2258,1920-01-01,1920-12-31,14.42578,50.08961,regional.address,geocode,,,,[],[]
pozitiv,Pohled na skalní útvary pískovcového vrchu Vidoule v Jinonicích - severní cíp východní strany s dřevěnou boudou.,15.6.1934,52x,A14CE802B67611DF820F00166F1163D4,I 9386,1934-06-15,1934-06-15,14.3252,50.05158,regional.address,geocode,"Alexander, Antonín (1892-působnost do 1948)",,,[],[]
negativ,Pohled do interiéru domu čp. 216 (Obecná a měšťanská dívčí škola u sv. Vojtěcha) na Novém Městě - sborovna.,1907,18x,279D224BB9A411E39F720024BE7CD9AC,XI 315,1907-01-01,1907-12-31,14.41497,50.07885,regional.address,geocode,"Kříženecký, Jan (1868-1921)",,0.0,[],[]
kresba,Detaily průčelí domu čp. 471 (Nostický palác) na Maltézském náměstí na Malé Straně.,1908,15x,A14CE81AB67611DF820F00166F1163D4,VI 59/4,1908-01-01,1908-12-31,14.40583,50.08546,regional.address,geocode,,,,[],[]
pozitiv,Pohled na Maltézské náměstí s domy čp. 477 a čp. 479 na Malé Straně. Vpravo sousoší sv. Jana Křtitele.,30.5.1907,24x,A0C5107DB67611DF820F00166F1163D4,VI 9/22,1907-05-30,1907-05-30,14.40512,50.08601,regional.address,geocode,"Klíma, Alois, Ing. (1873-1955)",,,[],[]
negativ,"Pohled do Podskalské ulice s domy čp. 336, 335, 334 na Novém Městě při bourání.",21.11.1908,35x,A0C51927B67611DF820F00166F1163D4,VIII 664,1908-11-21,1908-11-21,14.41506,50.07472,regional.address,geocode,Eckert-ateliér,,,[],[]
pozitiv,Panoramatický pohled na nové sídliště v Malešicích.,18.9.1964,47x,DFE886D22D1411E0823D00166F1163D4,I 9421,1964-09-18,1964-09-18,14.48403,50.07889,regional.address,geocode,"Krejčí, B.",,,[],[]
pozitiv,Pohled z vltavského břehu mezi Velkou a Malou Chuchlí k východu přes řeku na břeh v Hodkovičkách. Vpravo v pozadí Modřany. Součást panoramatu.,16.9.1934,68x,A1186B76B67611DF820F00166F1163D4,I 8790,1934-09-16,1934-09-16,14.39187,50.01744,regional.address,geocode,"Alexander, Antonín (1892-působnost do 1948)",,,[],[]
negativ,Pohled na část průčelí domu čp. 365 (Schönbornský palác) v ulici Tržiště na Malé Straně s portálem.,26.11.1905,19x,A1186903B67611DF820F00166F1163D4,VIII 675,1905-11-26,1905-11-26,14.40131,50.08733,regional.address,geocode,Eckert-ateliér,,,[],[]
pozitiv,"Celkový pohled na Medvědí kašnu před Albrechtskými kasárnami (Štefánikova - původně dům čp. 416 na Malé Straně, dnes dům čp. 234 na Smíchově) na dnešním náměstí Kinských.",1912,75x,A0C4F80BB67611DF820F00166F1163D4,I 8752,1912-01-01,1912-12-31,14.40506,50.0789,regional.address,geocode,"Fink, František (1854-1935)",,,[],[]
pozitiv,Průhled Václavským náměstím z rampy Národního muzea k Můstku. V popředí uprostřed pomník sv. Václava.,kol.1935,217x,A0C5065BB67611DF820F00166F1163D4,I 137,1935-01-01,1935-12-31,14.43056,50.07918,regional.address,geocode,,,,[],[]
negativ,Projekt úpravy Letné architekta Františka Velicha - komunikace.,20.2.1908,39x,F033B662F63611E3AB180024BE7CD9AC,XI 529,1908-02-20,1908-02-20,14.43287,50.09886,regional.address,geocode,"Kříženecký, Jan (1868-1921)",,0.0,[],[]
pozitiv,Pohled na dům čp. 112 (usedlost Fialka) na Smíchově.,,75x,A1188A4FB67611DF820F00166F1163D4,I 1899,,,14.4016,50.06866,regional.address,geocode,,,,[],[]
pozitiv,"Pohled na jihozápadní stranu Mariánského náměstí s Klementinem (dům čp. 190, 1040) ze Žatecké ulice - před zastavěním prázdného pozemku budovou městské knihovny. Vlevo dům čp. 159, vpravo část domu čp. 91 na Starém Městě.",duben 1925,69x,A1187D50B67611DF820F00166F1163D4,I 8623,1925-04-01,1925-04-30,14.41724,50.08666,regional.address,geocode,"Vojta, Tomáš (1885-1934)",,,[],[]
pozitiv,Pohled na střechu a opravovanou věž Klementina (dům čp. 190) na Starém Městě.,1914,19x,52276C9EB77B11E4AB55406186009F3A,V 4/2 a,1914-01-01,1914-12-31,14.41659,50.08616,poi,suggest,,,,[],[]
pozitiv,"Oslavy v Praze 6.6.1945. Maršál Andrej Ivanovič Jeremenko při projevu na Staroměstském náměstí. Vlevo vedle něho Valerian Alexandrovič Zorin, sovětský velvyslanec. Vpravo maršál Ivan Stěpanovič Koněv .",6.6.1945,73x,A1187665B67611DF820F00166F1163D4,I 1643,1945-06-06,1945-06-06,14.41994,50.08663,regional.address,geocode,,,,[],[]
pozitiv,Pohled na statek čp. 1204 a čp. 1212 v Novostrašnické ulici ve Strašnicích.,9.12.1942,38x,4E6E32E0C88911E7A755D4BED94BB14D,A 14867,1942-12-09,1942-12-09,14.50887,50.07506,regional.address,geocode,"Alexander, Antonín (1892-působnost do 1948)",,0.0,[],[]
pozitiv,Dveře v interiéru Schönbornského paláce - domu čp. 365 na Malé Straně.,červen 1931,26x,7C3C851479F911E3B274406186009F3A,I 9860,1931-06-01,1931-06-30,14.40131,50.08733,regional.address,geocode,"Vojta, Tomáš (1885-1934)",,,[],[]
negativ,Pohled na dvěře Primátorského sálu Obecního domu (dm čp. 1090 na Starém Městě).,kol.1920,15x,FF7F637EF46811E7A828406186009F3A,XI 4003,1920-01-01,1920-12-31,14.29081,50.09402,regional.address,suggest,,,0.0,[],[]
negativ,Celkový pohled na dům čp. 167 v Červené ulici v Josefově před zbořením v roce 1903.,29.8.1903,37x,A118713AB67611DF820F00166F1163D4,VIII 111,1903-08-29,1903-08-29,14.41862,50.08993,regional.address,geocode,"Eckert, Jindřich (1833-1905)",,,[],[]
pozitiv,Pohled na Národní třídu s domy čp. 36 (původní - Thunovský palác) a 37 (zleva) na Novém Městě. Vlevo část Jungmannovy ulice.,kol.1920,126x,A14CE4ABB67611DF820F00166F1163D4,II 172,1920-01-01,1920-12-31,14.42213,50.08248,regional.address,geocode,,,,[],[]
pozitiv,Celkový pohled na školu (dům čp. 460) na Lyčkově náměstí v Karlíně (dříve Riegrovy sady). V popředí park.,kol.1910,74x,A0C5029DB67611DF820F00166F1163D4,V 21/3,1910-01-01,1910-12-31,14.45836,50.09311,regional.address,geocode,,,,[],[]
pozitiv,4 kresby patníků na Starém Městě a Malé Straně. 1. patník u domu čp. 243 na Starém Městě. 2. patník u domu čp. 226 na Starém Městě. 3. patník u domu čp. 486 na Malé Straně 4. patník u domu čp. 347 na Malé Straně.,1908,16x,A0C50846B67611DF820F00166F1163D4,VI 34/14 b,1908-01-01,1908-12-31,14.66611,50.00146,regional.address,geocode,,,,[],[]
pozitiv,Panoramatický pohled na Strašnice - od západu přes sever k východu. Součást panoramatu.,10.10.1927,58x,A0C50287B67611DF820F00166F1163D4,I 4819,1927-10-10,1927-10-10,14.4896,50.07607,regional.address,geocode,"Alexander, Antonín (1892-působnost do 1948)",,,[],[]
negativ,Pohled z řetězového mostu císaře Františka I. přes Vltavu na Národní divadlo.,kol.1885,52x,DF593C259DC411E18B146C626D41E503,XII 764,1885-01-01,1885-12-31,14.41347,50.08126,regional.address,geocode,"Eckert, Jindřich (1833-1905)",,0.0,[],[]
CD-ROM,Pohled na Vltavu z Trojské lávky při povodni 9.8.2002.,9.8.2002,19x,A1186E2BB67611DF820F00166F1163D4,XXII 1/27 a,2002-08-09,2002-08-09,14.41665,50.11435,regional.street,suggest,"Malec, Milan - Malcová, Alena",,0.0,[],[]
negativ,"Tympanon severního portálu kostela P. Marie před Týnem na Starém Městě. 
                    
                
                    
                  Detail - levá dolejší skupina.",kol. 1905,17x,C9ED25D9AA9811E3A45A0024BE7CD9AC,XI 178,,,14.42218,50.08782,regional.address,geocode,"Kříženecký, Jan (1868-1921)",,0.0,[],[]
pozitiv,Pohled od Úvozu k Petřínu přes malostranské zahrady.,8.5.1931,50x,A1186E31B67611DF820F00166F1163D4,I 4418,1931-05-08,1931-05-08,14.39644,50.08841,regional.address,geocode,"Alexander, Antonín (1892-působnost do 1948)",,,[],[]
negativ,Pohled na dům čp. 67 na Smíchově v zahradě Portheimky (dům čp. 68) se skleníkem.,10.7.1908,67x,FF360D4812CB11E2A6B56C626D41E503,XII 1144,1908-07-10,1908-07-10,14.39956,50.05629,regional.address,geocode,Eckert-ateliér,,0.0,[],[]
pozitiv,Pohled na portál kostela P. Marie Sněžné na Novém Městě.,16.6.1906,21x,A1186704B67611DF820F00166F1163D4,VI 30/31 a,1906-06-16,1906-06-16,14.42273,50.08291,regional.address,geocode,,,,[],[]
pozitiv,Pohled na portál kostela sv. Cyrila a Metoděje (dříve Karla Boromejského) v Resslově ulici na Novém Městě.,15.5.1907,31x,A0C50292B67611DF820F00166F1163D4,VI 19/4,1907-05-15,1907-05-15,14.41762,50.07596,regional.address,geocode,,,,[],[]
pozitiv,Pražské povstání - 5.5.1945 - plenění a pálení nacistických tiskovin nakladatelství Deutsche Arbeitsfront na Václavském náměstí.,5.5.1945,83x,A71815F6D65111E18B876C626D41E503,I 7977,1945-05-05,1945-05-05,14.42499,50.08285,regional.address,geocode,"Velebil, Karel (?)",,,[],[]
negativ,Pohled přes Vltavu na dnešní Dvořákovo nábřeží. V pozadí panorama Starého Města.,28.8.1909,23x,A0C50853B67611DF820F00166F1163D4,XI 1180,1909-08-28,1909-08-28,14.41547,50.09073,regional.address,geocode,"Kříženecký, Jan (1868-1921)",,0.0,[],[]
pozitiv,Pohled do interiéru bývalého kostela sv. Bartoloměje na Novém Městě ve Vyšehradské ulici směrem k oltáři.,22.10.1904,53x,A118712DB67611DF820F00166F1163D4,VI 30/26,1904-10-22,1904-10-22,14.41863,50.06956,regional.address,geocode,"Eckert, Jindřich (1833-1905)",,,[],[]
pozitiv,Pohled do Josefské ulice s domem čp. 626 (škola) na Malé Straně. V pozadí část kostela sv. Tomáše.,23.6.1912,18x,A1187137B67611DF820F00166F1163D4,II 1470,1912-06-23,1912-06-23,14.40537,50.08823,regional.address,geocode,"Kříženecký, Jan (1868-1921)",,,[],[]
pozitiv,Pohled do dvora Schönbornského paláce - domu čp. 365 na Malé Straně.,,32x,A118786DB67611DF820F00166F1163D4,I 8515,,,14.40131,50.08733,regional.address,geocode,"Vojta, Tomáš (1885-1934)",Autorství T. Vojty není jisté.,,[],[]
pozitiv,"Pohled na portál domu čp. 214 (""Thunovský palác"") v Nerudově ulici na Malé Straně.",26.7.1907,25x,A0C4F9A9B67611DF820F00166F1163D4,VI 21/25,1907-07-26,1907-07-26,14.40038,50.08859,regional.address,geocode,,,,[],[]
pozitiv,Pohled do Wolkerovy ulice s domy čp. 34 a 24 v Bubenči.,1958,59x,A1186711B67611DF820F00166F1163D4,I 4743,1958-01-01,1958-12-31,14.40977,50.1034,regional.address,geocode,"Hnilička, Eduard (1887-1967)",,,[],[]
negativ,Tympanon severního portálu kostela P. Marie před Týnem na Starém Městě.,kol. 1905,18x,74E39BA2AA9511E3A45A0024BE7CD9AC,XI 171,,,14.42396,50.08884,regional.address,geocode,"Kříženecký, Jan (1868-1921)",,0.0,[],[]
pozitiv,"Stavba přístavu v Libni - vpravo Voctářova ulice, vlevo v pozadí Budečská ulice (dnes ulice U Českých loděnic). Uprostřed v pozadí Libeňský zámek.",1894-1895,107x,B02951246D7111E88D0474D435EEBE90,V 18/13 ř,1894-01-01,1895-12-31,14.46926,50.10457,regional.address,geocode,,,0.0,[],[]
negativ,Pohled na vnitřní portál kostela sv. Havla na Starém Městě - při rekonstrukci kostela.,8.8.1905,16x,E60B44AC2AD211E0BDCF000C766D2371,XII 183,1905-08-08,1905-08-08,14.4217,50.08555,regional.address,geocode,Eckert-ateliér,,0.0,[],[]
negativ,Zvon kostela sv. Mikuláše na Starém Městě před jeho sejmutím za 1. světové války k roztavení.,1914-1918,20x,5D9AD009D37D11E8AE88406186009F3A,XI 3830,1914-01-01,1918-12-31,14.41994,50.08663,regional.address,geocode,,,0.0,[],[]
negativ,"Pohled do Maiselovy ulice. Zprava dům čp. 74, ústí Kostečné ulice, dům čp. 78 (hotel Flusser) v Josefově.",kol.1895,30x,A1186916B67611DF820F00166F1163D4,VIII 826,1895-01-01,1895-12-31,14.41826,50.08957,regional.address,geocode,"Eckert, Jindřich (1833-1905)",,,[],[]
negativ,Pohled do zahrady kláštera augustiniánů kanovníků na Karlově (dům čp. 453 na Novém Městě - chorobinec).,kol.1890,34x,366B152A769911E2BF17525400E46D25,VIII 1217,1890-01-01,1890-12-31,14.42851,50.0692,regional.address,geocode,"Eckert, Jindřich (1833-1905)",,,[],[]
pozitiv,Pohled na kapličku nad ulicí Na Univerzitním statku v Malešicích.,1974,47x,DFE886E72D1411E0823D00166F1163D4,I 9428,1974-01-01,1974-12-31,14.51103,50.08569,regional.address,geocode,"Krofta, J. S.",,,[],[]
pozitiv,Pohled na kapli sv. Václava na Malešickém náměstí v Malešicích.,7.6.1958,39x,DFE886DD2D1411E0823D00166F1163D4,I 9427,1958-06-07,1958-06-07,14.51165,50.08443,regional.address,geocode,,,,[],[]
pozitiv,Pohled na Senovážné náměstí s domem čp. 976 na Novém Městě (Cukerní palác - nahradil čp. 979 městskou sennou váhu). Vlevo pozadí věž zvonice kostela sv. Jindřicha.,11.9.1914,119x,A1186DC9B67611DF820F00166F1163D4,II 934,1914-09-11,1914-09-11,14.43023,50.08551,regional.address,geocode,"Kříženecký, Jan (1868-1921)",,,[],[]
pozitiv,Pohled na poškozenou vorovou propust nového Helmovského jezu po velké vodě. V pozadí provizorní dřevěný most (Hlávkův).,2.4.1909,81x,64F73DDAEA9F11E5A51F000C76270B94,I 11599,1909-04-02,1909-04-02,14.4369,50.09567,regional.street,suggest,,,,[],[]
pozitiv,Studenti při Majáles roku 1965.,1965,13x,A1187D5FB67611DF820F00166F1163D4,I 8964,1965-01-01,1965-12-31,14.41994,50.08663,regional.address,geocode,"Pacovský, Jaroslav",,,[],[]
pozitiv,Pohled do obory Hvězda v Liboci - přemostění v jižní ohradní zdi pro průtok potůčku.,27.7.1943,35x,A0C4FC6BB67611DF820F00166F1163D4,I 4776,1943-07-27,1943-07-27,14.34181,50.08315,regional.address,geocode,"Alexander, Antonín (1892-působnost do 1948)",,,[],[]
pozitiv,Pohled na stavbu základů domu čp. 627 na Malé Straně. Vpravo dům čp. 128 na Malé Straně.,1907,38x,A0C50D7BB67611DF820F00166F1163D4,II 117,1907-01-01,1907-12-31,14.41139,50.09203,regional.address,geocode,,,,[],[]
pozitiv,Průhled Vršovickou ulicí.,,76x,A0C4FC71B67611DF820F00166F1163D4,I 4193,,,14.46217,50.06746,regional.address,geocode,,,,[],[]
pozitiv,Pohled na průčelí domu čp. 838 na Václavském náměstí na Novém Městě.,,21x,A14CEAF6B67611DF820F00166F1163D4,VI 48/24,,,14.42508,50.08347,regional.address,geocode,,,,[],[]
negativ,Pohled na stavbu Čechova mostu od Letné. V pozadí staroměstské nábřeží a nově vznikající Mikulášská třída (Pařížská ulice) s Velkodvorskou synagogou při bourání. V popředí část kaple sv. Maří Magdaleny.,12.4.1906,115x,A0C50D61B67611DF820F00166F1163D4,VIII 292,1906-04-12,1906-04-12,14.4171,50.093,regional.street,suggest,Eckert-ateliér,,,[],[]
pozitiv,Pohled na renesanční kašnu s mříží na Malém náměstí na Starém Městě. Vlevo malá část kamenné kašny.,kol.1880,18x,E6FC98A79B9711E2BF2D525400E46D25,VI 38/5 b,1880-01-01,1880-12-31,14.41979,50.08642,regional.address,geocode,"Eckert, Jindřich (1833-1905)",,,[],[]
pozitiv,"Pohled na Troju (Podhoří), Dejvice a Sedlec. Součást devítidílného kruhového panoramatu.",24.7.1926,25x,b06007985a4c474ba5f018289049784d,A 2563,1926-07-24,1926-07-24,14.41135,50.11784,regional.address,geocode,"Alexander, Antonín (1892-působnost do 1948)",,0.0,[],[]
pozitiv,Pohled do dvora domu čp. 808 na Starém Městě.,24.4.1937,34x,2CD83F2A295611E994E6406186009F3A,A 11161,1937-04-24,1937-04-24,14.42427,50.09165,regional.address,geocode,"Alexander, Antonín (1892-působnost do 1948)",,0.0,[],[]
pozitiv,Celkový pohled na budovu Filozofické fakulty UK (původně dům čp. 55 na Starém Městě - nyní dům čp. 1 v Josefově). V popředí park.,,52x,C28222F6763A11E0BE30000C766D2371,I 9474,,,14.41621,50.08866,regional.address,geocode,"Vojta, Tomáš (1885-1934)",,,[],[]
negativ,Pohled na zahradní průčelí domu čp. 462 (Vila Amerika - Michnův letohrádek) v ulici Ke Karlovu na Novém Městě.,před 1886,52x,A14CE80DB67611DF820F00166F1163D4,XII 5,1800-01-01,1885-12-31,14.42692,50.07369,regional.address,geocode,"Eckert, Jindřich (1833-1905)",,0.0,[],[]
pozitiv,Pohled do dvora domu čp. 149 s pavlačemi na Starém Městě.,2.5.1913,18x,A14CE817B67611DF820F00166F1163D4,VI 56/16,1913-05-02,1913-05-02,14.60161,50.02885,regional.address,geocode,"Donát, Tomáš",,,[],[]
negativ,"Pohled z Dívčích hradů na území Smíchova, vltavské údolí a Podolí k východu. V popředí vlevo lihovar. Uprostřed Vltava s novým Smíchovským přístavem a ostrovem Císařská louka, v pozadí za řekou Podolí, vpravo cementárna. Součást panoramatu.",16.11.1902,174x,AEB13402A3ED11E1BEEB000C766D2371,VIII 1103,1902-11-16,1902-11-16,14.40972,50.05208,regional.address,geocode,"Eckert, Jindřich (1833-1905)",,,[],[]
pohlednice,Pohled na umělou romantickou zříceninu (rozhlednu) v zahradě usedlosti Cibulka v Košířích (dům čp. 118).,,63x,A11888C1B67611DF820F00166F1163D4,I 4594,,,14.35655,50.06696,regional.address,suggest,,,,[],[]
pozitiv,Pohled do ulice Pod zámečkem v Dolních Chabrech z ulice Pod hrází.,1981,72x,A11888BBB67611DF820F00166F1163D4,I 351,1981-01-01,1981-12-31,14.43979,50.15038,regional.address,geocode,"Rameš, František",,,[],[]
pozitiv,Celkový pohled na Matyášovu bránu Pražského hradu z Hradčanského náměstí. V popředí brána se sochami zápasících Gigantů na prvním nádvoří.,24.4.1902,22x,A1186789B67611DF820F00166F1163D4,VI 25/5,1902-04-24,1902-04-24,14.39534,50.08934,regional.address,geocode,"Eckert, Jindřich (1833-1905)",,,[],[]
pozitiv,Celkový pohled na Klausovou synagogu v ulici U Starého hřbitova v Josefově. V pozadí Nová obřadní síň (dům čp. 243) na Starém židovském hřbitově.,16.11.1931,79x,A1187FD1B67611DF820F00166F1163D4,I 4693,1931-11-16,1931-11-16,14.41757,50.08996,regional.address,geocode,"Alexander, Antonín (1892-působnost do 1948)",,,[],[]
negativ,Celkový pohled na pavilon vodního ptactva Zoologické zahrady Praha v Troji.,1979,34x,8BF19F9A293611E994E6406186009F3A,IX 18269,1979-01-01,1979-12-31,14.41108,50.11671,regional.address,geocode,"Scheufler, Pavel",,,[],[]
pozitiv,"Pohled do Husovy ulice směrem k severu. Zleva domy čp. 227, 228, 229 a 156. V pozadí Clam Gallasův palác čp. 158 na Starém Městě.",6.4.1930,50x,7B52FFD004D611E3A4F66C626D41E503,I 9737,1930-04-06,1930-04-06,14.41798,50.086,regional.address,geocode,"Alexander, Antonín (1892-působnost do 1948)",,,[],[]
negativ,Pohled do interiéru Valdštejnského paláce (dům čp. 17 na Malé Straně) - audienční síň.,,16x,A11886BEB67611DF820F00166F1163D4,VIII 654,,,14.40535,50.09003,regional.address,geocode,Eckert-ateliér,,,[],[]
pozitiv,Pohled do dvora domu čp. 5 v Hloubětíně (Křižovnický dvůr) - od hlavních vrat k jihu.,30.3.1930,46x,3B15C7206F0111E88F4674D435EEBE90,A 5604,1930-03-30,1930-03-30,14.52479,50.10803,regional.address,geocode,"Alexander, Antonín (1892-působnost do 1948)",,0.0,[],[]
negativ,Pohled do interiéru hradu Karlštejn - prostor mezi 1. a 2. hradní branou s věží Voršilkou.,1896-1897,23x,D0157090EB2A11DFBD74000C766D2371,XII 16,1896-01-01,1897-12-31,14.25487,49.94465,poi,suggest,"Eckert, Jindřich (1833-1905)",,0.0,[],[]
pozitiv,Celkový na domek izraelitského pohřebního bratrstva (dům čp. 13) na Židovském hřbitově na Žižkově (v místech dnešních Mahlerových sadů). V pozadí domy čp. 1500 a 1526 ve Fibichově ulici.,14.4.1933,116x,595C1D0FF1D311E6BC06406186009F3A,A 7693,1933-04-14,1933-04-14,14.45888,50.07913,regional.address,geocode,"Alexander, Antonín (1892-působnost do 1948)",,0.0,[],[]
pozitiv,Pohled na barokní vyhlídkovou věžičku na vrchu Žižkově.,kol.1900,76x,A0C50ACAB67611DF820F00166F1163D4,I 1778,1900-01-01,1900-12-31,14.44498,50.08735,regional.address,geocode,,,,[],[]
negativ,"Celkový pohled na dům čp. 376 na nároží ulic Dřevné, Trojické a Václavské (dnes ulice Pod Slovany) na Novém Městě.",kol.1900,60x,A0C50AB2B67611DF820F00166F1163D4,VIII 564,1900-01-01,1900-12-31,14.41573,50.07144,regional.address,geocode,"Eckert, Jindřich (1833-1905)",,,[],[]
negativ,Pohled na Karlovo náměstí s parkovou úpravou. V pozadí Novoměstská radnice.,24.10.1907,44x,2B2BD22CE03411E3A3D40024BE7CD9AC,XI 461,1907-10-24,1907-10-24,14.4213,50.07812,regional.address,geocode,"Kříženecký, Jan (1868-1921)",,0.0,[],[]
pozitiv,"Pohled na Malostranské náměstí s pomníkem maršála Radeckého a s domy čp. 5, 6, 7, 518 na Malé Straně.",kol.1900,546x,A1187569B67611DF820F00166F1163D4,I 47,1900-01-01,1900-12-31,14.404,50.08785,regional.address,suggest,Bellmann-ateliér,,,[],[]
pozitiv,"Pohled do zahrady domu čp. 180 na Hradčanech (bývalý Trautmannsdorfský palác) od kapličky k severozápadu - ""práce na výkopu válečného vodního bazénu"".",5.6.1944,20x,08BC7ABC748611E4A81F406186009F3A,I 11073,1944-06-05,1944-06-05,14.39375,50.08878,regional.address,geocode,"Alexander, Antonín (1892-působnost do 1948)",,,[],[]
pozitiv,Pohled na zahradní průčelí domu čp. 1002 na Novém Městě.,,14x,A14CDB03B67611DF820F00166F1163D4,II 1472,,,14.43134,50.08713,regional.address,geocode,,,,[],[]
pozitiv,"Průhled Národní třídou. Zleva domy čp. 1370 (část), 1369 na Novém Městě a Národní divadlo. Vpravo domy na Starém Městě. V pozadí most císaře Františka I.",,59x,A0C515C1B67611DF820F00166F1163D4,V 71/22,,,14.41685,50.0816,regional.address,geocode,,,,[],[]
pozitiv,"Pohled z jižní části vyšehradských hradeb k jihu na Podolí a vltavské údolí. Vpravo Podolské nábřeží, přístavní hráz a přístav. V pozadí Veslařský ostrov. Součást panoramatu.",10.9.1923,106x,730342C5611E11E995BC74D435EEBE90,Voj 113,1923-09-10,1923-09-10,14.41352,50.0482,regional.address,geocode,"Vojta, Tomáš (1885-1934)",,0.0,[],[]
negativ,Pohled do interiéru Národního muzea (dům čp. 1700 na Novém Městě) - výstavní sál s exponáty z doby bronzové.,kol.1900,34x,A14CDA9AB67611DF820F00166F1163D4,VIII 125,1900-01-01,1900-12-31,14.43056,50.07918,regional.address,geocode,"Eckert, Jindřich (1833-1905)",,,[],[]
pozitiv,Pohled na prodej vánočních stromků před Staroměstskou radnicí.,kol.1935,56x,A1186CFCB67611DF820F00166F1163D4,II 930,1935-01-01,1935-12-31,14.42009,50.087,regional.address,suggest,,,,[],[]
pozitiv,"Pohled na Malostranské náměstí s domy čp. 5, 4, 2 (zleva) na Malé Straně. Nad nimi věže kostela sv. Mikuláše.",,20x,FDCF854B3E9E11E1B434000BCDD04BFA,I 9528,,,14.40351,50.08766,regional.address,geocode,,,,[],[]
pozitiv,"Panoramatický pohled na Smíchov - od strahovských lomů směrem k jihu na nové zastavění Hřebenek při Švédské ulici, kde nejvýš vyniká vila stavitele Beneše.",13.9.1925,95x,A0C50C28B67611DF820F00166F1163D4,I 4205,1925-09-13,1925-09-13,14.39194,50.07432,regional.address,geocode,"Alexander, Antonín (1892-působnost do 1948)",,,[],[]
pozitiv,Pohled na plavební kanál a lodní výhybku u Císařského ostrova v Bubenči.,13.5.1924,64x,A0C518CBB67611DF820F00166F1163D4,I 9021,1924-05-13,1924-05-13,14.41787,50.11296,regional.address,geocode,"Alexander, Antonín (1892-působnost do 1948)",,,[],[]
pozitiv,Pohled na Gröbeho vilu (dům čp. 58 na Vinohradech) nad vinicí - jižní průčelí.,kol.1910,66x,A0C4FD38B67611DF820F00166F1163D4,I 1833,1910-01-01,1910-12-31,14.44502,50.06921,regional.address,geocode,,,,[],[]
negativ,"Pohled na usedlost Cibulka (dům čp. 118) v Košířích, záběr na plastiku Číňana od Václava Prachnera, umístěnou na terase před hlavním vchodem.",1974,49x,A14CDF53B67611DF820F00166F1163D4,VII 574,1974-01-01,1974-12-31,14.35655,50.06696,regional.address,geocode,"Chalupníček, Miroslav -, Chalupníčková, Věra (dokument 1941-1948)",,,[],[]
pozitiv,Pohled na Krenův dům (dům čp. 936) na Staroměstském náměstí.,,50x,FDCF85513E9E11E1B434000BCDD04BFA,V 91/16 c,,,14.4202,50.08848,regional.address,geocode,,,,[],[]
pozitiv,Pohled na staré domy v Michli.,,81x,72016F2A2ACE11E0BDCE000C766D2371,VI 43/5,,,14.45877,50.04974,regional.address,geocode,"Fanta, Martin",,,[],[]
pozitiv,Pohled do interiéru kaple P. Marie a sv. Jana Boromejského při Vlašském špitále (dům čp. 335) na Malé Straně.,17.9.1904,46x,A14CE89BB67611DF820F00166F1163D4,VI 8/25 a,1904-09-17,1904-09-17,14.39762,50.0876,regional.address,geocode,"Eckert, Jindřich (1833-1905)",,,[],[]
pozitiv,Pohled do ulice V Domcích v Liboci - s domy čp. 64 a 66 (vpravo) u studny Královky.,27.7.1943,30x,A0C4FBF2B67611DF820F00166F1163D4,I 4777,1943-07-27,1943-07-27,14.53449,50.05779,regional.address,geocode,"Alexander, Antonín (1892-působnost do 1948)",,,[],[]
pozitiv,"Pohled na jihovýchodní stranu Staroměstského náměstí s mariánským sloupem. Zleva domy čp. 604, 603, 552, 551, 550, 549 na Starém Městě.",červen 1902,53x,A0C4F9A7B67611DF820F00166F1163D4,V 54/2 a,1902-06-01,1902-06-30,14.42156,50.08709,regional.address,geocode,"Dvořák, František (dokumenty 1901-1908)",,,[],[]
pozitiv,Pohled na kapličku a křížek na Malém náměstí (dnes Břevnovská ulice) v Břevnově.,1958,63x,A8D06AAFBA9C11E5A77074D435EEBE90,I 11392,1958-01-01,1958-12-31,14.36425,50.08431,regional.address,geocode,"Hnilička, Eduard (1887-1967)",,,[],[]
pozitiv,Pohled na část nárožního domu čp. 308 - průčelí v Resslově ulici na Novém Městě.,kol.1910,27x,A14CE881B67611DF820F00166F1163D4,VI 6/19 a,1910-01-01,1910-12-31,14.41764,50.07571,regional.address,geocode,"Schumpeter, Jan",,,[],[]
pozitiv,Pohled na staré Záběhlice - oblast záběhlického údolí ze stráně nad jižní stranou Hamerského rybníka. V pozadí vlevo domy v dnešní Záběhlické ulici. Čtvrtá část čtyřdílného panoramatu.,16.6.1929,57x,D634BC39583411E88F1F74D435EEBE90,A 5085,1929-06-16,1929-06-16,14.48614,50.05231,poi,suggest,"Alexander, Antonín (1892-působnost do 1948)",,0.0,[],[]
negativ,"Pohled na novoměstské nábřeží u Slovanského ostrova. Zleva Nové lázně čp. 228, dále 230, 231, Horní Lodecké mlýny (dům čp. 233, 1289, 1290) na Novém Městě.",kol.1900,44x,A14CE69EB67611DF820F00166F1163D4,VIII 1036,1900-01-01,1900-12-31,14.50767,50.07374,regional.address,geocode,"Eckert, Jindřich (1833-1905)",,,[],[]
pozitiv,Pohled na vstupní vrata domu čp. 17 v Malešicích.,11.3.1948,47x,DFE886E92D1411E0823D00166F1163D4,I 9436,1948-03-11,1948-03-11,14.51509,50.08918,regional.address,geocode,,,,[],[]
pozitiv,Pohled na bývalý klášter augustiniánů kanovníků na Karlově (dům čp. 453) na Novém Městě s kostelem Nanebevzetí P. Marie a sv. Karla Velikého.,kol.1890,50x,A14CE507B67611DF820F00166F1163D4,VI 30/22 b,1890-01-01,1890-12-31,14.42851,50.0692,regional.address,geocode,"Eckert, Jindřich (1833-1905)",,,[],[]
pozitiv,Pohled na Šlechtovu restauraci v Královské oboře - Stromovce (dům čp. 20 v Bubenči).,,85x,A1187BA1B67611DF820F00166F1163D4,II 1453,,,14.4175,50.10463,regional.address,geocode,,,,[],[]
pozitiv,Pohled na dům čp. 14 na nároží ulic Staroholešovické a Partyzánské v Holešovicích.,únor 1959,77x,A11870B4B67611DF820F00166F1163D4,I 853,1959-02-01,1959-02-28,14.43637,50.10853,regional.address,geocode,"Hnilička, Eduard (1887-1967)",,,[],[]
negativ,Pohled na náhrobek Josefa Lauterbacha na Malostranském hřbitově na Smíchově.,9.1.1914,66x,DF949EE62FB011E5A57D74D435EEBE90,XI 3024,1914-01-09,1914-01-09,14.39148,50.07167,poi,suggest,"Kříženecký, Jan (1868-1921)",,0.0,[],[]
pozitiv,Pohled do dvora starého mlýna (dům čp. 17) v Kyjích.,1968,64x,A1186918B67611DF820F00166F1163D4,I 4561,1968-01-01,1968-12-31,14.54645,50.0984,regional.address,geocode,"Vopravil, Josef (1902-1972)",,,[],[]
pozitiv,Pohled na stavbu nábřeží Na Františku u kláštera Milosrdných bratří na Starém Městě. Součást panoramatu.,2.7.1908,42x,A11879F4B67611DF820F00166F1163D4,II 1050,1908-07-02,1908-07-02,14.42582,50.09301,regional.address,geocode,"Kříženecký, Jan (1868-1921)",,,[],[]
negativ,Pohled na plastickou výzdobu kostela sv. Mikuláše na Starém Městě. Střední část choru u hlavního vchodu.,listopad 1905,16x,2929ECBE9E3411E3B7D600110989F46F,XI 59,1905-11-01,1905-11-30,14.4199,50.08778,regional.address,geocode,"Kříženecký, Jan (1868-1921)",,0.0,[],[]
pozitiv,Pohled na zahradní průčelí domu čp. 153 na Malé Straně. V popředí Fürstenberská zahrada (Velká). V pozadí Pražský hrad.,kol.1920,93x,A14CDB95B67611DF820F00166F1163D4,I 396,1920-01-01,1920-12-31,14.40696,50.09058,regional.address,geocode,"Vojta, Tomáš (1885-1934)",,,[],[]
pozitiv,"Reprodukce plánu: Soutěžní návrh na budovu chlapecké a dívčí obecné školy ""v nových Vysočanech"" v listopadu 1920.",kol.1920,48x,CA79B357DB8211DFBD5E000C766D2371,VI 50/1 d,1920-01-01,1920-12-31,14.50467,50.10987,regional.address,geocode,,,,[],[]
pozitiv,"Pohled na bourání domů čp. 282, 276, 160, 270 v Cikánské ulici v Josefově. Vlevo v pozadí věž kostela sv. Ducha.",23.6.1905,35x,A14CEAF8B67611DF820F00166F1163D4,VI 54/16,1905-06-23,1905-06-23,14.42123,50.09107,regional.address,geocode,Eckert-ateliér,,,[],[]
pozitiv,Průhled Fastrovou ulicí v Břevnově. Vpravo dům čp. 318 v Břevnově.,7.9.1943,44x,F8527BDAB61111E58B3BD4BED94BB14D,I 11399,1943-09-07,1943-09-07,14.37561,50.08409,regional.address,geocode,"Alexander, Antonín (1892-působnost do 1948)",,,[],[]
pozitiv,"Pohled na rybník v Hodkovičkách. V pozadí domy čp. 8, 9, 44 a 11 v ulici V Hodkovičkách.",16.9.1934,19x,376823E2D1C711E69F29406186009F3A,A 9040,1934-09-16,1934-09-16,14.40206,50.07289,regional.address,suggest,"Alexander, Antonín (1892-působnost do 1948)",,0.0,[],[]
negativ,Pohled na Křižíkovu fontánu na výstavišti při národopisné výstavě roku 1895.,1895,95x,365D5882070811E286836C626D41E503,XII 1813,1895-01-01,1895-12-31,14.44831,50.09189,regional.street,suggest,,,0.0,[],[]
pozitiv,Celkový pohled na budovu Ústřední knihovny hlavního města Prahy (dům čp. 98 na Starém Městě) na Mariánském náměstí.,18.10.1929,40x,53c4643ccbf04eff8dba5071f4b268f9,A 5412,1929-10-18,1929-10-18,14.41739,50.08739,regional.address,suggest,"Alexander, Antonín (1892-působnost do 1948)",,0.0,[],[]
negativ,Pohled do interiéru kostela P. Marie Na Slovanech (v Emauzích) na Novém Městě - socha P. Marie Montserratské.,před 1897,32x,5BA665548CB311E2BF24525400E46D25,VIII 1417,1800-01-01,1896-12-31,14.41719,50.07215,regional.address,geocode,"Eckert, Jindřich (1833-1905)",,,[],[]
negativ,"Mariánská výstava v Klementinu 9.8. - 3.10.1904 - obraz: Quido Reni, P. Marie s Ježíškem.",1904,25x,0C3252890CA111E2AEA36C626D41E503,XII 996,1904-01-01,1904-12-31,14.4172,50.08697,regional.address,geocode,"Eckert, Jindřich (1833-1905)",,0.0,[],[]
pozitiv,Pohled na portál domu čp. 381 v Karmelitské ulici na Malé Straně.,kol.1905,16x,A118873FB67611DF820F00166F1163D4,VI 23/10,1905-01-01,1905-12-31,14.404,50.08611,regional.address,geocode,,,,[],[]
negativ,Sousoší sv. Františka Borgiáše na Karlově mostě. V pozadí domy na Smetanově nábřeží.,20.10.1907,37x,5960680D3DDF11E0BDF1000C766D2371,XII 240,1907-10-20,1907-10-20,14.41126,50.0865,poi,suggest,Eckert-ateliér,,0.0,[],[]
negativ,"Průhled Celetnou ulicí vpravo s částí domu čp. 587 na Starém Městě (""Nová mincovna""). V pozadí Prašná brána.",kol.1895,86x,E5B48BFF946D11E1A7806C626D41E503,XII 573,1895-01-01,1895-12-31,14.4258,50.08687,regional.address,geocode,"Eckert, Jindřich (1833-1905)",,0.0,[],[]
negativ,Pohled na plastickou výzdobu kostela sv. Mikuláše na Starém Městě. Výplň pasu nad presbytářem.,říjen 1905,16x,A6A3A91A778211E3B7C300110989F46F,XI 28,1905-10-01,1905-10-31,14.4199,50.08778,regional.address,geocode,"Kříženecký, Jan (1868-1921)",,0.0,[],[]
pozitiv,Pohled do tělocvičny domu čp. 850 v Holešovicích (obecná a měšťanská škola U Studánky).,18.6.1907,41x,A118679DB67611DF820F00166F1163D4,V 63/2 h,1907-06-18,1907-06-18,14.42773,50.10268,regional.address,geocode,"Kříženecký, Jan (1868-1921)",,,[],[]
negativ,Pamětní bronzová deska Gutsulzbergerova v Muzeu hl. města Prahy v městských sadech Na Poříčí (dnes Švermovy sady).,26.6.1910,34x,64AEA6BD92D011E193C36C626D41E503,XII 498,1910-06-26,1910-06-26,14.43848,50.0901,regional.address,suggest,Eckert-ateliér,,0.0,[],[]
kresba,Portál domu čp. 208 ve Stříbrné uličce na Starém Městě.,1907,11x,A14CE819B67611DF820F00166F1163D4,VI 56/18,1907-01-01,1907-12-31,14.43865,50.03856,regional.address,geocode,,,,[],[]
pozitiv,"Pohled na rameno Vltavy u Primátorského ostrova s pěší lávkou na Primátorský ostrov a domy čp. 1233, 1232, 1231, 1540 a souborem budov u domu čp. 1229 v Novomlýnské ulici na Novém Městě. V pozadí domy čp. 1235 v Novomlýnské ulici.",25.3.1910,35x,5071B929651D11E6A555000C76270B94,I 11877,1910-03-25,1910-03-25,14.43098,50.09256,regional.address,geocode,,,,[],[]
negativ,Pohled do interiéru domu čp. 1012 na Starém Městě na Národní třídě (kavárna Slávia) - kavárenský salon.,6.10.1905,57x,006F2F2887DA11E2BF21525400E46D25,VIII 1347,1905-10-06,1905-10-06,14.41321,50.08173,regional.address,geocode,Eckert-ateliér,,,[],[]
pozitiv,Pohled na vstupní portál kostela sv. Salvátora na Křižovnickém náměstí na Starém Městě.,13.6.1907,22x,A14CE159B67611DF820F00166F1163D4,VI 29/6,1907-06-13,1907-06-13,14.41405,50.08641,regional.address,geocode,,,,[],[]
negativ,Pohled na část Vyšehradské skály s pevností a s Libušinou lázní. V popředí domek převozníka na břehu.,1902,47x,A0C503A9B67611DF820F00166F1163D4,VIII 533,1902-01-01,1902-12-31,14.41912,50.06521,regional.address,geocode,"Eckert, Jindřich (1833-1905)",,,[],[]
pozitiv,"Panoramatický pohled na Kobylisy a Troju od štěrkovny - jihovýchodně a jižně od Čimického háje přes vltavské údolí (od severovýchodu přes východ, jih k západu). Součást šestidílného panoramatu.",18.7.1926,151x,A0C51365B67611DF820F00166F1163D4,I 4328,1926-07-18,1926-07-18,14.41346,50.12502,regional.address,suggest,"Alexander, Antonín (1892-působnost do 1948)",,,[],[]
negativ,Okno nad hlavním vchodem kostela sv. Mikuláše na Starém Městě.,20.4.1908,18x,3E10FB1A9E3A11E3B7D600110989F46F,XI 70,1908-04-20,1908-04-20,14.4199,50.08778,regional.address,geocode,"Kříženecký, Jan (1868-1921)",,0.0,[],[]
pozitiv,Pražské povstání - 7.5.1945. Dva z příslušníků oddílu vlasovců odpočívající na chodníku v Lublaňské ulici na Novém Městě.,7.5.1945,67x,A0C5137FB67611DF820F00166F1163D4,II 995,1945-05-07,1945-05-07,14.43182,50.07009,regional.address,geocode,"Štěpánek, M.",,,[],[]
negativ,Pohled z mostu Františka I. (Legií) přes Vltavu na Národní divadlo (dům čp. 223 na Novém Městě) při stavbě nábřeží (dnes Masarykovo).,1904,40x,A118699CB67611DF820F00166F1163D4,VIII 445,1904-01-01,1904-12-31,14.41347,50.08126,regional.address,geocode,"Eckert, Jindřich (1833-1905)",,,[],[]
pozitiv,Pohled na Palachovo náměstí s domem čp. 73 (Uměleckoprůmyslové muzeum) na Starém Městě. Vlevo část čp. 79 (Rudolfinum) a vpravo část čp. 55 (FFUK). V popředí park.,1929,40x,CC8B2488763C11E0BE30000C766D2371,II 1526,1929-01-01,1929-12-31,14.63451,50.12259,regional.address,geocode,"Gubčevský, A.",,,[],[]
pozitiv,Pohled na novostavbu budovy Magistrátu hlavního města Prahy (dům čp. 2) na Starém Městě na Mariánském náměstí. Vlevo prázdné prostranství po zboření domů této části Platnéřské ulice. V pozadí část kostela sv. Mikuláše.,10.3.1913,64x,A0C4F892B67611DF820F00166F1163D4,II 522,1913-03-10,1913-03-10,14.41783,50.08711,regional.address,geocode,"Kříženecký, Jan (1868-1921)",,,[],[]
pozitiv,Pohled na dům čp. 1276 v Biskupské ulici na Novém Městě (škola).,kol.1940,25x,A14CE0D4B67611DF820F00166F1163D4,I 9146,1940-01-01,1940-12-31,14.4347,50.09126,regional.address,geocode,,,,[],[]
pozitiv,Pohled na portál domu čp. 177 v Loretánské ulici na Hradčanech.,31.7.1906,24x,A1188B4DB67611DF820F00166F1163D4,VI 24/29,1906-07-31,1906-07-31,14.39408,50.08858,regional.address,geocode,,,,[],[]
pozitiv,Pohled na okenní portál domu čp. 52 (Letohrádek královny Anny) na Hradčanech.,1.8.1908,12x,A118807AB67611DF820F00166F1163D4,VI 25/30,1908-08-01,1908-08-01,14.40526,50.09394,regional.address,geocode,,,,[],[]
pozitiv,Pohled na hlavní průčelí Arcibiskupského paláce na Hradčanském náměstí (dům čp. 56).,,27x,A1186860B67611DF820F00166F1163D4,VI 11/14 a,,,14.39755,50.08984,regional.address,geocode,Eckert-ateliér,,,[],[]
pozitiv,Pohled na hroby na Malostranském hřbitově na Smíchově při zdi do Plzeňské ulice - původní stav. Vlevo náhrobek rodiny Maškovy.,26.9.1926,91x,1DA9F6B02FB711E5A57D74D435EEBE90,I 11242,1926-09-26,1926-09-26,14.39148,50.07167,poi,suggest,"Alexander, Antonín (1892-působnost do 1948)",,,[],[]
negativ,Pohled do tunelu staroměstské kanalizace pod Malým náměstím.,2.2.1903,30x,A11884E9B67611DF820F00166F1163D4,XII 949,1903-02-02,1903-02-02,14.41979,50.08642,regional.address,geocode,"Eckert, Jindřich (1833-1905)",,0.0,[],[]
pozitiv,Okupace 1939-1945 - demonstrace 28.9.1939 proti okupantům - muž s trikolorou a odznakem s portrétem T.G.Masaryka na klobouku.,28.9.1939,32x,A14CDFC6B67611DF820F00166F1163D4,I 5148,1939-09-28,1939-09-28,14.42863,50.08014,regional.address,geocode,,,,[],[]
pozitiv,"Pohled na náměstí Kinských (Štefánikovo) vlevo s domy čp. 601, čp. 600, vpravo část domu čp. 234 na Smíchově (Štefánikova - kasárna - původně dům čp. 416 na Malé Straně, dnes dům čp. 234 na Smíchově).",kol.1905,137x,A0C4F6F8B67611DF820F00166F1163D4,I 1615,1905-01-01,1905-12-31,14.40506,50.0789,regional.address,geocode,,,,[],[]
negativ,Pohled na pavilon na výstavišti v Bubenči při Jubilejní výstavě 1891.,1891,70x,AE2FF3576A2511E2BF13525400E46D25,VIII 1152,1891-01-01,1891-12-31,14.43056,50.10462,regional.address,geocode,"Eckert, Jindřich (1833-1905)",,,[],[]
pozitiv,Vysočany - Žně na pražské periferii.,kol.1950,74x,A1187706B67611DF820F00166F1163D4,I 1571,1950-01-01,1950-12-31,14.50232,50.10869,regional.address,geocode,"Pacovský, Jaroslav",,,[],[]
pozitiv,Celkový pohled na usedlost Juliska (dům čp. 26) v Dejvicích.,11.6.1925,83x,A1187E33B67611DF820F00166F1163D4,I 1905,1925-06-11,1925-06-11,14.39144,50.10894,regional.address,suggest,"Alexander, Antonín (1892-působnost do 1948)",,,[],[]
negativ,"Pohled z Lobkovického paláce na Pražském hradě směrem k Petřínské rozhledně (v pozadí). Vpravo část Pražského hradu a zahrady, vlevo malostranské střechy a věž kostela sv. Mikuláše.",kol.1900,40x,BFEFBBB807D011E28BD16C626D41E503,XII 869,1900-01-01,1900-12-31,14.40339,50.09134,regional.address,geocode,"Eckert, Jindřich (1833-1905)",,0.0,[],[]
negativ,Pohled ze střechy Rudolfina přes Vltavu s Železnou lávkou na Malou Stranu (Klárov a Strakovo nábřeží). V pozadí Pražský hrad.,kol.1880,42x,A0C4FB1DB67611DF820F00166F1163D4,VIII 963,1880-01-01,1880-12-31,14.41521,50.09017,regional.address,geocode,"Eckert, Jindřich (1833-1905)",,,[],[]
pozitiv,Povodeň v březnu roku 1940 - ledy na Vltavě.,březen 1940,17x,A14CE2CFB67611DF820F00166F1163D4,I 1976,1940-03-01,1940-03-31,14.41126,50.0865,poi,suggest,,,,[],[]
pozitiv,Pohled na portál kláštera karmelitek (kolej barnabitů - dům čp. 184 na Hradčanech) na Hradčanském náměstí.,27.7.1906,25x,A0C50722B67611DF820F00166F1163D4,VI 24/34,1906-07-27,1906-07-27,14.39584,50.08914,regional.address,geocode,,,,[],[]
pozitiv,Pohled na dům čp. 702 na nároží Bubenského nábřeží a Argentinské ulice v Holešovicích.,20.9.1935,81x,A0C4FB07B67611DF820F00166F1163D4,I 4294,1935-09-20,1935-09-20,14.44293,50.09871,regional.address,geocode,"Alexander, Antonín (1892-působnost do 1948)",,,[],[]
negativ,"Pohled na usedlost Cibulka (dům čp. 118) v Košířích, detail průčelí obytného křídla.",1974,46x,A14CE2B5B67611DF820F00166F1163D4,VII 565,1974-01-01,1974-12-31,14.35655,50.06696,regional.address,geocode,"Chalupníček, Miroslav -, Chalupníčková, Věra (dokument 1941-1948)",,,[],[]
pozitiv,"Pohled do sklepení pod novostavbou obecné a občanské dívčí školy čp. 118 v Potockého ulici (dnes Parléřova) na Hradčanech - druhé jižní sklepení pod zbytky domu Tychona Brahe. Nad hromadou kamení je vidět probouraný vstup do dalšího sklepení, které sloužilo jako studna.",8.4.1933,2x,f6c0e7ec906d4bd2beea34996e2eaffc,Voj 4574,1933-04-08,1933-04-08,14.38728,50.08789,regional.address,geocode,"Vojta, Tomáš (1885-1934)",,0.0,[],[]
pozitiv,Pohled do Vrbkové ulice.,1981,69x,A14CE5F2B67611DF820F00166F1163D4,I 819,1981-01-01,1981-12-31,14.29347,50.05997,regional.address,geocode,"Vymazal, Jan",,,[],[]
pozitiv,"Celkový pohled na dům čp. 254 (U Města Betléma) na Betlémském náměstí na Starém Městě. Vlevo dům čp. 251, vpravo dům čp. 255.",10.6.1923,52x,8347C6919B9411E6A59B406186009F3A,A 95,1923-06-10,1923-06-10,14.4168,50.08426,regional.address,geocode,"Alexander, Antonín (1892-působnost do 1948)",,0.0,[],[]
negativ,Projekt tunelu pod Letnou architekta Františka Velicha - vstup do průkopu.,20.2.1908,51x,1FE3E5DBF63611E3AB180024BE7CD9AC,XI 527,1908-02-20,1908-02-20,14.41138,50.09203,regional.address,geocode,"Kříženecký, Jan (1868-1921)",,0.0,[],[]
negativ,"Pohled na dům čp. 648 (""V Templu"") na nároží Jakubské a Templové ulice na Starém Městě krátce před zbořením.",19.7.1911,11x,A0C50B4CB67611DF820F00166F1163D4,VIII 871,1911-07-19,1911-07-19,14.42548,50.08808,regional.address,geocode,Eckert-ateliér,,,[],[]
negativ,Celkový pohled na kostel Narození P. Marie v Michli. Vpravo kříž.,,91x,1540FB8D2C3911E8A8EF74D435EEBE90,IX 25,,,14.45239,50.04989,poi,suggest,,,,[],[]
negativ,"Pohled do interiéru novostavby hotelu ""Arcivévoda Štěpán"" na Václavském náměstí (dům čp. 826 na Novém Městě - později ""Grandhotel Šroubek"" - dnes ""Grandhotel Evropa"") - kulečník.",8.-12.8.1905,54x,404BFE470D6611E295A66C626D41E503,XII 1043,,,14.44363,50.0473,regional.address,geocode,Eckert-ateliér,,0.0,[],[]
pozitiv,"Zámek v Jinonicích (dům čp. 1 - dvůr, statek) - plán z 1818.",,32x,A14CDAFBB67611DF820F00166F1163D4,I 4250,,,14.35413,50.0556,regional.address,geocode,,,,[],[]
pozitiv,Panoramatický pohled na Libeňský ostrov a Holešovice přes Vltavu z pravého vltavského břehu při Povltavské ulici v Libni (vpravo). Pátá část pětidílného panoramatu.,6.4.1924,34x,645b9f6e4079460e95b4db2ef2fb0de7,A 549,1924-04-06,1924-04-06,14.41573,50.1153,regional.address,geocode,"Alexander, Antonín (1892-působnost do 1948)",,0.0,[],[]
pozitiv,Pohled na náhrobky Židovského hřbitova na Žižkově (v místech dnešních Mahlerových sadů).,14.4.1933,72x,3179BA98F1E711E6BC06406186009F3A,A 7712,1933-04-14,1933-04-14,14.45094,50.08172,poi,suggest,"Alexander, Antonín (1892-působnost do 1948)",,0.0,[],[]
pozitiv,"Pohled do ulice Na Příkopě od ulice 28. října s domy zleva čp. 378 (část), 388, 390 na Starém Městě. Vpravo část domu čp. 846 na Novém Městě. V pozadí Prašná brána.",1908,96x,D258C85DD85B11E89C7B74D435EEBE90,V 24/4 b,1908-01-01,1908-12-31,14.42321,50.08416,regional.address,geocode,Bellmann-ateliér,,,[],[]
pozitiv,Pohled na nános ledu u pěší lávky mezi Rohanským a Korunním ostrovem. V pozadí provizorní dřevěný most (Hlávkův) a skladiště na Rohanském ostrově.,8.2.1909,97x,58FC0DE95EEB11E6A551000C76270B94,I 11794,1909-02-08,1909-02-08,14.4369,50.09567,regional.street,suggest,,,,[],[]
pozitiv,Pohled na dům čp. 274 (restaurace Královka) v Břevnově na nároží ulic Bělohorské a Za Strahovem.,1940-1945,54x,A8332685BAD111E5A77074D435EEBE90,II 1642,1940-01-01,1945-12-31,14.37892,50.08492,regional.address,geocode,"Dub, Václav (dokumenty 1928-1983)",,,[],[]
negativ,Pohled na ostrov Štvanici při stavbě nábřeží. Vlevo část provizorního dřevěného mostu (na místě dnešního Hlávkova mostu).,28.5.1908,47x,E2DC89A590B111E2BF26525400E46D25,VIII 1475,1908-05-28,1908-05-28,14.4369,50.09567,regional.street,suggest,Eckert-ateliér,,,[],[]
pozitiv,Pohled na statek čp. 11 (nyní čp. 253) v Dolních Chabrech.,1968,46x,5CCE4474DD1511E480FB74D435EEBE90,I 11178,1968-01-01,1968-12-31,14.44449,50.14974,regional.address,suggest,"Vopravil, Josef (1902-1972)",,,[],[]
pozitiv,Pohled na jižní stranu zámku v Bohnicích (dům čp. 14).,31.7.1942,23x,2a502fcd8ccf4b8ba966ab6f7f4f282a,A 14458,1942-07-31,1942-07-31,14.43282,50.12913,regional.address,geocode,"Alexander, Antonín (1892-působnost do 1948)",,0.0,[],[]
pozitiv,Jeden z návrhů na pomník M. Jana Husa na Staroměstském náměstí - fotomontáž do fotografie. V pozadí východní křídlo Staroměstské radnice a Krenův dům.,1899,50x,A14CE77EB67611DF820F00166F1163D4,VI 5/12 a,1899-01-01,1899-12-31,14.41994,50.08663,regional.address,geocode,,,,[],[]
negativ,Pohled do Královské obory (Stromovky) v Bubenči s listnatými stromy.,kol.1885,52x,1B20DCD09B4111E18F3B6C626D41E503,XII 739,1885-01-01,1885-12-31,14.42742,50.10533,regional.address,geocode,"Eckert, Jindřich (1833-1905)",,0.0,[],[]
negativ,Pohled do kotelny domu čp. 850 v Holešovicích (obecná a měšťanská škola U Studánky).,1907,35x,E5A15236BB0C11E3A31E0024BE7CD9AC,XI 347,1907-01-01,1907-12-31,14.42773,50.10268,regional.address,geocode,"Kříženecký, Jan (1868-1921)",,0.0,[],[]
negativ,Průhled hlavní lodí kostela sv. Mikuláše na Malé Straně k oltáři.,,15x,B438D62DA4AC11E5A367406186009F3A,X 239 a,,,14.4032,50.08835,regional.address,geocode,,,,[],[]
negativ,Pohled na hlavní portál domu čp. 158 (Clam-Gallasovský palác) s Braunovými sochami Gigantů v Husově ulici na Starém Městě.,20.11.1914,83x,A0C514D7B67611DF820F00166F1163D4,XI 3614,1914-11-20,1914-11-20,14.41779,50.08642,regional.address,suggest,"Kříženecký, Jan (1868-1921)",,0.0,[],[]
pozitiv,Celkový pohled na novostavbu Elektrických podniků hl. m. Prahy v Holešovicích (dům čp. 1477) na Strossmayerově náměstí.,31.8.1937,249x,BB29DCF8E68B11E89E7C74D435EEBE90,A 11387,1937-08-31,1937-08-31,14.4368,50.09865,regional.address,geocode,"Alexander, Antonín (1892-působnost do 1948)",,0.0,[],[]
pozitiv,"Pohled na sochy v parku při domě čp. 178 (""Santoška"") na Smíchově.",12.12.1926,64x,A14CDC6FB67611DF820F00166F1163D4,I 8699,1926-12-12,1926-12-12,14.39848,50.06462,regional.address,geocode,"Alexander, Antonín (1892-působnost do 1948)",,,[],[]
pozitiv,Matějská pouť v roce 1984 na výstavišti (Park oddechu a kultury Julia Fučíka).,1984,102x,A0C514EDB67611DF820F00166F1163D4,I 1677,1984-01-01,1984-12-31,14.43056,50.10462,regional.address,geocode,"Hudeček, Jan",,,[],[]
pozitiv,"Panoramatický pohled na Záběhlice. V pozadí Michle s plynárnou, vlevo věž Vršovické vodárny, vpravo Bohdalec. Pátá část pětidílného panoramatu od východu, přes jih (Spořilov) k západu (Bohdalec).",30.6.1929,502x,5C98493B581B11E88F1F74D435EEBE90,A 5115,1929-06-30,1929-06-30,14.45107,50.04995,regional.address,geocode,"Alexander, Antonín (1892-působnost do 1948)",,0.0,[],[]
pozitiv,Přehlídka účastníků Pražského povstání na Pražském hradě 28.5.1945 - na 1. hradním nádvoří.,28.5.1945,53x,A14CDD32B67611DF820F00166F1163D4,I 5939,1945-05-28,1945-05-28,14.39836,50.09051,poi,suggest,"Hájek, Karel (1900-1978)",,0.0,[],[]
pozitiv,Pohled do interiéru Průmyslového paláce na výstaviště v Bubenči - ze souboru stereofotografií Národopisné výstavy v roce 1895.,1895,64x,B09A57C1476511E180176C626D41E503,I 9538,1895-01-01,1895-12-31,14.42967,50.10684,poi,suggest,,,,[],[]
pozitiv,Pohled na průčelí domu čp. 159 (škola) v Záběhlicích v Práčské ulici.,1940-1945,94x,A0C4FF59B67611DF820F00166F1163D4,I 1784,1940-01-01,1945-12-31,14.50071,50.05335,regional.address,geocode,,,,[],[]
negativ,Pohled do románských sklepů odkrytých při bourání domu čp. 128 v Linhartské ulici na Starém Městě.,10.5.1909,10x,e345130a5e4c4d349942c68c1a682cf8,XI 1075,1909-05-10,1909-05-10,14.37366,50.09637,regional.address,geocode,"Kříženecký, Jan (1868-1921)",,0.0,[],[]
pozitiv,Pohled do v Palackého ulice (dnes Křižíkova) směrem k východu. Vpravo průčelí továrny Breitfeld - Daněk (dům čp. 219 v Karlíně).,kol.1900,196x,A0C50A49B67611DF820F00166F1163D4,II 224,1900-01-01,1900-12-31,14.45566,50.09259,regional.address,geocode,Bellmann-ateliér,,,[],[]
pozitiv,Pohled na dům čp. 339 na Novém Městě - Svatováclavské lázně krátce před zbořením (jižní a východní průčelí se schodištěm).,18.1.1908,44x,A14CEB14B67611DF820F00166F1163D4,VI 58/20 a,1908-01-18,1908-01-18,14.41678,50.07444,regional.address,geocode,Eckert-ateliér,,,[],[]
pozitiv,Pohled na jižní průčelí bývalého pivovaru (dům čp. 2) ve Vršovické ulici (dříve třída krále Jiřího) ve Vršovicích.,11.8.1942,92x,A14CE021B67611DF820F00166F1163D4,I 4175,1942-08-11,1942-08-11,14.44891,50.06585,regional.address,geocode,"Alexander, Antonín (1892-působnost do 1948)",,,[],[]
pozitiv,"Pohled do dvora domu čp. 647 (""U Štupartů"") na nároží ulic Malé Štupartské a Jakubské (vlevo) na Starém Městě před zbořením.",16.3.1911,27x,A14CE97BB67611DF820F00166F1163D4,VI 47/31 c,1911-03-16,1911-03-16,14.42481,50.08808,regional.address,geocode,Eckert-ateliér,,,[],[]
pozitiv,"Pohled do dvora domu čp. 266 (""U Glaubiců"") mezi Malostranským náměstím a Tržištěm na Malé Straně.",7.6.1906,35x,A14CEA95B67611DF820F00166F1163D4,VI 53/17,1906-06-07,1906-06-07,14.40351,50.08765,regional.address,geocode,Eckert-ateliér,,,[],[]
pozitiv,Pohled na vstupní portál bývalého domu čp. 894 v Panské ulici na Novém Městě.,5.5.1906,17x,A0C505CEB67611DF820F00166F1163D4,VI 19/18,1906-05-05,1906-05-05,14.42659,50.08475,regional.address,geocode,,,,[],[]
negativ,Celkový pohled na mozaiku Posledního soudu na jižním průčelí chrámu sv. Víta na Pražském hradě.,před 1886,31x,A14CEA8FB67611DF820F00166F1163D4,XII 173,1800-01-01,1885-12-31,14.39995,50.09041,regional.address,geocode,"Eckert, Jindřich (1833-1905)",,0.0,[],[]
,"Kresby znaku na domech čp. 639 a 640 na Starém Městě (1559, 1560).",,8x,A14CE961B67611DF820F00166F1163D4,VI 47/30,,,14.42308,50.08803,regional.address,geocode,,,,[],[]
pozitiv,Pohled na portál domu čp. 635 (klášter minoritů u kostela sv. Jakuba) v ulici Malá Štupartská na Starém Městě.,9.4.1908,11x,A11889EDB67611DF820F00166F1163D4,VI 17/5,1908-04-09,1908-04-09,14.4257,50.08834,regional.address,geocode,,,,[],[]
negativ,"Pohled na usedlost Cibulka (dům čp. 118) v Košířích, záběr na altán v zahradě.",1974,55x,A1188BC2B67611DF820F00166F1163D4,VII 556,1974-01-01,1974-12-31,14.35655,50.06696,regional.address,geocode,"Chalupníček, Miroslav -, Chalupníčková, Věra (dokument 1941-1948)",,,[],[]
negativ,"Panoramatický pohled od Vyšehradu na Nusle, v popředí Ostrčilovo náměstí, Jaromírova ulice, v pozadí vpravo stavba Nuselského mostu.",kol.1965,102x,A14CE46BB67611DF820F00166F1163D4,VII 324,1965-01-01,1965-12-31,14.42486,50.06518,regional.address,geocode,"Chalupníček, Miroslav -, Chalupníčková, Věra (dokument 1941-1948)",,,[],[]
negativ,"Pohled do interiéru domu čp. 553 v Celetné ulici na Starém Městě - výzdoba vinárny ""Bodega""",kol.1880,95x,0E1F55E19AAC11E191A46C626D41E503,XII 715,1880-01-01,1880-12-31,14.42273,50.08653,regional.address,geocode,"Eckert, Jindřich (1833-1905)",,0.0,[],[]
pozitiv,"Pohled na vstupní portál domu čp. 560 (""U Nožičků"") v Celetné ulici na Starém Městě.",27.6.1906,23x,A0C501FEB67611DF820F00166F1163D4,VI 16/1,1906-06-27,1906-06-27,14.42394,50.08639,regional.address,geocode,,,,[],[]
pozitiv,Pohled na barokní farní kostel sv. Mikuláše a faru (vlevo) ve Vršovicích.,7.8.1942,117x,A0C508C6B67611DF820F00166F1163D4,I 4167,1942-08-07,1942-08-07,14.45318,50.06859,regional.address,geocode,"Alexander, Antonín (1892-působnost do 1948)",,,[],[]
negativ,Pohled od Střeleckého ostrova přes Vltavu na Malou Stranu s Kampou v popředí. V pozadí vpravo dům čp. 503 na Malé Straně (Sovovy - Odkolkovy mlýny) po požáru roku 1896. V pozadí uprostřed Pražský hrad.,kol.1900,32x,A14CE471B67611DF820F00166F1163D4,VIII 967,1900-01-01,1900-12-31,14.40839,50.08359,regional.address,geocode,"Eckert, Jindřich (1833-1905)",,,[],[]
pozitiv,Pohled na hlavní průčelí Lorety (dům čp. 100 na Hradčanech) na Loretánském náměstí.,29.3.1907,68x,A0C4F6F6B67611DF820F00166F1163D4,I 254,1907-03-29,1907-03-29,14.39151,50.08925,regional.address,geocode,"Klíma, Alois, Ing. (1873-1955)",,,[],[]
pozitiv,"Pohled do Husovy ulice s domem čp. 236 ""U Vocílků"" (""U Vocelků"") na Starém Městě - po zřízení podloubí a odbourání dvorní zdi v roce 1926.",26.3.1945,27x,DDD9F7FAECDB11DFBD7B000C766D2371,I 9451,1945-03-26,1945-03-26,14.41832,50.08461,regional.address,geocode,"Alexander, Antonín (1892-působnost do 1948)",,,[],[]
pozitiv,Pohled na Hradčanské náměstí s Arcibiskupským palácem (dům čp. 56) na Hradčanech a Pražským hradem. V pozadí věže chrámu sv. Víta s lešením.,,43x,A0C508BEB67611DF820F00166F1163D4,VI 10/12 b,,,14.39755,50.08984,regional.address,geocode,"Eckert, Jindřich (1833-1905)",,,[],[]
negativ,Pohled do tunelu staroměstské kanalizace pod Prašnou bránou.,15.7.1905,65x,60942C850E2711E2935B6C626D41E503,XII 1064,1905-07-15,1905-07-15,14.42724,50.08753,regional.address,geocode,Eckert-ateliér,,0.0,[],[]
pozitiv,"Pohled do dvora domu čp. 374 (Městská věznice - hnanecká stanice - zaopatřovací ústav ""Fišpanka"") na Novém Městě v ulici Pod Slovany - skupina cikánů.",1921,63x,A11871E2B67611DF820F00166F1163D4,II 1008,1921-01-01,1921-12-31,14.41633,50.07326,regional.address,geocode,,,,[],[]
pozitiv,Celkový pohled na sochu Jana Žižky před Národním památníkem na Vítkově.,,93x,A11871DAB67611DF820F00166F1163D4,I 4725,,,14.44949,50.08846,poi,suggest,"Zeman, Josef",,,[],[]
pozitiv,Panoramatický pohled z místa vysoko nad hlubočepským hřbitovem na jinonickou krajinu nad vsí Hlubočepy v Prokopském údolí. Šestá část osmidílného kruhového panoramatu.,19.9.1925,11x,d6f7fb13efa74ee4b8bf0981031ae205,A 2151,1925-09-19,1925-09-19,14.3966,50.04472,poi,suggest,"Alexander, Antonín (1892-působnost do 1948)","On-line výstava na webu AMP ""Pražské panorama 2. část - Prokopské a Dalejské údolí"".
                    
                
                    
                  Součást kruhového panoramatu A 2146, A 2147, A 2148, A 2149, A 2150, A 2151, A 2152, A 2153.
                    
                
                    
                  List 20 bod 34
                    
                
                    
                  Plány sign. AMP XXXII.",0.0,[],[]
pozitiv,"Pohled ze stráně nad Malou Chuchlí na vltavské údolí. V popředí Malá Chuchle, železniční trať a Vltava. Za řekou vlevo Braník a vpravo Hodkovičky. Součást panoramatu.",17.6.1927,87x,A0C50E19B67611DF820F00166F1163D4,I 8809,1927-06-17,1927-06-17,14.39178,50.02443,regional.address,geocode,"Alexander, Antonín (1892-působnost do 1948)",,,[],[]
negativ,Pohled do interiéru kostela sv. Mikuláše na Malostranském náměstí - freska v klenbě kaple sv. Barbory.,7.10.1907,35x,81BE5FB4DB7111E3BB45406186009F3A,XI 422,1907-10-07,1907-10-07,14.4032,50.08835,regional.address,geocode,"Kříženecký, Jan (1868-1921)",,0.0,[],[]
pozitiv,Pohled na oslavy 10. výročí osvobození - vystoupení Alexandrovova souboru písní a tanců na stadionu Sparta na Letné.,květen 1955,48x,7E75B72A9B8911E2BF2D525400E46D25,VI 37/21,1955-05-01,1955-05-31,14.41503,50.09959,regional.address,geocode,"Rakovec, Oldřich",,,[],[]
negativ,Pohled do interiéru tržnice masa v areálu pražských Ústředních jatek v Holešovicích (dům čp. 306).,1895,79x,249C9A3F921811E2BF28525400E46D25,VIII 1275,1895-01-01,1895-12-31,14.44531,50.09841,regional.address,geocode,"Eckert, Jindřich (1833-1905)",,,[],[]
pozitiv,"Pohled do ulice Na Zlíchově s domy čp. 260, 207 v Hlubočepích.",11.10.1925,106x,A1187708B67611DF820F00166F1163D4,I 290,1925-10-11,1925-10-11,14.40842,50.04817,regional.address,geocode,"Alexander, Antonín (1892-působnost do 1948)",,,[],[]
pozitiv,Pohled na staveniště budovy Magistrátu hlavního města Prahy (dům čp. 2) na Starém Městě na Mariánském náměstí. V pozadí část původní zástavby v Platnéřské ulici.,6.11.1908,36x,065266044D9711E1AE2C6C626D41E503,II 1546,1908-11-06,1908-11-06,14.41783,50.08711,regional.address,geocode,"Kříženecký, Jan (1868-1921)",,,[],[]
negativ,Pohled na portrétní bustu Václava Lucemburského v triforiu chrámu sv. Víta na Pražském hradě.,květen 1924,27x,4A324DFE3DA011E499B8406186009F3A,XI 6292,1924-05-01,1924-05-31,14.4006,50.09089,poi,suggest,Eckert-ateliér,,0.0,[],[]
negativ,Pohled na severní portál kostela P. Marie před Týnem na Starém Městě.,13.6.1906,20x,49EE2533A92F11E3839F0024BE7CD9AC,XI 137,1906-06-13,1906-06-13,14.42396,50.08884,regional.address,geocode,"Kříženecký, Jan (1868-1921)",,0.0,[],[]
pozitiv,Panoramatický pohled na Libeňský ostrov a Holešovice přes Vltavu z pravého vltavského břehu při Povltavské ulici v Libni. Druhá část pětidílného panoramatu.,6.4.1924,32x,771956b44d4d4cdbba1fab0ca3d44ad7,A 546,1924-04-06,1924-04-06,14.41959,50.11603,regional.address,geocode,"Alexander, Antonín (1892-působnost do 1948)",,0.0,[],[]
pozitiv,Pohled na stavbu vyústění kanálů na Těšnově vedoucí k Šaškovým mlýnům v rámci splavnění Vltavy u ostrova Štvanice.,8.10.1909,78x,3D5BBD47647711E6A554000C76270B94,I 11861,1909-10-08,1909-10-08,14.43436,50.09335,regional.address,geocode,,,,[],[]
pozitiv,"Pohled z Kaprovy ulice do Valentinské ulice. Vlevo nárožní dům čp. 52, vpravo nárožní dům čp. 56 na Starém Městě. Uprostřed původní dům čp. 98, v pozadí Klementinum.",9.11.1924,31x,0e4569baf1784f9591b3596b9b12d9e2,A 1425,1924-11-09,1924-11-09,14.41687,50.0883,regional.address,geocode,"Alexander, Antonín (1892-působnost do 1948)",,0.0,[],[]
pozitiv,Socha Kronikáře a Filozofa z orloje v jižním průčelí Staroměstské radnice (dům čp. 1 na Starém Městě) na Staroměstském náměstí před restaurováním.,21.9.1911,36x,55A2672D90EA11E8B3B474D435EEBE90,V 69/15 b,1911-09-21,1911-09-21,14.42009,50.087,regional.address,suggest,"Kříženecký, Jan (1868-1921)",,,[],[]
negativ,Pohled z ulice Československé armády na Vítězné náměstí v Dejvicích.,kol.1950,83x,A1187DCCB67611DF820F00166F1163D4,VII 70,1950-01-01,1950-12-31,14.39656,50.10114,regional.address,geocode,"Chalupníček, Miroslav -, Chalupníčková, Věra (dokument 1941-1948)",,,[],[]
pozitiv,Pohled do interiéru domu čp. 552 na Starém Městě na Staroměstském náměstí před zbořením.,kol.1895,17x,A1188ACFB67611DF820F00166F1163D4,XII 2061 - pozitiv,1895-01-01,1895-12-31,14.42204,50.0872,regional.address,geocode,,,0.0,[],[]
negativ,Pohled na jednu z vikýřových soch z divadla (Německé - Smetanovo - Státní opera - dům čp. 101 na Vinohradech).,kol.1890,65x,B6FC5BBE9E9911E1AB206C626D41E503,XII 807,1890-01-01,1890-12-31,14.46321,50.07369,regional.address,geocode,"Eckert, Jindřich (1833-1905)",,0.0,[],[]
negativ,Pohled do Kaprovy ulice vlevo s domem čp. 52 na Starém Městě krátce před zbořením.,30.1.1907,35x,A1187DB0B67611DF820F00166F1163D4,VIII 591,1907-01-30,1907-01-30,14.41687,50.0883,regional.address,geocode,Eckert-ateliér,,,[],[]
pozitiv,Pohled do interiéru kostela sv. Cyrila a Metoděje v Resslově ulici na Novém Městě - výzdoba kruchty a kostelní klenby malbami a štukem.,27.9.1934,23x,ccfd121e3289463199d8e9dbf7978842,A 9066,1934-09-27,1934-09-27,14.41762,50.07596,regional.address,geocode,"Alexander, Antonín (1892-působnost do 1948)",,0.0,[],[]
pozitiv,"Pohled na dům čp. 648 (""V Templu"") na nároží Jakubské a Templové ulice na Starém Městě krátce před zbořením.",19.7.1911,27x,A14CEA03B67611DF820F00166F1163D4,VI 47/32 a,1911-07-19,1911-07-19,14.42548,50.08808,regional.address,geocode,Eckert-ateliér,,,[],[]
pozitiv,Pohled na vápencové doly (Velký Prokopský lom) v Prokopském údolí. První část třídílného panoramatu.,28.10.1925,8x,fd0a270a198241cd99269209937e2a67,A 2265,1925-10-28,1925-10-28,14.40355,50.04138,regional.address,geocode,"Alexander, Antonín (1892-působnost do 1948)","On-line výstava na webu AMP ""Pražské panorama 2. část - Prokopské a Dalejské údolí"".
                    
                
                    
                  Součást panoramatu A 2265, A 2266, A 2267.
                    
                
                    
                  Bod 15 - list 20a
                    
                
                    
                  Plány sign. AMP XXXII.",0.0,[],[]
negativ,Detailní pohled na vázu ze zahrady Libeňského zámku (dům čp. 1).,7.3.1905,52x,E44C986F0D6311E295A66C626D41E503,XII 1037,1905-03-07,1905-03-07,14.46926,50.10457,regional.address,geocode,Eckert-ateliér,,0.0,[],[]
mapa,"List 20a plánu Prahy a okolí z let 1910-1914 (nakreslené stavebním úřadem, vydané nákladem obce Pražské, reprodukce Unie v Praze) se zákresy stanovišť fotografů v rámci akce Památkového sboru fotografování pražských památek a panoramat periferních oblastí ve 20., 30. a 40. letech 20. století.",1910-1914 - 1923,262x,4C046B3207F511E7A783406186009F3A,XXXII 1/20 a,,,14.35413,50.0556,regional.address,geocode,,,0.0,[],[]
negativ,"Výstava prací žáků Pomocné školy v Praze VIII. ""Na Rašáku"" na Staroměstské radnici.",30.6.1909,21x,5B1D443112E811E2A6B56C626D41E503,XII 1173,1909-06-30,1909-06-30,14.41994,50.08663,regional.address,geocode,Eckert-ateliér,,0.0,[],[]
negativ,Pohled do interiéru Náprstkova muzea (dům čp. 269 na Starém Městě) - starý tiskařský lis.,[1863-1905],50x,A91FDEA792D911E193C36C626D41E503,XII 523,,,14.33393,50.0929,regional.address,suggest,"Eckert, Jindřich (1833-1905)",Datace neznámá. Za účelem vyhledávání byla nastavena na časový rozsah celé sbírky.,0.0,[],[]
pozitiv,Pohled na Alšovo nábřeží s domem čp. 80 (Uměleckoprůmyslová škola) na Starém Městě. Vlevo dům čp. 79 (Rudolfinum) na náměstí Jana Palacha.,23.3.1936,42x,B633FA2BE1A311E899FA74D435EEBE90,A 10145,1936-03-23,1936-03-23,14.41521,50.09017,regional.address,geocode,"Alexander, Antonín (1892-působnost do 1948)",,0.0,[],[]
pozitiv,Pohled do Malé Fürstenberské zahrady na Malé Straně s pavilonem a s terasami. V pozadí část Pražského hradu.,kol.1900,34x,A14CE8FAB67611DF820F00166F1163D4,VI 8/13 b,1900-01-01,1900-12-31,14.4062,50.09097,regional.address,geocode,"Eckert, Jindřich (1833-1905)",,,[],[]
pozitiv,Primátor Alois Říha na balkoně Staroměstské radnice s Janem Grmelou.,1942,45x,bca926648f8f48cf9cb254760ff9c48c,I 13010,1942-01-01,1942-12-31,14.42009,50.087,regional.address,suggest,"Schulze, Annelise",,,[],[]
negativ,"Pohled do ""rytířského sálu"" původní expozice Městského muzea v Praze (dům čp. 1554 na Novém Městě) v městských sadech Na Poříčí (dnes Švermovy sady).",1902,44x,A0C50E81B67611DF820F00166F1163D4,VIII 237,1902-01-01,1902-12-31,14.43848,50.0901,regional.address,geocode,"Eckert, Jindřich (1833-1905)",,,[],[]
negativ,Pohled od Střeleckého ostrova přes Vltavu na Malou Stranu s Kampou v popředí. V pozadí vpravo dům čp. 503 na Malé Straně (Sovovy - Odkolkovy mlýny) po požáru roku 1896. V pozadí uprostřed Pražský hrad.,kol.1900,34x,A1186FE8B67611DF820F00166F1163D4,VIII 226,1900-01-01,1900-12-31,14.40839,50.08359,regional.address,geocode,"Eckert, Jindřich (1833-1905)",,,[],[]
pozitiv,"Pohled do dvora zámku v Jinonicích (dům čp. 1 - dvůr, statek).",1940-1945,31x,A1188114B67611DF820F00166F1163D4,I 4269,1940-01-01,1945-12-31,14.35686,50.05361,regional.address,geocode,,,,[],[]
negativ,Pohled do interiéru kostela sv. Petra a Pavla na Vyšehradě - hlavní loď.,13.7.1904,39x,A118778CB67611DF820F00166F1163D4,VIII 923,1904-07-13,1904-07-13,14.41785,50.06442,poi,suggest,"Eckert, Jindřich (1833-1905)",,,[],[]
negativ,Pohled do Šáreckého údolí v Dejvicích - Dívčí skok.,kol.1890,48x,13F575FB9CFF11E2BF2E525400E46D25,VIII 1621,1890-01-01,1890-12-31,14.32076,50.09976,poi,suggest,"Eckert, Jindřich (1833-1905)",,,[],[]
pozitiv,Celkový pohled na zahradní průčelí Lobkovického paláce čp. 347 (Lobkovický-Přehořovský palác) na Malé Straně - z výšky. V pozadí Pražský hrad.,kol.1930,30x,A1187997B67611DF820F00166F1163D4,I 8510,1930-01-01,1930-12-31,14.39803,50.08729,regional.address,geocode,"Vojta, Tomáš (1885-1934)",,,[],[]
negativ,Pohled do interiéru domu čp. 365 (Schönbornský palác) na Malé Straně - salon.,19.11.1902,18x,ABD3C66074F111E2BF16525400E46D25,VIII 1188,1902-11-19,1902-11-19,14.40131,50.08733,regional.address,geocode,"Eckert, Jindřich (1833-1905)",,,[],[]
pozitiv,Průhled ulicí U Vysočanského pivovaru s domem čp. 1 (pivovar) ve Vysočanech (vpravo).,28.10.1942,147x,A1187356B67611DF820F00166F1163D4,I 29,1942-10-28,1942-10-28,14.50244,50.10743,regional.address,suggest,"Alexander, Antonín (1892-působnost do 1948)",,,[],[]
negativ,Pohled do interiéru kostela sv. Ignáce na Karlově náměstí na Novém Městě - postranní část oltáře Srdce Ježíšova.,1913,49x,611248D06AF811E295C66C626D41E503,XII 1355,1913-01-01,1913-12-31,14.419,50.07337,regional.address,geocode,Eckert-ateliér,,0.0,[],[]
pozitiv,"Pohled do Havlíčkovy ulice s domy čp. 305, ústí Jeronýmovy ulice, 329, 330, ústí Husovy ulice na Smíchově.",16.9.1934,62x,A0C4FF4DB67611DF820F00166F1163D4,I 8707,1934-09-16,1934-09-16,14.40328,50.077,regional.address,geocode,"Alexander, Antonín (1892-působnost do 1948)",,,[],[]
negativ,"Pohled na předmostí Palackého mostu z novoměstského nábřeží v místech dnešního Palackého náměstí. V popředí sochy J. V. Myslbeka: Přemysl a Libuše, Lumír a Píseň. V pozadí Palackého ulice (dnes Lidická) s nárožním domem čp. 766 na Smíchově.",1897-1898,87x,A11889D9B67611DF820F00166F1163D4,VIII 232,1897-01-01,1898-12-31,14.41017,50.07256,regional.address,geocode,"Eckert, Jindřich (1833-1905)",,,[],[]
pozitiv,Pohled do interiéru arkýřové kaple Staroměstské radnice (dům čp. 1 na Starém Městě) - zničený polygon za oltářem po požáru 8.5.1945.,17.5.1945,28x,EF399FB2D0B411EABE1F74D435EEBE90,A 16943,1945-05-17,1945-05-17,14.34054,50.07267,regional.address,suggest,"Alexander, Antonín (1892-působnost do 1948)",,0.0,[],[]
pozitiv,Pohled do Prokopského údolí s železničním viaduktem (Pražský Semmering) v popředí.,1923,98x,A0C5197FB67611DF820F00166F1163D4,I 4796,1923-01-01,1923-12-31,14.40355,50.04138,regional.address,geocode,"Bernau, Karel, Ing. (1880-1948)",,,[],[]
negativ,Pohled do parku na Karlově náměstí - kašna se sloupem se sv. Josefem před Novoměstskou radnicí (stav před regotizací).,1890-1891,42x,A0C4F7D9B67611DF820F00166F1163D4,VIII 1062,1890-01-01,1891-12-31,14.4213,50.07812,regional.address,geocode,"Eckert, Jindřich (1833-1905)",,,[],[]
pozitiv,Pohled do Hellichovy ulice s domem čp. 457 na Malé Straně (škola).,14.9.1930,31x,A0C51A8BB67611DF820F00166F1163D4,I 9153,1930-09-14,1930-09-14,14.4052,50.08425,regional.address,geocode,"Alexander, Antonín (1892-působnost do 1948)",,,[],[]
pozitiv,Celkový pohled na nárožní dům čp. 969 na Starém Městě (lahůdkářství Josef Lippert).,kol.1925,55x,A1186941B67611DF820F00166F1163D4,I 4880,1925-01-01,1925-12-31,14.42767,50.08708,regional.address,geocode,"Vojta, Tomáš (1885-1934)",,,[],[]
pozitiv,"Pohled do Podskalské ulice s domy (zleva) čp. 331 (""U Mužínů""), 332, 333, 334 na Novém Městě.",22.2.1899,54x,A14CEABBB67611DF820F00166F1163D4,VI 48/8,1899-02-22,1899-02-22,14.41496,50.07524,regional.address,geocode,"Eckert, Jindřich (1833-1905)",,,[],[]
negativ,Pohled do interiéru kostela P. Marie Na Slovanech (v Emauzích) na Novém Městě - oltář P. Marie Montserratské.,před 1897,41x,A0C4FC3EB67611DF820F00166F1163D4,VIII 403,1800-01-01,1896-12-31,14.41719,50.07215,regional.address,geocode,"Eckert, Jindřich (1833-1905)",,,[],[]
pozitiv,Panoramatický pohled z vrchu Brabenec k západu na Radlice v okolí dnešní Radlické ulice. Druhá část pětidílného panoramatu.,srpen 1922,95x,A0C5059AB67611DF820F00166F1163D4,I 4839,1922-08-01,1922-08-31,14.39646,50.05819,regional.address,geocode,"Bernau, Karel, Ing. (1880-1948)",,,[],[]
pozitiv,"Pohled z mostu Svatopluka Čecha na Strakovu akademii (dům čp. 128 na Malé Straně) a Občanskou plovárnu (dům čp. 337 v Holešovicích) pod Mariánskými hradbami. Vlevo část Vojenské plovárny, v pozadí Pražský hrad.",25.6.1908,64x,A14CEAC1B67611DF820F00166F1163D4,VI 60/1,1908-06-25,1908-06-25,14.41139,50.09203,regional.address,geocode,Eckert-ateliér,,,[],[]
negativ,"Pohled ze Štvanice na Korunní ostrov. V pozadí Nové Město, vpravo most císaře Františka Josefa I. (Štefánikův) a nad ním Hradčany s Pražským hradem.",26.8.1907,41x,A0C50582B67611DF820F00166F1163D4,VIII 960,1907-08-26,1907-08-26,14.44021,50.09583,regional.address,geocode,Eckert-ateliér,,,[],[]
pozitiv,Pohled na Kosárkovo nábřeží s domem čp. 127 a čp. 554 (původně domek výběrčího mýta na Železné lávce) na Malé Straně.,1970,38x,A118717CB67611DF820F00166F1163D4,I 8920,1970-01-01,1970-12-31,14.41164,50.09047,regional.address,geocode,"Vopravil, Josef (1902-1972)",,,[],[]
pozitiv,"Pohled na vstupní portál domu čp. 452 (""U červeného orla"") v Jilské ulici na Starém Městě.",25.5.1906,20x,A118847FB67611DF820F00166F1163D4,VI 16/8,1906-05-25,1906-05-25,14.41906,50.08589,regional.address,geocode,,,,[],[]
kresba tužkou,Detaily fasády domů čp. 433 a 447 na Starém Městě.,,16x,A1187C4FB67611DF820F00166F1163D4,VI 2/7,,,14.42001,50.0855,regional.address,geocode,,,,[],[]
pozitiv,Pohled do dvora domu čp. 800 na Starém Městě (obecní dvůr).,,25x,A118783CB67611DF820F00166F1163D4,I 4451,,,14.42334,50.09144,regional.address,geocode,,,,[],[]
pozitiv,Sportovní hry během VII. všesokolského sletu na Letné v Holešovicích - běh žen.,27.-30.6.1920,41x,05CA18AC87DA11E79100406186009F3A,I 12195,,,14.42032,50.09595,regional.address,geocode,"Vojta, Tomáš (1885-1934)",,,[],[]
pozitiv,Celkový pohled na dům čp. 307 v Bartolomějské ulici na Starém Městě. Vlevo dům čp. 306 a vpravo dům čp. 308.,7.11.1927,43x,0F485343DE2911E6BA30406186009F3A,A 3829,1927-11-07,1927-11-07,14.41652,50.08266,regional.address,geocode,"Alexander, Antonín (1892-působnost do 1948)",,0.0,[],[]
negativ,Pohled do dvora domu čp. 242 ve Zlaté a Husově ulici na Starém Městě Pražském.,16.9.1947,27x,592373F018D011E9AFD5406186009F3A,X 4498,1947-09-16,1947-09-16,14.41805,50.08516,regional.address,geocode,"Poustecký, Josef",,,[],[]
pozitiv,Pohled do bývalé Goldřichovy ulice v Josefově.,12.5.1907,39x,FDCF85083E9E11E1B434000BCDD04BFA,V 97/4,1907-05-12,1907-05-12,14.41826,50.08957,regional.address,geocode,"Klíma, Alois, Ing. (1873-1955)",,,[],[]
pozitiv,Pohled na hroby při nově vystavené (oproti původní posunuté) zdi Malostranského hřbitova na Smíchově - při Plzeňské ulici.,kol.1950,61x,112DE511304211E5A53574D435EEBE90,I 11300,1950-01-01,1950-12-31,14.39148,50.07167,poi,suggest,"Pacovský, Jaroslav",,,[],[]
pozitiv,"Pohled do zahrady domu čp. 180 na Hradčanech (bývalý Trautmannsdorfský palác) - ""práce na výkopu válečného vodního bazénu"". Objevená opuková zeď vedoucí ke kapličce při Loretánské ulici.",5.6.1944,40x,41FE1C2A748711E4A81F406186009F3A,I 11074,1944-06-05,1944-06-05,14.39375,50.08878,regional.address,geocode,"Alexander, Antonín (1892-působnost do 1948)",,,[],[]
pozitiv,Pohled na území Smíchova z nejvyššího vrcholu Černého vrchu. Uprostřed letní cvičiště smíchovského Sokola. V pozadí vpravo Vyšehrad. Součást panoramatu.,18.5.1927,61x,AAB35BB0533211E19DFA6C626D41E503,I 9569,1927-05-18,1927-05-18,14.38927,50.06883,regional.address,geocode,"Alexander, Antonín (1892-působnost do 1948)",,,[],[]
pozitiv,"Panoramatický pohled na Hloubětín, Kyje, Hrdlořezy (?) z nejvyššího vrchu Hlohovce (od západu přes sever a východ). Součást panoramatu.",2.10.1927,93x,A1186746B67611DF820F00166F1163D4,I 4858,1927-10-02,1927-10-02,14.62505,50.11559,regional.address,geocode,"Alexander, Antonín (1892-působnost do 1948)",,,[],[]
pozitiv,"Panoramatický pohled na Dvořákovo nábřeží od Mariánských hradeb. V popředí část Občanské plovárny. Vlevo Čechův most. Na nábřeží zleva domy čp. 873, čp. 886, čp. 885, čp. 1033, čp. 884, čp. 883, čp. 206, čp. 207, čp. 208. Dále vpravo stará nízká zástavba v Josefově a Sanytrová ulice před postavením Právnické fakulty.",1905-1915,131x,734F00E5701A11E997F474D435EEBE90,II 1892,1905-01-01,1915-12-31,14.41547,50.09073,regional.address,geocode,"Vojta, Tomáš (1885-1934)",,,[],[]
pozitiv,Pohled na Bubenské nábřeží při stavbě Severojižní magistrály v Holešovicích. V pozadí Hlávkův most.,září 1980,63x,9F5BF4A1E69B11E89E7C74D435EEBE90,I 12416,1980-09-01,1980-09-30,14.44531,50.09841,regional.address,geocode,"Jelínková, Jana (1951-)",,,[],[]
pozitiv,Celkový pohled na Leopoldovu bránu na Vyšehradě.,1968,60x,A14CE198B67611DF820F00166F1163D4,I 4702,1968-01-01,1968-12-31,14.42171,50.06317,poi,suggest,"Vopravil, Josef (1902-1972)",,,[],[]
negativ,Pohled na budovu Wilsonova nádraží (dům čp. 300 na Vinohradech) ve Wilsonově ulici (dříve Sadová).,14.9.1914,76x,79B5EA4AA6C911E8B44374D435EEBE90,XI 3553,1914-09-14,1914-09-14,14.43549,50.08356,regional.address,suggest,"Kříženecký, Jan (1868-1921)",,0.0,[],[]
negativ,"Pohled na západní stranu Staroměstského náměstí. Uprostřed Staroměstská radnice (dům čp. 1 na Starém Městě) s věží, arkýřem a se strážnicí, vlevo domy jižní strany náměstí při ústí Železné ulice a Mariánský sloup. Vpravo dům čp. 936 (Krenův).",1.8.1913 (repro),78x,82F1FFCB29FC11E9A7CF406186009F3A,XI 2860,,,14.42174,50.08677,regional.address,geocode,,"Kříženecký, Jan (repro)",0.0,[],[]
negativ,Pohled na na hlavní průčelí Clam-Gallasovského paláce do Husovy ulice.,2.4.1914,39x,A14CE647B67611DF820F00166F1163D4,XI 3162,1914-04-02,1914-04-02,14.41779,50.08642,regional.address,geocode,"Kříženecký, Jan (1868-1921)",,0.0,[],[]
negativ,Celkový pohled na budovu Národního muzea (dům čp. 1700 na Novém Městě) z městského sadu (později Vrchlického sady). Vlevo část domu čp. 555 na Vinohradech. Vpravo pohled do Mezibranské ulice.,kol.1892,106x,A11886F1B67611DF820F00166F1163D4,VIII 925,1892-01-01,1892-12-31,14.43056,50.07918,regional.address,geocode,"Eckert, Jindřich (1833-1905)",,,[],[]
pozitiv,Pohled na staré Bohnice s kostelem sv. Petra a Pavla uprostřed.,1959,22x,b97f34d63bd34819bc5208e6e7868eda,I 12944,1959-01-01,1959-12-31,14.41054,50.13588,regional.address,geocode,"Hnilička, Eduard (1887-1967)",,,[],[]
pozitiv,Panoramatický pohled od Židovských pecí. Sedmá část devítidílného kruhového panoramatu od západu přes sever až zpět k západu.,31.8.1926,13x,99718d7bb3cd440f9b3215799e2927cd,A 2649,1926-08-31,1926-08-31,14.47764,50.08857,poi,suggest,"Alexander, Antonín (1892-působnost do 1948)","Pohled z bodu 3 list 13.
                    
                
                    
                  Součást panoramatu A 2643, A 2644, A 2645, A 2646, A 2647, A 2648, A 2649, A 2650, A 2651.",0.0,[],[]
negativ,"Pohled na Hradčanské náměstí s Arcibiskupským palácem (dům čp. 56) na Hradčanech a Pražským hradem. Vpravo část domu čp. 185, v pozadí nové věže chrámu sv. Víta.",kol.1898,45x,47177277F8AC11DFBD8B000C766D2371,XII 72,1898-01-01,1898-12-31,14.39755,50.08984,regional.address,geocode,"Eckert, Jindřich (1833-1905)",,0.0,[],[]
pozitiv,Pohled na dům čp. 490 (palác Metychů z Čečova - Hrzánský) na Velkopřevorském náměstí na Malé Straně.,25.3.1908,26x,FF58CF8204F311E3A4F66C626D41E503,II 1573,1908-03-25,1908-03-25,14.40739,50.08615,regional.address,geocode,"Kříženecký, Jan (1868-1921)",,,[],[]
negativ,Celkový pohled na kostel sv. Václava na Proseku.,13.2.1906,63x,626EF407A60511E3BC040024BE7CD9AC,XI 114,1906-02-13,1906-02-13,14.49396,50.11726,regional.address,geocode,"Kříženecký, Jan (1868-1921)",,0.0,[],[]
pozitiv,"Pohled na dnešní nábřeží Kpt. Jaroše ze Štvanice. Zprava domy čp. 464, čp. 421 v Holešovicích. Vpravo Hlávkův most.",2.2.1927,68x,81912E56E68411E89E7C74D435EEBE90,A 2877,1927-02-02,1927-02-02,14.43704,50.09958,regional.address,geocode,"Alexander, Antonín (1892-působnost do 1948)",,0.0,[],[]
pozitiv,Panoramatický pohled do Dalejského údolí u osady Klukovice - domky vlevo ve stráni nad silnicí vedoucí do tehdejší osady Slivence. Třetí část šestidílného panoramatu. První část šestidílného panoramatu.,21.7.1925,12x,710acf48eb6b41ffb3724761c4aef6ce,A 1974,1925-07-21,1925-07-21,14.36063,50.03642,regional.address,geocode,"Alexander, Antonín (1892-působnost do 1948)","On-line výstava na webu AMP ""Pražské panorama 2. část - Prokopské a Dalejské údolí"".
                    
                
                    
                  Součást panoramatu A 1967, A 1968, A 1970, A 1971. List 20a bod 23
                    
                
                    
                  Plány sign. AMP XXXII.",0.0,[],[]
pozitiv,Socha sv. Ludmily na Karlově mostě (Matyáš Bernard Braun).,[1856-2014],113x,A11881CEB67611DF820F00166F1163D4,II 1030,,,14.41126,50.0865,poi,suggest,,Datace neznámá. Za účelem vyhledávání byla nastavena na časový rozsah celé sbírky.,0.0,[],[]
pozitiv,Pohled na reprezentační okno jižního průčelí Staroměstské radnice (domu čp. 1) - se znaky Českého království a Starého Města z 2.pol. 15.století,1988,45x,A14CDCD9B67611DF820F00166F1163D4,I 4472,1988-01-01,1988-12-31,14.42009,50.087,regional.address,suggest,"Rameš, František",,,[],[]
negativ,Pohled ze Staroměstské mostní věže na Malou Stranu a Petřín. Uprostřed čp. 506 na Malé Straně. Vlevo domy čp. 200 (část) a 201 na Starém Městě. Vpravo část Karlova mostu.,kol.1898,52x,A14CE100B67611DF820F00166F1163D4,VIII 418,1898-01-01,1898-12-31,14.4133,50.08541,regional.address,geocode,"Eckert, Jindřich (1833-1905)",,,[],[]
pozitiv,Pohled do Mostecké ulice s částí domů čp. 55 a 282 na Malé Straně.,1965,38x,A14CE85CB67611DF820F00166F1163D4,I 9350,1965-01-01,1965-12-31,14.40603,50.08725,regional.address,geocode,,,,[],[]
pozitiv,Panoramatický pohled na Jinonice a Butovice - území kolem diabasového vrchu Kačný (od východu přes jih a západ). Součást panoramatu.,17.7.1925,55x,A0C4FACAB67611DF820F00166F1163D4,I 4833,1925-07-17,1925-07-17,14.3633,50.04643,poi,suggest,"Alexander, Antonín (1892-působnost do 1948)",,,[],[]
pozitiv,Pohled na dům čp. 101 na Vinohradech (divadlo Německé - Smetanovo - Státní opera) v Hooverově ulici (dnes Wilsonova).,kol.1890,59x,A14CE840B67611DF820F00166F1163D4,VI 6/7 b,1890-01-01,1890-12-31,14.43263,50.08071,regional.address,geocode,"Eckert, Jindřich (1833-1905)",,,[],[]
pozitiv,Pohled na nový dům čp. 180 v Karlově ulici na Starém Městě.,16.11.1944,30x,A11885FEB67611DF820F00166F1163D4,I 8869,1944-11-16,1944-11-16,14.4165,50.08597,regional.address,geocode,"Alexander, Antonín (1892-působnost do 1948)",,,[],[]
negativ,"Pohled do Vodičkovy ulice (zprava) s domy čp. 699, 700, 701, 702.",8.5.1910,63x,A0C50BF2B67611DF820F00166F1163D4,XI 1449,1910-05-08,1910-05-08,14.42433,50.08069,regional.address,geocode,"Kříženecký, Jan (1868-1921)",,0.0,[],[]
pozitiv,"Celkový pohled ""Faustův dům"" (dům čp. 502 na Novém Městě) na Karlově náměstí na Novém Městě.",,70x,2A5D9817E44111E4BE0074D435EEBE90,I 11187,,,14.419,50.07337,regional.address,geocode,"Vojta, Tomáš (1885-1934)",Autorství T. Vojty není jisté.,,[],[]
pozitiv,Pohled do vstupního průjezdu Schönbornského paláce - domu čp. 365 na Malé Straně.,červen 1931,27x,0169865779DF11E3B274406186009F3A,I 9842,1931-06-01,1931-06-30,14.40131,50.08733,regional.address,geocode,"Vojta, Tomáš (1885-1934)",,,[],[]
pozitiv,Pohled do Dvořákovy (dnes Pecháčkovy) ulice - nově prorážené přes Portheimovu zahradu na Smíchově.,25.4.1927,55x,A1188A19B67611DF820F00166F1163D4,I 8595,1927-04-25,1927-04-25,14.40874,50.07316,regional.address,geocode,"Alexander, Antonín (1892-působnost do 1948)",,,[],[]
pohlednice,Pohled na dům čp. 674 v ulici U Branek v Hostivaři (Švehlova sokolovna).,před 1956,54x,A1187629B67611DF820F00166F1163D4,I 9063,1800-01-01,1955-12-31,14.53526,50.05582,regional.address,geocode,,,,[],[]
negativ,Pohled do interiéru lázní na Slovanském ostrově (Žofín) - koupelna s pevnou a pojízdnou vanou.,kol.1900,19x,F8291B3507D711E28BD16C626D41E503,XII 876,1900-01-01,1900-12-31,14.41283,50.07924,regional.address,geocode,"Eckert, Jindřich (1833-1905)",,0.0,[],[]
pozitiv,"Pohled na zahradní průčelí Dienzenhoferova pavilonu (dům čp. 74 - ""dům botanické zahrady"") v Nábřežní ulici na Smíchově.",kol.1900,40x,A0C516FBB67611DF820F00166F1163D4,VI 74/10,1900-01-01,1900-12-31,14.40004,50.06379,regional.address,geocode,"Smolka, Karel",,,[],[]
negativ,Pohled do interiéru pivovarské školy (dům čp. 921 na Novém Městě) v Opletalově ulici - sborovna.,15.4.1911,23x,480F64621DDA11E2BCB36C626D41E503,XII 1267,1911-04-15,1911-04-15,14.42961,50.08112,regional.address,geocode,Eckert-ateliér,,0.0,[],[]
pozitiv,"Pohled do zahrady domu čp. 180 na Hradčanech (bývalý Trautmannsdorfský palác) - ""práce na výkopu válečného vodního bazénu"". V pozadí část západního průčelí domu čp. 180, vpravo část kapličky při Loretánské ulici.",5.6.1944,36x,96FF10DA748711E4A81F406186009F3A,I 11075,1944-06-05,1944-06-05,14.39375,50.08878,regional.address,geocode,"Alexander, Antonín (1892-působnost do 1948)",,,[],[]
pozitiv,Pohled do interiéru vinohradské tržnice (dům čp. 1200 na Vinohradech).,kol.1915,47x,FDCF851E3E9E11E1B434000BCDD04BFA,II 1083,1915-01-01,1915-12-31,14.44233,50.07635,regional.address,geocode,,,,[],[]
pozitiv,Pohled ze Strakovy akademie přes Vltavu na budovu Uměleckoprůmyslové školy čp. 80 na dnešním Palachově náměstí (Na Rejdišti). Vpravo část Železné lávky.,kol.1900,67x,FDCF85063E9E11E1B434000BCDD04BFA,I 9525,1900-01-01,1900-12-31,14.41492,50.08868,regional.address,geocode,Bellmann-ateliér,,,[],[]
pozitiv,Celkový pohled na Stavovské divadlo (Tylovo) čp. 540 na Starém Městě v Rytířské ulici.,1983,37x,A1186CB7B67611DF820F00166F1163D4,I 4703,1983-01-01,1983-12-31,14.42349,50.08599,regional.address,geocode,"Jelínková, Jana (1951-)",,,[],[]
negativ,Pohled na novostavbu domu čp. 846 (palác Koruna) na Novém Městě na nároží Václavského náměstí a ulice Na Příkopě.,25.9.1914,54x,7BC98695A78311E7AB2574D435EEBE90,XI 3531,1914-09-25,1914-09-25,14.45505,50.06718,regional.address,suggest,"Kříženecký, Jan (1868-1921)",,0.0,[],[]
pozitiv,Pohled na dům čp. 462 (hotel Union) na nároží Ostrčilova náměstí a Jaromírovy ulice v Nuslích,,82x,7EB3E82A81E111E3B4B96C626D41E503,I 9901,,,14.42486,50.06518,regional.address,geocode,,,,[],[]
negativ,Pohled na vyšehradský tunel z Podolského nábřeží.,duben 1907,58x,2787090EB37411E3A9CC406186009F3A,XI 243,1907-04-01,1907-04-30,14.41617,50.06351,poi,suggest,"Kříženecký, Jan (1868-1921)",,0.0,[],[]
negativ,Pohled na oltář Božího těla v zahradě kláštera Na Slovanech (v Emauzích) - dům čp. 320 na Novém Městě.,kol.1895,22x,C0F950169E9B11E1AB206C626D41E503,XII 813,1895-01-01,1895-12-31,14.41719,50.07215,regional.address,geocode,"Eckert, Jindřich (1833-1905)",,0.0,[],[]
negativ,Pohled na stavbu ústřední elektrárny v Holešovicích (dům čp. 1).,1899,72x,A0C4F9ECB67611DF820F00166F1163D4,VIII 197,1899-01-01,1899-12-31,14.43637,50.10853,regional.address,geocode,Fischer?,,,[],[]
pozitiv,Pohled na dělníky při výzkumu progresívních metod výstavby podpovrchových tras - na nábřeží Na Františku.,1965,51x,A0C50ECFB67611DF820F00166F1163D4,I 8174,1965-01-01,1965-12-31,14.42582,50.09301,regional.address,geocode,"Mikšátko, Václav",,,[],[]
negativ,"Tympanon severního portálu kostela P. Marie před Týnem na Starém Městě. 
                    
                
                    
                  Detail - pravá hořejší skupina.",kol. 1905,14x,41FBB1E0AA9611E3A45A0024BE7CD9AC,XI 174,,,14.42244,50.08839,regional.address,geocode,"Kříženecký, Jan (1868-1921)",,0.0,[],[]
pozitiv,Pohled na Rašínovo nábřeží směrem k severu. Uprostřed Palackého most.,24.3.1925,70x,59AF290A156F11E39CC26C626D41E503,I 9774,1925-03-24,1925-03-24,14.4119,50.07283,regional.street,suggest,"Alexander, Antonín (1892-působnost do 1948)",,,[],[]
pozitiv,"Povodeň v březnu roku 1940 - ledy na Vltavě v Braníku. V popředí zničený barrandovský přívoz. V pozadí vlevo Barrandovská skála, vpravo Hlubočepy.",březen 1940,75x,85812BA799B411E1874B6C626D41E503,I 9602,1940-03-01,1940-03-31,14.40238,50.02785,regional.address,geocode,,,,[],[]
negativ,Pohled do interiéru Windischgrätzovského paláce (dům čp. 119 na Malé Straně) v Letenské ulici - salon hraběnky Windischgrätzové.,8.5.1908,18x,14985CDC12D111E2A6B56C626D41E503,XII 1153,1908-05-08,1908-05-08,14.40926,50.08997,regional.address,geocode,Eckert-ateliér,,0.0,[],[]
negativ,"Pohled přes Vltavu na smíchovské nábřeží pod Palackého mostem. U břehu klubovna veslařského klubu ""Blesk"".",kol.1900,61x,A0C5132AB67611DF820F00166F1163D4,IX 2189,1900-01-01,1900-12-31,14.41041,50.07195,regional.address,geocode,Bellmann,,,[],[]
pozitiv,Primátor Karel Baxa ve své pracovně ve Staroměstské radnici.,1930-1935,214x,A14CDDACB67611DF820F00166F1163D4,I 156,1930-01-01,1935-12-31,14.42009,50.087,regional.address,suggest,,,,[],[]
pozitiv,Pohled na turbínové potrubí (trumpetu) určenou pro hydroelektrárnu Těšnov (dům čp. 1224 na Novém Městě). V pozadí osamělý dům čp. 1222 z původního komplexu Helmovských mlýnů na Novém Městě.,31.3.1910,74x,3137D1A962DD11E6A552000C76270B94,I 11820,1910-03-31,1910-03-31,14.43633,50.09114,regional.address,geocode,,,,[],[]
pozitiv,Pohled na opěrný systém a fiály chrámu sv. Víta na Pražském hradě.,kol.1905,24x,A1188B00B67611DF820F00166F1163D4,VI 32/17,1905-01-01,1905-12-31,14.4006,50.09089,poi,suggest,Eckert-ateliér,,,[],[]
pozitiv,Pohled na malostranské střechy od domu čp. 149 na Malé Straně k jihu.,kol.1900,49x,A1188035B67611DF820F00166F1163D4,VI 76/25,1900-01-01,1900-12-31,14.4019,50.08744,regional.address,geocode,,,,[],[]
pozitiv,"""Bourání Hampejzu"". Pohled na bourání domů v prostoru mezi Rabínskou (dnes Maiselovou) ulicí a Hampejskou ulici (dnes ulice U Starého hřbitova) v Josefově. Vlevo část Staronové synagogy a Židovská radnice (dům čp. 250). Vpravo budova Všeobecné židovské nemocnice (dům čp. 248 v Josefově) a část Starého židovského hřbitova. V pozadí novostavby v Josefovské (dnes Široké) ulici.",22.2.1910,147x,A1187530B67611DF820F00166F1163D4,V 84/29,1910-02-22,1910-02-22,14.41791,50.08962,regional.address,geocode,"Kříženecký, Jan (1868-1921)",,,[],[]
pozitiv,Pohled na královské mauzoleum prvních Habsburků na českém trůně v chrámu sv. Víta na Pražském hradě.,,23x,A1188B1CB67611DF820F00166F1163D4,VI 34/24 b,,,14.4006,50.09089,poi,suggest,"Eckert, Jindřich (1833-1905)",,,[],[]
pozitiv,Pohled na východní stranu fary (dům čp. 12) kostela Povýšení sv. Kříže v Čajkovského ulici na Žižkově.,24.3.1933,64x,75CF7F0BE16211E6B986406186009F3A,A 7680,1933-03-24,1933-03-24,14.45672,50.07879,regional.address,geocode,"Alexander, Antonín (1892-působnost do 1948)",,0.0,[],[]
pozitiv,Povodeň v březnu roku 1940 - rozvodněná Vltava u Slovanského ostrova (Žofín).,březen 1940,21x,A0C5068FB67611DF820F00166F1163D4,I 1980,1940-03-01,1940-03-31,14.41319,50.07744,regional.address,geocode,,,,[],[]
pozitiv,Pražské povstání - 5.5.1945. Pražané před 10.hodinou u hlavního vchodu do jižního křídla Staroměstské radnice.,5.5.1945,79x,A0C50695B67611DF820F00166F1163D4,IV 74/2,1945-05-05,1945-05-05,14.42009,50.087,regional.address,suggest,"Stehno, Josef (?)",,,[],[]
pozitiv,"Pohled do ulice U radnice s domy čp. 12, 13, 161, 17, 18 (zprava) na Starém Městě.",25.7.1927,60x,A0C515F8B67611DF820F00166F1163D4,I 1508,1927-07-25,1927-07-25,14.41937,50.08742,regional.address,geocode,"Alexander, Antonín (1892-působnost do 1948)",,,[],[]
pozitiv,Pohled na nástěnnou malbu v domě čp. 240 (Bretfeldovský palác) v Nerudově ulici na Malé Straně.,1914,36x,A14CE7E4B67611DF820F00166F1163D4,VI 8/18 b,1914-01-01,1914-12-31,14.39828,50.08841,regional.address,geocode,Eckert-ateliér,,,[],[]
pozitiv,Pohled do Myslbekovy ulice ve Střešovicích s usedlostí Hubálka (dům čp. 116) a částí domu čp. 122 (vlevo).,8.5.1931,82x,62907E49D27311EABE2074D435EEBE90,A 6792,1931-05-08,1931-05-08,14.37286,50.09628,regional.address,geocode,"Alexander, Antonín (1892-působnost do 1948)",,0.0,[],[]
pozitiv,Slavnostní instalace starosty Karla Groše 19. května 1909 - vítání na Staroměstském náměstí.,19.5.1909,72x,A118726DB67611DF820F00166F1163D4,IV 30/7,1909-05-19,1909-05-19,14.41994,50.08663,regional.address,geocode,"Bruner-Dvořák, Rudolf (1864-1921)",,,[],[]
pozitiv,Pohled na portál Královské zahrady u domů čp. 49 a 50 (Stájový dvůr) v ulici U Prašného mostu na Hradčanech.,23.4.1908,25x,A118876AB67611DF820F00166F1163D4,VI 25/13,1908-04-23,1908-04-23,14.39876,50.09218,regional.address,geocode,,,,[],[]
pozitiv,Průhled Seifertovou ulicí na Žižkově.,kol.1915,499x,A1187277B67611DF820F00166F1163D4,I 322,1915-01-01,1915-12-31,14.4531,50.08398,regional.address,geocode,,,,[],[]
negativ,"""Tycho Brahe v Praze"" - výročí 1901. T.XXII.1. Jansenův globus ze sbírky v Klementinu.",1901,31x,80EB9D4D0D5D11E295A66C626D41E503,XII 1029,1901-01-01,1901-12-31,14.4172,50.08697,regional.address,geocode,"Eckert, Jindřich (1833-1905)",,0.0,[],[]
negativ,"Pohled na umělou krápníkovou jeskyni (grottu) v zahradě bývalého bubenského dvora v místech nad dnešním Strossmayerovým náměstím krátce před zbořením. V pozadí vlevo dům čp. 693 na nároží dnešních ulic Dukelských hrdinů (průčelí) a Pplk. Sochora, vpravo dům čp. 562 v dnešní Heřmanově ulici v Holešovicích.",1890,126x,A14CDCEDB67611DF820F00166F1163D4,X 3012,1890-01-01,1890-12-31,14.43391,50.10061,regional.address,geocode,,,,[],[]
pozitiv,"Pohled na portál domu čp. 101 (""Černínský palác"") na Loretánském náměstí na Hradčanech.",28.8.1907,23x,A1187FA8B67611DF820F00166F1163D4,VI 24/17,1907-08-28,1907-08-28,14.39071,50.08877,regional.address,geocode,,,,[],[]
pozitiv,"Pohled na severní stranu Ovocného trhu. Vlevo Tylovo divadlo (dům čp. 540 na Starém Městě). Zleva domy čp. 563, 572, 571, 567, 568, 570 na Starém Městě.",25.4.1936,84x,A1186F64B67611DF820F00166F1163D4,I 4411,1936-04-25,1936-04-25,14.42349,50.08599,regional.address,geocode,"Alexander, Antonín (1892-působnost do 1948)",,,[],[]
pozitiv,"Pohled na portál Klementina (dům čp. 190, 1040) na Mariánském náměstí na Starém Městě.",22.5.1907,20x,A11888F8B67611DF820F00166F1163D4,VI 15/16 d,1907-05-22,1907-05-22,14.4172,50.08697,regional.address,geocode,,,,[],[]
pozitiv,Pohled na nároží domu čp. 585 v Celetné ulici na Starém Městě.,1907,30x,5B4F72EEE2B811E4B65C0024BE7CD9AC,V 6/2 c,1907-01-01,1907-12-31,14.42666,50.0873,regional.address,geocode,Štenc-ateliér,,,[],[]
negativ,"Pohled na dům čp. 846 (""Vídeňská kavárna"" - ""U Špinků"") na Novém Městě na nároží Václavského náměstí a ulice Na Příkopě před zbořením. Vedle domy čp. 844 a čp. 843 na Novém Městě.",15.2.1912,78x,A118868AB67611DF820F00166F1163D4,VIII 281,1912-02-15,1912-02-15,14.35154,50.04126,regional.address,geocode,Eckert-ateliér,,,[],[]
pozitiv,Pohled na jižní a východní stranu zámku v Bohnicích (dům čp. 14).,31.7.1942,26x,ee2944039fed4d8f9604ae24525bd548,A 14457,1942-07-31,1942-07-31,14.43282,50.12913,regional.address,geocode,"Alexander, Antonín (1892-působnost do 1948)",,0.0,[],[]
negativ,"Pohled na budovu kasáren v ulici Dlabačov (dům čp. 120 na Hradčanech). Uprostřed bývalá vojenská strážnice (""Budka"") při bourání. Vlevo hradby.",kol.1900,36x,A118794EB67611DF820F00166F1163D4,VIII 989,1900-01-01,1900-12-31,14.38561,50.08749,regional.address,geocode,"Eckert, Jindřich (1833-1905)",,,[],[]
pozitiv,Celkový pohled na hlavní průčelí Schönbornského paláce do ulice Tržiště - domu čp. 365 na Malé Straně.,27.7.1930,25x,A1187397B67611DF820F00166F1163D4,I 8514,1930-07-27,1930-07-27,14.40131,50.08733,regional.address,geocode,"Alexander, Antonín (1892-působnost do 1948)",,,[],[]
negativ,Celkový pohled na Králodvorská kasárna (dům čp. 654 - kadetní škola) na Josefském náměstí (náměstí Republiky). Vlevo část Prašné brány a kostela sv. Vojtěcha na Starém Městě.,kol.1895,55x,A1188692B67611DF820F00166F1163D4,VIII 312,1895-01-01,1895-12-31,14.42573,50.08795,regional.address,geocode,"Eckert, Jindřich (1833-1905)",,,[],[]
pozitiv,Pohled na vstupní portál domu čp. 355 v ulici Na Perštýně na Starém Městě.,10.5.1906,17x,A0C5096AB67611DF820F00166F1163D4,VI 15/30,1906-05-10,1906-05-10,14.4187,50.0838,regional.address,geocode,,,,[],[]
pozitiv,Pohled na vstupní portál domu čp. 201 v Zámecké ulici na Malé Straně.,10.7.1906,11x,A0C50032B67611DF820F00166F1163D4,VI 21/14,1906-07-10,1906-07-10,14.40197,50.08891,regional.address,geocode,,,,[],[]
negativ,"Pohled do dvora domu čp. 398 (""U Havíře"") s pavlačemi s kovovými mřížemi mezi ulicemi Rytířskou a Havířskou na Starém Městě.",10.6.1906,25x,A0C4FE17B67611DF820F00166F1163D4,VIII 899,1906-06-10,1906-06-10,14.44009,50.0371,regional.address,geocode,Eckert-ateliér,,,[],[]
pozitiv,Pohled na dům čp. 2 (Olšanský dvůr) na Žižkově. V popředí rybník.,24.9.1942,90x,A0C5002AB67611DF820F00166F1163D4,I 1937,1942-09-24,1942-09-24,14.45891,50.08224,regional.address,geocode,"Alexander, Antonín (1892-působnost do 1948)",,,[],[]
negativ,Zvon z kostela sv. Jana na Skalce na Novém Městě sejmutý za 1. světové války k roztavení.,1914-1918,56x,F3454297D37A11E8AE88406186009F3A,XI 3826,1914-01-01,1918-12-31,14.41861,50.07228,poi,suggest,,,0.0,[],[]
pozitiv,Průhled Koněvovou ulicí na Žižkově.,kol.1950,181x,A0C5158FB67611DF820F00166F1163D4,I 237,1950-01-01,1950-12-31,14.45507,50.08722,regional.address,geocode,"Vopravil, Josef (1902-1972)",,,[],[]
negativ,"Pohled na Staroměstské náměstí se Staroměstskou radnicí (dům čp. 1) a Krenovým domem (dům čp. 936 na Starém Městě). V pozadí kostel sv. Mikuláše, v popředí mariánský sloup.",1890-1899,49x,C44E15EEC67C11EA983A406186009F3A,XI 5819,1890-01-01,1899-12-31,14.4202,50.08848,regional.address,geocode,Bellmann-ateliér,,0.0,[],[]
pozitiv,Pohled na náhrobky Židovského hřbitova na Žižkově (v místech dnešních Mahlerových sadů).,20.4.1933,76x,18B37161F74211E699E8406186009F3A,A 7718,1933-04-20,1933-04-20,14.45094,50.08172,poi,suggest,"Alexander, Antonín (1892-působnost do 1948)",,0.0,[],[]
pozitiv,"Panoramatický pohled na Prahu z Petřína (ze čtyř volných částí). 
                    
                
                    
                  3. část: v popředí Petřín s Hladovou zdí, Vltava se Střeleckým a Slovanským ostrovem a s mostem císaře Františka I. Za řekou je vlevo část Starého Města a vpravo Nové Město s Národním divadlem (střecha ve stavbě).",1876,96x,A4E21B179C3C11E2B0DE6C626D41E503,VI 37/30 c,1876-01-01,1876-12-31,14.41347,50.08126,regional.address,geocode,"Fridrich, František (1829-1892)",,,[],[]
negativ,Severní portál kostela P. Marie před Týnem na Starém Městě. Detail konsoly levého oblouku - baldachýnky.,18.6.1906,16x,8350B3D1A93511E3839F0024BE7CD9AC,XI 150,1906-06-18,1906-06-18,14.42396,50.08884,regional.address,geocode,"Kříženecký, Jan (1868-1921)",,0.0,[],[]
pozitiv,Pohled na zbytky románského zdiva nalezeného při bourání domu čp. 16 na Starém Městě (Andělská kolej) v Mikulášské ulici (dnes náměstí Franze Kafky) .,1909,35x,45D49B7E808811E4AAB4406186009F3A,V 1/5 f,1909-01-01,1909-12-31,14.41873,50.08783,regional.address,geocode,"Kříženecký, Jan (1868-1921)",,,[],[]
negativ,Mariánská výstava v Klementinu 9.8. - 3.10.1904 - exponáty.,1904,27x,E5F995290C9F11E2AEA36C626D41E503,XII 989,1904-01-01,1904-12-31,14.41659,50.08616,poi,suggest,"Eckert, Jindřich (1833-1905)",,0.0,[],[]
CD-ROM,Pohled do zahrady Trojského zámku při povodni 14.8.2002 v poledne.,14.8.2002,22x,A0C50E5CB67611DF820F00166F1163D4,XXII 1/16,2002-08-14,2002-08-14,14.4124,50.11648,regional.address,geocode,"Malec, Milan - Malcová, Alena",,0.0,[],[]
pozitiv,"Celkový pohled na dům čp. 120 (""Skalka"") na Smíchově.",březen 1959,53x,A0C4FB50B67611DF820F00166F1163D4,I 8626,1959-03-01,1959-03-31,14.36851,50.07335,regional.address,geocode,"Hnilička, Eduard (1887-1967)",,,[],[]
pozitiv,Průhled Ohmovou ulicí od ulice Edisonovy.,1978,44x,A0C50775B67611DF820F00166F1163D4,I 346,1978-01-01,1978-12-31,14.55979,50.03876,regional.address,geocode,"Hudeček, Jan",,,[],[]
CD-ROM,Pohled do zahrady Trojského zámku při povodni 14.8.2002 v poledne.,14.8.2002,24x,A118888FB67611DF820F00166F1163D4,XXII 1/15,2002-08-14,2002-08-14,14.41109,50.11489,regional.address,geocode,"Malec, Milan - Malcová, Alena",,0.0,[],[]
negativ,Pohled od Alšova nábřeží na Palachovo náměstí a Rudolfinum (dům čp. 79 na Starém Městě) na Starém Městě.,kol.1950,53x,A118774BB67611DF820F00166F1163D4,VII 6,1950-01-01,1950-12-31,14.41521,50.09017,regional.address,geocode,"Chalupníček, Miroslav -, Chalupníčková, Věra (dokument 1941-1948)",,,[],[]
negativ,Pohled na model novostavby domu čp. 191 na Starém Městě (Křižovnický klášter) - severozápadní strana.,11.11.1910,17x,E687B5A7193811E28B046C626D41E503,XII 1249,1910-11-11,1910-11-11,14.41405,50.08641,regional.address,geocode,Eckert-ateliér,,0.0,[],[]
negativ,Pohled na Císařský mlýn v Bubenči (Kubíkova továrna na papír - dům čp. 22) - po požáru roku 1896.,1896,49x,164F8D7E76BA11E2BF17525400E46D25,VIII 1231,1896-01-01,1896-12-31,14.4055,50.10847,regional.address,geocode,"Eckert, Jindřich (1833-1905)",,,[],[]
pozitiv,Pohled do průchodu domu čp. 1047 (U Rozvařilů) na Novém Městě.,1986,22x,2AE5FD7A81E411E3B4B96C626D41E503,I 9903,1986-01-01,1986-12-31,14.43394,50.08971,regional.address,geocode,"Hudeček, Jan",,,[],[]
negativ,Celkový pohled na kostel sv. Prokopa a kapli sv. Kříže ve Středoklukách - východní průčelí.,[1863-1945],34x,96DDD70BF65611DFBD85000C766D2371,XII 46,,,14.23765,50.13312,poi,suggest,Eckert-ateliér,Datace neznámá. Za účelem vyhledávání byla nastavena na časový rozsah celé sbírky.,0.0,[],[]
negativ,Pohled na balkon Staroměstské radnice (dům čp. 1 na Starém Městě) se členy kuratoria vychovatelny v Libni.,1910,82x,A4758419CC7C11E89DA974D435EEBE90,XI 1479,1910-01-01,1910-12-31,14.46582,50.11682,regional.address,geocode,"Kříženecký, Jan (1868-1921)",,0.0,[],[]
pozitiv,Celkový pohled na nárožní dům čp. 310 (pivovar U Šálků) na nároží Karlova náměstí a Resslovy ulice na Novém Městě - pohled z Karlova náměstí.,1938,93x,A0C51AF2B67611DF820F00166F1163D4,I 9341,1938-01-01,1938-12-31,14.53102,50.05126,regional.address,geocode,,,,[],[]
pozitiv,Pohled do zahrady domu čp. 180 na Hradčanech (bývalý Trautmannsdorfský palác). V pozadí věže Lorety.,před 1926,23x,6AA9060F748511E4A81F406186009F3A,I 11071,1800-01-01,1925-12-31,14.39151,50.08925,regional.address,geocode,"Vojta, Tomáš (1885-1934)",,,[],[]
negativ,Celkový pohled na kostel sv. Cyrila a Metoděje (dříve kostel sv. Karla Boromejského) v Resslově ulici na Novém Městě od jihu.,kol.1898,27x,A11875DFB67611DF820F00166F1163D4,VIII 783,1898-01-01,1898-12-31,14.41762,50.07596,regional.address,geocode,"Eckert, Jindřich (1833-1905)",,,[],[]
pozitiv,Celkový pohled na mlýn (dům čp. 17) u rybníka v Kyjích.,kol. 1930,66x,A11880E0B67611DF820F00166F1163D4,I 4559,,,14.54079,50.09688,regional.address,geocode,,,,[],[]
negativ,Pohled na portrétní bustu Leonarda Buška v triforiu chrámu sv. Víta na Pražském hradě.,květen 1924,24x,3EABF31A3DA111E499B8406186009F3A,XI 6294,1924-05-01,1924-05-31,14.4006,50.09089,poi,suggest,Eckert-ateliér,,0.0,[],[]
negativ,Socha Hvězdáře a archanděla Michaela z orloje v jižním průčelí Staroměstské radnice (dům čp. 1 na Starém Městě) na Staroměstském náměstí před restaurováním.,21.9.1911,41x,4E3F29C590EB11E8B3B474D435EEBE90,V 69/15 f,1911-09-21,1911-09-21,14.42009,50.087,regional.address,suggest,"Kříženecký, Jan (1868-1921)",,,[],[]
pozitiv,Pohled na salu terrenu v zahradě Valdštejnského paláce (dům čp. 17 na Malé Straně). Vlevo v popředí kašna.,,20x,A14CEB43B67611DF820F00166F1163D4,VI 60/19,,,14.40535,50.09003,regional.address,geocode,"Eckert, Jindřich (1833-1905)","Eckert, Jindřich - Eckert-ateliér (repro)",,[],[]
pozitiv,Pohled na střechy Starého Města z věže kostela P. Marie před Týnem. V pozadí Letná s vodárenskou věží.,1.6.1904,59x,A14CE92EB67611DF820F00166F1163D4,VI 13/52,1904-06-01,1904-06-01,14.42203,50.08761,regional.address,geocode,"Eckert, Jindřich (1833-1905)",,,[],[]
pozitiv,Pohled na dolní průčelí s portálem domu čp. 462 (Vila Amerika - Michnův letohrádek) v ulici Ke Karlovu na Novém Městě.,10.4.1909,13x,A14CE076B67611DF820F00166F1163D4,VI 18/19 b,1909-04-10,1909-04-10,14.42693,50.07369,regional.address,geocode,,,,[],[]
pozitiv,Pohled na plastiku vázy v zahradě Trojského zámku (dům čp. 1 v Troji).,,29x,A14CE936B67611DF820F00166F1163D4,VI 41/6,,,14.4124,50.11648,regional.address,geocode,,,,[],[]
pozitiv,Pohled na tabulku s označením ulice Křižovnická (pod ní staré označení) na Starém Městě.,1996,20x,A0C502BEB67611DF820F00166F1163D4,V 137/11,1996-01-01,1996-12-31,14.41554,50.08802,regional.address,geocode,"Lašťovka, Marek","Lašťovka, Marek - Landergott, Josef (repro)",,[],[]
negativ,Pohled do dvora Menhartovského paláce mezi ulicemi Celetnou a Štupartskou (dům čp. 595 na Starém Městě) se sochou Herkula ve výklenku.,3.6.1906,30x,A14CE72BB67611DF820F00166F1163D4,VIII 456,1906-06-03,1906-06-03,14.42477,50.08722,regional.address,geocode,Eckert-ateliér,,,[],[]
pozitiv,Celkový pohled na dům čp. 104 v Holečkově ulici (ústav hluchoněmých) na Smíchově.,,29x,A0C4F5CEB67611DF820F00166F1163D4,II 1353,,,14.39741,50.07628,regional.address,geocode,,,,[],[]
negativ,Pohled do salonu bývalého Tereziánského ústavu šlechtičen na Pražském hradě (dům čp. 2 na Hradčanech).,kol.1880,33x,89EE2E049AAC11E191A46C626D41E503,XII 716,1880-01-01,1880-12-31,14.40339,50.09134,regional.address,geocode,"Eckert, Jindřich (1833-1905)",,0.0,[],[]
negativ,Pohled na schodiště v zahradě domu čp. 43 na Malé Straně (klášter Bosých karmelitánek - Anglických panen). Dnes Vojanovy sady.,kol.1880,41x,95C6107C9DD111E196AF6C626D41E503,XII 783,1880-01-01,1880-12-31,14.40954,50.08875,regional.address,geocode,"Eckert, Jindřich (1833-1905)",,0.0,[],[]
negativ,Sevreská váza (dar delegace pařížské městské rady městu Praze při návštěvě roku 1901) ve Staroměstské radnici.,28.5.1903,15x,C500712C176211E294C46C626D41E503,XII 925,1903-05-28,1903-05-28,14.41994,50.08663,regional.address,geocode,"Eckert, Jindřich (1833-1905)",,0.0,[],[]
negativ,"Pohled na plastiku (""Den"") na náhrobku rodiny Fučíkovských na Olšanských hřbitovech.",28.3.1906,78x,9556C95D0E2611E2935B6C626D41E503,XII 1060,1906-03-28,1906-03-28,14.46687,50.07842,regional.address,geocode,Eckert-ateliér,,0.0,[],[]
negativ,Pohled na 3. můstek přes Čertovku z můstku u Velkopřevorského mlýna.,,47x,83009610B91211E59ABE406186009F3A,IX 11 c,,,14.45092,50.05485,regional.address,geocode,Bellmann (?),,,[],[]
negativ,Celkový pohled na Prašnou bránu po přestavbě. Vpravo nízké krámky a za nimi kostel sv. Vojtěcha. Vlevo část domu čp. 969 na Starém Městě.,kol.1900,67x,A0C519ACB67611DF820F00166F1163D4,VIII 1077,1900-01-01,1900-12-31,14.42767,50.08708,regional.address,geocode,"Bellmann, Karel",,,[],[]
pozitiv,Pohled na mříž v kostele sv. Jakuba na Starém Městě.,1885,12x,A1186BE1B67611DF820F00166F1163D4,VI 75/15,1885-01-01,1885-12-31,14.42455,50.08856,regional.address,geocode,"Wlha, Josef",,,[],[]
pozitiv,Socha Marnivce a Turka z orloje v jižním průčelí Staroměstské radnice (dům čp. 1 na Starém Městě) na Staroměstském náměstí po restaurování.,18.12.1911,35x,203ED886917211E8B9E274D435EEBE90,V 69/19 b,1911-12-18,1911-12-18,14.42009,50.087,regional.address,suggest,"Kříženecký, Jan (1868-1921)",,,[],[]
negativ,"Pohled na slavobránu na Národní třídě vybudovaná Českou spořitelnou s dekorací při příležitosti návštěvy císaře Františka Josefa I. v Praze. Vlevo část budovy Národního divadla, vpravo část budovy 1009 (Česká spořitelna) na Starém Městě.",září 1891,34x,2599D3048B1311E2BF22525400E46D25,VIII 1398,1891-09-01,1891-09-30,14.41423,50.08154,regional.address,geocode,"Eckert, Jindřich (1833-1905)",,,[],[]
negativ,"Pohled na Prahu z Petřína. V popředí Smíchov, v pozadí Nové Město.",kol.1900,49x,A1187018B67611DF820F00166F1163D4,VIII 785,1900-01-01,1900-12-31,14.4119,50.07283,regional.street,suggest,"Eckert, Jindřich (1833-1905)",,,[],[]
pozitiv,Pohled na průčelí domu čp. 60 na Vinohradech v Havlíčkových sadech (Dolní Landhauska).,1940-1945,36x,A1186BDBB67611DF820F00166F1163D4,I 1882,1940-01-01,1945-12-31,14.44738,50.06849,regional.address,geocode,,,,[],[]
negativ,Pohled na novou Újezdskou bránu na Malé Straně před zbořením v roce 1891 - smíchovská strana.,kol.1890,59x,6A85D742172A11E0BDBB000C766D2371,XII 112,1890-01-01,1890-12-31,14.4049,50.08346,regional.address,geocode,"Eckert, Jindřich (1833-1905)",,0.0,[],[]
pozitiv,Pohled z okraje strahovských lomů na území Břevnova - 5. část panoramatu.,16.5.1925,50x,C84B078CB85311E5AA08D4BED94BB14D,I 11453,1925-05-16,1925-05-16,14.38965,50.08106,regional.address,geocode,"Alexander, Antonín (1892-působnost do 1948)",,,[],[]
negativ,Chlévy pro dobytek v areálu Ústředních jatek v Holešovicích (čp. 306).,7.5.1906,61x,255351DBA92D11E3839F0024BE7CD9AC,XI 133,1906-05-07,1906-05-07,14.44531,50.09841,regional.address,geocode,"Kříženecký, Jan (1868-1921)",,0.0,[],[]
pozitiv,Pohled detail průčelí školy (dům čp. 460) na Lyčkově náměstí v Karlíně (dříve Riegrovy sady).,3.10.1935,87x,A14CDAB8B67611DF820F00166F1163D4,I 176,1935-10-03,1935-10-03,14.45836,50.09311,regional.address,geocode,"Alexander, Antonín (1892-působnost do 1948)",,,[],[]
pozitiv,Pohled na závěr Karlova mostu s malostranskými mostními věžemi. V pozadí uprostřed věže kostela sv. Mikuláše.,31.8.1906,31x,A14CEA54B67611DF820F00166F1163D4,VI 59/16,1906-08-31,1906-08-31,14.41126,50.0865,poi,suggest,Eckert-ateliér,,,[],[]
negativ,Zvon z kostela Nanebevzetí P. Marie na Strahově sejmutý za 1. světové války k roztavení.,1914-1918,23x,79D9FA0DD3A611E8AE88406186009F3A,XI 3863,1914-01-01,1918-12-31,14.38967,50.08671,regional.address,geocode,,,0.0,[],[]
pozitiv,Pohled na sochu Neptuna uprostřed jezírka před grottou (Neptunovou jeskyní) v Havlíčkových sadech na Vinohradech.,,34x,A11883D7B67611DF820F00166F1163D4,I 1913,,,14.44431,50.06867,regional.address,geocode,,,,[],[]
negativ,Panoramatický pohled na Malou Stranu a Pražský hrad z Petřína.,kol.1900,31x,A1187CC0B67611DF820F00166F1163D4,VIII 419,1900-01-01,1900-12-31,14.39508,50.08354,poi,suggest,"Eckert, Jindřich (1833-1905)",,,[],[]
negativ,Pohled do interiéru domu čp. 909 (budova hlavní pošty) na Novém Městě v Jindřišské ulici - strojovna elektrického pohonu.,1908,27x,EF9621DE922411E2BF28525400E46D25,VIII 1288,1908-01-01,1908-12-31,14.42901,50.08293,regional.address,geocode,Eckert-ateliér,,,[],[]
negativ,Pohled na část plastické výzdoby Belvederu (Letohrádek královny Anny) - dům čp. 52 na Hradčanech - hlavice sloupu a část oken.,31.5.1907,8x,1AF81D050E3711E2935B6C626D41E503,XII 1092,1907-05-31,1907-05-31,14.46857,50.09989,regional.address,suggest,Eckert-ateliér,,0.0,[],[]
pozitiv,"Pohled na trh v Libni o vánocích (ovoce, zelenina, zajíci, stromky) u Libeňského zámku.",,110x,A11884ACB67611DF820F00166F1163D4,I 4038,,,14.47145,50.10766,regional.address,geocode,,,,[],[]
negativ,Pohled na slavnost při návštěvě císaře Františka Josefa v Podbabě - panovník sleduje průběh stavebních prací při regulaci Vltavy.,15.6.1901,73x,A0C4F6BBB67611DF820F00166F1163D4,XII 894,1901-06-15,1901-06-15,14.39378,50.11073,regional.address,geocode,"Eckert, Jindřich (1833-1905)",,0.0,[],[]
negativ,Pohled do interiéru domu čp. 386 na Malé Straně (Rohanský palác) - sál.,kol.1900,28x,A0C508F1B67611DF820F00166F1163D4,VIII 890,1900-01-01,1900-12-31,14.40444,50.08544,regional.address,geocode,"Eckert, Jindřich (1833-1905)",,,[],[]
negativ,Celkový pohled na jižní průčelí domu čp. 98 na Starém Městě (původní budova knihovny).,,14x,2e6df3ad15b0468bacd16b9662863a3c,X 8160,,,14.41739,50.08739,regional.address,geocode,"Reach, Zikmund (1859-1935)",,,[],[]
pozitiv,"Pohled přes Vltavu na Nové mlýny. Vlevo v pozadí dům čp. 1242 (Veselého mlýn), pod ním domy čp. 1241 a 1294, dále uprostřed čp. 1240 (městská vodárna) s vodárenskou věží a Eliščiny (Kandertovy) lázně čp. 1248 na Novém Městě. Vpravo část mostu císaře Františka Josefa I. (Štefánikův).",19.6.1909,51x,D70FD60DDB7E11DFBD5E000C766D2371,VI 49/14,1909-06-19,1909-06-19,14.42894,50.09218,regional.address,geocode,Eckert-ateliér,,,[],[]
negativ,Pohled do interiéru domu čp. 56 (Arcibiskupský palác) na Hradčanech - kaple sv. Jana Křtitele.,[1863-1905],28x,D0D574D6F18C11DFBD80000C766D2371,XII 53,,,14.39755,50.08984,regional.address,geocode,"Eckert, Jindřich (1833-1905)",Datace neznámá. Za účelem vyhledávání byla nastavena na časový rozsah celé sbírky.,0.0,[],[]
negativ,"Pohled do Ovocné ulice s dpmy čp. 374 (""U Zeleného čápa"") a čp. 375 (""U Tří králů"") do Ovocné ulice (ulice 28. října) na Starém Městě.",kol.1890,39x,A0C4FE81B67611DF820F00166F1163D4,VIII 341,1890-01-01,1890-12-31,14.42252,50.08369,regional.address,geocode,"Eckert, Jindřich (1833-1905)",,,[],[]
negativ,Pohled na nástěnnou malbu v horní partii severního výklenku zadní části kostela sv. Mikuláše na Malé Straně.,,14x,4EE5FC19A4B011E5A367406186009F3A,X 240 a,,,14.4032,50.08835,regional.address,geocode,,,,[],[]
pozitiv,Pohled na osvětlený pomník M. Jana Husa na Staroměstském náměstí při příležitosti 10. výročí samostatnosti Československé republiky.,28.10.1928,36x,E7CFC128124411E8A338406186009F3A,I 12049,1928-10-28,1928-10-28,14.42051,50.08777,regional.street,suggest,"Vopravil, Josef (1902-1972)",,,[],[]
pozitiv,Celkový pohled na Palackého most ze smíchovského nábřeží. V pozadí věž Šítkovské vodárny a Svatováclavská trestnice (dům čp. 329 na Novém Městě).,1878,67x,A1187A34B67611DF820F00166F1163D4,VI 39/22 a,1878-01-01,1878-12-31,14.41563,50.07517,regional.address,geocode,Heid,,,[],[]
pozitiv,Pohled na dům čp. 250 na Malé Straně.,kol.1925,90x,A1186AD8B67611DF820F00166F1163D4,I 161,1925-01-01,1925-12-31,14.40015,50.08843,regional.address,geocode,"Vojta, Tomáš (1885-1934)",,,[],[]
pozitiv,Celkový pohled na kostel sv. Petra se zvonicí (dům čp. 1232 na Novém Městě).,kol.1915,67x,A1188604B67611DF820F00166F1163D4,I 340,1915-01-01,1915-12-31,14.43428,50.0906,regional.address,geocode,"Fink, František (1854-1935)",,,[],[]
pozitiv,Pražské povstání - 5.5.1945 - pancéřované osobní auto na cestě k budově Rozhlasu.,5.5.1945,38x,A0C5169AB67611DF820F00166F1163D4,I 7995,1945-05-05,1945-05-05,14.4345,50.07859,regional.address,geocode,"Velebil, Karel (?)",,,[],[]
pozitiv,Pohled do interiéru Staroměstské radnice (dům čp. 1 na Starém Městě).,kol.1885,23x,A14CE938B67611DF820F00166F1163D4,VI 42/18,1885-01-01,1885-12-31,14.42009,50.087,regional.address,suggest,"Eckert, Jindřich (1833-1905)",,,[],[]
pozitiv,Jižní zeď první zahradní terasy v Schönbornském paláci - domě čp. 365 na Malé Straně. Boční (vrcholně barokní) nika.,červen 1931,22x,709673E07D2311E3BE26406186009F3A,I 9878,1931-06-01,1931-06-30,14.40131,50.08733,regional.address,geocode,"Vojta, Tomáš (1885-1934)",,,[],[]
pozitiv,Pohled do údolí Čimického potoka. Součást pětidílného panoramatu.,23.9.1924,28x,DF5E7AC5457211E99C7074D435EEBE90,A 1258,1924-09-23,1924-09-23,14.40403,50.1442,poi,suggest,"Alexander, Antonín (1892-působnost do 1948)",,0.0,[],[]
pozitiv,"Pohled na vstupní portál domu čp. 546 (""U kamenného ptáka"") v Kamzíkově ulici na Starém Městě.",18.5.1907,16x,A14CDBC1B67611DF820F00166F1163D4,VI 16/14,1907-05-18,1907-05-18,14.42292,50.08659,regional.address,geocode,,,,[],[]
negativ,Pohled na plastickou výzdobu kostela sv. Mikuláše na Starém Městě. Strop východní věže nad chorem.,říjen 1905,18x,299FF33273C911E3B7C100110989F46F,XI 22,1905-10-01,1905-10-31,14.4199,50.08778,regional.address,geocode,"Kříženecký, Jan (1868-1921)",,0.0,[],[]
pozitiv,Pohled na domy čp. 891 a čp. 892 u kostela sv. Ducha v Dušní ulici na Starém Městě.,26.2.1914,23x,7D54D01B9A7C11E4A736406186009F3A,V 2/31,1914-02-26,1914-02-26,14.42036,50.09132,regional.street,suggest,"Kříženecký, Jan (1868-1921)",,,[],[]
pozitiv,Pohled do údolí Čimického potoka. Součást panoramatu.,23.9.1924,30x,554C062E457011E99C7074D435EEBE90,A 1246,1924-09-23,1924-09-23,14.40403,50.1442,poi,suggest,"Alexander, Antonín (1892-působnost do 1948)",,0.0,[],[]
pozitiv,Průhled Mosteckou ulicí k západu. V pozadí uprostřed kostel sv. Mikuláše na Malé Straně.,kol.1900,43x,A11887A9B67611DF820F00166F1163D4,VI 76/26,1900-01-01,1900-12-31,14.40702,50.08714,regional.address,geocode,,,,[],[]
negativ,Pohled do interiéru kostela P. Marie před Týnem na Starém Městě - strop.,kol.1920,19x,A6601888A12911E2BF30525400E46D25,XI 6402,1920-01-01,1920-12-31,14.42203,50.08761,regional.address,geocode,Eckert-ateliér,,0.0,[],[]
negativ,Pohled na dům čp. 1481 na nároží Senovážného náměstí a Mariánské ulice (Opletalova). Vpravo dům čp. 1015 na Novém Městě.,27.11.1905,55x,A0C5189FB67611DF820F00166F1163D4,VIII 221,1905-11-27,1905-11-27,14.43483,50.08666,regional.address,geocode,Eckert-ateliér,,,[],[]
negativ,"Celkový pohled na pivovar ""Libušinka"" čp. 48 v Libušině (Libušinské) ulici na Vyšehradě.",27.7.1906,38x,A0C502C8B67611DF820F00166F1163D4,VIII 543,1906-07-27,1906-07-27,14.41594,50.06705,regional.address,geocode,Eckert-ateliér,,,[],[]
pozitiv,Pohled na staveniště pomníku M. Jana Husa (podstavec s lešením) na Staroměstském náměstí. Kolem prodejní stánky.,6.12.1913,34x,A0C51244B67611DF820F00166F1163D4,V 108/59,1913-12-06,1913-12-06,14.41994,50.08663,regional.address,geocode,Štenc,,,[],[]
pozitiv,Portrét obecního staršího Jindřicha Eckerta.,1892,18x,A1187446B67611DF820F00166F1163D4,IV 75/11,1892-01-01,1892-12-31,14.4049,50.08346,regional.address,geocode,"Eckert, Jindřich (1833-1905)",,,[],[]
pozitiv,"Pohled na malostranské střechy a věže z Thunovského paláce (dům čp. 180). Vlevo kostel sv. Tomáše, vpravo malostranské mostní věže. V pozadí Vltava s Karlovým mostem a Staré Město.",30.3.1907,42x,A14CE8B5B67611DF820F00166F1163D4,VI 13/32,1907-03-30,1907-03-30,14.40402,50.08968,regional.address,geocode,Eckert-ateliér,,,[],[]
pozitiv,Pohled na náhrobky na Starém židovském hřbitově v Josefově.,1908,35x,A14CE8CFB67611DF820F00166F1163D4,VI 12/3 k,1908-01-01,1908-12-31,14.45094,50.08172,poi,suggest,,,,[],[]
pozitiv,Pohled na východní průčelí statku čp. 16 ve Strašnicích (v místech dnešní ulice Ke Strašnické) - od domu čp. 21.,19.11.1942,63x,1AE5AF203D9311E499B8406186009F3A,I 11027,1942-11-19,1942-11-19,14.49422,50.06882,regional.address,geocode,"Alexander, Antonín (1892-působnost do 1948)",,,[],[]
pozitiv,Pohled na Císařský ostrov přes Vltavu.,18.8.1924,576x,A0C50F57B67611DF820F00166F1163D4,I 7,1924-08-18,1924-08-18,14.40182,50.10979,regional.address,geocode,"Alexander, Antonín (1892-působnost do 1948)",,,[],[]
pozitiv,"Pohled na portál domu čp. 476 (""Palác Straků z Nedabylic"") na Maltézském náměstí na Malé Straně.",1.6.1906,20x,A0C50462B67611DF820F00166F1163D4,VI 23/23,1906-06-01,1906-06-01,14.40583,50.08614,regional.address,geocode,,,,[],[]
pozitiv,Pohled na pankráckou stranu Táborské brány (dnes dům čp. 35) na Vyšehradě.,,81x,A0C51890B67611DF820F00166F1163D4,I 4701,,,14.42411,50.06173,regional.address,geocode,,,,[],[]
pozitiv,Panoramatický pohled přes Vltavu na Sedlec. Druhá část dvoudílného panoramatu.,1.6.1925,69x,A0C5188CB67611DF820F00166F1163D4,I 185,1925-06-01,1925-06-01,14.39887,50.12904,regional.address,geocode,"Alexander, Antonín (1892-působnost do 1948)",,,[],[]
negativ,"Reprodukce grafického listu AMP G 14 (Pražský hrad a část Malé Strany): Bossche, Philippus Van den - Wechter, Johannes, Panorama Prahy, vydal Sadeler, Aegidius ml., 1606 - jeden z devíti dílů.",1907,40x,CB15726AB5A811E3B6F7D4BED94BB14D,XI 289,1907-01-01,1907-12-31,14.39861,50.08948,regional.address,geocode,,,0.0,[],[]
pozitiv,"Pohled na vnitřní portál domu čp. 132 (""Strahovský klášter"") na Strahovském nádvoří na Hradčanech.",13.8.1907,20x,A0C50F42B67611DF820F00166F1163D4,VI 24/21,1907-08-13,1907-08-13,14.38967,50.08671,regional.address,geocode,,,,[],[]
pozitiv,Celkový pohled na budovu Masarykovy studentské koleje v Dejvicích.,,65x,5B049E2A274D11E287E86C626D41E503,I 9665,,,14.38706,50.10102,regional.address,geocode,,,,[],[]
pozitiv,"Pohled z Karlova mostu na pamětní desku na události roku 1648 na domě čp. 200 na Novotného lávce na Starém Městě s nápisem: ""Poutníče postůj na místě, kde zuřivost Švédů..."".",1890-1891,44x,A14CE8BCB67611DF820F00166F1163D4,VI 47/15,1890-01-01,1891-12-31,14.4133,50.08541,regional.address,geocode,"Eckert, Jindřich (1833-1905)",,,[],[]
pozitiv,Chiaroscurové malby na domě čp. 639 (Ungelt) na Starém Městě.,kol.1910,14x,A0C5046DB67611DF820F00166F1163D4,II 1109,1910-01-01,1910-12-31,14.42333,50.08809,regional.address,geocode,"Kříženecký, Jan (1868-1921)",,,[],[]
pozitiv,"Karel Špilar, freska ""Hudba"" v balkónovém výklenku Obecního domu (dům čp. 1090 na Starém Městě).",,15x,A14CE8C0B67611DF820F00166F1163D4,VI 40/3 a,,,14.42825,50.08762,regional.address,geocode,Štenc,,,[],[]
negativ,Pohled na vyřezávaný oltář s Madonou v kostele P. Marie před Týnem na Starém Městě (P. Marie na trůně).,17.4.1907,16x,0CF1881292D811E193C36C626D41E503,XII 518,1907-04-17,1907-04-17,14.42203,50.08761,regional.address,geocode,Eckert-ateliér,,0.0,[],[]
pozitiv,"Pohled na část průčelí ""Faustova domu"" (dům čp. 502 na Novém Městě) do Vyšehradské ulice - poškozeném po náletu spojenců v únoru 1945. V popředí zničená zahradní zeď kostela sv. Jana Na Skalce při odklízení sutin.",únor 1945,75x,83B88CAFE44311E4BE0074D435EEBE90,I 11194,1945-02-01,1945-02-28,14.419,50.07337,regional.address,geocode,,,,[],[]
pozitiv,Pohled na rybí přechody vedle vorové propusti nového Helmovského jezu. V pozadí most císaře Františka Josefa I.,9.4.1910,61x,E1714433638311E6A553000C76270B94,I 11825,1910-04-09,1910-04-09,14.43076,50.09537,poi,suggest,,,,[],[]
pozitiv,Pohled z vltavského břehu mezi Velkou a Malou Chuchlí k východu přes řeku na břeh v Modřanech. Součást panoramatu.,16.9.1934,55x,A1188C63B67611DF820F00166F1163D4,I 8792,1934-09-16,1934-09-16,14.3898,50.01661,regional.street,suggest,"Alexander, Antonín (1892-působnost do 1948)",,,[],[]
pozitiv,Průhled ulicí Na Dlážděnce.,1978,75x,A1187F66B67611DF820F00166F1163D4,I 270,1978-01-01,1978-12-31,14.44564,50.12087,regional.address,geocode,"Jelínková, Jana (1951-)",,,[],[]
pozitiv,Celkový pohled na dům čp. 434 na Novém Městě (lázně). Vpravo kostel P. Marie u Alžbětinek.,kol.1930,54x,EA564B87CA5911E59CC8406186009F3A,I 11493,1930-01-01,1930-12-31,14.42012,50.06984,regional.address,geocode,,,,[],[]
pohlednice,Celkový pohled na kostel sv. Cyrila a Metoděje na Karlínském náměstí. Legenda: Gruss aus Karolinenthal. - St. Cyrill und Method-Kirche.,kol.1900,80x,A1187A3BB67611DF820F00166F1163D4,I 1970,1900-01-01,1900-12-31,14.44872,50.09219,regional.address,geocode,,,,[],[]
negativ,Pohled do interiéru Muzea hlavního města Prahy (dům čp. 1554 na Novém Městě) v městských sadech Na Poříčí (dnes Švermovy sady) - sál s exponáty.,1902,35x,A0C4FF0FB67611DF820F00166F1163D4,VIII 458,1902-01-01,1902-12-31,14.43848,50.0901,regional.address,geocode,"Eckert, Jindřich (1833-1905)",,,[],[]
pozitiv,"Průhled Vinohradskou ulicí (v místech dnešní ulice Ke Strašnické) k severu. V popředí hráz rybníka. Vlevo dům čp. 23, vpravo dům čp. 2 ve Strašnicích.",20.11.1942,46x,BED4761CC49411E78A03D4BED94BB14D,A 14861,1942-11-20,1942-11-20,14.48269,50.0676,regional.address,geocode,"Alexander, Antonín (1892-působnost do 1948)",,0.0,[],[]
negativ,Pohled do interiéru kláštera Na Slovanech (v Emauzích) - dům čp. 320 na Novém Městě - kapitulní sál.,kol.1895,19x,6A57B1A90A2011E1BEC1000C766D2371,XII 360,1895-01-01,1895-12-31,14.41719,50.07215,regional.address,geocode,"Eckert, Jindřich (1833-1905)",,0.0,[],[]
negativ,Sala terrena Valdštejnského paláce (dům čp. 17 na Malé Straně) - interiér.,,19x,A0C50A05B67611DF820F00166F1163D4,VIII 379,,,14.40535,50.09003,regional.address,geocode,"Eckert, Jindřich (1833-1905)",,,[],[]
negativ,Průhled Královskou ulicí (dnes Sokolovská) k východu - směrem ke křižovatce s Vítkovou a ke Karlínskému náměstí. V pozadí dům čp. 145 s arkýřem v Karlíně. Uprostřed dvě koňky.,1895-1900,82x,DAB4936630FD11E9978874D435EEBE90,IX 243 d,1895-01-01,1900-12-31,14.44836,50.09326,regional.address,geocode,Bellmann-ateliér,,,[],[]
negativ,Pohled na starou a novou tabulku s názvem náměstí (Kleiner Waldstein-Platz/Malé Valdštýnské náměstí - Waldšteinské náměstí).,,20x,55E69735C4E511EA983A406186009F3A,IX 948,,,14.40535,50.09003,regional.address,geocode,"Reach, Zikmund (1859-1935)",,,[],[]
negativ,Pohled na Průmyslový palác (dům čp. 416) na výstavišti v Bubenči při Jubilejní výstavě 1891 - se zadním vchodem.,1891,85x,79BE0EEC6A2B11E2BF13525400E46D25,VIII 1161,1891-01-01,1891-12-31,14.42967,50.10684,poi,suggest,"Eckert, Jindřich (1833-1905)",,,[],[]
pozitiv,Cechovní znak sladovníků na svorníku kostela sv. Haštala na Starém Městě.,1990,19x,A14CEB58B67611DF820F00166F1163D4,VI 66/12 b,1990-01-01,1990-12-31,14.42492,50.09122,regional.address,geocode,"Jelínková, Jana (1951-)",,,[],[]
pozitiv,"Pohled na hlavní průčelí nádraží Praha - Těšnov (dům čp. 1583 na Novém Městě). Reprodukce exponátu na výstavě ""Paříž - Praha 1897 - 1917"" v Obecním domě 1997.",,88x,A0C501C4B67611DF820F00166F1163D4,VI 73/15 a,,,14.43633,50.09114,regional.address,geocode,"Fink, František (1854-1935)","Fink, František - Landergott, Josef (repro)",,[],[]
pozitiv,Průvod na Smetanově nábřeží během XI. všesokolském sletu Prahou. V pozadí domy čp. 330 a 327 na Starém Městě.,1948,70x,A0C51148B67611DF820F00166F1163D4,I 1673,1948-01-01,1948-12-31,14.41354,50.08405,regional.address,geocode,"Pacovský, Jaroslav",,,[],[]
negativ,Bronzový lustr na Pražském hradě.,před 1886,16x,F76D999F903F11E080250010DCCFBEC5,XII 328,1800-01-01,1885-12-31,14.39861,50.08948,regional.address,geocode,"Eckert, Jindřich (1833-1905)",,0.0,[],[]
pozitiv,"Pohled na údolí, jímž vede cesta do Bohnic z vrchu Skalka. Součást kruhového pětidílného panoramatu.",10.9.1924,84x,55BA6723213111E8925674D435EEBE90,A 1188,1924-09-10,1924-09-10,14.41575,50.13306,regional.address,geocode,"Alexander, Antonín (1892-působnost do 1948)",,0.0,[],[]
negativ,Pohled na klášter sester Srdce Ježíšova (dům čp. 103) v Holečkově ulici na Smíchově. V pozadí vpravo kostel Srdce Ježíšova - Sacré Coeur.,duben 1907,42x,53796578B42C11E39F7D0024BE7CD9AC,XI 256,1907-04-01,1907-04-30,14.39781,50.07552,regional.address,geocode,"Kříženecký, Jan (1868-1921)",,0.0,[],[]
negativ,Pohled na malostranskou stranu nové Újezdské brány na Malé Straně před zbořením v roce 1891.,kol.1890,93x,BD1410CAB61411E59BFF406186009F3A,IX 7,1890-01-01,1890-12-31,14.4049,50.08346,regional.address,geocode,"Eckert, Jindřich (1833-1905)","Eckert, Jindřich - Bellmann-ateliér (repro)",0.0,[],[]
pozitiv,Pohled na část jižního průčelí Staroměstské radnice při restaurování orloje (dům čp. 1 na Starém Městě) na Staroměstském náměstí. Detail levé fiály před opravou.,11.9.1911,36x,0282D68E90E311E8B3B474D435EEBE90,V 69/5 a,1911-09-11,1911-09-11,14.42009,50.087,regional.address,suggest,"Kříženecký, Jan (1868-1921)",,,[],[]
negativ,Pohled do dvora kláštera Bosých karmelitánek - Anglických panen (dům čp. 43 na Malé Straně ) při kostele sv. Josefa na Malé Straně.,[1863-1945],65x,1226EC43CF8911DFBD51000C766D2371,XII 2,,,14.40954,50.08875,regional.address,geocode,Eckert,Datace neznámá. Za účelem vyhledávání byla nastavena na časový rozsah celé sbírky.,0.0,[],[]
negativ,Pohled do Královské obory (Stromovky) - jezírko s labutěmi.,kol.1900,44x,A11878DCB67611DF820F00166F1163D4,VIII 1057,1900-01-01,1900-12-31,14.42114,50.1069,poi,suggest,"Eckert, Jindřich (1833-1905)",,,[],[]
pozitiv,Pohled do interiéru chrámu sv. Víta na ochranné zdi náhrobků a královské oratoře před nálety.,1945,3x,1BBBCF291C9011E8804174D435EEBE90,II 1695,1945-01-01,1945-12-31,14.4006,50.09089,poi,suggest,"Sudek, Josef (1896-1976)",,,[],[]
pozitiv,Pohled na novostavbu administrační budovy ústřední elektrárny v Holešovicích (dům čp. 1).,1899,33x,A1187CB5B67611DF820F00166F1163D4,VI 76/1,1899-01-01,1899-12-31,14.43637,50.10853,regional.address,geocode,,,,[],[]
pozitiv,Průhled Václavským náměstím od Můstku. V pozadí Národní muzeum (dům čp. 1700 na Novém Městě). Po obou stranách domy náměstí.,1900-1901,52x,AFD6CE3DD85611E89C7B74D435EEBE90,V 24/7 c,1900-01-01,1901-12-31,14.43056,50.07918,regional.address,geocode,Bellmann-ateliér,,,[],[]
pozitiv,Celkový pohled na hlavní průčelí Thunovského paláce - domu čp. 214 na Malé Straně v Nerudově ulici.,kol.1925,47x,A14CE2F9B67611DF820F00166F1163D4,I 8498,1925-01-01,1925-12-31,14.40038,50.08859,regional.address,geocode,"Vojta, Tomáš (1885-1934)",,,[],[]
pozitiv,Socha Filosofa v jižním průčelí Staroměstské radnice (dům čp. 1 na Starém Městě) na Staroměstském náměstí.,říjen 1930,33x,2C35A434D39711E8A2B874D435EEBE90,Voj 4092,1930-10-01,1930-10-31,14.34054,50.07267,regional.address,suggest,"Vojta, Tomáš (1885-1934)",,0.0,[],[]
pozitiv,"Pohled do zahrady domu čp. 859 na Novém Městě (Německý dům - kasino, Slovanský dům).",před 1926,41x,A11869C1B67611DF820F00166F1163D4,I 1822,1800-01-01,1925-12-31,14.42732,50.08641,regional.address,geocode,"Vojta, Tomáš (1885-1934)",,,[],[]
pozitiv,Pohled na stavbu budovy Magistrátu hlavního města Prahy (dům čp. 2) na Mariánském náměstí na Starém Městě - zdění třetího patra. V pozadí věže kostela sv. Mikuláše..,10.4.1910,11x,0ac1c103257244e0a3d6aba94c4d3c81,I 12881,1910-04-10,1910-04-10,14.41783,50.08711,regional.address,geocode,,,,[],[]
negativ,Celkový pohled na dům čp. 1554 na Novém Městě (Muzeum hlavního města Prahy) v městských sadech Na Poříčí (dnes Švermovy sady).,1902,53x,A1188689B67611DF820F00166F1163D4,VIII 265,1902-01-01,1902-12-31,14.43848,50.0901,regional.address,geocode,"Eckert, Jindřich (1833-1905)",,,[],[]
pozitiv,"Pohled na vstupní portál domu čp. 1036 (""Palác Sweerts-Sporckův"") v Hybernské ulici na Novém Městě.",9.5.1906,26x,A0C510E5B67611DF820F00166F1163D4,VI 19/24,1906-05-09,1906-05-09,14.43036,50.08731,regional.address,geocode,,,,[],[]
pozitiv,Pohled na dům čp. 793 na Václavském náměstí na Novém Městě krátce před zbořením.,1912,25x,F02D1924E29511E89F1B74D435EEBE90,V 9/7,1912-01-01,1912-12-31,14.42626,50.08178,regional.address,geocode,,,,[],[]
pozitiv,Pohled na kamenný sloup a dřevěný trám v domě čp. 640 (Ungeltní dům) na Starém Městě.,1914,17x,5C54F51BE75E11E49A60406186009F3A,V 6/7 j,1914-01-01,1914-12-31,14.42344,50.08789,regional.address,geocode,,,,[],[]
pozitiv,"Pohled na průčelí domu čp. 4, 5 do Kinského třídy (Štefánikova ulice) na Smíchově.",kol.1905,120x,A0C510DFB67611DF820F00166F1163D4,I 1625,1905-01-01,1905-12-31,14.4041,50.07247,regional.address,geocode,"Vojta, Tomáš (1885-1934)",,,[],[]
negativ,Celkový pohled na Matyášovu bránu Pražského hradu z Hradčanského náměstí. V popředí brána se sochami zápasících Gigantů na prvním nádvoří.,24.4.1902,25x,A1188AF7B67611DF820F00166F1163D4,VIII 373,1902-04-24,1902-04-24,14.39534,50.08934,regional.address,geocode,"Eckert, Jindřich (1833-1905)",,,[],[]
pozitiv,"Pohled na východní průčelí farní budovy (dům čp. 21) s výhledem na Hostivař směrem k severu k bývalé sýpce, škole i sokolovně.",8.6.1930,53x,A0C4F8B3B67611DF820F00166F1163D4,I 9095,1930-06-08,1930-06-08,14.52292,50.04973,regional.address,geocode,"Alexander, Antonín (1892-působnost do 1948)",,,[],[]
pozitiv,Pohled do Rabínské (dnes Maiselovy) ulice v Josefově se Staronovou synagogou a Židovskou radnicí (dům čp. 250).,kol.1885,108x,A0C4FCE6B67611DF820F00166F1163D4,II 110,1885-01-01,1885-12-31,14.41844,50.08972,regional.address,geocode,,,,[],[]
pozitiv,"Pohled do ulice Úvoz s domy (zleva) čp. 165, čp. 166 a čp. 167 na Hradčanech.",září 1911,26x,A14CEA41B67611DF820F00166F1163D4,VI 61/11,1911-09-01,1911-09-30,14.39559,50.08844,regional.address,geocode,Eckert-ateliér,,,[],[]
pozitiv,Pohled na Bohnice z vrchu Skalka. V pozadí ústav pro choromyslné v Bohnicích. Součást kruhového šestidílného panoramatu.,18.7.1926,89x,EE77C866211C11E8925674D435EEBE90,A 2544,1926-07-18,1926-07-18,14.42139,50.1328,regional.address,geocode,"Alexander, Antonín (1892-působnost do 1948)",,0.0,[],[]
pozitiv,Socha Hvězdáře v jižním průčelí Staroměstské radnice (dům čp. 1 na Starém Městě) na Staroměstském náměstí.,říjen 1930,34x,64FE8984D39711E8A2B874D435EEBE90,Voj 4093,1930-10-01,1930-10-31,14.34054,50.07267,regional.address,suggest,"Vojta, Tomáš (1885-1934)",,0.0,[],[]
pozitiv,Pohled na travnatý břeh poloostrova mezi Holešovickým přístavem a starým řečištěm Vltavy.,8.8.1923,66x,A49E60FFA72311E6BBBD406186009F3A,A 139,1923-08-08,1923-08-08,14.45414,50.11058,poi,suggest,"Alexander, Antonín (1892-působnost do 1948)",,0.0,[],[]
pozitiv,Pohled na portál zahrady kostela sv. Jana Nepomuckého na Skalce a vedlejšího domu čp. 502 na Karlově náměstí na Novém Městě.,31.5.1923,116x,E6607931976711E6BAC1406186009F3A,A 61,1923-05-31,1923-05-31,14.42313,50.08113,regional.address,suggest,"Alexander, Antonín (1892-působnost do 1948)",,0.0,[],[]
pozitiv,Pohled do Hradešínské ulice. Vpravo v pozadí vinohradský pivovar (dům čp. 810 na Vinohradech). V popředí pole.,1908,127x,A0C502B3B67611DF820F00166F1163D4,I 216,1908-01-01,1908-12-31,14.45662,50.07532,regional.address,geocode,"Vyšata, Adolf",,,[],[]
pozitiv,"Panoramatický pohled od Mariánských hradeb na Alšovo nábřeží. Uprostřed dnešní náměstí Jana Palacha. Vlevo Rudolfinum (dům čp. 79) a naproti dům čp. 80 (Uměleckoprůmyslová škola) na Starém Městě. Vpravo Rudolfova lávka, Alšovo nábřeží, Vltava, Železná lávka).",1910,55x,A1187F68B67611DF820F00166F1163D4,V 91/21 a,1910-01-01,1910-12-31,14.41521,50.09017,regional.address,geocode,,,,[],[]
negativ,"Reprodukce mědirytu Friedricha Bernarda Wernera a Johana Georga Ringleho, Staroměstské náměstí s radnicí, kol.1740.",před 1897,146x,81B60268DAB911DFBD5D000C766D2371,XII 301,1800-01-01,1896-12-31,14.41994,50.08663,regional.address,geocode,"Eckert, Jindřich (1833-1905)",,0.0,[],[]
pozitiv,Pohled na dům čp. 19 v Bubenči (zámeček) - střední část zahradního průčelí se schodištěm.,duben 1924,18x,d47b575d89504c4bbf2e8fc2d71e40c7,Voj 473,1924-04-01,1924-04-30,14.41014,50.10251,regional.address,geocode,"Vojta, Tomáš (1885-1934)",,0.0,[],[]
pozitiv,Pohled na portál kostela P. Marie Ustavičné pomoci a sv. Kajetána v Nerudově ulici na Malé Straně.,17.7.1907,58x,A1188818B67611DF820F00166F1163D4,VI 31/17,1907-07-17,1907-07-17,14.40105,50.08864,regional.address,geocode,,,,[],[]
negativ,Pohled na průčelí domů čp. 1384 a 1385 v Korunní ulici na Vinohradech.,29.7.-3.9.1906,48x,A14CDC2DB67611DF820F00166F1163D4,VIII 275,,,14.44677,50.07548,regional.address,geocode,Eckert-ateliér,,,[],[]
pozitiv,VII. sokolský slet 1920 - slavnostní shromáždění před Staroměstskou radnicí. Mezi ostatními generál Pellé a primátor Baxa.,1920,64x,A0C514AFB67611DF820F00166F1163D4,I 9252,1920-01-01,1920-12-31,14.42009,50.087,regional.address,suggest,,,,[],[]
pozitiv,Pohled na usedlost Hadovka (dům čp. 10) v Dejvicích - zadní průčelí z dálky.,březen 1959,63x,FBA4B179611411E4B88BD4BED94BB14D,I 11037,1959-03-01,1959-03-31,14.37685,50.10006,regional.address,geocode,"Hnilička, Eduard (1887-1967)",,,[],[]
pozitiv,"Pohled na portál domu čp. 378 (""U tří jetelových lístků"") v Karmelitské ulici na Malé Straně.",18.6.1906,18x,A0C50479B67611DF820F00166F1163D4,VI 23/6,1906-06-18,1906-06-18,14.40395,50.08626,regional.address,geocode,,,,[],[]
negativ,"Kropicí vůz tažený koňmi na Staroměstském náměstí. V pozadí domy čp. (zleva) 605, čp. 604, čp. 603 na Starém Městě.",srpen 1910,20x,F0EAFD2BCFFA11E196716C626D41E503,XI 1593,1910-08-01,1910-08-31,14.42211,50.08746,regional.address,geocode,"Kříženecký, Jan (1868-1921)",,0.0,[],[]
negativ,Pohled do interiéru domu čp. 216 (Obecná a měšťanská dívčí škola u sv. Vojtěcha) na Novém Městě - tělocvična.,5.6.1907,21x,FA130655B9A711E39F720024BE7CD9AC,XI 337,1907-06-05,1907-06-05,14.41497,50.07885,regional.address,geocode,"Kříženecký, Jan (1868-1921)",,0.0,[],[]
CD-ROM,Pohled přes Trojskou lávku směrem k Troji při povodni 9.8.2002.,9.8.2002,20x,A14CE6C9B67611DF820F00166F1163D4,XXII 1/25,2002-08-09,2002-08-09,14.41665,50.11435,regional.street,suggest,"Malec, Milan - Malcová, Alena",,0.0,[],[]
negativ,"""Tycho Brahe v Praze"" - výstava 1901. Rukopis Tabulae Prutenicae.""Tycho Brahe v Praze"" - výstava 1901. T.XII.1. Rukopis Tabulae Prutenicae.",1901,6x,EDEF02860BB211E2AEA36C626D41E503,XII 905,1901-01-01,1901-12-31,14.41994,50.08663,regional.address,geocode,"Eckert, Jindřich (1833-1905)",,0.0,[],[]
negativ,Reprodukce veduty kostela sv. Linharta na Starém Městě podle kresby Antonína Knöchela.,před 1897,47x,C5523EB7DACB11DFBD5D000C766D2371,XII 313,1800-01-01,1896-12-31,14.41865,50.08693,regional.address,geocode,"Eckert, Jindřich (1833-1905)",,0.0,[],[]
pozitiv,Pohled na cihlový sklep v bývalé vinici severně od čp. 185 na Smíchově (usedlost Barvířka) na východním svahu Paví hory u jižního okraje sadů Na Santošce.,22.8.1922,126x,A1186AE3B67611DF820F00166F1163D4,I 1886,1922-08-22,1922-08-22,14.40127,50.06373,regional.address,geocode,"Bernau, Karel, Ing. (1880-1948)",,,[],[]
pozitiv,Pohled na nástěnnou malbu z domu čp. 494 na Starém Městě - při bourání domu.,1898,26x,A14CE923B67611DF820F00166F1163D4,VI 47/24,1898-01-01,1898-12-31,14.60353,50.02439,regional.address,geocode,"Mulač, Jan",,,[],[]
pozitiv,Cechovní znak preclíkářů ze staré zasedací síně Staroměstské radnice (dům čp. 1 na Starém Městě).,1990,14x,A14CEB4EB67611DF820F00166F1163D4,VI 66/6 b,1990-01-01,1990-12-31,14.42009,50.087,regional.address,suggest,"Jelínková, Jana (1951-)",,,[],[]
negativ,Pohled na reliéf nad portálem kostela sv. Jakuba v ulici Malá Štupartská na Starém Městě.,kol. 1910,18x,2949A65B7C8111E488040024BE7CD9AC,XI 693,,,14.42455,50.08856,regional.address,geocode,"Kříženecký, Jan (1868-1921)",,0.0,[],[]
pozitiv,Cechovní znak řezníků pod kruchtou kostela sv. Jakuba na Starém Městě.,1990,15x,A14CEB56B67611DF820F00166F1163D4,VI 66/11 b,1990-01-01,1990-12-31,14.42455,50.08856,regional.address,geocode,"Jelínková, Jana (1951-)",,,[],[]
pozitiv,Celkový pohled na kostel sv. Petra a Pavla Na Zderaze na Novém Městě při bourání.,1.7.1904,41x,A1186D88B67611DF820F00166F1163D4,VI 30/2 a,1904-07-01,1904-07-01,14.41657,50.07735,regional.address,geocode,"Eckert, Jindřich (1833-1905)",,,[],[]
negativ,"Pohled na část Pražského hradu na Hradčanském náměstí. Vlevo brána se sochami zápasících gigantů, vpravo původní sousoší sv. Václava na rampě.",kol.1890,37x,FE56AA1994FC11E192C36C626D41E503,XII 580,1890-01-01,1890-12-31,14.39769,50.08921,regional.address,geocode,"Eckert, Jindřich (1833-1905)",,0.0,[],[]
pozitiv,"Pohled na dům čp. 120 (""Skalka"") na Smíchově. Vpravo část cihelny. Součást panoramatu.",15.5.1925,65x,A1186C57B67611DF820F00166F1163D4,I 8755,1925-05-15,1925-05-15,14.36851,50.07335,regional.address,geocode,"Alexander, Antonín (1892-působnost do 1948)",,,[],[]
pozitiv,Pohled na zahradní zeď kostela sv. Jana Na Skalce na Novém Městě.,19.5.1906,35x,A118683AB67611DF820F00166F1163D4,VI 30/6 a,1906-05-19,1906-05-19,14.41863,50.06956,regional.address,geocode,,,,[],[]
pozitiv,Celkový pohled na průčelí domu čp. 1563 (Anatomický ústav) na Novém Městě.,kol.1890,27x,A0C5181EB67611DF820F00166F1163D4,I 1522,1890-01-01,1890-12-31,14.42212,50.07375,regional.address,geocode,,,,[],[]
negativ,Pohled na 3. můstek přes Čertovku z můstku u Velkopřevorského mlýna.,,51x,7C6723FAB91111E59ABE406186009F3A,IX 11 b,,,14.40627,50.08618,regional.address,geocode,Bellmann (?),,,[],[]
pozitiv,"Panoramatický pohled na Hlubočepy a okolí. V popředí železniční viadukt (Pražský Semmering), v pozadí Prokopské údolí.",3.4.1926,83x,1C12AF8E234111E2A12A406186009F3A,I 9645,1926-04-03,1926-04-03,14.40355,50.04138,regional.address,geocode,"Alexander, Antonín (1892-působnost do 1948)",,,[],[]
pozitiv,Pohled na smíchovskou stranu staré Újezdské brány na Malé Straně. Vlevo v pozadí chrám sv. Víta.,1862,68x,6822D1496BA011E2AB7F6C626D41E503,VI 62/7 b,1862-01-01,1862-12-31,14.4049,50.08346,regional.address,geocode,"Rupp, Wilhelm (1821-1893)",,,[],[]
pozitiv,Socha Atlanta s hvězdným globem sejmutá během opravy z věže Klementina (dům čp. 190) na Starém Městě.,5.6.1914,17x,482E9AFEB78011E4AB55406186009F3A,V 4/4 i,1914-06-05,1914-06-05,14.4172,50.08697,regional.address,geocode,,,,[],[]
negativ,"Pohled od zimního stadionu na Štvanici na severní předmostí Hlávkova mostu, vlevo kostel sv. Antonína, v pozadí Holešovice.",kol.1960,47x,A14CE2F7B67611DF820F00166F1163D4,VII 29,1960-01-01,1960-12-31,14.4369,50.09567,regional.street,suggest,"Chalupníček, Miroslav -, Chalupníčková, Věra (dokument 1941-1948)",,,[],[]
pozitiv,"Pohled na severozápadní stranu Mariánského náměstí s Klementinem (dům čp. 190, 1040) a domy čp. 99, 100, 103 (zleva) na Starém Městě.",kol.1890,44x,A0C50E4FB67611DF820F00166F1163D4,VI 37/17,1890-01-01,1890-12-31,14.41948,50.09233,regional.address,geocode,"Eckert, Jindřich (1833-1905)",,,[],[]
pozitiv,"Pohled do dvora zámku v Jinonicích (dům čp. 1 - dvůr, statek) - od hlavních vrat na střední severní trakt.",22.4.1930,29x,A0C4FB5FB67611DF820F00166F1163D4,I 4255,1930-04-22,1930-04-22,14.35413,50.0556,regional.address,geocode,"Alexander, Antonín (1892-působnost do 1948)",,,[],[]
pozitiv,Celkový pohled na dům čp. 1210 v Novostrašnické ulici ve Strašnicích.,21.5.1923,61x,CF8F27D0975E11E6BAC1406186009F3A,A 44,1923-05-21,1923-05-21,14.4936,50.06953,regional.address,geocode,"Alexander, Antonín (1892-působnost do 1948)",,0.0,[],[]
pozitiv,Pohled na ústí čimického potoka do Vltavy z návrší nad dynamitkou (dům čp. 50 v Bohnicích).,13.9.1923,97x,CF96AD8B9FC211E3B650406186009F3A,I 9912,1923-09-13,1923-09-13,14.41556,50.13557,regional.address,geocode,"Alexander, Antonín (1892-působnost do 1948)",,,[],[]
pozitiv,Pohled na Gröbeho vilu (dům čp. 58 na Vinohradech).,1940-1944,39x,A0C4F737B67611DF820F00166F1163D4,I 1872,1940-01-01,1944-12-31,14.44502,50.06921,regional.address,geocode,,,,[],[]
negativ,Celkový pohled na kostel sv. Petra a Pavla na Vyšehradě po přestavbě.,1904,31x,A0C4FF83B67611DF820F00166F1163D4,VIII 294,1904-01-01,1904-12-31,14.41739,50.06532,regional.address,geocode,"Eckert, Jindřich (1833-1905)",,,[],[]
pozitiv,Panoramatický pohled na Hostivař z Komenského náměstí (dnešní Trhanovské). V popředí dům čp. 13 (hostinec U města Budína) v Pražské ulici. Druhá část třídílného panoramatu.,5.7.1930,65x,A0C50A93B67611DF820F00166F1163D4,I 9062,1930-07-05,1930-07-05,14.43055,50.07093,regional.address,geocode,"Alexander, Antonín (1892-působnost do 1948)",,,[],[]
negativ,Pohled na novoměstský břeh u Nových mlýnů. Vlevo Novomlýnská vodárenská věž u Nových mlýnů.,1890-1891,52x,A0C5097DB67611DF820F00166F1163D4,VIII 1066,1890-01-01,1891-12-31,14.42835,50.0923,poi,suggest,"Eckert, Jindřich (1833-1905)",,,[],[]
negativ,"Pohled z Palackého mostu na Šítkovské mlýny s věží Šítkovské vodárny. Uprostřed mlýn s továrnou bratří Trnků čp. 253. Vpravo část nábřeží, vlevo v pozadí most Legií.",2.9.1906,57x,A1188687B67611DF820F00166F1163D4,VIII 217,1906-09-02,1906-09-02,14.34636,50.09682,regional.address,geocode,Eckert-ateliér,,,[],[]
negativ,Pohled do dvora domu čp. 1257 mezi Plaveckou a Mýtní ulicí na Novém Městě.,18.8.1906,26x,A1187B36B67611DF820F00166F1163D4,VIII 558,1906-08-18,1906-08-18,14.59993,50.03147,regional.address,geocode,Eckert-ateliér,,,[],[]
pozitiv,Panoramatický pohled na Vršovice z Bohdalce. V pozadí vlevo část Edenu. Součást čtyřdílného panoramatu.,1.9.1926,46x,6ba18a18df3b4ec7afc2e747a3a5738c,A 2680,1926-09-01,1926-09-01,14.4652,50.0598,regional.address,geocode,"Alexander, Antonín (1892-působnost do 1948)","Součást panoramatu A 2677, 2678, A 2679, A 2680.",0.0,[],[]
pozitiv,Pohled na viniční Boží muka při Prosecké silnici vedoucí z Libně na Prosek - západní strana po opravě.,31.10.1930,80x,A1188506B67611DF820F00166F1163D4,I 4873,1930-10-31,1930-10-31,14.48944,50.11463,regional.address,geocode,"Alexander, Antonín (1892-působnost do 1948)",,,[],[]
negativ,Pohled přes Vltavu na část řetězového mostu císaře Františka I. (Legií) ze Střeleckého ostrova. Vlevo Národní divadlo(dům čp. 223 na Novém Městě).,kol.1890,68x,A118739AB67611DF820F00166F1163D4,VIII 414,1890-01-01,1890-12-31,14.41347,50.08126,regional.address,geocode,"Eckert, Jindřich (1833-1905)",,,[],[]
pozitiv,Pohled na Malý mlýn (dům čp. 44) v Dolní Šárce v Dejvicích - západní průčelí.,12.4.1944,9x,8361fee61c8c485594c6bd7d302b2fac,A 15668,1944-04-12,1944-04-12,14.38279,50.1003,regional.address,geocode,"Alexander, Antonín (1892-působnost do 1948)",,0.0,[],[]
negativ,"Pohled z nároží bastionu 36 vyšehradských hradeb k jihu na Podolí a vltavské údolí. V popředí podolské sanatorium (dům čp. 157). V pozadí uprostřed Podolské nábřeží, přístav, přístavní hráz s dřevěnou budovou Yacht klubu (dům čp. 1148 v Podolí). Dále v pozadí Veslařský ostrov.",10.9.1923,75x,49A2A13661AF11E9931174D435EEBE90,X 5119,1923-09-10,1923-09-10,14.41925,50.06214,regional.address,geocode,"Vojta, Tomáš (1885-1934)",,,[],[]
pozitiv,Pohled na pomník M. Jana Husa. V pozadí domy severní strany Staroměstského náměstí.,kol.1920,30x,A0C5159CB67611DF820F00166F1163D4,I 8906,1920-01-01,1920-12-31,14.41994,50.08663,regional.address,geocode,"Vojta, Tomáš (1885-1934)",,,[],[]
negativ,Pohled na hlavní průčelí Obecního domu (dům čp. 1090 na Starém Městě). V pozadí Prašná brána.,kol.1915,51x,A1188AF9B67611DF820F00166F1163D4,XII 1848,1915-01-01,1915-12-31,14.29081,50.09402,regional.address,suggest,,,0.0,[],[]
pozitiv,Povodeň v březnu roku 1940 - rozvodněná Vltava a zatopené domy v Braníku (?).,březen 1940,36x,FD6688D299B511E1874B6C626D41E503,I 9603,1940-03-01,1940-03-31,14.40827,50.03202,regional.address,geocode,,,,[],[]
pozitiv,Pohled na terasní zeď kostela sv. Jana Nepomuckého na Skalce ve Vyšehradské ulici na Novém Městě.,28.5.1923,61x,01E50A0D978B11E6BAC1406186009F3A,A 64,1923-05-28,1923-05-28,14.41719,50.07215,regional.address,geocode,"Alexander, Antonín (1892-působnost do 1948)",,0.0,[],[]
pozitiv,Pohled na nárožní dům čp. 935 na Starém Městě. Vlevo kašna s delfíny před kostelem sv. Mikuláše.,1895,12x,A1188767B67611DF820F00166F1163D4,VI 58/9,1895-01-01,1895-12-31,14.42034,50.08826,regional.address,geocode,"Maloch, Jan (1825-1911)",Autorství J. Malocha není jisté.,,[],[]
pozitiv,"Průhled Zlatou uličkou na Pražském hradě. Zleva domy čp. 23, 22, 21, 20, 19, 18, 17, 16 a zprava domy čp. 11, 7, 6 na Hradčanech.",,28x,A14CE7EBB67611DF820F00166F1163D4,I 9378,,,14.40428,50.09207,regional.address,geocode,"Vojta, Tomáš (1885-1934)",,,[],[]
negativ,Zvon z kostela Nanebevzetí P. Marie na Strahově sejmutý za 1. světové války k roztavení.,1914-1918,20x,2BB3941ED39D11E8AE88406186009F3A,XI 3851,1914-01-01,1918-12-31,14.38967,50.08671,regional.address,geocode,,,0.0,[],[]
pozitiv,"Pohled na portál domu čp. 182 (""Toskánský palác"") na Hradčanském náměstí na Hradčanech.",27.7.1906,20x,A0C50887B67611DF820F00166F1163D4,VI 24/32,1906-07-27,1906-07-27,14.39535,50.08934,regional.address,geocode,,,,[],[]
pozitiv,Pohled na usedlost Šťáhlavka (dům čp. 27) v Dejvicích.,11.6.1925,77x,A14CDE08B67611DF820F00166F1163D4,I 1957,1925-06-11,1925-06-11,14.38713,50.10752,regional.address,geocode,"Alexander, Antonín (1892-působnost do 1948)",,,[],[]
pozitiv,"Pohled do Hostivařské ulice v Hostivaři. Vlevo domy čp. 200 a čp. 204, v pozadí dům čp. 135.",5.7.1930,49x,A0C50246B67611DF820F00166F1163D4,I 9078,1930-07-05,1930-07-05,14.52893,50.05218,regional.address,geocode,"Alexander, Antonín (1892-působnost do 1948)",,,[],[]
pozitiv,"Pohled na původní dům čp. 128 na Malé Straně ""letní dům Jezuitů"" v Jezuitské zahradě na Malé Straně při úpravě terénu pro stavbu Strakovy akademie. V pozadí břeh s Rudolfinem a panorama Starého Města.",kol.1893,39x,A14CE7D1B67611DF820F00166F1163D4,VI 8/11,1893-01-01,1893-12-31,14.41139,50.09203,regional.address,geocode,"Eckert, Jindřich (1833-1905)",,,[],[]
negativ,Celkový pohled na hlavní průčelí novostavby školy v Jindřišské ulici (dům čp. 966 na Novém Městě).,1890,22x,55E176DD922B11E2BF28525400E46D25,VIII 1476,1890-01-01,1890-12-31,14.43094,50.08457,regional.address,geocode,"Eckert, Jindřich (1833-1905)",,,[],[]
negativ,"Celkový pohled na dům čp. 752 na nároží Jungmannova náměstí a Jungmannovy ulice na Novém Městě. Vpravo část Jungmannovy ulice s domy čp. 751, 750. Vlevo pomník Josefa Jungmanna.",18.7.1911,78x,A11874C8B67611DF820F00166F1163D4,VIII 63,1911-07-18,1911-07-18,14.4224,50.08258,regional.address,geocode,Eckert-ateliér,,,[],[]
negativ,"Pohled na Křižovnické náměstí od západu. Vlevo průčelí kostela sv. Františka, vpravo průčelí kostela sv. Salvátora.",10.3.1908,36x,233B18DA077511E48CE60024BE7CD9AC,XI 553,1908-03-10,1908-03-10,14.41405,50.08641,regional.address,geocode,"Kříženecký, Jan (1868-1921)",,0.0,[],[]
pozitiv,"Panoramatický pohled na Hloubětín, Kyje, Hrdlořezy (?) z nejvyššího vrchu Hlohovce (od západu přes sever a východ). Součást panoramatu.",2.10.1927,97x,A0C4FAC9B67611DF820F00166F1163D4,I 4859,1927-10-02,1927-10-02,14.53464,50.10186,regional.address,geocode,"Alexander, Antonín (1892-působnost do 1948)",,,[],[]
pozitiv,Panoramatický pohled na Pražský hrad a Malou Stranu s malostranským nábřežím (pod Cihelnou ulicí) z Karlova mostu.,kol.1898,32x,6B4B53C1DB7D11DFBD5E000C766D2371,VI 49/12,1898-01-01,1898-12-31,14.40985,50.08802,regional.address,geocode,"Eckert, Jindřich (1833-1905)",,,[],[]
negativ,Pohled od Albertova na budovu Fyzikálního ústavu Matematicko-fyzikální fakulty Univerzity Karlovy (dům čp. 2026) v ulici Ke Karlovu na Novém Městě.,duben 1907,47x,6C7F7308B42611E39F7D0024BE7CD9AC,XI 251,1907-04-01,1907-04-30,14.42816,50.07019,regional.address,geocode,"Kříženecký, Jan (1868-1921)",,0.0,[],[]
pozitiv,Celkový pohled na vyšehradský železniční most z Rašínova nábřeží.,7.10.1931,53x,8FE902C1C74011EA983A406186009F3A,A 7226,1931-10-07,1931-10-07,14.41451,50.07097,regional.address,geocode,"Alexander, Antonín (1892-působnost do 1948)",,0.0,[],[]
pozitiv,Průhled Havelskou ulicí od Uhelného trhu s domy čp. 512 a 526 na Starém Městě.,,63x,A0C51327B67611DF820F00166F1163D4,II 102,,,14.42033,50.08441,regional.address,geocode,"Jelínková, Jana (1951-)",,,[],[]
negativ,Pohled na Červenou Řečici - město se zámkem a s kostelem sv. Maří Magdalény.,[1863-1905],9x,820613C1945F11E1A7806C626D41E503,XII 544,,,14.39921,50.10113,regional.address,suggest,"Eckert, Jindřich (1833-1905)",Datace neznámá. Za účelem vyhledávání byla nastavena na časový rozsah celé sbírky.,0.0,[],[]
pozitiv,Pohled na pomník Josefa V. Stalina na Letné.,kol.1960,131x,A0C51A12B67611DF820F00166F1163D4,II 211,1960-01-01,1960-12-31,14.44878,50.10034,poi,suggest,,,,[],[]
negativ,"Pohled na usedlost Cibulka (dům čp. 118) v Košířích, záběr na plastiku Číňanky od Václava Prachnera, umístěnou na terase před hlavním vchodem.",1974,52x,A1186A2EB67611DF820F00166F1163D4,VII 571,1974-01-01,1974-12-31,14.35655,50.06696,regional.address,geocode,"Chalupníček, Miroslav -, Chalupníčková, Věra (dokument 1941-1948)",,,[],[]
kresba,Portál domu čp. 345 na Starém Městě v ulici Na Perštýně s domovním znamením.,,21x,A14CE9EEB67611DF820F00166F1163D4,VI 14/19,,,14.41871,50.08298,regional.address,geocode,,,,[],[]
pozitiv,Panoramatický pohled do Prokopského údolí ze stanoviště u kostela sv. Prokopa k západu. Vpravo je vidět železné oplocení kostela. Čtvrtá část čtyřdílného panoramatu.,14.4.1926,8x,270cb4cc072e408c8b6cd33565d760f6,A 2425,1926-04-14,1926-04-14,14.38926,50.04413,regional.address,geocode,"Alexander, Antonín (1892-působnost do 1948)","On-line výstava na webu AMP ""Pražské panorama 2. část - Prokopské a Dalejské údolí"".
                    
                
                    
                  Součást panoramatu A 2422, A 2423, A 2424, A 2425.
                    
                
                    
                  List 20a bod 16
                    
                
                    
                  Plány sign. AMP XXXII.",0.0,[],[]
pozitiv,Pohled na portál s mříží v areálu Trojského zámku.,1907,38x,A14CE9D6B67611DF820F00166F1163D4,VI 14/14 g,1907-01-01,1907-12-31,14.4124,50.11648,regional.address,geocode,,,,[],[]
pozitiv,Dům čp. 291 na Novém Městě na Karlově náměstí - schodiště.,kol.1930,19x,A118753FB67611DF820F00166F1163D4,IV 40/23,1930-01-01,1930-12-31,14.43664,50.03892,regional.address,geocode,,,,[],[]
negativ,Pohled na část průčelí domu čp. 643 s portálem do Štěpánské ulice na Novém Městě.,kol.1910,39x,8134D446696711E291C26C626D41E503,XII 1352,1910-01-01,1910-12-31,14.42534,50.07914,regional.address,geocode,Eckert-ateliér,,0.0,[],[]
CD-ROM,Pohled na zaplavený Trojský zámek se zahradou z vinice u sv. Kláry při povodni 14.8.2002.,14.8.2002,28x,A1188A94B67611DF820F00166F1163D4,XXII 4/29,2002-08-14,2002-08-14,14.41109,50.11489,regional.address,geocode,"Malec, Milan - Malcová, Alena",,0.0,[],[]
negativ,Pohled na komplex budov Pražské strojírny akc. spol. (dříve Ruston a spol.) dům čp. 145 ve Švábkách v Libni - uliční průčelí.,24.3.1912,69x,A5E5D09CE80411E89B6974D435EEBE90,XI 2200,1912-03-24,1912-03-24,14.47713,50.10299,regional.address,geocode,"Kříženecký, Jan (1868-1921)",,0.0,[],[]
negativ,Pohled do Královské obory (Stromovky) v Bubenči - terén před stavbou kanalizace.,kol.1900,50x,8D10165B85B011E2BF1F525400E46D25,VIII 1321,1900-01-01,1900-12-31,14.40204,50.11,regional.address,geocode,"Eckert, Jindřich (1833-1905)",,,[],[]
pozitiv,Pohled z Masné ulice do Štupartské ulice s domem čp. 977 (vlevo) a 633 (vpravo) na Starém Městě. V pozadí věže kostela sv. Jakuba.,24.7.1941,46x,A1186CBAB67611DF820F00166F1163D4,I 9173,1941-07-24,1941-07-24,14.42413,50.08877,regional.address,geocode,"Alexander, Antonín (1892-působnost do 1948)",,,[],[]
pozitiv,Pohled na část Karlova mostu. V pozadí část Pražského hradu a Belveder (Letohrádek královny Anny) - dům čp. 52 na Hradčanech - pravá část pohledu.,1890,37x,63FBAC2ADB5E11DFBD5E000C766D2371,VI 39/8 b,1890-01-01,1890-12-31,14.40526,50.09394,regional.address,geocode,"Eckert, Jindřich (1833-1905)",,,[],[]
negativ,Pohled na Mosteckou věž na Malé Straně. Vlevo dům čp. 56.,19.5.1906,34x,8DE2EE0EA86811E3A595406186009F3A,XI 127,1906-05-19,1906-05-19,14.40702,50.08714,regional.address,geocode,"Kříženecký, Jan (1868-1921)",,0.0,[],[]
pozitiv,Pohled do dvora domu čp. 892 na Starém Městě.,1914,19x,FDCF85133E9E11E1B434000BCDD04BFA,V 2/34,1914-01-01,1914-12-31,14.59207,50.03423,regional.address,geocode,"Kříženecký, Jan (1868-1921)",,,[],[]
pozitiv,Pohled na portál a část průčelí domu čp. 1 do Sněmovní ulice na Malé Straně.,kol.1920,24x,0BB9AAD6D50E11E3AADC406186009F3A,II 1596,1920-01-01,1920-12-31,14.40349,50.08881,regional.address,geocode,"Vojta, Tomáš (1885-1934)",,,[],[]
pozitiv,"Pohled na svah Letné od Rudolfina - vlevo v pozadí Hanavský pavilon (dům čp. 175 v Holešovicích). V popředí vlevo Vojenská plovárna, vpravo Občanská plovárna a Čechův most.",2.7.1914,79x,A1186E68B67611DF820F00166F1163D4,II 1060,1914-07-02,1914-07-02,14.41491,50.0931,regional.address,geocode,"Kříženecký, Jan (1868-1921)",,,[],[]
pozitiv,Pohled na nástropní fresku v kostele sv. Mikuláše na Malé Straně.,8.11.1904,18x,A11877CBB67611DF820F00166F1163D4,VI 31/7 o,1904-11-08,1904-11-08,14.4032,50.08835,regional.address,geocode,"Eckert, Jindřich (1833-1905)",,,[],[]
negativ,Tympanon severního portálu kostela P. Marie před Týnem na Starém Městě.,18.6.1906,17x,BBC4F4D5A93411E3839F0024BE7CD9AC,XI 145,1906-06-18,1906-06-18,14.42396,50.08884,regional.address,geocode,"Kříženecký, Jan (1868-1921)",,0.0,[],[]
pozitiv,Panoramatický pohled na pláň v Bohnicích s ústavním hřbitovem. První část dvoudílného panoramatu.,20.9.1923,118x,26E7A846DC9411E6B80F406186009F3A,A 261,1923-09-20,1923-09-20,14.4036,50.13858,poi,suggest,"Alexander, Antonín (1892-působnost do 1948)",,0.0,[],[]
pozitiv,Pohled ze střechy Rudolfina přes Vltavu s Železnou lávkou na Malou Stranu (Klárov a Strakovo nábřeží). V pozadí Pražský hrad.,,124x,A14CE21AB67611DF820F00166F1163D4,II 162,,,14.41521,50.09017,regional.address,geocode,"Eckert, Jindřich (1833-1905), Müllern, Julius (1831-1904)","Eckert, Jindřich - Müllern, Julius - Jelínková, Jana (repro)",,[],[]
pozitiv,Pohled do ulice Na Zlatnici v Podolí.,1.11.1930,84x,A14CE183B67611DF820F00166F1163D4,I 296,1930-11-01,1930-11-01,14.42436,50.05789,regional.address,geocode,"Alexander, Antonín (1892-působnost do 1948)",,,[],[]
negativ,Pohled na náměstí Míru na Vinohradech s tramvají (16) před Národním domem (dům čp. 820).,1897,96x,3591876D9F5011E18C606C626D41E503,XII 844,1897-01-01,1897-12-31,14.42804,50.08142,regional.address,geocode,"Eckert, Jindřich (1833-1905)",,0.0,[],[]
CD-ROM,Pohled na zaplavený Trojský zámek se zahradou z vinice u sv. Kláry při povodni 13.8.2002 dopoledne.,13.8.2002,28x,A0C50BFDB67611DF820F00166F1163D4,XXII 3/3 a,2002-08-13,2002-08-13,14.41288,50.11642,poi,suggest,"Malec, Milan - Malcová, Alena",,0.0,[],[]
pozitiv,Pohled na Gröbeho vilu (dům čp. 58 na Vinohradech) nad vinicí - jižní průčelí.,,47x,A14CE55FB67611DF820F00166F1163D4,I 1873,,,14.44502,50.06921,regional.address,geocode,,,,[],[]
pozitiv,Pohled do ulice Pod Altánem ve Strašnicích.,1974,85x,A11879B6B67611DF820F00166F1163D4,I 336,1974-01-01,1974-12-31,14.48923,50.06947,regional.address,geocode,"Krofta, J. S.",,,[],[]
pozitiv,Pohled na kostel sv. Petra a Pavla na bývalé návsi ve starých Bohnicích (dnes Bohnická ulice). V pozadí dům čp. 13.,15.6.1959,74x,242D64BA212311E8925674D435EEBE90,I 12281,1959-06-15,1959-06-15,14.41592,50.13467,regional.address,suggest,"Hnilička, Eduard (1887-1967)",,,[],[]
pozitiv,Pohled na sanatorium v Podolí (dům čp. 157).,9.10.1931,92x,DA6EA60B272911E287E86C626D41E503,I 9649,1931-10-09,1931-10-09,14.41925,50.06214,regional.address,geocode,"Alexander, Antonín (1892-působnost do 1948)",,,[],[]
negativ,Celkový pohled na dům čp. 441 (Zemská porodnice) v Apolinářské ulici na Novém Městě.,kol.1890,66x,36B5D074171F11E0BDBB000C766D2371,XII 98,1890-01-01,1890-12-31,14.42657,50.07139,regional.address,geocode,"Eckert, Jindřich (1833-1905)",,0.0,[],[]
pozitiv,Pohled na románský reliéf v Juditině věži (menší Malostranská mostní věž).,kol.1900,33x,A11866D0B67611DF820F00166F1163D4,VI 34/17 a,1900-01-01,1900-12-31,14.40702,50.08714,regional.address,geocode,,,,[],[]
negativ,Detailní pohled na hlavici sloupu chrámu sv. Víta na Pražském hradě.,[1863-1945],25x,AF565C09070A11E286836C626D41E503,XII 645,,,14.4006,50.09089,poi,suggest,Eckert,Datace neznámá. Za účelem vyhledávání byla nastavena na časový rozsah celé sbírky.,0.0,[],[]
negativ,Pohled do interiéru kostela P. Marie Vítězné - varhany.,15.12.1902,32x,7535E04F07E711E28BD16C626D41E503,XII 898,1902-12-15,1902-12-15,14.4039,50.08553,regional.address,geocode,"Eckert, Jindřich (1833-1905)",,0.0,[],[]
negativ,"""Tycho Brahe v Praze"" - 2. dodatečné vydání. T.XXIV. Interiér kostela P. Marie před Týnem s náhrobkem a deskou Tycho de Brahe.",1901,14x,A1186DFFB67611DF820F00166F1163D4,VIII 735,1901-01-01,1901-12-31,14.41994,50.08663,regional.address,geocode,"Eckert, Jindřich (1833-1905)",,,[],[]
pozitiv,Pohled na Tylovo náměstí v době trhu na Vinohradech.,kol.1915,59x,FDCF85853E9E11E1B434000BCDD04BFA,II 1541,1915-01-01,1915-12-31,14.43174,50.07523,regional.address,geocode,,,,[],[]
pozitiv,Pohled do interiéru domu čp. 406 na Starém Městě (Staroměstská tržnice) v Rytířské ulici - strojovna.,16.12.1910,39x,A0C4F558B67611DF820F00166F1163D4,II 90,1910-12-16,1910-12-16,14.42159,50.08432,regional.address,geocode,"Kříženecký, Jan (1868-1921)",,,[],[]
pozitiv,Pohled na část domu čp. 635 (klášter sv. Jakuba) s portálem na Starém Městě.,8.5.1907,12x,A14CDF9DB67611DF820F00166F1163D4,VI 2/34,1907-05-08,1907-05-08,14.4257,50.08834,regional.address,geocode,,,,[],[]
negativ,Celkový pohled na dům čp. 592 v ulici Českomalínská v Bubenči.,po 1923,42x,9507A5545BEC11E79925406186009F3A,X 7491,1924-01-01,2000-12-31,14.40447,50.10336,regional.address,geocode,"Vojta, Tomáš (1885-1934)",,,[],[]
pozitiv,Pohled na dům čp. 865 a další domovní zástavbu v Dušní ulici na Starém Městě.,1911,47x,6B80C3919A7811E4A736406186009F3A,V 2/17,1911-01-01,1911-12-31,14.42051,50.09126,regional.address,geocode,"Kříženecký, Jan (1868-1921)",,,[],[]
negativ,Celkový pohled na hlavní průčelí domu čp. 283 v Karlíně (divadlo) v Palackého ulici (dnes Křižíkova). V pozadí vlevo část viaduktu.,kol.1900,59x,03AF0B9B310C11E9978874D435EEBE90,IX 327 a,1900-01-01,1900-12-31,14.44123,50.09021,regional.address,geocode,Bellmann-ateliér,,,[],[]
pozitiv,"Pohled na dům čp. 523 na Novém Městě (kasárna, Röschovo kluziště) v místech Svinské brány, zazděné 1694 (název Slepá brána).",kol.1890,27x,A14CE855B67611DF820F00166F1163D4,VI 6/27 b,1890-01-01,1890-12-31,14.42374,50.07512,regional.address,geocode,"Eckert, Jindřich (1833-1905)",,,[],[]
negativ,Pohled na starožitné hodiny z roku 1738 uchovávané v Muzeu hl. m. Prahy (čp. 1554 na Novém Městě). Původní umístění na stavebním úřadě.,září 1905,41x,6331E5D89FB011E38B756C626D41E503,XI 72,1905-09-01,1905-09-30,14.43848,50.0901,regional.address,suggest,"Kříženecký, Jan (1868-1921)",,0.0,[],[]
pozitiv,Pohled na Albertov. V pozadí věž kostela Nanebevzetí P. Marie a sv. Karla Velikého na Karlově.,1.10.1906,40x,A14CE84FB67611DF820F00166F1163D4,VI 5/34,1906-10-01,1906-10-01,14.42449,50.06889,regional.address,geocode,Vilém,,,[],[]
pozitiv,"Pohled na část pobořeného Karlova mostu 4.9.1890 po povodni. V popředí naplavené dříví, v pozadí uprostřed Rudolfinum.",4.9.1890,115x,A14CE294B67611DF820F00166F1163D4,I 1818,1890-09-04,1890-09-04,14.41126,50.0865,poi,suggest,,,,[],[]
negativ,Pohled do interiéru Windischgrätzovského paláce (dům čp. 119 na Malé Straně) v Letenské ulici - pracovna hraběnky Windischgrätzové.,8.5.1908,20x,390DCC3C12D111E2A6B56C626D41E503,XII 1154,1908-05-08,1908-05-08,14.40926,50.08997,regional.address,geocode,Eckert-ateliér,,0.0,[],[]
pozitiv,Pohled na Bertramku (dům čp. 169 na Smíchově) z Mozartovy ulice.,28.4.1927,115x,A0C504A2B67611DF820F00166F1163D4,I 8700,1927-04-28,1927-04-28,14.36225,50.02109,regional.address,geocode,"Alexander, Antonín (1892-působnost do 1948)",,,[],[]
pozitiv,Celkový pohled na kapli sv. Bartoloměje v Hodkovičkách. V pozadí domy čp. 12 a 14 v Modřanské ulici.,1958,47x,9E779FBCD29311E6BE58406186009F3A,I 12153,1958-01-01,1958-12-31,14.40473,50.02294,regional.address,geocode,,,,[],[]
negativ,Pohled na sousoší Hlávkova mostu přes Štvanici (vpravo) - na levém břehu.,,34x,B9C7CB47A12811E2BF30525400E46D25,XI 6400,,,14.4369,50.09567,regional.street,suggest,Eckert-ateliér,Datace neznámá. Za účelem vyhledávání byla nastavena na časový rozsah celé sbírky.,0.0,[],[]
pozitiv,Pohled na budování městské kanalizace ve vltavském rameni mezi Primátorským ostrovem a Petrskou čtvrtí na Novém Městě. V pozadí Nové mlýny.,29.7.1910,44x,379E5F98644E11E6A554000C76270B94,I 11839,1910-07-29,1910-07-29,14.42854,50.09225,regional.address,geocode,,,,[],[]
pozitiv,Pražské povstání - květen 1945. Kostel P. Marie před Týnem v průhledu oknem zničeného křídla Staroměstské radnice po požáru 8.5.1945.,květen 1945,234x,A11873FBB67611DF820F00166F1163D4,I 5450,1945-05-01,1945-05-31,14.42009,50.087,regional.address,suggest,"Zeman, Josef",,,[],[]
pozitiv,Stavba přístavu v Libni - pohled na stavbu mostu přes Rokytku mezi Budečskou a Voctářovou ulicí. Vpravo Löwittův mlýn (dům čp. 40) v Libni v Budečské ulici (dnes ulice U Českých loděnic).,1894-1895,121x,157A73C16D6F11E88D0474D435EEBE90,V 18/13 p,1894-01-01,1895-12-31,14.46917,50.10746,regional.address,geocode,,,0.0,[],[]
negativ,Pohled na stavbu kanalizace - vyústění Botiče v Podskalí u Rašínova nábřeží pod mostem.,29.8.1904,97x,354F07538D6311E2BF25525400E46D25,VIII 1436,1904-08-29,1904-08-29,14.41451,50.07097,regional.address,geocode,"Eckert, Jindřich (1833-1905)",,,[],[]
pozitiv,Pohled na hlavní průčelí Městské knihovny (dům čp. 98) na Starém Městě.,1928,26x,BA166876C28611E4A492406186009F3A,V 4/21,1928-01-01,1928-12-31,14.41739,50.08739,regional.address,geocode,Štenc-ateliér,,,[],[]
pozitiv,Celkový pohled na dům čp. 154 (usedlost Klamovka) na Smíchově v Podbělohorské ulici.,1959 březen,54x,A14CE64AB67611DF820F00166F1163D4,I 8939,1959-03-01,1959-03-31,14.37932,50.07154,regional.address,geocode,"Hnilička, Eduard (1887-1967)",,,[],[]
negativ,Pohled na severní stranu restaurace na Štvanici (čp. 859 v Holešovicích) krátce před zbořením.,18.9.1909,41x,2D1D2C176ACA11E295C66C626D41E503,VIII 1171,1909-09-18,1909-09-18,14.44021,50.09583,regional.address,geocode,Eckert-ateliér,,,[],[]
pozitiv,Pohled do zahrady Schönbornského paláce - dům čp. 365 na Malé Straně - z výšky. V pozadí Hradčany.,,33x,A0C503DFB67611DF820F00166F1163D4,I 8536,,,14.40131,50.08733,regional.address,geocode,"Vojta, Tomáš (1885-1934)",,,[],[]
negativ,Pohled na hrad Orlík - západní strana.,[1863-1945],15x,A7872A6792DD11E193C36C626D41E503,XII 534,,,14.35842,50.08295,poi,suggest,Eckert-ateliér,Datace neznámá. Za účelem vyhledávání byla nastavena na časový rozsah celé sbírky.,0.0,[],[]
pozitiv,Pohled na Alšovo nábřeží s domem čp. 80 (Uměleckoprůmyslová škola) na Starém Městě.,23.3.1936,26x,FA463849E1A911E899FA74D435EEBE90,A 10146,1936-03-23,1936-03-23,14.41492,50.08868,regional.address,geocode,"Alexander, Antonín (1892-působnost do 1948)",,0.0,[],[]
pozitiv,Pohled na náměstí Míru na Vinohradech. Uprostřed kostel sv. Ludmily. V popředí oplocená zahrada.,kol.1900,87x,A14CE9D8B67611DF820F00166F1163D4,VI 14/17,1900-01-01,1900-12-31,14.43794,50.07563,regional.address,geocode,,,,[],[]
negativ,Obecní zásobárna za 1. světové války ve Vyšší dívčí škole (dům čp. 683) ve Vodičkově ulici na Novém Městě.,1915,13x,BC0B1DA123C511E4BF24406186009F3A,XI 3689,1915-01-01,1915-12-31,14.48961,50.09956,regional.address,geocode,"Kříženecký, Jan (1868-1921)",,0.0,[],[]
negativ,Pohled do interiéru Lobkovického paláce čp. 347 (Černínský-Přehořovský palác) na Malé Straně.,kol.1900,22x,A0C4F65BB67611DF820F00166F1163D4,VIII 959,1900-01-01,1900-12-31,14.39803,50.08729,regional.address,geocode,"Eckert, Jindřich (1833-1905)",,,[],[]
pozitiv,"Pohled (zleva) na domy čp. 15, čp. 16 (Andělská kolej) a čp. 28 na Starém Městě v Mikulášské ulici (dnes náměstí Franze Kafky).",1908,51x,A0C50811B67611DF820F00166F1163D4,II 503,1908-01-01,1908-12-31,14.60193,50.02833,regional.address,geocode,"Kříženecký, Jan (1868-1921)",Autorství J. Kříženeckého není jisté.,,[],[]
pozitiv,Celkový pohled na dům čp. 490 (palác Metychů z Čečova - Hrzánský) na Velkopřevorském náměstí na Malé Straně od Čertovky.,19.8.1907,37x,D00491B904FA11E3A4F66C626D41E503,I 9745,1907-08-19,1907-08-19,14.40739,50.08615,regional.address,geocode,"Klíma, Alois, Ing. (1873-1955)",,,[],[]
pozitiv,Celkový pohled na domek u ústí Rudolfovy štoly v Královské oboře (Stromovce).,1914,71x,A0C50151B67611DF820F00166F1163D4,I 4415,1914-01-01,1914-12-31,14.4196,50.10432,poi,suggest,"Fink, František (1854-1935)",,,[],[]
negativ,Pohled na dům čp. 29 na Vinohradech (usedlost Na Cikánce) a na zeď kolem Kanálské zahrady. V pozadí nové domy na Žižkově.,kol.1885,88x,A1188470B67611DF820F00166F1163D4,X 2022,1885-01-01,1885-12-31,14.44769,50.07723,regional.address,suggest,,,,[],[]
negativ,"Pohled na starou věž na střeše domu čp. 459 (Richterův dům) na Malém náměstí na Starém Městě, kde byla telefonní centrála do roku 1902.",,35x,A1187C5CB67611DF820F00166F1163D4,VIII 81,,,14.41979,50.08642,regional.address,geocode,,Eckert-ateliér (repro),,[],[]
pozitiv,Celkový pohled vodárnu na Vinohradech (vodárenská přečerpací stanice) - dům čp. 725 v Korunní ulici.,,22x,C1DAB06464A011E2BF12525400E46D25,VI 80/4,,,14.4491,50.07525,regional.address,geocode,,,,[],[]
pozitiv,Panoramatický pohled na Hlubočepy a okolí.,19.9.1925,48x,331E1B4CF71411DFBD86000C766D2371,I 9633,1925-09-19,1925-09-19,14.40355,50.04138,regional.address,geocode,"Alexander, Antonín (1892-působnost do 1948)",,,[],[]
pozitiv,Pohled do interiéru domu čp. 851 v Holešovicích (Opatrovna U Studánky) - děti při spaní.,19.6.1907,39x,A0C51777B67611DF820F00166F1163D4,V 62/3 c,1907-06-19,1907-06-19,14.42861,50.10242,regional.address,geocode,"Kříženecký, Jan (1868-1921)",,,[],[]
pozitiv,"Panoramatický pohled na Prahu z Petřína (ze čtyř volných částí). 
                    
                
                    
                  2. část: v popředí Malá Strana, za Vltavou s Karlovým Mostem a s Železnou lávkou je Staré Město - vpravo kostel P. Marie před Týnem.",1876,53x,383D92499C3C11E2B0DE6C626D41E503,VI 37/30 b,1876-01-01,1876-12-31,14.41126,50.0865,poi,suggest,"Fridrich, František (1829-1892)",,,[],[]
negativ,Stavba pomníku Palackého.,17.6.1911,9x,da738799e63e40599e7cf010f618e3c1,XI 1851,1911-06-17,1911-06-17,14.41536,50.07303,regional.address,geocode,"Kříženecký, Jan (1868-1921)",,0.0,[],[]
pozitiv,Pohled na staré řečiště Vltavy s rybáři z provizorního dřevěného mostu (Libeňského) směrem po proudu řeky.,12.8.1923,102x,AB617583A74F11E6BBBD406186009F3A,A 160,1923-08-12,1923-08-12,14.45594,50.10334,regional.street,suggest,"Alexander, Antonín (1892-působnost do 1948)",,0.0,[],[]
negativ,"Pohled na sochu ""Industria"" od Čeňka Vosmíka.",17.4.1908,21x,76542536121411E28E4C6C626D41E503,XII 1100,1908-04-17,1908-04-17,14.42582,50.09301,regional.address,suggest,Eckert-ateliér,,0.0,[],[]
pozitiv,"Práce na výstavbě podpovrchových tras. První úder kladiva - dělník Josef Bartoš za asistence oficiálních zástupců otevírá vozovku pro přeložení vodovodní trasy, aby na jejím místě vedla trať C podpovrchové dráhy v Opletalově ulici.",7.1.1966,72x,A1186954B67611DF820F00166F1163D4,I 8175,1966-01-07,1966-01-07,14.43508,50.08705,regional.address,geocode,"Mikšátko, Václav",,,[],[]
pozitiv,"Pohled do ulice V lázních s lázeňskými domy (zleva) čp. 42, 44, 45, 43.",25.3.1942,35x,A0C51B05B67611DF820F00166F1163D4,I 1549,1942-03-25,1942-03-25,14.39178,50.02443,regional.address,geocode,"Alexander, Antonín (1892-působnost do 1948)",,,[],[]
negativ,Pohled do interiéru kadetní školy čp. 221 na Hradčanech na Mariánské baště - pamětní deska.,po 1900,31x,44A58BFF8B0411E2BF22525400E46D25,VIII 1378,1901-01-01,2000-12-31,14.40328,50.09504,regional.address,geocode,"Eckert, Jindřich (1833-1905)",,,[],[]
pozitiv,Pohled na kapli Nejsvětější Trojice na křižovatce ulic Švédské a U Nesypky. V pozadí dům čp. 108 na Smíchově.,,86x,A0C4FEF9B67611DF820F00166F1163D4,I 1626,,,14.39158,50.07516,regional.address,geocode,,,,[],[]
pozitiv,"Pohled na část průčelí domu čp. 605 na Starém Městě (""U Kamenného zvonu"") s portálem a s domovním znamením.",28.6.1906,40x,A0C5196CB67611DF820F00166F1163D4,VI 17/1,1906-06-28,1906-06-28,14.42218,50.08782,regional.address,geocode,,,,[],[]
negativ,Reprodukce skicy nástěnné malby (č. 10) v interiéru Černínského paláce (dům čp. 101 na Hradčanech).,1891,28x,A1187D07B67611DF820F00166F1163D4,VIII 800,1891-01-01,1891-12-31,14.39071,50.08877,regional.address,geocode,"Eckert, Jindřich (1833-1905)",,,[],[]
negativ,Pohled na nástěnnou malbu (Hradčanské náměstí) v domě čp. 240 (Bretfeldovský palác) v Nerudově ulici na Malé Straně.,kol.1900,53x,5A6B8C710ADE11E1BEC2000C766D2371,XII 399,1900-01-01,1900-12-31,14.39828,50.08841,regional.address,geocode,"Eckert, Jindřich (1833-1905)",,0.0,[],[]
pozitiv,Pohled do Havelské ulice s kostelem sv. Havla a domem čp. 536-537 - židovský tandlmark na Starém Městě.,kol.1890,45x,A1188337B67611DF820F00166F1163D4,VI 2/16 b,1890-01-01,1890-12-31,14.42189,50.08506,regional.address,geocode,,,,[],[]
pozitiv,Celkový pohled na budovu Ústřední knihovny hlavního města Prahy (dům čp. 98 na Starém Městě) na Mariánském náměstí.,,11x,8708beafe9794523913d3c2a8b257427,I 12990,,,14.41739,50.08739,regional.address,geocode,,,,[],[]
negativ,Pohled na pavilony na výstavišti v Bubenči při Jubilejní výstavě 1891.,1891,65x,A7BF8F276A2B11E2BF13525400E46D25,VIII 1162,1891-01-01,1891-12-31,14.43056,50.10462,regional.address,geocode,"Eckert, Jindřich (1833-1905)",,,[],[]
pozitiv,Pohled na starou Újezdskou bránu na Malé Straně - severní strana (od Malé Strany) před zbořením roku 1862. Vpravo část domu čp. 414 na Malé Straně.,1862,55x,A14CEAB4B67611DF820F00166F1163D4,VI 62/8 b,1862-01-01,1862-12-31,14.40442,50.08054,regional.address,geocode,"Rupp, Wilhelm (1821-1893)",,,[],[]
pozitiv,Pohled na osvětlenou Staroměstskou mosteckou věž při příležitosti 10. výročí samostatnosti Československé republiky. Vlevo klášter Křižovníků (dům čp. 191 na Starém Městě).,28.10.1928,46x,3C9DEC0117D511E891E8406186009F3A,I 12051,1928-10-28,1928-10-28,14.41406,50.08641,regional.address,geocode,"Vopravil, Josef (1902-1972)",,,[],[]
pozitiv,Okupace 1939 - příjezd okupantů do Prahy 15. března 1939 - na Můstku.,15.3.1939,42x,A0C4F846B67611DF820F00166F1163D4,II 214,1939-03-15,1939-03-15,14.42269,50.08469,regional.address,geocode,"Dub, Václav (dokumenty 1928-1983)",,,[],[]
pozitiv,Pohled na rybníček v zahradě usedlosti Cibulka v Košířích (dům čp. 118).,říjen 1924,53x,A1187EC0B67611DF820F00166F1163D4,I 4612,1924-10-01,1924-10-31,14.35655,50.06696,regional.address,geocode,"Vojta, Tomáš (1885-1934)",,,[],[]
pozitiv,Pohled na část průčelí Pražského hradu na třetím hradním nádvoří - vchod do Vladislavského sálu s kašnou.,24.8.1906,15x,A11882ACB67611DF820F00166F1163D4,VI 10/6,1906-08-24,1906-08-24,14.39995,50.09041,regional.address,geocode,,,,[],[]
negativ,Pohled na výzdobu stropu kostela sv. Mikuláše na Malé Straně.,6.10.1907,13x,34E8CB84DB7011E3BB45406186009F3A,XI 418,1907-10-06,1907-10-06,14.4032,50.08835,regional.address,geocode,"Kříženecký, Jan (1868-1921)",,0.0,[],[]
pozitiv,Pohled na osazování klapačkových trámců sloužících pro regulaci průtoku vody vorovou propustí v levém rameni Vltavy u ostrova Štvanice u Holešovických břehů. V pozadí provizorní dřevěný most (Hlávkův).,27.10.1909,50x,E196E90E651811E6A555000C76270B94,I 11873,1909-10-27,1909-10-27,14.4369,50.09567,regional.street,suggest,,,,[],[]
pozitiv,Portrét obecního staršího Bedřicha Thuma.,1892,43x,A0C4F9FBB67611DF820F00166F1163D4,IV 75/50,1892-01-01,1892-12-31,14.40338,50.07215,regional.address,geocode,"Eckert, Jindřich (1833-1905)",Album pro starostu Jindřicha Šolce s portréty obecních starších v upomínku na den 7. 11. 1892.,0.0,[],[]
pozitiv,Pohled do ulice Řásnovka na Starém Městě.,30.3.1940,33x,A0C518EDB67611DF820F00166F1163D4,I 861,1940-03-30,1940-03-30,14.4254,50.09225,regional.address,geocode,"Alexander, Antonín (1892-působnost do 1948)",,,[],[]
pozitiv,Pohled do interiéru kaple Početí P. Marie (dům čp. 1000) ve Strašnicích.,14.9.1942,54x,7E6CAF7AF53811E7AFAF74D435EEBE90,A 14619,1942-09-14,1942-09-14,14.49468,50.0687,regional.address,geocode,"Alexander, Antonín (1892-působnost do 1948)",,0.0,[],[]
pozitiv,Pohled na hřbitov v Záběhlicích.,30.6.1929,58x,9C82F4FB581B11E88F1F74D435EEBE90,A 5116,1929-06-30,1929-06-30,14.4968,50.05474,regional.address,geocode,"Alexander, Antonín (1892-působnost do 1948)",,0.0,[],[]
pozitiv,Pohled na dům čp. 892 během asanace. Vlevo kostel sv. Ducha.,kol.1910,25x,FDCF852D3E9E11E1B434000BCDD04BFA,V 79/38,1910-01-01,1910-12-31,14.59207,50.03423,regional.address,geocode,,,,[],[]
pozitiv,Tribuna na Václavském náměstí 5. - 9. května 1946 při volbách.,květen 1946,35x,043D8666ED4F11E3B9F6406186009F3A,I 11003,1946-05-01,1946-05-31,14.42403,50.08418,regional.address,geocode,,,,[],[]
pozitiv,Pohled do interiéru kostela sv. Mikuláše na Staroměstském náměstí.,,35x,A0C4FC19B67611DF820F00166F1163D4,I 8393,,,14.4199,50.08778,regional.address,geocode,"Vojta, Tomáš (1885-1934)",,,[],[]
pozitiv,"Pohled do velkého sálu knihovny Klementina (dům čp. 190, 1040) na Starém Městě.",15.12.1902,36x,A14CDA72B67611DF820F00166F1163D4,VI 4/3 a,1902-12-15,1902-12-15,14.41659,50.08616,poi,suggest,"Eckert, Jindřich (1833-1905)",,,[],[]
negativ,Pohled na shromážděný dav při vyhlášení Československé republiky při první schůzi Národního shromáždění před domem čp. 176 (sněmovna) ve Sněmovní ulici na Malé Straně.,14.11.1918,37x,F37C2465335411E8B010406186009F3A,IX 2727,1918-11-14,1918-11-14,14.40395,50.08915,regional.address,geocode,"Reach, Zikmund (1859-1935)",,,[],[]
negativ,Pohled na nástropní fresku v kostele sv. Mikuláše na Malé Straně.,8.11.1904,17x,6594505C182111E0BDBC000C766D2371,XII 117,1904-11-08,1904-11-08,14.4032,50.08835,regional.address,geocode,"Eckert, Jindřich (1833-1905)",,0.0,[],[]
negativ,"Pohled na novoměstský břeh u Šítkovských mlýnů. Vlevo v pozadí nové domy čp. 241 a 242 a domy staré zástavby čp. 243, 244, 245, 246 na Novém Městě.",kol.1900,26x,A1187618B67611DF820F00166F1163D4,VIII 1041,1900-01-01,1900-12-31,14.41486,50.07831,regional.address,geocode,"Eckert, Jindřich (1833-1905)",,,[],[]
pozitiv,"Celkový pohled ""Faustův dům"" (dům čp. 502 na Novém Městě) na Karlově náměstí na Novém Městě.",,57x,881460B7E44111E4BE0074D435EEBE90,I 11188,,,14.419,50.07337,regional.address,geocode,,,,[],[]
pozitiv,"Panoramatický pohled na Záběhlice. V pozadí vlevo kostel Narození P. Marie, vpravo v dáli Spořilov. Druhá část pětidílného panoramatu od východu, přes jih (Spořilov) k západu (Bohdalec).",30.6.1929,140x,7B943B1426D311E4B68A406186009F3A,I 11017,1929-06-30,1929-06-30,14.48747,50.05283,poi,suggest,"Alexander, Antonín (1892-působnost do 1948)",,,[],[]
negativ,Pohled do tunelu kanalizace na Vyšehradě při stavbě.,21.11.1906,40x,8DF0BA5C8D6511E2BF25525400E46D25,VIII 1438,1906-11-21,1906-11-21,14.41617,50.06351,poi,suggest,Eckert-ateliér,,,[],[]
pozitiv,"Pohled na portál domu čp. 73 (""Císařský špitál"") v Kanovnické ulici na Hradčanech.",16.7.1907,21x,A0C4FED3B67611DF820F00166F1163D4,VI 24/15,1907-07-16,1907-07-16,14.39337,50.09061,regional.address,geocode,,,,[],[]
pozitiv,Pohled do ulice Zeyerova alej v Břevnově na Petřinách.,1975,52x,193447A5BAA311E5A77074D435EEBE90,I 11409,1975-01-01,1975-12-31,14.34502,50.08426,regional.address,geocode,"Jelínková, Jana (1951-)",,,[],[]
negativ,Pohled na budovu lázní na Slovanském ostrově (Žofín).,kol.1890,19x,96259D629E9411E1AB206C626D41E503,XII 801,1890-01-01,1890-12-31,14.41283,50.07924,regional.address,geocode,"Eckert, Jindřich (1833-1905)",,0.0,[],[]
pozitiv,Pohled na stavbu špičky ostrova Štvanice.,24.9.1908,36x,4B846F725D5011E6A54F000C76270B94,I 11769,1908-09-24,1908-09-24,14.44021,50.09583,regional.address,geocode,,,,[],[]
negativ,"Průhled Maiselovou ulicí s domy čp. 73 (zleva), čp. 70, 277 (zprava) v Josefově.",kol.1895,28x,A11870EAB67611DF820F00166F1163D4,VIII 831,1895-01-01,1895-12-31,14.41826,50.08957,regional.address,geocode,"Eckert, Jindřich (1833-1905)",,,[],[]
pozitiv,Pohled do Vodičkovy ulice s domem čp. 699 na Novém Městě (pivovar U Štajgrů) uprostřed.,kol.1895,47x,A11885D7B67611DF820F00166F1163D4,VI 48/44,1895-01-01,1895-12-31,14.42428,50.08045,regional.address,geocode,,,,[],[]
pozitiv,Pohled do údolí Čimického potoka. Třetí část třídílného panoramatu.,21.9.1924,41x,CCA95D0444E611E99C4374D435EEBE90,A 1232,1924-09-21,1924-09-21,14.40403,50.1442,poi,suggest,"Alexander, Antonín (1892-působnost do 1948)",,0.0,[],[]
pozitiv,Pohled na dům čp. 28 (hospodářský dvůr Gröbovy vily) ve Vršovicích - pobořený náletem spojenců 15.2.1945.,30.4.1945,112x,A11879AAB67611DF820F00166F1163D4,I 4180,1945-04-30,1945-04-30,14.44899,50.06813,regional.address,geocode,"Alexander, Antonín (1892-působnost do 1948)",,,[],[]
pozitiv,"Pohled na část chrámového chrliče, nalezeného ve sklepě Týnské fary (dům čp. 601 na Starém Městě).",18.5.1934,31x,A11888E9B67611DF820F00166F1163D4,I 4756,1934-05-18,1934-05-18,14.42281,50.08741,regional.address,geocode,"Alexander, Antonín (1892-působnost do 1948)",,,[],[]
negativ,Pohled na práce při stavbě kanalizace u Občanské plovárny (u dnešního nábřeží Edvarda Beneše) - ukončení spodního vedení.,1899,38x,4A5DD60C803611E2BF1B525400E46D25,VIII 1210,1899-01-01,1899-12-31,14.41138,50.09203,regional.address,geocode,"Eckert, Eckert",,,[],[]
pozitiv,"Panoramatický pohled na Kobylisy a Troju od štěrkovny - jihovýchodně a jižně od Čimického háje přes vltavské údolí (od severovýchodu přes východ, jih k západu). Součást šestidílného panoramatu.",18.7.1926,76x,A1186F55B67611DF820F00166F1163D4,I 4871,1926-07-18,1926-07-18,14.43758,50.12891,poi,suggest,"Alexander, Antonín (1892-působnost do 1948)",,,[],[]
pozitiv,Pohled na hlavní průčelí Lorety (dům čp. 100 na Hradčanech) na Loretánském náměstí.,29.3.1907,19x,A1187FB9B67611DF820F00166F1163D4,VI 32/5,1907-03-29,1907-03-29,14.39151,50.08925,regional.address,geocode,"Klíma, Alois, Ing. (1873-1955)",,,[],[]
pozitiv,"Pohled na dnešní nábřeží Kpt. Jaroše ze Štvanice. Zprava domy čp. 421, čp. 423, čp. 422, čp. 436, čp. 437 a čp. 438 (pivovar) v Holešovicích. V pozadí kostel sv. Antonína v Holešovicích, vpravo část Hlávkova mostu.",28.2.1927,180x,2D1977A3E68411E89E7C74D435EEBE90,A 2933,1927-02-28,1927-02-28,14.43704,50.09958,regional.address,geocode,"Alexander, Antonín (1892-působnost do 1948)",,0.0,[],[]
negativ,Pohled na průčelí východního vchodu pavilonu obchodu na Jubilejní výstavě obvodu obchodní a živnostenské komory v Praze na výstavišti v Bubenči v roce 1908 pořádané k 60. výročí panování císaře Františka Josefa I.,1908,44x,BEA740C3928311E59FAB406186009F3A,X 155,1908-01-01,1908-12-31,14.43056,50.10462,regional.address,geocode,,,,[],[]
pozitiv,Celkový pohled na kostel Narození P. Marie v Kostelní ulici (dnes ulice K Prádelně) v Záběhlicích. Vlevo Botič.,16.6.1929,95x,60947E21584811E88F1F74D435EEBE90,A 5072,1929-06-16,1929-06-16,14.4878,50.05323,regional.address,geocode,"Alexander, Antonín (1892-působnost do 1948)",,0.0,[],[]
pozitiv,Pohled na portál domu čp. 452 v ulici Újezd na Malé Straně.,8.6.1906,17x,A1188743B67611DF820F00166F1163D4,VI 23/16,1906-06-08,1906-06-08,14.40456,50.08379,regional.address,geocode,,,,[],[]
negativ,Děti v útulku v Holešovicích.,1908,22x,18C742FC70C711E4A3ED0024BE7CD9AC,XI 647,1908-01-01,1908-12-31,14.45689,50.10287,regional.address,geocode,"Kříženecký, Jan (1868-1921)",,0.0,[],[]
pozitiv,Pohled z Kampy na závěr Karlova mostu.,12.10.1930,53x,A0C4F56AB67611DF820F00166F1163D4,I 8864,1930-10-12,1930-10-12,14.4089,50.08707,regional.address,geocode,"Alexander, Antonín (1892-působnost do 1948)",,,[],[]
negativ,Celkový pohled na Clam-Gallasovský palác (dům čp. 158 na Starém Městě) na nároží Mariánského náměstí a Husovy ulice.,2.4.1914,45x,6A9D4E73CD4A11E88B1374D435EEBE90,XI 3163,1914-04-02,1914-04-02,14.41779,50.08642,regional.address,suggest,"Kříženecký, Jan (1868-1921)",,0.0,[],[]
pozitiv,Pohled na pankráckou stranu Táborské brány (dnes dům čp. 35) na Vyšehradě.,12.7.1908,48x,A14CE7F5B67611DF820F00166F1163D4,VI 36/12 b,1908-07-12,1908-07-12,14.42411,50.06173,regional.address,geocode,,,,[],[]
negativ,Pohled na domy čp. 111 (sirotčinec arcivévodkyně Gisely) a 112 na Pohořelci na Hradčanech. Vlevo empírová kašna.,kol.1890,34x,A0C4F572B67611DF820F00166F1163D4,VIII 919,1890-01-01,1890-12-31,14.38996,50.08783,regional.address,geocode,"Eckert, Jindřich (1833-1905)",,,[],[]
negativ,Pohled do interiéru domu čp. 851 (opatrovna U Studánky) v Holešovicích - mateřská škola pro chlapce.,19.6.1907,40x,8A2E6352BB3611E3A31E0024BE7CD9AC,XI 360,1907-06-19,1907-06-19,14.42861,50.10242,regional.address,geocode,"Kříženecký, Jan (1868-1921)",,0.0,[],[]
negativ,Grotta v zahradě Valdštejnského paláce (dům čp. 17 na Malé Straně) - socha lva.,11.6.1911,27x,8318C7E4609F11E293B96C626D41E503,XII 1287,1911-06-11,1911-06-11,14.40535,50.09003,regional.address,geocode,Eckert-ateliér,,0.0,[],[]
pohlednice,Detail kubistického domu čp. 42 na Vyšehradě na Rašínově nábřeží.,,49x,A0C50D8BB67611DF820F00166F1163D4,I 4723,,,14.41579,50.06455,regional.address,geocode,"Dostál, Míťa",,,[],[]
negativ,"Celkový pohled na staroměstskou vodárnu (dům čp. 201 na Starém Městě) na Novotného lávce. Vlevo na domě čp. 200 deska s nápisem: ""Poutníče postůj na místě, kde zuřivost Švédů..."":",1890-1891,23x,A0C5053FB67611DF820F00166F1163D4,VIII 980,1890-01-01,1891-12-31,14.4133,50.08541,regional.address,geocode,"Eckert, Jindřich (1833-1905)",,,[],[]
pozitiv,"Celkový pohled na východní průčelí Staroměstské radnice (dům čp. 1 na Starém Městě). Pod balkonem vojenská strážnice, v popředí Krocínova kašna.",1856,34x,A14CE9F2B67611DF820F00166F1163D4,VI 42/7 e,1856-01-01,1856-12-31,14.42009,50.087,regional.address,suggest,"Groll, Andreas (1812-1872)",,,[],[]
pozitiv,Pohled do Pernerovy ulice v Karlíně (Žižkova).,kol.1910,126x,A1188B2BB67611DF820F00166F1163D4,I 1965,1910-01-01,1910-12-31,14.44894,50.08998,regional.address,geocode,,,,[],[]
pozitiv,Pohled na portál kostela sv. Mikuláše na Starém Městě.,1907,8x,A1187501B67611DF820F00166F1163D4,VI 29/40,1907-01-01,1907-12-31,14.4199,50.08778,regional.address,geocode,,,,[],[]
negativ,Pohled do interiéru kostela sv. Mikuláše na Malé Straně.,5.10.1907,16x,AAC93F9EDB6C11E3BB45406186009F3A,XI 412,1907-10-05,1907-10-05,14.4032,50.08835,regional.address,geocode,"Kříženecký, Jan (1868-1921)",,0.0,[],[]
negativ,Pohled na nový pomník Hany Kvapilové od Jana Štursy v Kinského zahradě po slavnostním odhalení.,10.4.1914,60x,4A1465F7946511E1A7806C626D41E503,XII 556,1914-04-10,1914-04-10,14.39913,50.07658,poi,suggest,Eckert-ateliér,,0.0,[],[]
pozitiv,Pohled na podstavec pomníku M. Jana Husa - stav prací na podzim 1913. V pozadí domy jižní strany Staroměstského náměstí.,podzim 1913,29x,A1188B31B67611DF820F00166F1163D4,I 8889,,,14.41994,50.08663,regional.address,geocode,,,,[],[]
CD-ROM,Druhá vlna povodně v Praze - Panorama Starého Města z Petřína - 13.8.2002 v 15:00.,13.8.2002,28x,A14CDDC1B67611DF820F00166F1163D4,XXII 6/18,2002-08-13,2002-08-13,14.4133,50.08541,regional.address,geocode,"Elleder, Libor, Ing. (působnost 2002)",,0.0,[],[]
negativ,Pohled na zámek u hlavních dveřích kostela sv. Mikuláše na Starém Městě.,říjen 1905,23x,110FDCC077B211E3B7C300110989F46F,XI 41,1905-10-01,1905-10-31,14.4199,50.08778,regional.address,geocode,"Kříženecký, Jan (1868-1921)",,0.0,[],[]
pozitiv,Pohled na severní svah vrchu Žižkova. Vpravo nahoře rozestavěný Národní památník na Vítkově.,23.3.1931,93x,A1186A12B67611DF820F00166F1163D4,I 1773,1931-03-23,1931-03-23,14.44949,50.08846,poi,suggest,"Alexander, Antonín (1892-působnost do 1948)",,,[],[]
pozitiv,Pohled na vstupní portál domu čp. 553 (Sixtův) v Celetné ulici na Starém Městě.,26.4.1908,41x,A1186A0AB67611DF820F00166F1163D4,VI 16/16,1908-04-26,1908-04-26,14.42273,50.08653,regional.address,geocode,,,,[],[]
negativ,Pohled na renesanční portál domu čp. 490 (palác Metychů z Čečova - Hrzánský) na Velkopřevorském náměstí na Malé Straně.,25.3.1908,26x,E75F8DA1604411E4A30B0024BE7CD9AC,XI 565,1908-03-25,1908-03-25,14.40739,50.08615,regional.address,geocode,"Kříženecký, Jan (1868-1921)",,0.0,[],[]
negativ,"Pohled z Kaprovy ulice do Úzké ulice s nárožními domy čp. 30 (vpravo), čp. 32 (vlevo) na Starém Městě.",kol.1895,28x,A0C51753B67611DF820F00166F1163D4,VIII 913,1895-01-01,1895-12-31,14.31325,50.08096,regional.address,geocode,"Eckert, Jindřich (1833-1905)",,,[],[]
negativ,Pohled ze dvora na hlavní bránu a vjezd do statku čp. 101 (Nové Dvory) v ulici U Nového dvora (dnes Durychova) ve Lhotce.,červen 1953,36x,46CC908629F111E9980E74D435EEBE90,X 10077,1953-06-01,1953-06-30,14.44983,50.01797,regional.address,geocode,,,,[],[]
negativ,Zvony z kostela sv. Jana na Skalce na Novém Městě sejmuté za 1. světové války k roztavení.,1914-1918,76x,52381E7FD37A11E8AE88406186009F3A,XI 3824,1914-01-01,1918-12-31,14.41719,50.07215,regional.address,geocode,,,0.0,[],[]
pozitiv,Pohled na podstavec pomníku M. Jana Husa - stav prací na podzim 1913. V pozadí část východního křídla Staroměstské radnice.,podzim 1913,23x,A0C4F67FB67611DF820F00166F1163D4,I 8892,,,14.41994,50.08663,regional.address,geocode,,,,[],[]
negativ,"Reprodukce grafického listu: V. Morstadt, Nádvoří Klementina s věží hvězdárny, 1814.",30.4.1947,31x,A0C50C5CB67611DF820F00166F1163D4,X 3562,1947-04-30,1947-04-30,14.41659,50.08616,poi,suggest,,,,[],[]
negativ,Pohled na Karlův most při opravě po povodni 4.9.1890 - dřevěná provizorní konstrukce v zimě.,1892,39x,A0C518D9B67611DF820F00166F1163D4,VIII 412,1892-01-01,1892-12-31,14.41126,50.0865,poi,suggest,"Eckert, Jindřich (1833-1905)",,,[],[]
negativ,Pohled do dvora domu čp. 791 na Novém Městě.,7.7.1913,12x,FDCF85393E9E11E1B434000BCDD04BFA,XI 2808,1913-07-07,1913-07-07,14.42553,50.08197,regional.address,geocode,"Kříženecký, Jan (1868-1921)",,0.0,[],[]
pozitiv,"Průhled ulicí Na Pěšinách s domy čp. 6 (vlevo), čp. 70 (vpravo) v Kobylisích.",1.6.1944,117x,A0C5082FB67611DF820F00166F1163D4,I 240,1944-06-01,1944-06-01,14.46107,50.12201,regional.address,geocode,"Alexander, Antonín (1892-působnost do 1948)",,,[],[]
pozitiv,Pohled na archeologické vykopávky na třetím nádvoří Pražského hradu - zbytky dřevěných chat.,23.5.1928,29x,3833CED6670411E7AB4174D435EEBE90,A 4205,1928-05-23,1928-05-23,14.39995,50.09041,regional.address,geocode,"Alexander, Antonín (1892-působnost do 1948)",,0.0,[],[]
negativ,Projekt úpravy Letné architekta Františka Velicha - průčelí podjezdu.,20.2.1908,41x,BC32C5C4F63711E3AB180024BE7CD9AC,XI 533,1908-02-20,1908-02-20,14.4171,50.093,regional.street,suggest,"Kříženecký, Jan (1868-1921)",,0.0,[],[]
pozitiv,Pohled na stavbu plavebních komor u ostrova Štvanice. V pozadí Negrelliho viadukt.,19.7.1910,67x,2137DF9B644C11E6A554000C76270B94,I 11837,1910-07-19,1910-07-19,14.44021,50.09583,regional.address,geocode,,,,[],[]
negativ,Pohled do dvora domu čp. 255 v Rabínské ulici (Maiselova) v Josefově před zbořením v roce 1907.,24.5.1906,71x,A1187597B67611DF820F00166F1163D4,VIII 468,1906-05-24,1906-05-24,14.41826,50.08957,regional.address,geocode,Eckert-ateliér,,,[],[]
pozitiv,Pohled do dvora starého mlýna (dům čp. 17) v Kyjích.,1968,52x,A1187616B67611DF820F00166F1163D4,I 4562,1968-01-01,1968-12-31,14.54079,50.09688,regional.address,geocode,"Vopravil, Josef (1902-1972)",,,[],[]
pozitiv,Pohled na rybník při ulici Na Pěšinách v Kobylisích.,1.6.1944,92x,E8EA4857365F11E7B9CE406186009F3A,A 15891,1944-06-01,1944-06-01,14.46248,50.12162,regional.address,geocode,"Alexander, Antonín (1892-působnost do 1948)",,0.0,[],[]
pozitiv,"Dům čp. 292 na Novém Městě (""Černý pivovar"") na Karlově náměstí - koryto pod průjezdem.",kol.1930,23x,A0C50D07B67611DF820F00166F1163D4,IV 40/19,1930-01-01,1930-12-31,14.41912,50.0768,regional.address,geocode,,,,[],[]
negativ,Altán (sala terrena) u Freundova mlýna (dům čp. 1224 na Novém Městě) - v zahradě domu čp. 1318.,19.7.1909,30x,A14CE3C5B67611DF820F00166F1163D4,VIII 47,1909-07-19,1909-07-19,14.433,50.09182,regional.address,geocode,Eckert-ateliér,,,[],[]
pozitiv,Pražské povstání - 8.5.1945. Barikáda ve Vinohradské ulici pod rozhlasem.,8.5.1945,57x,A0C50632B67611DF820F00166F1163D4,II 1249,1945-05-08,1945-05-08,14.4345,50.07859,regional.address,geocode,"Štěpánek, M.",,,[],[]
pozitiv,Pohled do zahrady domu čp. 154 (usedlost Klamovka) na Smíchově - skleník (dříve zahradní pavilon),1959 březen,58x,A0C4FC17B67611DF820F00166F1163D4,I 8938,1959-03-01,1959-03-31,14.37932,50.07154,regional.address,geocode,"Hnilička, Eduard (1887-1967)",,,[],[]
pozitiv,Pohled na portál kostela sv. Markéty na Břevnově.,13.8.1907,25x,A0C4F862B67611DF820F00166F1163D4,VI 33/8 a,1907-08-13,1907-08-13,14.35747,50.08511,regional.address,geocode,,,,[],[]
negativ,"Pohled na pivovar ""U Kornelů"" (dům čp. 32 na Novém Městě) na nároží Vladislavovy a Charvátovy ulice. Vlevo část domu čp. 42, vpravo čp. 56 na Novém Městě.",kol.1900,54x,A14CE3BFB67611DF820F00166F1163D4,VIII 241,1900-01-01,1900-12-31,14.42229,50.08151,regional.address,suggest,"Eckert, Jindřich (1833-1905)",,,[],[]
pozitiv,Pohled do refektáře bývalého kláštera augustiniánů kanovníků na Karlově (dům čp. 453 na Novém Městě - chorobinec) - ložnice s postelemi a jmenovkami na zdi.,1901,43x,A14CEAACB67611DF820F00166F1163D4,VI 57/16,1901-01-01,1901-12-31,14.42851,50.0692,regional.address,geocode,"Eckert, Jindřich (1833-1905)",,,[],[]
pozitiv,Celkový pohled na kostel sv. Vojtěcha v Libni (dům čp. 599 v ulici U Meteoru).,kol.1910,131x,5622B41C50FE11E38E526C626D41E503,I 9812,1910-01-01,1910-12-31,14.47125,50.10887,regional.address,geocode,Bellmann,,,[],[]
,,,56x,b03c67e6fc9b90fb9290ba4d46e4ab66,,,,14.42825,50.08762,regional.address,geocode,,,0.0,[],[]
negativ,Severní portál kostela P. Marie před Týnem na Starém Městě. Detail baldachýnku na levé straně.,18.6.1906,12x,5048F981A93511E3839F0024BE7CD9AC,XI 149,1906-06-18,1906-06-18,14.42396,50.08884,regional.address,geocode,"Kříženecký, Jan (1868-1921)",,0.0,[],[]
pozitiv,Pohled na domy čp. 19 a 20 v Dejvicích.,1968,160x,A0C51014B67611DF820F00166F1163D4,I 31,1968-01-01,1968-12-31,14.37538,50.09767,regional.address,geocode,"Vopravil, Josef (1902-1972)",,,[],[]
negativ,Pohled na odstraňování zbytku litinového můstku ze Slovanského ostrova na nábřeží (Masarykovo).,18.2.1949,33x,2197A1232BEB11E69C9A406186009F3A,X 3862,1949-02-18,1949-02-18,14.41411,50.0775,regional.address,geocode,"Vopravil, Josef (1902-1972)",,,[],[]
pozitiv,Pohled do Štěpánské ulice s domem čp. 628 na Novém Městě.,kol.1910,41x,A14CE871B67611DF820F00166F1163D4,VI 6/30,1910-01-01,1910-12-31,14.34964,50.05489,regional.address,geocode,"Bruner-Dvořák, Rudolf (1864-1921)",,,[],[]
negativ,Pohled na plastickou výzdobu kostela sv. Mikuláše na Starém Městě. Náplň stropu tamburku v přízemí vlevo (jih).,říjen 1905,15x,521222F377AC11E3B7C300110989F46F,XI 33,1905-10-01,1905-10-31,14.4199,50.08778,regional.address,geocode,"Kříženecký, Jan (1868-1921)",,0.0,[],[]
pozitiv,"Pohled do velkého sklepa bývalého kláštera sv. Michala mezi Michalskou a Melantrichovou ulicí na Starém Městě (dům čp. 461 - na straně Staroměstského náměstí), do něhož se původně vstupovalo z náměstí. V horní části schodiště je vidět čtvercový otvor pro závěrový trámec při románském portálku.",29.11.1935,35x,A0C504BEB67611DF820F00166F1163D4,I 4806,1935-11-29,1935-11-29,14.42038,50.0865,regional.address,geocode,"Alexander, Antonín (1892-působnost do 1948)",,,[],[]
negativ,Pohled na stržený mariánský sloup na Staroměstském náměstí.,3.11.1918,54x,DE20968D2C3B11E8A8EF74D435EEBE90,IX 2591,1918-11-03,1918-11-03,14.42132,50.08737,poi,suggest,,,,[],[]
pozitiv,Pohled na shromáždění u sochy sv. Václava na Václavském náměstí 21.8.1988 (20. výročí sovětské okupace).,21.8.1988,68x,A0C4FAA3B67611DF820F00166F1163D4,II 210,1988-08-21,1988-08-21,14.42973,50.07978,poi,suggest,,,,[],[]
pozitiv,Pohled do zahrady Na Valech v Plečnikově úpravě.,kol.1930,183x,A0C504C6B67611DF820F00166F1163D4,I 4084,1930-01-01,1930-12-31,14.40316,50.09058,poi,suggest,,,,[],[]
negativ,Pohled na pavilon výrobků z kůže na Jubilejní výstavě obvodu obchodní a živnostenské komory v Praze na výstavišti v Bubenči v roce 1908 pořádané k 60. výročí panování císaře Františka Josefa I.,1908,42x,9B72C2E5929F11E59FAB406186009F3A,X 158 a,1908-01-01,1908-12-31,14.43056,50.10462,regional.address,geocode,,,,[],[]
pozitiv,Pražské povstání - květen 1945. Poškozený dům s arkýřem čp. 460 na Staroměstském náměstí na Starém Městě.,22.5.1945,33x,cc4ffe394df4419a8141504049b6bc0d,A 17021,1945-05-22,1945-05-22,14.42013,50.08651,regional.address,geocode,"Alexander, Antonín (1892-působnost do 1948)",,0.0,[],[]
negativ,Pohled z mostu Legií na Střelecký ostrov.,kol.1977,18x,A0C512A0B67611DF820F00166F1163D4,VII 347,1977-01-01,1977-12-31,14.41016,50.08058,regional.address,geocode,"Chalupníček, Miroslav -, Chalupníčková, Věra (dokument 1941-1948)",,,[],[]
pozitiv,"Pohled do ulice Na Zderaze s domem čp. 267 (""Stoletá kavárna"") na nároží ulic na Zderaze a Na Zbořenci krátce před zbořením. Zleva domy čp. 260 a 1702 na Novém Městě.",27.3.1908,30x,A14CDE3AB67611DF820F00166F1163D4,VI 58/18 b,1908-03-27,1908-03-27,14.41664,50.07719,regional.address,geocode,Eckert-ateliér,,,[],[]
negativ,Pohled do interiéru domu čp. 1554 (Muzeum města Prahy) na Novém Městě - dveře.,27.3.1908,29x,06EAAA40643811E4A0EB0024BE7CD9AC,XI 573,1908-03-27,1908-03-27,14.43848,50.0901,regional.address,suggest,"Kříženecký, Jan (1868-1921)",,0.0,[],[]
pozitiv,Pohled na zvoničku v Bělohorské ulici v Břevnově před zbořením.,1983,52x,3BB967FDBADB11E5A77074D435EEBE90,II 1656,1983-01-01,1983-12-31,14.36081,50.08356,regional.address,geocode,"Dub, Václav (dokumenty 1928-1983)",,,[],[]
pozitiv,"Pohled na dům čp. 100 na nároží ulic Komorní a Proboštské při Velvarské ulici (Kladenská, Veleslavínova, dnešní Evropská) v Dejvicích.",17.11.1943,24x,25e5d34699f7418e9b3950f71a51c46f,A 15587,1943-11-17,1943-11-17,14.37496,50.1081,regional.address,geocode,"Alexander, Antonín (1892-působnost do 1948)",,0.0,[],[]
pozitiv,Pohled na portál domu čp. 490 (palác Metychů z Čečova - Hrzánský) na Velkopřevorském náměstí na Malé Straně.,1.6.1906,25x,A0C515E7B67611DF820F00166F1163D4,VI 23/31,1906-06-01,1906-06-01,14.40739,50.08615,regional.address,geocode,"Klíma, Alois, Ing. (1873-1955)",,,[],[]
negativ,Pohled na vyobrazení měsíců Josefa Mánesa (znamení Beran) na orloji Staroměstské radnice (dům čp. 1 na Starém Městě) na Staroměstském náměstí.,,20x,F0D9F96990B911E8B3B474D435EEBE90,IX 395 j,,,14.42009,50.087,regional.address,suggest,,,,[],[]
pozitiv,Pohled na Liboc od statku čp. 18 v Liboci.,9.4.1924,27x,A11873DFB67611DF820F00166F1163D4,I 4770,1924-04-09,1924-04-09,14.33563,50.08598,regional.address,geocode,"Alexander, Antonín (1892-působnost do 1948)",,,[],[]
pozitiv,Pohled na západní portál kostela sv. Cyrila a Metoděje v Resslově ulici na Novém Městě.,27.9.1934,23x,dc909c1fa09c46c4af372c37b8a4a915,A 9054,1934-09-27,1934-09-27,14.41762,50.07596,regional.address,geocode,"Alexander, Antonín (1892-působnost do 1948)",,0.0,[],[]
pozitiv,Celkový pohled na Místodržitelský letohrádek (dům čp. 56) v Bubenči.,kol.1910,53x,A1187AF0B67611DF820F00166F1163D4,II 1032,1910-01-01,1910-12-31,14.41428,50.10455,regional.address,geocode,Bruner-Dvořák,,,[],[]
pozitiv,Pohled na tramvaj na křižovatce Plzeňské (vpravo) a Holečkovy (vlevo) na Smíchově. První elektrická soukromá dráha.,1900,369x,A11873E5B67611DF820F00166F1163D4,I 32,1900-01-01,1900-12-31,14.40365,50.07184,regional.address,geocode,,,,[],[]
negativ,Pohled do interiéru kostela sv. Vojtěcha na Starém Městě v Celetné ulici k západu - krátce před zbořením v letech 1902-1903 .,kol.1900,32x,A11886E0B67611DF820F00166F1163D4,VIII 757,1900-01-01,1900-12-31,14.42281,50.08741,regional.address,geocode,"Eckert, Jindřich (1833-1905)",,,[],[]
pozitiv,"Pražské povstání - 8.5.1945. Prostranství před postranním vchodem do kostela sv. Mikuláše a bývalou prelaturou (dnešní náměstí F.Kafky), kde stálo ještě 8.5. večer zneškodněné improvizované německé protiletadlové dělo - vlevo dole.",8.5.1945,141x,A0C51A38B67611DF820F00166F1163D4,I 6507,1945-05-08,1945-05-08,14.41939,50.08793,regional.address,geocode,,,,[],[]
pozitiv,Pohled do Hostivařské ulice (dříve Husova) s domy (zleva) čp. 119 a 125 (bývalý obecní úřad) v Hostivaři.,5.7.1930,103x,A0C4F4F1B67611DF820F00166F1163D4,I 9017,1930-07-05,1930-07-05,14.52656,50.05119,regional.address,geocode,"Alexander, Antonín (1892-působnost do 1948)",,,[],[]
negativ,Pohled na stavbu Mánesova mostu. V pozadí Železná (Rudolfova) lávka a vpravo Rudolfinum (dům čp. 79 na Starém Městě).,30.6.1911,47x,B7164E89CC8811E89DA974D435EEBE90,XI 1873,1911-06-30,1911-06-30,14.41521,50.09017,regional.address,geocode,"Kříženecký, Jan (1868-1921)",,0.0,[],[]
CD-ROM,Pohled na zaplavenou zahradu Trojského zámku při povodni 14.8.2002.,14.8.2002,20x,A0C517BEB67611DF820F00166F1163D4,XXII 4/21 aa,2002-08-14,2002-08-14,14.41109,50.11489,regional.address,geocode,"Malec, Milan - Malcová, Alena",,0.0,[],[]
pozitiv,Pohled na vstupní portál domu čp. 69 v Míšeňské ulici na Malé Straně.,kol.1905,14x,A14CDC85B67611DF820F00166F1163D4,VI 20/15,1905-01-01,1905-12-31,14.40806,50.08775,regional.address,geocode,,,,[],[]
pozitiv,Pohled na portál kostela Nejsvětější Trojice ve Spálené ulici na Novém Městě.,24.5.1907,24x,A11867A2B67611DF820F00166F1163D4,VI 30/36 b,1907-05-24,1907-05-24,14.41975,50.07936,regional.address,geocode,,,,[],[]
pozitiv,Celkový pohled na faru v Kyjích.,1968,41x,A1186EB7B67611DF820F00166F1163D4,I 4565,1968-01-01,1968-12-31,14.54645,50.0984,regional.address,geocode,"Vopravil, Josef (1902-1972)",,,[],[]
pozitiv,Pohled do Spálené ulice s domem čp. 68 na Novém Městě.,únor 1914,37x,A14CE796B67611DF820F00166F1163D4,VI 6/5,1914-02-01,1914-02-28,14.41991,50.08009,regional.address,geocode,,,,[],[]
pozitiv,Pohled do dvora domu čp. 36 na Novém Městě (Thunovský palác) při bourání.,,22x,A14CE78EB67611DF820F00166F1163D4,VI 6/3 c,,,14.42213,50.08248,regional.address,geocode,Bruner-Dvořák,,,[],[]
negativ,Pohled na Karlín z výšky (z vrchu Žižkova). Uprostřed kostel sv. Cyrila a Metoděje.,1896-1897,93x,A14CE40DB67611DF820F00166F1163D4,VIII 416,1896-01-01,1897-12-31,14.44872,50.09219,regional.address,geocode,"Eckert, Jindřich (1833-1905)",,,[],[]
pozitiv,Pohled na okna a chiaroscurové malby v nádvoří domu čp. 639 (Ungelt) na Starém Městě.,kol.1910,17x,A11884BBB67611DF820F00166F1163D4,II 1106,1910-01-01,1910-12-31,14.42333,50.08809,regional.address,geocode,"Kříženecký, Jan (1868-1921)",,,[],[]
pozitiv,"Pohled do interiéru Clam-Gallasovského paláce (dům čp. 158 na Starém Městě) - pokoj v 2 patře č. 87 (""palácová knihovna"").",před 1926,49x,A1186808B67611DF820F00166F1163D4,I 8927,1800-01-01,1925-12-31,14.41779,50.08642,regional.address,geocode,"Vojta, Tomáš (1885-1934)",,,[],[]
negativ,"Pohled do dvora domu čp. 346 (""U Berků"") v ulici Na Perštýně na Starém Městě.",22.10.1910,18x,A1187CABB67611DF820F00166F1163D4,VIII 492,1910-10-22,1910-10-22,14.41862,50.08307,regional.address,geocode,Eckert-ateliér,,,[],[]
negativ,Průhled Hlavsovou ulicí od Jilské ulice na Starém Městě.,1.9.1908,23x,FC3C2C4132D411E0BDD9000C766D2371,XII 193,1908-09-01,1908-09-01,14.41971,50.08587,regional.street,suggest,Eckert-ateliér,,0.0,[],[]
pozitiv,Pohled do interiéru Clam-Gallasovského paláce (dům čp. 158 na Starém Městě) - sál v 2 patře č. 66.,před 1926,47x,A1187DD6B67611DF820F00166F1163D4,I 8925,1800-01-01,1925-12-31,14.41779,50.08642,regional.address,geocode,"Vojta, Tomáš (1885-1934)",,,[],[]
negativ,"Průhled Masařskou ulicí. Vlevo za krámem dům čp. 194 v Josefově, za ním část Velkodvorské synagogy (dům čp. 201) na nároží ulic Rabínské a Masařské v Josefově.",9.7.1905,43x,A11883FEB67611DF820F00166F1163D4,VIII 840,1905-07-09,1905-07-09,14.41854,50.08892,regional.address,geocode,Eckert-ateliér,,,[],[]
pozitiv,Pohled na staré Záběhlice - oblast záběhlického údolí ze stráně nad jižní stranou Hamerského rybníka (v popředí). V pozadí uprostřed kostel Narození P. Marie a za ním domy v dnešní Záběhlické ulici. Třetí část čtyřdílného panoramatu.,16.6.1929,81x,91424899583411E88F1F74D435EEBE90,A 5084,1929-06-16,1929-06-16,14.48614,50.05231,poi,suggest,"Alexander, Antonín (1892-působnost do 1948)",,0.0,[],[]
pozitiv,Vůz s reklamou na čištění města. V pozadí část domu čp. 101 na Vinohradech (divadlo Německé - Smetanovo - Státní opera) v Hooverově ulici (dnes Wilsonova).,1946-1948,34x,A0C4FCFAB67611DF820F00166F1163D4,I 9368,1946-01-01,1948-12-31,14.43263,50.08071,regional.address,geocode,,,,[],[]
pozitiv,Pohled do dvora domu čp. 33 (hotel Na Knížecí) na Smíchově.,1914,28x,A14CE991B67611DF820F00166F1163D4,VI 14/12 c,1914-01-01,1914-12-31,14.40535,50.06938,regional.address,geocode,"Smolka, Karel",,,[],[]
pozitiv,Pohled do Vítkovy ulice v Karlíně.,kol.1910,81x,A14CE34CB67611DF820F00166F1163D4,I 1966,1910-01-01,1910-12-31,14.44607,50.09021,regional.address,geocode,,,,[],[]
pozitiv,"Pohled do interiéru kostela P. Marie před Týnem na Starém Městě - kazatelna, náhrobní kámen Tychona de Brahe.",kol.1940,44x,A14CE98BB67611DF820F00166F1163D4,VI 42/25 f,1940-01-01,1940-12-31,14.42203,50.08761,regional.address,geocode,"Funke, Jaromír",,,[],[]
pozitiv,Pohled do zákoutí ulice U českých loděnic v Libni - okno zámeckého pivovaru.,1981,103x,A0C50DF2B67611DF820F00166F1163D4,V 147/15,1981-01-01,1981-12-31,14.47019,50.10755,regional.address,geocode,"Michálek, Ladislav",,0.0,[],[]
pozitiv,"Pohled do Fastrovy ulice s domem čp. 315 (uprostřed na nároží s ulicí Tejnka) z Bělohorské ulice v Břevnově. Vlevo dům čp. 254, vpravo 253 v Břevnově.",7.9.1943,71x,A1187969B67611DF820F00166F1163D4,I 4136,1943-09-07,1943-09-07,14.37259,50.08381,regional.address,geocode,"Alexander, Antonín (1892-působnost do 1948)",,,[],[]
pozitiv,Pohled na náhrobky Židovského hřbitova na Žižkově (v místech dnešních Mahlerových sadů).,14.4.1933,72x,45AA8469F1E611E6BC06406186009F3A,A 7709,1933-04-14,1933-04-14,14.45166,50.08126,regional.address,geocode,"Alexander, Antonín (1892-působnost do 1948)",,0.0,[],[]
pozitiv,Pohled na řadu hrobů na hřbitově Malvazinky na Smíchově.,kol.1925,59x,A1186BF0B67611DF820F00166F1163D4,I 8780,1925-01-01,1925-12-31,14.38947,50.06181,regional.address,geocode,"Vojta, Tomáš (1885-1934)",,,[],[]
negativ,"Pohled z lávky na Primátorský ostrov na novoměstské nábřeží při Novomlýnské ulici u Nových mlýnů s domy čp. 1373, 1234, 1235 (vlevo - sušárna) na Novém Městě. V pozadí uprostřed věž kostela sv. Klimenta a vodárenská věž.",2.8.1910,44x,A0C519BBB67611DF820F00166F1163D4,VIII 1039,1910-08-02,1910-08-02,14.42928,50.0923,regional.address,geocode,Eckert-ateliér,,,[],[]
pozitiv,Pohled na telefonní budku na náměstí Republiky naproti domu čp. 1078 na Novém Městě.,,113x,A0C50B38B67611DF820F00166F1163D4,I 1561,,,14.4286,50.08921,regional.address,geocode,"Vojta, Tomáš (1885-1934)",,,[],[]
pozitiv,Celkový pohled na novostavbu Městské spořitelny (dům čp. 536) na Starém Městě v Rytířské ulici.,6.4.1902,25x,A0C510FBB67611DF820F00166F1163D4,VI 2/17 b,1902-04-06,1902-04-06,14.42189,50.08506,regional.address,geocode,"Eckert, Jindřich (1833-1905)",,,[],[]
pozitiv,Pohled na dům čp. 22 na Smíchově.,,65x,A0C50F7EB67611DF820F00166F1163D4,I 1934,,,14.39303,50.07354,regional.address,geocode,,,,[],[]
pozitiv,Pohled na velkou část domu čp. 182 (Toskánský - Thunovský palác) na Hradčanském náměstí.,,28x,A14CE8A4B67611DF820F00166F1163D4,VI 11/7 c,,,14.39535,50.08934,regional.address,geocode,,,,[],[]
negativ,Pohled na Šlechtovu restauraci v Královské oboře - Stromovce (dům čp. 20 v Bubenči) se zahrádkou.,kol.1885,84x,6DD9C7419B4111E18F3B6C626D41E503,XII 741,1885-01-01,1885-12-31,14.42226,50.10158,regional.address,geocode,"Eckert, Jindřich (1833-1905)",,0.0,[],[]
pozitiv,Pohled na střechy domů čp. 888 a čp. 889 na Starém Městě.,1911,21x,F25D00999A7811E4A736406186009F3A,V 2/18,1911-01-01,1911-12-31,14.42193,50.09182,regional.address,geocode,"Kříženecký, Jan (1868-1921)",,,[],[]
pozitiv,"Panoramatický pohled přes Vltavu na staré Podskalí. V popředí věž Šítkovské vodárny, v pozadí Vyšehrad.",,134x,A1188C47B67611DF820F00166F1163D4,II 34,,,14.41411,50.0775,regional.address,geocode,"Rupp, Wilhelm (1821-1893)",,,[],[]
pozitiv,"Pohled na severozápadní stranu Staroměstského náměstí s domy (zleva) čp. 1 (Staroměstská radnice), čp. 936 (Krenův dům), čp. 934 na Starém Městě a vlevo mariánský sloup.",18.4.1901,84x,A14CDEEDB67611DF820F00166F1163D4,VI 2/45 b,1901-04-18,1901-04-18,14.42009,50.087,regional.address,suggest,"Eckert, Jindřich (1833-1905)",,,[],[]
pozitiv,Pohled na jižní průčelí Staroměstské radnice (dům čp. 1) na Staroměstském náměstí.,kol.1920,46x,120A6E640FE111E38E586C626D41E503,I 9770,1920-01-01,1920-12-31,14.42009,50.087,regional.address,suggest,"Fink, František (1854-1935)",,,[],[]
pozitiv,Pohled na reliéf v průčelí domu čp. 396 na rohu ulic Provaznická a Havířská na Starém Městě.,1913,20x,A39D1C4BCBE711E4AB2C406186009F3A,V 5/9 a,1913-01-01,1913-12-31,14.42322,50.08469,regional.address,geocode,,,,[],[]
pozitiv,Pražské povstání - 5.5.1945 - nákladní auto s dobrovolníky v Bělehradské ulici na cestě k budově Rozhlasu.,5.5.1945,71x,BCD33C0ED65611E18B876C626D41E503,I 7981,1945-05-05,1945-05-05,14.43998,50.0648,regional.address,geocode,"Velebil, Karel (?)",,,[],[]
pozitiv,Celkový pohled na libeňský plynojem.,,91x,9450E5281B2011E5A99974D435EEBE90,I 11229,,,14.47424,50.10131,poi,suggest,,,,[],[]
pozitiv,Pohled na domy čp. 23 a čp. 19 (vpravo) ve Vinohradské ulici (v místech dnešní ulice Ke Strašnické).,20.11.1942,48x,9CE76429C49511E78A03D4BED94BB14D,A 14862,1942-11-20,1942-11-20,14.48158,50.07018,regional.address,geocode,"Alexander, Antonín (1892-působnost do 1948)",,0.0,[],[]
pozitiv,Pohled na část průčelí domu čp. 27 na Starém Městě (prelatura kostela sv. Mikuláše).,18.11.1897,25x,A14CE909B67611DF820F00166F1163D4,VI 47/4 a,1897-11-18,1897-11-18,14.41925,50.08848,regional.address,geocode,"Kříženecký, Rudolf (dokument 1897-1931)",,,[],[]
pozitiv,Pohled na severní průčelí domu čp. 995 na Starém Městě na Smetanově nábřeží.,19.7.1945,56x,A1187330B67611DF820F00166F1163D4,I 4102,1945-07-19,1945-07-19,14.4133,50.08234,regional.address,geocode,"Alexander, Antonín (1892-působnost do 1948)",,,[],[]
pozitiv,Pohled na Hradčanské náměstí k 1. nádvoří Pražského hradu.,1984,7x,c3926f19294c4d81bdddce564efec1dd,I 12765,1984-01-01,1984-12-31,14.39535,50.08934,regional.address,geocode,"Hudeček, Jan",,,[],[]
negativ,Pohled do interiéru domu čp. 671 na Karlově náměstí na Novém Městě (Salmovský palác) - salon.,kol.1900,18x,681417137C4311E2BF19525400E46D25,VIII 1252,1900-01-01,1900-12-31,14.42156,50.078,regional.address,geocode,"Eckert, Jindřich (1833-1905)",,,[],[]
negativ,"Pohled na východní stranu Staroměstského náměstí s domy čp. (zleva) 606, 605, 604 a 603 na Starém Městě. V pozadí kostel P. Marie před Týnem, v popředí mariánský sloup.",před 1896,45x,60A8DE7942A711EA982C406186009F3A,XI 5791,1800-01-01,1895-12-31,14.42211,50.08746,regional.address,geocode,Bellmann-ateliér,,0.0,[],[]
pozitiv,"Pohled z železničního mostu na stavbu nábřeží pod Vyšehradskou skálou. Uprostřed střecha pivovaru ""Libušinka"" (dům čp. 48 na Vyšehradě). V pozadí věže kostela sv. Petra a Pavla na Vyšehradě.",28.7.1906,87x,A0C5008FB67611DF820F00166F1163D4,VI 51/1 b,1906-07-28,1906-07-28,14.41466,50.07023,regional.address,geocode,Eckert-ateliér,,,[],[]
pozitiv,Pohled na hroby při nově vystavené (oproti původní posunuté) zdi Malostranského hřbitova na Smíchově - při Plzeňské ulici.,kol.1950,62x,12D4D00D304011E5A53574D435EEBE90,I 11296,1950-01-01,1950-12-31,14.39148,50.07167,poi,suggest,"Pacovský, Jaroslav",,,[],[]
negativ,Pohled na zahradní průčelí Valdštejnského paláce (dům čp. 17 na Malé Straně).,,22x,A0C50095B67611DF820F00166F1163D4,VIII 999,,,14.40535,50.09003,regional.address,geocode,Eckert-ateliér,,,[],[]
negativ,Pohled do interiéru domu čp. 1012 na Starém Městě na Národní třídě (kavárna Slávia) - kulečník.,7.10.1905,58x,98D23B2F87DA11E2BF21525400E46D25,VIII 1348,1905-10-07,1905-10-07,14.41321,50.08173,regional.address,geocode,Eckert-ateliér,,,[],[]
pozitiv,Pohled na Týnskou faru (dům čp. 601 na Starém Městě) - průčelí do Celetné ulice. Vlevo dům čp. 602 na Starém Městě.,16.12.1934,52x,A1187760B67611DF820F00166F1163D4,I 4757,1934-12-16,1934-12-16,14.42281,50.08741,regional.address,geocode,"Alexander, Antonín (1892-působnost do 1948)",,,[],[]
pozitiv,Povodeň v březnu roku 1940 - okolí plavební komory v Podbabě - práce při odklízení následků povodně.,duben 1940,42x,6E4B6D9899B111E1874B6C626D41E503,I 9592,1940-04-01,1940-04-30,14.3938,50.11701,poi,suggest,"Kropáček, Zdeněk",,,[],[]
pozitiv,Průhled ulicí Pod Poštou s domem čp. 91 (vlevo) v Satalicích.,1977,50x,A0C4F914B67611DF820F00166F1163D4,I 349,1977-01-01,1977-12-31,14.57249,50.12628,regional.address,geocode,"Hudeček, Jan",,,[],[]
negativ,"Panoramatický pohled od jihu na Suchdol, ze stanoviště u kostela sv. Matěje, v popředí Horní Šárka.",kol.1960,85x,A1186C73B67611DF820F00166F1163D4,VII 67,1960-01-01,1960-12-31,14.37746,50.11323,poi,suggest,"Chalupníček, Miroslav -, Chalupníčková, Věra (dokument 1941-1948)",,,[],[]
pozitiv,Pohled na stavbu plavebních komor u ostrova Štvanice. V pozadí Negrelliho viadukt.,10.3.1910,69x,67FF44EB62D811E6A552000C76270B94,I 11814,1910-03-10,1910-03-10,14.43744,50.09433,poi,suggest,,,,[],[]
pozitiv,Pohled do dvora domu čp. 233 v Břevnově (keramická dílna Václava Klause) k severu.,28.8.1936,44x,40859469B61A11E58B3BD4BED94BB14D,I 11436,1936-08-28,1936-08-28,14.36765,50.08391,regional.address,geocode,"Alexander, Antonín (1892-působnost do 1948)",,,[],[]
pozitiv,Pohled do interiéru Národního divadla (dům čp. 223) na Novém Městě po požáru roku 1881.,1881,55x,A14CE798B67611DF820F00166F1163D4,VI 6/12 b,1881-01-01,1881-12-31,14.41347,50.08126,regional.address,geocode,"Eckert, Jindřich (1833-1905)",,,[],[]
negativ,Pohled do interiéru elektrárny na Malé Straně.,1900-1901,26x,725B74608D5E11E2BF25525400E46D25,VIII 1433,1900-01-01,1901-12-31,14.40839,50.08359,regional.address,geocode,"Eckert, Jindřich (1833-1905)",,,[],[]
negativ,Pohled na Staroměstské náměstí se Staroměstskou radnicí (dům čp. 1) a Krenovým domem (dům čp. 936 na Starém Městě). V popředí mariánský sloup.,1890-1899,48x,9B081730C68A11EA983A406186009F3A,XI 5774,1890-01-01,1899-12-31,14.4202,50.08848,regional.address,geocode,Bellmann-ateliér,,0.0,[],[]
negativ,"Celkový pohled na Prašnou bránu po přestavbě. Vpravo část Obecního domu (čp. 1090 na Starém Městě), vlevo část nárožního domu čp. 969 na Starém Městě.",kol.1925,66x,27C2DECBF8A111E4808074D435EEBE90,X 10386,1925-01-01,1925-12-31,14.42825,50.08762,regional.address,geocode,Eckert-ateliér,,,[],[]
negativ,Pohled na portrétní bustu Mikuláše Holubce (ředitel stavby do roku 1355) v triforiu chrámu sv. Víta na Pražském hradě.,květen 1924,24x,C832E9903D9A11E499B8406186009F3A,XI 6281 a,1924-05-01,1924-05-31,14.4006,50.09089,poi,suggest,Eckert-ateliér,,0.0,[],[]
negativ,Pohled na nástropní fresku v kostele sv. Mikuláše na Malé Straně.,8.11.1904,17x,D6C4F39B181F11E0BDBC000C766D2371,XII 115,1904-11-08,1904-11-08,14.40322,50.08798,poi,suggest,"Eckert, Jindřich (1833-1905)",,0.0,[],[]
negativ,Děti v útulku na Maninách.,2.4.1908,35x,438B3FB470BB11E4A3ED0024BE7CD9AC,XI 636,1908-04-02,1908-04-02,14.45276,50.10086,regional.address,geocode,"Kříženecký, Jan (1868-1921)",,0.0,[],[]
negativ,Portál věže zvonice na Malé Straně při kostelu sv. Mikuláše na Malé Straně (dům čp. 556).,,29x,A0C50B36B67611DF820F00166F1163D4,VIII 206,,,14.40363,50.08779,regional.address,geocode,Eckert-ateliér,,,[],[]
negativ,Pohled přes Vltavu na Vyšehradskou skálu s částí opevnění.,,42x,3166EE75986611E2BF2C525400E46D25,VIII 1624,,,14.43414,50.08355,regional.municipality,suggest,"Eckert, Jindřich (1833-1905)",,,[],[]
negativ,Pohled na vojenskou kuchyni v petřínském pevnostním obvodu. V pozadí Petřínská rozhledna.,1914-1918,47x,0E4EBE387F8411E88359406186009F3A,X 757,1914-01-01,1918-12-31,14.39508,50.08354,poi,suggest,"Pfeiffer, Julius (1879-1947)",,,[],[]
negativ,Pohled do Pinkasovy uličky s domy čp. 285 a čp. 23 (Pinkasova synagoga) v Josefově.,10.3.1908,40x,AB94EF85077211E48CE60024BE7CD9AC,XI 551,1908-03-10,1908-03-10,14.41693,50.08917,regional.address,geocode,"Kříženecký, Jan (1868-1921)",,0.0,[],[]
negativ,Celkový pohled na náhrobek rodiny Ludvíka Václavíčka na Olšanských hřbitovech.,20.11.1907,73x,B46AFEFD0E2311E2935B6C626D41E503,XII 1053,1907-11-20,1907-11-20,14.46687,50.07842,regional.address,geocode,Eckert-ateliér,,0.0,[],[]
pozitiv,"Pohled na statek čp. 21 ve Strašnicích (dnes ulice V Olšinách, Ke Strašnické).",14.9.1942,64x,25DF5369F52611E7AFAF74D435EEBE90,A 14613,1942-09-14,1942-09-14,14.48226,50.06582,regional.address,geocode,"Alexander, Antonín (1892-působnost do 1948)",,0.0,[],[]
pozitiv,Pohled na zbouranou partii kláštera Milosrdných bratří (dům čp. 847) na Starém Městě.,1916,51x,A9B82820968D11E49A5E406186009F3A,V 2/7 e,1916-01-01,1916-12-31,14.42193,50.09182,regional.address,geocode,"Lederer, Arnold",,,[],[]
pozitiv,"Pohled do Brožíkovy síně Staroměstské radnice při zahájení činnosti tzv. Spolku pro postavení pomníku Mistra Antonína Dvořáka v Praze.
                    
                
                    
                  Sedící zleva v první řadě: Karel Moravec (violista, Ševčíkovo kvarteto), Jiří Herold (violista, České kvarteto), Richard Veselý (hudební spisovatel), JUDr.Jaroslav Patera (spolek Umělecká beseda), Karel Hoffmann (houslista), Josef Suk (skladatel, houslista Českého kvarteta, zeť AD), Anna Dvořáková (vdova AD), Magda Šantrůčková-Dvořáková, Julie Dvořáková (snacha AD), ing. Antonín Dvořák (syn AD), JUDr Maxmilian Leiser (první předseda);
                    
                
                    
                  Z dalších přítomných JUDr Antonín Čubr (klavírista a varhaník, později editor Souborného vydání díla AD), Jindřich Feld st.(houslový pedagog), Alois Hába (skladatel), Jan Heřman (klavírista), Bedřich Jaroš, Rudolf Karel (skladatel), Jaroslav Křička (skladatel), Jan Miroslav Květ, Čeněk Kvíčala (malíř), Egon Ledeč (houslista), Josef Procházka (skladatel, žák AD), František Stupka (dirigent), Roman Veselý (klavírista);
                    
                
                    
                  Stojící: ing. Otakar Šourek (životopisec AD, prvý místopředseda spolku).",29.3.1931,135x,A118703DB67611DF820F00166F1163D4,I 8489,1931-03-29,1931-03-29,14.4202,50.08686,poi,suggest,,,,[],[]
pohlednice,Pohled na bránu Gigantů a osvětlený Pražský hrad při příležitosti 10. výročí samostatnosti Československé republiky.,28.10.1928,44x,7E38D6140DAD11E892C0406186009F3A,I 12033,1928-10-28,1928-10-28,14.39534,50.08934,regional.address,geocode,,,,[],[]
CD-ROM,Pohled na zaplavenou zahradu Trojského zámku při povodni 13.8.2002 dopoledne.,13.8.2002,21x,A1186FBCB67611DF820F00166F1163D4,XXII 2/22,2002-08-13,2002-08-13,14.41109,50.11489,regional.address,geocode,"Malec, Milan - Malcová, Alena",,0.0,[],[]
pozitiv,Detail sochy Atlanta s hvězdným globem z věže Klementina (dům čp. 190) na Starém Městě.,5.6.1914,14x,DA5741CFBDBD11E493C10024BE7CD9AC,V 4/5 b,1914-06-05,1914-06-05,14.41659,50.08616,poi,suggest,,,,[],[]
negativ,Pohled na pamětní desku astrofyzika Kristiána Döpplera na Novoměstské radnici (dům čp. 1-2 na Novém Městě).,16.4.1904,43x,DBDAA0B90C9B11E2AEA36C626D41E503,XII 974,1904-04-16,1904-04-16,14.42098,50.07345,regional.address,suggest,"Eckert, Jindřich (1833-1905)",,0.0,[],[]
pozitiv,Pohled na nouzovou dřevěnou stavbu na nároží Národní třídy a Spálené ulice (po zbořeném domu čp. 61 na Novém Městě) vyhořelou v noci 23.-24.12.1969.,1969,125x,A0C514B1B67611DF820F00166F1163D4,I 4850,1969-01-01,1969-12-31,14.41948,50.0823,regional.address,geocode,"Vopravil, Josef (1902-1972)",,,[],[]
pozitiv,Pohled na kostel sv. Tomáše v Letenské ulici na Malé Straně.,kol.1925,50x,A0C4FA78B67611DF820F00166F1163D4,I 1528,1925-01-01,1925-12-31,14.40901,50.08998,regional.address,geocode,,,,[],[]
pozitiv,Pohled na uvolněné místo po zbořeném domu čp. 436 v Apolinářské ulici na Novém Městě.,2.7.1923,50x,08F16A9A9C3C11E6A8D0406186009F3A,A 113,1923-07-02,1923-07-02,14.4208,50.0701,regional.address,geocode,"Alexander, Antonín (1892-působnost do 1948)",,0.0,[],[]
pozitiv,Pohled ze stráně nad Malou Chuchlí na kopec mezi Chuchlí a Slivencem. Součást panoramatu.,17.6.1927,36x,DCB163B5AEB111E3B51C406186009F3A,I 9910,1927-06-17,1927-06-17,14.39178,50.02443,regional.address,geocode,"Alexander, Antonín (1892-působnost do 1948)",,,[],[]
pozitiv,"""Tycho Brahe v Praze"" - výročí 1901. T.III. Nádvoří Klementina s věží hvězdárny (dům čp. 190, 1040 na Starém Městě).",1901,52x,A11887CEB67611DF820F00166F1163D4,VI 4/4,1901-01-01,1901-12-31,14.41659,50.08616,poi,suggest,"Eckert, Jindřich (1833-1905)",,,[],[]
pozitiv,"Panoramatický pohled na centrum starých Kobylis - ulice Na Pěšinách a ulice Ke Koupališti, v pozadí škola (dům čp. 112). Druhá část dvoudílného panoramatu.",1.7.1927,112x,DA29CBAD365811E7B9CE406186009F3A,A 3394,1927-07-01,1927-07-01,14.45568,50.12191,regional.address,geocode,"Alexander, Antonín (1892-působnost do 1948)",,0.0,[],[]
negativ,Pohled na část Pražského hradu - průčelí na Hradčanské náměstí. Vpravo empírová kašna.,kol.1890,33x,203E15939DD911E196AF6C626D41E503,XII 793,1890-01-01,1890-12-31,14.39769,50.08921,regional.address,geocode,"Eckert, Jindřich (1833-1905)",,0.0,[],[]
pozitiv,Pražské typy - privilegovaný sbor granátníků měšťanské gardy v den vysvěcení praporu na Staroměstském náměstí.,,38x,A14CE05DB67611DF820F00166F1163D4,I 8606,,,14.41994,50.08663,regional.address,geocode,,,,[],[]
pozitiv,Pohled na průčelí domu čp. 12 do Mikulášské ulice (dnes U Radnice) na Starém Městě. Vlevo část domu čp. 128 na před zbořením.,23.5.1908,30x,A14CE907B67611DF820F00166F1163D4,VI 47/2,1908-05-23,1908-05-23,14.41925,50.08727,regional.address,geocode,Eckert-ateliér,,,[],[]
pozitiv,Reprodukce článku z Vinohradských listů 6.1.1912 o slavnostním otevření Obecního domu (dům čp. 1090 na Starém Městě).,1992,19x,A14CEB6AB67611DF820F00166F1163D4,VI 68/3 b,1992-01-01,1992-12-31,14.42825,50.08762,regional.address,geocode,"Jelínková, Jana (1951-)",,,[],[]
pozitiv,Pohled na osvětlenou Staroměstskou radnici při příležitosti 10. výročí samostatnosti Československé republiky.,28.10.1928,48x,6286E655124111E8A338406186009F3A,I 12044,1928-10-28,1928-10-28,14.42009,50.087,regional.address,suggest,"Vopravil, Josef (1902-1972)",,,[],[]
pozitiv,"Listina se znakem Vysočan - 13.10.1903 - povýšení na město. Císař František Josef I. povyšuje rozhodnutím ze dne 27.8.1902 obec Vysočany na město a uděluje mu znak (10.9.1903)
                    
                
                    
                  (AMP PGL I - 102).",1992,59x,A14CEB72B67611DF820F00166F1163D4,VI 69/4 a,1992-01-01,1992-12-31,14.50053,50.11049,regional.address,geocode,"Jelínková, Jana (1951-)",,,[],[]
negativ,"Pohled do parku na Karlově náměstí - detail výzdoby ""západní květinový koberec"". V pozadí vchod do parku před domem čp. 291 na Novém Městě.",kol.1900,33x,A1188BE4B67611DF820F00166F1163D4,VIII 1058,1900-01-01,1900-12-31,14.43664,50.03892,regional.address,geocode,"Eckert, Jindřich (1833-1905)",,,[],[]
pozitiv,Celkový pohled na domy čp. 976 a 979 na Senovážném náměstí na Novém Městě. V pozadí věž zvonice kostela sv. Jindřicha.,kol.1910,79x,A11889CBB67611DF820F00166F1163D4,VI 7/52 a,1910-01-01,1910-12-31,14.43023,50.08551,regional.address,geocode,,,,[],[]
pozitiv,Pražské povstání - květen 1945. Barikáda v Karlově ulici před Křižovnickým náměstím na Starém Městě.,květen 1945,149x,A11889B1B67611DF820F00166F1163D4,I 6518,1945-05-01,1945-05-31,14.41659,50.08616,regional.address,geocode,,,,[],[]
pozitiv,Pohled od tratě pod Barrandovskou skálou na vltavské údolí. Za řekou Braník (v pozadí uprostřed pivovar). Součást panoramatu.,15.6.1927,53x,09759312035811E7A51174D435EEBE90,A 3365,1927-06-15,1927-06-15,14.40986,50.02941,poi,suggest,"Alexander, Antonín (1892-působnost do 1948)",,0.0,[],[]
pozitiv,Pohled na Křižovnické náměstí se Staroměstskou mostní věží a s pomníkem císaře Karla IV.,kol.1890,45x,A1188BD1B67611DF820F00166F1163D4,VI 36/1 a,1890-01-01,1890-12-31,14.41405,50.08641,regional.address,geocode,"Eckert, Jindřich (1833-1905)",,,[],[]
pozitiv,Reprodukce článku z Národních listů 16.12.1911 (večerní vydání) o slavnostním otevření Obecního domu (dům čp. 1090 na Starém Městě).,1992,21x,A14CEB67B67611DF820F00166F1163D4,VI 68/1 b,1992-01-01,1992-12-31,14.42825,50.08762,regional.address,geocode,"Jelínková, Jana (1951-)",,,[],[]
pozitiv,Pohled do Martinské ulice s domem čp. 417 před kostelem sv. Martina ve zdi na Starém Městě.,16.7.1904,14x,A14CE90AB67611DF820F00166F1163D4,VI 47/20 b,1904-07-16,1904-07-16,14.4199,50.08269,regional.address,geocode,"Eckert, Jindřich (1833-1905)",,,[],[]
pozitiv,Pohled na malovaný strop v prvním patře domu čp. 347 v ulici Na Perštýně na Starém Městě.,kol. 1910,22x,E39DF4FBCBE611E4AB2C406186009F3A,V 5/8 a,,,14.41845,50.08327,regional.address,geocode,,,,[],[]
pozitiv,Pohled do Karmelitské ulice s domem čp. 388 na Malé Straně (četnická kasárna).,28.5.1904,70x,A14CE912B67611DF820F00166F1163D4,VI 8/28,1904-05-28,1904-05-28,14.40454,50.08495,regional.address,geocode,"Eckert, Jindřich (1833-1905)",,,[],[]
pozitiv,Průhled Václavským náměstím od Můstku. V pozadí Národní muzeum (dům čp. 1700 na Novém Městě). Vlevo domy východní strany náměstí.,1901-1902,58x,32818A1DD85611E89C7B74D435EEBE90,V 24/7 a,1901-01-01,1902-12-31,14.43056,50.07918,regional.address,geocode,Bellmann-ateliér,,,[],[]
negativ,"Pohled do Josefovské ulice od křižovatky s Cikánskou ulicí (vlevo). Zleva části domů čp. 124 v Josefově a 900 na Starém Městě, zprava domy čp. 115, 118, 119, 169 v Josefově.",kol.1895,49x,A1186AF2B67611DF820F00166F1163D4,VIII 175,1895-01-01,1895-12-31,14.41885,50.08921,regional.address,geocode,"Eckert, Jindřich (1833-1905)",,,[],[]
pozitiv,Pohled na dům čp. 868 na Senovážném náměstí na Novém Městě.,1910,61x,6BC3A318BDCA11E493C10024BE7CD9AC,V 4/10,1910-01-01,1910-12-31,14.43158,50.08552,regional.address,geocode,Bellmann,,,[],[]
negativ,"Pohled na domy (zleva) čp. 705 (""U Zlaté štiky"") a 704 (""U Zlaté krávy"") na nároží ulic Dlouhé (vlevo) a Masné na Starém Městě před zbořením v roce 1912.",2.4.1912,27x,A0C51AD6B67611DF820F00166F1163D4,VIII 703,1912-04-02,1912-04-02,14.42347,50.08969,regional.address,geocode,Eckert-ateliér,,,[],[]
pozitiv,"Průhled Bělohorskou ulicí k usedlosti U Kaštanu (dům čp. 201). Dále pak domy čp. 203, 204, 211, 205, 206, 207 v Břevnově.",7.9.1943,57x,F50A9CDFB60D11E58B3BD4BED94BB14D,I 11394,1943-09-07,1943-09-07,14.36081,50.08356,regional.address,geocode,"Alexander, Antonín (1892-působnost do 1948)",,,[],[]
pozitiv,Pohled do Veleslavínské ulice (dnes Radimova) v Břevnově - západní strana.,4.9.1943,46x,F2A6A77EBAB511E5A77074D435EEBE90,I 11448,1943-09-04,1943-09-04,14.37542,50.08752,regional.address,geocode,"Alexander, Antonín (1892-působnost do 1948)",,,[],[]
pozitiv,Pohled na dům čp. 647 na nároží ulic Malé Štupartské a Jakubské (vlevo) na Starém Městě.,29.9.1944,25x,F03AC5E9157611E39CC26C626D41E503,I 9785,1944-09-29,1944-09-29,14.42481,50.08808,regional.address,geocode,"Alexander, Antonín (1892-působnost do 1948)",,,[],[]
pozitiv,Pohled ze Smíchova na Vyšehrad - plující ledy na Vltavě.,1910,62x,D55AD466AC8111E49EA1406186009F3A,V 3/20 b,1910-01-01,1910-12-31,14.41041,50.07195,regional.address,geocode,Bellmann,,,[],[]
pozitiv,"Pohled na portál domu čp. 498 (""U modré lišky"") v ulici Na Kampě na Malé Straně.",4.7.1906,27x,A1186FB5B67611DF820F00166F1163D4,VI 23/32,1906-07-04,1906-07-04,14.40833,50.08575,regional.address,geocode,,,,[],[]
negativ,Pohled do průjezdu a dvora domu čp. 179 v Cikánské ulici v Josefově před zbořením v roce 1910.,24.5.1906,31x,A14CE70FB67611DF820F00166F1163D4,VIII 497,1906-05-24,1906-05-24,14.4163,50.09104,regional.address,geocode,Eckert-ateliér,,,[],[]
negativ,Pohled na nástěnnou malbu v domě čp. 240 (Bretfeldovský palác) v Nerudově ulici na Malé Straně - nástěnná malba na východní stěně vlevo.,kol.1900,47x,EA7019B30ADE11E1BEC2000C766D2371,XII 402,1900-01-01,1900-12-31,14.39828,50.08841,regional.address,geocode,"Eckert, Jindřich (1833-1905)",,0.0,[],[]
negativ,"Panoramatický pohled na Prahu z úbočí Petřína u Hladové zdi, v popředí Petřínské sady, Masarykovo nábřeží, Nové Město.",kol.1971,31x,A11887C3B67611DF820F00166F1163D4,VII 312,1971-01-01,1971-12-31,14.40078,50.08068,poi,suggest,"Chalupníček, Miroslav -, Chalupníčková, Věra (dokument 1941-1948)",,,[],[]
negativ,Panoramatický pohled na střed Vršovic ze stanoviště v Michli u nouzové kolonie pod elektrárnou.,kol.1960,114x,A11872BEB67611DF820F00166F1163D4,VII 10,1960-01-01,1960-12-31,14.46563,50.05718,regional.address,geocode,"Chalupníček, Miroslav -, Chalupníčková, Věra (dokument 1941-1948)",,,[],[]
pozitiv,Pohled na Hradčanské náměstí s Arcibiskupským palácem (dům čp. 56) na Hradčanech a Pražským hradem. V pozadí věže chrámu sv. Víta.,,10x,3c65cb962ef940b3b1c5d26f284fdb7b,I 12760,,,14.39535,50.08934,regional.address,geocode,Gotsche,,,[],[]
pozitiv,Pohled na stavbu přístavu v Libni - parník Wasserbau firmy Lanna.,1894-1895,89x,A63CED816D6411E88D0474D435EEBE90,V 18/13 f,1894-01-01,1895-12-31,14.41735,50.06113,regional.address,geocode,,,,[],[]
pozitiv,"Panoramatický pohled na Kobylisy a Troju od štěrkovny - jihovýchodně a jižně od Čimického háje přes vltavské údolí (od severovýchodu přes východ, jih k západu). Součást šestidílného panoramatu.",18.7.1926,73x,A11876F8B67611DF820F00166F1163D4,I 4872,1926-07-18,1926-07-18,14.45833,50.12953,regional.address,geocode,"Alexander, Antonín (1892-působnost do 1948)",,,[],[]
pozitiv,Pohled z výšky na přestavbu severního předmostí Hlávkova mostu v Holešovicích při stavbě Severojižní magistrály.,1980,40x,C1B1FBD6E69911E89E7C74D435EEBE90,I 12411,1980-01-01,1980-12-31,14.4369,50.09567,regional.street,suggest,"Jelínková, Jana (1951-)",,,[],[]
negativ,Pohled z pravé konchy do interiéru kostele sv. Mikuláše na Malé Straně.,5.10.1907,13x,9C884DD6D53211E39F890024BE7CD9AC,XI 405,1907-10-05,1907-10-05,14.4032,50.08835,regional.address,geocode,"Kříženecký, Jan (1868-1921)",,0.0,[],[]
pozitiv,Pohled na dřevěnou rybárnu při pilotovém mostu na ostrově Štvanice v Holešovicích.,5.6.1909,134x,A0C51630B67611DF820F00166F1163D4,I 380,1909-06-05,1909-06-05,14.44021,50.09583,regional.address,geocode,,,,[],[]
negativ,"Celkový pohled ""Faustův dům"" (dům čp. 502 na Novém Městě) na Karlově náměstí na Novém Městě.",1926,41x,15C6E9333DAA11E499B8406186009F3A,XI 6308,1926-01-01,1926-12-31,14.42313,50.08113,regional.address,suggest,Eckert-ateliér,,0.0,[],[]
pozitiv,Pohled na Černínský palác (dům čp. 101 na Hradčanech) a okolí od křižovatky ulic Keplerovy a Na Náspu na Hradčanech.,,70x,A1187A9EB67611DF820F00166F1163D4,VI 75/3,,,14.39071,50.08877,regional.address,geocode,,,,[],[]
pozitiv,"Pohled do zahrady domu čp. 180 na Hradčanech (bývalý Trautmannsdorfský palác) - ""práce na výkopu válečného vodního bazénu"". V pozadí část západního průčelí domu čp. 180, altán a vchod do velké zahrady.",5.6.1944,23x,4292489A748811E4A81F406186009F3A,I 11076,1944-06-05,1944-06-05,14.39375,50.08878,regional.address,geocode,"Alexander, Antonín (1892-působnost do 1948)",,,[],[]
pozitiv,"Pohled na vstupní portál domu čp. 254 (""U Města Betléma"") na Betlémském náměstí na Starém Městě.",19.8.1907,20x,A0C4FE33B67611DF820F00166F1163D4,VI 15/26,1907-08-19,1907-08-19,14.41712,50.0842,regional.address,geocode,,,,[],[]
negativ,"Panoramatický pohled na Prahu ze Staroměstské věže, v popředí Vltava, Mánesův most, v pozadí Malá Strana, Strakova akademie (dům čp. 128 na Malé Straně), Letenské sady.",kol.1960,53x,A14CE5A1B67611DF820F00166F1163D4,VII 270,1960-01-01,1960-12-31,14.41139,50.09203,regional.address,geocode,"Chalupníček, Miroslav -, Chalupníčková, Věra (dokument 1941-1948)",,,[],[]
pozitiv,Panoramatický pohled od okraje vysokého ostrohu Butovického hradiště do Prokopského údolí v okolí Klukovic. Uprostřed vlevo stojí hostinec „U Kosů“ (dnes pivovar „Prokopák“) v Klukovicích a v popředí trať Pražsko-duchcovské dráhy. Čtvrtá část pětidílného panoramatu.,18.7.1925,16x,21d5899ffe4e4b828f146b3a32080ff3,A 1937,1925-07-18,1925-07-18,14.61101,50.12245,regional.address,geocode,"Alexander, Antonín (1892-působnost do 1948)","On-line výstava na webu AMP ""Pražské panorama 2. část - Prokopské a Dalejské údolí"".
                    
                
                    
                  Součást panoramatu A 1934, A 1935, A 1936, A 1937, A 1938.
                    
                
                    
                  List 20a bod 12
                    
                
                    
                  Plány sign. AMP XXXII.",0.0,[],[]
negativ,Pohled na pavilony na výstavišti v Bubenči při Jubilejní výstavě 1891.,1891,62x,A9C0EDBF6A2C11E2BF13525400E46D25,VIII 1165,1891-01-01,1891-12-31,14.43056,50.10462,regional.address,geocode,"Eckert, Jindřich (1833-1905)",,,[],[]
negativ,Pohled od Mánesova mostu na Palachovo náměstí a Rudolfinum (dům čp. 79 na Starém Městě) na Starém Městě.,kol.1950,88x,A0C50E64B67611DF820F00166F1163D4,VII 1,1950-01-01,1950-12-31,14.41521,50.09017,regional.address,geocode,"Chalupníček, Miroslav -, Chalupníčková, Věra (dokument 1941-1948)",,,[],[]
pozitiv,"Pohled na dům čp. 160 (dům pro židovské studenty, v současnosti dům čp. 770) v ulici Na Popelce na Smíchově - před opravou.",,87x,A1187775B67611DF820F00166F1163D4,I 1926,,,14.38474,50.06917,regional.address,geocode,"Korba, Jaroslav",,,[],[]
pozitiv,Pohled do čítárny dětské literatury v nové budově Ústřední knihovny hlavního města Prahy (dům čp. 98 na Starém Městě).,kol.1935,97x,A1187E40B67611DF820F00166F1163D4,II 549,1935-01-01,1935-12-31,14.41739,50.08739,regional.address,geocode,,,,[],[]
negativ,Celkový pohled na hlavní průčelí Obecního domu (dům čp. 1090 na Starém Městě) těsně před dokončením.,1911,69x,A118776FB67611DF820F00166F1163D4,X 623,1911-01-01,1911-12-31,14.42825,50.08762,regional.address,geocode,,,,[],[]
pozitiv,"Pohled na stavbu Obecního domu (domu čp. 1090 na Starém Městě). V pozadí zleva domy čp. 1037, 864 na Novém Městě a část Prašné brány.",1906-1907,86x,A0C5182DB67611DF820F00166F1163D4,II 1364,1906-01-01,1907-12-31,14.42903,50.08791,regional.address,geocode,,,,[],[]
pozitiv,Pohled do sadů na Letné se stanicí Křižíkovy elektrické dráhy.,16.10.1907,59x,A0C5116DB67611DF820F00166F1163D4,II 1055,1907-10-16,1907-10-16,14.42558,50.0964,poi,suggest,"Kříženecký, Jan (1868-1921)",,,[],[]
pozitiv,Pohled na severní území Bohnic a přilehlé části Čimic po obou stranách Čimického potoka. Součást panoramatu.,8.10.1924,32x,E337121C457511E99C7074D435EEBE90,A 1270,1924-10-08,1924-10-08,14.41381,50.13544,regional.address,geocode,"Alexander, Antonín (1892-působnost do 1948)",,0.0,[],[]
negativ,Pohled na Malou Stranu a Pražský hrad z Petřína. V popředí Malá Strana s kostelem sv. Mikuláše.,kol.1900,38x,A1186813B67611DF820F00166F1163D4,VIII 961,1900-01-01,1900-12-31,14.4032,50.08835,regional.address,geocode,"Eckert, Jindřich (1833-1905)",,,[],[]
pozitiv,Reprodukce článku z Vinohradských listů 6.1.1912 o slavnostním otevření Obecního domu (dům čp. 1090 na Starém Městě).,1992,25x,A14CEB69B67611DF820F00166F1163D4,VI 68/3 a,1992-01-01,1992-12-31,14.42825,50.08762,regional.address,geocode,"Jelínková, Jana (1951-)",,,[],[]
pozitiv,Pohled na zdění plavebních komor u ostrova Štvanice. V pozadí Negrelliho viadukt.,21.7.1909,72x,A1FC09B3646311E6A554000C76270B94,I 11852,1909-07-21,1909-07-21,14.43744,50.09433,poi,suggest,,,,[],[]
pozitiv,"Pohled do Týnské ulice s domy čp. 627, 630, 639 (zleva) na Starém Městě.",11.7.1911,46x,A0C51527B67611DF820F00166F1163D4,II 189,1911-07-11,1911-07-11,14.42292,50.08805,regional.address,geocode,"Kříženecký, Jan (1868-1921)",,,[],[]
pozitiv,Pohled na portál kláštera Piaristů v Panské ulici (dům čp. 892 na Novém Městě).,kol.1905,46x,318D8798296611E6846C406186009F3A,F 392,1905-01-01,1905-12-31,14.42643,50.08509,regional.address,suggest,"Fink, František (1854-1935)",,0.0,[],[]
pozitiv,Pohled na domy čp. 203 a čp. 204 v Bělohorské ulici v Břevnově.,28.8.1936,45x,B0DAA826BA9D11E5A77074D435EEBE90,I 11395,1936-08-28,1936-08-28,14.3645,50.08938,regional.address,geocode,"Alexander, Antonín (1892-působnost do 1948)",,,[],[]
negativ,Pohled na románskou apsidu kostela sv. Jana Křtitele na nároží Smetanova nábřeží a ulice Na Zábradlí na Starém Městě.,1896,30x,A0C4FF24B67611DF820F00166F1163D4,VIII 525,1896-01-01,1896-12-31,14.41417,50.08499,regional.address,geocode,"Eckert, Jindřich (1833-1905)",,,[],[]
pozitiv,Celkový pohled z Palmovky na libeňský plynojem.,1959,129x,3AB3F11C1B2011E5A99974D435EEBE90,I 11228,1959-01-01,1959-12-31,14.47493,50.10235,regional.address,geocode,"Roleček, Jiří",,,[],[]
pozitiv,Pohled do údolí Čimického potoka. V pozadí vpravo Bohnice s věží vodárny a s budovami Ústavu choromyslných. Součást dvoudílného panoramatu.,23.9.1924,38x,57B659FE457111E99C7074D435EEBE90,A 1249,1924-09-23,1924-09-23,14.42399,50.13341,regional.address,geocode,"Alexander, Antonín (1892-působnost do 1948)",,0.0,[],[]
pozitiv,Pohled do Prokopského údolí s kostelem sv. Prokopa na skále.,11.10.1925,74x,A0C5031BB67611DF820F00166F1163D4,I 4550,1925-10-11,1925-10-11,14.38197,50.0411,regional.address,geocode,"Alexander, Antonín (1892-působnost do 1948)",,,[],[]
pozitiv,Pohled na sochu boha Merkura (Hermes) Vojtěcha Suchardy v parku usedlosti Kajetánka (dům čp. 30) v Břevnově.,26.4.1944,61x,B7D8705CB61611E58B3BD4BED94BB14D,I 11431,1944-04-26,1944-04-26,14.36874,50.08742,regional.address,geocode,"Alexander, Antonín (1892-působnost do 1948)",,,[],[]
pozitiv,Pohled na okno jižního průčelí Staroměstské radnice (domu čp. 1) - s nápisem PRAGA CAPUT REGNI - po rekonstrukci.,1988,50x,A118733FB67611DF820F00166F1163D4,I 4470,1988-01-01,1988-12-31,14.42009,50.087,regional.address,suggest,"Rameš, František",,,[],[]
pozitiv,Pohled na Gröbeho vilu (dům čp. 58 na Vinohradech) - severní průčelí.,12.7.1931,52x,A1187B91B67611DF820F00166F1163D4,I 1840,1931-07-12,1931-07-12,14.44502,50.06921,regional.address,geocode,"Alexander, Antonín (1892-působnost do 1948)",,,[],[]
pozitiv,Portrét Antonína Gindelyho.,[1863-1905],154x,A1188C52B67611DF820F00166F1163D4,I 8615,,,14.39989,50.08699,regional.address,geocode,"Eckert, Jindřich (1833-1905)",Datace neznámá. Za účelem vyhledávání byla nastavena na časový rozsah celé sbírky.,0.0,[],[]
negativ,"Pohled od Slovanského ostrova na most Legií, v pozadí Pražský hrad.",kol.1977,32x,A1187462B67611DF820F00166F1163D4,VII 361,1977-01-01,1977-12-31,14.41319,50.07744,regional.address,geocode,"Chalupníček, Miroslav -, Chalupníčková, Věra (dokument 1941-1948)",,,[],[]
pozitiv,"Postava krále z 2.pol. 13.stol. ""Mladý král"" - nástěnná malba z domu čp. 102 na Mariánském náměstí na Starém Městě. Dnes v Muzeu hl. města Prahy.",1906,72x,A1188167B67611DF820F00166F1163D4,VI 1/2 b,1906-01-01,1906-12-31,14.41783,50.08711,regional.address,geocode,"Kříženecký, Rudolf (dokument 1897-1931)",Autorství R. Kříženeckého není jisté.,,[],[]
CD-ROM,Pohled na část Císařského ostrova (Trojského) v okolí Trojské lávky při povodni 9.8.2002.,9.8.2002,18x,A1188C4AB67611DF820F00166F1163D4,XXII 1/23 a,2002-08-09,2002-08-09,14.41665,50.11435,regional.street,suggest,"Malec, Milan - Malcová, Alena",,0.0,[],[]
negativ,Pohled na Staroměstské náměstí s mariánským sloupem při demonstraci socialistů.,28.11.1905,38x,A825C2DE0E2F11E2935B6C626D41E503,XII 1082,1905-11-28,1905-11-28,14.41994,50.08663,regional.address,geocode,Eckert-ateliér,,0.0,[],[]
negativ,Pohled do interiéru starého královského paláce na pražském hradě - dvorská kancelář.,1904,14x,A118817DB67611DF820F00166F1163D4,VIII 372,1904-01-01,1904-12-31,14.40176,50.09062,poi,suggest,"Eckert, Jindřich (1833-1905)",,,[],[]
pozitiv,Pohled z Masné ulice do Štupartské ulice s domem čp. 977 (vlevo) a 633 (vpravo) na Starém Městě. V pozadí věže kostela sv. Jakuba.,27.9.1944,41x,A1188827B67611DF820F00166F1163D4,I 9171,1944-09-27,1944-09-27,14.42413,50.08877,regional.address,geocode,"Alexander, Antonín (1892-působnost do 1948)",,,[],[]
pozitiv,Pohled na most císaře Františka I. V pozadí Staré Město.,,78x,A14CE1EBB67611DF820F00166F1163D4,I 8691,,,14.41029,50.08135,regional.street,suggest,"Fridrich, František (1829-1892)","Fridrich, František - Reach, Zikmund (repro)",,[],[]
pozitiv,Pohled na vodárnu s věží (dům čp. 500 v Holešovicích).,1906,17x,F7FD2C3A298F11E6846C406186009F3A,F 461,1906-01-01,1906-12-31,14.41987,50.10017,regional.address,geocode,"Fink, František (1854-1935)",,0.0,[],[]
pozitiv,Pohled na stavbu přístavu v Libni - slavnostní zahájení.,1892,72x,A14CE8ABB67611DF820F00166F1163D4,VI 12/12 a,1892-01-01,1892-12-31,14.46997,50.1041,regional.address,geocode,,,,[],[]
pozitiv,Pohled na dům čp. 359 v Martinské ulici na Starém Městě před přestavbou.,květen 1912,21x,A14CDC08B67611DF820F00166F1163D4,VI 1/21 b,1912-05-01,1912-05-31,14.41903,50.08307,regional.address,geocode,,,,[],[]
pozitiv,Pohled na cihelnu v Bohnicích.,,20x,A0C4F98DB67611DF820F00166F1163D4,I 4371,,,14.41014,50.08848,regional.street,suggest,"Růžička, Jar.",,,[],[]
pozitiv,Dostavba vodárny v Podolí (dům čp. 15) v roce 1958.,1958,85x,A1186885B67611DF820F00166F1163D4,I 1572,1958-01-01,1958-12-31,14.42059,50.05712,regional.address,geocode,"Fleissig, Josef",,,[],[]
pozitiv,Pohled na věž malostranské vodárny a zdymadlo na Smíchově. Vlevo cíp Židovského ostrova. V pozadí Palackého most.,13.5.1928,81x,A11872C8B67611DF820F00166F1163D4,I 8761,1928-05-13,1928-05-13,14.40929,50.0761,poi,suggest,"Alexander, Antonín (1892-působnost do 1948)",,,[],[]
pozitiv,Pohled na Karlův most při povodni 3.9.1890. V popředí naplavené dříví. V pozadí Malá Strana a Pražský hrad.,3.9.1890,56x,A0C51260B67611DF820F00166F1163D4,VI 39/14,1890-09-03,1890-09-03,14.41405,50.08641,regional.address,geocode,"Mulač, Jan",,,[],[]
pozitiv,Cvičení žen během VII. všesokolského sletu na Letné v Holešovicích.,27.-30.6.1920,44x,237E84E887D911E79100406186009F3A,I 12193,,,14.42032,50.09595,regional.address,geocode,"Vojta, Tomáš (1885-1934)",,,[],[]
negativ,Celkový pohled od západu přes Vltavu na Rudolfinum před dokončením (dům čp. 79 na Starém Městě) na Starém Městě.,kol.1884,25x,002322E8769411E2BF17525400E46D25,VIII 1220,1884-01-01,1884-12-31,14.41521,50.09017,regional.address,geocode,"Eckert, Jindřich (1833-1905)",,,[],[]
pozitiv,Pohled do dvora domu čp. 72 na Hradčanech (voršilský klášter - dělostřelecká kasárna). Vpravo kostel sv. Jana Nepomuckého.,,38x,A14CEA70B67611DF820F00166F1163D4,VI 59/17,,,14.39366,50.09013,regional.address,geocode,"Eckert, Jindřich (1833-1905)","Eckert, Jindřich - Eckert-ateliér (repro)",,[],[]
negativ,"Pohled na dům čp. 900 na nároží ulic Josefovské, Cikánské a Kostelní na Starém Městě. V pozadí kostel sv. Ducha.",kol.1900,51x,A0C50DFDB67611DF820F00166F1163D4,VIII 886,1900-01-01,1900-12-31,14.4202,50.0913,regional.address,geocode,"Eckert, Jindřich (1833-1905)",,,[],[]
pozitiv,Pohled na Jungmannovo náměstí z Perlové ulice. Vpravo dům čp. 36 (Thunovský palác) na Novém Městě na nároží ulic Národní a Jungmannovy. Vlevo dům čp. 752 na Jungmannově náměstí a část pomníku Josefa Jungmanna. Uprostřed průhled Jungmannovou ulicí.,20.7.1911,94x,A14CEA6CB67611DF820F00166F1163D4,VI 53/13,1911-07-20,1911-07-20,14.42213,50.08248,regional.address,geocode,Eckert-ateliér,,,[],[]
pozitiv,Pohled na plastiku vázy v zahradě Trojského zámku (dům čp. 1 v Troji).,,23x,A14CE984B67611DF820F00166F1163D4,VI 41/55,,,14.4124,50.11648,regional.address,geocode,,,,[],[]
pozitiv,"Pohled do ulice U Staré školy. Uprostřed dům čp. 156 v Josefově, část Španělské synagogy čp. 141 v Josefově vpravo.",30.10.1909,18x,08172307ca414d858c9eeba6621fb0ee,V 78/12 a,1909-10-30,1909-10-30,14.41868,50.08806,regional.address,geocode,"Kříženecký, Jan (1868-1921)",,0.0,[],[]
pozitiv,Celkový pohled na kostel Zesnutí přesvaté Bohorodice na Olšanských hřbitovech na Žižkově při závěrečných stavebních úpravách (schodiště).,1925,80x,8017CD95510211E38E526C626D41E503,I 9816,1925-01-01,1925-12-31,14.47557,50.08153,poi,suggest,"Vojta, Tomáš (1885-1934)",,,[],[]
negativ,Celkový pohled na východní průčelí domu čp. 130 (Zámečnice) v ulici Nad Zámečnicí na Smíchově.,,37x,A11883F3B67611DF820F00166F1163D4,X 1495,,,14.36867,50.07049,regional.address,geocode,,,,[],[]
pozitiv,"Průhled ulicí Jánský vršek na Malé Straně. Vlevo dům čp. 240, vpravo dům čp. 313 s čp. 314. V pozadí dům čp. 220 v Nerudově ulici.",17.3.1908,71x,A0C519B4B67611DF820F00166F1163D4,II 101,1908-03-17,1908-03-17,14.39841,50.08853,regional.address,geocode,"Kříženecký, Jan (1868-1921)",,,[],[]
negativ,Průhled Vlašskou ulicí k Tržišti - vlevo kostel sv. Karla Boromejského při nemocnici Milosrdných sester sv. Karla Boromejského pod Petřínem (dům čp. 336 na Malé Straně).,kol.1925,74x,12D0815FF8A711E4808074D435EEBE90,X 10390,1925-01-01,1925-12-31,14.39624,50.08704,regional.address,geocode,Eckert-ateliér,,,[],[]
pozitiv,Průhled údolím v zahradě usedlosti Cibulka v Košířích (dům čp. 118) k jihu.,říjen 1924,53x,A1188539B67611DF820F00166F1163D4,I 4611,1924-10-01,1924-10-31,14.35655,50.06696,regional.address,geocode,"Vojta, Tomáš (1885-1934)",,,[],[]
negativ,Pohled na staveniště školy na Karlově. V pozadí kostel Nanebevzetí P. Marie a sv. Karla Velikého na Karlově.,kol.1892,34x,0DE71956753211E2BF16525400E46D25,VIII 1193,1892-01-01,1892-12-31,14.42851,50.0692,regional.address,geocode,"Eckert, Jindřich (1833-1905)",,,[],[]
pozitiv,Pohled na hroby na Malostranském hřbitově na Smíchově - původní stav. Rodina Bělských.,23.3.1927,61x,D98D17792FC011E5A57D74D435EEBE90,I 11275,1927-03-23,1927-03-23,14.39148,50.07167,poi,suggest,"Alexander, Antonín (1892-působnost do 1948)",,,[],[]
pozitiv,Pohled přes Vltavu na osvětlený kostel sv. Petra a Pavla na Vyšehradě při příležitosti 10. výročí samostatnosti Československé republiky.,28.10.1928,44x,66D1C6ED17E411E891E8406186009F3A,I 12066,1928-10-28,1928-10-28,14.41785,50.06442,poi,suggest,"Vopravil, Josef (1902-1972)",Autorství J. Vopravila není jisté.,,[],[]
pozitiv,"Pohled na Hostivař z Hostivařské ulice do míst dnešní Švehlovy ulice (z křižovatky ulic Hornoměcholupská, Hostivařská, Švehlova a Průmyslová).",15.6.1930,92x,A14CE2E8B67611DF820F00166F1163D4,I 9066,1930-06-15,1930-06-15,14.52596,50.05095,regional.address,geocode,"Alexander, Antonín (1892-působnost do 1948)",,,[],[]
negativ,Pohled do interiéru Pavilonu král. hlavního města Prahy na výstavišti v Bubenči při Jubilejní výstavě 1891 - obecní budovy.,,53x,BDD8AAAABEDA11E2A393D4BED94BB14D,VIII 1681,,,14.43163,50.10528,regional.address,geocode,"Eckert, Jindřich (1833-1905)",,,[],[]
pozitiv,Okupace 1939-1945 - Nové Město - objekty pobořené náletem spojenců 14.2.1945: Karlovo náměstí - podzemní kryt v jižní části sadů rozmetaný zásahem a tlakem vzduchu.,27.4.1945,129x,A11871B1B67611DF820F00166F1163D4,I 1800,1945-04-27,1945-04-27,14.42112,50.07643,regional.address,geocode,"Alexander, Antonín (1892-působnost do 1948)",,,[],[]
negativ,Pohled do interiéru kostela sv. Ignáce na Karlově náměstí na Novém Městě - hlavní loď směrem k oltáři. Slavnostní výzdoba s letopočtem 1904.,5.12.1904,40x,A11884B4B67611DF820F00166F1163D4,VIII 693,1904-12-05,1904-12-05,14.419,50.07337,regional.address,geocode,"Eckert, Jindřich (1833-1905)",,,[],[]
negativ,Pohled na náhrobek Jiřího Popele z Lobkovic v chrámu sv. Víta na Pražském hradě.,3.3.1910,30x,387B815C5C4E11E0801C0010DCCFBEC5,XII 267,1910-03-03,1910-03-03,14.4006,50.09089,poi,suggest,Eckert-ateliér,,0.0,[],[]
pozitiv,Celkový pohled na kostel sv. Václava ve Vršovicích na náměstí Svatopluka Čecha.,18.8.1942,66x,6107B5AC272B11E287E86C626D41E503,I 9651,1942-08-18,1942-08-18,14.45924,50.06981,regional.address,geocode,"Alexander, Antonín (1892-působnost do 1948)",,,[],[]
pozitiv,Pohled do knihovny Lobkovického paláce čp. 347 (Černínský-Přehořovský palác) na Malé Straně.,kol.1925,32x,A0C4FDCCB67611DF820F00166F1163D4,I 8509,1925-01-01,1925-12-31,14.39803,50.08729,regional.address,geocode,"Vojta, Tomáš (1885-1934)",,,[],[]
pozitiv,Pohled z prvního dvora na garáže při středním křídle domu čp. 2 (pivovar) v Košířích.,4.2.1957,46x,A0C51839B67611DF820F00166F1163D4,I 9285,1957-02-04,1957-02-04,14.38505,50.06972,regional.address,geocode,,,,[],[]
pozitiv,Sportovní utkání - fotbal - atletika.,1927,22x,A14CE402B67611DF820F00166F1163D4,I 9275,1927-01-01,1927-12-31,14.43287,50.09886,regional.address,geocode,"Vojta, Tomáš (1885-1934)",,,[],[]
pozitiv,Pohled do kaple ve věži Novoměstské radnice (dům čp. 1-2 na Novém Městě) - směrem k oltáři.,15.6.1904,55x,A14CE783B67611DF820F00166F1163D4,VI 6/1 c,1904-06-15,1904-06-15,14.4213,50.07812,regional.address,geocode,"Eckert, Jindřich (1833-1905)",,,[],[]
pozitiv,"Pohled na Prahu z Petřína. Součást panoramatu - Karlův most a Staré Město.
                    
                
                    
                  V popředí Kampa s domem čp. 503 (Sovovy mlýny) na Malé Straně. Za řekou uprostřed Novotného lávka a nábřeží.",1863,110x,A0C4FDB0B67611DF820F00166F1163D4,VI 13/47,1863-01-01,1863-12-31,14.40839,50.08359,regional.address,geocode,"Schmitz, Anselm (1831-1903)",,,[],[]
pozitiv,Pohled do Rudolfovy galerie na Pražském hradě (Německý sál).,29.4.-17.7.1904,16x,A0C515D2B67611DF820F00166F1163D4,VI 10/16 a,,,14.39861,50.08948,regional.address,geocode,"Eckert, Jindřich (1833-1905)",,,[],[]
negativ,Pohled na stavbu tunelu kanalizace u Botiče.,18.10.1907,45x,37212EE18B1411E2BF22525400E46D25,VIII 1400,1907-10-18,1907-10-18,14.41594,50.06705,regional.address,geocode,Eckert-ateliér,,,[],[]
pozitiv,Celkový pohled na kostel sv. Antonína z Padovy v Holešovicích na Strossmayerovo náměstí - západní a severní průčelí.,31.8.1937,64x,883ABD6F669211E481D7D4BED94BB14D,I 11048,1937-08-31,1937-08-31,14.43474,50.09841,regional.address,geocode,"Alexander, Antonín (1892-působnost do 1948)",,,[],[]
pozitiv,"Pohled z nároží bastionu 36 vyšehradských hradeb jihu na Podolí a vltavské údolí. V popředí podolské sanatorium (dům čp. 157). V pozadí uprostřed Podolské nábřeží, přístav, přístavní hráz s dřevěnou budovou Yacht klubu (dům čp. 1148 v Podolí). Dále v pozadí Veslařský ostrov. Součást panoramatu. Součást panoramatu.",10.9.1923,106x,62F22E30612511E995BC74D435EEBE90,Voj 243,1923-09-10,1923-09-10,14.41735,50.06113,regional.address,geocode,"Vojta, Tomáš (1885-1934)",,0.0,[],[]
pozitiv,"Pohled na naplavené dříví na Vltavě před Negrelliho viaduktem v Bubnech při povodni 25. a 26. května roku 1872. ""Uiberschwemmumg in Prag 1872"" (na kartonu).",květen 1872,90x,3537A162D60811E8A01574D435EEBE90,V 24/11,1872-05-01,1872-05-31,14.44069,50.09758,poi,suggest,"Cikánek, Ferdinand",,,[],[]
pozitiv,Pohled na nový dům čp. 415 na nároží ulic Vyšehradské a Na Hrobci na Novém Městě.,2.7.1933,84x,3E2EA8BF6FB611E8911174D435EEBE90,A 7948,1933-07-02,1933-07-02,14.41704,50.06846,regional.address,geocode,"Alexander, Antonín (1892-působnost do 1948)",,0.0,[],[]
pozitiv,Pohled na stavbu nábřežní zdi na Rohanském ostrově. V pozadí Negrelliho viadukt.,12.7.1909,90x,BB6756AFF1E211E5A523000C76270B94,I 11631,1909-07-12,1909-07-12,14.45142,50.09511,regional.address,geocode,,,,[],[]
pozitiv,Pohled na dům čp. 310 (pivovar U Šálků) na nároží Karlova náměstí a Resslovy ulice na Novém Městě - pohled z Karlova náměstí.,1938,109x,A1186B88B67611DF820F00166F1163D4,I 4846,1938-01-01,1938-12-31,14.53102,50.05126,regional.address,geocode,,,,[],[]
pozitiv,Pražské povstání - květen 1945. Interiér Staroměstské radnice po požáru - portál presidia.,květen 1945,185x,A11873ECB67611DF820F00166F1163D4,I 5433,1945-05-01,1945-05-31,14.42009,50.087,regional.address,suggest,"Zeman, Josef",,,[],[]
pozitiv,Rudá armáda v Praze 9.5.1945 - vojáci na tanku před Staroměstskou radnicí.,9.5.1945,82x,A11881AAB67611DF820F00166F1163D4,I 5850,1945-05-09,1945-05-09,14.42009,50.087,regional.address,suggest,"Pacovský, Jaroslav",,,[],[]
pozitiv,Celkový pohled na dům čp. 31 (budova statku) v Holešovicích. Vlevo Partyzánská (dnešní ) ulice.,1959,53x,2A078EC4787611E3BA46406186009F3A,I 9836,1959-01-01,1959-12-31,14.43637,50.10853,regional.address,geocode,"Hnilička, Eduard (1887-1967)",,,[],[]
negativ,Pohled do dvora domu čp. 145 na Starém Městě v Karlově ulici.,20.9.1903,74x,3849262E254211E0BDC9000C766D2371,XII 163,1903-09-20,1903-09-20,14.41894,50.08635,regional.address,geocode,"Eckert, Jindřich (1833-1905)",,0.0,[],[]
pozitiv,Pohled na severozápadní průčelí synagogy v Michli (dům čp. 124).,24.4.1944,126x,A0C50FA6B67611DF820F00166F1163D4,I 814,1944-04-24,1944-04-24,14.45008,50.05576,regional.address,geocode,"Alexander, Antonín (1892-působnost do 1948)",,,[],[]
negativ,Pohled na Nové lázně (dům čp. 228) od ústí ulice Na Struze krátce před zbořením. Vlevo domy čp. 227 a 1648 na Novém Městě.,14.8.1903,26x,A14CE124B67611DF820F00166F1163D4,VIII 340,1903-08-14,1903-08-14,14.41404,50.08008,regional.address,geocode,"Eckert, Jindřich (1833-1905)",,,[],[]
pozitiv,Pohled na bývalý Konvikt (dům čp. 291) a zadní průčelí kostela sv. Bartoloměje na Starém Městě.,kol. 1890,31x,E534A93BCBC011E4AB2C406186009F3A,V 5/1,,,14.41756,50.08307,regional.address,geocode,"Němeček, B.",,,[],[]
pozitiv,Pohled na dům čp. 795 (Aehrenthalský palác) na nároží Václavského náměstí a Štěpánské ulice. Vlevo dům čp. 626 ve Štěpánské ulici na Novém Městě.,kol.1900,49x,A14CE864B67611DF820F00166F1163D4,VI 7/41 b,1900-01-01,1900-12-31,14.42667,50.08149,regional.address,geocode,,,,[],[]
negativ,Pohled na nároží Staroměstské radnice s arkýřem na Staroměstském náměstí (dům čp. 1 na Starém Městě).,,35x,7EE072BCD0AA11EABE1F74D435EEBE90,IX 391 b,,,14.42009,50.087,regional.address,suggest,Bellmann-ateliér,,,[],[]
negativ,"Pohled na dům čp. 96 (""U Hradu"") na nároží ulic Kinského (dnes Štefánikova) a Holečkovy na Smíchově - dnes čp. 1.",[1863-1945],109x,27BDEF78663411E2A1036C626D41E503,XII 1340,,,14.41055,50.06315,regional.address,geocode,Eckert-ateliér,Datace neznámá. Za účelem vyhledávání byla nastavena na časový rozsah celé sbírky.,0.0,[],[]
negativ,Pohled do platanové aleje v sadech na Letné.,16.10.1907,38x,DBF4101CE02511E3A3D40024BE7CD9AC,XI 447,1907-10-16,1907-10-16,14.42324,50.09637,regional.address,geocode,"Kříženecký, Jan (1868-1921)",,0.0,[],[]
pozitiv,Pohled do zahrady usedlosti Cibulka v Košířích (dům čp. 118) - od Jupiterovy studánky k čínskému pavilonu.,říjen 1924,58x,A0C4F569B67611DF820F00166F1163D4,I 4604,1924-10-01,1924-10-31,14.35655,50.06696,regional.address,geocode,"Vojta, Tomáš (1885-1934)",,,[],[]
negativ,Pohled do Fialkové ulice (zleva) s domy čp. 207 a 279 (v pozadí čp. 208) v Josefově krátce před zbořením.,1.4.1905,45x,A0C4FC1AB67611DF820F00166F1163D4,VIII 32,1905-04-01,1905-04-01,14.41792,50.0913,regional.address,geocode,Eckert-ateliér,,,[],[]
pozitiv,Pražské povstání - květen 1945. Pohled ze zničené místnosti jižního křídla Pražského hradu na Prahu V popředí věž kostela sv. Mikuláše.,květen 1945,50x,A0C50D0AB67611DF820F00166F1163D4,I 8330,1945-05-01,1945-05-31,14.39861,50.08948,regional.address,geocode,,,,[],[]
pozitiv,Pohled na vstupní portál domu čp. 130 (palác Deymův) ve Voršilské ulici na Novém Městě.,4.5.1906,21x,A0C4F877B67611DF820F00166F1163D4,VI 18/8,1906-05-04,1906-05-04,14.4168,50.08091,regional.address,geocode,,,,[],[]
negativ,Pohled na východní stranu chrámu sv. Víta při přestavbě z věže kostela sv. Jiří na Pražském hradě.,10.8.1905,32x,A14CEAA5B67611DF820F00166F1163D4,XII 178,1905-08-10,1905-08-10,14.40231,50.09093,regional.address,geocode,Eckert-ateliér,,0.0,[],[]
negativ,Panoramatický pohled na Vršovice ze stanoviště na Bohdalci.,kol.1960,58x,A0C50627B67611DF820F00166F1163D4,VII 20,1960-01-01,1960-12-31,14.47706,50.06109,regional.address,geocode,"Chalupníček, Miroslav -, Chalupníčková, Věra (dokument 1941-1948)",,,[],[]
pozitiv,Pohled do obory Hvězda v Liboci s letohrádkem Hvězda při slavnosti otevření Jiráskova muzea roku 1951.,1951,43x,A14CDA69B67611DF820F00166F1163D4,I 4433,1951-01-01,1951-12-31,14.3262,50.08337,poi,suggest,,,,[],[]
pozitiv,"Panoramatický pohled z výšky na část Smíchova s kartounkou Portheimů. V popředí vlevo hradební příkop a uprostřed vojenské cvičiště ""V lesíku"".",,235x,A14CE3B0B67611DF820F00166F1163D4,I 1706,,,14.40404,50.07402,regional.address,geocode,"Fridrich, František (1829-1892)","Fridrich, František - Reach, Zikmund (repro)",,[],[]
pozitiv,Pohled část hlavního průčelí budovy Ústavu pro zaopatřování slepců (Dolní Palata) - dům čp. 737 na Smíchově.,kol.1950,65x,A0C4F86DB67611DF820F00166F1163D4,I 1754,1950-01-01,1950-12-31,14.38547,50.07583,regional.address,geocode,"Pacovský, Jaroslav",,,[],[]
pozitiv,"Pohled na Uhelný trh s domy čp. 424, 425 a 512 (škola) západní strany na Starém Městě. Uprostřed Wimmerova kašna.",kol.1955,183x,A1187603B67611DF820F00166F1163D4,I 35,1955-01-01,1955-12-31,14.42004,50.08397,regional.address,suggest,"Zeman, Josef",,,[],[]
negativ,Pohled na dům čp. 208 v Myslíkově ulici na Novém Městě.,14.2.1906,22x,306204FFAEB111E39FAD0024BE7CD9AC,XI 198,1906-02-14,1906-02-14,14.41569,50.0776,regional.address,geocode,"Kříženecký, Jan (1868-1921)",,0.0,[],[]
mapa,"List 3 plánu Prahy a okolí z let 1910-1914 (nakreslené stavebním úřadem, vydané nákladem obce Pražské, reprodukce Unie v Praze) se zákresy stanovišť fotografů v rámci akce Památkového sboru fotografování pražských památek a panoramat periferních oblastí ve 20., 30. a 40. letech 20. století.",1910-1914 - 1923,185x,64A84B2907F011E7A783406186009F3A,XXXII 1/3,,,14.39656,50.10114,regional.address,geocode,,,0.0,[],[]
negativ,Pohled na Valdštejnské náměstí s Auerspergským palácem vlevo (dům čp. 16 na Malé Straně) a s Ledeburským palácem (dům čp. 162 na Malé Straně).,3.6.1902,22x,A0C5195BB67611DF820F00166F1163D4,VIII 49,1902-06-03,1902-06-03,14.40488,50.0899,regional.address,geocode,"Eckert, Jindřich (1833-1905)",,,[],[]
pozitiv,"Reprodukce akvarelu Jana Ranzmayera: Bílý salonek hraběnky Clam-Gallasové v Clam-Gallasově paláci, 1863 (dům čp. 158 na Starém Městě) - místnost č. 76 ve 2. patře.",,47x,A0C51941B67611DF820F00166F1163D4,I 8311,,,14.41779,50.08642,regional.address,geocode,,,,[],[]
pozitiv,Pohled na budovu Motokovu (City Empiria) - dům čp. 1716/2b ve Hvězdově ulici v Nuslích.,1978,71x,D91F7418D3B111E4BF0774D435EEBE90,I 11173,1978-01-01,1978-12-31,14.43614,50.05042,regional.address,geocode,"Jelínková, Jana (1951-)",,,[],[]
negativ,"Pohled na východní stranu Staroměstského náměstí s domy čp. (zleva) 608, 606, 605 a 604. V pozadí část věže kostela P. Marie před Týnem. Třetí část šestidílného panoramatu.",1909,61x,3FD7EE472A3011E9A7CF406186009F3A,XI 5237,1909-01-01,1909-12-31,14.42203,50.08761,regional.address,geocode,"Kříženecký, Jan (1868-1921)",,0.0,[],[]
negativ,Celkový pohled na dům čp. 74 na nároží ulic Spálené (v popředí) a Purkyňovy (vlevo) na Novém Městě.,,23x,f353e8ace78445f3815b3e1cd68b3ea6,X 2989,,,14.42007,50.08113,regional.address,geocode,"Reach, Zikmund (1859-1935)",,,[],[]
pozitiv,Primátor Adolf Svoboda po příletu na ruzyňské letiště.,1956,13x,334da1ded5d54228ae5aa38f06569d24,I 12951,1956-01-01,1956-12-31,14.29276,50.09657,regional.address,geocode,,,,[],[]
pozitiv,Pohled na kostel Povýšení sv. Kříže s farou (dům čp. 12) v dněšní Čajkovského ulici na Žižkově. V pozadí zadní části domů v Kubelíkově ulici.,24.3.1933,75x,CAB7D58BE15311E6B986406186009F3A,A 7678,1933-03-24,1933-03-24,14.45672,50.07879,regional.address,geocode,"Alexander, Antonín (1892-působnost do 1948)",,0.0,[],[]
pozitiv,Pohled na fragmenty gotické výzdoby v domě čp. 16 na Starém Městě (Andělská kolej) v Mikulášské ulici (dnes náměstí Franze Kafky).,1909,33x,EE1DBBDC808A11E4AAB4406186009F3A,V 1/7 a,1909-01-01,1909-12-31,14.41873,50.08783,regional.address,geocode,"Kříženecký, Jan (1868-1921)",,,[],[]
pozitiv,Pohled do údolí Čimického potoka. V pozadí vlevo mezi stromy věž kostela sv. Václava v Ústavu choromyslných v Bohnicích. Součást dvoudílného panoramatu.,23.9.1924,36x,9B801ECA457111E99C7074D435EEBE90,A 1250,1924-09-23,1924-09-23,14.42215,50.13324,regional.street,suggest,"Alexander, Antonín (1892-působnost do 1948)",,0.0,[],[]
negativ,Pohled na severozápadní stranu Maltézského náměstí s domy čp. 479 a čp. 293 na Malé Straně a se sousoším sv. Jana Křtitele. V pozadí věže kostela sv. Mikuláše.,[1863-1945],23x,A83A2098663B11E2A1036C626D41E503,XII 1347,,,14.40494,50.08649,regional.address,geocode,Eckert-ateliér,Datace neznámá. Za účelem vyhledávání byla nastavena na časový rozsah celé sbírky.,0.0,[],[]
pozitiv,Pohled do dvora domu čp. 412 na Výtoni (bývalá celnice) v Podskalí na Novém Městě - muži při řezání dříví u dřevníku.,,60x,A1188441B67611DF820F00166F1163D4,I 4277,,,14.41538,50.06785,regional.address,geocode,,,,[],[]
pozitiv,"Pohled na portál domu čp. 212 (""U zlaté číše"") v Nerudově ulici na Malé Straně.",23.8.1906,21x,A1187C71B67611DF820F00166F1163D4,VI 21/20,1906-08-23,1906-08-23,14.40095,50.08863,regional.address,geocode,,,,[],[]
negativ,Pohled na tzv. Jiráskovu vilu v ulici Pod Táborem (dům čp. 17 v Malešicích).,14.4.1949,51x,B8D78E002CA511E69BD5406186009F3A,X 3910,1949-04-14,1949-04-14,14.51509,50.08918,regional.address,geocode,"Vopravil, Josef (1902-1972)",,,[],[]
pozitiv,Pohled na plovárnu na Barrandovské skále z výšky. V pozadí trať a Vltava.,,114x,A0C5083CB67611DF820F00166F1163D4,II 1006,,,14.40232,50.03758,regional.address,geocode,"Illek, František - Paul, Prokop",,,[],[]
negativ,Pohled od Mánesova mostu na Palachovo náměstí a Rudolfinum (dům čp. 79 na Starém Městě) na Starém Městě.,kol.1950,59x,A14CE4F7B67611DF820F00166F1163D4,VII 5,1950-01-01,1950-12-31,14.41521,50.09017,regional.address,geocode,"Chalupníček, Miroslav -, Chalupníčková, Věra (dokument 1941-1948)",,,[],[]
pozitiv,Pohled na kostel sv. Mikuláše od Kaprovy ulice na Starém Městě po odbourání staré prelatury kostela sv. Mikuláše (dům čp. 27). V pozadí novostavba domu čp. 934 v Pařížské ulici.,15.6.1900,36x,A0C4F670B67611DF820F00166F1163D4,VI 29/36,1900-06-15,1900-06-15,14.42048,50.08805,regional.address,geocode,"Eckert, Jindřich (1833-1905)",,,[],[]
pozitiv,Pražské povstání - květen 1945. Zničené německé auto SS v Panenské ulici na Břevnově 7.5.1945.,7.5.1945,48x,A0C4FD5FB67611DF820F00166F1163D4,II 1210,1945-05-07,1945-05-07,14.56149,50.0849,regional.address,geocode,"Dub, Václav (dokumenty 1928-1983)",,,[],[]
pozitiv,Celkový pohled na dům čp. 13 v ulici V Náklích v Hodkovičkách,22.8.1959,35x,34A99107D19B11E69F29406186009F3A,I 11031,1959-08-22,1959-08-22,14.40234,50.02347,regional.address,geocode,"Hnilička, Eduard (1887-1967)",,,[],[]
negativ,Pohled na výběhy horských kopytníků v Zoologické zahradě Praha v Troji.,1979,35x,84AB0F7C293711E994E6406186009F3A,IX 18271,1979-01-01,1979-12-31,14.41108,50.11671,regional.address,geocode,"Scheufler, Pavel",,,[],[]
pozitiv,"Pohled na kříž sanktusky kostela sv. Klimenta v Klementinu (dům čp. 190, 1040) na Starém Městě.",kol.1900,39x,4791020989B111E8853174D435EEBE90,V 33/3,1900-01-01,1900-12-31,14.41659,50.08616,regional.address,geocode,"Eckert, Jindřich (1833-1905)",,,[],[]
pozitiv,Průhled Kotkovou (dnes Goetheho) ulicí v Bubenči od Kostelního náměstí (dnes Krupkovo) k severozápadu. Vlevo dům čp. 6 v Bubenči.,1.4.1925,12x,5f72b83dec5a4d5a83bda90e58bd07d5,A 1596,1925-04-01,1925-04-01,14.42574,50.10132,regional.address,geocode,"Alexander, Antonín (1892-působnost do 1948)",,0.0,[],[]
negativ,Pohled do interiéru kostela sv. Mikuláše na Malé Straně - k hlavnímu oltáři.,2.11.1911,23x,A118800BB67611DF820F00166F1163D4,VIII 487,1911-11-02,1911-11-02,14.4032,50.08835,regional.address,geocode,Eckert-ateliér,,,[],[]
negativ,Pohled do tunelu kanalizace v Bubenči - u stanice Bubeneč proti Bubnům.,kol.1900,41x,F756D92F85B011E2BF1F525400E46D25,VIII 1322,1900-01-01,1900-12-31,14.40442,50.10736,regional.address,geocode,"Eckert, Jindřich (1833-1905)",,,[],[]
negativ,Pohled na vnitřní stranu vstupní brány Jubilejní výstavy obvodu obchodní a živnostenské komory v Praze na výstavišti v Bubenči v roce 1908 pořádané k 60. výročí panování císaře Františka Josefa I.,1908,62x,D9376C97929511E59FAB406186009F3A,X 156,1908-01-01,1908-12-31,14.43056,50.10462,regional.address,geocode,,,,[],[]
pozitiv,Pohled na stavbu nábřežní zdi na Rohanském ostrově. V pozadí Negrelliho viadukt.,18.6.1909,98x,EBC5A01CF1B811E5A522000C76270B94,I 11620,1909-06-18,1909-06-18,14.45142,50.09511,regional.address,geocode,,,,[],[]
pozitiv,Pohled do zahrady domu čp. 204 na Smíchově - továrna (Richtrova přádelna).,,25x,A14CE9FDB67611DF820F00166F1163D4,VI 46/1 g,,,14.40154,50.07428,regional.address,geocode,,,,[],[]
negativ,Pohled na přijímací halu Obvodního ústavu národního zdraví (dům čp. 809) ve Vysočanech od arch. Antonína Tenzera.,kol.1955,58x,A0C50D84B67611DF820F00166F1163D4,VII 237,1955-01-01,1955-12-31,14.49565,50.09968,regional.address,geocode,"Chalupníček, Miroslav -, Chalupníčková, Věra (dokument 1941-1948)",,,[],[]
pozitiv,"Pohled na portál domu čp. 486 (""Buqouyský palác"") na Velkopřevorském náměstí na Malé Straně.",18.6.1906,26x,A1186B86B67611DF820F00166F1163D4,VI 23/29,1906-06-18,1906-06-18,14.4063,50.08592,regional.address,geocode,,,,[],[]
pozitiv,Celkový pohled na dům čp. 1203 v Novostrašnické ulici ve Strašnicích.,13.5.1923,73x,B68A684296C111E6BE20406186009F3A,A 26,1923-05-13,1923-05-13,14.50862,50.07509,regional.address,geocode,"Alexander, Antonín (1892-působnost do 1948)",,0.0,[],[]
pozitiv,Pohled do vestibulu Thunovského paláce - domu čp. 214 na Malé Straně v Nerudově ulici.,1945,16x,A14CDDB4B67611DF820F00166F1163D4,II 1295,1945-01-01,1945-12-31,14.40038,50.08859,regional.address,geocode,,,,[],[]
pozitiv,Pohled na část vilové kolonie Baba v Dejvicích.,1945-1946,125x,A0C5130EB67611DF820F00166F1163D4,I 81,1945-01-01,1946-12-31,14.38526,50.11435,regional.address,geocode,,,,[],[]
pozitiv,"Panoramatický pohled na Kobylisy a Troju od štěrkovny - jihovýchodně a jižně od Čimického háje přes vltavské údolí (od severovýchodu přes východ, jih k západu). Součást šestidílného panoramatu.",18.7.1926,43x,0940cb0f84a54713b4f67ea963242cef,A 2555,1926-07-18,1926-07-18,14.43758,50.12891,poi,suggest,"Alexander, Antonín (1892-působnost do 1948)",,0.0,[],[]
pozitiv,Pohled na bývalý hliník čp. 1 s rybníkem ve Lhotce a domky při polní cestě vedoucí od Masarykových domovů k západu.,26.5.1929,73x,7C143523548311E997EB74D435EEBE90,I 1915,1929-05-26,1929-05-26,14.44999,50.02972,regional.address,geocode,"Alexander, Antonín (1892-působnost do 1948)",,,[],[]
pozitiv,Pohled na portál Šítkovské vodárny při dnešním Masarykově nábřeží na Novém Městě.,24.4.1908,33x,A0C4F567B67611DF820F00166F1163D4,VI 19/34,1908-04-24,1908-04-24,14.41411,50.0775,regional.address,geocode,,,,[],[]
pozitiv,"Pohled na památník Českým ženám v odboji 1939-1945, Janě-Marii Valtrové, vojenské ilegální skupině Věrný pes na hřbitově Malvazinky na Smíchově.",1960,64x,A14CDE39B67611DF820F00166F1163D4,I 8770,1960-01-01,1960-12-31,14.38698,50.06196,poi,suggest,"Mikšátko, Václav",,,[],[]
pozitiv,Pohled na stavbu přístavu v Libni - slavnostní zahájení.,1892,63x,A14CE7FCB67611DF820F00166F1163D4,VI 12/12 c,1892-01-01,1892-12-31,14.46997,50.1041,regional.address,geocode,,,,[],[]
negativ,Pohled do parku na Slovanském ostrově (Žofín) - květinová váza.,kol.1900,14x,A1187253B67611DF820F00166F1163D4,VIII 1051,1900-01-01,1900-12-31,14.41283,50.07924,regional.address,geocode,"Eckert, Jindřich (1833-1905)",,,[],[]
pozitiv,Pohled na dolní průčelí domu čp. 101 (Černínský palác) s portálem na Loretánském náměstí na Hradčanech.,21.8.1907,24x,A1188756B67611DF820F00166F1163D4,VI 24/18,1907-08-21,1907-08-21,14.39071,50.08877,regional.address,geocode,,,,[],[]
negativ,Pohled na levý oltář v kostele sv. Jiljí v Husově ulici na Starém Městě.,kol.1910,22x,AC602DF2609C11E293B96C626D41E503,XII 1281,1910-01-01,1910-12-31,14.41838,50.08531,regional.address,geocode,Eckert-ateliér,,0.0,[],[]
pozitiv,Pohled do Korunovační ulice s vodárenskou věží (dům čp. 500 v Holešovicích) a domem čp. 310 v Bubenči.,1911,47x,00F6E067227C11E6AC04406186009F3A,F 619,1911-01-01,1911-12-31,14.41987,50.10017,regional.address,geocode,"Fink, František (1854-1935)",,0.0,[],[]
pozitiv,Detail sochy Atlanta s hvězdným globem z věže Klementina (dům čp. 190) na Starém Městě.,5.6.1914,15x,8582E35EBDBD11E493C10024BE7CD9AC,V 4/5 a,1914-06-05,1914-06-05,14.41659,50.08616,poi,suggest,,,,[],[]
pozitiv,"Pohled na Uhelný trh (zprava) s domy čp. 416, 415, 414, 413 na Starém Městě.",17.7.1934,50x,A1188089B67611DF820F00166F1163D4,I 4403,1934-07-17,1934-07-17,14.42082,50.08373,regional.address,geocode,"Alexander, Antonín (1892-působnost do 1948)",,,[],[]
negativ,Pohled do interiéru kostela Narození Páně na Hradčanech (Loreta) - hlavní loď směrem k oltáři.,1917,20x,2F65BC21032211E293456C626D41E503,XII 626,1917-01-01,1917-12-31,14.39151,50.08925,regional.address,geocode,Eckert-ateliér,,0.0,[],[]
negativ,"Pohled na část Čechova mostu od severu směrem k nové Mikulášské (dnes Pařížské) ulici s novostavbami domů zleva čp. 884 (ve stavbě), čp. 883, čp. 206 a čp. 207 a čp. 208 (ve stavbě) na Starém Městě. Vlevo část nábřeží Na Františku, uprostřed Pařížská ulice, vpravo Sanytrová ulice (dnes 17. listopadu).",1909,177x,32C9E69F700D11E997F474D435EEBE90,XI 1155,1909-01-01,1909-12-31,14.40178,50.08868,regional.address,geocode,"Kříženecký, Jan (1868-1921)",,0.0,[],[]
pozitiv,Pohled na severovýchodní (uliční) průčelí domu čp. 19 v Havlíčkově ulici v Hostivaři.,5.7.1930,50x,A0C4F879B67611DF820F00166F1163D4,I 9096,1930-07-05,1930-07-05,14.52677,50.04957,regional.address,geocode,"Alexander, Antonín (1892-působnost do 1948)",,,[],[]
pozitiv,"Pohled do Železné ulice z křižovatky s ulicí Rytířskou. Vpravo část Stavovského divadla (dům čp. 540), vlevo část nárožního domu čp. 539 na Starém Městě.",,53x,08D2AE3215FE11E390486C626D41E503,I 9794,,,14.4228,50.08549,regional.address,geocode,Bellmann,,,[],[]
negativ,Pohled do Martinské ulice s domem čp. 417 před kostelem sv. Martina ve zdi na Starém Městě.,16.7.1904,20x,A0C516DFB67611DF820F00166F1163D4,VIII 335,1904-07-16,1904-07-16,14.4199,50.08269,regional.address,geocode,"Eckert, Jindřich (1833-1905)",,,[],[]
pozitiv,Pohled na komplex budov Pražské strojírny akc. spol. (dříve Ruston a spol.) dům čp. 145 ve Švábkách v Libni - uliční průčelí. Vpravo ulice Švábky.,24.3.1912,67x,B047B055D60511E8A01574D435EEBE90,V 18/9 b,1912-03-24,1912-03-24,14.46857,50.09989,regional.address,geocode,"Kříženecký, Jan (1868-1921)",,,[],[]
pozitiv,Pohled na budovu Magistrátu hlavního města Prahy (dům čp. 2) na Starém Městě na Mariánském náměstí.,1949,20x,90AD52CC4DA211E1A9526C626D41E503,I 9555,1949-01-01,1949-12-31,14.41783,50.08711,regional.address,geocode,,,,[],[]
pozitiv,Pohled na staré řečiště Vltavy mezi Holešovicemi a Libeňským ostrovem.,9.8.1923,102x,0FFC02B5A74511E6BBBD406186009F3A,A 152,1923-08-09,1923-08-09,14.45594,50.10334,regional.street,suggest,"Alexander, Antonín (1892-působnost do 1948)",,0.0,[],[]
pozitiv,Pohled na dům čp. 14 na Hostivařském náměstí v Hostivaři.,1970,40x,A11870E7B67611DF820F00166F1163D4,I 9100,1970-01-01,1970-12-31,14.52471,50.05069,regional.address,geocode,"Vopravil, Josef (1902-1972)",,,[],[]
negativ,"Pohled od Uhelného trhu do Rytířské ulice s domy čp. 532, 1023, 534, 535 na Starém Městě (zleva). Vpravo podloubí domů čp. 411, 410, 409.",kol.1895,34x,A11885E2B67611DF820F00166F1163D4,VIII 89,1895-01-01,1895-12-31,14.42117,50.08437,regional.address,geocode,"Eckert, Jindřich (1833-1905)",,,[],[]
negativ,Celkový pohled na dům čp. 600 (U Zlatého hřebenu) na Starém Městě na nároží ulic Celetné a Štupartské.,před 1882,81x,BAC09FE3CF8D11DFBD51000C766D2371,XII 9,1800-01-01,1881-12-31,14.42324,50.08729,regional.address,geocode,"Eckert, Jindřich (1833-1905)",,0.0,[],[]
negativ,Pohled na dům čp. 37 v Libušině ulici na Vyšehradě.,26.1.1905,29x,A0C50BEEB67611DF820F00166F1163D4,VIII 207,1905-01-26,1905-01-26,14.41574,50.06673,regional.address,geocode,Eckert-ateliér,,,[],[]
pozitiv,Panoramatický pohled do Prokopského údolí ze stanoviště nad dnešní křižovatkou ulic Slivenecké a Pražského (pod tramvajovou zastávkou Geologická). V pozadí uprostřed kostel sv. Prokopa na skále nad údolím. První část čtyřdílného panoramatu.,15.4.1926,15x,d9e08ee960314e23b56e3c2ee8149613,A 2404,1926-04-15,1926-04-15,14.38766,50.03357,regional.address,geocode,"Alexander, Antonín (1892-působnost do 1948)","On-line výstava na webu AMP ""Pražské panorama 2. část - Prokopské a Dalejské údolí"".
                    
                
                    
                  Součást panoramatu A 2404, A 2405, A 2406, A 2407.
                    
                
                    
                  List 20 bod 3
                    
                
                    
                  Plány sign. AMP XXXII.",0.0,[],[]
pozitiv,Socha apoštola Matouše z orloje Staroměstské radnice (dům čp. 1 na Starém Městě) na Staroměstském náměstí po restaurování.,říjen 1930,35x,EC51FEF2D37711E8A2B874D435EEBE90,Voj 4107,1930-10-01,1930-10-31,14.34054,50.07267,regional.address,suggest,"Vojta, Tomáš (1885-1934)",,0.0,[],[]
pozitiv,Pohled na provizorní dřevěný most na místě dnešního Libeňského mostu (úsek mezi Libeňskými ostrovy).,30.6.1925,149x,73DD079EFA6711E5B79C406186009F3A,I 11646,1925-06-30,1925-06-30,14.45594,50.10334,regional.street,suggest,"Reach, Zikmund (1859-1935)",,,[],[]
pozitiv,Pohled na portál domu čp. 460 (Vila Voračických z Paběnic) v ulici Ke Karlovu na Novém Městě.,15.5.1906,17x,A0C4FBA1B67611DF820F00166F1163D4,VI 18/18 a,1906-05-15,1906-05-15,14.42013,50.08651,regional.address,geocode,,,,[],[]
negativ,"Panoramatický pohled z Vyšehradu na Nové Město, vpravo vyšehradské hradby, vlevo ulice Na Slupi, v pozadí Petřín, Hradčany.",kol.1960,58x,A0C50EABB67611DF820F00166F1163D4,VII 327,1960-01-01,1960-12-31,14.4233,50.06216,regional.address,geocode,"Chalupníček, Miroslav -, Chalupníčková, Věra (dokument 1941-1948)",,,[],[]
negativ,Pohled na nástěnnou malbu v domě čp. 240 (Bretfeldovský palác) v Nerudově ulici na Malé Straně.,kol.1900,35x,371A16FB0ADF11E1BEC2000C766D2371,XII 404,1900-01-01,1900-12-31,14.39828,50.08841,regional.address,geocode,"Eckert, Jindřich (1833-1905)",,0.0,[],[]
pozitiv,Pohled na nárožní dům čp. 831 na rohu Václavského náměstí a Jindřišské ulice. V pozadí domy čp. 830 a 829.,1966,63x,D1018E4D1F6D11E2AA75406186009F3A,I 9630,1966-01-01,1966-12-31,14.42661,50.0825,regional.address,geocode,"Vopravil, Josef (1902-1972)",,,[],[]
pozitiv,Pohled na hrobky na Malostranském hřbitově na Smíchově při zdi do Plzeňské ulice - původní stav.,7.11.1926,87x,7A0D47D02FB811E5A57D74D435EEBE90,I 11246,1926-11-07,1926-11-07,14.39148,50.07167,poi,suggest,"Alexander, Antonín (1892-působnost do 1948)",,,[],[]
pozitiv,Pohled na usedlost Žežulka (dům čp. 79) v Dolní Šárce v Dejvicích v dnešní ulici V Šáreckém údolí.,12.4.1944,26x,06d68bdfbf1845cbae10a47d2711067d,A 15672,1944-04-12,1944-04-12,14.38706,50.10102,regional.address,geocode,"Alexander, Antonín (1892-působnost do 1948)",,0.0,[],[]
pozitiv,"Pohled na portál domu čp. 3 (""Palác Lobkowiczký"") v Jiřské ulici na Hradčanech.",2.8.1906,16x,A1186E59B67611DF820F00166F1163D4,VI 24/1,1906-08-02,1906-08-02,14.40339,50.09134,regional.address,geocode,,,,[],[]
negativ,Pohled do interiéru kostela sv. Ignáce na Karlově náměstí na Novém Městě - oltář Nejsv. srdce Ježíšova.,16.1.1904,40x,63A00E7B031C11E293456C626D41E503,XII 619,1904-01-16,1904-01-16,14.42031,50.07458,regional.street,suggest,"Eckert, Jindřich (1833-1905)",,0.0,[],[]
pozitiv,Pohled na Bertramku (dům čp. 169 na Smíchově) - západní průčelí se schodištěm do 1. patra.,5.5.1929,70x,A11882A5B67611DF820F00166F1163D4,I 8702,1929-05-05,1929-05-05,14.36225,50.02109,regional.address,geocode,"Alexander, Antonín (1892-působnost do 1948)",,,[],[]
pozitiv,"Pohled do Šamesovy ulice v Josefově. Vlevo průchod domem čp. 120, vpravo část domu čp. 118 a pavlačový dům čp. 115 v Josefově.",kol.1895,60x,FDCF853A3E9E11E1B434000BCDD04BFA,V 16/10 w,1895-01-01,1895-12-31,14.41826,50.08957,regional.address,geocode,"Eckert, Jindřich (1833-1905)",,,[],[]
pozitiv,Tribuna na Václavském náměstí 5. - 9. května 1946 při volbách.,květen 1946,120x,A0C518E2B67611DF820F00166F1163D4,I 1639,1946-05-01,1946-05-31,14.42321,50.08416,regional.address,geocode,,,,[],[]
pozitiv,Pohled na dveře v západním průčelí chrámu sv. Víta na Pražském hradě.,12.11.1906,26x,A14CE4F9B67611DF820F00166F1163D4,VI 32/16,1906-11-12,1906-11-12,14.39995,50.09041,regional.address,geocode,Eckert-ateliér,,,[],[]
pozitiv,Pohled do Šamesovy ulice uprostřed s domem čp. 122 (průchozím do Dušní ulice). Vpravo dům čp. 123 v Josefově.,kol.1895,53x,FDCF85223E9E11E1B434000BCDD04BFA,V 16/10 w2,1895-01-01,1895-12-31,14.41976,50.09087,regional.address,geocode,"Eckert, Jindřich (1833-1905)",,,[],[]
negativ,Wimmerova kašna na Betlémském náměstí na Starém Městě.,1890-1891,25x,A14CDF20B67611DF820F00166F1163D4,VIII 1015,1890-01-01,1891-12-31,14.41749,50.08425,regional.address,geocode,"Eckert, Jindřich (1833-1905)",,,[],[]
pozitiv,"Pohled do dvora domu čp. 374 (Městská věznice - hnanecká stanice - zaopatřovací ústav ""Fišpanka"") na Novém Městě v ulici Pod Slovany - skupina cikánů.",1921,57x,A0C518DAB67611DF820F00166F1163D4,II 1009,1921-01-01,1921-12-31,14.41633,50.07326,regional.address,geocode,,,,[],[]
negativ,"Pohled do interiéru Kaiseršteinského paláce (dům čp. 37) na Malé Straně v době, kdy zde bydlela Ema Destinová (1908-1914) - hudební salon.",10.12.1910,40x,514992211D1C11E287846C626D41E503,XII 1251,1910-12-10,1910-12-10,14.40471,50.08788,regional.address,geocode,Eckert-ateliér,,0.0,[],[]
negativ,Pohled do sadů na Letné se stanicí Křižíkovy elektrické dráhy.,16.10.1907,49x,064CB7A6E02B11E3A3D40024BE7CD9AC,XI 450,1907-10-16,1907-10-16,14.41261,50.09367,poi,suggest,"Kříženecký, Jan (1868-1921)",,0.0,[],[]
negativ,Celkový pohled na hlavní průčelí karlínské radnice na Karlínském náměstí (dům čp. 316).,1896-1897,65x,A1186CC1B67611DF820F00166F1163D4,VIII 20,1896-01-01,1897-12-31,14.44877,50.09077,regional.address,geocode,"Eckert, Jindřich (1833-1905)",,,[],[]
pozitiv,Bourání staroměstských domů v Dlouhé ulici na Starém Městě.,kol.1900,44x,FDCF85103E9E11E1B434000BCDD04BFA,V 16/10 k2,1900-01-01,1900-12-31,14.4269,50.09079,regional.address,geocode,,,,[],[]
pozitiv,Celkový pohled na pomník M. Jana Husa s požární nádrží z věže kostela P. Marie před Týnem.,,41x,A0C511CCB67611DF820F00166F1163D4,I 8911,,,14.41994,50.08663,regional.address,geocode,,,,[],[]
pozitiv,"Pohled na Malostranské náměstí s domy čp. 5, 4, 2 (zleva) na Malé Straně. Nad nimi věže kostela sv. Mikuláše.",1911,53x,FDCF850C3E9E11E1B434000BCDD04BFA,XII 1693 - pozitiv,1911-01-01,1911-12-31,14.42098,50.07345,regional.address,suggest,,,0.0,[],[]
CD-ROM,Pohled z Císařského ostrova (Trojského) na Trojský zámek při povodni 9.8.2002.,9.8.2002,31x,A1187EA7B67611DF820F00166F1163D4,XXII 1/18 a,2002-08-09,2002-08-09,14.4124,50.11648,regional.address,geocode,"Malec, Milan - Malcová, Alena",,0.0,[],[]
pozitiv,"Pohled na pomník ""Pražský student"" na nádvoří Klementina (dům čp. 190, 1040 na Starém Městě).",,24x,829487C5B0E011E29177406186009F3A,I 9722,,,14.4172,50.08697,regional.address,geocode,,,,[],[]
pozitiv,Pohled na stavbu přístavu v Libni - slavnostní zahájení.,1892,69x,A11882B7B67611DF820F00166F1163D4,VI 12/12 b,1892-01-01,1892-12-31,14.41735,50.06113,regional.address,geocode,,,,[],[]
negativ,Celkový pohled od Letné na most císaře Františka Josefa I. (Štefánikův). V pozadí novoměstské mlýny.,kol.1900,44x,CD91631487CC11E2BF21525400E46D25,VIII 1342,1900-01-01,1900-12-31,14.42709,50.09385,regional.street,suggest,"Eckert, Jindřich (1833-1905)",,,[],[]
pozitiv,"Pohled (zleva) na domy čp. 17, čp. 15, čp. 16 (Andělská kolej) na Starém Městě v Mikulášské ulici (dnes náměstí Franze Kafky).",6.11.1908,65x,A14CE19CB67611DF820F00166F1163D4,II 502,1908-11-06,1908-11-06,14.60193,50.02833,regional.address,geocode,"Kříženecký, Jan (1868-1921)",,,[],[]
negativ,Pohled na náhrobní desku Přemysla Otakara II. v chrámu sv. Víta na Pražském hradě.,před 1886,31x,C041AEF7903F11E080250010DCCFBEC5,XII 327,1800-01-01,1885-12-31,14.4006,50.09089,poi,suggest,"Eckert, Jindřich (1833-1905)",,0.0,[],[]
pozitiv,Pohled do Malé Fürstenberské zahrady na Malé Straně s pavilonem a s terasami.,kol.1900,26x,A0C4F7E1B67611DF820F00166F1163D4,VI 9/28 a,1900-01-01,1900-12-31,14.4062,50.09097,regional.address,geocode,"Eckert, Jindřich (1833-1905)",,,[],[]
negativ,Pohled na plastickou výzdobu kostela sv. Mikuláše na Starém Městě. Sousoší na středním rizalitu.,listopad 1905,16x,D3478E829E3911E3B7D600110989F46F,XI 67,1905-11-01,1905-11-30,14.4199,50.08778,regional.address,geocode,"Kříženecký, Jan (1868-1921)",,0.0,[],[]
negativ,Pohled do interiéru Národního domu na náměstí Míru (čp. 820 na Vinohradech) - koncertní sál.,12.11.1905,90x,A0C500D1B67611DF820F00166F1163D4,VIII 5,1905-11-12,1905-11-12,14.42804,50.08142,regional.address,geocode,Eckert-ateliér,,,[],[]
pozitiv,Pohled na Palachovo náměstí (dnešní) s domem čp. 80 (Uměleckoprůmyslová škola) na Starém Městě. Vpravo část Alšova nábřeží.,21.9.1935,56x,A14CE55EB67611DF820F00166F1163D4,I 9156,1935-09-21,1935-09-21,14.41492,50.08868,regional.address,geocode,"Alexander, Antonín (1892-působnost do 1948)",,,[],[]
negativ,Pohled na okna a chiaroscurové malby v nádvoří domu čp. 639 (Ungelt) na Starém Městě.,kol.1910,17x,97B61B5CCBD911E8A0AF74D435EEBE90,XI 1889,1910-01-01,1910-12-31,14.42698,50.0866,regional.address,geocode,"Kříženecký, Jan (1868-1921)",,0.0,[],[]
pozitiv,Pohled na bourání klášterního pivovaru v Břevnově.,po 1950,52x,1ECE0BDDBAA211E5A77074D435EEBE90,I 11407,1951-01-01,2000-12-31,14.35747,50.08511,regional.address,geocode,,,,[],[]
pozitiv,Pohled na dvorní trakt domu čp. 705 v Dlouhé ulici na Starém Městě.,1912,19x,CA587642928411E49D49406186009F3A,V 2/1 b,1912-01-01,1912-12-31,14.42308,50.08954,regional.address,geocode,"Kříženecký, Jan (1868-1921)",,,[],[]
pozitiv,Pohled na Rašínovo nábřeží s domem čp. 44 na Vyšehradě u tunelu ve Vyšehradské skále.,duben 1907,82x,A11879CFB67611DF820F00166F1163D4,II 175,1907-04-01,1907-04-30,14.41592,50.06415,regional.address,geocode,"Kříženecký, Jan (1868-1921)",,,[],[]
negativ,"Pohled do dvora domu čp. 647 (""U Štupartů"") na nároží ulic Malé Štupartské a Jakubské (vlevo) na Starém Městě před zbořením.",16.3.1911,23x,A11885F0B67611DF820F00166F1163D4,VIII 145,1911-03-16,1911-03-16,14.42481,50.08808,regional.address,geocode,Eckert-ateliér,,,[],[]
pozitiv,Pohled na dům čp. 2 (pivovar) v Košířích.,27.2.1934,53x,A14CDA4FB67611DF820F00166F1163D4,I 9281,1934-02-27,1934-02-27,14.38505,50.06972,regional.address,geocode,"Alexander, Antonín (1892-působnost do 1948)",,,[],[]
pozitiv,Pohled do interiéru kostela sv. Vojtěcha v Libni směrem k oltáři (dům čp. 599 v ulici U Meteoru).,kol.1910,62x,58BC4D5E15DA11EABE1274D435EEBE90,V 109/6,1910-01-01,1910-12-31,14.47125,50.10887,regional.address,geocode,Bellmann,,,[],[]
pozitiv,Pohled na jihozápadní stranu chrámu sv. Víta na Pražském hradě krátce po přestavbě - úprava nádvoří.,,31x,1F26E5773A1B11E3B532406186009F3A,II 1591,,,14.39995,50.09041,regional.address,geocode,"Vojta, Tomáš (1885-1934)",,,[],[]
pozitiv,Pohled na průčelí domu čp. 264 na Starém Městě do Konviktské ulice.,kol.1910,19x,A0C50884B67611DF820F00166F1163D4,II 1067,1910-01-01,1910-12-31,14.59305,50.03351,regional.address,geocode,Bruner-Dvořák,,,[],[]
pozitiv,Pohled na průčelí domu čp. 861 v Dušní ulici na Starém Městě.,27.5.1911,40x,FDCF85883E9E11E1B434000BCDD04BFA,V 2/16,1911-05-27,1911-05-27,14.42123,50.09107,regional.address,geocode,"Kříženecký, Jan (1868-1921)",,,[],[]
pozitiv,Pohled na dům čp. 101 na Vinohradech (divadlo Německé - Smetanovo - Státní opera) v Hooverově ulici (dnes Wilsonova).,1905-1915,1537x,A0C50245B67611DF820F00166F1163D4,I 1,1905-01-01,1915-12-31,14.43263,50.08071,regional.address,geocode,,,,[],[]
pozitiv,"Pohled na severní část Havelské ulice (Zelný trh) s domy (zprava) čp. 504, 505, 506, 507, 508, 509, 510, 511, 512, 513 na Starém Městě.",28.10.1900,63x,A0C512C9B67611DF820F00166F1163D4,VI 3/5 a,1900-10-28,1900-10-28,14.42122,50.08511,regional.address,geocode,"Eckert, Jindřich (1833-1905)",,,[],[]
pozitiv,Pohled na malovaný strop v domě čp. 791 v Haštalské ulici na Starém Městě.,16.1.1913,16x,9A1D41CE928A11E49D49406186009F3A,V 2/2 j,1913-01-16,1913-01-16,14.42369,50.09089,regional.address,geocode,"Kříženecký, Jan (1868-1921)",,,[],[]
pozitiv,Pražské povstání - 6.5.1945. Barikáda v Bělehradské ulici.,6.5.1945,59x,A14CE118B67611DF820F00166F1163D4,II 1244,1945-05-06,1945-05-06,14.43998,50.0648,regional.address,geocode,"Štěpánek, M.",,,[],[]
pozitiv,Pražské povstání - 5.5.1945 - na nároží Staroměstského náměstí a Železné ulice došlo kolem poledne ke střetům české policie s hlídkami příslušníků wehrmachtu.,5.5.1945,200x,A0C51463B67611DF820F00166F1163D4,I 5537,1945-05-05,1945-05-05,14.42142,50.08702,regional.address,geocode,"Fridrich, K.",,,[],[]
pozitiv,Pohled do Rudolfovy galerie na Pražském hradě (Německý sál).,,41x,14566087659011E8B6E074D435EEBE90,V 14/6,,,14.4196,50.10432,poi,suggest,"Bellmann, Carl",,,[],[]
pozitiv,Pohled do Vodičkovy ulice s domem čp. 708 na Novém Městě.,,57x,A14CE858B67611DF820F00166F1163D4,VI 7/37,,,14.48918,50.03933,regional.address,geocode,"Bellmann, Karel",,,[],[]
negativ,"Pohled do interiéru Klementina (dům čp. 190, 1040) na Starém Městě - Křížová (Křižovnická) chodba.",kol.1890,20x,1BD73D108B1711E2BF22525400E46D25,VIII 1402,1890-01-01,1890-12-31,14.41659,50.08616,poi,suggest,"Eckert, Jindřich (1833-1905)",,,[],[]
pozitiv,"Pohled na portál domu čp. 173 (""Hradčanská radnice"") v Loretánské ulici na Hradčanech.",3.7.1906,35x,A0C51A0BB67611DF820F00166F1163D4,VI 24/38,1906-07-03,1906-07-03,14.39523,50.08887,regional.address,geocode,,,,[],[]
negativ,Veřejný záchodek na Karlově náměstí.,10.7.1906,54x,84D8286BAEBC11E39FAD0024BE7CD9AC,XI 207,1906-07-10,1906-07-10,14.42112,50.07643,regional.address,geocode,"Kříženecký, Jan (1868-1921)",,0.0,[],[]
negativ,"Pohled na křižovatku ulic Josefovské (vodorovně), Cikánské (uprostřed) a Kostelní (vpravo). Zleva domy čp. 124 a 282 v Josefově, vpravo dům čp. 899 na Starém Městě.",25.3.1905,31x,A1186A35B67611DF820F00166F1163D4,VIII 912,1905-03-25,1905-03-25,14.41989,50.08972,regional.address,geocode,Eckert-ateliér,,,[],[]
negativ,Celkový pohled na novostavbu obřadní síně Nového židovského hřbitova na Olšanech.,kol.1893,150x,50A300040D5611E295A66C626D41E503,XII 1021,1893-01-01,1893-12-31,14.47331,50.07927,regional.address,geocode,"Eckert, Jindřich (1833-1905)",,0.0,[],[]
pozitiv,Pohled na dům čp. 41 mezi Veleslavínskou ulicí (dnes Radimova) vlevo a spojovací uličkou k návsi v Břevnově - západní strana. Vlevo dům čp. 48 v Břevnově.,1958,52x,A870292EBAA711E5A77074D435EEBE90,I 11416,1958-01-01,1958-12-31,14.36088,50.08704,regional.address,geocode,"Hnilička, Eduard (1887-1967)",,,[],[]
pozitiv,"Pohled na vstupní portál domu čp. 436 (""Železné dveře"") s domovním znamením v Michalské ulici na Starém Městě.",1906,23x,A14CE9EFB67611DF820F00166F1163D4,VI 16/6,1906-01-01,1906-12-31,14.41985,50.08566,regional.address,geocode,,,,[],[]
pozitiv,"Průhled Nerudovou ulicí (dnes Bassova) od čp. 21, vpravo zeď statku čp. 25 ve Vysočanech.",28.10.1942,59x,36D7871F6A2611E8B65D74D435EEBE90,A 14781,1942-10-28,1942-10-28,14.50215,50.10533,regional.address,geocode,"Alexander, Antonín (1892-působnost do 1948)",,0.0,[],[]
pozitiv,Pohled na dům čp. 417 (ve zrušeném kostele sv. Martina ve zdi) v Martinské ulici na Starém Městě.,kol.1900,36x,A14CE9D5B67611DF820F00166F1163D4,V 4/31 a,1900-01-01,1900-12-31,14.4199,50.08269,regional.address,geocode,,,,[],[]
pozitiv,Pohled na jižní stranu Karolina s arkýřovou kaplí na Ovocném trhu (dům čp. 541 na Starém Městě).,,28x,A118753EB67611DF820F00166F1163D4,II 1464,,,14.42352,50.08646,regional.address,geocode,,,,[],[]
negativ,Pohled na provizorní dřevěný most na místě dnešního Libeňského mostu (stál zde od roku 1903). Zleva železobetonová klenba na začátku mostu a budka výběrčího na holešovické straně.,15.5.1908,82x,A1188B16B67611DF820F00166F1163D4,VIII 161,1908-05-15,1908-05-15,14.45594,50.10334,regional.street,suggest,Eckert-ateliér,,,[],[]
diapozitiv,Erb cechu zlatníků ve staré zasedací síni Staroměstské radnice (dům čp. 1 na Starém Městě).,1987,54x,A1187526B67611DF820F00166F1163D4,III 27/28,1987-01-01,1987-12-31,14.42009,50.087,regional.address,suggest,"Rameš, František",,,[],[]
pozitiv,"Pohled na portál domu čp. 48 (""Staré probošství"") na III. hradním nádvoří Pražského hradu.",14.8.1906,10x,A1188023B67611DF820F00166F1163D4,VI 24/6,1906-08-14,1906-08-14,14.39995,50.09041,regional.address,geocode,,,,[],[]
negativ,Pohled na plastickou výzdobu kostela sv. Mikuláše na Starém Městě - hlavice polosloupu.,20.4.1908,17x,2425B4F69E3A11E3B7D600110989F46F,XI 69,1908-04-20,1908-04-20,14.41994,50.08663,regional.address,geocode,"Kříženecký, Jan (1868-1921)",,0.0,[],[]
pozitiv,Pohled na vnitřní portál kostela sv. Salvátora na Křižovnickém náměstí na Starém Městě.,1908,20x,A0C4F65AB67611DF820F00166F1163D4,VI 29/5,1908-01-01,1908-12-31,14.41405,50.08641,regional.address,geocode,,,,[],[]
pozitiv,Pohled na domy v osadě Buďánka na Smíchově.,11.8.1925,125x,A0C50C7DB67611DF820F00166F1163D4,I 318,1925-08-11,1925-08-11,14.42866,50.10204,regional.address,geocode,,"Alexander, Antonín (repro)",,[],[]
negativ,Zvony z kostela P. Marie u Alžbětinek sejmuté za 1. světové války k roztavení.,1914-1918,24x,D0D16915D37E11E8AE88406186009F3A,XI 3833,1914-01-01,1918-12-31,14.42038,50.06924,regional.address,geocode,,,0.0,[],[]
negativ,"Celkový pohled na střední část průčelí s portálem a štítem domu čp. 648 (""V Templu"") v Templové ulici na Starém Městě.",19.7.1911,19x,A0C5080AB67611DF820F00166F1163D4,VIII 597,1911-07-19,1911-07-19,14.42548,50.08808,regional.address,geocode,Eckert-ateliér,,,[],[]
negativ,Pohled na opravu pobořeného Karlova mostu po povodni 4.9.1890.,1892,36x,A14CE4E5B67611DF820F00166F1163D4,VIII 972,1892-01-01,1892-12-31,14.41126,50.0865,poi,suggest,"Eckert, Jindřich (1833-1905)",,,[],[]
pozitiv,Pohled na průvod studentů při Majáles roku 1965 v Dlouhé ulici.,1965,45x,A0C50C67B67611DF820F00166F1163D4,I 8995,1965-01-01,1965-12-31,14.4269,50.09079,regional.address,geocode,"Pacovský, Jaroslav",,,[],[]
negativ,"Stavba pomníku Palackého - ""práce sochařská. Provedení žulové sochy Palackého. Montovací lešení na osazení bronzi"".",17.6.1911,41x,A2626492CD2C11E89E2274D435EEBE90,XI 1850,1911-06-17,1911-06-17,14.41536,50.07303,regional.address,geocode,"Kříženecký, Jan (1868-1921)",,0.0,[],[]
pozitiv,Panoramatický pohled na Lysolaje a Dejvice.,8.6.1924,102x,A1188473B67611DF820F00166F1163D4,I 183,1924-06-08,1924-06-08,14.37424,50.12542,regional.address,geocode,"Alexander, Antonín (1892-působnost do 1948)",,,[],[]
pozitiv,Pohled na montáž vrat v dolní části plavební komory u ostrova Štvanice. V pozadí provizorní dřevěný most (Hlávkův).,18.9.1909,59x,EDE2A98DF74D11E5A524000C76270B94,I 11639,1909-09-18,1909-09-18,14.44021,50.09583,regional.address,geocode,,,,[],[]
pozitiv,Pohled na neorokokový strop Schönbornského paláce - domu čp. 365 na Malé Straně.,červen 1931,21x,72795F1279E211E3B274406186009F3A,I 9847,1931-06-01,1931-06-30,14.40131,50.08733,regional.address,geocode,"Vojta, Tomáš (1885-1934)",,,[],[]
mapa,"List 16 plánu Prahy a okolí z let 1910-1914 (nakreslené stavebním úřadem, vydané nákladem obce Pražské, reprodukce Unie v Praze) se zákresy stanovišť fotografů v rámci akce Památkového sboru fotografování pražských památek a panoramat periferních oblastí ve 20., 30. a 40. letech 20. století.",1910-1914 - 1923,278x,37885D3607F511E7A783406186009F3A,XXXII 1/16,,,14.4233,50.06216,regional.address,geocode,,,0.0,[],[]
pozitiv,Stavba přístavu v Libni. Pohled směrem od Budečské ulice (dnes ulice U Českých loděnic) k Voctářově ulici (v pozadí).,1894-1895,92x,81125AD16D8C11E88D0474D435EEBE90,V 18/13 u,1894-01-01,1895-12-31,14.46917,50.10746,regional.address,geocode,,,0.0,[],[]
pozitiv,Pohled na dům čp. 41 mezi Veleslavínskou ulicí (dnes Radimova) vlevo a spojovací uličkou k návsi v Břevnově - západní strana.,4.9.1943,48x,E3A799CDB85111E5AA08D4BED94BB14D,I 11412,1943-09-04,1943-09-04,14.36088,50.08704,regional.address,geocode,"Alexander, Antonín (1892-působnost do 1948)",,,[],[]
pozitiv,Pohled na průčelí domu čp. 1050 do Husitské ulice na Žižkově.,1940-1945,88x,D4827E7E81DA11E3B4B96C626D41E503,I 9898,1940-01-01,1945-12-31,14.44472,50.08708,regional.address,geocode,,,,[],[]
pozitiv,"Pohled na les východně od místa, kde stával hrad krále Václava IV. v Kunraticích, se zachovanými valy ležení Pražanů, kteří zničili hrad.",27.10.1928,28x,A1186E7FB67611DF820F00166F1163D4,I 4438,1928-10-27,1928-10-27,14.47153,50.0194,poi,suggest,"Alexander, Antonín (1892-působnost do 1948)",,,[],[]
pozitiv,Pohled na část Libně u Rokytky při povodni 4.9.1890 - naplavené dříví.,4.9.1890,108x,796B8C858B5511E8AFC474D435EEBE90,V 18/4 a,1890-09-04,1890-09-04,14.47215,50.10652,regional.address,geocode,"Mulač, Jan",,,[],[]
pozitiv,Celkový pohled na hlavní průčelí Thunovského paláce - domu čp. 214 na Malé Straně v Nerudově ulici.,2.4.1914,36x,A1188B9CB67611DF820F00166F1163D4,II 1293,1914-04-02,1914-04-02,14.40038,50.08859,regional.address,geocode,"Kříženecký, Jan (1868-1921)",,,[],[]
negativ,Celkový pohled na Karlův most od Staroměstských mlýnů. V pozadí Pražský hrad.,kol.1893,28x,130C77E47C2511E2BF19525400E46D25,VIII 1290,1893-01-01,1893-12-31,14.41294,50.08545,regional.address,geocode,"Eckert, Jindřich (1833-1905)",,,[],[]
negativ,Pohled do Senátního sále vedle Velké auly (Malá promoční síň) Karolina (dům čp. 541) na Starém Městě - v podobě před rokem 1882.,,24x,A1187631B67611DF820F00166F1163D4,VIII 934,,,14.42352,50.08646,regional.address,geocode,"Eckert, Jindřich (1833-1905)",,,[],[]
pozitiv,"Pohled na Alšovo nábřeží (zleva) s domy čp. 83, čp. 85 na Starém Městě při stavbě nábřeží. V pozadí Křižovnický klášter čp. 191 s pivovarem.",kol.1905,73x,A1187D04B67611DF820F00166F1163D4,I 8169,1905-01-01,1905-12-31,14.41406,50.08641,regional.address,geocode,"Fink, František (1854-1935)",,,[],[]
negativ,Pohled na dveře v západním průčelí chrámu sv. Víta na Pražském hradě.,12.11.1906,24x,A14CEAB7B67611DF820F00166F1163D4,XII 179,1906-11-12,1906-11-12,14.4006,50.09089,poi,suggest,Eckert-ateliér,,0.0,[],[]
pozitiv,Celkový pohled na zámeček Šelboch (Schildwarte) v Libni. V popředí dvůr domu čp. 85 v dnešní ulici Na Stráži.,21.7.1927 (repro),119x,52712B6BE8F911E9907A406186009F3A,A 3464,,,14.47231,50.12454,regional.address,geocode,,"Alexander, Antonín (repro)",0.0,[],[]
pozitiv,Pohled na zelinářskou zahradu u domu čp. 48 při Sinkulově ulici (Krušinově) v Nuslích. Vpravo ulice Na dolinách.,1.11.1930,104x,A0C5060FB67611DF820F00166F1163D4,I 1891,1930-11-01,1930-11-01,14.42996,50.05786,regional.address,geocode,"Alexander, Antonín (1892-působnost do 1948)",,,[],[]
pozitiv,Pohled do dvora domu čp. 863 s pavlačemi v Bílkově ulici na Starém Městě před zbořením roku 1907.,17.6.1906,23x,A14CEACDB67611DF820F00166F1163D4,VI 57/20,1906-06-17,1906-06-17,14.42144,50.09126,regional.address,geocode,Eckert-ateliér,,,[],[]
pozitiv,Pohled do hlavního sálu Valdštejnského paláce - jižní strana s krbem (dům čp. 17 na Malé Straně).,,16x,A0C4FC2CB67611DF820F00166F1163D4,VI 9/9 a,,,14.40535,50.09003,regional.address,geocode,"Eckert, Jindřich (1833-1905)",,,[],[]
pozitiv,Pohled na restauraci Nebozízek na Petříně - dům čp. 411 na Malé Straně.,1939-1945,40x,754B76BBD1AE11E18F8C6C626D41E503,I 4898,1939-01-01,1945-12-31,14.39885,50.0819,regional.address,geocode,,,,[],[]
pozitiv,Pohled do vstupního průchodu domu čp. 888 na Starém Městě.,1912,19x,FDCF85863E9E11E1B434000BCDD04BFA,V 2/23,1912-01-01,1912-12-31,14.42521,50.08513,regional.address,geocode,"Kříženecký, Jan (1868-1921)",,,[],[]
negativ,Pohled do interiéru domu čp. 476 (Palác Straků z Nedabylic či dům U Sedmi čertů) na Maltézském náměstí na Malé Straně - štuk na stropě.,8.4.1908,16x,E1EE0BBA69AB11E49F1F0024BE7CD9AC,XI 606,1908-04-08,1908-04-08,14.4054,50.08594,regional.address,geocode,"Kříženecký, Jan (1868-1921)",,0.0,[],[]
pozitiv,Průhled Drtinovou ulicí na Smíchově.,kol.1930,160x,A14CE10EB67611DF820F00166F1163D4,I 199,1930-01-01,1930-12-31,14.40226,50.07639,regional.address,geocode,,,,[],[]
pozitiv,Pohled do Ječné ulice s domem čp. 548 na Novém Městě.,1911,70x,A14CE856B67611DF820F00166F1163D4,VI 6/28,1911-01-01,1911-12-31,14.42194,50.07575,regional.address,geocode,"Langhans, J. F.",,,[],[]
pozitiv,Pohled do interiéru domu čp. 216 (Obecná a měšťanská dívčí škola u sv. Vojtěcha) ve Vojtěšské ulici na Novém Městě - tělocvična.,5.6.1907,33x,A0C4FAC4B67611DF820F00166F1163D4,V 11/9 d,1907-06-05,1907-06-05,14.41497,50.07885,regional.address,geocode,"Kříženecký, Jan (1868-1921)",,,[],[]
pozitiv,"Pohled na ""Braunův"" dům čp. 730 na nároží ulic Jungmannovy (vlevo) a Vodičkovy na Novém Městě před zbořením v roce 1910.",kol.1900,60x,A14CE84EB67611DF820F00166F1163D4,VI 7/39 b,1900-01-01,1900-12-31,14.42265,50.07965,regional.address,geocode,"Eckert, Jindřich (1833-1905)",,,[],[]
pozitiv,"Celkový pohled na hlavní průčelí domů čp. 7, 518 na Malostranském náměstí na Malé Straně.",,54x,A11881C0B67611DF820F00166F1163D4,VI 75/24,,,14.40464,50.08857,regional.address,geocode,"Maloch, Karel",,,[],[]
pozitiv,Pohled na portál s mříží kostela sv. Cyrila a Metoděje (dříve kostel sv. Karla Boromejského) v Resslově ulici na Novém Městě.,5.4.1909,26x,A11874BFB67611DF820F00166F1163D4,VI 31/3 d,1909-04-05,1909-04-05,14.41762,50.07596,regional.address,geocode,,,,[],[]
pozitiv,"Průhled ulicí (dnes Ke Strašnické) k jihovýchodu s domy zleva čp. 21, čp. 22 a čp. 23 ve Strašnicích (dnes ulice V Olšinách, Ke Strašnické).",14.9.1942,69x,6C121C58F53411E7AFAF74D435EEBE90,A 14614,1942-09-14,1942-09-14,14.48226,50.06582,regional.address,geocode,"Alexander, Antonín (1892-působnost do 1948)",,0.0,[],[]
pozitiv,Ústřední elektrárna v Holešovicích (dům čp. 1) uvedená do provozu roku 1900.,kol.1910,170x,A1187FACB67611DF820F00166F1163D4,V 17/10,1910-01-01,1910-12-31,14.43637,50.10853,regional.address,geocode,Štenc-ateliér,,,[],[]
negativ,Pohled na náhrobní desku Johanny z Dittrichsteina v chrámu sv. Víta na Pražském hradě.,3.3.1910,32x,9B8E79485C4E11E0801C0010DCCFBEC5,XII 268,1910-03-03,1910-03-03,14.39995,50.09041,regional.address,geocode,Eckert-ateliér,,0.0,[],[]
pozitiv,"Pohled na náměstí Palackého na Novém Městě - v místech, kde stál Palackého pomník před odstraněním v době okupace. Vlevo dům čp. 359 poškozený náletem, vpravo dům čp. 375 na Novém Městě. Mezi nimi ústí ulice Na Moráni.",1945,14x,F6EE29C83B1311E7A5EB74D435EEBE90,II 1686,1945-01-01,1945-12-31,14.41536,50.07303,regional.address,geocode,"Sudek, Josef (1896-1976)",,,[],[]
pozitiv,Průhled Všehrdovou ulicí na Malé Straně směrem k severu.,15.11.1939,25x,B681BE55505D11E397576C626D41E503,I 9811,1939-11-15,1939-11-15,14.4068,50.08266,regional.address,geocode,"Alexander, Antonín (1892-působnost do 1948)",,,[],[]
pozitiv,"Pohled do dvora domu čp. 352 (""U Sladkých"") na Starém Městě.",1926,22x,5203B4D5ECE511DFBD7B000C766D2371,I 9452,1926-01-01,1926-12-31,14.41833,50.08448,regional.address,geocode,"Vojta, Tomáš (1885-1934)",,,[],[]
negativ,Celkový pohled na kostel sv. Mikuláše na Staroměstském náměstí.,27.4.1906,15x,A1187AEDB67611DF820F00166F1163D4,VIII 545,1906-04-27,1906-04-27,14.41994,50.08663,regional.address,geocode,Eckert-ateliér,,,[],[]
negativ,"Pohled na Smíchov z věže nádraží Praha - Smíchov (dům čp. 279 na Smíchově), v popředí vlakové tratě a železniční most nad Nádražní ulicí.",4.7.1907,330x,F384F074BEF711E39F3D0024BE7CD9AC,XI 382,1907-07-04,1907-07-04,14.40872,50.06142,regional.address,geocode,"Kříženecký, Jan (1868-1921)",,0.0,[],[]
pozitiv,Pohled do dvora Richtrových přádelen (dům čp. 204) na Smíchově.,,34x,A0C503E6B67611DF820F00166F1163D4,V 25/2 d,,,14.40154,50.07428,regional.address,geocode,,,,[],[]
negativ,Detail nároží ulice Československé armády a Vítězného náměstí v Dejvicích (dům čp. 828 / Bubeneč).,kol.1950,84x,A14CDDA8B67611DF820F00166F1163D4,VII 75,1950-01-01,1950-12-31,14.3971,50.10084,regional.address,geocode,"Chalupníček, Miroslav -, Chalupníčková, Věra (dokument 1941-1948)",,,[],[]
pozitiv,Pohled na zadní část Branického pivovaru (dům čp. 212) a sady. V pozadí jižní část Braníku v údolí Kunratického potoka.,31.5.1923,74x,31247DD3979011E6BAC1406186009F3A,A 80,1923-05-31,1923-05-31,14.40936,50.02973,regional.address,geocode,"Alexander, Antonín (1892-působnost do 1948)",,0.0,[],[]
pozitiv,Pohled na reliéf nad středním portálem kostela sv. Jakuba v ulici Malá Štupartská na Starém Městě.,23.8.1907,13x,A1187528B67611DF820F00166F1163D4,VI 29/13,1907-08-23,1907-08-23,14.42455,50.08856,regional.address,geocode,,,,[],[]
pozitiv,Pohled na kapli sv. Bartoloměje v Hodkovičkách. Vlevo průhled Modřanskou ulicí.,16.9.1934,32x,67B86EF3D1BE11E69F29406186009F3A,A 9039,1934-09-16,1934-09-16,14.40433,50.02308,poi,suggest,"Alexander, Antonín (1892-působnost do 1948)",,0.0,[],[]
negativ,Pohled na povrchovou těžbu železné rudy u Nučic u Prahy.,kol.1890,19x,F92B0B5A9D1411E2BF2E525400E46D25,VIII 1640,1890-01-01,1890-12-31,14.23122,50.02238,regional.address,geocode,"Eckert, Jindřich (1833-1905)",,,[],[]
negativ,Pohled na dům čp. 33 v Libušině ulici na Vyšehradě.,26.1.1905,33x,A14CDB5AB67611DF820F00166F1163D4,VIII 249,1905-01-26,1905-01-26,14.41658,50.06701,regional.address,geocode,Eckert-ateliér,,,[],[]
negativ,"Reprodukce grafického listu: Anonym, Pohled na vojenský a evangelický hřbitov v Karlíně.",20.5.1947,86x,A11878E3B67611DF820F00166F1163D4,X 8909,1947-05-20,1947-05-20,14.44268,50.09124,regional.address,geocode,,,,[],[]
pozitiv,Panoramatický pohled na starou Libeň. Uprostřed komplex budov Pražských strojíren akc. spol. (dříve Ruston a spol.) - dům čp. 145 ve Švábkách v Libni.,kol.1895,70x,A11884A6B67611DF820F00166F1163D4,VI 12/13 f,1895-01-01,1895-12-31,14.46736,50.10102,regional.address,geocode,,,,[],[]
pozitiv,Pohled do Klášterské ulice (dnes Malá Klášterní) na Starém Městě. Vpravo přízemní dům čp. 832 při klášteru sv. Anežky (dům čp. 811). V pozadí část kostela sv. Františka v areálu Anežského kláštera.,kol.1905,75x,A0C517A1B67611DF820F00166F1163D4,I 233,1905-01-01,1905-12-31,14.42404,50.09215,regional.address,geocode,"Fink, František (1854-1935)",,,[],[]
pozitiv,Pohled na stavbu budovy Magistrátu hlavního města Prahy (dům čp. 2) na Mariánském náměstí na Starém Městě.,,7x,f40f26d11ef746b7a8228c5981c74fae,I 12898,,,14.41783,50.08711,regional.address,geocode,,,,[],[]
pozitiv,Panoramatický pohled do Dalejského údolí u osady Klukovice. První část pětidílného panoramatu.,21.7.1925,12x,10fbc4fc089d4735adc2fc85e20e5f81,A 1967,1925-07-21,1925-07-21,14.37085,50.03566,regional.address,geocode,"Alexander, Antonín (1892-působnost do 1948)","On-line výstava na webu AMP ""Pražské panorama 2. část - Prokopské a Dalejské údolí"".
                    
                
                    
                  Součást panoramatu A 1967, A 1968, A 1970, A 1971. List 20a bod 23
                    
                
                    
                  Plány sign. AMP XXXII.",0.0,[],[]
negativ,Pohled na sochy gigantů od Čeňka Vosmíka vpravo nad bránou Pražského hradu z Hradčanského náměstí.,7.6.1907,26x,B2A29E02121111E28E4C6C626D41E503,XII 1097,1907-06-07,1907-06-07,14.39769,50.08921,regional.address,geocode,Eckert-ateliér,,0.0,[],[]
kresba tužkou,Pohled na portál domu čp. 922 v Dušní ulici na Starém Městě. Detail erbu nad portálem.,kol.1900,24x,A11867C5B67611DF820F00166F1163D4,VI 17/17 a,1900-01-01,1900-12-31,14.42215,50.08953,regional.address,geocode,,,,[],[]
pozitiv,Pohled do interiéru Clam-Gallasovského paláce (dům čp. 158 na Starém Městě) - kancelář archivní knihovny v 1. patře.,1965,15x,d9e09133573148a088f8e1cb3536fc0e,II 1928,1965-01-01,1965-12-31,14.41779,50.08642,regional.address,geocode,"Vopravil, Josef (1902-1972)",,,[],[]
pozitiv,"Pohled portál domu čp. 26 (""U zlatého jelena"") v Tomášské ulici na Malé Straně.",7.7.1906,12x,A1187749B67611DF820F00166F1163D4,VI 20/9 b,1906-07-07,1906-07-07,14.40492,50.08882,regional.address,geocode,,,,[],[]
pozitiv,Pohled na Vyšehradskou skálu s částí opevnění a s Libušinou lázní. Na břehu domek převozníka.,kol.1880,57x,A1186BEDB67611DF820F00166F1163D4,I 8696,1880-01-01,1880-12-31,14.43414,50.08355,regional.municipality,suggest,"Maloch, Karel",,,[],[]
pozitiv,Pohled na dům čp. 1208 v Novostrašnické ulici ve Strašnicích.,9.12.1942,40x,EBFD69D6C88B11E7A755D4BED94BB14D,A 14872,1942-12-09,1942-12-09,14.49395,50.0693,regional.address,geocode,"Alexander, Antonín (1892-působnost do 1948)",,0.0,[],[]
negativ,Zvon ze špitálu sv. Alžběty a sv. Norberta na Strahově (dům čp. 156 na Hradčanech) sejmutý za 1. světové války k roztavení.,1914-1918,49x,DAD084EAD2DA11E880E4406186009F3A,XI 3795,1914-01-01,1918-12-31,14.39093,50.08761,regional.address,geocode,,,0.0,[],[]
negativ,Pohled do Ječné ulice s domem čp. 527 na Novém Městě (Mariánský ústav) po přestavbě.,kol.1890,54x,EFEBAFA89A7711E191A46C626D41E503,XII 682,1890-01-01,1890-12-31,14.42652,50.07567,regional.address,geocode,"Eckert, Jindřich (1833-1905)",,0.0,[],[]
pozitiv,Pohled na hroby na Malostranském hřbitově na Smíchově.,kol.1950,51x,10B227DB303F11E5A53574D435EEBE90,I 11292,1950-01-01,1950-12-31,14.39148,50.07167,poi,suggest,"Pacovský, Jaroslav",,,[],[]
pozitiv,Pohled na část průčelí malostranské radnice - dům čp. 35 na Malé Straně.,,14x,A11883E1B67611DF820F00166F1163D4,VI 9/29,,,14.40477,50.08832,regional.address,geocode,,,,[],[]
pozitiv,Celkový pohled na usedlost Šafránka (dům čp. 18 v Dejvicích) s rybníkem.,1909,99x,47C786CF23FA11E6BA60406186009F3A,F 597,1909-01-01,1909-12-31,14.39673,50.09821,regional.address,geocode,"Fink, František (1854-1935)",,0.0,[],[]
pozitiv,Pohled na pískovcová barokní Boží muka při vjezdu do hřbitova Malvazinky na Smíchově.,12.2.1927,65x,A0C4FCDFB67611DF820F00166F1163D4,I 8759,1927-02-12,1927-02-12,14.38947,50.06181,regional.address,geocode,"Alexander, Antonín (1892-působnost do 1948)",,,[],[]
pozitiv,Pohled na nově objevený pozdně gotický portál domu čp. 228 v Husově ulici na Starém Městě.,30.8.1935,22x,B6F4E4A104D711E3A4F66C626D41E503,I 9739,1935-08-30,1935-08-30,14.41804,50.08583,regional.address,geocode,"Alexander, Antonín (1892-působnost do 1948)",,,[],[]
negativ,Vůz městského zdravotního odboru ve dvoře Staroměstské radnice.,8.5.1914,33x,A0C506FCB67611DF820F00166F1163D4,XI 3252,1914-05-08,1914-05-08,14.41994,50.08663,regional.address,geocode,"Kříženecký, Jan (1868-1921)",,0.0,[],[]
pozitiv,Pohled na Národní divadlo (dům čp. 223 na Novém Městě) z mostu císaře Františka I. (Legií). Vlevo část domu čp. 1012 na Starém Městě (kavárna Slavia) a Národní třída.,kol.1910,66x,A14CEA42B67611DF820F00166F1163D4,VI 61/12,1910-01-01,1910-12-31,14.41321,50.08173,regional.address,geocode,Eckert-ateliér,,,[],[]
negativ,Detailní pohled na hlavici sloupu chrámu sv. Víta na Pražském hradě.,[1863-1945],25x,912ED0E9070A11E286836C626D41E503,XII 643,,,14.4006,50.09089,poi,suggest,Eckert,Datace neznámá. Za účelem vyhledávání byla nastavena na časový rozsah celé sbírky.,0.0,[],[]
negativ,Pohled do interiéru vychovatelny manželů Olivových v Říčanech (dnes Olivova dětská léčebna) - třída.,kol.1900,14x,6BE3F64B8AFE11E2BF22525400E46D25,VIII 1374,1900-01-01,1900-12-31,14.68942,49.99028,regional.address,geocode,"Eckert, Jindřich (1833-1905)",,,[],[]
negativ,Panoramatický pohled z Hloubětína na Černý most. První část třídílného panoramatu.,kol.1970,68x,A0C5124AB67611DF820F00166F1163D4,VII 481,1970-01-01,1970-12-31,14.50844,50.10271,regional.address,geocode,"Chalupníček, Miroslav -, Chalupníčková, Věra (dokument 1941-1948)",,,[],[]
negativ,Pohled na balkon oratoře v kostele sv. Mikuláše na Malé Straně.,6.10.1907,12x,8B844E6CDB6F11E3BB45406186009F3A,XI 416,1907-10-06,1907-10-06,14.4032,50.08835,regional.address,geocode,"Kříženecký, Jan (1868-1921)",,0.0,[],[]
pozitiv,Pohled na pokládání pumpy v dolní části plavební komory u ostrova Štvanice.,21.7.1909,106x,126495E8F1D411E5A523000C76270B94,I 11624,1909-07-21,1909-07-21,14.43744,50.09433,poi,suggest,,,,[],[]
pozitiv,Pohled na malovaný strop v prvním patře domu čp. 347 v ulici Na Perštýně na Starém Městě.,kol. 1910,21x,4E9735FBCBE711E4AB2C406186009F3A,V 5/8 b,,,14.41845,50.08327,regional.address,geocode,,,,[],[]
pozitiv,Pohled na novostavbu obecné a občanské dívčí školy čp. 118 v Potockého ulici (dnes Parléřova) na Hradčanech - pamětní deska hvězdáře Tychona Brahe.,8.4.1933,5x,45973f83af1b48e3b928655d8b898cc1,Voj 4569,1933-04-08,1933-04-08,14.38728,50.08789,regional.address,geocode,"Vojta, Tomáš (1885-1934)",,0.0,[],[]
pozitiv,Pohled na kříž jižně od kostela ve starých Bohnicích (památník padlým v 1. světové válce).,31.8.1942,81x,D3200817F18711E99444406186009F3A,A 14460,1942-08-31,1942-08-31,14.41381,50.13544,regional.address,geocode,"Alexander, Antonín (1892-působnost do 1948)",,0.0,[],[]
pozitiv,"Pohled do velké (""Nové"") zasedací síně Staroměstské radnice (dům čp. 1 na Starém Městě).",kol.1890,32x,A14CE8C3B67611DF820F00166F1163D4,VI 42/17,1890-01-01,1890-12-31,14.42009,50.087,regional.address,suggest,"Eckert, Jindřich (1833-1905)",,,[],[]
pozitiv,Pohled na cihelnu na Smíchově (dům čp. 1061).,3.9.1931,244x,A118814FB67611DF820F00166F1163D4,I 33,1931-09-03,1931-09-03,14.36096,50.02069,regional.address,geocode,"Alexander, Antonín (1892-působnost do 1948)",,,[],[]
negativ,Pohled do tunelu staroměstské kanalizace pod Melantrichovou ulicí.,10.5.1906,28x,04F1FBA50E2711E2935B6C626D41E503,XII 1062,1906-05-10,1906-05-10,14.42109,50.0853,regional.address,geocode,Eckert-ateliér,,0.0,[],[]
pozitiv,Panoramatický pohled přes zamrzlou Vltavu na Malou Stranu a Hradčany.,kol.1945,44x,A1188C60B67611DF820F00166F1163D4,II 23,1945-01-01,1945-12-31,14.41429,50.08809,regional.address,geocode,"Zeman, Josef",,,[],[]
pozitiv,"Pražské povstání - květen 1945. Těžká děla, která byla připravena v kasárnách na Pohořelci na zničení Prahy.",10.5.1945,60x,A1186FA9B67611DF820F00166F1163D4,II 1216,1945-05-10,1945-05-10,14.38756,50.08765,regional.address,geocode,"Dub, Václav (dokumenty 1928-1983)",,,[],[]
pozitiv,"Pohled na Mariánské náměstí (Linhartská ulice) s domy čp. 130 (kovárna), čp. 132, čp. 133 na Starém Městě. V pozadí část Klementina s věží.",kol.1870,44x,A1188155B67611DF820F00166F1163D4,VI 1/7,1870-01-01,1870-12-31,14.41783,50.08711,regional.address,geocode,anonym,,,[],[]
pozitiv,Pohled na dům čp. 886 - s průhledem Sanytrovou ulicí k domu čp. 901 na Starém Městě.,30.8.1935,247x,A1187096B67611DF820F00166F1163D4,I 43,1935-08-30,1935-08-30,14.41975,50.09196,regional.address,geocode,"Alexander, Antonín (1892-působnost do 1948)",,,[],[]
negativ,"Pohled do Královské ulice (dnes Sokolovská) od sadů Na Poříčí k východu. Uprostřed dům čp. 268 na nároží ulic Ke Štvanici a Sokolovské, vpravo dům čp. 66 na nároží ulic Prokopovy a Sokolovské v Karlíně.",kol.1910,89x,5F512E3D306F11EABE1474D435EEBE90,IX 250 c,1910-01-01,1910-12-31,14.48992,50.10703,regional.address,geocode,,,,[],[]
pozitiv,Pohled na náhrobek Barbary Laumannové na Malostranském hřbitově na Smíchově.,9.1.1914,41x,A0C50A1EB67611DF820F00166F1163D4,II 1344,1914-01-09,1914-01-09,14.39148,50.07167,poi,suggest,"Kříženecký, Jan (1868-1921)",,,[],[]
pozitiv,Návrhy na obnovu kostela Nanebevzetí P. Marie a sv. Karla Velikého na Karlově na Novém Městě.,1901,18x,A0C4FF0EB67611DF820F00166F1163D4,VI 30/25 b,1901-01-01,1901-12-31,14.42851,50.0692,regional.address,geocode,,,,[],[]
negativ,"Průhled Rabínskou ulicí (v místech dnešní Masielovy ulice) od křižovatky s Josefovskou (dnes Širokou) ulicí v Josefově k severu. Vlevo dům čp. 264, vpravo čp. 96 krátce před zbořením.",25.3.1905,58x,A0C4FE97B67611DF820F00166F1163D4,VIII 27,1905-03-25,1905-03-25,14.41826,50.08957,regional.address,geocode,Eckert-ateliér,,,[],[]
pozitiv,Pohled do interiéru chrámu sv. Víta na Pražském hradě na plastiky určené pro úschovu před nálety.,1945,6x,0BA295461C8611E8804174D435EEBE90,II 1688,1945-01-01,1945-12-31,14.4006,50.09089,poi,suggest,"Sudek, Josef (1896-1976)",,,[],[]
pozitiv,Pohled na model sochy personifikace Staré doby (autor Vilém Amort) pro výzdobu domu čp. 934 na Staroměstském náměstí (Schierův - podle stavitele Franze Schiera).,19.7.1897,46x,A1186D85B67611DF820F00166F1163D4,VI 34/30 a,1897-07-19,1897-07-19,14.42048,50.08805,regional.address,geocode,"Mulač, Jan",,,[],[]
pozitiv,Pohled na sochu Neptuna uprostřed jezírka před grottou (Neptunovou jeskyní) v Havlíčkových sadech na Vinohradech. Vpravo část zahradní restaurace.,12.7.1931,67x,A0C51694B67611DF820F00166F1163D4,I 1842,1931-07-12,1931-07-12,14.44502,50.06921,regional.address,geocode,"Alexander, Antonín (1892-působnost do 1948)",,,[],[]
negativ,Pohled do interiéru vodárny na Letné (dům čp. 1000 v Bubenči) - čerpadlo.,1890-1891,60x,FA2E10FD81B811E2BF1D525400E46D25,VIII 1292,1890-01-01,1891-12-31,14.41987,50.10017,regional.address,geocode,"Eckert, Jindřich (1833-1905)",,,[],[]
negativ,Mešní konvice z Arcibiskupského paláce (dům čp. 56) na Hradčanech.,[1863-1905],21x,BB27242D946011E1A7806C626D41E503,XII 546,,,14.39755,50.08984,regional.address,geocode,"Eckert, Jindřich (1833-1905)",Datace neznámá. Za účelem vyhledávání byla nastavena na časový rozsah celé sbírky.,0.0,[],[]
pozitiv,Pohled na dům čp. 10 (Pražačka) na Žižkově.,24.9.1942,99x,A11884A8B67611DF820F00166F1163D4,I 1936,1942-09-24,1942-09-24,14.45507,50.08722,regional.address,geocode,"Alexander, Antonín (1892-působnost do 1948)",,,[],[]
negativ,Pohled na stromy v sadech na Letné.,16.10.1907,42x,B0C3348EE02911E3A3D40024BE7CD9AC,XI 448,1907-10-16,1907-10-16,14.42324,50.09637,regional.address,geocode,"Kříženecký, Jan (1868-1921)",,0.0,[],[]
pozitiv,"Pohled na vstupní portál domu čp. 671 (Salmovský palác, dům U Kamenného stolu) na Karlově náměstí na Novém Městě.",18.5.1906,54x,A1186C54B67611DF820F00166F1163D4,VI 18/27,1906-05-18,1906-05-18,14.42156,50.078,regional.address,geocode,,,,[],[]
pohlednice,Pohled na dům čp. 324 (radnice) na Královské třídě (dnes Sokolovská 14) ve Vysočanech.,1912,140x,A1187CB8B67611DF820F00166F1163D4,I 63,1912-01-01,1912-12-31,14.48582,50.09848,regional.address,geocode,,,,[],[]
pozitiv,Pohled na dům čp. 1225 v Barvířské ulici na Novém Městě.,13.10.1908,30x,1FB97F7D651F11E6A555000C76270B94,I 11879,1908-10-13,1908-10-13,14.43197,50.09276,regional.address,geocode,,,,[],[]
pozitiv,Pohled na domy čp. 205 a čp. 206 v Bělohorské ulici v Břevnově.,28.8.1936,44x,4432DD58B61C11E58B3BD4BED94BB14D,I 11437,1936-08-28,1936-08-28,14.36526,50.08915,regional.address,geocode,"Alexander, Antonín (1892-působnost do 1948)",,,[],[]
negativ,Pohled do ulice Albertov s domy čp. 2026 (Fyzikální ústav - vlevo) a 2027 (Matematický a přírodovědecký ústav - vpravo) na Novém Městě.,2.4.1910,4x,df717679e3c343df9d33ee4c0b9d812a,XI 1394,1910-04-02,1910-04-02,14.42816,50.07019,regional.address,geocode,"Kříženecký, Jan (1868-1921)",,0.0,[],[]
pozitiv,Pohled na portál kostela sv. Jana Na Skalce na Novém Městě.,24.5.1907,31x,A14CDFFDB67611DF820F00166F1163D4,VI 30/8,1907-05-24,1907-05-24,14.41871,50.07097,regional.address,geocode,,,,[],[]
pozitiv,Pohled na nádvoří bývalého kostela a kláštera sv. Michala mezi Michalskou a Melantrichovou ulicí na Starém Městě.,12.4.1945,30x,A0C501C9B67611DF820F00166F1163D4,I 9184,1945-04-12,1945-04-12,14.42013,50.08651,regional.address,geocode,"Alexander, Antonín (1892-působnost do 1948)",,,[],[]
pozitiv,Pohled do Thunovské ulice s domy čp. 181 (uprostřed) a čp. 177 (vpravo) na Malé Straně.,10.7.1911,58x,A0C4F6B9B67611DF820F00166F1163D4,II 183,1911-07-10,1911-07-10,14.40365,50.08922,regional.address,geocode,"Kříženecký, Jan (1868-1921)",,,[],[]
CD-ROM,Prvá vlna povodně v Praze - Na lodičce v loděnici pod Vyšehradem při 3.SPA čas :10.8.2002 v 8:30.,10.8.2002,72x,A118775DB67611DF820F00166F1163D4,XXII 6/12,2002-08-10,2002-08-10,14.41352,50.0482,regional.address,geocode,"Elleder, Libor, Ing. (působnost 2002)",,0.0,[],[]
pozitiv,Pohled do nuselského údolí z Legerovy ulice (z hradební terasy při české dětské nemocnici). Součást panoramatu.,26.7.1931,91x,34C50A32063211E2AC506C626D41E503,I 9617,1931-07-26,1931-07-26,14.43112,50.06961,regional.address,geocode,"Alexander, Antonín (1892-působnost do 1948)",,,[],[]
pozitiv,Pohled dům čp. 9 v Palackého ulici (dnes Freyova) ve Vysočanech. V pozadí dům čp. 178 v ulici Sokolovská.,16.10.1942,100x,77837E755E5911E8B32C406186009F3A,A 14733,1942-10-16,1942-10-16,14.50176,50.11134,regional.address,geocode,"Alexander, Antonín (1892-působnost do 1948)",,0.0,[],[]
negativ,Pohled do interiéru domu čp. 671 na Karlově náměstí na Novém Městě (Salmovský palác) - pokoj s dámským psacím stolem.,kol.1900,38x,EC5D29107C4311E2BF19525400E46D25,VIII 1253,1900-01-01,1900-12-31,14.42156,50.078,regional.address,geocode,"Eckert, Jindřich (1833-1905)",,,[],[]
pozitiv,Pohled na portál kostela sv. Markéty na Břevnově.,15.11.1908,24x,A14CE2F4B67611DF820F00166F1163D4,VI 33/8 b,1908-11-15,1908-11-15,14.35747,50.08511,regional.address,geocode,,,,[],[]
negativ,"Pohled na nároží domu čp. 127 na Starém Městě s domovním znamením ""U Černého beránka"".",28.6.1908,42x,263df7e3f4ab4388943780f3dd8fab5c,XI 788,1908-06-28,1908-06-28,14.55043,50.09694,regional.address,geocode,"Kříženecký, Jan (1868-1921)",,0.0,[],[]
pozitiv,Pohled z čínského pavilonu do zahrady usedlosti Cibulka v Košířích (dům čp. 118) - v pozadí umělá romantická zřícenina (rozhledna). Součást panoramatu.,říjen 1924,59x,A0C4FB5EB67611DF820F00166F1163D4,I 4600,1924-10-01,1924-10-31,14.35655,50.06696,regional.address,geocode,"Vojta, Tomáš (1885-1934)",,,[],[]
pozitiv,"Dům čp. 292 na Novém Městě (""Černý pivovar"") na Karlově náměstí - krov.",kol.1930,17x,A0C50A8CB67611DF820F00166F1163D4,IV 40/16,1930-01-01,1930-12-31,14.41912,50.0768,regional.address,geocode,,,,[],[]
pozitiv,Detail sochařské výzdoby vstupního schodiště Trojského zámku (dům čp. 1)..,1989,52x,A0C50964B67611DF820F00166F1163D4,I 4698,1989-01-01,1989-12-31,14.4124,50.11648,regional.address,geocode,"Jelínková, Jana (1951-)",,,[],[]
pozitiv,Pohled do zahrady Na Valech v Plečnikově úpravě. Vlevo pyramida u vyhlídkové terasy.,kol.1930,34x,A0C4FE1BB67611DF820F00166F1163D4,I 4085,1930-01-01,1930-12-31,14.40316,50.09058,poi,suggest,,,,[],[]
CD-ROM,Po povodni - Konečná tramvají v Bráníku 17.8.2002,17.8.2002,44x,A0C50B0BB67611DF820F00166F1163D4,XXII 6/52,2002-08-17,2002-08-17,14.40771,50.03041,regional.address,geocode,"Elleder, Libor, Ing. (působnost 2002)",,0.0,[],[]
pozitiv,Pražské povstání - 5.5.1945 - pohled do hlasatelny městského rozhlasu v nové radniční úřední budově na nároží Kaprovy a Platnéřské ulice - velitel radničních bloků poručík Antonín Kozel (stojící) a hlasatelé bratři Kučerovi - Karel (vlevo) a Jaroslav (vpravo).,5.5.1945,159x,A0C4FF80B67611DF820F00166F1163D4,II 1091,1945-05-05,1945-05-05,14.41873,50.08783,regional.address,geocode,,,,[],[]
pozitiv,Pohled na detail štukového stropu v interiéru Šternberského paláce (Ernestinum - dům čp. 57 na Hradčanech).,16.6.1914,21x,A14CE5B3B67611DF820F00166F1163D4,II 1299,1914-06-16,1914-06-16,14.39669,50.09028,regional.address,geocode,"Kříženecký, Jan (1868-1921)",,,[],[]
pozitiv,Pohled na stavbu budovy Magistrátu hlavního města Prahy (dům čp. 2) na Mariánském náměstí na Starém Městě. V pozadí Platnéřská ulice a náměstí Franze Kafky.,1909-1910,14x,22ecece6e38e4559a598776f092aa80b,I 12872,1909-01-01,1910-12-31,14.41783,50.08711,regional.address,geocode,,,,[],[]
pozitiv,Pohled od jihozápadu na Gröbeho vilu (dům čp. 58 na Vinohradech) vyhořelou po náletu spojenců 14.2.1945.,30.4.1945,58x,A1187381B67611DF820F00166F1163D4,I 1870,1945-04-30,1945-04-30,14.44502,50.06921,regional.address,geocode,"Alexander, Antonín (1892-působnost do 1948)",,,[],[]
pozitiv,Průhled Poděbradskou ulicí s domem čp. 1 (zájezdní hostinec) uprostřed v Hloubětíně.,30.3.1930,55x,C35FAA5E6EE911E88F4674D435EEBE90,A 5596,1930-03-30,1930-03-30,14.54392,50.10747,regional.address,geocode,"Alexander, Antonín (1892-působnost do 1948)",,0.0,[],[]
pozitiv,Celkový pohled na hlavní průčelí Kinského vily čp. 98 v zahradě Kinských na Smíchově.,,75x,A118851FB67611DF820F00166F1163D4,I 1627,,,14.39886,50.07673,regional.address,geocode,,,,[],[]
pozitiv,Pohled na usedlost Špitálka (dům čp. 17) v Dejvicích v dnešní ulici Na Špitálce.,12.6.1925,12x,904c1e0c9c0042d2b6983e4d0808a278,A 1880,1925-06-12,1925-06-12,14.38835,50.0999,regional.address,geocode,"Alexander, Antonín (1892-působnost do 1948)",,0.0,[],[]
pozitiv,Pohled na domy v okolí dnešních ulic Zavadilovy a Proboštské v Dejvicích. Uprostřed kostel sv. Václava. První část dvoudílného panoramatu A 3539 - A 3540.,14.8.1927,9x,a1410cdf66374e51aee72a746ed0ce49,A 3539,1927-08-14,1927-08-14,14.37538,50.09767,regional.address,geocode,"Alexander, Antonín (1892-působnost do 1948)",,0.0,[],[]
negativ,"Celkový pohled na jeden z pavilonů v areálu výstaviště v Bubenči při Jubilejní výstavě 1891 - ""Hanavský"" (""Knížecí Hanavské železárny v Komárově"").",1891,98x,BCD45A463E3411E2BF08525400E46D25,VIII 1149,1891-01-01,1891-12-31,14.43056,50.10462,regional.address,geocode,"Eckert, Jindřich (1833-1905)",,,[],[]
pozitiv,Pohled z nároží bastionu 36 vyšehradských hradeb k východu. V popředí část podolského sanatoria (dům čp. 157) a hradby. Součást panoramatu.,10.9.1923,121x,CB9A5DD0612611E995BC74D435EEBE90,Voj 245,1923-09-10,1923-09-10,14.41925,50.06214,regional.address,geocode,"Vojta, Tomáš (1885-1934)",,0.0,[],[]
pozitiv,Průhled Václavským náměstím se sadovou úpravou od Můstku k jihu - bez Koňské brány.,,76x,A14CE379B67611DF820F00166F1163D4,II 114,,,14.42863,50.08014,regional.address,geocode,"Fridrich, František (1829-1892)",Autorství F. Fridricha není jisté.,,[],[]
pozitiv,Pohled na osvětlenou Staroměstskou radnici při příležitosti 10. výročí samostatnosti Československé republiky. V pozadí kostel P. Marie před Týnem na Starém Městě.,28.10.1928,49x,247213E2124211E8A338406186009F3A,I 12045,1928-10-28,1928-10-28,14.42009,50.087,regional.address,suggest,"Vopravil, Josef (1902-1972)",,,[],[]
pozitiv,Pražské povstání - květen 1945 - provizorní pomník na Staroměstském náměstí - kříž postavený 13.5.1945 z trámů křídla Staroměstské radnice po požáru 8.5.1945. Pomník se jmény obránců radničních budov a městského rozhlasu padlých 5. - 9. května 1945. Čestná stráž.,květen 1945,198x,A1186D13B67611DF820F00166F1163D4,I 5763,1945-05-01,1945-05-31,14.42009,50.087,regional.address,suggest,,,,[],[]
negativ,Pohled na plastickou výzdobu kostela sv. Mikuláše na Starém Městě. Strop pod hlavním chorem.,listopad 1905,16x,1BE4B5469E3611E3B7D600110989F46F,XI 60,1905-11-01,1905-11-30,14.4199,50.08778,regional.address,geocode,"Kříženecký, Jan (1868-1921)",,0.0,[],[]
pozitiv,Pohled na kostel sv. Prokopa nad vápencovými doly (Velký Prokopský lom) v Prokopském údolí. Vršek těžební věže je patrný vpravo dole. Druhá část třídílného panoramatu.,28.10.1925,9x,07e7da88e4b34d4dace7274a54e2fd18,A 2266,1925-10-28,1925-10-28,14.38926,50.04413,regional.address,geocode,"Alexander, Antonín (1892-působnost do 1948)","On-line výstava na webu AMP ""Pražské panorama 2. část - Prokopské a Dalejské údolí"".
                    
                
                    
                  Součást panoramatu A 2265, A 2266, A 2267.
                    
                
                    
                  Bod 15 - list 20a
                    
                
                    
                  Plány sign. AMP XXXII.",0.0,[],[]
pozitiv,Pohled do interiéru kostela sv. Jiří na Pražském hradě na Hradčanech - hlavní loď po odkrytí starého stavu směrem od presbytáře k západnímu vchodu (po zbourání Helfenburského západního chóru).,19.11.1899,17x,A0C502B0B67611DF820F00166F1163D4,VI 35/11 b,1899-11-19,1899-11-19,14.40231,50.09093,regional.address,geocode,"Eckert, Jindřich (1833-1905)",,,[],[]
negativ,Pohled do interiéru zámku Měšice.,[1863-1945],7x,23A98170362D11E1BECE000C766D2371,XII 472,,,14.39939,50.15834,regional.address,geocode,Eckert-ateliér,Datace neznámá. Za účelem vyhledávání byla nastavena na časový rozsah celé sbírky.,0.0,[],[]
pozitiv,Pohled na náhrobek hraběte Vratislava z Mitrovic v kostele sv. Jakuba na Starém Městě.,kol.1900,19x,A0C4F5BCB67611DF820F00166F1163D4,VI 34/7 b,1900-01-01,1900-12-31,14.42455,50.08856,regional.address,geocode,,,,[],[]
pozitiv,Pohled na stavbu budovy Magistrátu hlavního města Prahy (dům čp. 2) na Mariánském náměstí na Starém Městě - stavba dvorany.,,8x,222996ed5c034954bf21dcf85ffb7aaa,I 12899,,,14.41783,50.08711,regional.address,geocode,,,,[],[]
negativ,Celkový pohled na Císařský mlýn v Bubenči (Kubíkova továrna na papír - dům čp. 22) - z lešení na ostrově. Opraveno po požáru roku 1896.,po 1896,36x,AAD4B0F5921B11E2BF28525400E46D25,VIII 1280,1897-01-01,2000-12-31,14.4055,50.10847,regional.address,geocode,"Eckert, Jindřich (1833-1905)",,,[],[]
negativ,Pohled do interiéru divadla (Německé - Smetanovo - Státní opera - dům čp. 101 na Vinohradech) - strop (pravá část v proscéniu).,kol.1890,68x,8FB1ED13951211E192C36C626D41E503,XII 594,1890-01-01,1890-12-31,14.46321,50.07369,regional.address,geocode,"Eckert, Jindřich (1833-1905)",,0.0,[],[]
pozitiv,Pohled na zeď domu čp. 605 v ulici Na dědince v Libni.,1975,68x,A0C4FF18B67611DF820F00166F1163D4,V 147/10,1975-01-01,1975-12-31,14.47236,50.11508,regional.address,geocode,"Michálek, Ladislav",,,[],[]
pozitiv,Pohled do dvora domu čp. 425 na Malé Straně.,25.2.1927,22x,A0C513D1B67611DF820F00166F1163D4,I 4246,1927-02-25,1927-02-25,14.40458,50.08208,regional.address,geocode,"Alexander, Antonín (1892-působnost do 1948)",,,[],[]
negativ,Celkový pohled na dům čp. 600 (U Zlatého hřebenu) na Starém Městě na nároží ulic Celetné a Štupartské.,před 1882,51x,41FB4F43CF8E11DFBD51000C766D2371,XII 10,1800-01-01,1881-12-31,14.42324,50.08729,regional.address,geocode,"Eckert, Jindřich (1833-1905)",,0.0,[],[]
pozitiv,"Pohled na Nové mlýny na Novém Městě z mostu císaře Františka Josefa I. - zleva Šebelův mlýn (dům čp. 1293), mlýn čp. 1451, Dietzův mlýn (dům čp. 1528), Vávrův mlýn (dům čp. 1239). Vpravo vodárenská věž Novomlýnské vodárny a Eliščiny (Kandertovy) lázně (dům čp. 1248). V pozadí kostel sv. Klimenta na Novém Městě, v popředí železná lávka.",před 1910,145x,8DB3D1BE312011E9ABB6406186009F3A,F 389,1800-01-01,1909-12-31,14.44363,50.0473,regional.address,geocode,"Fink, František (1854-1935)",,0.0,[],[]
pozitiv,Pohled na dvůr Ronzova mlýna v Pobřežní ulici (dům čp. 218 v Karlíně).,16.5.1923,105x,BB68F320F71F11E5B89A406186009F3A,A 33,1923-05-16,1923-05-16,14.36549,50.07034,regional.address,suggest,"Alexander, Antonín (1892-působnost do 1948)",,0.0,[],[]
negativ,"""Tycho Brahe v Praze"" - výročí 1901. T.XVII.1. Erbovní kniha (Stammbuch), který Tycho Brahe věnoval svému synovi roku 1598.",1901,14x,B22BC3E60BB311E2AEA36C626D41E503,XII 907,1901-01-01,1901-12-31,14.41994,50.08663,regional.address,geocode,"Eckert, Jindřich (1833-1905)",,0.0,[],[]
negativ,Pohled do interiéru pivovarské školy (dům čp. 921 na Novém Městě) v Opletalově ulici - laboratoř.,15.4.1911,27x,BC2CA6C21DD811E2BCB36C626D41E503,XII 1265,1911-04-15,1911-04-15,14.42961,50.08112,regional.address,geocode,Eckert-ateliér,,0.0,[],[]
pozitiv,Návrh novostavby čp. 24 na místě domu čp. 27 na Starém Městě (prelatura kostela sv. Mikuláše).,18.11.1897,19x,A14CE920B67611DF820F00166F1163D4,VI 47/5,1897-11-18,1897-11-18,14.41939,50.08792,regional.address,suggest,"Kříženecký, Rudolf (dokument 1897-1931)",,,[],[]
pozitiv,Pohled na schodiště domu čp. 369 na Malé Straně.,1920-1925,144x,A14CDBB9B67611DF820F00166F1163D4,I 20,1920-01-01,1925-12-31,14.40281,50.08712,regional.address,geocode,,,,[],[]
pozitiv,Pohled na průčelí domu čp. 18 v Poděbradské ulici. Vlevo dům čp. 19 na nároží dnešní ulice V Mototechně v Hloubětíně.,30.3.1930,55x,A96A09786EE611E88F4674D435EEBE90,A 5588,1930-03-30,1930-03-30,14.52994,50.10181,regional.address,geocode,"Alexander, Antonín (1892-působnost do 1948)",,0.0,[],[]
pozitiv,Pohled na nástropní malbu v arkýřové kapli Staroměstské radnice (dům čp. 1 na Starém Městě).,před 1886,27x,A14CE93CB67611DF820F00166F1163D4,VI 42/23 a,1800-01-01,1885-12-31,14.42009,50.087,regional.address,suggest,"Eckert, Jindřich (1833-1905)",,,[],[]
negativ,Pohled na vyobrazení měsíců Josefa Mánesa (znamení Býk) na orloji Staroměstské radnice (dům čp. 1 na Starém Městě) na Staroměstském náměstí.,,21x,96DDDC7990B811E8B3B474D435EEBE90,IX 395 c,,,14.42009,50.087,regional.address,suggest,,,,[],[]
pozitiv,Stavba přístavu v Libni - pohled na Rokytku před ústím do Vltavy před regulací. Vlevo Budečská ulice (dnes ulice U Českých loděnic). V pozadí uprostřed pivovar (dům čp. 63 v Libni).,1894-1895,108x,8B8337C56D7211E88D0474D435EEBE90,V 18/13 t,1894-01-01,1895-12-31,14.47559,50.10691,regional.address,geocode,,,0.0,[],[]
pozitiv,Panoramatický pohled do Dalejského údolí u osady Klukovice - domky vpravo ve stráni nad silnicí vedoucí do tehdejší osady Slivence. Druhá část šestidílného panoramatu. První část šestidílného panoramatu.,21.7.1925,13x,df5e4e02e527426fa5b67a0784374ecc,A 1973,1925-07-21,1925-07-21,14.3154,50.0471,regional.address,geocode,"Alexander, Antonín (1892-působnost do 1948)","On-line výstava na webu AMP ""Pražské panorama 2. část - Prokopské a Dalejské údolí"".
                    
                
                    
                  Součást panoramatu A 1967, A 1968, A 1970, A 1971. List 20a bod 23
                    
                
                    
                  Plány sign. AMP XXXII.",0.0,[],[]
negativ,"Pohled z věže chrámu sv. Víta na část Pražského hradu s kostelem sv. Jiří. V pozadí vlevo Letná, uprostřed Vltava, vpravo nábřeží Na Františku.",kol.1903,83x,A1188588B67611DF820F00166F1163D4,VIII 131,1903-01-01,1903-12-31,14.40231,50.09093,regional.address,geocode,"Eckert, Jindřich (1833-1905)",,,[],[]
negativ,"Maiselova ulice (slepá část východně od Maiselovy synagogy) s domy čp. 77 (uprostřed), čp. 83 (vpravo) a čp. 82 (vlevo) v Josefově před zbořením v letech 1896-1898.",kol.1895,25x,A1188609B67611DF820F00166F1163D4,VIII 825,1895-01-01,1895-12-31,14.41866,50.08878,regional.address,geocode,"Eckert, Jindřich (1833-1905)",,,[],[]
pozitiv,Pohled na hroby na Malostranském hřbitově na Smíchově při zdi do Plzeňské ulice - původní stav.,4.3.1927,77x,9EB8E0102FBA11E5A57D74D435EEBE90,I 11250,1927-03-04,1927-03-04,14.39148,50.07167,poi,suggest,"Alexander, Antonín (1892-působnost do 1948)",,,[],[]
negativ,"""Tycho Brahe v Praze"" - výročí 1901. T.V.1. Malý sextant ze sbírky v Klementinu.",1901,21x,A81A9B120BAD11E2AEA36C626D41E503,XII 900,1901-01-01,1901-12-31,14.41659,50.08616,poi,suggest,"Eckert, Jindřich (1833-1905)",,0.0,[],[]
pozitiv,Celkový pohled na dům čp. 102 na Malé Straně v Cihelné ulici.,22.1.1934,32x,A0C50328B67611DF820F00166F1163D4,I 1811,1934-01-22,1934-01-22,14.40985,50.08802,regional.address,geocode,"Alexander, Antonín (1892-působnost do 1948)",,,[],[]
pozitiv,Pohled na budovu Umělecké besedy v Besední ulici - dům čp. 487 na Malé Straně.,,32x,A1188BF6B67611DF820F00166F1163D4,I 4103,,,14.40573,50.08217,regional.address,geocode,"Vojta, Tomáš (1885-1934)",Autorství T. Vojty není jisté.,,[],[]
pozitiv,Pohled na hlavní (jižní) vstupní portál poutního kostela P. Marie Vítězné na Bílé hoře (čp. 106 v Řepích),13.9.1907,32x,A11880E3B67611DF820F00166F1163D4,VI 26/14,1907-09-13,1907-09-13,14.32187,50.07408,regional.address,geocode,,,,[],[]
pozitiv,Pohled ze zahrad pod Petřínem na Malou Stranu a Pražský hrad.,1869,42x,A14CE92FB67611DF820F00166F1163D4,VI 13/55,1869-01-01,1869-12-31,14.39624,50.08704,regional.address,geocode,"Eckert, Jindřich (1833-1905)",,,[],[]
pozitiv,Celkový pohled na dům čp. 373 (Vrtbovský palác) v Karmelitské ulici na Malé Straně.,,25x,A14CEB40B67611DF820F00166F1163D4,VI 59/1,,,14.40354,50.08695,regional.address,geocode,,,,[],[]
pozitiv,Pohled na plastiku vázy v zahradě Trojského zámku (dům čp. 1 v Troji).,,30x,A14CE935B67611DF820F00166F1163D4,VI 41/5,,,14.4124,50.11648,regional.address,geocode,,,,[],[]
pozitiv,Pražské povstání - 6.5.1945 - v noci z 5. na 6. května Pražané postavili množství barikád - barikáda v Melantrichově ulici naproti orloji.,6.5.1945,147x,A0C505FAB67611DF820F00166F1163D4,IV 74/20,1945-05-06,1945-05-06,14.42109,50.0853,regional.address,geocode,"Stehno, Josef (?)",,,[],[]
pozitiv,Cechovní znak soukeníků na svorníku klenby přízemí domu čp. 144 na Starém Městě.,1990,8x,A14CEB5CB67611DF820F00166F1163D4,VI 66/14 c,1990-01-01,1990-12-31,14.41922,50.08647,regional.address,geocode,"Jelínková, Jana (1951-)",,,[],[]
pozitiv,Pohled z Veleslavínovy ulice na průčelí domu čp. 98 (původní budova knihovny) do Valentinské ulice na Starém Městě.,9.11.1924,18x,c2678dcde5884e3dad485ae4d8c3c07c,A 1423,1924-11-09,1924-11-09,14.41739,50.08739,regional.address,geocode,"Alexander, Antonín (1892-působnost do 1948)",,0.0,[],[]
negativ,Pohled do interiéru Inwaldovy sklárny na Zlíchově - skupina foukačů skla.,1.3.1908,91x,C411356A122211E28E4C6C626D41E503,XII 1136,1908-03-01,1908-03-01,14.40829,50.05324,regional.address,geocode,Eckert-ateliér,,0.0,[],[]
negativ,Pohled na tramvaj na Olšanském náměstí u kostela sv. Rocha na Žižkově. Před kostelem dům čp. 3 na Žižkově.,1897,150x,DAB45FAB9F5711E18C606C626D41E503,XII 847,1897-01-01,1897-12-31,14.45927,50.07815,regional.address,geocode,"Eckert, Jindřich (1833-1905)",,0.0,[],[]
pozitiv,Pohled na portál bývalé kaple sv. Ludmily při kostelu P. Marie před Týnem na Starém Městě odkrytý roku 1886.,1886,43x,A11887A4B67611DF820F00166F1163D4,VI 27/12,1886-01-01,1886-12-31,14.42203,50.08761,regional.address,geocode,"Eckert, Jindřich (1833-1905)",,,[],[]
negativ,Socha sv. Františka na Karlově mostě při opravě.,25.4.1906,32x,2932139D0E2411E2935B6C626D41E503,XII 1054,1906-04-25,1906-04-25,14.41126,50.0865,poi,suggest,Eckert-ateliér,,0.0,[],[]
pozitiv,Pohled do Saské ulice s domem čp. 286 vpravo.,12.10.1930,33x,A0C514A3B67611DF820F00166F1163D4,I 1534,1930-10-12,1930-10-12,14.40602,50.08688,regional.address,geocode,"Alexander, Antonín (1892-působnost do 1948)",,,[],[]
pozitiv,Pohled na Libeňský zámeček - dům čp. 1.,8.2.1908,84x,A14CDC21B67611DF820F00166F1163D4,II 900,1908-02-08,1908-02-08,14.47145,50.10766,regional.address,geocode,"Kříženecký, Jan (1868-1921)",,,[],[]
pozitiv,Pohled na dům čp. 27 na Starém Městě (prelatura kostela sv. Mikuláše) na nároží dnešního náměstí Franze Kafky a Maiselovy ulice.,18.11.1897,18x,A14CE8B8B67611DF820F00166F1163D4,VI 47/6,1897-11-18,1897-11-18,14.41925,50.08848,regional.address,geocode,"Kříženecký, Rudolf (dokument 1897-1931)",,,[],[]
pozitiv,Pohled na kostel sv. Štěpána na Novém Městě během prováděné opravy.,1926,11x,86c7c573242040e4b25815f3a5c73253,Voj 2975,1926-01-01,1926-12-31,14.39374,50.08878,regional.address,geocode,"Vojta, Tomáš (1885-1934)",,0.0,[],[]
pozitiv,"Pohled do interiéru kaple sv. Jana Nepomuckého v severozápadním rohu zahrady usedlosti Kneislovka (dříve dům čp. 114, dnes dům čp. 2339 a 2340) v Břevnově.",,90x,A1186FAAB67611DF820F00166F1163D4,I 8777,,,14.36417,50.02189,regional.address,geocode,,,,[],[]
negativ,Pohled na portál domu čp. 608 na Staroměstském náměstí na Starém Městě.,říjen 1905,29x,FA88D98F9FB111E38B756C626D41E503,XI 78,1905-10-01,1905-10-31,14.42168,50.08832,regional.address,geocode,"Kříženecký, Jan (1868-1921)",,0.0,[],[]
negativ,"Pohřební průvod legionářů popravených během 1. světové války. V pozadí domy čp. (zprava) 856, 857, 858 a 859 v ulici Na Příkopě na Novém Městě.",24.4.1921,41x,93A4AD687F8111E88359406186009F3A,X 1570,1921-04-24,1921-04-24,14.42678,50.08486,regional.address,geocode,"Reach, Zikmund (1859-1935)",,,[],[]
negativ,Pohled do interiéru Thunovského paláce (dům čp. 180) v Thunovské ulici na Malé Straně - salon hraběte Pavla.,7.11.1910,30x,A9B4E121193111E28B046C626D41E503,XII 1236,1910-11-07,1910-11-07,14.40284,50.08938,regional.address,geocode,Eckert-ateliér,,0.0,[],[]
pozitiv,"Celkový pohled na Klementinum na Mariánském náměstí (dům čp. 190, 1040) na Starém Městě z výšky.",1985,46x,A1187955B67611DF820F00166F1163D4,I 4699,1985-01-01,1985-12-31,14.4172,50.08697,regional.address,geocode,"Rameš, František",,,[],[]
pozitiv,"Pohled na Vltavu s vory u Podolského nábřeží. Na druhém břehu v pozadí Smíchov, vlevo v dálce kostel sv. Filipa a Jakuba na Zlíchově.",kol.1950,132x,A118850CB67611DF820F00166F1163D4,I 4283,1950-01-01,1950-12-31,14.41352,50.0482,regional.address,geocode,"Zeman, Josef",,,[],[]
pozitiv,Průhled Kotkovou (dnes Goetheho) ulicí v Bubenči od Kostelního náměstí (dnes Krupkovo) k severozápadu. Vlevo dům čp. 6 v Bubenči.,1.4.1925,84x,A11869B9B67611DF820F00166F1163D4,I 206,1925-04-01,1925-04-01,14.40442,50.10736,regional.address,geocode,"Alexander, Antonín (1892-působnost do 1948)",,,[],[]
pozitiv,Pohled na Senovážném náměstí s domy (zleva) čp. 979 a 976 na Novém Městě. V pozadí věž zvonice kostela sv. Jindřicha.,kol.1910,94x,A1188691B67611DF820F00166F1163D4,VI 7/52 b,1910-01-01,1910-12-31,14.43023,50.08551,regional.address,geocode,,,,[],[]
negativ,Pohled přes plot ve Valdštejnské ulici do Fürstenberské zahrady na Malé Straně.,8.3.1912,21x,42188C8E63E211E296F46C626D41E503,XII 1322,1912-03-08,1912-03-08,14.40889,50.09144,regional.address,geocode,Eckert-ateliér,,0.0,[],[]
pozitiv,Pohled na dům čp. 62 (Perucka) na Vinohradech.,29.9.1929,41x,A0C4F73BB67611DF820F00166F1163D4,I 1950,1929-09-29,1929-09-29,14.35757,49.98663,regional.address,geocode,"Alexander, Antonín (1892-působnost do 1948)",,,[],[]
pozitiv,Pohled na stavbu železné části Hlávkova mostu. V pozadí provizorní dřevěný most.,18.5.1909,76x,70C512D5F19D11E5A522000C76270B94,I 11613,1909-05-18,1909-05-18,14.4369,50.09567,regional.street,suggest,,,,[],[]
negativ,Pohled na zadní část Libeňského zámečku - domu čp. 1 v Libni.,8.2.1908,61x,B498D98EEB2F11E3ABDE0024BE7CD9AC,XI 516,1908-02-08,1908-02-08,14.46926,50.10457,regional.address,geocode,"Kříženecký, Jan (1868-1921)",,0.0,[],[]
pozitiv,Celkový pohled na opatství benediktinek beuronské kongregace (dům čp. 106) s kostelem sv. Gabriela (rovněž kostel Zvěstování P. Marie) v Holečkově ulici na Smíchově.,,76x,CDC8A0A6E22C11E6A537406186009F3A,I 11914,,,14.39607,50.07488,regional.address,geocode,,,,[],[]
pozitiv,Pohled do Štupartské ulice na Starém Městě s domy čp. (zleva) 599 a 600.,22.6.1945,53x,FDC9249B344411E98097406186009F3A,A 17149,1945-06-22,1945-06-22,14.42347,50.08727,regional.address,geocode,"Alexander, Antonín (1892-působnost do 1948)",,0.0,[],[]
pozitiv,Pohled na vstupní portál kláštera Premonstrátů na Strahově od Pohořelce.,13.8.1908,19x,A14CDACFB67611DF820F00166F1163D4,VI 25/21,1908-08-13,1908-08-13,14.38967,50.08671,regional.address,geocode,,,,[],[]
negativ,Celkový pohled na hlavní průčelí kostela sv. Jana Nepomuckého v Kanovnické ulici na Hradčanech.,11.8.1903,24x,A0C5160DB67611DF820F00166F1163D4,VIII 745,1903-08-11,1903-08-11,14.39366,50.09013,regional.address,geocode,"Eckert, Jindřich (1833-1905)",,,[],[]
pozitiv,Pohled na spodní část průčelí domu čp. 1075 na Starém Městě v Pařížské ulici.,1986,54x,A14CDAB5B67611DF820F00166F1163D4,I 8668,1986-01-01,1986-12-31,14.41987,50.08837,regional.address,geocode,"Rameš, František",,,[],[]
pozitiv,Pohled do interiéru hradu Karlštejn - kaple sv. Kateřiny.,,13x,A14CEA59B67611DF820F00166F1163D4,VI 37/8 d,,,14.25487,49.94465,poi,suggest,"Eckert, Jindřich (1833-1905)",,,[],[]
pozitiv,Pohled na západní průčelí Stavovského divadla (dům čp. 540 na Starém Městě).,kol.1930,27x,1C0F0DA4B0E511E29177406186009F3A,I 9725,1930-01-01,1930-12-31,14.42349,50.08599,regional.address,geocode,Centropress Praha XII.,,,[],[]
negativ,Pohled na severní portál kostela P. Marie před Týnem na Starém Městě.,7.6.1906,17x,9A756A0AA93211E3839F0024BE7CD9AC,XI 139,1906-06-07,1906-06-07,14.42396,50.08884,regional.address,geocode,"Kříženecký, Jan (1868-1921)",,0.0,[],[]
negativ,Pohled na nástěnnou malbu v domě čp. 240 (Bretfeldovský palác) v Nerudově ulici na Malé Straně.,kol.1900,32x,551489CA0ADF11E1BEC2000C766D2371,XII 406,1900-01-01,1900-12-31,14.39828,50.08841,regional.address,geocode,"Eckert, Jindřich (1833-1905)",,0.0,[],[]
pozitiv,Pohled na zahradní průčelí domu čp. 153 (Fürstenberský palác) na Malé Straně z Valdštejnské ulice. V pozadí Pražský hrad.,kol.1920,78x,A0C5114CB67611DF820F00166F1163D4,I 833,1920-01-01,1920-12-31,14.40696,50.09058,regional.address,geocode,"Vojta, Tomáš (1885-1934)",,,[],[]
negativ,Pohled do interiéru kostela sv. Vavřince v Černovičkách - s podstavcem pro oltář.,[1863-1945],8x,89DE44CF92D611E193C36C626D41E503,XII 509,,,14.25948,50.1417,regional.address,geocode,Eckert,Datace neznámá. Za účelem vyhledávání byla nastavena na časový rozsah celé sbírky.,0.0,[],[]
pozitiv,Pohled do interiéru kostela sv. Cyrila a Metoděje v Resslově ulici na Novém Městě - výzdoba kruchty a kostelní klenby malbami a štukem.,27.9.1934,19x,115f553ab832472cac8a949c12725bf9,A 9064,1934-09-27,1934-09-27,14.41762,50.07596,regional.address,geocode,"Alexander, Antonín (1892-působnost do 1948)",,0.0,[],[]
negativ,Socha sv. Václava na Karlově mostě. V pozadí domy na Kampě.,20.10.1907,65x,241A83A03DDE11E0BDF1000C766D2371,XII 237,1907-10-20,1907-10-20,14.41126,50.0865,poi,suggest,Eckert-ateliér,,0.0,[],[]
negativ,"Pohled do Kinského třídy (Štefánikova ulice) s domy čp. 4, 5 a 6, 7 (Švandovo divadlo) na Smíchově.",kol.1905,57x,A11878D8B67611DF820F00166F1163D4,X 530,1905-01-01,1905-12-31,14.40399,50.07781,regional.address,geocode,,,,[],[]
pozitiv,Průhled Poděbradovou ulicí (od Říjnové ulice) v Ďáblicích.,1975,68x,A0C5076EB67611DF820F00166F1163D4,I 342,1975-01-01,1975-12-31,14.48458,50.16499,regional.street,suggest,"Jelínková, Jana (1951-)",,,[],[]
pozitiv,Pohled do Vězeňské ulice na Starém Městě od křižovatky s Dušní ulicí.,17.4.1904,41x,A0C4FB53B67611DF820F00166F1163D4,VI 58/3,1904-04-17,1904-04-17,14.42159,50.0902,regional.address,geocode,"Eckert, Jindřich (1833-1905)",,,[],[]
negativ,Průhled Václavským náměstím k Můstku. Vpravo dům čp. 819 na Novém Městě.,12.5.1910,36x,0C3CBEA716DF11E2B3CE6C626D41E503,XII 1203,1910-05-12,1910-05-12,14.42818,50.08133,regional.address,geocode,Eckert-ateliér,,0.0,[],[]
pozitiv,"Pohled do ulice Selské v Hostivaři, v popředí kostel sv. Jana Křtitele a dřevěná zvonice.",28.5.1959,51x,A118888EB67611DF820F00166F1163D4,I 9074,1959-05-28,1959-05-28,14.52231,50.04883,regional.address,geocode,"Hnilička, Eduard (1887-1967)",,,[],[]
pozitiv,Pohled na portál domu čp. 454 v ulici Újezd na Malé Straně.,8.6.1906,17x,A1187752B67611DF820F00166F1163D4,VI 23/17,1906-06-08,1906-06-08,14.40454,50.08407,regional.address,geocode,,,,[],[]
negativ,Pohled do interiéru staroměstských masných krámů na nároží Štupartské a Masné ulice (dům čp. 956 na Starém Mestě).,kol.1920,44x,A1188257B67611DF820F00166F1163D4,X 3032,1920-01-01,1920-12-31,14.42578,50.08961,regional.address,geocode,,,,[],[]
pozitiv,Detail hlavy sochy Atlanta z věže Klementina (dům čp. 190) na Starém Městě.,9.6.1914,15x,908811C4BDC011E493C10024BE7CD9AC,V 4/6 d,1914-06-09,1914-06-09,14.4172,50.08697,regional.address,geocode,,,,[],[]
pozitiv,"Pohled na Strossmayerovo náměstí s domy čp. 967, čp. 966 a čp. 965 a s kostelem sv. Antonína z Padovy v Holešovicích.",před 1926,84x,EA037858669011E481D7D4BED94BB14D,I 11044,1800-01-01,1925-12-31,14.4341,50.09865,regional.address,geocode,"Vojta, Tomáš (1885-1934)",,,[],[]
negativ,"Pohled na karlínský břeh. V popředí přívoz, v pozadí část ostrova Štvanice.",kol.1900,59x,A0C50B92B67611DF820F00166F1163D4,X 485,1900-01-01,1900-12-31,14.46071,50.09672,regional.address,geocode,,,,[],[]
pozitiv,Pohled od tratě pod Barrandovskou skálou na vltavské údolí. Vpravo břeh u Malé Chuchle s přístavištěm parníků. Součást panoramatu.,15.6.1927,57x,A14CDD68B67611DF820F00166F1163D4,I 8806,1927-06-15,1927-06-15,14.39178,50.02443,regional.address,geocode,"Alexander, Antonín (1892-působnost do 1948)",,,[],[]
pozitiv,"Pohled na sovětský tank na Staroměstském náměstí v srpnu 1968. V pozadí zleva domy čp. 934, čp. 932 a čp. 930 na Starém Městě.",srpen 1968,62x,A118859EB67611DF820F00166F1163D4,I 9207,1968-08-01,1968-08-31,14.42135,50.08837,regional.address,geocode,,,,[],[]
negativ,"""Tycho Brahe v Praze"" - výročí 1901. T.III. Nádvoří Klementina s věží hvězdárny (dům čp. 190, 1040 na Starém Městě).",1901,22x,A1188607B67611DF820F00166F1163D4,VIII 792,1901-01-01,1901-12-31,14.4172,50.08697,regional.address,geocode,"Eckert, Jindřich (1833-1905)",,,[],[]
pozitiv,"Okupace 1939-1945 - Pamětní deska ""Památce popravených vlastenců v září a říjnu 1941"" se jmény zastřelených vysokoškoláků 17.11.1939 v Ruzyni.",,31x,A1187083B67611DF820F00166F1163D4,I 5807,,,14.30797,50.08644,regional.address,geocode,,,,[],[]
CD-ROM,Prvá vlna povodně v Praze - pohled přes Vltavu na Lahovice 9.8.2002 v 7.30.,9.8.2002,28x,A14CDBBAB67611DF820F00166F1163D4,XXII 6/3,2002-08-09,2002-08-09,14.40833,49.99252,regional.address,geocode,"Elleder, Libor, Ing. (působnost 2002)",,0.0,[],[]
pozitiv,Průhled údolím v zahradě usedlosti Cibulka v Košířích (dům čp. 118) k jihu.,říjen 1924,51x,A0C51500B67611DF820F00166F1163D4,I 4610,1924-10-01,1924-10-31,14.35655,50.06696,regional.address,geocode,"Vojta, Tomáš (1885-1934)",,,[],[]
pozitiv,Původní výzdoba vestibulu konečné stanice trasy A Leninova (dnes Dejvická).,1978,168x,A0C51681B67611DF820F00166F1163D4,I 1568,1978-01-01,1978-12-31,14.39275,50.10051,poi,suggest,"Jelínková, Jana (1951-)",,,[],[]
negativ,Pohled na nástropní fresku kostela sv. Františka Serafinského na Křižovnickém náměstí na Starém Městě - detail.,27.6.-16.7.1903,17x,BCAE3617176311E294C46C626D41E503,XII 928,,,14.41405,50.08641,regional.address,geocode,"Eckert, Jindřich (1833-1905)",,0.0,[],[]
negativ,"Pohled domy čp. (zleva) 934, 932 a 930 na severní straně Staroměstského náměstí. Druhá část šestidílného panoramatu.",25.4.1909,19x,F99E54B724AB11E9B9F9406186009F3A,XI 1047,1909-04-25,1909-04-25,14.42134,50.08837,regional.address,geocode,"Kříženecký, Jan (1868-1921)",,0.0,[],[]
negativ,Pohled do interiéru domu čp. 216 (Obecná a měšťanská dívčí škola u sv. Vojtěcha) na Novém Městě - šatna.,1907,36x,810ACC5AB97E11E3AFA20024BE7CD9AC,XI 310,1907-01-01,1907-12-31,14.41497,50.07885,regional.address,geocode,"Kříženecký, Jan (1868-1921)",,0.0,[],[]
pozitiv,Pohled na vjezd do dvora domu čp. 1 (zájezdní hostinec) v Hloubětíně v Poděbradské ulici.,30.3.1930,46x,ECE052576EE811E88F4674D435EEBE90,A 5594,1930-03-30,1930-03-30,14.54392,50.10747,regional.address,geocode,"Alexander, Antonín (1892-působnost do 1948)",,0.0,[],[]
negativ,"Pohled do interiéru Albrechtských kasáren (Štefánikova - původně dům čp. 416 na Malé Straně, dnes dům čp. 234 na Smíchově) - důstojnická jídelna.",7.3.1909,85x,F6031F9417A711E294C46C626D41E503,XII 1214,1909-03-07,1909-03-07,14.40506,50.0789,regional.address,geocode,Eckert-ateliér,,0.0,[],[]
pozitiv,Pohled na viničný altán nad vinicí při Gröbově vile (dům čp. 58 na Vinohradech),kol.1910 - 1995 (repro),48x,A0C5125DB67611DF820F00166F1163D4,I 1866,1910-01-01,1910-12-31,14.44433,50.06866,poi,suggest,"Jelínková, Jana (1951-)",,,[],[]
negativ,Slavnostní kladení závěrného kamene pilíře Čechova mostu při příležitosti návštěvy císaře Františka Josefa I. v Praze.,17.4.1907,63x,A1188C75B67611DF820F00166F1163D4,VIII 293,1907-04-17,1907-04-17,14.4171,50.093,regional.street,suggest,Eckert-ateliér,,0.0,[],[]
pozitiv,"Pražské povstání - 8.5.1945. Barikáda v ulici Na Zbořenci na Novém Městě - pohled od Karlova náměstí. Nápis ""JEN PŘES NAŠE MRTVOLY"".",9.5.1945,59x,A0C5047BB67611DF820F00166F1163D4,I 6556,1945-05-09,1945-05-09,14.41745,50.07742,regional.address,geocode,"Pacovský, Jaroslav",,,[],[]
pozitiv,Pohled na Malou Stranu z okna Thunovského paláce (dům čp. 180) na Malé Straně. Vlevo část Pražského hradu. Uprostřed v pozadí Mariánské hradby s Hanavským pavilonem (dům čp. 175 v Holešovicích).,29.3.1907,49x,A14CE8B6B67611DF820F00166F1163D4,VI 13/33,1907-03-29,1907-03-29,14.40402,50.08968,regional.address,geocode,Eckert-ateliér,,,[],[]
negativ,"Pohled na usedlost Cibulka (dům čp. 118) v Košířích, záběr na čínský pavilon.",1974,64x,A0C4FA44B67611DF820F00166F1163D4,VII 554,1974-01-01,1974-12-31,14.35655,50.06696,regional.address,geocode,"Chalupníček, Miroslav -, Chalupníčková, Věra (dokument 1941-1948)",,,[],[]
negativ,"Pohled na malbu na domě čp. 415 (hostinec U Pěti králů) ve Vyšehradské ulici na Novém Městě - ""S.Wenzeslaus"".",21.2.1905,44x,F21A4C5824AE11E0BDC8000C766D2371,XII 158,1905-02-21,1905-02-21,14.41704,50.06846,regional.address,geocode,Eckert-ateliér,,0.0,[],[]
pozitiv,Pohled na náhrobky na Starém židovském hřbitově v Josefově.,1908,33x,A14CE8CEB67611DF820F00166F1163D4,VI 12/3 j,1908-01-01,1908-12-31,14.45094,50.08172,poi,suggest,,,,[],[]
pozitiv,Pohled na klenby hospodářského dvora fary v Bohnicích (dům čp. 4).,31.7.1942,26x,b074c3cbfc8e402bb375e83c15a5011a,A 14454,1942-07-31,1942-07-31,14.43282,50.12913,regional.address,geocode,"Alexander, Antonín (1892-působnost do 1948)",,0.0,[],[]
negativ,"Pohled na dům ""U Černého orla"" (čp. 960) na nároží Valentinské a Kaprovy ulice na Starém Městě.",kol.1895,37x,F9E98555A4D711E1BEEC000C766D2371,VIII 1143,1895-01-01,1895-12-31,14.41639,50.08804,regional.address,geocode,"Eckert, Jindřich (1833-1905)",,,[],[]
negativ,Pohled do interiéru domu čp. 216 (Obecná a měšťanská dívčí škola u sv. Vojtěcha) na Novém Městě - šatna.,1907,17x,B7C6DEBBB9A711E39F720024BE7CD9AC,XI 335,1907-01-01,1907-12-31,14.41497,50.07885,regional.address,geocode,"Kříženecký, Jan (1868-1921)",,0.0,[],[]
negativ,Tympanon kostela svatého Jiří na Pražském hradě zobrazující korunování P. Marie s Ježíškem na klíně.,před 1886,21x,14E0D02A23B611E0BDC7000C766D2371,XII 143,1800-01-01,1885-12-31,14.40231,50.09093,regional.address,geocode,"Eckert, Jindřich (1833-1905)",,0.0,[],[]
pozitiv,Pohled do staré zasedací síně Staroměstské radnice (dům čp. 1 na Starém Městě) těsně po výměně nástěnné výzdoby. Štíty s cechovními a šlechtickými znaky nahradily roku 1885 původní obrazy.,1885,25x,A14CEA57B67611DF820F00166F1163D4,VI 61/16 b,1885-01-01,1885-12-31,14.42009,50.087,regional.address,suggest,"Eckert, Jindřich (1833-1905)",,,[],[]
negativ,Pohled ze střechy Rudolfina přes Vltavu s Železnou lávkou na Malou Stranu (Klárov a Strakovo nábřeží). V pozadí Pražský hrad.,kol.1880,51x,045AC68B232311E0BDC6000C766D2371,XII 137,1880-01-01,1880-12-31,14.41521,50.09017,regional.address,geocode,"Eckert, Jindřich (1833-1905), Müllern, Julius (1831-1904)",,0.0,[],[]
negativ,"Průhled Karmelitskou ulicí s průlomem U Klíčů - po zboření domů čp. 298, čp. 270, čp. 269 na Malé Straně. Uprostřed zadní průčelí domů čp. 299 (s plakáty), čp. 300, čp. 268 na Malé Straně. V pozadí věže kostela sv. Mikuláše, vlevo ústí ulice Tržiště. Reprodukce pozitivu.",11.6.1898,36x,A0C50DE0B67611DF820F00166F1163D4,VIII 248,1898-06-11,1898-06-11,14.40384,50.08717,regional.address,geocode,"Eckert, Jindřich (1833-1905)",,,[],[]
negativ,Model komunikace pod Letnou - tunel.,20.2.1908,55x,8DE10D78074011E48CE60024BE7CD9AC,XI 541,1908-02-20,1908-02-20,14.42457,50.09693,regional.street,suggest,"Kříženecký, Jan (1868-1921)",,0.0,[],[]
pozitiv,"Pohled na vstupní portál domu čp. 365 (""palác Schönbornský"") v ulici Tržiště na Malé Straně.",31.5.1906,24x,A0C4F8BFB67611DF820F00166F1163D4,VI 22/33,1906-05-31,1906-05-31,14.40131,50.08733,regional.address,geocode,,,,[],[]
pozitiv,"Pohled na Staroměstské náměstí zleva s domy čp. 932 (část), čp. 930 (""Stará mincovna"") a čp. 929 (část) na Starém Městě.",1901,20x,A14CEA4DB67611DF820F00166F1163D4,VI 47/40,1901-01-01,1901-12-31,14.42151,50.08853,regional.address,geocode,"Eckert, Jindřich (1833-1905)",,,[],[]
negativ,Celkový pohled na průčelí domu čp. 16 (Auerspergský palác) na Valdštejnském náměstí na Malé Straně.,kol.1885,19x,54F6D4DAED8E11DFBD7C000C766D2371,XII 25,1885-01-01,1885-12-31,14.40488,50.0899,regional.address,geocode,"Eckert, Jindřich (1833-1905)",,0.0,[],[]
pozitiv,Reprodukce schematického znázornění pražských mostů s popisem materiálu.,,15x,A0C4F8C5B67611DF820F00166F1163D4,VI 39/29,,,14.41126,50.0865,poi,suggest,,,,[],[]
pozitiv,Pohled do interiéru domu čp. 216 (Obecná a měšťanská dívčí škola u sv. Vojtěcha) ve Vojtěšské ulici na Novém Městě - učebna 5. třídy.,5.6.1907,40x,A11876D1B67611DF820F00166F1163D4,V 11/5 c,1907-06-05,1907-06-05,14.41497,50.07885,regional.address,geocode,"Kříženecký, Jan (1868-1921)",,,[],[]
negativ,Obecní zásobárna za 1. světové války v jízdárně Valdštejnského paláce na Malé Straně (dům čp. 17).,1915,28x,4DD445A123C511E4BF24406186009F3A,XI 3720,1915-01-01,1915-12-31,14.40535,50.09003,regional.address,geocode,"Kříženecký, Jan (1868-1921)",,0.0,[],[]
pozitiv,Pohled do severní části Haštalského náměstí na Starém městě mezi farou (dům čp. 789) a kostelem sv. Haštala. V pozadí dům čp. 808.,8.8.1944,50x,CAAC8DFD295911E994E6406186009F3A,A 16128,1944-08-08,1944-08-08,14.42401,50.09154,regional.address,geocode,"Alexander, Antonín (1892-působnost do 1948)",,0.0,[],[]
negativ,Pohled na odkrytou Starou Strahovskou bránu na Hradčanech.,kol.1898,37x,A11878EEB67611DF820F00166F1163D4,VIII 928,1898-01-01,1898-12-31,14.39352,50.0884,regional.address,geocode,"Eckert, Jindřich (1833-1905)",,,[],[]
negativ,Pohled do interiéru kostela sv. Ignáce na Karlově náměstí na Novém Městě - oltář P. Marie.,1913,45x,0B2F1A5D6AF911E295C66C626D41E503,XII 1357,1913-01-01,1913-12-31,14.42112,50.07643,regional.address,geocode,Eckert-ateliér,,0.0,[],[]
pozitiv,Celkový pohled na Karlův most z Novotného lávky. V pozadí Pražský hrad - levá část pohledu.,1890,35x,A11878D6B67611DF820F00166F1163D4,VI 39/8 a,1890-01-01,1890-12-31,14.4133,50.08541,regional.address,geocode,,,,[],[]
pozitiv,"Pohled na Arbesovo náměstí s domy zprava čp. 1107, 753, 781, 782, 742 na Smíchově.",1940-1945,124x,A0C4F6C2B67611DF820F00166F1163D4,I 1618,1940-01-01,1945-12-31,14.4062,50.0759,regional.address,geocode,"Vopravil, Josef (1902-1972)",,,[],[]
negativ,"Průhled Kaprovou ulicí k východu. Uprostřed zprava domy 47, 45, 44 na Starém Městě krátce před zbořením. V pozadí věž Staroměstské radnice.",30.1.1907,38x,A14CE425B67611DF820F00166F1163D4,VIII 535,1907-01-30,1907-01-30,14.41953,50.09157,regional.address,geocode,Eckert-ateliér,,,[],[]
pozitiv,"Pohled na vstupní portál domu čp. 184 (""Palác Věžníků"") v Thunovské ulici na Malé Straně.",10.7.1906,17x,A11867CCB67611DF820F00166F1163D4,VI 21/45,1906-07-10,1906-07-10,14.40144,50.08913,regional.address,geocode,,,,[],[]
negativ,Průhled Václavským náměstím od Můstku k Muzeu.,29.4.1906,35x,E06269CE16D511E2B3CE6C626D41E503,XII 1191,1906-04-29,1906-04-29,14.42863,50.08014,regional.address,geocode,Eckert-ateliér,,0.0,[],[]
pozitiv,Pohled na dům čp. 205 v Pařížské ulici v Josefově.,13.10.1944,57x,A1188898B67611DF820F00166F1163D4,I 9295,1944-10-13,1944-10-13,14.4181,50.09109,regional.address,geocode,"Alexander, Antonín (1892-působnost do 1948)",,,[],[]
pozitiv,Pohled na kašnu se sochou Herkula ve dvoře Hrzánského paláce (dům čp. 177 na Hradčanech).,kol.1925,30x,A1188259B67611DF820F00166F1163D4,I 9036,1925-01-01,1925-12-31,14.39408,50.08858,regional.address,geocode,"Vojta, Tomáš (1885-1934)",,,[],[]
pozitiv,Pohled na část novoměstské hradební zdi v ulici Na Slupi u mostu přes Botič u Ostrčilova náměstí.,před 1926,68x,A1187E69B67611DF820F00166F1163D4,I 4048,1800-01-01,1925-12-31,14.42486,50.06518,regional.address,geocode,"Vojta, Tomáš (1885-1934)",,,[],[]
pozitiv,Pohled na náhrobky Židovského hřbitova na Žižkově (v místech dnešních Mahlerových sadů).,14.4.1933,80x,F03BBC9AF1E111E6BC06406186009F3A,A 7704,1933-04-14,1933-04-14,14.45166,50.08126,regional.address,geocode,"Alexander, Antonín (1892-působnost do 1948)",,0.0,[],[]
pozitiv,Otevřená rakev s ostatky sv. Norberta ve Strahovském klášteře (dům čp. 132 na Hradčanech).,27.6.1916,30x,D98786FF473C11E180176C626D41E503,I 9546,1916-06-27,1916-06-27,14.38967,50.08671,regional.address,geocode,"Pantoflíček, Jaroslav",,,[],[]
kresba tužkou,"Domovní znamení na domě čp. 382 na Starém Městě (""U Samuele"").",,12x,A0C50AFEB67611DF820F00166F1163D4,VI 1/24,,,14.42265,50.08451,regional.address,geocode,,,,[],[]
negativ,Pohled na novoměstskou stranu nové Koňské brány.,1874,86x,26683150B39211E59222406186009F3A,IX 3,1874-01-01,1874-12-31,14.43055,50.07918,regional.address,geocode,"Pták, Karel (1839-1911)",,,[],[]
pozitiv,Pražské povstání - květen 1945. Německý tankový stíhač na Dlabačově na Břevnově 7.5.1945.,7.5.1945,45x,A0C503D3B67611DF820F00166F1163D4,II 1212,1945-05-07,1945-05-07,14.38601,50.08621,regional.address,geocode,"Dub, Václav (dokumenty 1928-1983)",,,[],[]
pozitiv,Pohled na práce v horním ohlaví plavebních komor u ostrova Štvanice pod nedokončenou železnou částí Hlávkova mostu. V pozadí provizorní dřevěný most.,3.10.1909,48x,A097FCAC646A11E6A554000C76270B94,I 11856,1909-10-03,1909-10-03,14.4369,50.09567,regional.street,suggest,,,,[],[]
pozitiv,"Pohled na vnitřní portál Klementina (dům čp. 190, 1040) v Křižovnické ulici na Starém Městě.",4.9.1908,27x,A11886F2B67611DF820F00166F1163D4,VI 17/20 a,1908-09-04,1908-09-04,14.41554,50.08802,regional.address,geocode,,,,[],[]
pozitiv,Pohled na portál bývalého domu čp. 933 na Staroměstském náměstí na Starém Městě.,2.5.1908,15x,A0C50698B67611DF820F00166F1163D4,VI 17/19,1908-05-02,1908-05-02,14.41994,50.08663,regional.address,geocode,,,,[],[]
pozitiv,"Pohled na malý portál domu čp. 450 (Michnův palác, Tyršův dům) v ulici Újezd na Malé Straně.",22.5.1909,22x,A0C50519B67611DF820F00166F1163D4,VI 23/14,1909-05-22,1909-05-22,14.4049,50.08346,regional.address,geocode,,,,[],[]
pozitiv,Socha Marnivce v jižním průčelí Staroměstské radnice (dům čp. 1 na Starém Městě) na Staroměstském náměstí.,říjen 1930,31x,848DE9D4D39711E8A2B874D435EEBE90,Voj 4094,1930-10-01,1930-10-31,14.34054,50.07267,regional.address,suggest,"Vojta, Tomáš (1885-1934)",,0.0,[],[]
pozitiv,Pohled na model sochy (autor Vilém Amort) pro výzdobu domu čp. 934 na Staroměstském náměstí (Schierův - podle stavitele Franze Schiera).,19.7.1897,35x,6770AD3DC32511E998F074D435EEBE90,VI 34/30 b,1897-07-19,1897-07-19,14.42048,50.08805,regional.address,geocode,"Mulač, Jan",,,[],[]
negativ,Pohled na portrétní bustu Jana Lucemburského v triforiu chrámu sv. Víta na Pražském hradě.,květen 1924,28x,E53BD23A3D9E11E499B8406186009F3A,XI 6288,1924-05-01,1924-05-31,14.4006,50.09089,poi,suggest,Eckert-ateliér,,0.0,[],[]
pozitiv,"Pohled do Chotkovy silnice na Malé Straně z výšky - z terasy domu čp. 134 směrem k západu. Zprava domy čp. 144, čp. 551, čp. 538, čp. 607 (část). Vlevo část domu čp. 145 na Malé Straně.",2.2.1934,70x,203BE606D5A111E18CF36C626D41E503,I 4890,1934-02-02,1934-02-02,14.40905,50.09295,regional.address,geocode,"Alexander, Antonín (1892-působnost do 1948)",,,[],[]
pozitiv,"Pohled na přípravné výkopové práce pro budovu ministerstva obchodu (dům čp. 1039) v ulici Na Františku na Starém Městě, při nichž došlo k odhalení pozůstatků staroměstských hradeb a původního nábřeží. V pozadí domy (zleva) čp. 1503 (v Revoluční ulici na Novém Městě), 774 (v ulici Na Františku), 1403 a 1247 (v Revoluční ulici na Novém Městě), 989 (v ulici Řásnovka) a domy čp. 940 a 759 (v Haštalské ulici).",17.5.1928,538x,2DE83350580211E7A695406186009F3A,A 4186,1928-05-17,1928-05-17,14.42582,50.09301,regional.address,suggest,"Alexander, Antonín (1892-působnost do 1948)",,0.0,[],[]
pozitiv,Průhled ulicí V Edenu.,1979,297x,A1188978B67611DF820F00166F1163D4,I 359,1979-01-01,1979-12-31,14.35276,49.98896,regional.address,geocode,"Vymazal, Jan",,,[],[]
pozitiv,Pohled na renesanční portál domu čp. 490 (palác Metychů z Čečova - Hrzánský) na Velkopřevorském náměstí na Malé Straně.,kol.1935,24x,ADF497B805BA11E389696C626D41E503,I 9768,1935-01-01,1935-12-31,14.40739,50.08615,regional.address,geocode,,,,[],[]
