{"type": "FeatureCollection", "features": [{"type": "Feature", "geometry": {"type": "Point", "coordinates": [14.4182, 50.08587]}, "properties": {"id": "00110F67D6D411E89BFA74D435EEBE90", "kind": "pozitiv", "description": "Pohled na dům čp. 230 na nároží ulic Karlovy a Husovy na Starém Městě.", "date_label": "listopad 1909", "start_date": "1909-11-01", "end_date": "1909-11-30", "author": "", "note": "", "views": "24x", "geolocation_type": "regional.address"}}, {"type": "Feature", "geometry": {"type": "Point", "coordinates": [14.41521, 50.09017]}, "properties": {"id": "002322E8769411E2BF17525400E46D25", "kind": "negativ", "description": "Celkový pohled od západu přes Vltavu na Rudolfinum před dokončením (dům čp. 79 na Starém Městě) na Starém Městě.", "date_label": "kol.1884", "start_date": "1884-01-01", "end_date": "1884-12-31", "author": "Eckert, Jindřich (1833-1905)", "note": "", "views": "25x", "geolocation_type": "regional.address"}}, {"type": "Feature", "geometry": {"type": "Point", "coordinates": [14.41321, 50.08173]}, "properties": {"id": "006F2F2887DA11E2BF21525400E46D25", "kind": "negativ", "description": "Pohled do interiéru domu čp. 1012 na Starém Městě na Národní třídě (kavárna Slávia) - kavárenský salon.", "date_label": "6.10.1905", "start_date": "1905-10-06", "end_date": "1905-10-06", "author": "Eckert-ateliér", "note": "", "views": "57x", "geolocation_type": "regional.address"}}, {"type": "Feature", "geometry": {"type": "Point", "coordinates": [14.40131, 50.08733]}, "properties": {"id": "0169865779DF11E3B274406186009F3A", "kind": "pozitiv", "description": "Pohled do vstupního průjezdu Schönbornského paláce - domu čp. 365 na Malé Straně.", "date_label": "červen 1931", "start_date": "1931-06-01", "end_date": "1931-06-30", "author": "Vojta, Tomáš (1885-1934)", "note": "", "views": "27x", "geolocation_type": "regional.address"}}, {"type": "Feature", "geometry": {"type": "Point", "coordinates": [14.31195, 50.08129]}, "properties": {"id": "01BEC72D808611E4AAB4406186009F3A", "kind": "pozitiv", "description": "Pohled na bourání domu čp. 16 na Starém Městě (Andělská kolej) při asanaci. V pozadí nad jeho zbytky domy čp. 18, čp. 17, čp. 14 a čp. 13 v Mikulášské ulici (dnes náměstí Franze Kafky).", "date_label": "3.4.1909", "start_date": "1909-04-03", "end_date": "1909-04-03", "author": "Kříženecký, Jan (1868-1921)", "note": "", "views": "71x", "geolocation_type": "regional.address"}}, {"type": "Feature", "geometry": {"type": "Point", "coordinates": [14.40739, 50.08615]}, "properties": {"id": "01C46EEB04FC11E3A4F66C626D41E503", "kind": "pozitiv", "description": "Pohled na dům čp. 490 (palác Metychů z Čečova - Hrzánský) na Velkopřevorském náměstí na Malé Straně v zimě.", "date_label": "kol.1920", "start_date": "1920-01-01", "end_date": "1920-12-31", "author": "Rázek, Antonín", "note": "", "views": "28x", "geolocation_type": "regional.address"}}, {"type": "Feature", "geometry": {"type": "Point", "coordinates": [14.41804, 50.08583]}, "properties": {"id": "01DC38A404D811E3A4F66C626D41E503", "kind": "pozitiv", "description": "Pohled na spodní část průčelí domu čp. 228 v Husově ulici na Starém Městě - odkrytý pozdně gotický portál a nad ním nově osazená deska s domovním znamením s plastikou tygra z umělého kamene (\"Skořepova plzeňská pivnice \"U Zlatého tygra\").", "date_label": "6.12.1935", "start_date": "1935-12-06", "end_date": "1935-12-06", "author": "Alexander, Antonín (1892-působnost do 1948)", "note": "", "views": "58x", "geolocation_type": "regional.address"}}, {"type": "Feature", "geometry": {"type": "Point", "coordinates": [14.41724, 50.08595]}, "properties": {"id": "01F1A8D1A4BA11E1BEEC000C766D2371", "kind": "negativ", "description": "Pohled do interiéru domu čp. 223 (Svatováclavská záložna) v Karlově ulici na Starém Městě - restaurace.", "date_label": "kol.1890", "start_date": "1890-01-01", "end_date": "1890-12-31", "author": "Eckert, Jindřich (1833-1905)", "note": "", "views": "35x", "geolocation_type": "regional.address"}}, {"type": "Feature", "geometry": {"type": "Point", "coordinates": [14.42009, 50.087]}, "properties": {"id": "0225236C124111E8A338406186009F3A", "kind": "pozitiv", "description": "Pohled na osvětlenou Staroměstskou radnici při příležitosti 10. výročí samostatnosti Československé republiky.", "date_label": "28.10.1928", "start_date": "1928-10-28", "end_date": "1928-10-28", "author": "Vopravil, Josef (1902-1972)", "note": "", "views": "58x", "geolocation_type": "regional.address"}}, {"type": "Feature", "geometry": {"type": "Point", "coordinates": [14.43056, 50.07918]}, "properties": {"id": "023BE336990811E5BFC4406186009F3A", "kind": "negativ", "description": "Pohled na Václavské náměstí od ústí Vodičkovy ulice (z patra domu čp. 791-II) k Národnímu muzeu.", "date_label": "1910", "start_date": "1910-01-01", "end_date": "1910-12-31", "author": "Reach, Zikmund (1859-1935)", "note": "", "views": "75x", "geolocation_type": "regional.address"}}, {"type": "Feature", "geometry": {"type": "Point", "coordinates": [14.42009, 50.087]}, "properties": {"id": "0282D68E90E311E8B3B474D435EEBE90", "kind": "pozitiv", "description": "Pohled na část jižního průčelí Staroměstské radnice při restaurování orloje (dům čp. 1 na Starém Městě) na Staroměstském náměstí. Detail levé fiály před opravou.", "date_label": "11.9.1911", "start_date": "1911-09-11", "end_date": "1911-09-11", "author": "Kříženecký, Jan (1868-1921)", "note": "", "views": "36x", "geolocation_type": "regional.address"}}, {"type": "Feature", "geometry": {"type": "Point", "coordinates": [14.41979, 50.08642]}, "properties": {"id": "02DCE9DB8B1C11E2BF22525400E46D25", "kind": "negativ", "description": "Pohled do interiéru domu čp. 459 (Richterův dům) na Malém náměstí Starém Městě - stará telefonní centrála.", "date_label": "", "start_date": "", "end_date": "", "author": "Eckert, Jindřich (1833-1905)", "note": "Eckert, Jindřich - Eckert-ateliér (repro)", "views": "29x", "geolocation_type": "regional.address"}}, {"type": "Feature", "geometry": {"type": "Point", "coordinates": [14.43637, 50.10853]}, "properties": {"id": "02F65BF48D5C11E2BF25525400E46D25", "kind": "negativ", "description": "Pohled novostavbu elektrárny v Holešovicích (městská centrála).", "date_label": "1900-1901", "start_date": "1900-01-01", "end_date": "1901-12-31", "author": "Eckert, Jindřich (1833-1905)", "note": "", "views": "57x", "geolocation_type": "regional.address"}}, {"type": "Feature", "geometry": {"type": "Point", "coordinates": [14.43637, 50.10853]}, "properties": {"id": "02F65BF58D5C11E2BF25525400E46D25", "kind": "negativ", "description": "Pohled do interiéru elektrárny v Holešovicích (městská centrála) krátce po dostavění roku 1900 - strojírna.", "date_label": "po 1900", "start_date": "1901-01-01", "end_date": "2000-12-31", "author": "Eckert, Jindřich (1833-1905)", "note": "", "views": "44x", "geolocation_type": "regional.address"}}, {"type": "Feature", "geometry": {"type": "Point", "coordinates": [14.41609, 50.08608]}, "properties": {"id": "0312281FA53D11E39D6DD4BED94BB14D", "kind": "pozitiv", "description": "Pohled do dvora domu čp. 181 v Karlově ulici na Starém Městě.", "date_label": "", "start_date": "", "end_date": "", "author": "Klíma, Alois, Ing. (1873-1955)", "note": "Klíma, Alois - Jelínková, Jana (repro)", "views": "26x", "geolocation_type": "regional.address"}}, {"type": "Feature", "geometry": {"type": "Point", "coordinates": [14.44123, 50.09021]}, "properties": {"id": "03AF0B9B310C11E9978874D435EEBE90", "kind": "negativ", "description": "Celkový pohled na hlavní průčelí domu čp. 283 v Karlíně (divadlo) v Palackého ulici (dnes Křižíkova). V pozadí vlevo část viaduktu.", "date_label": "kol.1900", "start_date": "1900-01-01", "end_date": "1900-12-31", "author": "Bellmann-ateliér", "note": "", "views": "59x", "geolocation_type": "regional.address"}}, {"type": "Feature", "geometry": {"type": "Point", "coordinates": [14.50767, 50.07748]}, "properties": {"id": "03B7077A4FF511E6A54A000C76270B94", "kind": "pozitiv", "description": "Pohled na částečně zbořené Helmovské mlýny na Novém Městě - zleva Kubešův mlýn (dům čp. 1220), zbytky mlýna čp. 1303 a mlýn čp. 1222. V pozadí Dolní Lodecké mlýny a domy v Klimentské ulici.", "date_label": "23.2.1909", "start_date": "1909-02-23", "end_date": "1909-02-23", "author": "", "note": "", "views": "55x", "geolocation_type": "regional.address"}}, {"type": "Feature", "geometry": {"type": "Point", "coordinates": [14.40979, 50.09172]}, "properties": {"id": "040DFB5A21F711E8B26274D435EEBE90", "kind": "pozitiv", "description": "Pohled ze Starých zámeckých schodů na Staré Město. V popředí Malá Strana s Fürstenberskou a Valdštejnskou zahradou a s Klárovem.", "date_label": "kol.1867", "start_date": "1867-01-01", "end_date": "1867-12-31", "author": "Fridrich, František (1829-1892)", "note": "", "views": "93x", "geolocation_type": "regional.address"}}, {"type": "Feature", "geometry": {"type": "Point", "coordinates": [14.44509, 50.08512]}, "properties": {"id": "04510462A41411E1BEEB000C766D2371", "kind": "negativ", "description": "Pohled do dvora žižkovské plynárny. V pozadí Komenského ulice (dnes Seifertova) s domy čp. 555, 560 a 559 (C. k. berní úřad).", "date_label": "kol.1900", "start_date": "1900-01-01", "end_date": "1900-12-31", "author": "Eckert, Jindřich (1833-1905)", "note": "", "views": "104x", "geolocation_type": "regional.address"}}, {"type": "Feature", "geometry": {"type": "Point", "coordinates": [14.42851, 50.0692]}, "properties": {"id": "047B5BF6769311E2BF17525400E46D25", "kind": "negativ", "description": "Pohled do zahrady kláštera augustiniánů kanovníků na Karlově (dům čp. 453 na Novém Městě - chorobinec).", "date_label": "kol.1890", "start_date": "1890-01-01", "end_date": "1890-12-31", "author": "Eckert, Jindřich (1833-1905)", "note": "", "views": "52x", "geolocation_type": "regional.address"}}, {"type": "Feature", "geometry": {"type": "Point", "coordinates": [14.38224, 50.08528]}, "properties": {"id": "0492BB0FBB7811E594BE74D435EEBE90", "kind": "pozitiv", "description": "Pohled na dům čp. 1069 (hostinec U Vonásků - U Zelené brány) v Bělohorské ulici v Břevnově - s terasou, po zbourání přístavků.", "date_label": "kol.1965", "start_date": "1965-01-01", "end_date": "1965-12-31", "author": "Dub, Václav (dokumenty 1928-1983)", "note": "", "views": "50x", "geolocation_type": "regional.address"}}, {"type": "Feature", "geometry": {"type": "Point", "coordinates": [14.60209, 50.02694]}, "properties": {"id": "04B226A1157111E39CC26C626D41E503", "kind": "pozitiv", "description": "Průhled Betlémskou ulicí z křižovatky s ulicí Karoliny Světlé. Vlevo dům čp. 286 na Starém Městě (Armáda spásy).", "date_label": "6.11.1927", "start_date": "1927-11-06", "end_date": "1927-11-06", "author": "Alexander, Antonín (1892-působnost do 1948)", "note": "", "views": "56x", "geolocation_type": "regional.address"}}, {"type": "Feature", "geometry": {"type": "Point", "coordinates": [14.44983, 50.01797]}, "properties": {"id": "04BEA219217011E9977174D435EEBE90", "kind": "pozitiv", "description": "Celkový pohled na hlavní obytnou budovu statku čp. 101 (Nové Dvory) v ulici U Nového dvora (dnes Durychova) ve Lhotce při bourání. V popředí rybník.", "date_label": "1958", "start_date": "1958-01-01", "end_date": "1958-12-31", "author": "Hnilička, Eduard (1887-1967)", "note": "", "views": "52x", "geolocation_type": "regional.address"}}, {"type": "Feature", "geometry": {"type": "Point", "coordinates": [14.44983, 50.01797]}, "properties": {"id": "04BEA21A217011E9977174D435EEBE90", "kind": "pozitiv", "description": "Celkový pohled na hlavní obytnou budovu statku čp. 101 (Nové Dvory) v ulici U Nového dvora (dnes Durychova) ve Lhotce při bourání. V popředí rybník.", "date_label": "1958", "start_date": "1958-01-01", "end_date": "1958-12-31", "author": "Hnilička, Eduard (1887-1967)", "note": "", "views": "48x", "geolocation_type": "regional.address"}}, {"type": "Feature", "geometry": {"type": "Point", "coordinates": [14.4242, 50.0871]}, "properties": {"id": "053F25DD8B1011E2BF22525400E46D25", "kind": "negativ", "description": "Pohled do interiéru domu čp. 562 (\"Dům Buquoyský\") v Celetné ulici na Starém Městě - jídelna hraběnky Ledeburgové.", "date_label": "20.4.1907", "start_date": "1907-04-20", "end_date": "1907-04-20", "author": "Eckert-ateliér", "note": "", "views": "23x", "geolocation_type": "regional.address"}}, {"type": "Feature", "geometry": {"type": "Point", "coordinates": [14.42009, 50.087]}, "properties": {"id": "054278AF90B711E8B3B474D435EEBE90", "kind": "negativ", "description": "Pohled na portál a orloj Staroměstské radnice (dům čp. 1 na Starém Městě) na Staroměstském náměstí.", "date_label": "", "start_date": "", "end_date": "", "author": "", "note": "", "views": "20x", "geolocation_type": "regional.address"}}, {"type": "Feature", "geometry": {"type": "Point", "coordinates": [14.37935, 50.08823]}, "properties": {"id": "054589CFB61511E58B3BD4BED94BB14D", "kind": "pozitiv", "description": "Pohled na usedlost Malovanka (dům čp. 34 v Břevnově - dnes dům čp. 123 ve Střešovicích) - severní průčelí staré části v ulici Na Malovance.", "date_label": "6.9.1943", "start_date": "1943-09-06", "end_date": "1943-09-06", "author": "Alexander, Antonín (1892-působnost do 1948)", "note": "", "views": "110x", "geolocation_type": "regional.address"}}, {"type": "Feature", "geometry": {"type": "Point", "coordinates": [14.42009, 50.087]}, "properties": {"id": "054A013B90BE11E8B3B474D435EEBE90", "kind": "negativ", "description": "Pohled na portál a orloj Staroměstské radnice (dům čp. 1 na Starém Městě) na Staroměstském náměstí.", "date_label": "", "start_date": "", "end_date": "", "author": "Reach, Zikmund (1859-1935)", "note": "", "views": "27x", "geolocation_type": "regional.address"}}, {"type": "Feature", "geometry": {"type": "Point", "coordinates": [14.40739, 50.08615]}, "properties": {"id": "0590ECC405B411E389696C626D41E503", "kind": "pozitiv", "description": "Pohled na dům čp. 490 (palác Metychů z Čečova - Hrzánský) na Velkopřevorském náměstí na Malé Straně s portálem (\"Sklad Velkopřevorského mlýna. H. Veselý\").", "date_label": "1922", "start_date": "1922-01-01", "end_date": "1922-12-31", "author": "Alexander, Antonín (1892-působnost do 1948)", "note": "", "views": "32x", "geolocation_type": "regional.address"}}, {"type": "Feature", "geometry": {"type": "Point", "coordinates": [14.40726, 50.10249]}, "properties": {"id": "05B6A3EC6A7E11E0BE22000C766D2371", "kind": "pozitiv", "description": "Celkový pohled na zahradní průčelí Lannovy vily (dům čp. 1) v Bubenči s pergolou.", "date_label": "1947", "start_date": "1947-01-01", "end_date": "1947-12-31", "author": "", "note": "", "views": "59x", "geolocation_type": "regional.address"}}, {"type": "Feature", "geometry": {"type": "Point", "coordinates": [14.40739, 50.08615]}, "properties": {"id": "05C3657005B911E389696C626D41E503", "kind": "pozitiv", "description": "Pohled na dům čp. 490 (palác Metychů z Čečova - Hrzánský) na Velkopřevorském náměstí na Malé Straně s renesančním portálem.", "date_label": "1970", "start_date": "1970-01-01", "end_date": "1970-12-31", "author": "Vopravil, Josef (1902-1972)", "note": "", "views": "27x", "geolocation_type": "regional.address"}}, {"type": "Feature", "geometry": {"type": "Point", "coordinates": [14.41783, 50.08711]}, "properties": {"id": "065266044D9711E1AE2C6C626D41E503", "kind": "pozitiv", "description": "Pohled na staveniště budovy Magistrátu hlavního města Prahy (dům čp. 2) na Starém Městě na Mariánském náměstí. V pozadí část původní zástavby v Platnéřské ulici.", "date_label": "6.11.1908", "start_date": "1908-11-06", "end_date": "1908-11-06", "author": "Kříženecký, Jan (1868-1921)", "note": "", "views": "36x", "geolocation_type": "regional.address"}}, {"type": "Feature", "geometry": {"type": "Point", "coordinates": [14.40444, 50.08544]}, "properties": {"id": "06CE095B8D6711E2BF25525400E46D25", "kind": "negativ", "description": "Pohled do interiéru domu čp. 386 na Malé Straně (Rohanský palác) - sál s exponáty při výstavě parohů.", "date_label": "1893", "start_date": "1893-01-01", "end_date": "1893-12-31", "author": "Eckert, Jindřich (1833-1905)", "note": "", "views": "33x", "geolocation_type": "regional.address"}}, {"type": "Feature", "geometry": {"type": "Point", "coordinates": [14.40535, 50.09003]}, "properties": {"id": "07449770802F11E2BF1B525400E46D25", "kind": "negativ", "description": "Pohled do interiéru Valdštejnského paláce (dům čp. 17 na Malé Straně) - salon.", "date_label": "1920", "start_date": "1920-01-01", "end_date": "1920-12-31", "author": "Eckert-ateliér", "note": "", "views": "14x", "geolocation_type": "regional.address"}}, {"type": "Feature", "geometry": {"type": "Point", "coordinates": [14.42211, 50.08746]}, "properties": {"id": "075ACF332DAA11E89EFE74D435EEBE90", "kind": "negativ", "description": "Pohled na část východní strany Staroměstského náměstí s domy čp. 604, 603 na Starém Městě. Za nimi kostel P. Marie před Týnem. Uprostřed mariánský sloup.", "date_label": "", "start_date": "", "end_date": "", "author": "Vojta, Tomáš (1885-1934)", "note": "Reprodukce původní fotografie.", "views": "33x", "geolocation_type": "regional.address"}}, {"type": "Feature", "geometry": {"type": "Point", "coordinates": [14.42553, 50.08197]}, "properties": {"id": "07918574E29511E89F1B74D435EEBE90", "kind": "pozitiv", "description": "Pohled do dvora domu čp. 791 (U Lhotků) na nároží Václavského náměstí a Vodičkovy ulice na Novém Městě krátce před zbořením.", "date_label": "kol.1912", "start_date": "1912-01-01", "end_date": "1912-12-31", "author": "Bufka, Vladimír Jindřich", "note": "", "views": "49x", "geolocation_type": "regional.address"}}, {"type": "Feature", "geometry": {"type": "Point", "coordinates": [14.40328, 50.09504]}, "properties": {"id": "0879BF76275311E287E86C626D41E503", "kind": "pohlednice", "description": "Pohled na hlavní průčelí kasáren na Hradčanech - dům čp. 221 (\"kasárna Adolfa Hitlera\" - bývalá kadetní škola).", "date_label": "1939-1945", "start_date": "1939-01-01", "end_date": "1945-12-31", "author": "", "note": "", "views": "84x", "geolocation_type": "regional.address"}}, {"type": "Feature", "geometry": {"type": "Point", "coordinates": [14.45836, 50.09311]}, "properties": {"id": "0880C6DF81BE11E2BF1D525400E46D25", "kind": "negativ", "description": "Pohled na stavbu školy (dům čp. 460) na Lyčkově náměstí v Karlíně (dříve Riegrovy sady).", "date_label": "1905", "start_date": "1905-01-01", "end_date": "1905-12-31", "author": "Eckert-ateliér", "note": "", "views": "58x", "geolocation_type": "regional.address"}}, {"type": "Feature", "geometry": {"type": "Point", "coordinates": [14.39375, 50.08878]}, "properties": {"id": "08BC7ABC748611E4A81F406186009F3A", "kind": "pozitiv", "description": "Pohled do zahrady domu čp. 180 na Hradčanech (bývalý Trautmannsdorfský palác) od kapličky k severozápadu - \"práce na výkopu válečného vodního bazénu\".", "date_label": "5.6.1944", "start_date": "1944-06-05", "end_date": "1944-06-05", "author": "Alexander, Antonín (1892-působnost do 1948)", "note": "", "views": "20x", "geolocation_type": "regional.address"}}, {"type": "Feature", "geometry": {"type": "Point", "coordinates": [14.4228, 50.08549]}, "properties": {"id": "08D2AE3215FE11E390486C626D41E503", "kind": "pozitiv", "description": "Pohled do Železné ulice z křižovatky s ulicí Rytířskou. Vpravo část Stavovského divadla (dům čp. 540), vlevo část nárožního domu čp. 539 na Starém Městě.", "date_label": "", "start_date": "", "end_date": "", "author": "Bellmann", "note": "", "views": "53x", "geolocation_type": "regional.address"}}, {"type": "Feature", "geometry": {"type": "Point", "coordinates": [14.42276, 50.07944]}, "properties": {"id": "0910DFC2718011E59BDB406186009F3A", "kind": "pozitiv", "description": "Pohled do dvora domu čp. 681 ve Vodičkově ulici na Novém Městě s autodílnou.", "date_label": "kol. 1919", "start_date": "", "end_date": "", "author": "", "note": "", "views": "40x", "geolocation_type": "regional.address"}}, {"type": "Feature", "geometry": {"type": "Point", "coordinates": [14.41719, 50.07215]}, "properties": {"id": "0928B76385AD11E2BF1F525400E46D25", "kind": "negativ", "description": "Pohled na varhany v kostele P. Marie Na Slovanech (v Emauzích) na Novém Městě.", "date_label": "kol.1900", "start_date": "1900-01-01", "end_date": "1900-12-31", "author": "Eckert, Jindřich (1833-1905)", "note": "", "views": "32x", "geolocation_type": "regional.address"}}, {"type": "Feature", "geometry": {"type": "Point", "coordinates": [14.4176, 50.08846]}, "properties": {"id": "097BFFA4155D11E39CC26C626D41E503", "kind": "pozitiv", "description": "Pohled do Josefovské ulice od křižovatky s Pinkasovou uličkou (vlevo). Uprostřed nárožní dům čp. 20 v Josefově. Zprava domy čp. 18, 19, 22, 25, 26... v Josefově.", "date_label": "10.3.1908", "start_date": "1908-03-10", "end_date": "1908-03-10", "author": "Kříženecký, Jan (1868-1921)", "note": "", "views": "53x", "geolocation_type": "regional.address"}}, {"type": "Feature", "geometry": {"type": "Point", "coordinates": [14.44983, 50.01797]}, "properties": {"id": "098E28A629F111E9980E74D435EEBE90", "kind": "negativ", "description": "Pohled na hlavní obytnou budovu statku čp. 101 (Nové Dvory) v ulici U Nového dvora (dnes Durychova) ve Lhotce.", "date_label": "červen 1953", "start_date": "1953-06-01", "end_date": "1953-06-30", "author": "", "note": "", "views": "41x", "geolocation_type": "regional.address"}}, {"type": "Feature", "geometry": {"type": "Point", "coordinates": [14.36526, 50.08915]}, "properties": {"id": "09A9BA15BA9E11E5A77074D435EEBE90", "kind": "pozitiv", "description": "Pohled do Bělohorské ulice s domem čp. 205 v Břevnově při bourání staré zástavby.", "date_label": "po 1950", "start_date": "1951-01-01", "end_date": "2000-12-31", "author": "", "note": "", "views": "52x", "geolocation_type": "regional.address"}}, {"type": "Feature", "geometry": {"type": "Point", "coordinates": [14.38996, 50.08783]}, "properties": {"id": "0A1A7A598B1211E2BF22525400E46D25", "kind": "negativ", "description": "Pohled do interiéru domu čp. 111 (sirotčinec arcivévodkyně Gisely) na Pohořelci na Hradčanech - ložnice dívek.", "date_label": "kol.1890", "start_date": "1890-01-01", "end_date": "1890-12-31", "author": "Eckert, Jindřich (1833-1905)", "note": "", "views": "24x", "geolocation_type": "regional.address"}}, {"type": "Feature", "geometry": {"type": "Point", "coordinates": [14.41571, 50.04748]}, "properties": {"id": "0A30091A2CE311E88DF074D435EEBE90", "kind": "negativ", "description": "Pohled na křižovatku ulic Přemyslovy (dnes Podolské) vlevo a Dvorecké (dnes Jeremenkova) vpravo. Uprostřed dům čp. 403, vpravo dům čp. 367 v Podolí.", "date_label": "1939-1945", "start_date": "1939-01-01", "end_date": "1945-12-31", "author": "", "note": "", "views": "66x", "geolocation_type": "regional.address"}}, {"type": "Feature", "geometry": {"type": "Point", "coordinates": [14.42009, 50.087]}, "properties": {"id": "0A642D7590C811E8B3B474D435EEBE90", "kind": "negativ", "description": "Pohled na část orloje Staroměstské radnice (dům čp. 1 na Starém Městě) na Staroměstském náměstí při opravě.", "date_label": "kol.1910", "start_date": "1910-01-01", "end_date": "1910-12-31", "author": "", "note": "", "views": "22x", "geolocation_type": "regional.address"}}, {"type": "Feature", "geometry": {"type": "Point", "coordinates": [14.43263, 50.08071]}, "properties": {"id": "0AAD5C52744911E2A9206C626D41E503", "kind": "negativ", "description": "Pohled na vlaky a nádraží císaře Františka Josefa I. (dům čp. 300 na Vinohradech) ze stanoviště nad vinohradským železničním tunelem. Vlevo zadní část budovy Nového německého divadla (dům čp. 101) a sousedního domu čp. 98 na Vinohradech.", "date_label": "kol.1910", "start_date": "1910-01-01", "end_date": "1910-12-31", "author": "Reach, Zikmund (1859-1935)", "note": "", "views": "174x", "geolocation_type": "regional.address"}}, {"type": "Feature", "geometry": {"type": "Point", "coordinates": [14.41783, 50.08711]}, "properties": {"id": "0ac1c103257244e0a3d6aba94c4d3c81", "kind": "pozitiv", "description": "Pohled na stavbu budovy Magistrátu hlavního města Prahy (dům čp. 2) na Mariánském náměstí na Starém Městě - zdění třetího patra. V pozadí věže kostela sv. Mikuláše..", "date_label": "10.4.1910", "start_date": "1910-04-10", "end_date": "1910-04-10", "author": "", "note": "", "views": "11x", "geolocation_type": "regional.address"}}, {"type": "Feature", "geometry": {"type": "Point", "coordinates": [14.4202, 50.08848]}, "properties": {"id": "0AC74F90968911E49A5E406186009F3A", "kind": "pozitiv", "description": "Pohled na Krenův dům (čp. 936) na Staroměstském náměstí na Starém Městě.", "date_label": "1901", "start_date": "1901-01-01", "end_date": "1901-12-31", "author": "Dvořák, František (dokumenty 1901-1908)", "note": "", "views": "39x", "geolocation_type": "regional.address"}}, {"type": "Feature", "geometry": {"type": "Point", "coordinates": [14.43549, 50.08356]}, "properties": {"id": "0AD8CCD617DB11E891E8406186009F3A", "kind": "pozitiv", "description": "Pohled na osvětlenou budovu Wilsonova nádraží (dům čp. 300) na Vinohradech - nádraží císaře Františka Josefa I., Hlavní. Při příležitosti 10. výročí samostatnosti Československé republiky.", "date_label": "28.10.1928", "start_date": "1928-10-28", "end_date": "1928-10-28", "author": "Vopravil, Josef (1902-1972)", "note": "", "views": "119x", "geolocation_type": "regional.address"}}, {"type": "Feature", "geometry": {"type": "Point", "coordinates": [14.42009, 50.087]}, "properties": {"id": "0adca44ff9f84db5a0a3f0b20b678f7c", "kind": "pozitiv", "description": "Socha Přemysla Otakara II. na východním křídle Staroměstské radnice od Josefa Maxe.", "date_label": "", "start_date": "", "end_date": "", "author": "", "note": "", "views": "23x", "geolocation_type": "regional.address"}}, {"type": "Feature", "geometry": {"type": "Point", "coordinates": [14.38967, 50.08671]}, "properties": {"id": "0B11A887656F11E8B6E074D435EEBE90", "kind": "pozitiv", "description": "Pohled na vchod do kvadratury Strahovského kláštera - domu čp. 132 na Hradčanech při stavebních úpravách.", "date_label": "léto 1906", "start_date": "", "end_date": "", "author": "", "note": "", "views": "29x", "geolocation_type": "regional.address"}}, {"type": "Feature", "geometry": {"type": "Point", "coordinates": [14.39402, 50.08908]}, "properties": {"id": "0B48AA27748A11E4A81F406186009F3A", "kind": "pozitiv", "description": "Pohled do zahrady domu čp. 180 na Hradčanech (bývalý Trautmannsdorfský palác) - \"práce na výkopu válečného vodního bazénu\". V pozadí uprostřed část kaple paláce.", "date_label": "5.6.1944", "start_date": "1944-06-05", "end_date": "1944-06-05", "author": "Alexander, Antonín (1892-působnost do 1948)", "note": "", "views": "23x", "geolocation_type": "regional.address"}}, {"type": "Feature", "geometry": {"type": "Point", "coordinates": [14.40204, 50.11]}, "properties": {"id": "0B55ED888B0D11E2BF22525400E46D25", "kind": "negativ", "description": "Pohled na kanalizační čistící stanici v Bubenči (dům čp. 199) - východní průčelí.", "date_label": "7.3.1907", "start_date": "1907-03-07", "end_date": "1907-03-07", "author": "Eckert-ateliér", "note": "", "views": "35x", "geolocation_type": "regional.address"}}, {"type": "Feature", "geometry": {"type": "Point", "coordinates": [14.40597, 50.03164]}, "properties": {"id": "0B6BC6DAB5C411E3B6F7D4BED94BB14D", "kind": "pozitiv", "description": "Pohled ze Zbraslavské silnice nad železniční tratí. V popředí Vltava, za řekou Braník s ledárnou (dům čp. 238 v Braníku) a loděnicí vodních turistů KČST. Součást panoramatu.", "date_label": "15.6.1927", "start_date": "1927-06-15", "end_date": "1927-06-15", "author": "Alexander, Antonín (1892-působnost do 1948)", "note": "", "views": "66x", "geolocation_type": "regional.address"}}, {"type": "Feature", "geometry": {"type": "Point", "coordinates": [14.41833, 50.08448]}, "properties": {"id": "0B9AACDDECE711DFBD7B000C766D2371", "kind": "pozitiv", "description": "Pohled do Jilské ulice k severu. Uprostřed dům čp. 352 (\"U Sladkých\") na Starém Městě. V pozadí část kostela sv. Jiljí.", "date_label": "26.3.1945", "start_date": "1945-03-26", "end_date": "1945-03-26", "author": "Alexander, Antonín (1892-působnost do 1948)", "note": "", "views": "32x", "geolocation_type": "regional.address"}}, {"type": "Feature", "geometry": {"type": "Point", "coordinates": [14.42009, 50.087]}, "properties": {"id": "0BA64CCD90EC11E8B3B474D435EEBE90", "kind": "pozitiv", "description": "Socha Lakomce a Smrtky z orloje v jižním průčelí Staroměstské radnice (dům čp. 1 na Starém Městě) na Staroměstském náměstí po restaurování.", "date_label": "18.12.1911", "start_date": "1911-12-18", "end_date": "1911-12-18", "author": "Kříženecký, Jan (1868-1921)", "note": "", "views": "36x", "geolocation_type": "regional.address"}}, {"type": "Feature", "geometry": {"type": "Point", "coordinates": [14.40349, 50.08881]}, "properties": {"id": "0BB9AAD6D50E11E3AADC406186009F3A", "kind": "pozitiv", "description": "Pohled na portál a část průčelí domu čp. 1 do Sněmovní ulice na Malé Straně.", "date_label": "kol.1920", "start_date": "1920-01-01", "end_date": "1920-12-31", "author": "Vojta, Tomáš (1885-1934)", "note": "", "views": "24x", "geolocation_type": "regional.address"}}, {"type": "Feature", "geometry": {"type": "Point", "coordinates": [14.40328, 50.09504]}, "properties": {"id": "0BC5E622580C11E7A695406186009F3A", "kind": "pozitiv", "description": "Celkový pohled na dům čp. 221 (kadetní škola) na Mariánské baště na Hradčanech.", "date_label": "", "start_date": "", "end_date": "", "author": "Bellmann (?)", "note": "", "views": "51x", "geolocation_type": "regional.address"}}, {"type": "Feature", "geometry": {"type": "Point", "coordinates": [14.40535, 50.09003]}, "properties": {"id": "0BCF539ADBBD11E5AB3774D435EEBE90", "kind": "pozitiv", "description": "Pohled do interiéru Valdštejnského paláce (dům čp. 17 na Malé Straně) - Rytířská síň.", "date_label": "", "start_date": "", "end_date": "", "author": "Eckert, Jindřich (1833-1905)", "note": "Eckert, Jindřich - Eckert-ateliér (repro)", "views": "77x", "geolocation_type": "regional.address"}}, {"type": "Feature", "geometry": {"type": "Point", "coordinates": [14.40535, 50.09003]}, "properties": {"id": "0C0DEF1C922711E2BF28525400E46D25", "kind": "negativ", "description": "Pohled do interiéru Valdštejnského paláce (dům čp. 17 na Malé Straně) - salon.", "date_label": "1920", "start_date": "1920-01-01", "end_date": "1920-12-31", "author": "Eckert-ateliér", "note": "", "views": "17x", "geolocation_type": "regional.address"}}, {"type": "Feature", "geometry": {"type": "Point", "coordinates": [14.40925, 50.02208]}, "properties": {"id": "0C180476D19F11E69F29406186009F3A", "kind": "pozitiv", "description": "Pohled na hájovnu v Hodkovičkách (dům čp. 35 v dnešní ulici Nad Lesem).", "date_label": "", "start_date": "", "end_date": "", "author": "", "note": "", "views": "36x", "geolocation_type": "regional.address"}}, {"type": "Feature", "geometry": {"type": "Point", "coordinates": [14.41347, 50.08126]}, "properties": {"id": "0C3960C317E311E891E8406186009F3A", "kind": "pozitiv", "description": "Pohled na osvětlené Národní divadlo (dům čp. 223 na Novém Městě) při příležitosti 10. výročí samostatnosti Československé republiky.", "date_label": "28.10.1928", "start_date": "1928-10-28", "end_date": "1928-10-28", "author": "Vopravil, Josef (1902-1972)", "note": "", "views": "64x", "geolocation_type": "regional.address"}}, {"type": "Feature", "geometry": {"type": "Point", "coordinates": [14.44925, 50.09049]}, "properties": {"id": "0C48E4B6909911E2BF26525400E46D25", "kind": "negativ", "description": "Pohled do interiéru domu čp. 271 v Karlíně (škola) - tělocvična.", "date_label": "kol.1895", "start_date": "1895-01-01", "end_date": "1895-12-31", "author": "Eckert, Jindřich (1833-1905)", "note": "", "views": "53x", "geolocation_type": "regional.address"}}, {"type": "Feature", "geometry": {"type": "Point", "coordinates": [14.42825, 50.08762]}, "properties": {"id": "0C978612E83C11E4BB7A0024BE7CD9AC", "kind": "pozitiv", "description": "Pohled na schodiště v interiéru domu čp. 1090 (Obecní dům) na Starém Městě.", "date_label": "kol. 1915", "start_date": "", "end_date": "", "author": "Štenc", "note": "", "views": "19x", "geolocation_type": "regional.address"}}, {"type": "Feature", "geometry": {"type": "Point", "coordinates": [14.42162, 50.08786]}, "properties": {"id": "0C9C4A72E2B911E4B65C0024BE7CD9AC", "kind": "pozitiv", "description": "Pohled na průčelí domů čp. 606, 609 a 608 na Staroměstském náměstí na Starém Městě.", "date_label": "1901", "start_date": "1901-01-01", "end_date": "1901-12-31", "author": "Dvořák, František (dokumenty 1901-1908)", "note": "", "views": "37x", "geolocation_type": "regional.address"}}, {"type": "Feature", "geometry": {"type": "Point", "coordinates": [14.41517, 50.06829]}, "properties": {"id": "0CC923636B9B11E2AB7F6C626D41E503", "kind": "pozitiv", "description": "Pohled do dvora solného skladiště v Podskalí (dům čp. 410 na Novém Městě).", "date_label": "15.5.1905", "start_date": "1905-05-15", "end_date": "1905-05-15", "author": "Eckert-ateliér", "note": "", "views": "49x", "geolocation_type": "regional.address"}}, {"type": "Feature", "geometry": {"type": "Point", "coordinates": [14.42901, 50.08293]}, "properties": {"id": "0CD9AB7B8B1D11E2BF22525400E46D25", "kind": "negativ", "description": "Pohled do dvora domu čp. 909 s věží (budova hlavní pošty) v Jindřišské ulici na Novém Městě s poštovními vozy.", "date_label": "20.5.1908", "start_date": "1908-05-20", "end_date": "1908-05-20", "author": "Eckert-ateliér", "note": "", "views": "34x", "geolocation_type": "regional.address"}}, {"type": "Feature", "geometry": {"type": "Point", "coordinates": [14.40131, 50.08733]}, "properties": {"id": "0D1D25DB79E511E3B274406186009F3A", "kind": "pozitiv", "description": "Interiér středového sálu piana nobile v Schönbornském paláci - domě čp. 365 na Malé Straně.", "date_label": "červen 1931", "start_date": "1931-06-01", "end_date": "1931-06-30", "author": "Vojta, Tomáš (1885-1934)", "note": "", "views": "21x", "geolocation_type": "regional.address"}}, {"type": "Feature", "geometry": {"type": "Point", "coordinates": [14.41678, 50.07444]}, "properties": {"id": "0d4b1c0b1d0e435ab5ce26edddc59ec2", "kind": "negativ", "description": "Pohled na studánku se sochou sv. Václava (\"Pučka\") v zahradě domu čp. 339 na Novém Městě (Svatováclavské lázně).", "date_label": "před 1908", "start_date": "1800-01-01", "end_date": "1907-12-31", "author": "", "note": "", "views": "14x", "geolocation_type": "regional.address"}}, {"type": "Feature", "geometry": {"type": "Point", "coordinates": [14.41045, 50.12074]}, "properties": {"id": "0d5b88b2e23c4485a78dc45b6adff4c4", "kind": "pozitiv", "description": "Pohled na usedlost Salabku (dům čp. 57 v Troji) v dnešní ulici K Bohnicím. V popředí vinice.", "date_label": "1958", "start_date": "1958-01-01", "end_date": "1958-12-31", "author": "Hnilička, Eduard (1887-1967)", "note": "", "views": "16x", "geolocation_type": "regional.address"}}, {"type": "Feature", "geometry": {"type": "Point", "coordinates": [14.41783, 50.08711]}, "properties": {"id": "0DB67F574D9D11E1A9526C626D41E503", "kind": "pozitiv", "description": "Pohled na část hlavního průčelí budovy Magistrátu hlavního města Prahy (dům čp. 2) na Starém Městě na Mariánském náměstí.", "date_label": "12.6.1931", "start_date": "1931-06-12", "end_date": "1931-06-12", "author": "Alexander, Antonín (1892-působnost do 1948)", "note": "", "views": "19x", "geolocation_type": "regional.address"}}, {"type": "Feature", "geometry": {"type": "Point", "coordinates": [14.40739, 50.08615]}, "properties": {"id": "0E0C9E2305B711E389696C626D41E503", "kind": "pozitiv", "description": "Pohled na dům čp. 490 (palác Metychů z Čečova - Hrzánský) na Velkopřevorském náměstí na Malé Straně s renesančním portálem.", "date_label": "1925", "start_date": "1925-01-01", "end_date": "1925-12-31", "author": "Vojta, Tomáš (1885-1934)", "note": "", "views": "29x", "geolocation_type": "regional.address"}}, {"type": "Feature", "geometry": {"type": "Point", "coordinates": [14.42788, 50.08949]}, "properties": {"id": "0E25BF6D161811E390486C626D41E503", "kind": "pozitiv", "description": "Celkový pohled na dům čp. 655 na Starém Městě (Ústav šlechtičen) v Revoluční třídě (Eliščině) směrem od náměstí Republiky (Josefské).", "date_label": "kol.1900", "start_date": "1900-01-01", "end_date": "1900-12-31", "author": "Bellmann, Carl", "note": "", "views": "70x", "geolocation_type": "regional.address"}}, {"type": "Feature", "geometry": {"type": "Point", "coordinates": [14.39755, 50.08984]}, "properties": {"id": "0E297F61955411E2BF29525400E46D25", "kind": "negativ", "description": "Pohled do interiéru Arcibiskupského paláce na Hradčanském náměstí (dům čp. 56 na Hradčanech) - knihovna (od vchodu k ložnici).", "date_label": "kol.1900", "start_date": "1900-01-01", "end_date": "1900-12-31", "author": "Eckert, Jindřich (1833-1905)", "note": "", "views": "25x", "geolocation_type": "regional.address"}}, {"type": "Feature", "geometry": {"type": "Point", "coordinates": [14.41139, 50.09203]}, "properties": {"id": "0E6FF1D0205F11E88E87406186009F3A", "kind": "pozitiv", "description": "Pohled na osvětlené pražské památky při příležitosti 10. výročí samostatnosti Československé republiky - (zprava) Pražský hrad, kostel sv. Mikuláše na Malé Strany a Malostranské mostecké věže. V popředí neosvětlená budova Starkovy akademie (dům čp. 128 na Malé Straně).", "date_label": "28.10.1928", "start_date": "1928-10-28", "end_date": "1928-10-28", "author": "Vopravil, Josef (1902-1972)", "note": "", "views": "45x", "geolocation_type": "regional.address"}}, {"type": "Feature", "geometry": {"type": "Point", "coordinates": [14.42601, 50.07543]}, "properties": {"id": "0E84EB54A41B11E1BEEB000C766D2371", "kind": "negativ", "description": "Pohled do interiéru školy čp. 517 v Ječné ulici na Novém Městě (česká státní reálka) - tělocvična.", "date_label": "kol.1890", "start_date": "1890-01-01", "end_date": "1890-12-31", "author": "Eckert, Jindřich (1833-1905)", "note": "", "views": "49x", "geolocation_type": "regional.address"}}, {"type": "Feature", "geometry": {"type": "Point", "coordinates": [14.42009, 50.087]}, "properties": {"id": "0E8DFA6A917311E8B9E274D435EEBE90", "kind": "pozitiv", "description": "Socha Hvězdáře a archanděla Michaela z orloje v jižním průčelí Staroměstské radnice (dům čp. 1 na Starém Městě) na Staroměstském náměstí po restaurování.", "date_label": "18.12.1911", "start_date": "1911-12-18", "end_date": "1911-12-18", "author": "Kříženecký, Jan (1868-1921)", "note": "", "views": "37x", "geolocation_type": "regional.address"}}, {"type": "Feature", "geometry": {"type": "Point", "coordinates": [14.42009, 50.087]}, "properties": {"id": "0ED9FC9444C411E9A0B1406186009F3A", "kind": "pozitiv", "description": "Pohled na Staroměstské náměstí od ústí Melantrichovy ulice. Vlevo část Staroměstské radnice s orlojem (dům čp. 1 na Starém Městě), vpravo domy jižní strany náměstí. V pozadí kostel P. Marie před Týnem a před ním domy čp. 604, 603, vlevo mariánský sloup.", "date_label": "1908-1918", "start_date": "1908-01-01", "end_date": "1918-12-31", "author": "Bellmann-ateliér", "note": "", "views": "79x", "geolocation_type": "regional.address"}}, {"type": "Feature", "geometry": {"type": "Point", "coordinates": [14.42654, 50.08592]}, "properties": {"id": "0F360D48744C11E2A9206C626D41E503", "kind": "negativ", "description": "Pohled na dům čp. 857 na nároží ulic Na Příkopě a Nekázanky na Novém Městě s filiálním obchodem Waldek a Wagner.", "date_label": "1890", "start_date": "1890-01-01", "end_date": "1890-12-31", "author": "", "note": "Reach, Zikmund (repro)", "views": "131x", "geolocation_type": "regional.address"}}, {"type": "Feature", "geometry": {"type": "Point", "coordinates": [14.42488, 50.08361]}, "properties": {"id": "0F37EAB4E29711E89F1B74D435EEBE90", "kind": "pozitiv", "description": "Pohled na dům čp. 839 na Václavském náměstí na Novém Městě (hotel U Zlaté husy).", "date_label": "květen 1909", "start_date": "1909-05-01", "end_date": "1909-05-31", "author": "", "note": "", "views": "66x", "geolocation_type": "regional.address"}}, {"type": "Feature", "geometry": {"type": "Point", "coordinates": [14.41843, 50.0689]}, "properties": {"id": "10471C46768A11E2BF17525400E46D25", "kind": "negativ", "description": "Celkový pohled na dům čp. 1936 (hostinec \"V Novém Koutku\") v Botičské ulici na Novém Městě. Vlevo část domu čp. 1937.", "date_label": "4.5.1902", "start_date": "1902-05-04", "end_date": "1902-05-04", "author": "Eckert, Jindřich (1833-1905)", "note": "", "views": "32x", "geolocation_type": "regional.address"}}, {"type": "Feature", "geometry": {"type": "Point", "coordinates": [14.42743, 50.08554]}, "properties": {"id": "1047D0EA824C11E2BF1E525400E46D25", "kind": "negativ", "description": "Pohled do interiéru Zemské banky (dům čp. 858) na Novém Městě v ulici Na Příkopě - hala s přepážkami (světlík).", "date_label": "9.4.1902", "start_date": "1902-04-09", "end_date": "1902-04-09", "author": "Eckert, Jindřich (1833-1905)", "note": "", "views": "24x", "geolocation_type": "regional.address"}}, {"type": "Feature", "geometry": {"type": "Point", "coordinates": [14.41783, 50.08711]}, "properties": {"id": "105b5a31ce694fe48a607615efbd8799", "kind": "pozitiv", "description": "Pohled na stavbu budovy Magistrátu hlavního města Prahy (dům čp. 2) na Mariánském náměstí na Starém Městě - stavba dvorany.", "date_label": "", "start_date": "", "end_date": "", "author": "", "note": "", "views": "9x", "geolocation_type": "regional.address"}}, {"type": "Feature", "geometry": {"type": "Point", "coordinates": [14.40739, 50.08615]}, "properties": {"id": "1092FD0F05B811E389696C626D41E503", "kind": "pozitiv", "description": "Pohled do interiéru domu čp. 490 (palác Metychů z Čečova - Hrzánský) na Velkopřevorském náměstí na Malé Straně - schodiště s krucifixem.", "date_label": "1925", "start_date": "1925-01-01", "end_date": "1925-12-31", "author": "Vojta, Tomáš (1885-1934)", "note": "", "views": "29x", "geolocation_type": "regional.address"}}, {"type": "Feature", "geometry": {"type": "Point", "coordinates": [14.43349, 50.0874]}, "properties": {"id": "10E644DA21F311E8B26274D435EEBE90", "kind": "pozitiv", "description": "Pohled ze svahu Vítkova na vnější část nádraží Rakouské společnosti státní dráhy (dnes Masarykovo nádraží - dům čp. 1014 na Novém Městě).", "date_label": "kol.1870", "start_date": "1870-01-01", "end_date": "1870-12-31", "author": "anonym", "note": "", "views": "93x", "geolocation_type": "regional.address"}}, {"type": "Feature", "geometry": {"type": "Point", "coordinates": [14.41883, 50.06985]}, "properties": {"id": "11648BB3819511E2BF1C525400E46D25", "kind": "negativ", "description": "Pohled na zahradní průčelí městského chudobince sv. Bartoloměje (dům čp. 427) ve Vyšehradské ulici na Novém Městě.", "date_label": "kol.1890", "start_date": "1890-01-01", "end_date": "1890-12-31", "author": "Eckert, Jindřich (1833-1905)", "note": "", "views": "53x", "geolocation_type": "regional.address"}}, {"type": "Feature", "geometry": {"type": "Point", "coordinates": [14.40447, 50.10336]}, "properties": {"id": "117CF8E35BEF11E79925406186009F3A", "kind": "negativ", "description": "Celkový pohled na dům čp. 592 v ulici Českomalínská v Bubenči.", "date_label": "po 1923", "start_date": "1924-01-01", "end_date": "2000-12-31", "author": "Vojta, Tomáš (1885-1934)", "note": "", "views": "32x", "geolocation_type": "regional.address"}}, {"type": "Feature", "geometry": {"type": "Point", "coordinates": [14.419, 50.07337]}, "properties": {"id": "11D88BE7E44311E4BE0074D435EEBE90", "kind": "pozitiv", "description": "Pohled na průčelí \"Faustova domu\" (dům čp. 502 na Novém Městě) do Vyšehradské ulice - poškozeném po náletu spojenců v únoru 1945. V popředí zničená terasní zeď zahrady kostela sv. Jana Na Skalce.", "date_label": "únor 1945", "start_date": "1945-02-01", "end_date": "1945-02-28", "author": "Sudek, Josef (1896-1976)", "note": "", "views": "90x", "geolocation_type": "regional.address"}}, {"type": "Feature", "geometry": {"type": "Point", "coordinates": [14.42009, 50.087]}, "properties": {"id": "120A6E640FE111E38E586C626D41E503", "kind": "pozitiv", "description": "Pohled na jižní průčelí Staroměstské radnice (dům čp. 1) na Staroměstském náměstí.", "date_label": "kol.1920", "start_date": "1920-01-01", "end_date": "1920-12-31", "author": "Fink, František (1854-1935)", "note": "", "views": "46x", "geolocation_type": "regional.address"}}, {"type": "Feature", "geometry": {"type": "Point", "coordinates": [14.42009, 50.087]}, "properties": {"id": "12B43AB590C811E8B3B474D435EEBE90", "kind": "negativ", "description": "Pohled na část orloje Staroměstské radnice (dům čp. 1 na Starém Městě) na Staroměstském náměstí při opravě.", "date_label": "kol.1910", "start_date": "1910-01-01", "end_date": "1910-12-31", "author": "", "note": "", "views": "22x", "geolocation_type": "regional.address"}}, {"type": "Feature", "geometry": {"type": "Point", "coordinates": [14.39624, 50.08704]}, "properties": {"id": "12D0815FF8A711E4808074D435EEBE90", "kind": "negativ", "description": "Průhled Vlašskou ulicí k Tržišti - vlevo kostel sv. Karla Boromejského při nemocnici Milosrdných sester sv. Karla Boromejského pod Petřínem (dům čp. 336 na Malé Straně).", "date_label": "kol.1925", "start_date": "1925-01-01", "end_date": "1925-12-31", "author": "Eckert-ateliér", "note": "", "views": "74x", "geolocation_type": "regional.address"}}, {"type": "Feature", "geometry": {"type": "Point", "coordinates": [14.41873, 50.08783]}, "properties": {"id": "1395BD2C808711E4AAB4406186009F3A", "kind": "pozitiv", "description": "Pohled na zbytky románského zdiva nalezeného při bourání domu čp. 16 na Starém Městě (Andělská kolej) v Mikulášské ulici (dnes náměstí Franze Kafky) .", "date_label": "30.11.1909", "start_date": "1909-11-30", "end_date": "1909-11-30", "author": "Kříženecký, Jan (1868-1921)", "note": "", "views": "55x", "geolocation_type": "regional.address"}}, {"type": "Feature", "geometry": {"type": "Point", "coordinates": [14.40131, 50.08733]}, "properties": {"id": "139F58247D2411E3BE26406186009F3A", "kind": "pozitiv", "description": "Klenba přízemních arkád zahradního pavilonu Schönbornského paláce - domu čp. 365 na Malé Straně.", "date_label": "červen 1931", "start_date": "1931-06-01", "end_date": "1931-06-30", "author": "Vojta, Tomáš (1885-1934)", "note": "", "views": "19x", "geolocation_type": "regional.address"}}, {"type": "Feature", "geometry": {"type": "Point", "coordinates": [14.40597, 50.08626]}, "properties": {"id": "13BA8AEB04FB11E3A4F66C626D41E503", "kind": "pozitiv", "description": "Pohled na dům čp. 490 (palác Metychů z Čečova - Hrzánský) na Velkopřevorském náměstí na Malé Straně ze zahrady Velkopřevorského paláce (dům čp. 485 na Malé Straně).", "date_label": "kol.1910", "start_date": "1910-01-01", "end_date": "1910-12-31", "author": "Fink, František (1854-1935)", "note": "", "views": "35x", "geolocation_type": "regional.address"}}, {"type": "Feature", "geometry": {"type": "Point", "coordinates": [14.40535, 50.09003]}, "properties": {"id": "140AB499DBB911E5AB3774D435EEBE90", "kind": "pozitiv", "description": "Pohled na vycpaného koně Albrechta z Valdštejna v interiéru Valdštejnského paláce (dům čp. 17 na Malé Straně).", "date_label": "", "start_date": "", "end_date": "", "author": "Eckert, Jindřich (1833-1905)", "note": "Eckert, Jindřich - Eckert-ateliér (repro)", "views": "68x", "geolocation_type": "regional.address"}}, {"type": "Feature", "geometry": {"type": "Point", "coordinates": [14.44357, 50.14932]}, "properties": {"id": "1440F0DCDD1411E480FB74D435EEBE90", "kind": "pozitiv", "description": "Pohled na statek čp. 15 v Dolních Chabrech z Bíleneckého náměstí.", "date_label": "1968", "start_date": "1968-01-01", "end_date": "1968-12-31", "author": "Vopravil, Josef (1902-1972)", "note": "", "views": "48x", "geolocation_type": "regional.address"}}, {"type": "Feature", "geometry": {"type": "Point", "coordinates": [14.41832, 50.08461]}, "properties": {"id": "14603E2CECDA11DFBD7B000C766D2371", "kind": "pozitiv", "description": "Pohled do dvora domu čp. 236 na Starém Městě - zahradní restaurace \"U Vocílků\" (\"U Vocelků\") před přestavbou - dvorní průčelí jižního traktu, kde bylo přízemí adaptováno pro Hlaváčkův obchod se starožitnostmi.", "date_label": "19.9.1926", "start_date": "1926-09-19", "end_date": "1926-09-19", "author": "Alexander, Antonín (1892-působnost do 1948)", "note": "", "views": "37x", "geolocation_type": "regional.address"}}, {"type": "Feature", "geometry": {"type": "Point", "coordinates": [14.41925, 50.07743]}, "properties": {"id": "15976988157311E39CC26C626D41E503", "kind": "pozitiv", "description": "Pohled na část západní strany Karlova náměstí. Uprostřed dům čp. 287 na Novém Městě na nároží ulice Na Zbořenci.", "date_label": "25.5.1931", "start_date": "1931-05-25", "end_date": "1931-05-25", "author": "Alexander, Antonín (1892-působnost do 1948)", "note": "", "views": "75x", "geolocation_type": "regional.address"}}, {"type": "Feature", "geometry": {"type": "Point", "coordinates": [14.41045, 50.12074]}, "properties": {"id": "15c36f2b38e2440f8a60710132d8d632", "kind": "pozitiv", "description": "Pohled na usedlost Salabka (dům čp. 57 v Troji) v dnešní ulici K Bohnicím. V pozadí vinice.", "date_label": "5.6.1959", "start_date": "1959-06-05", "end_date": "1959-06-05", "author": "Hnilička, Eduard (1887-1967)", "note": "", "views": "18x", "geolocation_type": "regional.address"}}, {"type": "Feature", "geometry": {"type": "Point", "coordinates": [14.40477, 50.08832]}, "properties": {"id": "15CFFC6681D311E3B4B96C626D41E503", "kind": "pozitiv", "description": "Celkový pohled na dům s podloubím čp. 35 na Malostranském náměstí (Malostranská beseda) na Malé Straně.", "date_label": "1945", "start_date": "1945-01-01", "end_date": "1945-12-31", "author": "Illek, František a Paul, Alexandr", "note": "", "views": "39x", "geolocation_type": "regional.address"}}, {"type": "Feature", "geometry": {"type": "Point", "coordinates": [14.40131, 50.08733]}, "properties": {"id": "15D3F5E07C7311E3BFE4406186009F3A", "kind": "pozitiv", "description": "Západní dvůr Schönbornského paláce - domu čp. 365 na Malé Straně. Fragment původní raně barokní zahradní zdi.", "date_label": "červen 1931", "start_date": "1931-06-01", "end_date": "1931-06-30", "author": "Vojta, Tomáš (1885-1934)", "note": "", "views": "31x", "geolocation_type": "regional.address"}}, {"type": "Feature", "geometry": {"type": "Point", "coordinates": [14.40395, 50.08915]}, "properties": {"id": "15E16D42581211E7A695406186009F3A", "kind": "pohlednice", "description": "Celkový pohled na dům čp. 176 (sněmovna) ve Sněmovní ulici na Malé Straně.", "date_label": "", "start_date": "", "end_date": "", "author": "Čech, L. J.", "note": "", "views": "32x", "geolocation_type": "regional.address"}}, {"type": "Feature", "geometry": {"type": "Point", "coordinates": [14.39071, 50.08877]}, "properties": {"id": "16135848D1B011E18F8C6C626D41E503", "kind": "pozitiv", "description": "Celkový pohled na hlavní průčelí Černínského paláce (dům čp. 101 na Hradčanech) na Loretánské náměstí.", "date_label": "13.3.1933", "start_date": "1933-03-13", "end_date": "1933-03-13", "author": "", "note": "", "views": "30x", "geolocation_type": "regional.address"}}, {"type": "Feature", "geometry": {"type": "Point", "coordinates": [14.40258, 50.02336]}, "properties": {"id": "16214A92D29C11E6BE58406186009F3A", "kind": "pozitiv", "description": "Průhled ulicí V Náklích v Hodkovičkách od drážního podjezdu. Vlevo dům čp. 7.", "date_label": "1958", "start_date": "1958-01-01", "end_date": "1958-12-31", "author": "", "note": "", "views": "32x", "geolocation_type": "regional.address"}}, {"type": "Feature", "geometry": {"type": "Point", "coordinates": [14.41873, 50.08783]}, "properties": {"id": "1628FE0F808811E4AAB4406186009F3A", "kind": "pozitiv", "description": "Pohled na zbytky románského zdiva nalezeného při bourání domu čp. 16 na Starém Městě (Andělská kolej) v Mikulášské ulici (dnes náměstí Franze Kafky) .", "date_label": "1909", "start_date": "1909-01-01", "end_date": "1909-12-31", "author": "Kříženecký, Jan (1868-1921)", "note": "", "views": "38x", "geolocation_type": "regional.address"}}, {"type": "Feature", "geometry": {"type": "Point", "coordinates": [14.42009, 50.087]}, "properties": {"id": "1655424290C411E8B3B474D435EEBE90", "kind": "negativ", "description": "Pohled na stroj chronometru orloje Staroměstské radnice (dům čp. 1 na Starém Městě) na Staroměstském náměstí (reprodukce jedné stránky z knihy Václava Rosického, Staroměstský orloj v Praze. Praha: J. Otto, 1923).", "date_label": "", "start_date": "", "end_date": "", "author": "", "note": "", "views": "36x", "geolocation_type": "regional.address"}}, {"type": "Feature", "geometry": {"type": "Point", "coordinates": [14.43263, 50.08071]}, "properties": {"id": "1678E9342CF211E3A89A406186009F3A", "kind": "pozitiv", "description": "Pohled na vlaky a nádraží císaře Františka Josefa I. (dům čp. 300 na Vinohradech) ze stanoviště nad vinohradským železničním tunelem. Vlevo zadní část budovy Nového německého divadla (dům čp. 101) a sousedního domu čp. 98 na Vinohradech.", "date_label": "", "start_date": "", "end_date": "", "author": "Reach, Zikmund (1859-1935)", "note": "Reach, Zikmund - Jelínková, Jana (repro)", "views": "138x", "geolocation_type": "regional.address"}}, {"type": "Feature", "geometry": {"type": "Point", "coordinates": [14.41724, 50.08595]}, "properties": {"id": "167FDF23A4B911E1BEEC000C766D2371", "kind": "negativ", "description": "Pohled do interiéru domu čp. 223 (Svatováclavská záložna) v Karlově ulici na Starém Městě - schodiště.", "date_label": "kol.1890", "start_date": "1890-01-01", "end_date": "1890-12-31", "author": "Eckert, Jindřich (1833-1905)", "note": "", "views": "27x", "geolocation_type": "regional.address"}}, {"type": "Feature", "geometry": {"type": "Point", "coordinates": [14.41701, 50.08605]}, "properties": {"id": "16D7B6E4F8A311E4808074D435EEBE90", "kind": "negativ", "description": "Průhled Karlovou ulicí od křižovatky s Liliovou k východu. Vlevo Klementinum (dům čp. 190, 1040), uprostřed v pozadí dům čp. 175 na Starém Městě.", "date_label": "kol.1925", "start_date": "1925-01-01", "end_date": "1925-12-31", "author": "Eckert-ateliér", "note": "", "views": "31x", "geolocation_type": "regional.address"}}, {"type": "Feature", "geometry": {"type": "Point", "coordinates": [14.42827, 50.08961]}, "properties": {"id": "178574C2161611E390486C626D41E503", "kind": "pozitiv", "description": "Celkový pohled na dům čp. 655 na Starém Městě (Ústav šlechtičen) v Revoluční třídě (Eliščině) směrem od náměstí Republiky (Josefské). Vpravo část domu čp. 1080 na Novém Městě.", "date_label": "", "start_date": "", "end_date": "", "author": "Bellmann-ateliér", "note": "", "views": "89x", "geolocation_type": "regional.address"}}, {"type": "Feature", "geometry": {"type": "Point", "coordinates": [14.40739, 50.08615]}, "properties": {"id": "178C60FE04F511E3A4F66C626D41E503", "kind": "pozitiv", "description": "Pohled na dům čp. 490 (palác Metychů z Čečova - Hrzánský) na Velkopřevorském náměstí na Malé Straně s renesančním portálem.", "date_label": "31.3.1914", "start_date": "1914-03-31", "end_date": "1914-03-31", "author": "Kříženecký, Jan (1868-1921)", "note": "", "views": "24x", "geolocation_type": "regional.address"}}, {"type": "Feature", "geometry": {"type": "Point", "coordinates": [14.49468, 50.0687]}, "properties": {"id": "179CC4FB3F3311E4B4E9406186009F3A", "kind": "pozitiv", "description": "Pohled na kapli Početí P. Marie a dům čp. 1000 ve Strašnicích.", "date_label": "14.9.1942", "start_date": "1942-09-14", "end_date": "1942-09-14", "author": "Alexander, Antonín (1892-působnost do 1948)", "note": "", "views": "59x", "geolocation_type": "regional.address"}}, {"type": "Feature", "geometry": {"type": "Point", "coordinates": [14.44868, 50.10248]}, "properties": {"id": "179E4A31955611E2BF29525400E46D25", "kind": "negativ", "description": "Pohled do interiéru domu čp. 515 v Holešovicích (Opatrovna a mateřská škola Na Maninách - dnes Tusarova 27) - jídelna.", "date_label": "kol.1900", "start_date": "1900-01-01", "end_date": "1900-12-31", "author": "Eckert, Jindřich (1833-1905)", "note": "", "views": "41x", "geolocation_type": "regional.address"}}, {"type": "Feature", "geometry": {"type": "Point", "coordinates": [14.40131, 50.08733]}, "properties": {"id": "17C50EF487FA11E2BF21525400E46D25", "kind": "negativ", "description": "Pohled do interiéru domu čp. 365 (Schönbornský palác) na Malé Straně - salon.", "date_label": "19.11.1902", "start_date": "1902-11-19", "end_date": "1902-11-19", "author": "Eckert, Jindřich (1833-1905)", "note": "", "views": "17x", "geolocation_type": "regional.address"}}, {"type": "Feature", "geometry": {"type": "Point", "coordinates": [14.42149, 50.08921]}, "properties": {"id": "17DC6245955E11E2BF29525400E46D25", "kind": "negativ", "description": "Pohled do Dušní ulice s domem čp. 905 na Starém Městě před zbořením v roce 1904.", "date_label": "1.5.1904", "start_date": "1904-05-01", "end_date": "1904-05-01", "author": "Eckert, Jindřich (1833-1905)", "note": "", "views": "22x", "geolocation_type": "regional.address"}}, {"type": "Feature", "geometry": {"type": "Point", "coordinates": [14.45566, 50.09259]}, "properties": {"id": "17F27386310B11E9978874D435EEBE90", "kind": "negativ", "description": "Pohled do v Palackého ulice (dnes Křižíkova) směrem k východu. Vpravo průčelí továrny Breitfeld - Daněk (dům čp. 219 v Karlíně).", "date_label": "kol.1900", "start_date": "1900-01-01", "end_date": "1900-12-31", "author": "Bellmann-ateliér", "note": "", "views": "69x", "geolocation_type": "regional.address"}}, {"type": "Feature", "geometry": {"type": "Point", "coordinates": [14.42708, 50.0821]}, "properties": {"id": "1867922681D411E3B4B96C626D41E503", "kind": "pozitiv", "description": "Celkový pohled na hlavní průčelí hotelu \"Grandhotel Šroubek\" na Václavském náměstí (dům čp. 826 na Novém Městě - dříve \"Arcivévoda Štěpán\" - dnes \"Grandhotel Evropa\").", "date_label": "kol.1930", "start_date": "1930-01-01", "end_date": "1930-12-31", "author": "Gotsche", "note": "", "views": "94x", "geolocation_type": "regional.address"}}, {"type": "Feature", "geometry": {"type": "Point", "coordinates": [14.50767, 50.07748]}, "properties": {"id": "187F229E87D211E2BF21525400E46D25", "kind": "negativ", "description": "Pohled na dům čp. 1222 na Novém Městě. V pozadí vpravo dům čp. 1220 (Helmův - Kubešův mlýn) na nábřeží Nového Města.", "date_label": "19.7.1909", "start_date": "1909-07-19", "end_date": "1909-07-19", "author": "Eckert-ateliér", "note": "", "views": "28x", "geolocation_type": "regional.address"}}, {"type": "Feature", "geometry": {"type": "Point", "coordinates": [14.41873, 50.08783]}, "properties": {"id": "188C2351808D11E4AAB4406186009F3A", "kind": "pozitiv", "description": "Pohled na gotické trámy nalezené při bourání domu čp. 16 na Starém Městě (Andělská kolej) v Mikulášské ulici (dnes náměstí Franze Kafky).", "date_label": "25.2.1909", "start_date": "1909-02-25", "end_date": "1909-02-25", "author": "Kříženecký, Jan (1868-1921)", "note": "", "views": "26x", "geolocation_type": "regional.address"}}, {"type": "Feature", "geometry": {"type": "Point", "coordinates": [14.41139, 50.09203]}, "properties": {"id": "18D004ED5A4811E7A69B406186009F3A", "kind": "pozitiv", "description": "Celkový pohled na Starkovu akademii (dům čp. 128) na nábřeží Edvarda Beneše na Malé Straně. V pozadí Pražský hrad.", "date_label": "", "start_date": "", "end_date": "", "author": "Bellmann (?)", "note": "", "views": "68x", "geolocation_type": "regional.address"}}, {"type": "Feature", "geometry": {"type": "Point", "coordinates": [14.41969, 50.0787]}, "properties": {"id": "193CA4C581DF11E3B4B96C626D41E503", "kind": "pozitiv", "description": "Celkový pohled na dům čp. 6 (trestní soud) na nároží Karlova náměstí a Spálené ulice (vlevo) na Novém Městě.", "date_label": "kol.1920 (?)", "start_date": "1920-01-01", "end_date": "1920-12-31", "author": "", "note": "", "views": "131x", "geolocation_type": "regional.address"}}, {"type": "Feature", "geometry": {"type": "Point", "coordinates": [14.42233, 50.08309]}, "properties": {"id": "1963C972CFF611E196716C626D41E503", "kind": "pozitiv", "description": "Pohled na průčelí domu čp. 761 do Národní třídy na Novém Městě. Vlevo část Ovocné ulice (dnes ulice 28. října), vpravo část Jungmannova náměstí.", "date_label": "1905", "start_date": "1905-01-01", "end_date": "1905-12-31", "author": "Bruner-Dvořák, Rudolf (1864-1921)", "note": "", "views": "73x", "geolocation_type": "regional.address"}}, {"type": "Feature", "geometry": {"type": "Point", "coordinates": [14.42825, 50.08762]}, "properties": {"id": "197BAAA5E83911E4BB7A0024BE7CD9AC", "kind": "pozitiv", "description": "Pohled na horní část kandelábru před domem čp. 1090 (Obecní dům) na Starém Městě.", "date_label": "kol. 1915", "start_date": "", "end_date": "", "author": "Štenc", "note": "", "views": "30x", "geolocation_type": "regional.address"}}, {"type": "Feature", "geometry": {"type": "Point", "coordinates": [14.4186, 50.0808]}, "properties": {"id": "19D2D8A2923011E2BF28525400E46D25", "kind": "negativ", "description": "Pohled na část průčelí domu čp. 126 na Novém Městě v Ostrovní ulici - s portálem do dvora.", "date_label": "kol.1900", "start_date": "1900-01-01", "end_date": "1900-12-31", "author": "Eckert, Jindřich (1833-1905)", "note": "", "views": "13x", "geolocation_type": "regional.address"}}, {"type": "Feature", "geometry": {"type": "Point", "coordinates": [14.42009, 50.087]}, "properties": {"id": "19E9766D90EA11E8B3B474D435EEBE90", "kind": "pozitiv", "description": "Socha Kronikáře a Filozofa z orloje v jižním průčelí Staroměstské radnice (dům čp. 1 na Starém Městě) na Staroměstském náměstí před restaurováním.", "date_label": "21.9.1911", "start_date": "1911-09-21", "end_date": "1911-09-21", "author": "Kříženecký, Jan (1868-1921)", "note": "", "views": "41x", "geolocation_type": "regional.address"}}, {"type": "Feature", "geometry": {"type": "Point", "coordinates": [14.40131, 50.08733]}, "properties": {"id": "1A11B1DD7D3A11E3BE26406186009F3A", "kind": "pozitiv", "description": "Východní zeď první zahradní terasy Schönbornského paláce - domu čp. 365 na Malé Straně.", "date_label": "", "start_date": "", "end_date": "", "author": "", "note": "", "views": "18x", "geolocation_type": "regional.address"}}, {"type": "Feature", "geometry": {"type": "Point", "coordinates": [14.40131, 50.08733]}, "properties": {"id": "1A4963D57D0711E3BE26406186009F3A", "kind": "pozitiv", "description": "Interiér původního belvederu (s vyhlídkou do zahrady) v Schönbornském paláci - domě čp. 365 na Malé Straně.", "date_label": "červen 1931", "start_date": "1931-06-01", "end_date": "1931-06-30", "author": "Vojta, Tomáš (1885-1934)", "note": "", "views": "24x", "geolocation_type": "regional.address"}}, {"type": "Feature", "geometry": {"type": "Point", "coordinates": [14.43428, 50.10216]}, "properties": {"id": "1A4E3B1FC3E411E480AC74D435EEBE90", "kind": "pozitiv", "description": "Pohled na průčelí domu čp. 528 v Holešovicích (továrna Hutter a Schrantz) do Veletržní ulice.", "date_label": "1934", "start_date": "1934-01-01", "end_date": "1934-12-31", "author": "", "note": "", "views": "83x", "geolocation_type": "regional.address"}}, {"type": "Feature", "geometry": {"type": "Point", "coordinates": [14.40447, 50.10336]}, "properties": {"id": "1A9737BD5BEE11E79925406186009F3A", "kind": "negativ", "description": "Celkový pohled na dům čp. 592 v ulici Českomalínská v Bubenči.", "date_label": "po 1923", "start_date": "1924-01-01", "end_date": "2000-12-31", "author": "Vojta, Tomáš (1885-1934)", "note": "", "views": "34x", "geolocation_type": "regional.address"}}, {"type": "Feature", "geometry": {"type": "Point", "coordinates": [14.45836, 50.09311]}, "properties": {"id": "1AB6C2DE87D711E2BF21525400E46D25", "kind": "negativ", "description": "Pohled do interiéru školy (dům čp. 460) na Lyčkově náměstí v Karlíně (dříve Riegrovy sady) při stavbě - schodiště.", "date_label": "1905", "start_date": "1905-01-01", "end_date": "1905-12-31", "author": "Eckert-ateliér", "note": "", "views": "55x", "geolocation_type": "regional.address"}}, {"type": "Feature", "geometry": {"type": "Point", "coordinates": [14.40872, 50.06142]}, "properties": {"id": "1AC9CC25158711E8826174D435EEBE90", "kind": "pozitiv", "description": "Pohled z Pavího vrchu přes Vltavu na Vyšehradskou skálu s kostelem sv. Petra a Pavla před přestavbou. V popředí zleva hotel Plzeňka (dům čp. 35), hotel U Šumavského smrku (dům čp. 280) a nádraží České západní dráhy (dům čp. 279) na Smíchově. Za nimi Císařská louka.", "date_label": "", "start_date": "", "end_date": "", "author": "Eckert, Jindřich (1833-1905)", "note": "Eckert, Jindřich - Reach, Zikmund (repro)", "views": "143x", "geolocation_type": "regional.address"}}, {"type": "Feature", "geometry": {"type": "Point", "coordinates": [14.42009, 50.087]}, "properties": {"id": "1B1A32BBE28A11E89F1B74D435EEBE90", "kind": "pozitiv", "description": "Pohled na část přízemí jižního průčelí Staroměstské radnice (dům čp. 1 na Starém Městě) s oknem a s poštovní schránkou.", "date_label": "květen 1901", "start_date": "1901-05-01", "end_date": "1901-05-31", "author": "Dvořák, František (dokumenty 1901-1908)", "note": "", "views": "39x", "geolocation_type": "regional.address"}}, {"type": "Feature", "geometry": {"type": "Point", "coordinates": [14.42903, 50.08791]}, "properties": {"id": "1B3C6B84174E11EABE1274D435EEBE90", "kind": "pozitiv", "description": "Celkový pohled na hlavní průčelí Hybernského paláce (dům čp. 1037 na Novém Městě) na náměstí Republiky.", "date_label": "kol.1930", "start_date": "1930-01-01", "end_date": "1930-12-31", "author": "", "note": "", "views": "23x", "geolocation_type": "regional.address"}}, {"type": "Feature", "geometry": {"type": "Point", "coordinates": [14.4186, 50.0808]}, "properties": {"id": "1BA34CA5955211E2BF29525400E46D25", "kind": "negativ", "description": "Pohled do interiéru domu čp. 126 na Novém Městě v Ostrovní ulici - sazečská dílna.", "date_label": "kol.1900", "start_date": "1900-01-01", "end_date": "1900-12-31", "author": "Eckert, Jindřich (1833-1905)", "note": "", "views": "17x", "geolocation_type": "regional.address"}}, {"type": "Feature", "geometry": {"type": "Point", "coordinates": [14.40638, 50.08475]}, "properties": {"id": "1BE1BB19A3FD11E1BEEB000C766D2371", "kind": "negativ", "description": "Pohled na manéž v Nosticově ulici (dům čp. 468 - Nosticova jízdárna) na Malé Straně.", "date_label": "21.5.1903", "start_date": "1903-05-21", "end_date": "1903-05-21", "author": "Eckert, Jindřich (1833-1905)", "note": "", "views": "20x", "geolocation_type": "regional.address"}}, {"type": "Feature", "geometry": {"type": "Point", "coordinates": [14.39408, 50.08858]}, "properties": {"id": "1BE8CF322BED11E69C9A406186009F3A", "kind": "negativ", "description": "Celkový pohled na průčelí Hrzánského paláce (dům čp. 177) v Loretánské ulici na Hradčanech.", "date_label": "7.4.1949", "start_date": "1949-04-07", "end_date": "1949-04-07", "author": "Vopravil, Josef (1902-1972)", "note": "", "views": "32x", "geolocation_type": "regional.address"}}, {"type": "Feature", "geometry": {"type": "Point", "coordinates": [14.41939, 50.08792]}, "properties": {"id": "1BFBE707332411E2BF04525400E46D25", "kind": "pozitiv", "description": "Pohled na archeologické vykopávky v místě dnešního náměstí Franze Kafky. V pozadí uprostřed kostel sv. Mikuláše, vlevo dům čp. 24 na Starém Městě.", "date_label": "1926-1927", "start_date": "1926-01-01", "end_date": "1927-12-31", "author": "Pasternak, Jaroslav", "note": "", "views": "31x", "geolocation_type": "regional.address"}}, {"type": "Feature", "geometry": {"type": "Point", "coordinates": [14.42349, 50.08599]}, "properties": {"id": "1C0F0DA4B0E511E29177406186009F3A", "kind": "pozitiv", "description": "Pohled na západní průčelí Stavovského divadla (dům čp. 540 na Starém Městě).", "date_label": "kol.1930", "start_date": "1930-01-01", "end_date": "1930-12-31", "author": "Centropress Praha XII.", "note": "", "views": "27x", "geolocation_type": "regional.address"}}, {"type": "Feature", "geometry": {"type": "Point", "coordinates": [14.42009, 50.087]}, "properties": {"id": "1C331A4590B511E8B3B474D435EEBE90", "kind": "negativ", "description": "Pohled na orloj Staroměstské radnice (dům čp. 1 na Starém Městě) na Staroměstském náměstí.", "date_label": "", "start_date": "", "end_date": "", "author": "", "note": "", "views": "22x", "geolocation_type": "regional.address"}}, {"type": "Feature", "geometry": {"type": "Point", "coordinates": [14.42203, 50.08761]}, "properties": {"id": "1C7DBBCED64311E5A67174D435EEBE90", "kind": "pozitiv", "description": "Pohled na mariánský sloup na Staroměstském náměstí. V pozadí domy čp. 606 (palác Kinských), 605 a 604 na Starém Městě.", "date_label": "1865", "start_date": "1865-01-01", "end_date": "1865-12-31", "author": "Fridrich, František (1829-1892)", "note": "", "views": "72x", "geolocation_type": "regional.address"}}, {"type": "Feature", "geometry": {"type": "Point", "coordinates": [14.40131, 50.08733]}, "properties": {"id": "1D201FE379F911E3B274406186009F3A", "kind": "pozitiv", "description": "Interiér ložnice v druhém patře Schönbornského paláce - domu čp. 365 na Malé Straně - detail s oknem a dveřmi.", "date_label": "červen 1931", "start_date": "1931-06-01", "end_date": "1931-06-30", "author": "Vojta, Tomáš (1885-1934)", "note": "", "views": "24x", "geolocation_type": "regional.address"}}, {"type": "Feature", "geometry": {"type": "Point", "coordinates": [14.41139, 50.09203]}, "properties": {"id": "1E796279A3FC11E1BEEB000C766D2371", "kind": "negativ", "description": "Pohled na stavbu domu čp. 128 na Strakově nábřeží (Strakova akademie) na Malé Straně. V pozadí domy na Klárově s domem čp. 131 (Klárův ústav slepců).", "date_label": "kol.1895", "start_date": "1895-01-01", "end_date": "1895-12-31", "author": "Eckert, Jindřich (1833-1905)", "note": "", "views": "39x", "geolocation_type": "regional.address"}}, {"type": "Feature", "geometry": {"type": "Point", "coordinates": [14.37746, 50.08679]}, "properties": {"id": "1EFACA6CB84C11E5AA08D4BED94BB14D", "kind": "pozitiv", "description": "Pohled na dům čp. 42 ve Veleslavínské ulici (dnes Radimova) v Břevnově. V pozadí dům čp. 6 (\"Česká chaloupka\").", "date_label": "4.9.1943", "start_date": "1943-09-04", "end_date": "1943-09-04", "author": "Alexander, Antonín (1892-působnost do 1948)", "note": "", "views": "48x", "geolocation_type": "regional.address"}}, {"type": "Feature", "geometry": {"type": "Point", "coordinates": [14.41735, 50.08203]}, "properties": {"id": "1F4B1F3F824B11E2BF1E525400E46D25", "kind": "negativ", "description": "Celkový pohled na novostavbu domu čp. 949 (\"Matějovský\") na Národní třídě na Starém Městě.", "date_label": "1912", "start_date": "1912-01-01", "end_date": "1912-12-31", "author": "Eckert-ateliér", "note": "", "views": "27x", "geolocation_type": "regional.address"}}, {"type": "Feature", "geometry": {"type": "Point", "coordinates": [14.42009, 50.087]}, "properties": {"id": "1F84490B725411E98754406186009F3A", "kind": "negativ", "description": "Boční pohled na východní křídlo Staroměstské radnice (dům čp. 1 na Starém Městě).", "date_label": "1904", "start_date": "1904-01-01", "end_date": "1904-12-31", "author": "Bellmann-ateliér", "note": "", "views": "51x", "geolocation_type": "regional.address"}}, {"type": "Feature", "geometry": {"type": "Point", "coordinates": [14.41783, 50.08711]}, "properties": {"id": "2010af7db42a44f59eda238b948cf087", "kind": "pozitiv", "description": "Pohled na stavbu budovy Magistrátu hlavního města Prahy (dům čp. 2) na Mariánském náměstí na Starém Městě.", "date_label": "", "start_date": "", "end_date": "", "author": "", "note": "", "views": "7x", "geolocation_type": "regional.address"}}, {"type": "Feature", "geometry": {"type": "Point", "coordinates": [14.40905, 50.09295]}, "properties": {"id": "203BE606D5A111E18CF36C626D41E503", "kind": "pozitiv", "description": "Pohled do Chotkovy silnice na Malé Straně z výšky - z terasy domu čp. 134 směrem k západu. Zprava domy čp. 144, čp. 551, čp. 538, čp. 607 (část). Vlevo část domu čp. 145 na Malé Straně.", "date_label": "2.2.1934", "start_date": "1934-02-02", "end_date": "1934-02-02", "author": "Alexander, Antonín (1892-působnost do 1948)", "note": "", "views": "70x", "geolocation_type": "regional.address"}}, {"type": "Feature", "geometry": {"type": "Point", "coordinates": [14.41783, 50.08711]}, "properties": {"id": "203e0757ce5943039f6531808a5b71bd", "kind": "pozitiv", "description": "Pohled na stavbu budovy Magistrátu hlavního města Prahy (dům čp. 2) na Mariánském náměstí na Starém Městě. V pozadí Platnéřská ulice a náměstí Franze Kafky.", "date_label": "1909-1910", "start_date": "1909-01-01", "end_date": "1910-12-31", "author": "", "note": "", "views": "12x", "geolocation_type": "regional.address"}}, {"type": "Feature", "geometry": {"type": "Point", "coordinates": [14.42009, 50.087]}, "properties": {"id": "203ED886917211E8B9E274D435EEBE90", "kind": "pozitiv", "description": "Socha Marnivce a Turka z orloje v jižním průčelí Staroměstské radnice (dům čp. 1 na Starém Městě) na Staroměstském náměstí po restaurování.", "date_label": "18.12.1911", "start_date": "1911-12-18", "end_date": "1911-12-18", "author": "Kříženecký, Jan (1868-1921)", "note": "", "views": "35x", "geolocation_type": "regional.address"}}, {"type": "Feature", "geometry": {"type": "Point", "coordinates": [14.43554, 50.09229]}, "properties": {"id": "207CA96F90B011E2BF26525400E46D25", "kind": "negativ", "description": "Pohled na novoměstské nábřeží - při stavbě. Uprostřed Helmovské mlýny a novorenesanční dům čp. 1219 na nároží ulic Klimentské a Půtovy.", "date_label": "28.5.1908", "start_date": "1908-05-28", "end_date": "1908-05-28", "author": "Eckert-ateliér", "note": "", "views": "32x", "geolocation_type": "regional.address"}}, {"type": "Feature", "geometry": {"type": "Point", "coordinates": [14.42009, 50.087]}, "properties": {"id": "208F064290C111E8B3B474D435EEBE90", "kind": "negativ", "description": "Pohled na část orloje Staroměstské radnice (dům čp. 1 na Starém Městě) na Staroměstském náměstí při opravě.", "date_label": "kol.1910", "start_date": "1910-01-01", "end_date": "1910-12-31", "author": "", "note": "", "views": "22x", "geolocation_type": "regional.address"}}, {"type": "Feature", "geometry": {"type": "Point", "coordinates": [14.43704, 50.09958]}, "properties": {"id": "2097CB61698711E49A11406186009F3A", "kind": "pozitiv", "description": "Celkový pohled na dům čp. 421 na nároží ulic Bubenské (vpravo) a Antonínské (vlevo) v Holešovicích.", "date_label": "31.8.1937", "start_date": "1937-08-31", "end_date": "1937-08-31", "author": "Alexander, Antonín (1892-působnost do 1948)", "note": "", "views": "72x", "geolocation_type": "regional.address"}}, {"type": "Feature", "geometry": {"type": "Point", "coordinates": [14.42009, 50.087]}, "properties": {"id": "2153E36190E611E8B3B474D435EEBE90", "kind": "pozitiv", "description": "Pohled na levou spodní část ciferníku orloje Staroměstské radnice při restaurování (dům čp. 1 na Starém Městě) na Staroměstském náměstí.", "date_label": "19.9.1911", "start_date": "1911-09-19", "end_date": "1911-09-19", "author": "", "note": "", "views": "34x", "geolocation_type": "regional.address"}}, {"type": "Feature", "geometry": {"type": "Point", "coordinates": [14.40535, 50.09003]}, "properties": {"id": "21BDEF285F5611E8A52374D435EEBE90", "kind": "pozitiv", "description": "Pohled do zahrady Valdštejnského paláce s grottou a voliérou (dům čp. 17 na Malé Straně).", "date_label": "", "start_date": "", "end_date": "", "author": "Eckert-ateliér", "note": "", "views": "41x", "geolocation_type": "regional.address"}}, {"type": "Feature", "geometry": {"type": "Point", "coordinates": [14.40473, 50.02294]}, "properties": {"id": "21E66EECD29311E6BE58406186009F3A", "kind": "pozitiv", "description": "Celkový pohled na kapli sv. Bartoloměje v Hodkovičkách. V pozadí dům čp. 12 v Modřanské ulici.", "date_label": "1958", "start_date": "1958-01-01", "end_date": "1958-12-31", "author": "", "note": "", "views": "39x", "geolocation_type": "regional.address"}}, {"type": "Feature", "geometry": {"type": "Point", "coordinates": [14.41783, 50.08711]}, "properties": {"id": "222996ed5c034954bf21dcf85ffb7aaa", "kind": "pozitiv", "description": "Pohled na stavbu budovy Magistrátu hlavního města Prahy (dům čp. 2) na Mariánském náměstí na Starém Městě - stavba dvorany.", "date_label": "", "start_date": "", "end_date": "", "author": "", "note": "", "views": "8x", "geolocation_type": "regional.address"}}, {"type": "Feature", "geometry": {"type": "Point", "coordinates": [14.4213, 50.0816]}, "properties": {"id": "223C5C84D9FA11E480BC74D435EEBE90", "kind": "pozitiv", "description": "Průhled Charvátovou ulicí. Vlevo dům čp. 35, vpravo čp. 1978 na Novém Městě.", "date_label": "11.9.1927", "start_date": "1927-09-11", "end_date": "1927-09-11", "author": "Alexander, Antonín (1892-působnost do 1948)", "note": "", "views": "33x", "geolocation_type": "regional.address"}}, {"type": "Feature", "geometry": {"type": "Point", "coordinates": [14.41621, 50.08866]}, "properties": {"id": "228A546E763B11E0BE30000C766D2371", "kind": "pozitiv", "description": "Pohled na budovu Filozofické fakulty UK (původně dům čp. 55 na Starém Městě - nyní dům čp. 1 v Josefově) na nároží Kaprovy a Valentinské ulice.", "date_label": "10.11.1944", "start_date": "1944-11-10", "end_date": "1944-11-10", "author": "Alexander, Antonín (1892-působnost do 1948)", "note": "", "views": "48x", "geolocation_type": "regional.address"}}, {"type": "Feature", "geometry": {"type": "Point", "coordinates": [14.41783, 50.08711]}, "properties": {"id": "22ecece6e38e4559a598776f092aa80b", "kind": "pozitiv", "description": "Pohled na stavbu budovy Magistrátu hlavního města Prahy (dům čp. 2) na Mariánském náměstí na Starém Městě. V pozadí Platnéřská ulice a náměstí Franze Kafky.", "date_label": "1909-1910", "start_date": "1909-01-01", "end_date": "1910-12-31", "author": "", "note": "", "views": "14x", "geolocation_type": "regional.address"}}, {"type": "Feature", "geometry": {"type": "Point", "coordinates": [14.38224, 50.08528]}, "properties": {"id": "22F688FBB84111E5AA08D4BED94BB14D", "kind": "pozitiv", "description": "Pohled na přední stěnu kapličky č. 1 poutní cesty do Hájku v Břevnově při čp. 47 ve Střešovicích (dnes dům čp. 1069 v Břevnově) u Bělohoské ulice.", "date_label": "6.9.1943", "start_date": "1943-09-06", "end_date": "1943-09-06", "author": "Alexander, Antonín (1892-působnost do 1948)", "note": "", "views": "74x", "geolocation_type": "regional.address"}}, {"type": "Feature", "geometry": {"type": "Point", "coordinates": [14.44531, 50.09841]}, "properties": {"id": "22F7916E76B311E2BF17525400E46D25", "kind": "negativ", "description": "Pohled na správní budovu (\"Správa a výběrny\") v areálu pražských Ústředních jatek v Holešovicích (dům čp. 306).", "date_label": "1895", "start_date": "1895-01-01", "end_date": "1895-12-31", "author": "Eckert, Jindřich (1833-1905)", "note": "", "views": "70x", "geolocation_type": "regional.address"}}, {"type": "Feature", "geometry": {"type": "Point", "coordinates": [14.44983, 50.01797]}, "properties": {"id": "231F1C7629F111E9980E74D435EEBE90", "kind": "negativ", "description": "Celkový pohled na hlavní obytnou budovu statku čp. 101 (Nové Dvory) v ulici U Nového dvora (dnes Durychova) ve Lhotce při bourání.", "date_label": "červen 1953", "start_date": "1953-06-01", "end_date": "1953-06-30", "author": "", "note": "", "views": "49x", "geolocation_type": "regional.address"}}, {"type": "Feature", "geometry": {"type": "Point", "coordinates": [14.42743, 50.08554]}, "properties": {"id": "233A1BB885B411E2BF1F525400E46D25", "kind": "negativ", "description": "Pohled do interiéru budovy Zemské banky (dům čp. 858) na Novém Městě - kancelář centrálního ředitele.", "date_label": "16.2.1903", "start_date": "1903-02-16", "end_date": "1903-02-16", "author": "Eckert, Jindřich (1833-1905)", "note": "", "views": "23x", "geolocation_type": "regional.address"}}, {"type": "Feature", "geometry": {"type": "Point", "coordinates": [14.40124, 50.08755]}, "properties": {"id": "23A2044428A011E6BCEA406186009F3A", "kind": "negativ", "description": "Pohled do ulice Tržiště. Vpravo dům čp. 302, uprostřed dům čp. 303 na Malé Straně.", "date_label": "kol.1920", "start_date": "1920-01-01", "end_date": "1920-12-31", "author": "Fink, František (1854-1935)", "note": "", "views": "20x", "geolocation_type": "regional.address"}}, {"type": "Feature", "geometry": {"type": "Point", "coordinates": [14.42582, 50.09301]}, "properties": {"id": "240C33A357F611E7A695406186009F3A", "kind": "pozitiv", "description": "Celkový pohled na budovu ministerstva průmyslu a obchodu (dům čp. 1039) v ulici Na Františku na Starém Městě.", "date_label": "1985", "start_date": "1985-01-01", "end_date": "1985-12-31", "author": "Rameš, Václav", "note": "", "views": "30x", "geolocation_type": "regional.address"}}, {"type": "Feature", "geometry": {"type": "Point", "coordinates": [14.41798, 50.086]}, "properties": {"id": "24290DD504D711E3A4F66C626D41E503", "kind": "pozitiv", "description": "Pohled do Husovy ulice směrem k severu. Zleva domy čp. 227, 228 (nově opravený), 229 a 156. V pozadí Clam Gallasův palác čp. 158 na Starém Městě.", "date_label": "30.8.1935", "start_date": "1935-08-30", "end_date": "1935-08-30", "author": "Alexander, Antonín (1892-působnost do 1948)", "note": "", "views": "46x", "geolocation_type": "regional.address"}}, {"type": "Feature", "geometry": {"type": "Point", "coordinates": [14.41592, 50.13467]}, "properties": {"id": "242D64BA212311E8925674D435EEBE90", "kind": "pozitiv", "description": "Pohled na kostel sv. Petra a Pavla na bývalé návsi ve starých Bohnicích (dnes Bohnická ulice). V pozadí dům čp. 13.", "date_label": "15.6.1959", "start_date": "1959-06-15", "end_date": "1959-06-15", "author": "Hnilička, Eduard (1887-1967)", "note": "", "views": "74x", "geolocation_type": "regional.address"}}, {"type": "Feature", "geometry": {"type": "Point", "coordinates": [14.42009, 50.087]}, "properties": {"id": "247213E2124211E8A338406186009F3A", "kind": "pozitiv", "description": "Pohled na osvětlenou Staroměstskou radnici při příležitosti 10. výročí samostatnosti Československé republiky. V pozadí kostel P. Marie před Týnem na Starém Městě.", "date_label": "28.10.1928", "start_date": "1928-10-28", "end_date": "1928-10-28", "author": "Vopravil, Josef (1902-1972)", "note": "", "views": "49x", "geolocation_type": "regional.address"}}, {"type": "Feature", "geometry": {"type": "Point", "coordinates": [14.42009, 50.087]}, "properties": {"id": "247A894590EB11E8B3B474D435EEBE90", "kind": "pozitiv", "description": "Socha Hvězdáře a archanděla Michaela z orloje v jižním průčelí Staroměstské radnice (dům čp. 1 na Starém Městě) na Staroměstském náměstí před restaurováním.", "date_label": "21.9.1911", "start_date": "1911-09-21", "end_date": "1911-09-21", "author": "Kříženecký, Jan (1868-1921)", "note": "", "views": "42x", "geolocation_type": "regional.address"}}, {"type": "Feature", "geometry": {"type": "Point", "coordinates": [14.44531, 50.09841]}, "properties": {"id": "249C9A3F921811E2BF28525400E46D25", "kind": "negativ", "description": "Pohled do interiéru tržnice masa v areálu pražských Ústředních jatek v Holešovicích (dům čp. 306).", "date_label": "1895", "start_date": "1895-01-01", "end_date": "1895-12-31", "author": "Eckert, Jindřich (1833-1905)", "note": "", "views": "79x", "geolocation_type": "regional.address"}}, {"type": "Feature", "geometry": {"type": "Point", "coordinates": [14.42825, 50.08762]}, "properties": {"id": "25308762E83811E4BB7A0024BE7CD9AC", "kind": "pozitiv", "description": "Pohled na část Šalounova sousoší nad průčelím domu čp. 1090 (Obecní dům) na Starém Městě.", "date_label": "kol. 1915", "start_date": "", "end_date": "", "author": "Štenc", "note": "", "views": "24x", "geolocation_type": "regional.address"}}, {"type": "Feature", "geometry": {"type": "Point", "coordinates": [14.42009, 50.087]}, "properties": {"id": "2552080990B911E8B3B474D435EEBE90", "kind": "negativ", "description": "Pohled na vyobrazení měsíců Josefa Mánesa (znamení Lev) na orloji Staroměstské radnice (dům čp. 1 na Starém Městě) na Staroměstském náměstí.", "date_label": "", "start_date": "", "end_date": "", "author": "", "note": "", "views": "25x", "geolocation_type": "regional.address"}}, {"type": "Feature", "geometry": {"type": "Point", "coordinates": [14.41423, 50.08154]}, "properties": {"id": "2599D3048B1311E2BF22525400E46D25", "kind": "negativ", "description": "Pohled na slavobránu na Národní třídě vybudovaná Českou spořitelnou s dekorací při příležitosti návštěvy císaře Františka Josefa I. v Praze. Vlevo část budovy Národního divadla, vpravo část budovy 1009 (Česká spořitelna) na Starém Městě.", "date_label": "září 1891", "start_date": "1891-09-01", "end_date": "1891-09-30", "author": "Eckert, Jindřich (1833-1905)", "note": "", "views": "34x", "geolocation_type": "regional.address"}}, {"type": "Feature", "geometry": {"type": "Point", "coordinates": [14.44237, 50.03563]}, "properties": {"id": "259E4279510411E38E526C626D41E503", "kind": "pozitiv", "description": "Pohled na hlavní průčelí kaple sv. Anny v Dolnokrčské ulici 1 (dům čp. 1908 v Krči).", "date_label": "28.4.1944", "start_date": "1944-04-28", "end_date": "1944-04-28", "author": "Alexander, Antonín (1892-působnost do 1948)", "note": "", "views": "72x", "geolocation_type": "regional.address"}}, {"type": "Feature", "geometry": {"type": "Point", "coordinates": [14.4401, 50.09021]}, "properties": {"id": "25C9B659310711E9978874D435EEBE90", "kind": "negativ", "description": "Pohled do Křižíkovy (Palackého) ulice od křižovatky s ulicí Sadovou (dnes Ke Štvanici) k východu - k viaduktu. Zprava domy čp. 345, čp. 379 a čp. 283 (divadlo) v Karlíně. Zleva domy čp. 254, čp. 255, čp. 267... v Karlíně.", "date_label": "kol.1900", "start_date": "1900-01-01", "end_date": "1900-12-31", "author": "Bellmann-ateliér", "note": "", "views": "73x", "geolocation_type": "regional.address"}}, {"type": "Feature", "geometry": {"type": "Point", "coordinates": [14.42851, 50.0692]}, "properties": {"id": "25CB0CE038F711E4BE4B406186009F3A", "kind": "pozitiv", "description": "Pohled do interiéru domu čp. 453 (chorobinec na Karlově) na Novém Městě - pacienti v pokoji.", "date_label": "kol.1910", "start_date": "1910-01-01", "end_date": "1910-12-31", "author": "", "note": "", "views": "56x", "geolocation_type": "regional.address"}}, {"type": "Feature", "geometry": {"type": "Point", "coordinates": [14.41426, 50.08298]}, "properties": {"id": "2717D1BE81D811E3B4B96C626D41E503", "kind": "pozitiv", "description": "Celkový pohled na dům čp. 320 na Starém Městě na nároží ulic Konviktské (vpravo) a Divadelní (vlevo).", "date_label": "29.3.1928", "start_date": "1928-03-29", "end_date": "1928-03-29", "author": "Alexander, Antonín (1892-působnost do 1948)", "note": "", "views": "36x", "geolocation_type": "regional.address"}}, {"type": "Feature", "geometry": {"type": "Point", "coordinates": [14.36175, 50.08637]}, "properties": {"id": "27256D9BB85511E5AA08D4BED94BB14D", "kind": "pozitiv", "description": "Průhled Markétskou ulicí od čp. 60 v Břevnově. Dále domy čp. 63, 61, 72 a 67.", "date_label": "3.9.1943", "start_date": "1943-09-03", "end_date": "1943-09-03", "author": "Alexander, Antonín (1892-působnost do 1948)", "note": "", "views": "32x", "geolocation_type": "regional.address"}}, {"type": "Feature", "geometry": {"type": "Point", "coordinates": [14.44868, 50.10248]}, "properties": {"id": "276BBB1A8AF611E2BF22525400E46D25", "kind": "negativ", "description": "Pohled do interiéru domu čp. 515 v Holešovicích (Opatrovna a mateřská škola Na Maninách - dnes Tusarova 27) - oddělení pro větší děti - děti při jídle u stolu.", "date_label": "1901", "start_date": "1901-01-01", "end_date": "1901-12-31", "author": "Eckert, Jindřich (1833-1905)", "note": "", "views": "44x", "geolocation_type": "regional.address"}}, {"type": "Feature", "geometry": {"type": "Point", "coordinates": [14.41783, 50.08711]}, "properties": {"id": "276ECEC14D9911E1AE2C6C626D41E503", "kind": "pozitiv", "description": "Průhled Platnéřskou ulicí s budovou Magistrátu hlavního města Prahy (dům čp. 2) na Starém Městě. Uprostřed prázdné prostranství po zboření domů této části Platnéřské ulice.", "date_label": "10.3.1913", "start_date": "1913-03-10", "end_date": "1913-03-10", "author": "Kříženecký, Jan (1868-1921)", "note": "", "views": "44x", "geolocation_type": "regional.address"}}, {"type": "Feature", "geometry": {"type": "Point", "coordinates": [14.44123, 50.09021]}, "properties": {"id": "276EF61F310C11E9978874D435EEBE90", "kind": "negativ", "description": "Celkový pohled na hlavní průčelí domu čp. 283 v Karlíně (divadlo) v Palackého ulici (dnes Křižíkova). V pozadí vlevo část viaduktu.", "date_label": "kol.1900", "start_date": "1900-01-01", "end_date": "1900-12-31", "author": "Bellmann-ateliér", "note": "", "views": "65x", "geolocation_type": "regional.address"}}, {"type": "Feature", "geometry": {"type": "Point", "coordinates": [14.40638, 50.08475]}, "properties": {"id": "278F386D826211E2BF1E525400E46D25", "kind": "negativ", "description": "Pohled do interiéru manéže v Nosticově ulici (dům čp. 468 - Nosticova jízdárna) na Malé Straně.", "date_label": "21.5.1903", "start_date": "1903-05-21", "end_date": "1903-05-21", "author": "Eckert, Jindřich (1833-1905)", "note": "", "views": "22x", "geolocation_type": "regional.address"}}, {"type": "Feature", "geometry": {"type": "Point", "coordinates": [14.44531, 50.09841]}, "properties": {"id": "27A06ACC921711E2BF28525400E46D25", "kind": "negativ", "description": "Pohled do interiéru jatek vepřového dobytka v areálu pražských Ústředních jatek v Holešovicích (dům čp. 306).", "date_label": "1895", "start_date": "1895-01-01", "end_date": "1895-12-31", "author": "Eckert, Jindřich (1833-1905)", "note": "", "views": "42x", "geolocation_type": "regional.address"}}, {"type": "Feature", "geometry": {"type": "Point", "coordinates": [14.42825, 50.08762]}, "properties": {"id": "27AE4BADF25911E4AA40406186009F3A", "kind": "pozitiv", "description": "Pohled na vchod Primátorského sálu v Obecním domě (dům čp. 1090 na Starém Městě).", "date_label": "kol.1920", "start_date": "1920-01-01", "end_date": "1920-12-31", "author": "", "note": "", "views": "21x", "geolocation_type": "regional.address"}}, {"type": "Feature", "geometry": {"type": "Point", "coordinates": [14.42825, 50.08762]}, "properties": {"id": "27C2DECBF8A111E4808074D435EEBE90", "kind": "negativ", "description": "Celkový pohled na Prašnou bránu po přestavbě. Vpravo část Obecního domu (čp. 1090 na Starém Městě), vlevo část nárožního domu čp. 969 na Starém Městě.", "date_label": "kol.1925", "start_date": "1925-01-01", "end_date": "1925-12-31", "author": "Eckert-ateliér", "note": "", "views": "66x", "geolocation_type": "regional.address"}}, {"type": "Feature", "geometry": {"type": "Point", "coordinates": [14.42009, 50.087]}, "properties": {"id": "27C377DE90E111E8B3B474D435EEBE90", "kind": "pozitiv", "description": "Pohled na část jižního průčelí Staroměstské radnice s portálem a s orlojem (dům čp. 1 na Starém Městě) na Staroměstském náměstí.", "date_label": "24.3.1910", "start_date": "1910-03-24", "end_date": "1910-03-24", "author": "Kříženecký, Jan (1868-1921)", "note": "", "views": "37x", "geolocation_type": "regional.address"}}, {"type": "Feature", "geometry": {"type": "Point", "coordinates": [14.40696, 50.09058]}, "properties": {"id": "28AEDA4A5A5A11E7A69B406186009F3A", "kind": "pohlednice", "description": "Celkový pohled na Fürstenberský palác (dům čp. 153) ve Valdštejnské ulici na Malé Straně. V pozadí Pražský hrad.", "date_label": "", "start_date": "", "end_date": "", "author": "Vojta, Tomáš (1885-1934)", "note": "Autorství T. Vojty není jisté.", "views": "39x", "geolocation_type": "regional.address"}}, {"type": "Feature", "geometry": {"type": "Point", "coordinates": [14.40131, 50.08733]}, "properties": {"id": "28F5B2D87D2011E3BE26406186009F3A", "kind": "pozitiv", "description": "Podkrovní interiér v Schönbornském paláci - domě čp. 365 na Malé Straně.", "date_label": "červen 1931", "start_date": "1931-06-01", "end_date": "1931-06-30", "author": "Vojta, Tomáš (1885-1934)", "note": "", "views": "21x", "geolocation_type": "regional.address"}}, {"type": "Feature", "geometry": {"type": "Point", "coordinates": [14.42009, 50.087]}, "properties": {"id": "2930A48990BA11E8B3B474D435EEBE90", "kind": "negativ", "description": "Pohled na vyobrazení měsíců Josefa Mánesa (znamení Štír) na orloji Staroměstské radnice (dům čp. 1 na Starém Městě) na Staroměstském náměstí.", "date_label": "", "start_date": "", "end_date": "", "author": "", "note": "", "views": "23x", "geolocation_type": "regional.address"}}, {"type": "Feature", "geometry": {"type": "Point", "coordinates": [14.4186, 50.0808]}, "properties": {"id": "2A1E54FC923111E2BF28525400E46D25", "kind": "negativ", "description": "Pohled do 1. dvora domu čp. 126 na Novém Městě v Ostrovní ulici - západní kout.", "date_label": "kol.1900", "start_date": "1900-01-01", "end_date": "1900-12-31", "author": "Eckert, Jindřich (1833-1905)", "note": "", "views": "12x", "geolocation_type": "regional.address"}}, {"type": "Feature", "geometry": {"type": "Point", "coordinates": [14.42009, 50.087]}, "properties": {"id": "2A2AC59CD0AB11EABE1F74D435EEBE90", "kind": "pozitiv", "description": "Pohled na nároží Staroměstské radnice s arkýřem a s orlojem na Staroměstském náměstí (dům čp. 1 na Starém Městě).", "date_label": "kol.1885", "start_date": "1885-01-01", "end_date": "1885-12-31", "author": "", "note": "", "views": "30x", "geolocation_type": "regional.address"}}, {"type": "Feature", "geometry": {"type": "Point", "coordinates": [14.51352, 50.08979]}, "properties": {"id": "2A3AE3B02CA811E69BD5406186009F3A", "kind": "negativ", "description": "Pohled na domek vrátného (dům čp. 141 v Malešicích) u hlavního vjezdu do parku tzv. Jiráskovy vily v ulici Pod Táborem.", "date_label": "14.4.1949", "start_date": "1949-04-14", "end_date": "1949-04-14", "author": "Vopravil, Josef (1902-1972)", "note": "", "views": "39x", "geolocation_type": "regional.address"}}, {"type": "Feature", "geometry": {"type": "Point", "coordinates": [14.36315, 50.08638]}, "properties": {"id": "2A543A54B5FF11E58B3BD4BED94BB14D", "kind": "pozitiv", "description": "Průhled na Malé náměstí (Břevnovská ulice) s domem čp. 11 (hostinec U Žáby) a čp. 68 v Břevnově.", "date_label": "1925", "start_date": "1925-01-01", "end_date": "1925-12-31", "author": "Vojta, Tomáš (1885-1934)", "note": "", "views": "44x", "geolocation_type": "regional.address"}}, {"type": "Feature", "geometry": {"type": "Point", "coordinates": [14.42346, 50.08434]}, "properties": {"id": "2A5CC82A7CE411E2BF1A525400E46D25", "kind": "negativ", "description": "Pohled na slavobránu na Václavském náměstí na Můstku s dekorací při příležitosti návštěvy císaře Františka Josefa I. v Praze. Za bránou je prázdné prostranství po zbořeném domě čp. 388, za ním část kostela sv. Havla.", "date_label": "červen 1901", "start_date": "1901-06-01", "end_date": "1901-06-30", "author": "Eckert, Jindřich (1833-1905)", "note": "", "views": "44x", "geolocation_type": "regional.address"}}, {"type": "Feature", "geometry": {"type": "Point", "coordinates": [14.419, 50.07337]}, "properties": {"id": "2A5D9817E44111E4BE0074D435EEBE90", "kind": "pozitiv", "description": "Celkový pohled \"Faustův dům\" (dům čp. 502 na Novém Městě) na Karlově náměstí na Novém Městě.", "date_label": "", "start_date": "", "end_date": "", "author": "Vojta, Tomáš (1885-1934)", "note": "Autorství T. Vojty není jisté.", "views": "70x", "geolocation_type": "regional.address"}}, {"type": "Feature", "geometry": {"type": "Point", "coordinates": [14.4343, 50.09908]}, "properties": {"id": "2A83AF33698411E49A11406186009F3A", "kind": "pozitiv", "description": "Celkový pohled na dům čp. 990 (škola) na nároží Janovského ulice a Strossmayerova náměstí. Vlevo část nároží domu čp. 978, vpravo malá část kostela sv. Antonína v Holešovicích.", "date_label": "31.8.1937", "start_date": "1937-08-31", "end_date": "1937-08-31", "author": "Alexander, Antonín (1892-působnost do 1948)", "note": "", "views": "69x", "geolocation_type": "regional.address"}}, {"type": "Feature", "geometry": {"type": "Point", "coordinates": [14.44123, 50.09021]}, "properties": {"id": "2AB78E08310611E9978874D435EEBE90", "kind": "negativ", "description": "Celkový pohled na hlavní průčelí domu čp. 283 v Karlíně (divadlo) v Palackého ulici (dnes Křižíkova). V pozadí vlevo část viaduktu.", "date_label": "kol.1900", "start_date": "1900-01-01", "end_date": "1900-12-31", "author": "Bellmann-ateliér", "note": "", "views": "69x", "geolocation_type": "regional.address"}}, {"type": "Feature", "geometry": {"type": "Point", "coordinates": [14.43394, 50.08971]}, "properties": {"id": "2AE5FD7A81E411E3B4B96C626D41E503", "kind": "pozitiv", "description": "Pohled do průchodu domu čp. 1047 (U Rozvařilů) na Novém Městě.", "date_label": "1986", "start_date": "1986-01-01", "end_date": "1986-12-31", "author": "Hudeček, Jan", "note": "", "views": "22x", "geolocation_type": "regional.address"}}, {"type": "Feature", "geometry": {"type": "Point", "coordinates": [14.42211, 50.08746]}, "properties": {"id": "2b45b340e7724efaa79016ac6cabc521", "kind": "negativ", "description": "Pohled do bývalého bohnického parku. V pozadí zámeček v Bohnicích (dům čp. 14).", "date_label": "29.3.1909", "start_date": "1909-03-29", "end_date": "1909-03-29", "author": "Almer, Jan, Ing. arch. (1882-1960)", "note": "", "views": "15x", "geolocation_type": "regional.address"}}, {"type": "Feature", "geometry": {"type": "Point", "coordinates": [14.39071, 50.08877]}, "properties": {"id": "2B507090DC5211DFBD60000C766D2371", "kind": "pozitiv", "description": "Reprodukce skicy nástěnné malby (č. 12) v interiéru Černínského paláce (dům čp. 101 na Hradčanech).", "date_label": "1891", "start_date": "1891-01-01", "end_date": "1891-12-31", "author": "Eckert, Jindřich (1833-1905)", "note": "", "views": "26x", "geolocation_type": "regional.address"}}, {"type": "Feature", "geometry": {"type": "Point", "coordinates": [14.39204, 50.13305]}, "properties": {"id": "2B7B3AB3FE3611E483F974D435EEBE90", "kind": "pozitiv", "description": "Pohled na hlavní průčelí zámku v Sedlci - dům čp. 7.", "date_label": "1958", "start_date": "1958-01-01", "end_date": "1958-12-31", "author": "Hnilička, Eduard (1887-1967)", "note": "", "views": "34x", "geolocation_type": "regional.address"}}, {"type": "Feature", "geometry": {"type": "Point", "coordinates": [14.42009, 50.087]}, "properties": {"id": "2BB3D3F590E711E8B3B474D435EEBE90", "kind": "pozitiv", "description": "Pohled na levou dolní část ciferníku orloje Staroměstské radnice při restaurování (dům čp. 1 na Starém Městě) na Staroměstském náměstí.", "date_label": "26.9.1911", "start_date": "1911-09-26", "end_date": "1911-09-26", "author": "", "note": "", "views": "33x", "geolocation_type": "regional.address"}}, {"type": "Feature", "geometry": {"type": "Point", "coordinates": [14.41536, 50.07303]}, "properties": {"id": "2C1E35182DE111E89EFF406186009F3A", "kind": "negativ", "description": "Celkový pohled na náměstí Pod Emauzy s pomníkem \"Praha svým vítězným synům\" a domy čp. 375 (Ministerstvo sociální péče) a čp. 376 (Zemský úřad) na Novém Městě. V pozadí kostel P. Marie Na Slovanech (v Emauzích) a kaple sv. Kosmy a Damiána.", "date_label": "15.4.1936", "start_date": "1936-04-15", "end_date": "1936-04-15", "author": "Alexander, Antonín (1892-působnost do 1948)", "note": "", "views": "67x", "geolocation_type": "regional.address"}}, {"type": "Feature", "geometry": {"type": "Point", "coordinates": [14.43056, 50.07918]}, "properties": {"id": "2C56794CD85511E89C7B74D435EEBE90", "kind": "pozitiv", "description": "Celkový pohled na budovu Národního muzea čp. 1700 na Novém Městě na Václavském náměstí.", "date_label": "1895-1900", "start_date": "1895-01-01", "end_date": "1900-12-31", "author": "", "note": "", "views": "44x", "geolocation_type": "regional.address"}}, {"type": "Feature", "geometry": {"type": "Point", "coordinates": [14.40955, 50.10101]}, "properties": {"id": "2C86067C87CE11E2BF21525400E46D25", "kind": "negativ", "description": "Pohled na dům čp. 286 v ulici Pod Kaštany v Bubenči (vila Hugo Sieburgera).\r\n                    \r\n                \r\n                    \r\n                  .", "date_label": "20.4.1909", "start_date": "1909-04-20", "end_date": "1909-04-20", "author": "Eckert-ateliér", "note": "", "views": "35x", "geolocation_type": "regional.address"}}, {"type": "Feature", "geometry": {"type": "Point", "coordinates": [14.41873, 50.08783]}, "properties": {"id": "2CA4E782808C11E4AAB4406186009F3A", "kind": "pozitiv", "description": "Pohled na různě profilované kameny nalezené ve zdech zbořeného domu čp. 16 na Starém Městě (Andělská kolej) v Mikulášské ulici (dnes náměstí Franze Kafky).", "date_label": "1909", "start_date": "1909-01-01", "end_date": "1909-12-31", "author": "Kříženecký, Jan (1868-1921)", "note": "", "views": "31x", "geolocation_type": "regional.address"}}, {"type": "Feature", "geometry": {"type": "Point", "coordinates": [14.44287, 50.07635]}, "properties": {"id": "2CB1D501DA1A11E9B4EC406186009F3A", "kind": "negativ", "description": "Průhled Slezskou ulicí na Vinohradech s domy čp. (zleva) 1200, 1161 a 920. Vpravo dům čp. 825 na nároží ulic Slezská a Budečská.", "date_label": "", "start_date": "", "end_date": "", "author": "Reach, Zikmund (1859-1935)", "note": "", "views": "78x", "geolocation_type": "regional.address"}}, {"type": "Feature", "geometry": {"type": "Point", "coordinates": [14.41521, 50.09017]}, "properties": {"id": "2DACF914475411E180176C626D41E503", "kind": "pozitiv", "description": "Pohled na schodiště Rudolfina (dům čp. 79 na Starém Městě). V pozadí Pražský hrad.", "date_label": "kol.1900", "start_date": "1900-01-01", "end_date": "1900-12-31", "author": "", "note": "", "views": "30x", "geolocation_type": "regional.address"}}, {"type": "Feature", "geometry": {"type": "Point", "coordinates": [14.40131, 50.08733]}, "properties": {"id": "2E63CACE7D3811E3BE26406186009F3A", "kind": "pozitiv", "description": "Freska salonu v patře zahradního pavilonu Schönbornského paláce - domu čp. 365 na Malé Straně.", "date_label": "červen 1931", "start_date": "1931-06-01", "end_date": "1931-06-30", "author": "Vojta, Tomáš (1885-1934)", "note": "", "views": "20x", "geolocation_type": "regional.address"}}, {"type": "Feature", "geometry": {"type": "Point", "coordinates": [14.41739, 50.08739]}, "properties": {"id": "2e6df3ad15b0468bacd16b9662863a3c", "kind": "negativ", "description": "Celkový pohled na jižní průčelí domu čp. 98 na Starém Městě (původní budova knihovny).", "date_label": "", "start_date": "", "end_date": "", "author": "Reach, Zikmund (1859-1935)", "note": "", "views": "14x", "geolocation_type": "regional.address"}}, {"type": "Feature", "geometry": {"type": "Point", "coordinates": [14.42009, 50.087]}, "properties": {"id": "2EAD9F5D0FEF11E38E586C626D41E503", "kind": "pozitiv", "description": "Pohled na část jižního průčelí Staroměstské radnice (domu čp. 1) - uprostřed okno s nápisem PRAGA CAPUT REGNI.", "date_label": "1911", "start_date": "1911-01-01", "end_date": "1911-12-31", "author": "Bellmann", "note": "", "views": "49x", "geolocation_type": "regional.address"}}, {"type": "Feature", "geometry": {"type": "Point", "coordinates": [14.41783, 50.08711]}, "properties": {"id": "2ed77ddff9104abbbf8bfe6f9faa504c", "kind": "pozitiv", "description": "Pohled na stavbu budovy Magistrátu hlavního města Prahy (dům čp. 2) na Mariánském náměstí na Starém Městě. V pozadí náměstí Franze Kafky.", "date_label": "", "start_date": "", "end_date": "", "author": "", "note": "", "views": "9x", "geolocation_type": "regional.address"}}, {"type": "Feature", "geometry": {"type": "Point", "coordinates": [14.40038, 50.08859]}, "properties": {"id": "2F2BC0445E4111E2A1506C626D41E503", "kind": "pozitiv", "description": "Celkový pohled na hlavní průčelí Thunovského paláce (dům čp. 214) v Nerudově ulici na Malé Straně.", "date_label": "3.9.1907", "start_date": "1907-09-03", "end_date": "1907-09-03", "author": "Klíma, Alois, Ing. (1873-1955)", "note": "", "views": "45x", "geolocation_type": "regional.address"}}, {"type": "Feature", "geometry": {"type": "Point", "coordinates": [14.41833, 50.08448]}, "properties": {"id": "2F50556AECE911DFBD7B000C766D2371", "kind": "pozitiv", "description": "Pohled do Husovy ulice vpravo s domem čp. 352 (\"U Sladkých\") na Starém Městě v zimě. V popředí nárožní patník.", "date_label": "kol.1938", "start_date": "1938-01-01", "end_date": "1938-12-31", "author": "", "note": "", "views": "18x", "geolocation_type": "regional.address"}}, {"type": "Feature", "geometry": {"type": "Point", "coordinates": [14.42732, 50.08641]}, "properties": {"id": "2F5C9CE281A311E2BF1C525400E46D25", "kind": "negativ", "description": "Pohled do zahrady domu čp. 859 na Novém Městě (Německý dům - kasino, Slovanský dům) v ulici Na Příkopě (restaurace).", "date_label": "kol.1893", "start_date": "1893-01-01", "end_date": "1893-12-31", "author": "Eckert, Jindřich (1833-1905)", "note": "", "views": "35x", "geolocation_type": "regional.address"}}, {"type": "Feature", "geometry": {"type": "Point", "coordinates": [14.42143, 50.08645]}, "properties": {"id": "2F95C49E1C9611E8804174D435EEBE90", "kind": "pozitiv", "description": "Pohled na domy (zleva) čp. 483, 482, 481, 480 na Starém Městě na Staroměstském náměstí, poškozené za povstání 5. - 8. května 1945.", "date_label": "květen 1945", "start_date": "1945-05-01", "end_date": "1945-05-31", "author": "Sudek, Josef (1896-1976)", "note": "", "views": "10x", "geolocation_type": "regional.address"}}, {"type": "Feature", "geometry": {"type": "Point", "coordinates": [14.4247, 50.08373]}, "properties": {"id": "2FB62264E29811E89F1B74D435EEBE90", "kind": "pozitiv", "description": "Pohled na dům čp. 840 na Václavském náměstí na Novém Městě (U Zlatého beránka) krátce před zbořením.", "date_label": "kol.1910", "start_date": "1910-01-01", "end_date": "1910-12-31", "author": "Štenc", "note": "", "views": "34x", "geolocation_type": "regional.address"}}, {"type": "Feature", "geometry": {"type": "Point", "coordinates": [14.39375, 50.08878]}, "properties": {"id": "2FBBB1B0748A11E4A81F406186009F3A", "kind": "pozitiv", "description": "Pohled do zahrady domu čp. 180 na Hradčanech (bývalý Trautmanndorfský palác) - z půdy domu čp. 102 na Hradčanech \"práce na výkopu válečného vodního bazénu\". V pozadí západní průčelí paláce s kaplí.", "date_label": "5.6.1944", "start_date": "1944-06-05", "end_date": "1944-06-05", "author": "Alexander, Antonín (1892-působnost do 1948)", "note": "", "views": "24x", "geolocation_type": "regional.address"}}, {"type": "Feature", "geometry": {"type": "Point", "coordinates": [14.42666, 50.0873]}, "properties": {"id": "301B57C4A40511EA9836406186009F3A", "kind": "negativ", "description": "Pohled na horní část průčelí domu čp. 585 v Celetné ulici na Starém Městě.", "date_label": "12.9.1907", "start_date": "1907-09-12", "end_date": "1907-09-12", "author": "Klíma, Alois, Ing. (1873-1955)", "note": "", "views": "16x", "geolocation_type": "regional.address"}}, {"type": "Feature", "geometry": {"type": "Point", "coordinates": [14.40739, 50.08615]}, "properties": {"id": "30A4F0E805B811E389696C626D41E503", "kind": "pozitiv", "description": "Pohled do dvora domu čp. 490 (palác Metychů z Čečova - Hrzánský) na Velkopřevorském náměstí na Malé Straně s pavlačemi.", "date_label": "1925", "start_date": "1925-01-01", "end_date": "1925-12-31", "author": "Vojta, Tomáš (1885-1934)", "note": "", "views": "35x", "geolocation_type": "regional.address"}}, {"type": "Feature", "geometry": {"type": "Point", "coordinates": [14.40131, 50.08733]}, "properties": {"id": "31768E0D7D3A11E3BE26406186009F3A", "kind": "pozitiv", "description": "Kout západního dvora se západním vjezdem Schönbornského paláce - domu čp. 365 na Malé Straně.", "date_label": "", "start_date": "", "end_date": "", "author": "", "note": "", "views": "20x", "geolocation_type": "regional.address"}}, {"type": "Feature", "geometry": {"type": "Point", "coordinates": [14.41907, 50.06375]}, "properties": {"id": "319B03693F8311E2A1026C626D41E503", "kind": "pozitiv", "description": "Pohled na archeologické vykopávky na Vyšehradě - zbytky baziliky sv. Vavřince při domě čp. 14 (staré děkanství) v Soběslavově ulici - ve východním prostoru sklepních místností - západní stěna z části románského oblouku vedoucího původně do severní lodi baziliky.", "date_label": "15.9.1936", "start_date": "1936-09-15", "end_date": "1936-09-15", "author": "Alexander, Antonín (1892-působnost do 1948)", "note": "", "views": "55x", "geolocation_type": "regional.address"}}, {"type": "Feature", "geometry": {"type": "Point", "coordinates": [14.43056, 50.07918]}, "properties": {"id": "32818A1DD85611E89C7B74D435EEBE90", "kind": "pozitiv", "description": "Průhled Václavským náměstím od Můstku. V pozadí Národní muzeum (dům čp. 1700 na Novém Městě). Vlevo domy východní strany náměstí.", "date_label": "1901-1902", "start_date": "1901-01-01", "end_date": "1902-12-31", "author": "Bellmann-ateliér", "note": "", "views": "58x", "geolocation_type": "regional.address"}}, {"type": "Feature", "geometry": {"type": "Point", "coordinates": [14.42867, 50.08705]}, "properties": {"id": "32A260CC9B8411E2BF2D525400E46D25", "kind": "pozitiv", "description": "Celkový pohled na dům čp. 864 na Novém Městě (hotel Modrá hvězda).", "date_label": "1890", "start_date": "1890-01-01", "end_date": "1890-12-31", "author": "", "note": "", "views": "38x", "geolocation_type": "regional.address"}}, {"type": "Feature", "geometry": {"type": "Point", "coordinates": [14.42607, 50.08277]}, "properties": {"id": "32A7926BA6C311E8B44374D435EEBE90", "kind": "negativ", "description": "Celkový pohled na průčelí domu čp. 832 na Václavském náměstí na Novém Městě.", "date_label": "", "start_date": "", "end_date": "", "author": "", "note": "Kříženecký, Rudolf (?) (repro)", "views": "25x", "geolocation_type": "regional.address"}}, {"type": "Feature", "geometry": {"type": "Point", "coordinates": [14.42096, 50.08461]}, "properties": {"id": "32BA4C17156511E39CC26C626D41E503", "kind": "pozitiv", "description": "Pohled do uličky V Kotcích směrem k Uhelnému trhu. Zprava domy čp. 519 (část), 521 (hostinec), 522, 525, 526 na Starém Městě.", "date_label": "", "start_date": "", "end_date": "", "author": "Bellmann", "note": "", "views": "46x", "geolocation_type": "regional.address"}}, {"type": "Feature", "geometry": {"type": "Point", "coordinates": [14.42009, 50.087]}, "properties": {"id": "33092F8D90EC11E8B3B474D435EEBE90", "kind": "pozitiv", "description": "Socha Hvězdáře a archanděla Michaela z orloje v jižním průčelí Staroměstské radnice (dům čp. 1 na Starém Městě) na Staroměstském náměstí po restaurování.", "date_label": "18.12.1911", "start_date": "1911-12-18", "end_date": "1911-12-18", "author": "Kříženecký, Jan (1868-1921)", "note": "", "views": "39x", "geolocation_type": "regional.address"}}, {"type": "Feature", "geometry": {"type": "Point", "coordinates": [14.4049, 50.08346]}, "properties": {"id": "333FB50C324D11E6A7DA74D435EEBE90", "kind": "negativ", "description": "Pohled na část dvorního průčelí Michnova paláce (dům čp. 450 na Malé Straně - \"Zbrojnice jízdy\", Tyršův dům).", "date_label": "20.6.1911", "start_date": "1911-06-20", "end_date": "1911-06-20", "author": "Eckert-ateliér", "note": "", "views": "40x", "geolocation_type": "regional.address"}}, {"type": "Feature", "geometry": {"type": "Point", "coordinates": [14.41873, 50.08783]}, "properties": {"id": "342110F3808C11E4AAB4406186009F3A", "kind": "pozitiv", "description": "Pohled na trámy zbořeného domu čp. 16 na Starém Městě (Andělská kolej) v Mikulášské ulici (dnes náměstí Franze Kafky).", "date_label": "20.2.1909", "start_date": "1909-02-20", "end_date": "1909-02-20", "author": "Kříženecký, Jan (1868-1921)", "note": "", "views": "28x", "geolocation_type": "regional.address"}}, {"type": "Feature", "geometry": {"type": "Point", "coordinates": [14.42009, 50.087]}, "properties": {"id": "3483658E90E511E8B3B474D435EEBE90", "kind": "pozitiv", "description": "Pohled na část jižního průčelí Staroměstské radnice při restaurování orloje (dům čp. 1 na Starém Městě) na Staroměstském náměstí. Detail dolejší části ciferníku a fiály před opravou.", "date_label": "19.9.1911", "start_date": "1911-09-19", "end_date": "1911-09-19", "author": "Kříženecký, Jan (1868-1921)", "note": "", "views": "37x", "geolocation_type": "regional.address"}}, {"type": "Feature", "geometry": {"type": "Point", "coordinates": [14.37935, 50.08823]}, "properties": {"id": "34A3727BBB6611E594BE74D435EEBE90", "kind": "pozitiv", "description": "Pohled na usedlost Malovanku (dům čp. 34 v Břevnově - dnes dům čp. 123 ve Střešovicích) s koloniálem Vladimíra Hájka.", "date_label": "", "start_date": "", "end_date": "", "author": "Dub, Václav (dokumenty 1928-1983)", "note": "", "views": "83x", "geolocation_type": "regional.address"}}, {"type": "Feature", "geometry": {"type": "Point", "coordinates": [14.40234, 50.02347]}, "properties": {"id": "34A99107D19B11E69F29406186009F3A", "kind": "pozitiv", "description": "Celkový pohled na dům čp. 13 v ulici V Náklích v Hodkovičkách", "date_label": "22.8.1959", "start_date": "1959-08-22", "end_date": "1959-08-22", "author": "Hnilička, Eduard (1887-1967)", "note": "", "views": "35x", "geolocation_type": "regional.address"}}, {"type": "Feature", "geometry": {"type": "Point", "coordinates": [14.40328, 50.09504]}, "properties": {"id": "34C5C5D08AFF11E2BF22525400E46D25", "kind": "negativ", "description": "Pohled na hlavní průčelí kadetní školy čp. 221 na Hradčanech na Mariánské baště. V popředí přehlídka kadetů.", "date_label": "po 1900", "start_date": "1901-01-01", "end_date": "2000-12-31", "author": "Eckert, Jindřich (1833-1905)", "note": "", "views": "30x", "geolocation_type": "regional.address"}}, {"type": "Feature", "geometry": {"type": "Point", "coordinates": [14.44357, 50.14932]}, "properties": {"id": "34E5BDFEDD1611E480FB74D435EEBE90", "kind": "pozitiv", "description": "Pohled na statek čp. 15 v Dolních Chabrech ze dvora.", "date_label": "1981", "start_date": "1981-01-01", "end_date": "1981-12-31", "author": "Rameš, František", "note": "", "views": "35x", "geolocation_type": "regional.address"}}, {"type": "Feature", "geometry": {"type": "Point", "coordinates": [14.40643, 50.09055]}, "properties": {"id": "34E61C778E0511E1A9956C626D41E503", "kind": "pozitiv", "description": "Pohled do Valdštejnské ulice s domem čp. 154 (Kolovratský palác) na Malé Straně směrem k východu.", "date_label": "9.7.1933", "start_date": "1933-07-09", "end_date": "1933-07-09", "author": "Alexander, Antonín (1892-působnost do 1948)", "note": "", "views": "23x", "geolocation_type": "regional.address"}}, {"type": "Feature", "geometry": {"type": "Point", "coordinates": [14.44983, 50.01797]}, "properties": {"id": "354590A629F111E9980E74D435EEBE90", "kind": "negativ", "description": "Pohled do dvora statku čp. 101 (Nové Dvory) v ulici U Nového dvora (dnes Durychova) ve Lhotce při bourání jedné z budov.", "date_label": "červen 1953", "start_date": "1953-06-01", "end_date": "1953-06-30", "author": "", "note": "", "views": "39x", "geolocation_type": "regional.address"}}, {"type": "Feature", "geometry": {"type": "Point", "coordinates": [14.41521, 50.09017]}, "properties": {"id": "355B1DF15A6911E7A69B406186009F3A", "kind": "pozitiv", "description": "Pohled na sochu T. G. Masaryka a státní znak v Národním shromáždění v koncertním sále Rudolfina (dům čp. 79 na Starém Městě).", "date_label": "po 1924", "start_date": "1925-01-01", "end_date": "2000-12-31", "author": "Vojta, Tomáš (1885-1934)", "note": "", "views": "41x", "geolocation_type": "regional.address"}}, {"type": "Feature", "geometry": {"type": "Point", "coordinates": [14.4032, 50.08835]}, "properties": {"id": "356283CAD51111E3AADC406186009F3A", "kind": "pozitiv", "description": "Pohled do interiéru domu čp. 2 na Malé Straně - úřadovna vrchního zemského soudu (bývalá jezuitská kolej).", "date_label": "před 1926", "start_date": "1800-01-01", "end_date": "1925-12-31", "author": "Vojta, Tomáš (1885-1934)", "note": "", "views": "32x", "geolocation_type": "regional.address"}}, {"type": "Feature", "geometry": {"type": "Point", "coordinates": [14.39071, 50.08877]}, "properties": {"id": "356F8CF6DC5111DFBD60000C766D2371", "kind": "pozitiv", "description": "Reprodukce skicy nástěnné malby: Černínský palác ? (dům čp. 101 na Hradčanech).", "date_label": "1891", "start_date": "1891-01-01", "end_date": "1891-12-31", "author": "Eckert-ateliér", "note": "", "views": "30x", "geolocation_type": "regional.address"}}, {"type": "Feature", "geometry": {"type": "Point", "coordinates": [14.37685, 50.10006]}, "properties": {"id": "35740B76611511E4B88BD4BED94BB14D", "kind": "pozitiv", "description": "Pohled na usedlost Hadovka (dům čp. 10) v Dejvicích - zadní průčelí.", "date_label": "březen 1959", "start_date": "1959-03-01", "end_date": "1959-03-31", "author": "Hnilička, Eduard (1887-1967)", "note": "", "views": "63x", "geolocation_type": "regional.address"}}, {"type": "Feature", "geometry": {"type": "Point", "coordinates": [14.40204, 50.11]}, "properties": {"id": "35749E32712511E2BF15525400E46D25", "kind": "negativ", "description": "Pohled na kanalizační čistící stanici v Bubenči (dům čp. 199) - stavba lapáku písku.", "date_label": "kol.1900", "start_date": "1900-01-01", "end_date": "1900-12-31", "author": "Eckert, Jindřich (1833-1905)", "note": "", "views": "42x", "geolocation_type": "regional.address"}}, {"type": "Feature", "geometry": {"type": "Point", "coordinates": [14.42678, 50.08486]}, "properties": {"id": "359EE6EC7F8211E88359406186009F3A", "kind": "negativ", "description": "Pohřební průvod legionářů popravených během 1. světové války. V pozadí domy čp. (zprava) 856, 857, 858 a 859 v ulici Na Příkopě na Novém Městě.", "date_label": "24.4.1921", "start_date": "1921-04-24", "end_date": "1921-04-24", "author": "Reach, Zikmund (1859-1935)", "note": "", "views": "40x", "geolocation_type": "regional.address"}}, {"type": "Feature", "geometry": {"type": "Point", "coordinates": [14.38967, 50.08671]}, "properties": {"id": "35A2AD6468A111E8B58B74D435EEBE90", "kind": "pozitiv", "description": "Pohled na vstupní portál Strahovského kláštera od západu. Uprostřed kostel sv. Rocha.", "date_label": "28.9.1907", "start_date": "1907-09-28", "end_date": "1907-09-28", "author": "Klíma, Alois, Ing. (1873-1955)", "note": "", "views": "21x", "geolocation_type": "regional.address"}}, {"type": "Feature", "geometry": {"type": "Point", "coordinates": [14.43681, 50.09865]}, "properties": {"id": "35E085E9E69B11E89E7C74D435EEBE90", "kind": "pozitiv", "description": "Pohled do Antonínské ulice. Vlevo dům čp. 424, vpravo dům čp. 1477 (budova Elektrických podniků hl. m. Prahy) v Holešovicích.", "date_label": "1981", "start_date": "1981-01-01", "end_date": "1981-12-31", "author": "Jelínková, Jana (1951-)", "note": "", "views": "46x", "geolocation_type": "regional.address"}}, {"type": "Feature", "geometry": {"type": "Point", "coordinates": [14.41783, 50.08711]}, "properties": {"id": "35fa1c167d894a419582482973eb3494", "kind": "pozitiv", "description": "Pohled z rozestavěné budovy budovy Magistrátu hlavního města Prahy (dům čp. 2) na Mariánském náměstí na Starém Městě - staroměstské střechy směrem k jihovýchodu.", "date_label": "5.7.1910", "start_date": "1910-07-05", "end_date": "1910-07-05", "author": "", "note": "", "views": "10x", "geolocation_type": "regional.address"}}, {"type": "Feature", "geometry": {"type": "Point", "coordinates": [14.42851, 50.0692]}, "properties": {"id": "366B152A769911E2BF17525400E46D25", "kind": "negativ", "description": "Pohled do zahrady kláštera augustiniánů kanovníků na Karlově (dům čp. 453 na Novém Městě - chorobinec).", "date_label": "kol.1890", "start_date": "1890-01-01", "end_date": "1890-12-31", "author": "Eckert, Jindřich (1833-1905)", "note": "", "views": "34x", "geolocation_type": "regional.address"}}, {"type": "Feature", "geometry": {"type": "Point", "coordinates": [14.44868, 50.10248]}, "properties": {"id": "371A308C8AF511E2BF22525400E46D25", "kind": "negativ", "description": "Pohled do interiéru domu čp. 515 v Holešovicích (Opatrovna a mateřská škola Na Maninách - dnes Tusarova 27) - děti při jídle v \"kruhu pro učedníky v chůzi\".", "date_label": "1901", "start_date": "1901-01-01", "end_date": "1901-12-31", "author": "Eckert, Jindřich (1833-1905)", "note": "", "views": "46x", "geolocation_type": "regional.address"}}, {"type": "Feature", "geometry": {"type": "Point", "coordinates": [14.40204, 50.11]}, "properties": {"id": "379D1DD274F211E2BF16525400E46D25", "kind": "negativ", "description": "Pohled na kanalizační čistící stanici v Bubenči (dům čp. 199).", "date_label": "kol.1900", "start_date": "1900-01-01", "end_date": "1900-12-31", "author": "Eckert, Jindřich (1833-1905)", "note": "", "views": "38x", "geolocation_type": "regional.address"}}, {"type": "Feature", "geometry": {"type": "Point", "coordinates": [14.40739, 50.08615]}, "properties": {"id": "37A0A87105B611E389696C626D41E503", "kind": "pozitiv", "description": "Pohled na dům čp. 490 (palác Metychů z Čečova - Hrzánský) na Malé Straně - jižní a východní průčelí při pohledu ze dvora domu čp. 500 přes Čertovku.", "date_label": "14.3.1931", "start_date": "1931-03-14", "end_date": "1931-03-14", "author": "Alexander, Antonín (1892-působnost do 1948)", "note": "", "views": "32x", "geolocation_type": "regional.address"}}, {"type": "Feature", "geometry": {"type": "Point", "coordinates": [14.42495, 50.07406]}, "properties": {"id": "37D99253A31D11E5B178406186009F3A", "kind": "pohlednice", "description": "Pohled na portál bývalého kláštera sv. Kateřiny (dům čp. 468 na Novém Městě) v Kateřinské ulici se sochou sv. Kateřiny Alexandrijské.", "date_label": "", "start_date": "", "end_date": "", "author": "Reach, Zikmund (1859-1935)", "note": "", "views": "37x", "geolocation_type": "regional.address"}}, {"type": "Feature", "geometry": {"type": "Point", "coordinates": [14.33208, 50.07629]}, "properties": {"id": "37F2CF2DB84211E5AA08D4BED94BB14D", "kind": "pozitiv", "description": "Průhled do Bělohorské ulice s domy (zprava) čp. 169, 168, 167 v Břevnově.", "date_label": "26.7.1943", "start_date": "1943-07-26", "end_date": "1943-07-26", "author": "Alexander, Antonín (1892-působnost do 1948)", "note": "", "views": "43x", "geolocation_type": "regional.address"}}, {"type": "Feature", "geometry": {"type": "Point", "coordinates": [14.42048, 50.07457]}, "properties": {"id": "37F31D3E81A411E2BF1C525400E46D25", "kind": "negativ", "description": "Pohled na hlavní průčelí domu čp. 504 na Karlově náměstí (kolej novoměstských jezuitů - kasárna grenadýrů - vojenská nemocnice) na Novém Městě.", "date_label": "před 1897", "start_date": "1800-01-01", "end_date": "1896-12-31", "author": "Eckert, Jindřich (1833-1905)", "note": "", "views": "55x", "geolocation_type": "regional.address"}}, {"type": "Feature", "geometry": {"type": "Point", "coordinates": [14.41783, 50.08711]}, "properties": {"id": "38134190c47641ae85c38403230a2c1e", "kind": "pozitiv", "description": "Pohled na stavbu budovy Magistrátu hlavního města Prahy (dům čp. 2) na Mariánském náměstí na Starém Městě. V pozadí Klementinum, Platnéřská a Valentinská ulice.", "date_label": "1909-1910", "start_date": "1909-01-01", "end_date": "1910-12-31", "author": "", "note": "", "views": "14x", "geolocation_type": "regional.address"}}, {"type": "Feature", "geometry": {"type": "Point", "coordinates": [14.39755, 50.08984]}, "properties": {"id": "384C7898475F11E180176C626D41E503", "kind": "pozitiv", "description": "Celkový pohled na Arcibiskupský palác na Hradčanském náměstí (dům čp. 56) z I. nádvoří Pražského hradu. V popředí brána se sochami zápasících gigantů.", "date_label": "", "start_date": "", "end_date": "", "author": "Fridrich, František (1829-1892)", "note": "Autorství F. Fridricha není jisté.", "views": "50x", "geolocation_type": "regional.address"}}, {"type": "Feature", "geometry": {"type": "Point", "coordinates": [14.42009, 50.087]}, "properties": {"id": "38A1E5BEF8A211E4808074D435EEBE90", "kind": "negativ", "description": "Pohled na Staroměstské náměstí od Malého náměstí k východu. Zleva domy čp. 4, 3, jižní část Staroměstské radnice s věží, orlojem a portálem (dům čp. 1 na Starém Městě), domy čp. 604, 603, nad nimi kostel P. Marie před Týnem. Vpravo část domu čp. 460 na Starém Městě.", "date_label": "kol.1925", "start_date": "1925-01-01", "end_date": "1925-12-31", "author": "Eckert-ateliér", "note": "", "views": "46x", "geolocation_type": "regional.address"}}, {"type": "Feature", "geometry": {"type": "Point", "coordinates": [14.41969, 50.0787]}, "properties": {"id": "38BB289796CD11E2BF2B525400E46D25", "kind": "negativ", "description": "Celkový pohled na dům čp. 6 ve Spálené ulici na Novém Městě (\"U Slovanské lípy\").", "date_label": "1898-1900", "start_date": "1898-01-01", "end_date": "1900-12-31", "author": "Eckert, Jindřich (1833-1905)", "note": "", "views": "62x", "geolocation_type": "regional.address"}}, {"type": "Feature", "geometry": {"type": "Point", "coordinates": [14.40131, 50.08733]}, "properties": {"id": "38BBCFFE791111E3B7C400110989F46F", "kind": "pozitiv", "description": "Pohled na severní stranu západního dvoru Schönbornského paláce - domu čp. 365 na Malé Straně.", "date_label": "", "start_date": "", "end_date": "", "author": "Vojta, Tomáš (1885-1934)", "note": "Autorství T. Vojty není jisté.", "views": "28x", "geolocation_type": "regional.address"}}, {"type": "Feature", "geometry": {"type": "Point", "coordinates": [14.41139, 50.09203]}, "properties": {"id": "39137186A3F011E1BEEB000C766D2371", "kind": "negativ", "description": "Pohled na stavbu domu čp. 128 na Strakově nábřeží (Strakova akademie) na Malé Straně. V pozadí domy na Klárově, Malá Strana a nad ní Petřín s rozhlednou.", "date_label": "kol.1895", "start_date": "1895-01-01", "end_date": "1895-12-31", "author": "Eckert, Jindřich (1833-1905)", "note": "", "views": "42x", "geolocation_type": "regional.address"}}, {"type": "Feature", "geometry": {"type": "Point", "coordinates": [14.40535, 50.09003]}, "properties": {"id": "3925B7315A6311E7A69B406186009F3A", "kind": "pozitiv", "description": "Pohled do zahrady Valdštejnského paláce (dům čp. 17) na Malé Straně se salou terrenou.", "date_label": "před 1923", "start_date": "1800-01-01", "end_date": "1922-12-31", "author": "", "note": "", "views": "36x", "geolocation_type": "regional.address"}}, {"type": "Feature", "geometry": {"type": "Point", "coordinates": [14.43309, 50.09917]}, "properties": {"id": "3929152876BC11E2BF17525400E46D25", "kind": "negativ", "description": "Celkový pohled na novostavbu pošty (dům čp. 691) na nároží ulic Belcrediho (dnes Milady Horákové) a Bělského v Holešovicích.", "date_label": "kol.1895", "start_date": "1895-01-01", "end_date": "1895-12-31", "author": "Eckert, Jindřich (1833-1905)", "note": "", "views": "90x", "geolocation_type": "regional.address"}}, {"type": "Feature", "geometry": {"type": "Point", "coordinates": [14.42009, 50.087]}, "properties": {"id": "39A3A3A290C311E8B3B474D435EEBE90", "kind": "negativ", "description": "Pohled na část jižního průčelí Staroměstské radnice s orlojem (dům čp. 1 na Starém Městě) na Staroměstském náměstí. V popředí stanice tramvaje č. 5.", "date_label": "", "start_date": "", "end_date": "", "author": "", "note": "", "views": "38x", "geolocation_type": "regional.address"}}, {"type": "Feature", "geometry": {"type": "Point", "coordinates": [14.43056, 50.07918]}, "properties": {"id": "39A9E7CB474211E180176C626D41E503", "kind": "pozitiv", "description": "Průhled Václavským náměstím od Můstku. V pozadí dům čp. 1700 na Novém Městě (Národní muzeum).", "date_label": "1892", "start_date": "1892-01-01", "end_date": "1892-12-31", "author": "Beer, Alois", "note": "", "views": "120x", "geolocation_type": "regional.address"}}, {"type": "Feature", "geometry": {"type": "Point", "coordinates": [14.42767, 50.08708]}, "properties": {"id": "39BEED3B306B11E0B894000BDB040909", "kind": "pozitiv", "description": "Celkový pohled na Prašnou bránu po přestavbě. Vpravo nízké krámky a za nimi kostel sv. Vojtěcha. Vlevo část domu čp. 969 na Starém Městě.", "date_label": "1901", "start_date": "1901-01-01", "end_date": "1901-12-31", "author": "Eckert, Jindřich (1833-1905)", "note": "", "views": "52x", "geolocation_type": "regional.address"}}, {"type": "Feature", "geometry": {"type": "Point", "coordinates": [14.33563, 50.07737]}, "properties": {"id": "39C03AB1B60D11E58B3BD4BED94BB14D", "kind": "pozitiv", "description": "Pohled na dům čp. 214 na Břevnově při Bělohorské ulici - (jižní průčelí od jihozápadu, na bývalé cestě k Malému náměstí).", "date_label": "7.9.1943", "start_date": "1943-09-07", "end_date": "1943-09-07", "author": "Alexander, Antonín (1892-působnost do 1948)", "note": "", "views": "50x", "geolocation_type": "regional.address"}}, {"type": "Feature", "geometry": {"type": "Point", "coordinates": [14.39535, 50.08934]}, "properties": {"id": "3a85e1c968a942e49a38fb5242d24070", "kind": "pozitiv", "description": "Pohled na Hradčanské náměstí k 1. nádvoří Pražského hradu.", "date_label": "1984", "start_date": "1984-01-01", "end_date": "1984-12-31", "author": "Hudeček, Jan", "note": "", "views": "8x", "geolocation_type": "regional.address"}}, {"type": "Feature", "geometry": {"type": "Point", "coordinates": [14.41783, 50.08711]}, "properties": {"id": "3af6f2c4cb4d423090f5a6cbb0b991a2", "kind": "pozitiv", "description": "Pohled na stavbu budovy Magistrátu hlavního města Prahy (dům čp. 2) na Mariánském náměstí na Starém Městě. V pozadí Platnéřská ulice a náměstí Franze Kafky.", "date_label": "1909", "start_date": "1909-01-01", "end_date": "1909-12-31", "author": "", "note": "", "views": "17x", "geolocation_type": "regional.address"}}, {"type": "Feature", "geometry": {"type": "Point", "coordinates": [14.42265, 50.07965]}, "properties": {"id": "3B23D6ABE28B11E89F1B74D435EEBE90", "kind": "pozitiv", "description": "Pohled na bourání (Braunova) domu čp. 730 na nároží Vodičkovy a Jungmannovy ulice na Novém Městě.", "date_label": "23.9.1911", "start_date": "1911-09-23", "end_date": "1911-09-23", "author": "Kříženecký, Jan (1868-1921)", "note": "", "views": "71x", "geolocation_type": "regional.address"}}, {"type": "Feature", "geometry": {"type": "Point", "coordinates": [14.42156, 50.078]}, "properties": {"id": "3B542A867C4511E2BF19525400E46D25", "kind": "negativ", "description": "Pohled do interiéru domu čp. 671 na Karlově náměstí na Novém Městě (Salmovský palác) - salon.", "date_label": "kol.1900", "start_date": "1900-01-01", "end_date": "1900-12-31", "author": "Eckert, Jindřich (1833-1905)", "note": "", "views": "39x", "geolocation_type": "regional.address"}}, {"type": "Feature", "geometry": {"type": "Point", "coordinates": [14.39535, 50.08934]}, "properties": {"id": "3b57f1e66562451b9315849ff080bf5a", "kind": "pozitiv", "description": "Pohled na Hradčanské náměstí s Arcibiskupským palácem (dům čp. 56) na Hradčanech a Pražským hradem. V pozadí věže chrámu sv. Víta.", "date_label": "1984", "start_date": "1984-01-01", "end_date": "1984-12-31", "author": "Hudeček, Jan", "note": "", "views": "16x", "geolocation_type": "regional.address"}}, {"type": "Feature", "geometry": {"type": "Point", "coordinates": [14.42009, 50.087]}, "properties": {"id": "3B734A1B90BD11E8B3B474D435EEBE90", "kind": "negativ", "description": "Pohled na orloj Staroměstské radnice (dům čp. 1 na Starém Městě) na Staroměstském náměstí. V popředí stanice tramvaje č. 5.", "date_label": "", "start_date": "", "end_date": "", "author": "Reach, Zikmund (1859-1935)", "note": "", "views": "42x", "geolocation_type": "regional.address"}}, {"type": "Feature", "geometry": {"type": "Point", "coordinates": [14.50776, 50.11328]}, "properties": {"id": "3BA71675725211E0801F0010DCCFBEC5", "kind": "pozitiv", "description": "Pohled do dvora domu čp. 56 ve Vysočanech (bývalý cukrovar).", "date_label": "7.6.1928", "start_date": "1928-06-07", "end_date": "1928-06-07", "author": "Alexander, Antonín (1892-působnost do 1948)", "note": "", "views": "67x", "geolocation_type": "regional.address"}}, {"type": "Feature", "geometry": {"type": "Point", "coordinates": [14.42009, 50.087]}, "properties": {"id": "3BB4BE110D7F11E8874D74D435EEBE90", "kind": "pozitiv", "description": "Celkový pohled na východní průčelí Staroměstské radnice s věží a arkýřem (dům čp. 1 na Starém Městě). V popředí pod balkonem vojenská strážnice. Vlevo jižní průčelí radnice.", "date_label": "kol.1870", "start_date": "1870-01-01", "end_date": "1870-12-31", "author": "Fridrich, František (1829-1892)", "note": "", "views": "46x", "geolocation_type": "regional.address"}}, {"type": "Feature", "geometry": {"type": "Point", "coordinates": [14.40131, 50.08733]}, "properties": {"id": "3BC8BF2279E211E3B274406186009F3A", "kind": "pozitiv", "description": "Pohled na vrcholně barokní štukovou výzdobu stropu Schönbornského paláce - domu čp. 365 na Malé Straně - detail.", "date_label": "červen 1931", "start_date": "1931-06-01", "end_date": "1931-06-30", "author": "Vojta, Tomáš (1885-1934)", "note": "", "views": "20x", "geolocation_type": "regional.address"}}, {"type": "Feature", "geometry": {"type": "Point", "coordinates": [14.68942, 49.99028]}, "properties": {"id": "3BF4232F8AFE11E2BF22525400E46D25", "kind": "negativ", "description": "Pohled do interiéru vychovatelny manželů Olivových v Říčanech (dnes Olivova dětská léčebna) - ložnice.", "date_label": "kol.1900", "start_date": "1900-01-01", "end_date": "1900-12-31", "author": "Eckert, Jindřich (1833-1905)", "note": "", "views": "18x", "geolocation_type": "regional.address"}}, {"type": "Feature", "geometry": {"type": "Point", "coordinates": [14.42442, 50.0871]}, "properties": {"id": "3C31FD77157511E39CC26C626D41E503", "kind": "pozitiv", "description": "Pohled na spodní část průčelí domu čp. 563 na Ovocném trhu na Starém Městě.", "date_label": "25.4.1936", "start_date": "1936-04-25", "end_date": "1936-04-25", "author": "Alexander, Antonín (1892-působnost do 1948)", "note": "", "views": "38x", "geolocation_type": "regional.address"}}, {"type": "Feature", "geometry": {"type": "Point", "coordinates": [14.39535, 50.08934]}, "properties": {"id": "3c65cb962ef940b3b1c5d26f284fdb7b", "kind": "pozitiv", "description": "Pohled na Hradčanské náměstí s Arcibiskupským palácem (dům čp. 56) na Hradčanech a Pražským hradem. V pozadí věže chrámu sv. Víta.", "date_label": "", "start_date": "", "end_date": "", "author": "Gotsche", "note": "", "views": "10x", "geolocation_type": "regional.address"}}, {"type": "Feature", "geometry": {"type": "Point", "coordinates": [14.42156, 50.078]}, "properties": {"id": "3C8204D27C4411E2BF19525400E46D25", "kind": "negativ", "description": "Pohled do interiéru domu čp. 671 na Karlově náměstí na Novém Městě (Salmovský palác) - ložnice.", "date_label": "kol.1900", "start_date": "1900-01-01", "end_date": "1900-12-31", "author": "Eckert, Jindřich (1833-1905)", "note": "", "views": "36x", "geolocation_type": "regional.address"}}, {"type": "Feature", "geometry": {"type": "Point", "coordinates": [14.41406, 50.08641]}, "properties": {"id": "3C9DEC0117D511E891E8406186009F3A", "kind": "pozitiv", "description": "Pohled na osvětlenou Staroměstskou mosteckou věž při příležitosti 10. výročí samostatnosti Československé republiky. Vlevo klášter Křižovníků (dům čp. 191 na Starém Městě).", "date_label": "28.10.1928", "start_date": "1928-10-28", "end_date": "1928-10-28", "author": "Vopravil, Josef (1902-1972)", "note": "", "views": "46x", "geolocation_type": "regional.address"}}, {"type": "Feature", "geometry": {"type": "Point", "coordinates": [14.41865, 50.08693]}, "properties": {"id": "3D05BEA44D9611E1AE2C6C626D41E503", "kind": "pozitiv", "description": "Nálezy lidských koster ve výkopech na staveništi budovy Magistrátu hlavního města Prahy (dům čp. 2) na Mariánském náměstí. V pozadí dům čp. 136 na Starém Městě.", "date_label": "18.12.1908", "start_date": "1908-12-18", "end_date": "1908-12-18", "author": "Kříženecký, Jan (1868-1921)", "note": "", "views": "41x", "geolocation_type": "regional.address"}}, {"type": "Feature", "geometry": {"type": "Point", "coordinates": [14.44123, 50.09021]}, "properties": {"id": "3D616D21160111E390486C626D41E503", "kind": "pozitiv", "description": "Celkový pohled na hlavní průčelí domu čp. 283 v Karlíně (divadlo) v Palackého ulici (dnes Křižíkova). V pozadí vlevo část viaduktu.", "date_label": "kol.1900", "start_date": "1900-01-01", "end_date": "1900-12-31", "author": "Bellmann-ateliér", "note": "", "views": "110x", "geolocation_type": "regional.address"}}, {"type": "Feature", "geometry": {"type": "Point", "coordinates": [14.41783, 50.08711]}, "properties": {"id": "3d8365d5afef49ab9b16fba8a45cb78f", "kind": "pozitiv", "description": "Pohled na stavbu budovy Magistrátu hlavního města Prahy (dům čp. 2) na Mariánském náměstí na Starém Městě. V pozadí náměstí Franze Kafky.", "date_label": "1909", "start_date": "1909-01-01", "end_date": "1909-12-31", "author": "", "note": "", "views": "11x", "geolocation_type": "regional.address"}}, {"type": "Feature", "geometry": {"type": "Point", "coordinates": [14.37892, 50.08492]}, "properties": {"id": "3DAD9E85BAD111E5A77074D435EEBE90", "kind": "pozitiv", "description": "Pohled přes pole do ulice Za Strahovem s domem čp. 274 v Břevnově (restaurace Královka).", "date_label": "", "start_date": "", "end_date": "", "author": "Dub, Václav (dokumenty 1928-1983)", "note": "", "views": "47x", "geolocation_type": "regional.address"}}, {"type": "Feature", "geometry": {"type": "Point", "coordinates": [14.39803, 50.08729]}, "properties": {"id": "3DB7574F8C9E11E2BF24525400E46D25", "kind": "negativ", "description": "Pohled do interiéru Lobkovického paláce čp. 347 (Černínský-Přehořovský palác) na Malé Straně - salon.", "date_label": "27.4.1909", "start_date": "1909-04-27", "end_date": "1909-04-27", "author": "Eckert-ateliér", "note": "", "views": "17x", "geolocation_type": "regional.address"}}, {"type": "Feature", "geometry": {"type": "Point", "coordinates": [14.44042, 50.0743]}, "properties": {"id": "3DD72F391C9211E8804174D435EEBE90", "kind": "pozitiv", "description": "Pohled na vinohradskou synagogu (dům čp. 830) v Sázavské ulici - poničenou náletem spojenců 14. února 1945.", "date_label": "1945", "start_date": "1945-01-01", "end_date": "1945-12-31", "author": "Sudek, Josef (1896-1976)", "note": "", "views": "77x", "geolocation_type": "regional.address"}}, {"type": "Feature", "geometry": {"type": "Point", "coordinates": [14.42009, 50.087]}, "properties": {"id": "3E21315D0FEE11E38E586C626D41E503", "kind": "pozitiv", "description": "Pohled na část jižního průčelí Staroměstské radnice (domu čp. 1) - uprostřed okno s nápisem PRAGA CAPUT REGNI.", "date_label": "1911", "start_date": "1911-01-01", "end_date": "1911-12-31", "author": "Bellmann-ateliér", "note": "", "views": "47x", "geolocation_type": "regional.address"}}, {"type": "Feature", "geometry": {"type": "Point", "coordinates": [14.42772, 50.08394]}, "properties": {"id": "3F072814E29B11E89F1B74D435EEBE90", "kind": "pozitiv", "description": "Pohled na dům čp. 897 (U Rajtknechtů) na nároží ulic Jindřišské a Panské - průčelí do Jindřišské krátce před zbořením. Vlevo dům čp. 898 na Novém Městě.", "date_label": "18.5.1907", "start_date": "1907-05-18", "end_date": "1907-05-18", "author": "", "note": "", "views": "47x", "geolocation_type": "regional.address"}}, {"type": "Feature", "geometry": {"type": "Point", "coordinates": [14.39071, 50.08877]}, "properties": {"id": "3F1F63EB8AFC11E2BF22525400E46D25", "kind": "negativ", "description": "Pohled do zahrady domu čp. 111 (sirotčinec arcivévodkyně Gisely) na Pohořelci na Hradčanech - hřiště chlapců. V pozadí zadní trakt domu čp. 101 na Hradčanech (Černínský palác).", "date_label": "kol.1890", "start_date": "1890-01-01", "end_date": "1890-12-31", "author": "Eckert, Jindřich (1833-1905)", "note": "", "views": "44x", "geolocation_type": "regional.address"}}, {"type": "Feature", "geometry": {"type": "Point", "coordinates": [14.36765, 50.08391]}, "properties": {"id": "3FB00402B61911E58B3BD4BED94BB14D", "kind": "pozitiv", "description": "Pohled do dvora domu čp. 233 v Břevnově (keramická dílna Václava Klause) k jihu.", "date_label": "28.8.1936", "start_date": "1936-08-28", "end_date": "1936-08-28", "author": "Alexander, Antonín (1892-působnost do 1948)", "note": "", "views": "45x", "geolocation_type": "regional.address"}}, {"type": "Feature", "geometry": {"type": "Point", "coordinates": [14.40739, 50.08615]}, "properties": {"id": "40043E8804F611E3A4F66C626D41E503", "kind": "pozitiv", "description": "Pohled na dům čp. 490 (palác Metychů z Čečova - Hrzánský) na Velkopřevorském náměstí na Malé Straně.", "date_label": "", "start_date": "", "end_date": "", "author": "Bellmann", "note": "", "views": "41x", "geolocation_type": "regional.address"}}, {"type": "Feature", "geometry": {"type": "Point", "coordinates": [14.40535, 50.09003]}, "properties": {"id": "401C973D96CE11E2BF2B525400E46D25", "kind": "negativ", "description": "Pohled do interiéru Valdštejnského paláce (dům čp. 17 na Malé Straně) - salon.", "date_label": "1920", "start_date": "1920-01-01", "end_date": "1920-12-31", "author": "Eckert-ateliér", "note": "", "views": "18x", "geolocation_type": "regional.address"}}, {"type": "Feature", "geometry": {"type": "Point", "coordinates": [14.4051, 50.08666]}, "properties": {"id": "4046F80B157211E39CC26C626D41E503", "kind": "pozitiv", "description": "Pohled na severní stranu Maltézského náměstí s domem čp. 292 (Zelený křížek) na Malé Straně. Vlevo sousoší sv. Jana Křtitele.", "date_label": "14.9.1930", "start_date": "1930-09-14", "end_date": "1930-09-14", "author": "Alexander, Antonín (1892-působnost do 1948)", "note": "", "views": "21x", "geolocation_type": "regional.address"}}, {"type": "Feature", "geometry": {"type": "Point", "coordinates": [14.37685, 50.10006]}, "properties": {"id": "407956F6611411E4B88BD4BED94BB14D", "kind": "pozitiv", "description": "Pohled na usedlost Hadovka (dům čp. 10) v Dejvicích z Veleslavínovy ulice (Žukovova, dnes Evropská).", "date_label": "24.4.1930", "start_date": "1930-04-24", "end_date": "1930-04-24", "author": "Alexander, Antonín (1892-působnost do 1948)", "note": "", "views": "90x", "geolocation_type": "regional.address"}}, {"type": "Feature", "geometry": {"type": "Point", "coordinates": [14.36765, 50.08391]}, "properties": {"id": "40859469B61A11E58B3BD4BED94BB14D", "kind": "pozitiv", "description": "Pohled do dvora domu čp. 233 v Břevnově (keramická dílna Václava Klause) k severu.", "date_label": "28.8.1936", "start_date": "1936-08-28", "end_date": "1936-08-28", "author": "Alexander, Antonín (1892-působnost do 1948)", "note": "", "views": "44x", "geolocation_type": "regional.address"}}, {"type": "Feature", "geometry": {"type": "Point", "coordinates": [14.42263, 50.08811]}, "properties": {"id": "40FB7ECDE4DE11E4A5F6406186009F3A", "kind": "pozitiv", "description": "Pohled na průčelí domu čp. 628 na Starém Městě (\"Škrétův dům\"), vlevo dům čp. 629 v Týnské uličce.", "date_label": "před 1898", "start_date": "1800-01-01", "end_date": "1897-12-31", "author": "", "note": "", "views": "39x", "geolocation_type": "regional.address"}}, {"type": "Feature", "geometry": {"type": "Point", "coordinates": [14.41769, 50.08403]}, "properties": {"id": "411D2F3BECE811DFBD7B000C766D2371", "kind": "pozitiv", "description": "Pohled z Betlémského náměstí k východu. V pozadí dům čp. 352, vpravo část domu čp. 1004 na Starém Městě.", "date_label": "1969", "start_date": "1969-01-01", "end_date": "1969-12-31", "author": "Vopravil, Josef (1902-1972)", "note": "", "views": "50x", "geolocation_type": "regional.address"}}, {"type": "Feature", "geometry": {"type": "Point", "coordinates": [14.43358, 50.09236]}, "properties": {"id": "416BB10390AB11E2BF26525400E46D25", "kind": "negativ", "description": "Pohled na novoměstské nábřeží při stavbě. Vlevo Helmovské mlýny, uprostřed Dolní Lodecké mlýny a v pozadí nad nimi dům čp. 1216 (Špačkův) vedle věže zvonice kostela sv. Petra na Novém Městě.", "date_label": "28.5.1908", "start_date": "1908-05-28", "end_date": "1908-05-28", "author": "Eckert-ateliér", "note": "", "views": "28x", "geolocation_type": "regional.address"}}, {"type": "Feature", "geometry": {"type": "Point", "coordinates": [14.42143, 50.08701]}, "properties": {"id": "4180838965C311E98115406186009F3A", "kind": "negativ", "description": "Pohled na jižní stranu Staroměstského náměstí s domy čp. (zprava) 548, 549, 550, 551, 552 (tzv. Štorchův) a 553. V popředí mariánský sloup.", "date_label": "1896", "start_date": "1896-01-01", "end_date": "1896-12-31", "author": "", "note": "", "views": "44x", "geolocation_type": "regional.address"}}, {"type": "Feature", "geometry": {"type": "Point", "coordinates": [14.41631, 50.08993]}, "properties": {"id": "419E80D15A6D11E7A69B406186009F3A", "kind": "pozitiv", "description": "Celkový pohled na Rudolfinum (dům čp. 79 na Starém Městě) směrem od domu čp. 71 na nároží ulice Křižovnická a Kaprova.", "date_label": "kol. 1910", "start_date": "", "end_date": "", "author": "Bellmann-ateliér", "note": "", "views": "99x", "geolocation_type": "regional.address"}}, {"type": "Feature", "geometry": {"type": "Point", "coordinates": [14.41631, 50.08993]}, "properties": {"id": "419E80D25A6D11E7A69B406186009F3A", "kind": "pozitiv", "description": "Celkový pohled na Rudolfinum (dům čp. 79 na Starém Městě) z druhého břehu Vltavy pod Letnou.", "date_label": "kol.1905", "start_date": "1905-01-01", "end_date": "1905-12-31", "author": "Bellmann-ateliér", "note": "", "views": "67x", "geolocation_type": "regional.address"}}, {"type": "Feature", "geometry": {"type": "Point", "coordinates": [14.40444, 50.08544]}, "properties": {"id": "41A7628C8D6711E2BF25525400E46D25", "kind": "negativ", "description": "Pohled do interiéru domu čp. 386 na Malé Straně (Rohanský palác) - sál s exponáty při výstavě parohů.", "date_label": "1893", "start_date": "1893-01-01", "end_date": "1893-12-31", "author": "Eckert, Jindřich (1833-1905)", "note": "", "views": "34x", "geolocation_type": "regional.address"}}, {"type": "Feature", "geometry": {"type": "Point", "coordinates": [14.39375, 50.08878]}, "properties": {"id": "41FE1C2A748711E4A81F406186009F3A", "kind": "pozitiv", "description": "Pohled do zahrady domu čp. 180 na Hradčanech (bývalý Trautmannsdorfský palác) - \"práce na výkopu válečného vodního bazénu\". Objevená opuková zeď vedoucí ke kapličce při Loretánské ulici.", "date_label": "5.6.1944", "start_date": "1944-06-05", "end_date": "1944-06-05", "author": "Alexander, Antonín (1892-působnost do 1948)", "note": "", "views": "40x", "geolocation_type": "regional.address"}}, {"type": "Feature", "geometry": {"type": "Point", "coordinates": [14.42009, 50.087]}, "properties": {"id": "4217050290C211E8B3B474D435EEBE90", "kind": "negativ", "description": "Pohled na část jižního průčelí Staroměstské radnice s portálem a s orlojem (dům čp. 1 na Starém Městě) na Staroměstském náměstí.", "date_label": "", "start_date": "", "end_date": "", "author": "", "note": "", "views": "26x", "geolocation_type": "regional.address"}}, {"type": "Feature", "geometry": {"type": "Point", "coordinates": [14.4186, 50.0808]}, "properties": {"id": "423EEBEC819D11E2BF1C525400E46D25", "kind": "negativ", "description": "Pohled do dvora domu čp. 126 na Novém Městě v Ostrovní ulici - jihovýchodní roh 1. dvora.", "date_label": "kol.1900", "start_date": "1900-01-01", "end_date": "1900-12-31", "author": "Eckert, Jindřich (1833-1905)", "note": "", "views": "15x", "geolocation_type": "regional.address"}}, {"type": "Feature", "geometry": {"type": "Point", "coordinates": [14.40131, 50.08733]}, "properties": {"id": "42516D0379F911E3B274406186009F3A", "kind": "pozitiv", "description": "Interiér ložnice v druhém patře Schönbornského paláce - domu čp. 365 na Malé Straně - pohled ke kamnům.", "date_label": "červen 1931", "start_date": "1931-06-01", "end_date": "1931-06-30", "author": "Vojta, Tomáš (1885-1934)", "note": "", "views": "24x", "geolocation_type": "regional.address"}}, {"type": "Feature", "geometry": {"type": "Point", "coordinates": [14.40131, 50.08733]}, "properties": {"id": "4263AAD17D0711E3BE26406186009F3A", "kind": "pozitiv", "description": "Interiér horního patra v Schönbornském paláci - domě čp. 365 na Malé Straně.", "date_label": "červen 1931", "start_date": "1931-06-01", "end_date": "1931-06-30", "author": "Vojta, Tomáš (1885-1934)", "note": "", "views": "22x", "geolocation_type": "regional.address"}}, {"type": "Feature", "geometry": {"type": "Point", "coordinates": [14.404, 50.08785]}, "properties": {"id": "4279e2b62c4845cd8f4674ce20c46519", "kind": "negativ", "description": "Pohled na Mariánský morový sloup na Hradčanském náměstí", "date_label": "", "start_date": "", "end_date": "", "author": "Reach, Zikmund (1859-1935)", "note": "Autorství Z. Reacha není jisté.", "views": "26x", "geolocation_type": "regional.address"}}, {"type": "Feature", "geometry": {"type": "Point", "coordinates": [14.42141, 50.09278]}, "properties": {"id": "42904A95156811E39CC26C626D41E503", "kind": "pozitiv", "description": "Průhled Kozí ulicí s domy čp. 854, čp. 853 (U Dvou divých) a čp. 847 (zleva) na Starém Městě.", "date_label": "1923", "start_date": "1923-01-01", "end_date": "1923-12-31", "author": "Fink, František (1854-1935)", "note": "", "views": "78x", "geolocation_type": "regional.address"}}, {"type": "Feature", "geometry": {"type": "Point", "coordinates": [14.39375, 50.08878]}, "properties": {"id": "4292489A748811E4A81F406186009F3A", "kind": "pozitiv", "description": "Pohled do zahrady domu čp. 180 na Hradčanech (bývalý Trautmannsdorfský palác) - \"práce na výkopu válečného vodního bazénu\". V pozadí část západního průčelí domu čp. 180, altán a vchod do velké zahrady.", "date_label": "5.6.1944", "start_date": "1944-06-05", "end_date": "1944-06-05", "author": "Alexander, Antonín (1892-působnost do 1948)", "note": "", "views": "23x", "geolocation_type": "regional.address"}}, {"type": "Feature", "geometry": {"type": "Point", "coordinates": [14.44531, 50.09841]}, "properties": {"id": "42C866D5921911E2BF28525400E46D25", "kind": "negativ", "description": "Celkový pohled na areál pražských Ústředních jatek v Holešovicích (dům čp. 306) - od jihozápadu. V popředí železniční vagony na kolejích vedoucích do jatek.", "date_label": "1895", "start_date": "1895-01-01", "end_date": "1895-12-31", "author": "Eckert, Jindřich (1833-1905)", "note": "", "views": "68x", "geolocation_type": "regional.address"}}, {"type": "Feature", "geometry": {"type": "Point", "coordinates": [14.42009, 50.087]}, "properties": {"id": "4382F42890B711E8B3B474D435EEBE90", "kind": "negativ", "description": "Pohled na vyobrazení měsíců Josefa Mánesa (znamení Kozoroh) na orloji Staroměstské radnice (dům čp. 1 na Starém Městě) na Staroměstském náměstí.", "date_label": "", "start_date": "", "end_date": "", "author": "", "note": "", "views": "27x", "geolocation_type": "regional.address"}}, {"type": "Feature", "geometry": {"type": "Point", "coordinates": [14.419, 50.07337]}, "properties": {"id": "439B6087E44311E4BE0074D435EEBE90", "kind": "pozitiv", "description": "Pohled na část průčelí \"Faustova domu\" (dům čp. 502 na Novém Městě) do Vyšehradské ulice - poškozeném po náletu spojenců v únoru 1945. V popředí zničená zahradní zeď kostela sv. Jana Na Skalce při odklízení sutin.", "date_label": "únor 1945", "start_date": "1945-02-01", "end_date": "1945-02-28", "author": "", "note": "", "views": "63x", "geolocation_type": "regional.address"}}, {"type": "Feature", "geometry": {"type": "Point", "coordinates": [14.39755, 50.08984]}, "properties": {"id": "43B882C085B311E2BF1F525400E46D25", "kind": "negativ", "description": "Pohled do interiéru Arcibiskupského paláce (dům čp. 56 na Hradčanech) - kuchyň s kamny.", "date_label": "1891", "start_date": "1891-01-01", "end_date": "1891-12-31", "author": "Eckert, Jindřich (1833-1905)", "note": "", "views": "28x", "geolocation_type": "regional.address"}}, {"type": "Feature", "geometry": {"type": "Point", "coordinates": [14.42825, 50.08762]}, "properties": {"id": "43D7FE6FE84211E4BB7A0024BE7CD9AC", "kind": "pozitiv", "description": "Pohled do interieru Lidové restaurace Obecního domu (dům čp. 1090 na Starém Městě) - výzdoba stěn, suterén.", "date_label": "kol.1920", "start_date": "1920-01-01", "end_date": "1920-12-31", "author": "Štenc", "note": "", "views": "22x", "geolocation_type": "regional.address"}}, {"type": "Feature", "geometry": {"type": "Point", "coordinates": [14.42009, 50.087]}, "properties": {"id": "43E973C990B911E8B3B474D435EEBE90", "kind": "negativ", "description": "Pohled na vyobrazení měsíců Josefa Mánesa (znamení Panna) na orloji Staroměstské radnice (dům čp. 1 na Starém Městě) na Staroměstském náměstí.", "date_label": "", "start_date": "", "end_date": "", "author": "", "note": "", "views": "22x", "geolocation_type": "regional.address"}}, {"type": "Feature", "geometry": {"type": "Point", "coordinates": [14.40597, 50.08626]}, "properties": {"id": "4417B6F8818D11E2BF1C525400E46D25", "kind": "negativ", "description": "Celkový pohled na Velkopřevorský palác na Velkopřevorském náměstí (dům čp. 485) na Malé Straně.", "date_label": "4.5.1902", "start_date": "1902-05-04", "end_date": "1902-05-04", "author": "Eckert, Jindřich (1833-1905)", "note": "", "views": "23x", "geolocation_type": "regional.address"}}, {"type": "Feature", "geometry": {"type": "Point", "coordinates": [14.36526, 50.08915]}, "properties": {"id": "4432DD58B61C11E58B3BD4BED94BB14D", "kind": "pozitiv", "description": "Pohled na domy čp. 205 a čp. 206 v Bělohorské ulici v Břevnově.", "date_label": "28.8.1936", "start_date": "1936-08-28", "end_date": "1936-08-28", "author": "Alexander, Antonín (1892-působnost do 1948)", "note": "", "views": "44x", "geolocation_type": "regional.address"}}, {"type": "Feature", "geometry": {"type": "Point", "coordinates": [14.42001, 50.08383]}, "properties": {"id": "44485C76BC6F11E28FB36C626D41E503", "kind": "negativ", "description": "Pohled na část domu čp. 423 v ulici Skořepka na Starém Městě - výloha knihkupectví a antikvariátu Zikmunda Reacha.", "date_label": "", "start_date": "", "end_date": "", "author": "Reach, Zikmund (1859-1935)", "note": "", "views": "35x", "geolocation_type": "regional.address"}}, {"type": "Feature", "geometry": {"type": "Point", "coordinates": [14.4163, 50.09104]}, "properties": {"id": "4453EACB1C8B11E8804174D435EEBE90", "kind": "pozitiv", "description": "Pohled na dům čp. 78 na Starém Městě na nároží ulic 17. listopadu a Břehové s betonovými obrannými zdmi proti náletům.", "date_label": "1945", "start_date": "1945-01-01", "end_date": "1945-12-31", "author": "Sudek, Josef (1896-1976)", "note": "", "views": "6x", "geolocation_type": "regional.address"}}, {"type": "Feature", "geometry": {"type": "Point", "coordinates": [14.47543, 50.07572]}, "properties": {"id": "4494BA13275211E287E86C626D41E503", "kind": "pohlednice", "description": "Pohled na budovu nemocnice na Vinohradech (dům čp. 1150) - Všeobecná veřejná nemocnice Protektorátu Čechy a Morava na Král. Vinohradech.", "date_label": "1939-1945", "start_date": "1939-01-01", "end_date": "1945-12-31", "author": "", "note": "", "views": "57x", "geolocation_type": "regional.address"}}, {"type": "Feature", "geometry": {"type": "Point", "coordinates": [14.42009, 50.087]}, "properties": {"id": "44A3BECD90E911E8B3B474D435EEBE90", "kind": "pozitiv", "description": "Pohled na část astronomického ciferníku ve střední části orloje Staroměstské radnice (dům čp. 1 na Starém Městě) na Staroměstském náměstí po restaurování. Vpravo sochy Smrtky a Turka.", "date_label": "23.12.1911", "start_date": "1911-12-23", "end_date": "1911-12-23", "author": "Kříženecký, Jan (1868-1921)", "note": "", "views": "38x", "geolocation_type": "regional.address"}}, {"type": "Feature", "geometry": {"type": "Point", "coordinates": [14.40328, 50.09504]}, "properties": {"id": "44A58BFF8B0411E2BF22525400E46D25", "kind": "negativ", "description": "Pohled do interiéru kadetní školy čp. 221 na Hradčanech na Mariánské baště - pamětní deska.", "date_label": "po 1900", "start_date": "1901-01-01", "end_date": "2000-12-31", "author": "Eckert, Jindřich (1833-1905)", "note": "", "views": "31x", "geolocation_type": "regional.address"}}, {"type": "Feature", "geometry": {"type": "Point", "coordinates": [14.40416, 50.08677]}, "properties": {"id": "44F24C88657111E8B6E074D435EEBE90", "kind": "pozitiv", "description": "Pohled na část průčelí domu čp. 297 v Prokopské ulici na Malé Straně s domovním znamením - \"P. Maria pod řetězem\" s Ježíškem a Černý koníček.", "date_label": "", "start_date": "", "end_date": "", "author": "", "note": "", "views": "25x", "geolocation_type": "regional.address"}}, {"type": "Feature", "geometry": {"type": "Point", "coordinates": [14.40955, 50.10101]}, "properties": {"id": "451AC8FB87CF11E2BF21525400E46D25", "kind": "negativ", "description": "Pohled na dům čp. 286 v ulici Pod Kaštany v Bubenči (vila Hugo Sieburgera).\r\n                    \r\n                \r\n                    \r\n                  .", "date_label": "23.4.1909", "start_date": "1909-04-23", "end_date": "1909-04-23", "author": "Eckert-ateliér", "note": "", "views": "37x", "geolocation_type": "regional.address"}}, {"type": "Feature", "geometry": {"type": "Point", "coordinates": [14.41521, 50.09017]}, "properties": {"id": "451ADE0C769C11E2BF17525400E46D25", "kind": "negativ", "description": "Pohled na stavbu Rudolfina (dům čp. 79 na Starém Městě) od jihovýchodu - od křižovatky dnešního Palachova náměstí a Sanytrové ulice (dnes ulice 17. listopadu) na Starém Městě.", "date_label": "kol.1884", "start_date": "1884-01-01", "end_date": "1884-12-31", "author": "Eckert, Jindřich (1833-1905)", "note": "", "views": "30x", "geolocation_type": "regional.address"}}, {"type": "Feature", "geometry": {"type": "Point", "coordinates": [14.41783, 50.08711]}, "properties": {"id": "4547C3954D9C11E1A9526C626D41E503", "kind": "pozitiv", "description": "Pohled na budovu Magistrátu hlavního města Prahy (dům čp. 2) na Starém Městě na Mariánském náměstí.", "date_label": "17.7.1934", "start_date": "1934-07-17", "end_date": "1934-07-17", "author": "Alexander, Antonín (1892-působnost do 1948)", "note": "", "views": "22x", "geolocation_type": "regional.address"}}, {"type": "Feature", "geometry": {"type": "Point", "coordinates": [14.41873, 50.08783]}, "properties": {"id": "45D49B7E808811E4AAB4406186009F3A", "kind": "pozitiv", "description": "Pohled na zbytky románského zdiva nalezeného při bourání domu čp. 16 na Starém Městě (Andělská kolej) v Mikulášské ulici (dnes náměstí Franze Kafky) .", "date_label": "1909", "start_date": "1909-01-01", "end_date": "1909-12-31", "author": "Kříženecký, Jan (1868-1921)", "note": "", "views": "35x", "geolocation_type": "regional.address"}}, {"type": "Feature", "geometry": {"type": "Point", "coordinates": [14.40213, 50.08817]}, "properties": {"id": "45DCF224D5AA11E18CF36C626D41E503", "kind": "pozitiv", "description": "Pohled na dům čp. 258 na Malé Straně (vojenské velitelství).", "date_label": "16.10.1945", "start_date": "1945-10-16", "end_date": "1945-10-16", "author": "Alexander, Antonín (1892-působnost do 1948)", "note": "", "views": "26x", "geolocation_type": "regional.address"}}, {"type": "Feature", "geometry": {"type": "Point", "coordinates": [14.39427, 50.07227]}, "properties": {"id": "469F2205DCB211E6B80F406186009F3A", "kind": "negativ", "description": "Celkový pohled na kapli sv. Rocha na Malostranském hřbitově z Plzeňské ulice na Smíchově. V pozadí dům čp. 934 a kostel Nejsvětější Trojice.", "date_label": "9.5.1950", "start_date": "1950-05-09", "end_date": "1950-05-09", "author": "Vopravil, Josef (1902-1972)", "note": "", "views": "64x", "geolocation_type": "regional.address"}}, {"type": "Feature", "geometry": {"type": "Point", "coordinates": [14.42336, 50.07977]}, "properties": {"id": "46C0F11B800211E2BF1B525400E46D25", "kind": "negativ", "description": "Pohled do interiéru Vyšší dívčí školy ve Vodičkově ulici (dům čp. 683 na Novém Městě) - schodiště.", "date_label": "kol.1890", "start_date": "1890-01-01", "end_date": "1890-12-31", "author": "Eckert, Jindřich (1833-1905)", "note": "", "views": "34x", "geolocation_type": "regional.address"}}, {"type": "Feature", "geometry": {"type": "Point", "coordinates": [14.44983, 50.01797]}, "properties": {"id": "46CC908629F111E9980E74D435EEBE90", "kind": "negativ", "description": "Pohled ze dvora na hlavní bránu a vjezd do statku čp. 101 (Nové Dvory) v ulici U Nového dvora (dnes Durychova) ve Lhotce.", "date_label": "červen 1953", "start_date": "1953-06-01", "end_date": "1953-06-30", "author": "", "note": "", "views": "36x", "geolocation_type": "regional.address"}}, {"type": "Feature", "geometry": {"type": "Point", "coordinates": [14.4211, 50.08684]}, "properties": {"id": "4722DBA61C9311E8804174D435EEBE90", "kind": "pozitiv", "description": "Pohled do podloubí domu čp. 481 na Starém Městě na Staroměstském náměstí, poškozený za povstání 5. - 8. května 1945.", "date_label": "květen 1945", "start_date": "1945-05-01", "end_date": "1945-05-31", "author": "Sudek, Josef (1896-1976)", "note": "", "views": "7x", "geolocation_type": "regional.address"}}, {"type": "Feature", "geometry": {"type": "Point", "coordinates": [14.43965, 50.09011]}, "properties": {"id": "475293B3305211E99E6A74D435EEBE90", "kind": "negativ", "description": "Pohled do Křižíkovy (Palackého) ulice od křižovatky s ulicí Sadovou (dnes Ke Štvanici) k východu - k viaduktu. Uprostřed nárožní dům čp. 332 v Karlíně.", "date_label": "kol.1900", "start_date": "1900-01-01", "end_date": "1900-12-31", "author": "Bellmann-ateliér", "note": "", "views": "69x", "geolocation_type": "regional.address"}}, {"type": "Feature", "geometry": {"type": "Point", "coordinates": [14.44868, 50.10248]}, "properties": {"id": "484F5303955511E2BF29525400E46D25", "kind": "negativ", "description": "Pohled do interiéru domu čp. 515 v Holešovicích (Opatrovna a mateřská škola Na Maninách - dnes Tusarova 27) - oddělení pro nejmenší děti.", "date_label": "kol.1900", "start_date": "1900-01-01", "end_date": "1900-12-31", "author": "Eckert, Jindřich (1833-1905)", "note": "", "views": "37x", "geolocation_type": "regional.address"}}, {"type": "Feature", "geometry": {"type": "Point", "coordinates": [14.44929, 50.08173]}, "properties": {"id": "486A1559864011E294336C626D41E503", "kind": "pozitiv", "description": "Průhled Fibichovou ulicí k hlavní bráně Židovského hřbitova na Žižkově (v místech dnešních Mahlerových sadů). Vlevo část domu čp. 1526, vpravo část domu čp. 1500 na Žižkově.", "date_label": "27.4.1933", "start_date": "1933-04-27", "end_date": "1933-04-27", "author": "Alexander, Antonín (1892-působnost do 1948)", "note": "", "views": "138x", "geolocation_type": "regional.address"}}, {"type": "Feature", "geometry": {"type": "Point", "coordinates": [14.43664, 50.09022]}, "properties": {"id": "48998A3D306C11EABE1474D435EEBE90", "kind": "negativ", "description": "Pohled do ulice Na Poříčí od Těšnova. Zleva domy čp. 1055 na nároží ulic Na Poříčí a Na Florenci, čp. 1054, čp. 1894... na Novém Městě.", "date_label": "kol.1910", "start_date": "1910-01-01", "end_date": "1910-12-31", "author": "", "note": "", "views": "52x", "geolocation_type": "regional.address"}}, {"type": "Feature", "geometry": {"type": "Point", "coordinates": [14.41806, 50.08421]}, "properties": {"id": "48C89E0DECE611DFBD7B000C766D2371", "kind": "pozitiv", "description": "Pohled do Husovy ulice k severu. Vlevo nárožní dům čp. 351, vpravo dům čp. 352 (\"U Sladkých\") na Starém Městě. V popředí nárožní patníky obou domů.", "date_label": "26.3.1945", "start_date": "1945-03-26", "end_date": "1945-03-26", "author": "Alexander, Antonín (1892-působnost do 1948)", "note": "", "views": "23x", "geolocation_type": "regional.address"}}, {"type": "Feature", "geometry": {"type": "Point", "coordinates": [14.42588, 50.08592]}, "properties": {"id": "48F8597B711E11E2BF15525400E46D25", "kind": "pozitiv", "description": "Pohled na průčelí domu čp. 957 v ulici Na Příkopě na Starém Městě (\"Velký bazar\").", "date_label": "7.12.1923", "start_date": "1923-12-07", "end_date": "1923-12-07", "author": "Vojta, Tomáš (1885-1934)", "note": "", "views": "56x", "geolocation_type": "regional.address"}}, {"type": "Feature", "geometry": {"type": "Point", "coordinates": [14.42788, 50.08949]}, "properties": {"id": "493065F4161711E390486C626D41E503", "kind": "pozitiv", "description": "Pohled na část náměstí Republiky s nízkými krámky v proluce před postavením OD Kotva. Zcela vlevo část domu čp. 655 (dům pojišťovny Kotva) na Starém Městě.", "date_label": "", "start_date": "", "end_date": "", "author": "Roleček, Jiří", "note": "", "views": "73x", "geolocation_type": "regional.address"}}, {"type": "Feature", "geometry": {"type": "Point", "coordinates": [14.37114, 50.08738]}, "properties": {"id": "495245D0BB7B11E594BE74D435EEBE90", "kind": "pozitiv", "description": "Pohled do venkovní zahrádky domu čp. 35 (hostinec Stodola - U Klausů) v Boleslavově ulici (dnes Radimova) v Břevnově.", "date_label": "1925 (?)", "start_date": "1925-01-01", "end_date": "1925-12-31", "author": "Dub, Václav (dokumenty 1928-1983)", "note": "", "views": "41x", "geolocation_type": "regional.address"}}, {"type": "Feature", "geometry": {"type": "Point", "coordinates": [14.46093, 50.08722]}, "properties": {"id": "4997DF7BF8CD11E1BEF6000C766D2371", "kind": "pozitiv", "description": "Pohled na kostel sv. Anny a na bývalý klášter karmelitánů na Žižkově (dům čp. 1268) v bloku mezi Ostromečskou (býv. Šlikovou), Jeseniovou a Tovačovského ulicí.", "date_label": "24.9.1942", "start_date": "1942-09-24", "end_date": "1942-09-24", "author": "Alexander, Antonín (1892-působnost do 1948)", "note": "", "views": "95x", "geolocation_type": "regional.address"}}, {"type": "Feature", "geometry": {"type": "Point", "coordinates": [14.38996, 50.08783]}, "properties": {"id": "499F1AA4819C11E2BF1C525400E46D25", "kind": "negativ", "description": "Pohled do interiéru domu čp. 111 (sirotčinec arcivévodkyně Gisely) na Pohořelci na Hradčanech - jídelna.", "date_label": "kol.1890", "start_date": "1890-01-01", "end_date": "1890-12-31", "author": "Eckert, Jindřich (1833-1905)", "note": "", "views": "26x", "geolocation_type": "regional.address"}}, {"type": "Feature", "geometry": {"type": "Point", "coordinates": [14.43637, 50.10853]}, "properties": {"id": "4A2174B777A711E3B1146C626D41E503", "kind": "pozitiv", "description": "Pohled do interiéru haly ústřední elektrárny v Holešovicích (dům čp. 1).", "date_label": "1899-1900", "start_date": "1899-01-01", "end_date": "1900-12-31", "author": "", "note": "", "views": "38x", "geolocation_type": "regional.address"}}, {"type": "Feature", "geometry": {"type": "Point", "coordinates": [14.65313, 50.1772]}, "properties": {"id": "4A42017E81D711E3B4B96C626D41E503", "kind": "pozitiv", "description": "Pohled na dům čp. 320 na Starém Městě na nároží ulic Konviktské (vpravo) a Divadelní. Další dům vlevo čp. 1088 (pseudogotický).", "date_label": "29.3.1928", "start_date": "1928-03-29", "end_date": "1928-03-29", "author": "Alexander, Antonín (1892-působnost do 1948)", "note": "", "views": "41x", "geolocation_type": "regional.address"}}, {"type": "Feature", "geometry": {"type": "Point", "coordinates": [14.40957, 50.09228]}, "properties": {"id": "4A5BDEAF87ED11E2BF21525400E46D25", "kind": "negativ", "description": "Pohled do interiéru domu čp. 132 na Malé Straně (kasárna pod Bruskou) - šermířská síň.", "date_label": "kol.1890", "start_date": "1890-01-01", "end_date": "1890-12-31", "author": "Eckert, Jindřich (1833-1905)", "note": "", "views": "22x", "geolocation_type": "regional.address"}}, {"type": "Feature", "geometry": {"type": "Point", "coordinates": [14.41556, 50.13557]}, "properties": {"id": "4A6372F19FC211E3B650406186009F3A", "kind": "pozitiv", "description": "Panoramatický pohled ze skály u roztockého lesa na vltavské údolí a ústí čimického potoka v Bohnicích s domem čp. 50 (dynamitka). Druhá část čtyřdílného panoramatu.", "date_label": "9.9.1923", "start_date": "1923-09-09", "end_date": "1923-09-09", "author": "Alexander, Antonín (1892-působnost do 1948)", "note": "", "views": "106x", "geolocation_type": "regional.address"}}, {"type": "Feature", "geometry": {"type": "Point", "coordinates": [14.42642, 50.08845]}, "properties": {"id": "4ACE1016157611E39CC26C626D41E503", "kind": "pozitiv", "description": "Celkový pohled dům čp. 674 na nároží ulic Rybné a Jakubské (v popředí) na Starém Městě.", "date_label": "27.9.1944", "start_date": "1944-09-27", "end_date": "1944-09-27", "author": "Alexander, Antonín (1892-působnost do 1948)", "note": "", "views": "40x", "geolocation_type": "regional.address"}}, {"type": "Feature", "geometry": {"type": "Point", "coordinates": [14.41873, 50.08783]}, "properties": {"id": "4AD6B439808B11E4AAB4406186009F3A", "kind": "pozitiv", "description": "Pohled na fragmenty gotické výzdoby v domě čp. 16 na Starém Městě (Andělská kolej) v Mikulášské ulici (dnes náměstí Franze Kafky).", "date_label": "1909", "start_date": "1909-01-01", "end_date": "1909-12-31", "author": "Kříženecký, Jan (1868-1921)", "note": "", "views": "29x", "geolocation_type": "regional.address"}}, {"type": "Feature", "geometry": {"type": "Point", "coordinates": [14.42095, 50.0867]}, "properties": {"id": "4ADA79AB00B611E69BA4406186009F3A", "kind": "pozitiv", "description": "Pohled do alkovny v 1. patře domu čp. 480 na Starém Městě. Pod stropem jsou na dřevěné rámy na zavěšování kožešin (souvisí s rukavičkářským závodem J. Z. Schütze).", "date_label": "1926", "start_date": "1926-01-01", "end_date": "1926-12-31", "author": "Vojta, Tomáš (1885-1934)", "note": "", "views": "18x", "geolocation_type": "regional.address"}}, {"type": "Feature", "geometry": {"type": "Point", "coordinates": [14.41536, 50.07303]}, "properties": {"id": "4B57EBE40DA911E892C0406186009F3A", "kind": "pohlednice", "description": "Pohled na osvětlený kostel P. Marie v Emauzích a kapli sv. Kosmy a Damiána na Novém Městě při příležitosti 10. výročí samostatnosti Československé republiky. V popředí domy čp. 375 a 376.", "date_label": "28.10.1928", "start_date": "1928-10-28", "end_date": "1928-10-28", "author": "", "note": "", "views": "79x", "geolocation_type": "regional.address"}}, {"type": "Feature", "geometry": {"type": "Point", "coordinates": [14.41883, 50.06985]}, "properties": {"id": "4B66913E87E611E2BF21525400E46D25", "kind": "negativ", "description": "Pohled na zahradní průčelí městského chudobince sv. Bartoloměje (dům čp. 427) ve Vyšehradské ulici na Novém Městě.", "date_label": "kol.1890", "start_date": "1890-01-01", "end_date": "1890-12-31", "author": "Eckert, Jindřich (1833-1905)", "note": "", "views": "44x", "geolocation_type": "regional.address"}}, {"type": "Feature", "geometry": {"type": "Point", "coordinates": [14.41426, 50.08298]}, "properties": {"id": "4C3CA5DE81D611E3B4B96C626D41E503", "kind": "pozitiv", "description": "Pohled do dvora domu čp. 320 na Starém Městě v ulici Karoliny Světlé.", "date_label": "před 1926", "start_date": "1800-01-01", "end_date": "1925-12-31", "author": "Vojta, Tomáš (1885-1934)", "note": "", "views": "29x", "geolocation_type": "regional.address"}}, {"type": "Feature", "geometry": {"type": "Point", "coordinates": [14.42009, 50.087]}, "properties": {"id": "4CD1E252917111E8B9E274D435EEBE90", "kind": "pozitiv", "description": "Socha Marnivce a Turka z orloje v jižním průčelí Staroměstské radnice (dům čp. 1 na Starém Městě) na Staroměstském náměstí po restaurování.", "date_label": "18.12.1911", "start_date": "1911-12-18", "end_date": "1911-12-18", "author": "Kříženecký, Jan (1868-1921)", "note": "", "views": "34x", "geolocation_type": "regional.address"}}, {"type": "Feature", "geometry": {"type": "Point", "coordinates": [14.42009, 50.087]}, "properties": {"id": "4D08D3CC90B611E8B3B474D435EEBE90", "kind": "negativ", "description": "Pohled na orloj Staroměstské radnice (dům čp. 1 na Starém Městě) na Staroměstském náměstí. V popředí část stanice tramvaje č. 5.", "date_label": "", "start_date": "", "end_date": "", "author": "", "note": "", "views": "36x", "geolocation_type": "regional.address"}}, {"type": "Feature", "geometry": {"type": "Point", "coordinates": [14.40598, 50.08672]}, "properties": {"id": "4D1D39F5D5A011E18CF36C626D41E503", "kind": "pozitiv", "description": "Pohled na portál domu čp. 287 v Lázeňské ulici na Malé Straně (fara konventu řádu maltézských rytířů).", "date_label": "12.10.1930", "start_date": "1930-10-12", "end_date": "1930-10-12", "author": "Alexander, Antonín (1892-působnost do 1948)", "note": "", "views": "20x", "geolocation_type": "regional.address"}}, {"type": "Feature", "geometry": {"type": "Point", "coordinates": [14.40535, 50.09003]}, "properties": {"id": "4D36B43A74F011E2BF16525400E46D25", "kind": "negativ", "description": "Pohled do interiéru Valdštejnského paláce (dům čp. 17 na Malé Straně) - salon.", "date_label": "1920", "start_date": "1920-01-01", "end_date": "1920-12-31", "author": "Eckert-ateliér", "note": "", "views": "18x", "geolocation_type": "regional.address"}}, {"type": "Feature", "geometry": {"type": "Point", "coordinates": [14.41995, 50.08028]}, "properties": {"id": "4D7EA38BDB8711DFBD5E000C766D2371", "kind": "pozitiv", "description": "Pohled do Spálené ulice s domem čp. 78 (87?) na Novém Městě před zbořením.", "date_label": "", "start_date": "", "end_date": "", "author": "", "note": "", "views": "33x", "geolocation_type": "regional.address"}}, {"type": "Feature", "geometry": {"type": "Point", "coordinates": [14.42901, 50.08293]}, "properties": {"id": "4E1C21C5AE7311E2B80CD4BED94BB14D", "kind": "negativ", "description": "Pohled do interiéru domu čp. 909 (budova hlavní pošty) na Novém Městě v Jindřišské ulici - místnost s akumulátory.", "date_label": "1908", "start_date": "1908-01-01", "end_date": "1908-12-31", "author": "Eckert-ateliér", "note": "", "views": "23x", "geolocation_type": "regional.address"}}, {"type": "Feature", "geometry": {"type": "Point", "coordinates": [14.42009, 50.087]}, "properties": {"id": "4E3F29C590EB11E8B3B474D435EEBE90", "kind": "negativ", "description": "Socha Hvězdáře a archanděla Michaela z orloje v jižním průčelí Staroměstské radnice (dům čp. 1 na Starém Městě) na Staroměstském náměstí před restaurováním.", "date_label": "21.9.1911", "start_date": "1911-09-21", "end_date": "1911-09-21", "author": "Kříženecký, Jan (1868-1921)", "note": "", "views": "41x", "geolocation_type": "regional.address"}}, {"type": "Feature", "geometry": {"type": "Point", "coordinates": [14.43235, 50.09781]}, "properties": {"id": "4E4759DDC3E311E480AC74D435EEBE90", "kind": "pozitiv", "description": "Pohled na průčelí domu čp. 360 v Holešovicích (továrna firmy Novák a Jahn) do Kostelní ulice.", "date_label": "1932", "start_date": "1932-01-01", "end_date": "1932-12-31", "author": "", "note": "", "views": "79x", "geolocation_type": "regional.address"}}, {"type": "Feature", "geometry": {"type": "Point", "coordinates": [14.42573, 50.08795]}, "properties": {"id": "4EC1F4B5F23111E39D34406186009F3A", "kind": "pozitiv", "description": "Pohled na Králodvorská kasárna (dům čp. 654 - kadetní škola) na Josefském náměstí (náměstí Republiky).", "date_label": "1903", "start_date": "1903-01-01", "end_date": "1903-12-31", "author": "", "note": "", "views": "51x", "geolocation_type": "regional.address"}}, {"type": "Feature", "geometry": {"type": "Point", "coordinates": [14.42009, 50.087]}, "properties": {"id": "4ECD8444917211E8B9E274D435EEBE90", "kind": "pozitiv", "description": "Socha Marnivce a Turka z orloje v jižním průčelí Staroměstské radnice (dům čp. 1 na Starém Městě) na Staroměstském náměstí po restaurování.", "date_label": "18.12.1911", "start_date": "1911-12-18", "end_date": "1911-12-18", "author": "Kříženecký, Jan (1868-1921)", "note": "", "views": "37x", "geolocation_type": "regional.address"}}, {"type": "Feature", "geometry": {"type": "Point", "coordinates": [14.4052, 50.08425]}, "properties": {"id": "4EF37F919B8D11E2BF2D525400E46D25", "kind": "pozitiv", "description": "Tablo abiturientů Malostranské reálky - VII. b - 1906", "date_label": "1906", "start_date": "1906-01-01", "end_date": "1906-12-31", "author": "Donát, V.", "note": "", "views": "18x", "geolocation_type": "regional.address"}}, {"type": "Feature", "geometry": {"type": "Point", "coordinates": [14.36406, 50.08607]}, "properties": {"id": "4F23AD64B5FC11E58B3BD4BED94BB14D", "kind": "pozitiv", "description": "Pohled na Malé náměstí (dnes Břevnovská ulice) s domem čp. 15 v Břevnově (panská kovárna).", "date_label": "1925", "start_date": "1925-01-01", "end_date": "1925-12-31", "author": "Vojta, Tomáš (1885-1934)", "note": "", "views": "54x", "geolocation_type": "regional.address"}}, {"type": "Feature", "geometry": {"type": "Point", "coordinates": [14.42233, 50.08309]}, "properties": {"id": "4F2600DDE28F11E89F1B74D435EEBE90", "kind": "pozitiv", "description": "Pohled na průčelí domu čp. 761 na Jungmannově náměstí na Novém Městě.", "date_label": "1905", "start_date": "1905-01-01", "end_date": "1905-12-31", "author": "Bruner-Dvořák, Rudolf (1864-1921)", "note": "", "views": "24x", "geolocation_type": "regional.address"}}, {"type": "Feature", "geometry": {"type": "Point", "coordinates": [14.42112, 50.08823]}, "properties": {"id": "4F4B6EA5824D11E2BF1E525400E46D25", "kind": "negativ", "description": "Pohled do interiéru Pražské městské pojišťovny (dům čp. 932) na Staroměstském náměstí - zasedací síň.", "date_label": "4.4.1902", "start_date": "1902-04-04", "end_date": "1902-04-04", "author": "Eckert, Jindřich (1833-1905)", "note": "", "views": "14x", "geolocation_type": "regional.address"}}, {"type": "Feature", "geometry": {"type": "Point", "coordinates": [14.40131, 50.08733]}, "properties": {"id": "4F837FAC7C7311E3BFE4406186009F3A", "kind": "pozitiv", "description": "Západní vstupní průjezd Schönbornského paláce - domu čp. 365 na Malé Straně.", "date_label": "červen 1931", "start_date": "1931-06-01", "end_date": "1931-06-30", "author": "Vojta, Tomáš (1885-1934)", "note": "", "views": "27x", "geolocation_type": "regional.address"}}, {"type": "Feature", "geometry": {"type": "Point", "coordinates": [14.42013, 50.08651]}, "properties": {"id": "4F887556A57611E4A308406186009F3A", "kind": "pozitiv", "description": "Pohled na jihozápadní část Staroměstského náměstí s domy čp. (zprava) 460, 461, 462, 478, 479, 480, 481 a 482. V pozadí kostel P. Marie před Týnem.", "date_label": "23.9.1914", "start_date": "1914-09-23", "end_date": "1914-09-23", "author": "Kříženecký, Jan (1868-1921)", "note": "", "views": "41x", "geolocation_type": "regional.address"}}, {"type": "Feature", "geometry": {"type": "Point", "coordinates": [14.40473, 50.02294]}, "properties": {"id": "4F89AEC2D29D11E6BE58406186009F3A", "kind": "pozitiv", "description": "Průhled Modřanskou ulicí v Hodkovičkách s domy (zprava) čp. 30, 14 a 12.", "date_label": "", "start_date": "", "end_date": "", "author": "", "note": "", "views": "36x", "geolocation_type": "regional.address"}}, {"type": "Feature", "geometry": {"type": "Point", "coordinates": [14.43308, 50.08714]}, "properties": {"id": "4FB216B287DC11E2BF21525400E46D25", "kind": "negativ", "description": "Pohled do interiéru novostavby domu čp. 1006 na Novém Městě v Hybernské ulici (\"Ústřední jednota českých hospodářských společenstev\") - slavnostní sál.", "date_label": "22.10.1906", "start_date": "1906-10-22", "end_date": "1906-10-22", "author": "Eckert-ateliér", "note": "", "views": "20x", "geolocation_type": "regional.address"}}, {"type": "Feature", "geometry": {"type": "Point", "coordinates": [14.43098, 50.09256]}, "properties": {"id": "5071B929651D11E6A555000C76270B94", "kind": "pozitiv", "description": "Pohled na rameno Vltavy u Primátorského ostrova s pěší lávkou na Primátorský ostrov a domy čp. 1233, 1232, 1231, 1540 a souborem budov u domu čp. 1229 v Novomlýnské ulici na Novém Městě. V pozadí domy čp. 1235 v Novomlýnské ulici.", "date_label": "25.3.1910", "start_date": "1910-03-25", "end_date": "1910-03-25", "author": "", "note": "", "views": "35x", "geolocation_type": "regional.address"}}, {"type": "Feature", "geometry": {"type": "Point", "coordinates": [14.40131, 50.08733]}, "properties": {"id": "51071D0C7D2411E3BE26406186009F3A", "kind": "pozitiv", "description": "Interiér stáje Schönbornského paláce - domu čp. 365 na Malé Straně.", "date_label": "", "start_date": "", "end_date": "", "author": "", "note": "", "views": "19x", "geolocation_type": "regional.address"}}, {"type": "Feature", "geometry": {"type": "Point", "coordinates": [14.41883, 50.06985]}, "properties": {"id": "51237A2287E811E2BF21525400E46D25", "kind": "negativ", "description": "Pohled do interiéru městského chudobince sv. Bartoloměje (dům čp. 427 na Novém Městě) ve Vyšehradské ulici - koupelna.", "date_label": "kol.1890", "start_date": "1890-01-01", "end_date": "1890-12-31", "author": "Eckert, Jindřich (1833-1905)", "note": "", "views": "43x", "geolocation_type": "regional.address"}}, {"type": "Feature", "geometry": {"type": "Point", "coordinates": [14.44042, 50.0743]}, "properties": {"id": "5165F5ACD65C11E18B876C626D41E503", "kind": "pozitiv", "description": "Okupace - květen 1945 - pohled na Vinohradskou synagogu (dům čp. 830 na Vinohradech).", "date_label": "květen 1945", "start_date": "1945-05-01", "end_date": "1945-05-31", "author": "Velebil, Karel (?)", "note": "", "views": "65x", "geolocation_type": "regional.address"}}, {"type": "Feature", "geometry": {"type": "Point", "coordinates": [14.40131, 50.08733]}, "properties": {"id": "51C15D4A74F111E2BF16525400E46D25", "kind": "negativ", "description": "Pohled do interiéru domu čp. 365 (Schönbornský palác) na Malé Straně - salon.", "date_label": "19.11.1902", "start_date": "1902-11-19", "end_date": "1902-11-19", "author": "Eckert, Jindřich (1833-1905)", "note": "", "views": "20x", "geolocation_type": "regional.address"}}, {"type": "Feature", "geometry": {"type": "Point", "coordinates": [14.41833, 50.08448]}, "properties": {"id": "5203B4D5ECE511DFBD7B000C766D2371", "kind": "pozitiv", "description": "Pohled do dvora domu čp. 352 (\"U Sladkých\") na Starém Městě.", "date_label": "1926", "start_date": "1926-01-01", "end_date": "1926-12-31", "author": "Vojta, Tomáš (1885-1934)", "note": "", "views": "22x", "geolocation_type": "regional.address"}}, {"type": "Feature", "geometry": {"type": "Point", "coordinates": [14.37685, 50.10006]}, "properties": {"id": "52160250611211E4B88BD4BED94BB14D", "kind": "pozitiv", "description": "Pohled na usedlost Hadovka (dům čp. 10) v Dejvicích.", "date_label": "1912", "start_date": "1912-01-01", "end_date": "1912-12-31", "author": "Fink, František (1854-1935)", "note": "", "views": "82x", "geolocation_type": "regional.address"}}, {"type": "Feature", "geometry": {"type": "Point", "coordinates": [14.41976, 50.07032]}, "properties": {"id": "5236F5F9B84111E5BC22406186009F3A", "kind": "pozitiv", "description": "Pohled do ulice Na Slupi na Novém Městě směrem od křižovatky s Botičskou. Vlevo klášter sv. Alžběty (dům čp. 448) a domy čp. 434, 1485, 1484, 1483.", "date_label": "21.5.1910", "start_date": "1910-05-21", "end_date": "1910-05-21", "author": "", "note": "", "views": "57x", "geolocation_type": "regional.address"}}, {"type": "Feature", "geometry": {"type": "Point", "coordinates": [14.40608, 50.08189]}, "properties": {"id": "5243AB6D657B11E8B6E074D435EEBE90", "kind": "pozitiv", "description": "Pohled do dvora domu čp. 440 v Říční ulici na Malé Straně.", "date_label": "", "start_date": "", "end_date": "", "author": "", "note": "", "views": "22x", "geolocation_type": "regional.address"}}, {"type": "Feature", "geometry": {"type": "Point", "coordinates": [14.41993, 50.07002]}, "properties": {"id": "5356F4D8CA5111E59CC8406186009F3A", "kind": "pozitiv", "description": "Celkový pohled na dům čp. 434 na Novém Městě při započetí demolice. V pozadí dům čp. 1485.", "date_label": "27.3.1925", "start_date": "1925-03-27", "end_date": "1925-03-27", "author": "Alexander, Antonín (1892-působnost do 1948)", "note": "", "views": "75x", "geolocation_type": "regional.address"}}, {"type": "Feature", "geometry": {"type": "Point", "coordinates": [14.37685, 50.10006]}, "properties": {"id": "536D9CF1611511E4B88BD4BED94BB14D", "kind": "pozitiv", "description": "Pohled na dům čp. 126 v Dejvicích ve Veleslavínově ulici (Žukovova, dnes Evropská). Vpravo stodola (čp. 11?) usedlosti Hadovka (čp. 10).", "date_label": "březen 1959", "start_date": "1959-03-01", "end_date": "1959-03-31", "author": "Hnilička, Eduard (1887-1967)", "note": "", "views": "97x", "geolocation_type": "regional.address"}}, {"type": "Feature", "geometry": {"type": "Point", "coordinates": [14.41907, 50.06375]}, "properties": {"id": "5384A7693F8311E2A1026C626D41E503", "kind": "pozitiv", "description": "Pohled na archeologické vykopávky na Vyšehradě - zbytky baziliky sv. Vavřince při domě čp. 14 (staré děkanství) v Soběslavově ulici - část románských kachlíků z románské baziliky vykopaných prof. Matějkou v roce 1893, které shromáždil zesnulý kanovník Ed. Sittlera (dnes umístěny v kapli).", "date_label": "14.9.1936", "start_date": "1936-09-14", "end_date": "1936-09-14", "author": "Alexander, Antonín (1892-působnost do 1948)", "note": "", "views": "54x", "geolocation_type": "regional.address"}}, {"type": "Feature", "geometry": {"type": "Point", "coordinates": [14.42708, 50.0821]}, "properties": {"id": "53DB037D8B0B11E2BF22525400E46D25", "kind": "negativ", "description": "Pohled do interiéru novostavby hotelu \"Arcivévoda Štěpán\" na Václavském náměstí (dům čp. 826 na Novém Městě - později \"Grandhotel Šroubek\" - dnes \"Grandhotel Evropa\") - tzv. Štěpánský sklep (dnes Plzeňská restaurace).", "date_label": "8.-12.8.1905", "start_date": "", "end_date": "", "author": "Eckert-ateliér", "note": "", "views": "58x", "geolocation_type": "regional.address"}}, {"type": "Feature", "geometry": {"type": "Point", "coordinates": [14.419, 50.07337]}, "properties": {"id": "540898D7E44211E4BE0074D435EEBE90", "kind": "pozitiv", "description": "Interiér \"Faustova domu\" (dům čp. 502 na Novém Městě) - poškozeném po náletu spojenců v únoru 1945.", "date_label": "14.2.1945", "start_date": "1945-02-14", "end_date": "1945-02-14", "author": "", "note": "", "views": "44x", "geolocation_type": "regional.address"}}, {"type": "Feature", "geometry": {"type": "Point", "coordinates": [14.41783, 50.08711]}, "properties": {"id": "5412ab63824648ef8618176e2545639c", "kind": "pozitiv", "description": "Pohled na stavbu budovy Magistrátu hlavního města Prahy (dům čp. 2) na Mariánském náměstí na Starém Městě. V pozadí Platnéřská a Valentinská ulice.", "date_label": "1909-1910", "start_date": "1909-01-01", "end_date": "1910-12-31", "author": "", "note": "", "views": "12x", "geolocation_type": "regional.address"}}, {"type": "Feature", "geometry": {"type": "Point", "coordinates": [14.39375, 50.08878]}, "properties": {"id": "5472F999D5A911E18CF36C626D41E503", "kind": "pozitiv", "description": "Pohled do zahrady domu čp. 180 na Hradčanech (bývalý Trautmannsdorfský palác) - \"práce na výkopu válečného vodního bazénu\". Vlevo kaplička při Loretánské ulici.", "date_label": "5.6.1944", "start_date": "1944-06-05", "end_date": "1944-06-05", "author": "Alexander, Antonín (1892-působnost do 1948)", "note": "", "views": "52x", "geolocation_type": "regional.address"}}, {"type": "Feature", "geometry": {"type": "Point", "coordinates": [14.40491, 50.08866]}, "properties": {"id": "5489725E81DA11E3B4B96C626D41E503", "kind": "pozitiv", "description": "Pohled s kupole kostela sv. Mikuláše na část severovýchodní strany Malostranského náměstí s domy (zprava) čp. 35, čp. 27, čp. 518 na Malé Straně. V pozadí kostel sv. Tomáše.", "date_label": "1940-1945", "start_date": "1940-01-01", "end_date": "1945-12-31", "author": "", "note": "", "views": "47x", "geolocation_type": "regional.address"}}, {"type": "Feature", "geometry": {"type": "Point", "coordinates": [14.42233, 50.08309]}, "properties": {"id": "551D49E3E29011E89F1B74D435EEBE90", "kind": "pozitiv", "description": "Pohled na průčelí domu čp. 761 v Ovocné ulice na Novém Městě (dnes ulice 28. října).", "date_label": "1905", "start_date": "1905-01-01", "end_date": "1905-12-31", "author": "Bruner-Dvořák, Rudolf (1864-1921)", "note": "", "views": "25x", "geolocation_type": "regional.address"}}, {"type": "Feature", "geometry": {"type": "Point", "coordinates": [14.40131, 50.08733]}, "properties": {"id": "555D9B517C7211E3BFE4406186009F3A", "kind": "pozitiv", "description": "Kamna v interiéru Schönbornského paláce - domu čp. 365 na Malé Straně.", "date_label": "červen 1931", "start_date": "1931-06-01", "end_date": "1931-06-30", "author": "Vojta, Tomáš (1885-1934)", "note": "", "views": "22x", "geolocation_type": "regional.address"}}, {"type": "Feature", "geometry": {"type": "Point", "coordinates": [14.38224, 50.08528]}, "properties": {"id": "5561329CBB7A11E594BE74D435EEBE90", "kind": "pozitiv", "description": "Pohled na dům čp. 1069 (hostinec U Vonásků - U Zelené brány) v Bělohorské ulici v Břevnově - s nízkými domky. V pozadí nouzová obydlí v lomech u Ladronky.", "date_label": "kol.1935", "start_date": "1935-01-01", "end_date": "1935-12-31", "author": "Dub, Václav (dokumenty 1928-1983)", "note": "", "views": "72x", "geolocation_type": "regional.address"}}, {"type": "Feature", "geometry": {"type": "Point", "coordinates": [14.51723, 50.0348]}, "properties": {"id": "5561A3A654A211E6B6CF406186009F3A", "kind": "pozitiv", "description": "Pohled na základní školu v ulici Květnového vítězství (dům čp. 1554 na Chodově).", "date_label": "1982", "start_date": "1982-01-01", "end_date": "1982-12-31", "author": "Jelínková, Jana (1951-)", "note": "", "views": "33x", "geolocation_type": "regional.address"}}, {"type": "Feature", "geometry": {"type": "Point", "coordinates": [14.42009, 50.087]}, "properties": {"id": "55A2672D90EA11E8B3B474D435EEBE90", "kind": "pozitiv", "description": "Socha Kronikáře a Filozofa z orloje v jižním průčelí Staroměstské radnice (dům čp. 1 na Starém Městě) na Staroměstském náměstí před restaurováním.", "date_label": "21.9.1911", "start_date": "1911-09-21", "end_date": "1911-09-21", "author": "Kříženecký, Jan (1868-1921)", "note": "", "views": "36x", "geolocation_type": "regional.address"}}, {"type": "Feature", "geometry": {"type": "Point", "coordinates": [14.40643, 50.09055]}, "properties": {"id": "55AFF2B2580E11E7A695406186009F3A", "kind": "pozitiv", "description": "Pohled do dvora Kolovratského paláce (dům čp. 154) ve Valdštejnské ulici na Malé Straně.", "date_label": "kol.1920", "start_date": "1920-01-01", "end_date": "1920-12-31", "author": "", "note": "", "views": "27x", "geolocation_type": "regional.address"}}, {"type": "Feature", "geometry": {"type": "Point", "coordinates": [14.43094, 50.08457]}, "properties": {"id": "55E176DD922B11E2BF28525400E46D25", "kind": "negativ", "description": "Celkový pohled na hlavní průčelí novostavby školy v Jindřišské ulici (dům čp. 966 na Novém Městě).", "date_label": "1890", "start_date": "1890-01-01", "end_date": "1890-12-31", "author": "Eckert, Jindřich (1833-1905)", "note": "", "views": "22x", "geolocation_type": "regional.address"}}, {"type": "Feature", "geometry": {"type": "Point", "coordinates": [14.40739, 50.08615]}, "properties": {"id": "56080CE004F511E3A4F66C626D41E503", "kind": "pozitiv", "description": "Pohled na dům čp. 490 (palác Metychů z Čečova - Hrzánský) na Velkopřevorském náměstí na Malé Straně s renesančním portálem.", "date_label": "31.3.1914", "start_date": "1914-03-31", "end_date": "1914-03-31", "author": "Kříženecký, Jan (1868-1921)", "note": "", "views": "23x", "geolocation_type": "regional.address"}}, {"type": "Feature", "geometry": {"type": "Point", "coordinates": [14.42009, 50.087]}, "properties": {"id": "5636212D90EC11E8B3B474D435EEBE90", "kind": "pozitiv", "description": "Socha Filosofa a Kronikáře z orloje v jižním průčelí Staroměstské radnice (dům čp. 1 na Starém Městě) na Staroměstském náměstí po restaurování.", "date_label": "18.12.1911", "start_date": "1911-12-18", "end_date": "1911-12-18", "author": "Kříženecký, Jan (1868-1921)", "note": "", "views": "39x", "geolocation_type": "regional.address"}}, {"type": "Feature", "geometry": {"type": "Point", "coordinates": [14.44983, 50.01797]}, "properties": {"id": "567A3C8629F111E9980E74D435EEBE90", "kind": "negativ", "description": "Pohled na hlavní bránu a vjezd do statku čp. 101 (Nové Dvory) v ulici U Nového dvora (dnes Durychova) ve Lhotce.", "date_label": "červen 1953", "start_date": "1953-06-01", "end_date": "1953-06-30", "author": "", "note": "", "views": "44x", "geolocation_type": "regional.address"}}, {"type": "Feature", "geometry": {"type": "Point", "coordinates": [14.40131, 50.08733]}, "properties": {"id": "569601287D3811E3BE26406186009F3A", "kind": "pozitiv", "description": "Exteriér zahradního pavilonu Schönbornského paláce - domu čp. 365 na Malé Straně. Detail vstupu do salonku prvního patra.", "date_label": "červen 1931", "start_date": "1931-06-01", "end_date": "1931-06-30", "author": "Vojta, Tomáš (1885-1934)", "note": "", "views": "22x", "geolocation_type": "regional.address"}}, {"type": "Feature", "geometry": {"type": "Point", "coordinates": [14.3985, 50.08792]}, "properties": {"id": "56EFF6CAD70E11E1ABB66C626D41E503", "kind": "pozitiv", "description": "Pohled na dům čp. 323 na nároží Jánského vršku a Šporkovy ulice na Malé Straně s ohradní zdí.", "date_label": "16.4.1937", "start_date": "1937-04-16", "end_date": "1937-04-16", "author": "Alexander, Antonín (1892-působnost do 1948)", "note": "", "views": "57x", "geolocation_type": "regional.address"}}, {"type": "Feature", "geometry": {"type": "Point", "coordinates": [14.40131, 50.08733]}, "properties": {"id": "56FE0D8079F811E3B274406186009F3A", "kind": "pozitiv", "description": "Kamna v Schönbornském paláci - domě čp. 365 na Malé Straně.", "date_label": "červen 1931", "start_date": "1931-06-01", "end_date": "1931-06-30", "author": "Vojta, Tomáš (1885-1934)", "note": "", "views": "22x", "geolocation_type": "regional.address"}}, {"type": "Feature", "geometry": {"type": "Point", "coordinates": [14.419, 50.07337]}, "properties": {"id": "58550F99E43F11E4BE0074D435EEBE90", "kind": "pozitiv", "description": "Pohled na průčelí \"Faustova domu\" (dům čp. 502 na Novém Městě) do Vyšehradské ulice. V popředí zahradní zeď kostela sv. Jana Na Skalce.", "date_label": "31.5.1931", "start_date": "1931-05-31", "end_date": "1931-05-31", "author": "Alexander, Antonín (1892-působnost do 1948)", "note": "", "views": "78x", "geolocation_type": "regional.address"}}, {"type": "Feature", "geometry": {"type": "Point", "coordinates": [14.42156, 50.078]}, "properties": {"id": "5895E50285B211E2BF1F525400E46D25", "kind": "negativ", "description": "Pohled do interiéru domu čp. 671 na Karlově náměstí na Novém Městě (Salmovský palác) - pracovna s pánským psacím stolem.", "date_label": "kol.1900", "start_date": "1900-01-01", "end_date": "1900-12-31", "author": "Eckert, Jindřich (1833-1905)", "note": "", "views": "42x", "geolocation_type": "regional.address"}}, {"type": "Feature", "geometry": {"type": "Point", "coordinates": [14.40936, 50.02973]}, "properties": {"id": "58D3F3E1B99F11E3A934406186009F3A", "kind": "pozitiv", "description": "Pohled z Barrandovské skály k severovýchodu. V popředí Barrandovská skála a vltavské údolí. Na protějším břehu Braník s ledárnou (dům čp. 238) a Branickým pivovarem (dům čp. 212). Součást panoramatu.", "date_label": "4.4.1926", "start_date": "1926-04-04", "end_date": "1926-04-04", "author": "Alexander, Antonín (1892-působnost do 1948)", "note": "", "views": "65x", "geolocation_type": "regional.address"}}, {"type": "Feature", "geometry": {"type": "Point", "coordinates": [14.41805, 50.08516]}, "properties": {"id": "592373F018D011E9AFD5406186009F3A", "kind": "negativ", "description": "Pohled do dvora domu čp. 242 ve Zlaté a Husově ulici na Starém Městě Pražském.", "date_label": "16.9.1947", "start_date": "1947-09-16", "end_date": "1947-09-16", "author": "Poustecký, Josef", "note": "", "views": "27x", "geolocation_type": "regional.address"}}, {"type": "Feature", "geometry": {"type": "Point", "coordinates": [14.42801, 50.08681]}, "properties": {"id": "596F31D95A4111E7A69B406186009F3A", "kind": "pozitiv", "description": "Pohled na stavbu domu čp. 969 na nároží ulice Celetné a Na Příkopě na Starém Městě. V pozadí Prašná brána a dům čp. 862 na Novém Městě.", "date_label": "kol.1930", "start_date": "1930-01-01", "end_date": "1930-12-31", "author": "Pollak", "note": "", "views": "120x", "geolocation_type": "regional.address"}}, {"type": "Feature", "geometry": {"type": "Point", "coordinates": [14.41571, 50.04748]}, "properties": {"id": "5995EBB82CEF11E88DF074D435EEBE90", "kind": "negativ", "description": "Pohled na křižovatku ulic Přemyslovy (dnes Podolské) vpravo a Dvorecké (dnes Jeremenkova) vlevo. Uprostřed dům čp. 403, vlevo dům čp. 367, vpravo dům čp. 445 v Podolí. V popředí benzínová pumpa.", "date_label": "1939-1945", "start_date": "1939-01-01", "end_date": "1945-12-31", "author": "", "note": "", "views": "104x", "geolocation_type": "regional.address"}}, {"type": "Feature", "geometry": {"type": "Point", "coordinates": [14.47222, 50.10922]}, "properties": {"id": "59A34A5AAC7C11E49EA1406186009F3A", "kind": "pozitiv", "description": "Pohled na dům čp. 137 v Primátorské ulici v Libni.", "date_label": "1919", "start_date": "1919-01-01", "end_date": "1919-12-31", "author": "", "note": "", "views": "116x", "geolocation_type": "regional.address"}}, {"type": "Feature", "geometry": {"type": "Point", "coordinates": [14.65189, 50.17156]}, "properties": {"id": "59AF9454847511E49AE9406186009F3A", "kind": "pozitiv", "description": "Pohled do Platnéřské ulice s domy čp. 84, 1042 a 85 vpravo a s klášterem křižovníků (dům čp. 109 na Starém Městě) vlevo. V pozadí chrám sv. Víta na Pražském hradě.", "date_label": "3.7.1908", "start_date": "1908-07-03", "end_date": "1908-07-03", "author": "Dvořák, František (dokumenty 1901-1908)", "note": "", "views": "47x", "geolocation_type": "regional.address"}}, {"type": "Feature", "geometry": {"type": "Point", "coordinates": [14.40258, 50.02336]}, "properties": {"id": "59DE09D5D19811E69F29406186009F3A", "kind": "pozitiv", "description": "Pohled na dům čp. 7 v ulici V Náklích v Hodkovičkách.", "date_label": "1958", "start_date": "1958-01-01", "end_date": "1958-12-31", "author": "", "note": "", "views": "29x", "geolocation_type": "regional.address"}}, {"type": "Feature", "geometry": {"type": "Point", "coordinates": [14.42851, 50.0692]}, "properties": {"id": "59E6A7F8769911E2BF17525400E46D25", "kind": "negativ", "description": "Pohled do interiéru kláštera augustiniánů kanovníků na Karlově (dům čp. 453 na Novém Městě - chorobinec).", "date_label": "kol.1890", "start_date": "1890-01-01", "end_date": "1890-12-31", "author": "Eckert, Jindřich (1833-1905)", "note": "", "views": "37x", "geolocation_type": "regional.address"}}, {"type": "Feature", "geometry": {"type": "Point", "coordinates": [14.38806, 50.09007]}, "properties": {"id": "59E812F2769211E2BF17525400E46D25", "kind": "negativ", "description": "Pohled na budovu zimní jízdárny jezdecké školy - dům čp. 213 na Hradčanech.", "date_label": "kol.1890", "start_date": "1890-01-01", "end_date": "1890-12-31", "author": "Eckert, Jindřich (1833-1905)", "note": "", "views": "19x", "geolocation_type": "regional.address"}}, {"type": "Feature", "geometry": {"type": "Point", "coordinates": [14.4201, 50.08245]}, "properties": {"id": "5A094BCD15DF11EABE1274D435EEBE90", "kind": "negativ", "description": "Celkový pohled na průčelí domu čp. 60 (Choděrův restaurant) do Národní třídy na Novém Městě.", "date_label": "kol.1910", "start_date": "1910-01-01", "end_date": "1910-12-31", "author": "", "note": "", "views": "37x", "geolocation_type": "regional.address"}}, {"type": "Feature", "geometry": {"type": "Point", "coordinates": [14.40739, 50.08615]}, "properties": {"id": "5A80479F05B711E389696C626D41E503", "kind": "pozitiv", "description": "Pohled na dům čp. 490 (palác Metychů z Čečova - Hrzánský) na Velkopřevorském náměstí na Malé Straně s renesančním portálem.", "date_label": "1925", "start_date": "1925-01-01", "end_date": "1925-12-31", "author": "Vojta, Tomáš (1885-1934)", "note": "", "views": "31x", "geolocation_type": "regional.address"}}, {"type": "Feature", "geometry": {"type": "Point", "coordinates": [14.42825, 50.08762]}, "properties": {"id": "5AA65B0BF25A11E4AA40406186009F3A", "kind": "pozitiv", "description": "Pohled do interiéru Obecního domu (dm čp. 1090 na Starém Městě) - plastická výzdoba schodiště.", "date_label": "kol.1920", "start_date": "1920-01-01", "end_date": "1920-12-31", "author": "", "note": "", "views": "18x", "geolocation_type": "regional.address"}}, {"type": "Feature", "geometry": {"type": "Point", "coordinates": [14.4242, 50.0871]}, "properties": {"id": "5AB768368B1011E2BF22525400E46D25", "kind": "negativ", "description": "Pohled do interiéru domu čp. 562 (\"Dům Buquoyský\") v Celetné ulici na Starém Městě - ložnice hraběnky Ledeburgové.", "date_label": "20.4.1907", "start_date": "1907-04-20", "end_date": "1907-04-20", "author": "Eckert-ateliér", "note": "", "views": "24x", "geolocation_type": "regional.address"}}, {"type": "Feature", "geometry": {"type": "Point", "coordinates": [14.4341, 50.09865]}, "properties": {"id": "5ACC9999669411E481D7D4BED94BB14D", "kind": "pozitiv", "description": "Průhled Strossmayerovým náměstím směrem od kostela sv. Antonína k západu. Vpravo nárožní dům čp. 978, vlevo nárožní dům čp. 965 na křižovatce s ulicí Janovského v Holešovicích.", "date_label": "31.8.1937", "start_date": "1937-08-31", "end_date": "1937-08-31", "author": "Alexander, Antonín (1892-působnost do 1948)", "note": "", "views": "73x", "geolocation_type": "regional.address"}}, {"type": "Feature", "geometry": {"type": "Point", "coordinates": [14.40739, 50.08615]}, "properties": {"id": "5AFC3A4A04F711E3A4F66C626D41E503", "kind": "pozitiv", "description": "Pohled na renesanční portál domu čp. 490 (palác Metychů z Čečova - Hrzánský) na Velkopřevorském náměstí na Malé Straně - s vyretušovanými německými tabulkami.", "date_label": "1939-1945", "start_date": "1939-01-01", "end_date": "1945-12-31", "author": "Sudek, Josef (1896-1976)", "note": "", "views": "35x", "geolocation_type": "regional.address"}}, {"type": "Feature", "geometry": {"type": "Point", "coordinates": [14.42666, 50.0873]}, "properties": {"id": "5B4F72EEE2B811E4B65C0024BE7CD9AC", "kind": "pozitiv", "description": "Pohled na nároží domu čp. 585 v Celetné ulici na Starém Městě.", "date_label": "1907", "start_date": "1907-01-01", "end_date": "1907-12-31", "author": "Štenc-ateliér", "note": "", "views": "30x", "geolocation_type": "regional.address"}}, {"type": "Feature", "geometry": {"type": "Point", "coordinates": [14.42009, 50.087]}, "properties": {"id": "5BA17BBE90E111E8B3B474D435EEBE90", "kind": "pozitiv", "description": "Pohled na část jižního průčelí Staroměstské radnice s portálem a s orlojem (dům čp. 1 na Starém Městě) na Staroměstském náměstí.", "date_label": "24.3.1910", "start_date": "1910-03-24", "end_date": "1910-03-24", "author": "Kříženecký, Jan (1868-1921)", "note": "", "views": "39x", "geolocation_type": "regional.address"}}, {"type": "Feature", "geometry": {"type": "Point", "coordinates": [14.41406, 50.08641]}, "properties": {"id": "5BC0E60B17D611E891E8406186009F3A", "kind": "pozitiv", "description": "Pohled přes Vltavu na osvětlené památky Starém Městě při příležitosti 10. výročí samostatnosti Československé republiky. V pozadí Národní divadlo (dům čp. 223 na Novém Městě).", "date_label": "28.10.1928", "start_date": "1928-10-28", "end_date": "1928-10-28", "author": "Vopravil, Josef (1902-1972)", "note": "", "views": "51x", "geolocation_type": "regional.address"}}, {"type": "Feature", "geometry": {"type": "Point", "coordinates": [14.40853, 50.07568]}, "properties": {"id": "5BC23046A9D811E881AB406186009F3A", "kind": "pozitiv", "description": "Pohled do Diezenhoferových sadů na Smíchově. V pozadí domy čp. 1113 a 1112, Dienzenhoferův pavilon (dům čp. 74) a Malostranská vodárenská věž.", "date_label": "", "start_date": "", "end_date": "", "author": "Bellmann-ateliér", "note": "", "views": "72x", "geolocation_type": "regional.address"}}, {"type": "Feature", "geometry": {"type": "Point", "coordinates": [14.43549, 50.08356]}, "properties": {"id": "5C67EB5F2F2711E3B673406186009F3A", "kind": "pozitiv", "description": "Celkový pohled na nádraží císaře Františka Josefa I. (dům čp. 300 na Vinohradech) od Vinohrad. V popředí kolejiště s vlaky.", "date_label": "kol.1900", "start_date": "1900-01-01", "end_date": "1900-12-31", "author": "", "note": "", "views": "118x", "geolocation_type": "regional.address"}}, {"type": "Feature", "geometry": {"type": "Point", "coordinates": [14.46155, 50.09545]}, "properties": {"id": "5CCBC150274611E287E86C626D41E503", "kind": "pozitiv", "description": "Pohled na hlavní průčelí Invalidovny v Karlíně (dům čp. 24).", "date_label": "kol.1955", "start_date": "1955-01-01", "end_date": "1955-12-31", "author": "Zeman, Josef", "note": "", "views": "72x", "geolocation_type": "regional.address"}}, {"type": "Feature", "geometry": {"type": "Point", "coordinates": [14.44449, 50.14974]}, "properties": {"id": "5CCE4474DD1511E480FB74D435EEBE90", "kind": "pozitiv", "description": "Pohled na statek čp. 11 (nyní čp. 253) v Dolních Chabrech.", "date_label": "1968", "start_date": "1968-01-01", "end_date": "1968-12-31", "author": "Vopravil, Josef (1902-1972)", "note": "", "views": "46x", "geolocation_type": "regional.address"}}, {"type": "Feature", "geometry": {"type": "Point", "coordinates": [14.42009, 50.087]}, "properties": {"id": "5CE7A20290C111E8B3B474D435EEBE90", "kind": "negativ", "description": "Pohled na část orloje Staroměstské radnice (dům čp. 1 na Starém Městě) na Staroměstském náměstí při opravě.", "date_label": "kol.1910", "start_date": "1910-01-01", "end_date": "1910-12-31", "author": "", "note": "", "views": "23x", "geolocation_type": "regional.address"}}, {"type": "Feature", "geometry": {"type": "Point", "coordinates": [14.41907, 50.06375]}, "properties": {"id": "5D545CA93F8211E2A1026C626D41E503", "kind": "pozitiv", "description": "Pohled na archeologické vykopávky na Vyšehradě - zbytky baziliky sv. Vavřince při domě čp. 14 (staré děkanství) v Soběslavově ulici - ve východním prostoru sklepních místností - západní stěna z části románského oblouku vedoucího původně do severní lodi baziliky.", "date_label": "15.9.1936", "start_date": "1936-09-15", "end_date": "1936-09-15", "author": "Alexander, Antonín (1892-působnost do 1948)", "note": "", "views": "55x", "geolocation_type": "regional.address"}}, {"type": "Feature", "geometry": {"type": "Point", "coordinates": [14.42009, 50.087]}, "properties": {"id": "5D7B8DDE90E211E8B3B474D435EEBE90", "kind": "pozitiv", "description": "Pohled na část jižního průčelí Staroměstské radnice při restaurování orloje (dům čp. 1 na Starém Městě) na Staroměstském náměstí. Dveře na levé straně orloje vedoucí na galerii.", "date_label": "26.9.1911", "start_date": "1911-09-26", "end_date": "1911-09-26", "author": "Kříženecký, Jan (1868-1921)", "note": "", "views": "38x", "geolocation_type": "regional.address"}}, {"type": "Feature", "geometry": {"type": "Point", "coordinates": [14.42478, 50.07677]}, "properties": {"id": "5DED2C1EA41C11E1BEEB000C766D2371", "kind": "negativ", "description": "Pohled do interiéru školy čp. 1286 na Novém Městě ve Štěpánské ulici (obecná škola u sv. Štěpána) - tělocvična.", "date_label": "kol.1890", "start_date": "1890-01-01", "end_date": "1890-12-31", "author": "Eckert, Jindřich (1833-1905)", "note": "", "views": "35x", "geolocation_type": "regional.address"}}, {"type": "Feature", "geometry": {"type": "Point", "coordinates": [14.44237, 50.03563]}, "properties": {"id": "5E10A78B510811E38E526C626D41E503", "kind": "pozitiv", "description": "Pohled na kapli sv. Anny v Dolnokrčské ulici 1 (dům čp. 1908 v Krči).", "date_label": "28.4.1944", "start_date": "1944-04-28", "end_date": "1944-04-28", "author": "Alexander, Antonín (1892-působnost do 1948)", "note": "", "views": "74x", "geolocation_type": "regional.address"}}, {"type": "Feature", "geometry": {"type": "Point", "coordinates": [14.43681, 50.09865]}, "properties": {"id": "5E27874B669211E481D7D4BED94BB14D", "kind": "pozitiv", "description": "Celkový pohled na novostavbu Elektrických podniků hl. m. Prahy v Holešovicích (dům čp. 1477).", "date_label": "31.8.1937", "start_date": "1937-08-31", "end_date": "1937-08-31", "author": "Alexander, Antonín (1892-působnost do 1948)", "note": "", "views": "73x", "geolocation_type": "regional.address"}}, {"type": "Feature", "geometry": {"type": "Point", "coordinates": [14.42825, 50.08762]}, "properties": {"id": "5E6FBD65E83911E4BB7A0024BE7CD9AC", "kind": "pozitiv", "description": "Pohled na horní část kandelábru před domem čp. 1090 (Obecní dům) na Starém Městě.", "date_label": "kol. 1915", "start_date": "", "end_date": "", "author": "Štenc", "note": "", "views": "33x", "geolocation_type": "regional.address"}}, {"type": "Feature", "geometry": {"type": "Point", "coordinates": [14.40131, 50.08733]}, "properties": {"id": "5F168D5A79E211E3B274406186009F3A", "kind": "pozitiv", "description": "Pohled na vrcholně barokní štukovou výzdobu stropu Schönbornského paláce - domu čp. 365 na Malé Straně - detail.", "date_label": "červen 1931", "start_date": "1931-06-01", "end_date": "1931-06-30", "author": "Vojta, Tomáš (1885-1934)", "note": "", "views": "20x", "geolocation_type": "regional.address"}}, {"type": "Feature", "geometry": {"type": "Point", "coordinates": [14.42825, 50.08762]}, "properties": {"id": "5F387E33F25611E4AA40406186009F3A", "kind": "pozitiv", "description": "Pohled do interiéru Obecního domu (dům čp. 1090 na Starém Městě) - Grégrův sál.", "date_label": "kol.1920", "start_date": "1920-01-01", "end_date": "1920-12-31", "author": "", "note": "", "views": "20x", "geolocation_type": "regional.address"}}, {"type": "Feature", "geometry": {"type": "Point", "coordinates": [14.41925, 50.08848]}, "properties": {"id": "5F723365A4D511E1BEEC000C766D2371", "kind": "negativ", "description": "Pohled do interiéru domu čp. 27 na Starém Městě (prelatura kostela sv. Mikuláše) - zimní refektář.", "date_label": "1897", "start_date": "1897-01-01", "end_date": "1897-12-31", "author": "Eckert, Jindřich (1833-1905)", "note": "", "views": "26x", "geolocation_type": "regional.address"}}, {"type": "Feature", "geometry": {"type": "Point", "coordinates": [14.41783, 50.08711]}, "properties": {"id": "6094088b26e04890ac22a12c49f71d1e", "kind": "pozitiv", "description": "Pohled na novostavbu budovy Magistrátu hlavního města Prahy (dům čp. 2) na Mariánském náměstí na Starém Městě směrem k náměstí Franze Kafky - nově osazené sochy na střeše.", "date_label": "1910-1911", "start_date": "1910-01-01", "end_date": "1911-12-31", "author": "", "note": "", "views": "18x", "geolocation_type": "regional.address"}}, {"type": "Feature", "geometry": {"type": "Point", "coordinates": [14.42772, 50.08797]}, "properties": {"id": "60C2CADEB68511DF820F00166F1163D4", "kind": "pozitiv", "description": "Slavnostní otevření Obecního domu po rekonstrukci dne 2.5.1997", "date_label": "2.5.1997", "start_date": "1997-05-02", "end_date": "1997-05-02", "author": "Jelínková, Jana (1951-)", "note": "", "views": "55x", "geolocation_type": "regional.address"}}, {"type": "Feature", "geometry": {"type": "Point", "coordinates": [14.44877, 50.09077]}, "properties": {"id": "61017B9A909E11E2BF26525400E46D25", "kind": "negativ", "description": "Pohled do interiéru karlínské radnice (dům čp. 316) na Karlínském náměstí - zasedací síň.", "date_label": "1896-1897", "start_date": "1896-01-01", "end_date": "1897-12-31", "author": "Eckert, Jindřich (1833-1905)", "note": "", "views": "58x", "geolocation_type": "regional.address"}}, {"type": "Feature", "geometry": {"type": "Point", "coordinates": [14.42009, 50.087]}, "properties": {"id": "612F832F474611E180176C626D41E503", "kind": "pozitiv", "description": "Pohled na část jižního a východního průčelí Staroměstské radnice s arkýřem (dům čp. 1 na Starém Městě).", "date_label": "kol.1895", "start_date": "1895-01-01", "end_date": "1895-12-31", "author": "", "note": "", "views": "38x", "geolocation_type": "regional.address"}}, {"type": "Feature", "geometry": {"type": "Point", "coordinates": [14.41521, 50.09017]}, "properties": {"id": "613318BE474911E180176C626D41E503", "kind": "pozitiv", "description": "Celkový pohled přes Vltavu na Rudolfinum (dům čp. 79 na Starém Městě) krátce po dostavení roku 1881. Vpravo dům původní zástavby.", "date_label": "kol.1885", "start_date": "1885-01-01", "end_date": "1885-12-31", "author": "Fridrich, František (1829-1892)", "note": "", "views": "53x", "geolocation_type": "regional.address"}}, {"type": "Feature", "geometry": {"type": "Point", "coordinates": [14.40131, 50.08733]}, "properties": {"id": "61C7B5B979E011E3B274406186009F3A", "kind": "pozitiv", "description": "Pohled na vrcholně barokní štukový strop Schönbornského paláce - domu čp. 365 na Malé Straně.", "date_label": "červen 1931", "start_date": "1931-06-01", "end_date": "1931-06-30", "author": "Vojta, Tomáš (1885-1934)", "note": "", "views": "20x", "geolocation_type": "regional.address"}}, {"type": "Feature", "geometry": {"type": "Point", "coordinates": [14.65189, 50.17156]}, "properties": {"id": "621FB8B0289A11E6BCEA406186009F3A", "kind": "pozitiv", "description": "Pohled do Platnéřské ulice s domy čp. 84, 1042 a 85 vpravo a s klášterem křižovníků (dům čp. 109 na Starém Městě) vlevo. V pozadí chrám sv. Víta na Pražském hradě.", "date_label": "1900-1905", "start_date": "1900-01-01", "end_date": "1905-12-31", "author": "Fink, František (1854-1935)", "note": "", "views": "44x", "geolocation_type": "regional.address"}}, {"type": "Feature", "geometry": {"type": "Point", "coordinates": [14.40284, 50.08938]}, "properties": {"id": "627DF6697C2811E2BF19525400E46D25", "kind": "negativ", "description": "Pohled do interiéru Thunovského paláce (dům čp. 180) na Malé Straně - salon hraběnky Thunové.", "date_label": "1905", "start_date": "1905-01-01", "end_date": "1905-12-31", "author": "Eckert-ateliér", "note": "", "views": "25x", "geolocation_type": "regional.address"}}, {"type": "Feature", "geometry": {"type": "Point", "coordinates": [14.42009, 50.087]}, "properties": {"id": "6286E655124111E8A338406186009F3A", "kind": "pozitiv", "description": "Pohled na osvětlenou Staroměstskou radnici při příležitosti 10. výročí samostatnosti Československé republiky.", "date_label": "28.10.1928", "start_date": "1928-10-28", "end_date": "1928-10-28", "author": "Vopravil, Josef (1902-1972)", "note": "", "views": "48x", "geolocation_type": "regional.address"}}, {"type": "Feature", "geometry": {"type": "Point", "coordinates": [14.42604, 50.07718]}, "properties": {"id": "628DF6C6712E11E2BF15525400E46D25", "kind": "negativ", "description": "Pohled do zahrady \"Valdštejnské útulny pro ošetřovatelky od červeného kříže\" (dům čp. 569 na Novém Městě) v Žitné ulici.", "date_label": "11.2.1904", "start_date": "1904-02-11", "end_date": "1904-02-11", "author": "Eckert, Jindřich (1833-1905)", "note": "", "views": "18x", "geolocation_type": "regional.address"}}, {"type": "Feature", "geometry": {"type": "Point", "coordinates": [14.4049, 50.08346]}, "properties": {"id": "62984435801D11E2BF1B525400E46D25", "kind": "negativ", "description": "Pohled na budovy v areálu zbrojnice a kasáren - dům čp. 450 na Malé Straně (Michnův palác, Tyršův dům).", "date_label": "kol.1890", "start_date": "1890-01-01", "end_date": "1890-12-31", "author": "Eckert, Jindřich (1833-1905)", "note": "", "views": "30x", "geolocation_type": "regional.address"}}, {"type": "Feature", "geometry": {"type": "Point", "coordinates": [14.42009, 50.087]}, "properties": {"id": "62B022712DAB11E89EFE74D435EEBE90", "kind": "negativ", "description": "Celkový pohled na jižní a východní průčelí Staroměstské radnice (dům čp. 1 na Starém Městě).", "date_label": "kol.1925", "start_date": "1925-01-01", "end_date": "1925-12-31", "author": "Vojta, Tomáš (1885-1934)", "note": "", "views": "27x", "geolocation_type": "regional.address"}}, {"type": "Feature", "geometry": {"type": "Point", "coordinates": [14.42601, 50.07543]}, "properties": {"id": "62CC07AB87E911E2BF21525400E46D25", "kind": "negativ", "description": "Pohled do interiéru školy čp. 517 v Ječné ulici na Novém Městě (česká státní reálka) - chodba.", "date_label": "kol.1890", "start_date": "1890-01-01", "end_date": "1890-12-31", "author": "Eckert, Jindřich (1833-1905)", "note": "", "views": "45x", "geolocation_type": "regional.address"}}, {"type": "Feature", "geometry": {"type": "Point", "coordinates": [14.43287, 50.09886]}, "properties": {"id": "62D1928F698211E49A11406186009F3A", "kind": "pozitiv", "description": "Pohled do Belcrediho třídy (dnes ulice Milady Horákové) od křižovatky se Strossmayerovým náměstím směrem od kostela sv. Antonína k západu. Vpravo nárožní dům čp. 691, vlevo nárožní dům čp. 476 v Holešovicích.", "date_label": "31.8.1937", "start_date": "1937-08-31", "end_date": "1937-08-31", "author": "Alexander, Antonín (1892-působnost do 1948)", "note": "", "views": "104x", "geolocation_type": "regional.address"}}, {"type": "Feature", "geometry": {"type": "Point", "coordinates": [14.42313, 50.08715]}, "properties": {"id": "63f9ca2c8e9a47639c94d033fdfcb05b", "kind": "pozitiv černobílý", "description": "Pohled na zadní trakty domů čp. 564, čp. 563, čp. 562 na Starém Městě v Celetné ulici po odbourání.", "date_label": "3.3.1948", "start_date": "1948-03-03", "end_date": "1948-03-03", "author": "", "note": "", "views": "28x", "geolocation_type": "regional.address"}}, {"type": "Feature", "geometry": {"type": "Point", "coordinates": [14.40526, 50.09394]}, "properties": {"id": "63FBAC2ADB5E11DFBD5E000C766D2371", "kind": "pozitiv", "description": "Pohled na část Karlova mostu. V pozadí část Pražského hradu a Belveder (Letohrádek královny Anny) - dům čp. 52 na Hradčanech - pravá část pohledu.", "date_label": "1890", "start_date": "1890-01-01", "end_date": "1890-12-31", "author": "Eckert, Jindřich (1833-1905)", "note": "", "views": "37x", "geolocation_type": "regional.address"}}, {"type": "Feature", "geometry": {"type": "Point", "coordinates": [14.37685, 50.10006]}, "properties": {"id": "643E54997F8611E4A56A406186009F3A", "kind": "pozitiv", "description": "Pohled na zadní průčelí stodoly (čp. 11?) usedlosti Hadovka (čp. 10) v Dejvicích.", "date_label": "březen 1959", "start_date": "1959-03-01", "end_date": "1959-03-31", "author": "Hnilička, Eduard (1887-1967)", "note": "", "views": "63x", "geolocation_type": "regional.address"}}, {"type": "Feature", "geometry": {"type": "Point", "coordinates": [14.42313, 50.08715]}, "properties": {"id": "6476cea32fd94fae9a6e0e8099325e03", "kind": "pozitiv černobílý", "description": "Pohled na zadní trakt domu čp. 564 na Starém Městě v Celetné ulici po odbourání.", "date_label": "27.12.1948", "start_date": "1948-12-27", "end_date": "1948-12-27", "author": "", "note": "", "views": "29x", "geolocation_type": "regional.address"}}, {"type": "Feature", "geometry": {"type": "Point", "coordinates": [14.41873, 50.08783]}, "properties": {"id": "64883D74808811E4AAB4406186009F3A", "kind": "pozitiv", "description": "Pohled na zbytky románského zdiva nalezeného při bourání domu čp. 16 na Starém Městě (Andělská kolej) v Mikulášské ulici (dnes náměstí Franze Kafky) .", "date_label": "1909", "start_date": "1909-01-01", "end_date": "1909-12-31", "author": "Kříženecký, Jan (1868-1921)", "note": "", "views": "41x", "geolocation_type": "regional.address"}}, {"type": "Feature", "geometry": {"type": "Point", "coordinates": [14.41873, 50.08783]}, "properties": {"id": "648C3B00808711E4AAB4406186009F3A", "kind": "pozitiv", "description": "Pohled na zbytky románského zdiva nalezeného při bourání domu čp. 16 na Starém Městě (Andělská kolej) v Mikulášské ulici (dnes náměstí Franze Kafky) .", "date_label": "23.3.1909", "start_date": "1909-03-23", "end_date": "1909-03-23", "author": "Kříženecký, Jan (1868-1921)", "note": "", "views": "70x", "geolocation_type": "regional.address"}}, {"type": "Feature", "geometry": {"type": "Point", "coordinates": [14.43582, 50.06004]}, "properties": {"id": "64C0794C6BB711E2AB7F6C626D41E503", "kind": "pozitiv", "description": "Pohled na dům čp. 122 v Táborské ulici (Božetěchova) v Nuslích.", "date_label": "kol.1940", "start_date": "1940-01-01", "end_date": "1940-12-31", "author": "", "note": "", "views": "81x", "geolocation_type": "regional.address"}}, {"type": "Feature", "geometry": {"type": "Point", "coordinates": [14.40444, 50.08544]}, "properties": {"id": "64DE16608D6711E2BF25525400E46D25", "kind": "negativ", "description": "Pohled do interiéru domu čp. 386 na Malé Straně (Rohanský palác) - sál s exponáty při výstavě parohů.", "date_label": "1893", "start_date": "1893-01-01", "end_date": "1893-12-31", "author": "Eckert, Jindřich (1833-1905)", "note": "", "views": "33x", "geolocation_type": "regional.address"}}, {"type": "Feature", "geometry": {"type": "Point", "coordinates": [14.40131, 50.08733]}, "properties": {"id": "652AE51679F911E3B274406186009F3A", "kind": "pozitiv", "description": "Dveře v interiéru Schönbornského paláce - domu čp. 365 na Malé Straně.", "date_label": "červen 1931", "start_date": "1931-06-01", "end_date": "1931-06-30", "author": "Vojta, Tomáš (1885-1934)", "note": "", "views": "24x", "geolocation_type": "regional.address"}}, {"type": "Feature", "geometry": {"type": "Point", "coordinates": [14.42477, 50.08301]}, "properties": {"id": "6568FB5CF5FD11E3BAAD406186009F3A", "kind": "negativ", "description": "Celkový pohled na dům čp. 781 na Václavském náměstí. Vlevo část domu čp. 782, vpravo čp. 780 na Novém Městě.", "date_label": "", "start_date": "", "end_date": "", "author": "", "note": "", "views": "71x", "geolocation_type": "regional.address"}}, {"type": "Feature", "geometry": {"type": "Point", "coordinates": [14.42804, 50.08142]}, "properties": {"id": "65C8A87E81D911E3B4B96C626D41E503", "kind": "pozitiv", "description": "Celkový pohled na dům čp. 820 (Národní dům) na Vinohradech - průčelí na náměstí Míru.", "date_label": "26.7.1931", "start_date": "1931-07-26", "end_date": "1931-07-26", "author": "Alexander, Antonín (1892-působnost do 1948)", "note": "", "views": "57x", "geolocation_type": "regional.address"}}, {"type": "Feature", "geometry": {"type": "Point", "coordinates": [14.43056, 50.07918]}, "properties": {"id": "66633BB4475511E180176C626D41E503", "kind": "pozitiv", "description": "Pohled na rampu a část Národního muzea na Václavském náměstí (dům čp. 1700 na Novém Městě).", "date_label": "kol.1905", "start_date": "1905-01-01", "end_date": "1905-12-31", "author": "", "note": "", "views": "49x", "geolocation_type": "regional.address"}}, {"type": "Feature", "geometry": {"type": "Point", "coordinates": [14.42009, 50.087]}, "properties": {"id": "667FE2ED90E811E8B3B474D435EEBE90", "kind": "pozitiv", "description": "Pohled na astronomický ciferník ve střední části orloje v jižním průčelí Staroměstské radnice (dům čp. 1 na Starém Městě) na Staroměstském náměstí při restaurování. Detail horní části ciferníku.", "date_label": "26.9.1911", "start_date": "1911-09-26", "end_date": "1911-09-26", "author": "Kříženecký, Jan (1868-1921)", "note": "", "views": "34x", "geolocation_type": "regional.address"}}, {"type": "Feature", "geometry": {"type": "Point", "coordinates": [14.42048, 50.08805]}, "properties": {"id": "6770AD3DC32511E998F074D435EEBE90", "kind": "pozitiv", "description": "Pohled na model sochy (autor Vilém Amort) pro výzdobu domu čp. 934 na Staroměstském náměstí (Schierův - podle stavitele Franze Schiera).", "date_label": "19.7.1897", "start_date": "1897-07-19", "end_date": "1897-07-19", "author": "Mulač, Jan", "note": "", "views": "35x", "geolocation_type": "regional.address"}}, {"type": "Feature", "geometry": {"type": "Point", "coordinates": [14.42276, 50.07944]}, "properties": {"id": "67A98772718111E59BDB406186009F3A", "kind": "pozitiv", "description": "Pohled do dvora domu čp. 681 s průjezdem do Vodičkovy ulice na Novém Městě.", "date_label": "kol. 1919", "start_date": "", "end_date": "", "author": "", "note": "", "views": "42x", "geolocation_type": "regional.address"}}, {"type": "Feature", "geometry": {"type": "Point", "coordinates": [14.42292, 50.08805]}, "properties": {"id": "67ADDA90627B11E8B80B74D435EEBE90", "kind": "pozitiv", "description": "Pohled ze Štupartské ulice na východní stranu kostela P. Marie před Týnem na Starém Městě. Vpravo Týnská ulička s domem čp. 627 na Starém městě.", "date_label": "", "start_date": "", "end_date": "", "author": "", "note": "", "views": "35x", "geolocation_type": "regional.address"}}, {"type": "Feature", "geometry": {"type": "Point", "coordinates": [14.42156, 50.078]}, "properties": {"id": "681417137C4311E2BF19525400E46D25", "kind": "negativ", "description": "Pohled do interiéru domu čp. 671 na Karlově náměstí na Novém Městě (Salmovský palác) - salon.", "date_label": "kol.1900", "start_date": "1900-01-01", "end_date": "1900-12-31", "author": "Eckert, Jindřich (1833-1905)", "note": "", "views": "18x", "geolocation_type": "regional.address"}}, {"type": "Feature", "geometry": {"type": "Point", "coordinates": [14.40131, 50.08733]}, "properties": {"id": "681794F77C7211E3BFE4406186009F3A", "kind": "pozitiv", "description": "Kamna v interiéru Schönbornského paláce - domu čp. 365 na Malé Straně.", "date_label": "červen 1931", "start_date": "1931-06-01", "end_date": "1931-06-30", "author": "Vojta, Tomáš (1885-1934)", "note": "", "views": "21x", "geolocation_type": "regional.address"}}, {"type": "Feature", "geometry": {"type": "Point", "coordinates": [14.44983, 50.01797]}, "properties": {"id": "68B71EE629F111E9980E74D435EEBE90", "kind": "negativ", "description": "Celkový pohled na hlavní obytnou budovu statku čp. 101 (Nové Dvory) v ulici U Nového dvora (dnes Durychova) ve Lhotce při bourání - od východu. V popředí skleníky.", "date_label": "červen 1953", "start_date": "1953-06-01", "end_date": "1953-06-30", "author": "", "note": "", "views": "42x", "geolocation_type": "regional.address"}}, {"type": "Feature", "geometry": {"type": "Point", "coordinates": [14.41347, 50.08126]}, "properties": {"id": "68F41F3F1F5511E2AA75406186009F3A", "kind": "pozitiv", "description": "Celkový pohled na Národní divadlo (dům čp. 223 na Novém Městě) z mostu Legií.", "date_label": "kol.1960", "start_date": "1960-01-01", "end_date": "1960-12-31", "author": "", "note": "", "views": "68x", "geolocation_type": "regional.address"}}, {"type": "Feature", "geometry": {"type": "Point", "coordinates": [14.41724, 50.08595]}, "properties": {"id": "69C1C705A4B911E1BEEC000C766D2371", "kind": "negativ", "description": "Pohled do interiéru domu čp. 223 (Svatováclavská záložna) v Karlově ulici na Starém Městě - jídelna.", "date_label": "kol.1890", "start_date": "1890-01-01", "end_date": "1890-12-31", "author": "Eckert, Jindřich (1833-1905)", "note": "", "views": "38x", "geolocation_type": "regional.address"}}, {"type": "Feature", "geometry": {"type": "Point", "coordinates": [14.43681, 50.09865]}, "properties": {"id": "69D9DF3CE69C11E89E7C74D435EEBE90", "kind": "pozitiv", "description": "Pohled z výšky na severní předmostí Hlávkova mostu v Holešovicích v popředí Bubenské nábřeží, v pozadí nábřeží Kpt. Jaroše. V pozadí uprostřed dům čp. 1477 (budova Elektrických podniků hl. m. Prahy).", "date_label": "1982", "start_date": "1982-01-01", "end_date": "1982-12-31", "author": "Jelínková, Jana (1951-)", "note": "", "views": "73x", "geolocation_type": "regional.address"}}, {"type": "Feature", "geometry": {"type": "Point", "coordinates": [14.39661, 50.08857]}, "properties": {"id": "69E0F91A67EE11E89C5974D435EEBE90", "kind": "negativ", "description": "Pohled na Radnické schody z ulice Ke Hradu. Vlevo nároží domu čp. 171 na Hradčanech.", "date_label": "17.3.1908", "start_date": "1908-03-17", "end_date": "1908-03-17", "author": "Kříženecký, Jan (1868-1921)", "note": "", "views": "24x", "geolocation_type": "regional.address"}}, {"type": "Feature", "geometry": {"type": "Point", "coordinates": [14.43637, 50.10853]}, "properties": {"id": "6A0A54A08D5F11E2BF25525400E46D25", "kind": "negativ", "description": "Pohled do interiéru ústřední elektrárny v Holešovicích (dům čp. 1) - \"Křižíkův elektrický stroj\".", "date_label": "13.9.1904", "start_date": "1904-09-13", "end_date": "1904-09-13", "author": "Eckert, Jindřich (1833-1905)", "note": "", "views": "34x", "geolocation_type": "regional.address"}}, {"type": "Feature", "geometry": {"type": "Point", "coordinates": [14.41045, 50.12074]}, "properties": {"id": "6a636fe9d05f4097948f5797b32780e9", "kind": "pozitiv", "description": "Pohled na usedlost Salabka (dům čp. 57 v Troji) v dnešní ulici K Bohnicím.", "date_label": "5.6.1959", "start_date": "1959-06-05", "end_date": "1959-06-05", "author": "Hnilička, Eduard (1887-1967)", "note": "", "views": "15x", "geolocation_type": "regional.address"}}, {"type": "Feature", "geometry": {"type": "Point", "coordinates": [14.39151, 50.08925]}, "properties": {"id": "6AA9060F748511E4A81F406186009F3A", "kind": "pozitiv", "description": "Pohled do zahrady domu čp. 180 na Hradčanech (bývalý Trautmannsdorfský palác). V pozadí věže Lorety.", "date_label": "před 1926", "start_date": "1800-01-01", "end_date": "1925-12-31", "author": "Vojta, Tomáš (1885-1934)", "note": "", "views": "23x", "geolocation_type": "regional.address"}}, {"type": "Feature", "geometry": {"type": "Point", "coordinates": [14.42678, 50.08486]}, "properties": {"id": "6B1997F87F7E11E88359406186009F3A", "kind": "negativ", "description": "Pohřební průvod legionářů popravených během 1. světové války. V pozadí domy čp. (zprava) 856, 857, 858 a 859 v ulici Na Příkopě na Novém Městě.", "date_label": "24.4.1921", "start_date": "1921-04-24", "end_date": "1921-04-24", "author": "Reach, Zikmund (1859-1935)", "note": "", "views": "42x", "geolocation_type": "regional.address"}}, {"type": "Feature", "geometry": {"type": "Point", "coordinates": [14.41889, 50.086]}, "properties": {"id": "6B61A75E157411E39CC26C626D41E503", "kind": "pozitiv", "description": "Pohled do Jilské ulice od křižovatky s Jalovcovou ulicí. Vlevo část nárožního domu čp. 147, vpravo domy čp. 452 a 453 na Starém Městě.", "date_label": "27.3.1936", "start_date": "1936-03-27", "end_date": "1936-03-27", "author": "Alexander, Antonín (1892-působnost do 1948)", "note": "", "views": "32x", "geolocation_type": "regional.address"}}, {"type": "Feature", "geometry": {"type": "Point", "coordinates": [14.42009, 50.087]}, "properties": {"id": "6B69638290C211E8B3B474D435EEBE90", "kind": "negativ", "description": "Pohled na část jižního průčelí Staroměstské radnice s portálem a s orlojem (dům čp. 1 na Starém Městě) na Staroměstském náměstí.", "date_label": "", "start_date": "", "end_date": "", "author": "", "note": "", "views": "24x", "geolocation_type": "regional.address"}}, {"type": "Feature", "geometry": {"type": "Point", "coordinates": [14.40258, 50.02336]}, "properties": {"id": "6BAB7FA9D19711E69F29406186009F3A", "kind": "pozitiv", "description": "Pohled na dům čp. 7 v ulici V Náklích v Hodkovičkách.", "date_label": "22.8.1959", "start_date": "1959-08-22", "end_date": "1959-08-22", "author": "Hnilička, Eduard (1887-1967)", "note": "", "views": "28x", "geolocation_type": "regional.address"}}, {"type": "Feature", "geometry": {"type": "Point", "coordinates": [14.40402, 50.07705]}, "properties": {"id": "6BC153DFDFBD11E5A81274D435EEBE90", "kind": "pozitiv", "description": "Pohled na dům čp. 268 na nároží ulic Štefánikovy a vlevo Havlíčkovy (dnešní Zubatého) na Smíchově.", "date_label": "16.9.1934", "start_date": "1934-09-16", "end_date": "1934-09-16", "author": "Alexander, Antonín (1892-působnost do 1948)", "note": "", "views": "60x", "geolocation_type": "regional.address"}}, {"type": "Feature", "geometry": {"type": "Point", "coordinates": [14.68942, 49.99028]}, "properties": {"id": "6BE3F64B8AFE11E2BF22525400E46D25", "kind": "negativ", "description": "Pohled do interiéru vychovatelny manželů Olivových v Říčanech (dnes Olivova dětská léčebna) - třída.", "date_label": "kol.1900", "start_date": "1900-01-01", "end_date": "1900-12-31", "author": "Eckert, Jindřich (1833-1905)", "note": "", "views": "14x", "geolocation_type": "regional.address"}}, {"type": "Feature", "geometry": {"type": "Point", "coordinates": [14.43056, 50.07918]}, "properties": {"id": "6BF79F5DD85611E89C7B74D435EEBE90", "kind": "pozitiv", "description": "Průhled Václavským náměstím od Můstku. V pozadí Národní muzeum (dům čp. 1700 na Novém Městě). Po obou stranách domy náměstí.", "date_label": "1901-1902", "start_date": "1901-01-01", "end_date": "1902-12-31", "author": "Bellmann-ateliér", "note": "", "views": "53x", "geolocation_type": "regional.address"}}, {"type": "Feature", "geometry": {"type": "Point", "coordinates": [14.42009, 50.087]}, "properties": {"id": "6C10644290C311E8B3B474D435EEBE90", "kind": "negativ", "description": "Pohled na část jižního průčelí Staroměstské radnice s orlojem (dům čp. 1 na Starém Městě) na Staroměstském náměstí. V popředí stanice tramvaje č. 5.", "date_label": "", "start_date": "", "end_date": "", "author": "", "note": "", "views": "38x", "geolocation_type": "regional.address"}}, {"type": "Feature", "geometry": {"type": "Point", "coordinates": [14.41833, 50.08448]}, "properties": {"id": "6C4F95CDECE711DFBD7B000C766D2371", "kind": "pozitiv", "description": "Pohled do Jilské ulice k jihu. Vpravo dům čp. 352 (\"U Sladkých\") na Starém Městě.", "date_label": "26.3.1945", "start_date": "1945-03-26", "end_date": "1945-03-26", "author": "Alexander, Antonín (1892-působnost do 1948)", "note": "", "views": "24x", "geolocation_type": "regional.address"}}, {"type": "Feature", "geometry": {"type": "Point", "coordinates": [14.37685, 50.10006]}, "properties": {"id": "6C6448A5611311E4B88BD4BED94BB14D", "kind": "pozitiv", "description": "Pohled na usedlost Hadovka (dům čp. 10) v Dejvicích z protějšího svahu. V popředí dům čp. 168.", "date_label": "26.5.1924", "start_date": "1924-05-26", "end_date": "1924-05-26", "author": "Fink, František (1854-1935)", "note": "", "views": "75x", "geolocation_type": "regional.address"}}, {"type": "Feature", "geometry": {"type": "Point", "coordinates": [14.40213, 50.08817]}, "properties": {"id": "6C76137D46DC11E3927D6C626D41E503", "kind": "negativ", "description": "Pohled na shromáždění na horním Malostranském náměstí před zemským vojenským velitelstvím v Lichtenštejnském paláci (dům čp. 258 na Malé Straně) při příležitosti oslav vítězství rakouských vojsk v Haliči.", "date_label": "1915", "start_date": "1915-01-01", "end_date": "1915-12-31", "author": "Reach, Zikmund (1859-1935)", "note": "", "views": "30x", "geolocation_type": "regional.address"}}, {"type": "Feature", "geometry": {"type": "Point", "coordinates": [14.41833, 50.08561]}, "properties": {"id": "6C7B76EC636511E492496C626D41E503", "kind": "negativ", "description": "Průhled Řetězovou ulicí. Uprostřed v pozadí dům čp. 232 v Husově ulici na Starém Městě.", "date_label": "kol.1915", "start_date": "1915-01-01", "end_date": "1915-12-31", "author": "", "note": "", "views": "74x", "geolocation_type": "regional.address"}}, {"type": "Feature", "geometry": {"type": "Point", "coordinates": [14.42009, 50.087]}, "properties": {"id": "6CB3E22290C111E8B3B474D435EEBE90", "kind": "negativ", "description": "Pohled na část orloje Staroměstské radnice (dům čp. 1 na Starém Městě) na Staroměstském náměstí při opravě.", "date_label": "kol.1910", "start_date": "1910-01-01", "end_date": "1910-12-31", "author": "", "note": "", "views": "23x", "geolocation_type": "regional.address"}}, {"type": "Feature", "geometry": {"type": "Point", "coordinates": [14.41724, 50.08595]}, "properties": {"id": "6CCB4184923311E2BF28525400E46D25", "kind": "negativ", "description": "Pohled do interiéru domu čp. 223 (Svatováclavská záložna) v Karlově ulici na Starém Městě - salon.", "date_label": "kol.1890", "start_date": "1890-01-01", "end_date": "1890-12-31", "author": "Eckert, Jindřich (1833-1905)", "note": "", "views": "30x", "geolocation_type": "regional.address"}}, {"type": "Feature", "geometry": {"type": "Point", "coordinates": [14.42112, 50.08823]}, "properties": {"id": "6D7C8B416A2E11E2BF13525400E46D25", "kind": "negativ", "description": "Pohled do dvora domu čp. 932 na Staroměstském náměstí k jihu před zbořením roku 1899.", "date_label": "1898-1899", "start_date": "1898-01-01", "end_date": "1899-12-31", "author": "Eckert, Jindřich (1833-1905)", "note": "", "views": "14x", "geolocation_type": "regional.address"}}, {"type": "Feature", "geometry": {"type": "Point", "coordinates": [14.42678, 50.08486]}, "properties": {"id": "6D8E2A2746DB11E3927D6C626D41E503", "kind": "negativ", "description": "Pohřební průvod legionářů popravených během 1. světové války. V pozadí domy čp. (zprava) 856, 857, 858 a 859 v ulici Na Příkopě na Novém Městě.", "date_label": "24.4.1921", "start_date": "1921-04-24", "end_date": "1921-04-24", "author": "Reach, Zikmund (1859-1935)", "note": "", "views": "52x", "geolocation_type": "regional.address"}}, {"type": "Feature", "geometry": {"type": "Point", "coordinates": [14.42142, 50.02285]}, "properties": {"id": "6DACDC8DD1B411E69F29406186009F3A", "kind": "pozitiv", "description": "Pohled na dům čp. 86 v ulici Havlovického v Hodkovičkách.", "date_label": "", "start_date": "", "end_date": "", "author": "", "note": "", "views": "26x", "geolocation_type": "regional.address"}}, {"type": "Feature", "geometry": {"type": "Point", "coordinates": [14.43235, 50.09781]}, "properties": {"id": "6DAD5E4BC3E211E480AC74D435EEBE90", "kind": "pozitiv", "description": "Pohled do dvora domu čp. 360 v Holešovicích (továrna firmy Novák a Jahn) - od Kostelní k Belcrediho ulici.", "date_label": "1932", "start_date": "1932-01-01", "end_date": "1932-12-31", "author": "", "note": "", "views": "100x", "geolocation_type": "regional.address"}}, {"type": "Feature", "geometry": {"type": "Point", "coordinates": [14.43127, 50.08145]}, "properties": {"id": "6E36CE5ED1AC11E18F8C6C626D41E503", "kind": "pozitiv", "description": "Okupace 1939-1945 - pohled na část Petschkova paláce (dům čp. 931) v Bredovské ulici (dnes Politických vězňů) na Novém Městě v době okupace (sídlo hlavního velitelství pražského gestapa).", "date_label": "1939-1945", "start_date": "1939-01-01", "end_date": "1945-12-31", "author": "", "note": "", "views": "89x", "geolocation_type": "regional.address"}}, {"type": "Feature", "geometry": {"type": "Point", "coordinates": [14.38967, 50.08671]}, "properties": {"id": "6E6F63C36B9D11E2AB7F6C626D41E503", "kind": "pozitiv", "description": "Pohled do velkého sálu knihovny Strahovského kláštera - dům čp. 132 na Hradčanech.", "date_label": "9.8.1906", "start_date": "1906-08-09", "end_date": "1906-08-09", "author": "Eckert-ateliér", "note": "", "views": "19x", "geolocation_type": "regional.address"}}, {"type": "Feature", "geometry": {"type": "Point", "coordinates": [14.39375, 50.08878]}, "properties": {"id": "6E96B740748911E4A81F406186009F3A", "kind": "pozitiv", "description": "Pohled do zahrady domu čp. 180 na Hradčanech (bývalý Trautmannsdorfský palác) - \"práce na výkopu válečného vodního bazénu\". V pozadí vpravo část kaple paláce.", "date_label": "5.6.1944", "start_date": "1944-06-05", "end_date": "1944-06-05", "author": "Alexander, Antonín (1892-působnost do 1948)", "note": "", "views": "26x", "geolocation_type": "regional.address"}}, {"type": "Feature", "geometry": {"type": "Point", "coordinates": [14.43056, 50.07918]}, "properties": {"id": "6EA95E1C123D11E8A338406186009F3A", "kind": "pozitiv", "description": "Pohled na manifestaci při zestátnění průmyslu před Národním muzeem (dům čp. 1700 na Novém Městě).", "date_label": "25.10.1945", "start_date": "1945-10-25", "end_date": "1945-10-25", "author": "", "note": "", "views": "44x", "geolocation_type": "regional.address"}}, {"type": "Feature", "geometry": {"type": "Point", "coordinates": [14.41987, 50.10017]}, "properties": {"id": "6EC7701887D911E79100406186009F3A", "kind": "pozitiv", "description": "Nástup ženských oddílů během VII. všesokolského sletu na Letné v Holešovicích. V pozadí Letenská vodárenská věž.", "date_label": "27.-30.6.1920", "start_date": "", "end_date": "", "author": "Vojta, Tomáš (1885-1934)", "note": "", "views": "92x", "geolocation_type": "regional.address"}}, {"type": "Feature", "geometry": {"type": "Point", "coordinates": [14.42009, 50.087]}, "properties": {"id": "6ECDB6E290C011E8B3B474D435EEBE90", "kind": "negativ", "description": "Pohled na kalendářní desku Josefa Mánesa na orloji Staroměstské radnice (dům čp. 1 na Starém Městě) na Staroměstském náměstí.", "date_label": "", "start_date": "", "end_date": "", "author": "", "note": "", "views": "26x", "geolocation_type": "regional.address"}}, {"type": "Feature", "geometry": {"type": "Point", "coordinates": [14.40696, 50.09058]}, "properties": {"id": "6ED5EBC33DCA11EABE1574D435EEBE90", "kind": "negativ", "description": "Pohled na Malou Stranu od Pražského hradu. Uprostřed v zahradě dům čp. 153 (Fürstenberský palác), za ním dům čp. 17 (Valdštejnský palác). V pozadí Mánesův most a za Vltavou Staré Město.", "date_label": "", "start_date": "", "end_date": "", "author": "", "note": "", "views": "25x", "geolocation_type": "regional.address"}}, {"type": "Feature", "geometry": {"type": "Point", "coordinates": [14.41883, 50.06985]}, "properties": {"id": "6EFE7CFE18D711E9AFD5406186009F3A", "kind": "pozitiv", "description": "Pohled do interiéru chudobince u sv. Bartoloměje ve Vyšehradské ulici (dům čp. 427 na Novém Městě) - ženské ložnice.", "date_label": "1921", "start_date": "1921-01-01", "end_date": "1921-12-31", "author": "", "note": "", "views": "63x", "geolocation_type": "regional.address"}}, {"type": "Feature", "geometry": {"type": "Point", "coordinates": [14.41783, 50.08711]}, "properties": {"id": "6f1c1d118c35486c990baba828c9ea59", "kind": "pozitiv", "description": "Pohled na stavbu budovy Magistrátu hlavního města Prahy (dům čp. 2) na Mariánském náměstí na Starém Městě. V pozadí věž Staroměstské radnice.", "date_label": "", "start_date": "", "end_date": "", "author": "", "note": "", "views": "8x", "geolocation_type": "regional.address"}}, {"type": "Feature", "geometry": {"type": "Point", "coordinates": [14.49504, 50.12775]}, "properties": {"id": "6F4DE19D1C0B11E6A449406186009F3A", "kind": "pozitiv", "description": "Pohled na mateřskou školu na konci Šluknovské ulice v nitrobloku sídliště (dům čp. 328 na Střížkově).", "date_label": "po 1970", "start_date": "1971-01-01", "end_date": "2000-12-31", "author": "Jelínková, Jana (1951-)", "note": "", "views": "73x", "geolocation_type": "regional.address"}}, {"type": "Feature", "geometry": {"type": "Point", "coordinates": [14.39607, 50.07488]}, "properties": {"id": "6F8F011CE22F11E6A537406186009F3A", "kind": "pozitiv", "description": "Celkový pohled na dům čp. 106 (bývalé opatství benediktinek beuronské kongregace) s kostelem sv. Gabriela (rovněž kostel Zvěstování P. Marie) v Holečkově ulici na Smíchově.", "date_label": "", "start_date": "", "end_date": "", "author": "", "note": "", "views": "63x", "geolocation_type": "regional.address"}}, {"type": "Feature", "geometry": {"type": "Point", "coordinates": [14.41905, 50.0855]}, "properties": {"id": "6F900405F8A711E4808074D435EEBE90", "kind": "negativ", "description": "Pohled do Husovy ulice s dominikánským klášterem (dům čp. 234) a kostelem sv. Jiljí. Vpravo nárožní dům čp. 243 na Starém Městě.", "date_label": "kol.1925", "start_date": "1925-01-01", "end_date": "1925-12-31", "author": "Eckert-ateliér", "note": "", "views": "40x", "geolocation_type": "regional.address"}}, {"type": "Feature", "geometry": {"type": "Point", "coordinates": [14.42767, 50.08708]}, "properties": {"id": "6F9368CD225911EABE1474D435EEBE90", "kind": "pozitiv", "description": "Průhled ulicí Na Příkopě od Hybernského kláštera. Vpravo Prašná brána a dům čp. 969 na Starém Městě.", "date_label": "po 1870", "start_date": "1871-01-01", "end_date": "2000-12-31", "author": "anonym", "note": "", "views": "69x", "geolocation_type": "regional.address"}}, {"type": "Feature", "geometry": {"type": "Point", "coordinates": [14.43554, 50.09229]}, "properties": {"id": "708C28E753D911E6A54D000C76270B94", "kind": "pozitiv", "description": "Pohled na šroubová stavidla u Kubešova mlýnu v Helmovských mlýnech (dům čp. 1220 na Novém Městě). V pozadí dům čp. 1219 (dnes rozdělený dům čp. 1219 a 1746) a 1443 v Klimentské ulici na Novém Městě.", "date_label": "8.3.1909", "start_date": "1909-03-08", "end_date": "1909-03-08", "author": "", "note": "", "views": "57x", "geolocation_type": "regional.address"}}, {"type": "Feature", "geometry": {"type": "Point", "coordinates": [14.40131, 50.08733]}, "properties": {"id": "709673E07D2311E3BE26406186009F3A", "kind": "pozitiv", "description": "Jižní zeď první zahradní terasy v Schönbornském paláci - domě čp. 365 na Malé Straně. Boční (vrcholně barokní) nika.", "date_label": "červen 1931", "start_date": "1931-06-01", "end_date": "1931-06-30", "author": "Vojta, Tomáš (1885-1934)", "note": "", "views": "22x", "geolocation_type": "regional.address"}}, {"type": "Feature", "geometry": {"type": "Point", "coordinates": [14.43474, 50.09841]}, "properties": {"id": "70A7B555669311E481D7D4BED94BB14D", "kind": "pozitiv", "description": "Pohled od Strossmayerova náměstí směrem k Vltavě. Vlevo část novostavby Elektrických podniků hl. m. Prahy (dům čp. 1477) v Bubenské ulici vpravo část domu čp. 1297 v Holešovicích na Strossmayerově náměstí.", "date_label": "31.8.1937", "start_date": "1937-08-31", "end_date": "1937-08-31", "author": "Alexander, Antonín (1892-působnost do 1948)", "note": "", "views": "87x", "geolocation_type": "regional.address"}}, {"type": "Feature", "geometry": {"type": "Point", "coordinates": [14.43393, 50.11648]}, "properties": {"id": "70BF245E712711E2BF15525400E46D25", "kind": "negativ", "description": "Pohled na starou a novou budovu Pomologického ústavu (domy čp. 91 - usedlost Popelářka a vpravo čp. 129 v Troji), v popředí zahrady.", "date_label": "", "start_date": "", "end_date": "", "author": "Eckert, Jindřich (1833-1905)", "note": "", "views": "63x", "geolocation_type": "regional.address"}}, {"type": "Feature", "geometry": {"type": "Point", "coordinates": [14.41873, 50.08783]}, "properties": {"id": "70C248C4808D11E4AAB4406186009F3A", "kind": "pozitiv", "description": "Pohled na gotické trámy nalezené při bourání domu čp. 16 na Starém Městě (Andělská kolej) v Mikulášské ulici (dnes náměstí Franze Kafky).", "date_label": "25.2.1909", "start_date": "1909-02-25", "end_date": "1909-02-25", "author": "Kříženecký, Jan (1868-1921)", "note": "", "views": "26x", "geolocation_type": "regional.address"}}, {"type": "Feature", "geometry": {"type": "Point", "coordinates": [14.40686, 50.08144]}, "properties": {"id": "70E788529F1A11E5B9B7406186009F3A", "kind": "pozitiv", "description": "Pohled na východní konec Vítězné ulice na Malé Straně směrem od Vltavy k Petřínu.", "date_label": "po 1898", "start_date": "1899-01-01", "end_date": "2000-12-31", "author": "", "note": "", "views": "68x", "geolocation_type": "regional.address"}}, {"type": "Feature", "geometry": {"type": "Point", "coordinates": [14.40696, 50.09058]}, "properties": {"id": "710ED3F85F5B11E8A52374D435EEBE90", "kind": "pozitiv", "description": "Pohled na část zahradního průčelí domu čp. 153 (Fürstenberský palác) na Malé Straně. V popředí zahrada s vodotryskem. V pozadí Pražský hrad.", "date_label": "kol.1900", "start_date": "1900-01-01", "end_date": "1900-12-31", "author": "Deport a Panzer", "note": "", "views": "69x", "geolocation_type": "regional.address"}}, {"type": "Feature", "geometry": {"type": "Point", "coordinates": [14.41783, 50.08711]}, "properties": {"id": "71811a7a7b394aa091daa2e4b672cb9a", "kind": "pozitiv", "description": "Pohled na stavbu budovy Magistrátu hlavního města Prahy (dům čp. 2) na Mariánském náměstí na Starém Městě. V pozadí Klementinum.", "date_label": "5.7.1910", "start_date": "1910-07-05", "end_date": "1910-07-05", "author": "", "note": "", "views": "13x", "geolocation_type": "regional.address"}}, {"type": "Feature", "geometry": {"type": "Point", "coordinates": [14.42661, 50.0825]}, "properties": {"id": "71A6B294E29611E89F1B74D435EEBE90", "kind": "pozitiv", "description": "Pohled na dům čp. 831 na nároží Václavského náměstí a Jindřišské ulice na Novém Městě.", "date_label": "1912", "start_date": "1912-01-01", "end_date": "1912-12-31", "author": "", "note": "", "views": "54x", "geolocation_type": "regional.address"}}, {"type": "Feature", "geometry": {"type": "Point", "coordinates": [14.38996, 50.08783]}, "properties": {"id": "71DC329F800011E2BF1B525400E46D25", "kind": "negativ", "description": "Pohled do interiéru domu čp. 111 (sirotčinec arcivévodkyně Gisely) na Pohořelci na Hradčanech - pracovna v chlapeckém oddělení.", "date_label": "kol.1890", "start_date": "1890-01-01", "end_date": "1890-12-31", "author": "Eckert, Jindřich (1833-1905)", "note": "", "views": "28x", "geolocation_type": "regional.address"}}, {"type": "Feature", "geometry": {"type": "Point", "coordinates": [14.42009, 50.087]}, "properties": {"id": "7226F41A0FEE11E38E586C626D41E503", "kind": "pozitiv", "description": "Pohled na část jižního průčelí Staroměstské radnice (domu čp. 1) - uprostřed okno s nápisem PRAGA CAPUT REGNI, vpravo gotický portál. Reprodukce fotografie z roku 1881.", "date_label": "květen 1881", "start_date": "1881-05-01", "end_date": "1881-05-31", "author": "", "note": "\"jižní průčelí v květnu 1881 za příčinou návštěvy novomanželů Korunního prince Rudolfa a princezny Štěpánky v Praze\"", "views": "48x", "geolocation_type": "regional.address"}}, {"type": "Feature", "geometry": {"type": "Point", "coordinates": [14.41712, 50.0842]}, "properties": {"id": "724C09A6D91811E89D2574D435EEBE90", "kind": "pozitiv", "description": "Pohled na novostavbu Betlémské kaple (dům čp. 255 na Starém Městě) na Betlémském náměstí. Vlevo část domu čp. 254, vpravo čp. 351 na Starém Městě.", "date_label": "1952", "start_date": "1952-01-01", "end_date": "1952-12-31", "author": "Zeman, Josef", "note": "", "views": "50x", "geolocation_type": "regional.address"}}, {"type": "Feature", "geometry": {"type": "Point", "coordinates": [14.39535, 50.08934]}, "properties": {"id": "72536dabcf854fcfa6dc3d6c89ba65b5", "kind": "pozitiv", "description": "Pohled na část Hradčanského náměstí při Pražském hradu.", "date_label": "1984", "start_date": "1984-01-01", "end_date": "1984-12-31", "author": "Hudeček, Jan", "note": "", "views": "6x", "geolocation_type": "regional.address"}}, {"type": "Feature", "geometry": {"type": "Point", "coordinates": [14.40131, 50.08733]}, "properties": {"id": "72795F1279E211E3B274406186009F3A", "kind": "pozitiv", "description": "Pohled na neorokokový strop Schönbornského paláce - domu čp. 365 na Malé Straně.", "date_label": "červen 1931", "start_date": "1931-06-01", "end_date": "1931-06-30", "author": "Vojta, Tomáš (1885-1934)", "note": "", "views": "21x", "geolocation_type": "regional.address"}}, {"type": "Feature", "geometry": {"type": "Point", "coordinates": [14.39151, 50.08925]}, "properties": {"id": "736676B4475A11E180176C626D41E503", "kind": "pozitiv", "description": "Pohled na hlavní průčelí Lorety (dům čp. 100 na Hradčanech) na Loretánském náměstí.", "date_label": "kol.1895", "start_date": "1895-01-01", "end_date": "1895-12-31", "author": "", "note": "", "views": "20x", "geolocation_type": "regional.address"}}, {"type": "Feature", "geometry": {"type": "Point", "coordinates": [14.65102, 50.17658]}, "properties": {"id": "7382AE678B0511E2BF22525400E46D25", "kind": "negativ", "description": "Pohled do interiéru hotelu Paříž (dům čp. 1080 na Starém Městě).", "date_label": "16.-17.10.1905", "start_date": "", "end_date": "", "author": "Eckert-ateliér", "note": "", "views": "36x", "geolocation_type": "regional.address"}}, {"type": "Feature", "geometry": {"type": "Point", "coordinates": [14.41815, 50.08342]}, "properties": {"id": "73BE0900CBE511E4AB2C406186009F3A", "kind": "pozitiv", "description": "Pohled na průčelí domu čp. 347 v ulici Na Perštýně na Starém Městě. V pozadí domy čp. 348 a 309.", "date_label": "kol. 1910", "start_date": "", "end_date": "", "author": "", "note": "", "views": "35x", "geolocation_type": "regional.address"}}, {"type": "Feature", "geometry": {"type": "Point", "coordinates": [14.42141, 50.09278]}, "properties": {"id": "74031F149A7411E4A736406186009F3A", "kind": "pozitiv", "description": "Celkový pohled na kostel sv. Šimona a Judy na nároží ulic Dušní a U Milosrdných na Starém Městě. Vpravo klášter milosrdných bratří (dům čp. 847).", "date_label": "1908", "start_date": "1908-01-01", "end_date": "1908-12-31", "author": "Klíma, Alois, Ing. (1873-1955)", "note": "", "views": "50x", "geolocation_type": "regional.address"}}, {"type": "Feature", "geometry": {"type": "Point", "coordinates": [14.42009, 50.087]}, "properties": {"id": "7484B233969411EABE1B74D435EEBE90", "kind": "pozitiv", "description": "Pohled na část mariánského sloupu (podstavec) před Staroměstskou radnicí.", "date_label": "1902", "start_date": "1902-01-01", "end_date": "1902-12-31", "author": "Dvořák, František (dokumenty 1901-1908)", "note": "", "views": "43x", "geolocation_type": "regional.address"}}, {"type": "Feature", "geometry": {"type": "Point", "coordinates": [14.42781, 50.08981]}, "properties": {"id": "74954D8A161511E390486C626D41E503", "kind": "pozitiv", "description": "Celkový pohled na na hlavní průčelí domu čp. 1003 na Starém Městě do Revoluční třídy.", "date_label": "12.10.1944", "start_date": "1944-10-12", "end_date": "1944-10-12", "author": "Alexander, Antonín (1892-působnost do 1948)", "note": "", "views": "48x", "geolocation_type": "regional.address"}}, {"type": "Feature", "geometry": {"type": "Point", "coordinates": [14.41873, 50.08783]}, "properties": {"id": "749F00AB808C11E4AAB4406186009F3A", "kind": "pozitiv", "description": "Pohled na gotický strop nalezený při bourání domu čp. 16 na Starém Městě (Andělská kolej) v Mikulášské ulici (dnes náměstí Franze Kafky).", "date_label": "22.2.1909", "start_date": "1909-02-22", "end_date": "1909-02-22", "author": "Kříženecký, Jan (1868-1921)", "note": "", "views": "30x", "geolocation_type": "regional.address"}}, {"type": "Feature", "geometry": {"type": "Point", "coordinates": [14.44531, 50.09841]}, "properties": {"id": "7509022C921711E2BF28525400E46D25", "kind": "negativ", "description": "Pohled na tržnici masa v areálu pražských Ústředních jatek v Holešovicích (dům čp. 306).", "date_label": "1895", "start_date": "1895-01-01", "end_date": "1895-12-31", "author": "Eckert, Jindřich (1833-1905)", "note": "", "views": "49x", "geolocation_type": "regional.address"}}, {"type": "Feature", "geometry": {"type": "Point", "coordinates": [14.41783, 50.08711]}, "properties": {"id": "7525d95eb5524a0b801ca8120d9cbc6c", "kind": "pozitiv", "description": "Pohled na staveniště budovy Magistrátu hlavního města Prahy (dům čp. 2) na Mariánském náměstí na Starém Městě. V pozadí náměstí Franze Kafky.", "date_label": "1909", "start_date": "1909-01-01", "end_date": "1909-12-31", "author": "", "note": "", "views": "10x", "geolocation_type": "regional.address"}}, {"type": "Feature", "geometry": {"type": "Point", "coordinates": [14.42604, 50.07718]}, "properties": {"id": "759DD69E712D11E2BF15525400E46D25", "kind": "negativ", "description": "Pohled do interiéru kaple \"Valdštejnské útulny pro ošetřovatelky od červeného kříže\" (dům čp. 569 na Novém Městě) v Žitné ulici.", "date_label": "18.12.1902", "start_date": "1902-12-18", "end_date": "1902-12-18", "author": "Eckert, Jindřich (1833-1905)", "note": "", "views": "25x", "geolocation_type": "regional.address"}}, {"type": "Feature", "geometry": {"type": "Point", "coordinates": [14.43681, 50.09865]}, "properties": {"id": "75ACD340E69411E89E7C74D435EEBE90", "kind": "pozitiv", "description": "Pohled do Bubenské ulice s domem čp. 1477 (budova Elektrických podniků hl. m. Prahy) v Holešovicích v zimě.", "date_label": "21.3.1958", "start_date": "1958-03-21", "end_date": "1958-03-21", "author": "Roleček, Jiří", "note": "", "views": "63x", "geolocation_type": "regional.address"}}, {"type": "Feature", "geometry": {"type": "Point", "coordinates": [14.4028, 50.02379]}, "properties": {"id": "75BBAF5CD29111E6BE58406186009F3A", "kind": "pozitiv", "description": "Pohled na dům čp. 7 v ulici V Náklích v Hodkovičkách z Modřanské ulice. Vpravo dům čp. 6.", "date_label": "22.8.1959", "start_date": "1959-08-22", "end_date": "1959-08-22", "author": "Hnilička, Eduard (1887-1967)", "note": "", "views": "28x", "geolocation_type": "regional.address"}}, {"type": "Feature", "geometry": {"type": "Point", "coordinates": [14.40597, 50.08626]}, "properties": {"id": "762C65D05F5111E8A52374D435EEBE90", "kind": "pozitiv", "description": "Celkový pohled na Velkopřevorský palác na Velkopřevorském náměstí (dům čp. 485) na Malé Straně.", "date_label": "1902", "start_date": "1902-01-01", "end_date": "1902-12-31", "author": "Eckert, Jindřich (1833-1905)", "note": "", "views": "35x", "geolocation_type": "regional.address"}}, {"type": "Feature", "geometry": {"type": "Point", "coordinates": [14.46093, 50.08722]}, "properties": {"id": "76412347F8D011E1BEF6000C766D2371", "kind": "pozitiv", "description": "Pohled na kostel sv. Anny a na bývalý klášter karmelitánů na Žižkově (dům čp. 1268) v bloku mezi Ostromečskou (býv. Šlikovou), Jeseniovou a Tovačovského ulicí.", "date_label": "24.9.1942", "start_date": "1942-09-24", "end_date": "1942-09-24", "author": "Alexander, Antonín (1892-působnost do 1948)", "note": "", "views": "80x", "geolocation_type": "regional.address"}}, {"type": "Feature", "geometry": {"type": "Point", "coordinates": [14.42142, 50.02285]}, "properties": {"id": "7651CD6DD1B311E69F29406186009F3A", "kind": "pozitiv", "description": "Pohled na dům čp. 86 v ulici Havlovického v Hodkovičkách. V pozadí dům čp. 95.", "date_label": "", "start_date": "", "end_date": "", "author": "", "note": "", "views": "28x", "geolocation_type": "regional.address"}}, {"type": "Feature", "geometry": {"type": "Point", "coordinates": [14.42009, 50.087]}, "properties": {"id": "767D68C590EB11E8B3B474D435EEBE90", "kind": "pozitiv", "description": "Socha Hvězdáře a archanděla Michaela z orloje v jižním průčelí Staroměstské radnice (dům čp. 1 na Starém Městě) na Staroměstském náměstí před restaurováním.", "date_label": "21.9.1911", "start_date": "1911-09-21", "end_date": "1911-09-21", "author": "Kříženecký, Jan (1868-1921)", "note": "", "views": "44x", "geolocation_type": "regional.address"}}, {"type": "Feature", "geometry": {"type": "Point", "coordinates": [14.44836, 50.09326]}, "properties": {"id": "76AA8EA9310211E9978874D435EEBE90", "kind": "negativ", "description": "Průhled Královskou ulicí (dnes Sokolovská) k východu - směrem ke křižovatce s Vítkovou a ke Karlínskému náměstí. V pozadí dům čp. 145 s arkýřem v Karlíně. Uprostřed dvě koňky.", "date_label": "1895-1900", "start_date": "1895-01-01", "end_date": "1900-12-31", "author": "Bellmann-ateliér", "note": "", "views": "78x", "geolocation_type": "regional.address"}}, {"type": "Feature", "geometry": {"type": "Point", "coordinates": [14.41783, 50.08711]}, "properties": {"id": "77428335956742e8a7b93a818090a22c", "kind": "pozitiv", "description": "Pohled na stavbu budovy Magistrátu hlavního města Prahy (dům čp. 2) na Mariánském náměstí na Starém Městě. V pozadí Linhartská ulice.", "date_label": "1909-1910", "start_date": "1909-01-01", "end_date": "1910-12-31", "author": "", "note": "", "views": "9x", "geolocation_type": "regional.address"}}, {"type": "Feature", "geometry": {"type": "Point", "coordinates": [14.41609, 50.08608]}, "properties": {"id": "776F71BD273211E6A56A406186009F3A", "kind": "negativ", "description": "Pohled do Karlovy ulice s Vlašskou kaplí na Starém Městě. Vlevo část domu čp. 181 na nároží Karlovy a Liliové ulice.", "date_label": "kol.1920", "start_date": "1920-01-01", "end_date": "1920-12-31", "author": "Fink, František (1854-1935)", "note": "", "views": "56x", "geolocation_type": "regional.address"}}, {"type": "Feature", "geometry": {"type": "Point", "coordinates": [14.42009, 50.087]}, "properties": {"id": "77A1D73B90E611E8B3B474D435EEBE90", "kind": "pozitiv", "description": "Pohled na pravou dolní část ciferníku orloje Staroměstské radnice při restaurování (dům čp. 1 na Starém Městě) na Staroměstském náměstí.", "date_label": "26.9.1911", "start_date": "1911-09-26", "end_date": "1911-09-26", "author": "", "note": "", "views": "37x", "geolocation_type": "regional.address"}}, {"type": "Feature", "geometry": {"type": "Point", "coordinates": [14.40131, 50.08733]}, "properties": {"id": "77B028E97D3911E3BE26406186009F3A", "kind": "pozitiv", "description": "Interiér stáje Schönbornského paláce - domu čp. 365 na Malé Straně.", "date_label": "", "start_date": "", "end_date": "", "author": "", "note": "", "views": "19x", "geolocation_type": "regional.address"}}, {"type": "Feature", "geometry": {"type": "Point", "coordinates": [14.44357, 50.14932]}, "properties": {"id": "77C3708BDD1511E480FB74D435EEBE90", "kind": "pozitiv", "description": "Pohled na statek čp. 15 v Dolních Chabrech ze dvora.", "date_label": "1968", "start_date": "1968-01-01", "end_date": "1968-12-31", "author": "Vopravil, Josef (1902-1972)", "note": "", "views": "41x", "geolocation_type": "regional.address"}}, {"type": "Feature", "geometry": {"type": "Point", "coordinates": [14.42009, 50.087]}, "properties": {"id": "7839288F65B911E98115406186009F3A", "kind": "pozitiv", "description": "Pohled do jihozápadní části Staroměstského náměstí od Malého náměstí. V pozadí kostel P. Marie před Týnem.", "date_label": "kol.1915", "start_date": "1915-01-01", "end_date": "1915-12-31", "author": "", "note": "", "views": "40x", "geolocation_type": "regional.address"}}, {"type": "Feature", "geometry": {"type": "Point", "coordinates": [14.42404, 50.09215]}, "properties": {"id": "78D86CC2968B11E49A5E406186009F3A", "kind": "pozitiv", "description": "Pohled na dvůr Anežského kláštera (dům čp. 811) na Starém Městě.", "date_label": "1908", "start_date": "1908-01-01", "end_date": "1908-12-31", "author": "Klíma, Alois, Ing. (1873-1955)", "note": "", "views": "38x", "geolocation_type": "regional.address"}}, {"type": "Feature", "geometry": {"type": "Point", "coordinates": [14.40131, 50.08733]}, "properties": {"id": "78F0825179F811E3B274406186009F3A", "kind": "pozitiv", "description": "Kamna v Schönbornském paláci - domě čp. 365 na Malé Straně.", "date_label": "červen 1931", "start_date": "1931-06-01", "end_date": "1931-06-30", "author": "Vojta, Tomáš (1885-1934)", "note": "", "views": "22x", "geolocation_type": "regional.address"}}, {"type": "Feature", "geometry": {"type": "Point", "coordinates": [14.42009, 50.087]}, "properties": {"id": "78F1AA7E90E411E8B3B474D435EEBE90", "kind": "pozitiv", "description": "Pohled na astronomický ciferník ve střední části orloje v jižním průčelí Staroměstské radnice (dům čp. 1 na Starém Městě) na Staroměstském náměstí při restaurování.", "date_label": "26.9.1911", "start_date": "1911-09-26", "end_date": "1911-09-26", "author": "Kříženecký, Jan (1868-1921)", "note": "", "views": "37x", "geolocation_type": "regional.address"}}, {"type": "Feature", "geometry": {"type": "Point", "coordinates": [14.43263, 50.08071]}, "properties": {"id": "78F5F33076A011E2BF17525400E46D25", "kind": "negativ", "description": "Celkový pohled na Novoměstské divadlo s okolím od severozápadu při bourání (dřevěná krytá aréna v místech dnešní Státní opery zbořená roku 1886 - dům čp. 101 na Vinohradech). Vlevo domy v Resslově ulici (dnes U Divadla) na Vinohradech, vpravo původní dům čp. 101 na Vinohradech. V popředí část Městských sadů (Městský Velký park, dnes Vrchlického sady).", "date_label": "1886", "start_date": "1886-01-01", "end_date": "1886-12-31", "author": "Eckert, Jindřich (1833-1905)", "note": "", "views": "94x", "geolocation_type": "regional.address"}}, {"type": "Feature", "geometry": {"type": "Point", "coordinates": [14.42966, 50.07213]}, "properties": {"id": "7903FFC16EC611E292116C626D41E503", "kind": "pozitiv", "description": "Pohled na severní stranu Fügnerova náměstí na Novém Městě - zleva domy čp. 1806, 1807 a 1808, vpravo ústí Legerovy ulice.", "date_label": "kol.1900", "start_date": "1900-01-01", "end_date": "1900-12-31", "author": "", "note": "", "views": "37x", "geolocation_type": "regional.address"}}, {"type": "Feature", "geometry": {"type": "Point", "coordinates": [14.4186, 50.0808]}, "properties": {"id": "79074D6D955211E2BF29525400E46D25", "kind": "negativ", "description": "Pohled do interiéru domu čp. 126 na Novém Městě v Ostrovní ulici - strojovna.", "date_label": "kol.1900", "start_date": "1900-01-01", "end_date": "1900-12-31", "author": "Eckert, Jindřich (1833-1905)", "note": "", "views": "15x", "geolocation_type": "regional.address"}}, {"type": "Feature", "geometry": {"type": "Point", "coordinates": [14.41783, 50.08711]}, "properties": {"id": "791fd91d68e443cc814ca785c2632429", "kind": "pozitiv", "description": "Pohled na stavbu budovy Magistrátu hlavního města Prahy (dům čp. 2) na Mariánském náměstí na Starém Městě.", "date_label": "10.4.1910", "start_date": "1910-04-10", "end_date": "1910-04-10", "author": "", "note": "", "views": "9x", "geolocation_type": "regional.address"}}, {"type": "Feature", "geometry": {"type": "Point", "coordinates": [14.41563, 50.07517]}, "properties": {"id": "799D5DCE9B8811E2BF2D525400E46D25", "kind": "pozitiv", "description": "Pohled přes Vltavu na novoměstské nábřeží (část dnešního Masarykova a Rašínova). Vlevo věž Šítkovské vodárny, uprostřed Svatováclavská trestnice (dům čp. 329 na Novém Městě).", "date_label": "1866", "start_date": "1866-01-01", "end_date": "1866-12-31", "author": "Eckert, Jindřich (1833-1905)", "note": "", "views": "89x", "geolocation_type": "regional.address"}}, {"type": "Feature", "geometry": {"type": "Point", "coordinates": [14.40618, 50.08249]}, "properties": {"id": "79C86251657311E8B6E074D435EEBE90", "kind": "pozitiv", "description": "Pohled na kostel sv. Jana Na prádle s domem čp. 440 na Malé Straně na nároží ulic Říční a Všehrdovy (doprava). Vpravo dům čp. 439 na Malé Straně ve Všehrdově ulici.", "date_label": "kol.1910", "start_date": "1910-01-01", "end_date": "1910-12-31", "author": "", "note": "", "views": "26x", "geolocation_type": "regional.address"}}, {"type": "Feature", "geometry": {"type": "Point", "coordinates": [14.41783, 50.08711]}, "properties": {"id": "79eeba38dd6942e0bb769398bcbf2f49", "kind": "pozitiv", "description": "Pohled na stavbu budovy Magistrátu hlavního města Prahy (dům čp. 2) na Mariánském náměstí na Starém Městě. V pozadí věže kostela sv. Mikuláše.", "date_label": "", "start_date": "", "end_date": "", "author": "", "note": "", "views": "11x", "geolocation_type": "regional.address"}}, {"type": "Feature", "geometry": {"type": "Point", "coordinates": [14.41719, 50.07215]}, "properties": {"id": "7A10EB7F85AD11E2BF1F525400E46D25", "kind": "negativ", "description": "Pohled na varhany v kostele P. Marie Na Slovanech (v Emauzích) na Novém Městě - registr.", "date_label": "kol.1900", "start_date": "1900-01-01", "end_date": "1900-12-31", "author": "Eckert, Jindřich (1833-1905)", "note": "", "views": "37x", "geolocation_type": "regional.address"}}, {"type": "Feature", "geometry": {"type": "Point", "coordinates": [14.42009, 50.087]}, "properties": {"id": "7A97117B90BF11E8B3B474D435EEBE90", "kind": "negativ", "description": "Pohled na stroj chronometru orloje Staroměstské radnice (dům čp. 1 na Starém Městě) na Staroměstském náměstí.", "date_label": "", "start_date": "", "end_date": "", "author": "", "note": "", "views": "31x", "geolocation_type": "regional.address"}}, {"type": "Feature", "geometry": {"type": "Point", "coordinates": [14.41724, 50.08595]}, "properties": {"id": "7AB196A9A4B811E1BEEC000C766D2371", "kind": "negativ", "description": "Pohled do interiéru domu čp. 223 (Svatováclavská záložna) v Karlově ulici na Starém Městě - zasedací síň.", "date_label": "kol.1890", "start_date": "1890-01-01", "end_date": "1890-12-31", "author": "Eckert, Jindřich (1833-1905)", "note": "", "views": "30x", "geolocation_type": "regional.address"}}, {"type": "Feature", "geometry": {"type": "Point", "coordinates": [14.41783, 50.08711]}, "properties": {"id": "7abd38cf886d4a8d8222fe70ff5354f6", "kind": "pozitiv", "description": "Pohled na stavbu budovy Magistrátu hlavního města Prahy (dům čp. 2) na Mariánském náměstí na Starém Městě. V pozadí Platnéřská ulice a náměstí Franze Kafky.", "date_label": "1909", "start_date": "1909-01-01", "end_date": "1909-12-31", "author": "", "note": "", "views": "14x", "geolocation_type": "regional.address"}}, {"type": "Feature", "geometry": {"type": "Point", "coordinates": [14.41883, 50.06985]}, "properties": {"id": "7AE693DF87E711E2BF21525400E46D25", "kind": "negativ", "description": "Pohled do interiéru městského chudobince sv. Bartoloměje (dům čp. 427 na Novém Městě) ve Vyšehradské ulici - chodba.", "date_label": "kol.1890", "start_date": "1890-01-01", "end_date": "1890-12-31", "author": "Eckert, Jindřich (1833-1905)", "note": "", "views": "46x", "geolocation_type": "regional.address"}}, {"type": "Feature", "geometry": {"type": "Point", "coordinates": [14.41873, 50.08783]}, "properties": {"id": "7B22A99B808811E4AAB4406186009F3A", "kind": "pozitiv", "description": "Pohled na zbytky románského zdiva nalezeného při bourání domu čp. 16 na Starém Městě (Andělská kolej) v Mikulášské ulici (dnes náměstí Franze Kafky) .", "date_label": "1909", "start_date": "1909-01-01", "end_date": "1909-12-31", "author": "Kříženecký, Jan (1868-1921)", "note": "", "views": "33x", "geolocation_type": "regional.address"}}, {"type": "Feature", "geometry": {"type": "Point", "coordinates": [14.41798, 50.086]}, "properties": {"id": "7B52FFD004D611E3A4F66C626D41E503", "kind": "pozitiv", "description": "Pohled do Husovy ulice směrem k severu. Zleva domy čp. 227, 228, 229 a 156. V pozadí Clam Gallasův palác čp. 158 na Starém Městě.", "date_label": "6.4.1930", "start_date": "1930-04-06", "end_date": "1930-04-06", "author": "Alexander, Antonín (1892-působnost do 1948)", "note": "", "views": "50x", "geolocation_type": "regional.address"}}, {"type": "Feature", "geometry": {"type": "Point", "coordinates": [14.42801, 50.08681]}, "properties": {"id": "7B7CD28E824C11E2BF1E525400E46D25", "kind": "negativ", "description": "Pohled do interiéru Živnostenské banky (dům čp. 862) v ulici Na Příkopě na Novém Městě - hala s přepážkami (světlík).", "date_label": "9.4.1902", "start_date": "1902-04-09", "end_date": "1902-04-09", "author": "Eckert, Jindřich (1833-1905)", "note": "", "views": "23x", "geolocation_type": "regional.address"}}, {"type": "Feature", "geometry": {"type": "Point", "coordinates": [14.42009, 50.087]}, "properties": {"id": "7B8D5182220211E8B26274D435EEBE90", "kind": "pozitiv", "description": "Pohled na část jižního průčelí Staroměstské radnice (dům čp. 1 na Starém Městě).", "date_label": "1864", "start_date": "1864-01-01", "end_date": "1864-12-31", "author": "Groll, Andreas (1812-1872)", "note": "", "views": "51x", "geolocation_type": "regional.address"}}, {"type": "Feature", "geometry": {"type": "Point", "coordinates": [14.39151, 50.08925]}, "properties": {"id": "7B969C92748A11E4A81F406186009F3A", "kind": "pozitiv", "description": "Pohled do zahrady domu čp. 180 na Hradčanech (bývalý Trautmannsdorfský palác) - \"práce na výkopu válečného vodního bazénu\". V pozadí východní část Lorety (dům čp. 100 na Hradčanech).", "date_label": "5.6.1944", "start_date": "1944-06-05", "end_date": "1944-06-05", "author": "Alexander, Antonín (1892-působnost do 1948)", "note": "", "views": "20x", "geolocation_type": "regional.address"}}, {"type": "Feature", "geometry": {"type": "Point", "coordinates": [14.43889, 50.07735]}, "properties": {"id": "7BD87D91968411E49A5E406186009F3A", "kind": "pozitiv", "description": "Pohled na nároží domu čp. 1971 (budova Obchodní akademie Ústředního svazu obchodu) na Vinohradech.", "date_label": "23.9.1942", "start_date": "1942-09-23", "end_date": "1942-09-23", "author": "Alexander, Antonín (1892-působnost do 1948)", "note": "", "views": "37x", "geolocation_type": "regional.address"}}, {"type": "Feature", "geometry": {"type": "Point", "coordinates": [14.42276, 50.07944]}, "properties": {"id": "7BE5DA2A628B11E58AA0406186009F3A", "kind": "pozitiv", "description": "Pohled na dům čp. 681 ve Vodičkově ulici na Novém Městě.", "date_label": "kol. 1919", "start_date": "", "end_date": "", "author": "", "note": "", "views": "86x", "geolocation_type": "regional.address"}}, {"type": "Feature", "geometry": {"type": "Point", "coordinates": [14.42009, 50.087]}, "properties": {"id": "7BFAD54290C111E8B3B474D435EEBE90", "kind": "negativ", "description": "Pohled na část ciferníku orloje Staroměstské radnice (dům čp. 1 na Starém Městě) na Staroměstském náměstí při opravě.", "date_label": "kol.1910", "start_date": "1910-01-01", "end_date": "1910-12-31", "author": "", "note": "", "views": "21x", "geolocation_type": "regional.address"}}, {"type": "Feature", "geometry": {"type": "Point", "coordinates": [14.40131, 50.08733]}, "properties": {"id": "7C3C851479F911E3B274406186009F3A", "kind": "pozitiv", "description": "Dveře v interiéru Schönbornského paláce - domu čp. 365 na Malé Straně.", "date_label": "červen 1931", "start_date": "1931-06-01", "end_date": "1931-06-30", "author": "Vojta, Tomáš (1885-1934)", "note": "", "views": "26x", "geolocation_type": "regional.address"}}, {"type": "Feature", "geometry": {"type": "Point", "coordinates": [14.41783, 50.08711]}, "properties": {"id": "7c7938df0c3c4d6aa439d3cd2186659a", "kind": "pozitiv", "description": "Pohled na stavbu budovy Magistrátu hlavního města Prahy (dům čp. 2) na Mariánském náměstí na Starém Městě - 2. patro hlavního schodiště. V pozadí Linhartská ulice.", "date_label": "5.7.1910", "start_date": "1910-07-05", "end_date": "1910-07-05", "author": "", "note": "", "views": "12x", "geolocation_type": "regional.address"}}, {"type": "Feature", "geometry": {"type": "Point", "coordinates": [14.43549, 50.08356]}, "properties": {"id": "7D1E74FDD5A411E18CF36C626D41E503", "kind": "pozitiv", "description": "Pohled na vlaky na Wilsonově nádraží. V pozadí budova Wilsonova nádraží (dům čp. 300) na Vinohradech - nádraží císaře Františka Josefa I., Hlavní.", "date_label": "1948-1949", "start_date": "1948-01-01", "end_date": "1949-12-31", "author": "", "note": "", "views": "145x", "geolocation_type": "regional.address"}}, {"type": "Feature", "geometry": {"type": "Point", "coordinates": [14.40131, 50.08733]}, "properties": {"id": "7D4133CB7C7211E3BFE4406186009F3A", "kind": "pozitiv", "description": "Severovýchodní kout první zahradní terasy Schönbornského paláce - domu čp. 365 na Malé Straně.", "date_label": "červen 1931", "start_date": "1931-06-01", "end_date": "1931-06-30", "author": "Vojta, Tomáš (1885-1934)", "note": "", "views": "25x", "geolocation_type": "regional.address"}}, {"type": "Feature", "geometry": {"type": "Point", "coordinates": [14.45836, 50.09311]}, "properties": {"id": "7D43DF8B81BE11E2BF1D525400E46D25", "kind": "negativ", "description": "Pohled na stavbu školy (dům čp. 460) na Lyčkově náměstí v Karlíně (dříve Riegrovy sady).", "date_label": "1905", "start_date": "1905-01-01", "end_date": "1905-12-31", "author": "Eckert-ateliér", "note": "", "views": "52x", "geolocation_type": "regional.address"}}, {"type": "Feature", "geometry": {"type": "Point", "coordinates": [14.42009, 50.087]}, "properties": {"id": "7DE6909990B811E8B3B474D435EEBE90", "kind": "negativ", "description": "Pohled na vyobrazení měsíců Josefa Mánesa (znamení Váhy) na orloji Staroměstské radnice (dům čp. 1 na Starém Městě) na Staroměstském náměstí.", "date_label": "", "start_date": "", "end_date": "", "author": "", "note": "", "views": "20x", "geolocation_type": "regional.address"}}, {"type": "Feature", "geometry": {"type": "Point", "coordinates": [14.42141, 50.08628]}, "properties": {"id": "7E2B151C157711E39CC26C626D41E503", "kind": "pozitiv", "description": "Pohled na část domu čp. 1024 v Kožné ulici na Starém Městě (restaurace U Špirků).", "date_label": "16.4.1945", "start_date": "1945-04-16", "end_date": "1945-04-16", "author": "Alexander, Antonín (1892-působnost do 1948)", "note": "", "views": "160x", "geolocation_type": "regional.address"}}, {"type": "Feature", "geometry": {"type": "Point", "coordinates": [14.42398, 50.09021]}, "properties": {"id": "7E691975A4BF11E1BEEC000C766D2371", "kind": "negativ", "description": "Pohled na dům čp. 739 (pivovar \"U Klouzarů\") na nároží ulic Haštalské a Rámové na Starém Městě.", "date_label": "1899", "start_date": "1899-01-01", "end_date": "1899-12-31", "author": "Eckert, Jindřich (1833-1905)", "note": "", "views": "54x", "geolocation_type": "regional.address"}}, {"type": "Feature", "geometry": {"type": "Point", "coordinates": [14.42488, 50.08361]}, "properties": {"id": "7EB3CDA4E29711E89F1B74D435EEBE90", "kind": "pozitiv", "description": "Pohled do dvora domu čp. 839 na Václavském náměstí na Novém Městě (hotel U Zlaté husy).", "date_label": "květen 1909", "start_date": "1909-05-01", "end_date": "1909-05-31", "author": "", "note": "", "views": "34x", "geolocation_type": "regional.address"}}, {"type": "Feature", "geometry": {"type": "Point", "coordinates": [14.42009, 50.087]}, "properties": {"id": "7EE072BCD0AA11EABE1F74D435EEBE90", "kind": "negativ", "description": "Pohled na nároží Staroměstské radnice s arkýřem na Staroměstském náměstí (dům čp. 1 na Starém Městě).", "date_label": "", "start_date": "", "end_date": "", "author": "Bellmann-ateliér", "note": "", "views": "35x", "geolocation_type": "regional.address"}}, {"type": "Feature", "geometry": {"type": "Point", "coordinates": [14.40131, 50.08733]}, "properties": {"id": "7F48CDC8E42011E89C1E74D435EEBE90", "kind": "negativ", "description": "Pohled na Malou Stranu a Pražský hrad ze Schönbornské zahrady. V popředí zahradní průčelí Schönbornského paláce - dům čp. 365 na Malé Straně. V pozadí Pražský hrad s chrámem sv. Víta.", "date_label": "", "start_date": "", "end_date": "", "author": "Vojta, Tomáš (1885-1934)", "note": "", "views": "42x", "geolocation_type": "regional.address"}}, {"type": "Feature", "geometry": {"type": "Point", "coordinates": [14.65102, 50.17658]}, "properties": {"id": "7FD8A4038B0711E2BF22525400E46D25", "kind": "negativ", "description": "Pohled do interiéru hotelu Paříž (dům čp. 1080 na Starém Městě) - jídelna.", "date_label": "16.-17.10.1905", "start_date": "", "end_date": "", "author": "Eckert-ateliér", "note": "", "views": "36x", "geolocation_type": "regional.address"}}, {"type": "Feature", "geometry": {"type": "Point", "coordinates": [14.41976, 50.07032]}, "properties": {"id": "7FEBBAC3B84411E5BC22406186009F3A", "kind": "pozitiv", "description": "Pohled do ulice Na Slupi na Novém Městě směrem od křižovatky s Vyšehradskou a Benátskou. Vpravo domy čp. 433, 1483, 1484, 1485 a 434. V pozadí klášter sv. Alžběty (dům čp. 448) a kostel P. Marie na Trávníčku.", "date_label": "21.5.1910", "start_date": "1910-05-21", "end_date": "1910-05-21", "author": "", "note": "", "views": "61x", "geolocation_type": "regional.address"}}, {"type": "Feature", "geometry": {"type": "Point", "coordinates": [14.41832, 50.08461]}, "properties": {"id": "7FF46262ECD911DFBD7B000C766D2371", "kind": "pozitiv", "description": "Pohled do Husovy ulice s domem čp. 236 \"U Vocílků\" (\"U Vocelků\") na Starém Městě - s ohradní zdí dvorku, která byla později odbourána, ulice rozšířena a zřízena podloubí.", "date_label": "19.9.1926", "start_date": "1926-09-19", "end_date": "1926-09-19", "author": "Alexander, Antonín (1892-působnost do 1948)", "note": "", "views": "19x", "geolocation_type": "regional.address"}}, {"type": "Feature", "geometry": {"type": "Point", "coordinates": [14.44531, 50.09841]}, "properties": {"id": "7FFC5935525C11E6A54B000C76270B94", "kind": "pozitiv", "description": "Pohled na písčiny ve vltavském korytu mezi ostrovem Štvanice a Holešovicemi. V pozadí Ústřední jatka ve Vltavské ulici (dům čp. 306 v Holešovicích).", "date_label": "14.12.1908", "start_date": "1908-12-14", "end_date": "1908-12-14", "author": "", "note": "", "views": "71x", "geolocation_type": "regional.address"}}, {"type": "Feature", "geometry": {"type": "Point", "coordinates": [14.4199, 50.08269]}, "properties": {"id": "7FFF3CD2F23311E39D34406186009F3A", "kind": "pozitiv", "description": "Pohled do dvora domu čp. 417 (ve zrušeném kostele sv. Martina ve zdi) v Martinské ulici na Starém Městě.", "date_label": "kol.1900", "start_date": "1900-01-01", "end_date": "1900-12-31", "author": "", "note": "", "views": "28x", "geolocation_type": "regional.address"}}, {"type": "Feature", "geometry": {"type": "Point", "coordinates": [14.41621, 50.08866]}, "properties": {"id": "80276602763B11E0BE30000C766D2371", "kind": "pozitiv", "description": "Pohled do Široké ulice (Josefovské) s budovou Filozofické fakulty UK (původně dům čp. 55 na Starém Městě - nyní dům čp. 1 v Josefově).", "date_label": "10.11.1944", "start_date": "1944-11-10", "end_date": "1944-11-10", "author": "Alexander, Antonín (1892-působnost do 1948)", "note": "", "views": "68x", "geolocation_type": "regional.address"}}, {"type": "Feature", "geometry": {"type": "Point", "coordinates": [14.60261, 50.02646]}, "properties": {"id": "8064C34F712F11E2BF15525400E46D25", "kind": "negativ", "description": "Pohled do Konviktské ulice při bourání domu čp. 292 na Starém Městě (\"U Goliáše\"). Uprostřed dům čp. 291 (\"Konvikt), vpravo dům čp. 293.", "date_label": "1901-1902", "start_date": "1901-01-01", "end_date": "1902-12-31", "author": "Eckert, Jindřich (1833-1905)", "note": "", "views": "32x", "geolocation_type": "regional.address"}}, {"type": "Feature", "geometry": {"type": "Point", "coordinates": [14.43637, 50.10853]}, "properties": {"id": "80F7AE1D8D5C11E2BF25525400E46D25", "kind": "negativ", "description": "Pohled do interiéru elektrárny v Holešovicích (městská centrála) krátce po dostavění roku 1900 - kotelna.", "date_label": "po 1900", "start_date": "1901-01-01", "end_date": "2000-12-31", "author": "Eckert, Jindřich (1833-1905)", "note": "", "views": "36x", "geolocation_type": "regional.address"}}, {"type": "Feature", "geometry": {"type": "Point", "coordinates": [14.42825, 50.08762]}, "properties": {"id": "80F82062E84211E4BB7A0024BE7CD9AC", "kind": "pozitiv", "description": "Pohled do interieru Lidové restaurace Obecního domu (dům čp. 1090 na Starém Městě) - výzdoba stěn, suterén.", "date_label": "kol.1920", "start_date": "1920-01-01", "end_date": "1920-12-31", "author": "Štenc", "note": "", "views": "21x", "geolocation_type": "regional.address"}}, {"type": "Feature", "geometry": {"type": "Point", "coordinates": [14.404, 50.08785]}, "properties": {"id": "8107E008C09011E3BE26406186009F3A", "kind": "pozitiv", "description": "Pohled z výšky na dům čp. 5 na Malostranském náměstí - Česká banka a Malostranská kavárna se zahrádkou. Nad ním věž kostela sv. Mikuláše a zvonice (dům čp. 556).", "date_label": "kol.1925", "start_date": "1925-01-01", "end_date": "1925-12-31", "author": "Pařík a spol.", "note": "", "views": "48x", "geolocation_type": "regional.address"}}, {"type": "Feature", "geometry": {"type": "Point", "coordinates": [14.4068, 50.08266]}, "properties": {"id": "81AC4BB4B91711E59ABE406186009F3A", "kind": "negativ", "description": "Pohled na horní část Čertovky s mlýnem Huť (dům čp. 449 na Malé Straně) směrem z dřevěné můstku. V pozadí věž a kupole kostela sv. Mikuláše na Malé Straně a Pražský hrad s chrámem sv. Víta.", "date_label": "", "start_date": "", "end_date": "", "author": "", "note": "", "views": "61x", "geolocation_type": "regional.address"}}, {"type": "Feature", "geometry": {"type": "Point", "coordinates": [14.42101, 50.08558]}, "properties": {"id": "8262D1DC7C2011E2BF19525400E46D25", "kind": "negativ", "description": "Pohled do Sirkové ulice (Melantrichova) s Melantrichovým domem (čp. 471 na Starém Městě - \"U Dvou velbloudů\"). Vpravo dům čp. 470, vlevo čp. 970 na Starém Městě.", "date_label": "kol.1890", "start_date": "1890-01-01", "end_date": "1890-12-31", "author": "Eckert, Jindřich (1833-1905)", "note": "", "views": "32x", "geolocation_type": "regional.address"}}, {"type": "Feature", "geometry": {"type": "Point", "coordinates": [14.42559, 50.08243]}, "properties": {"id": "8264C8D5E29211E89F1B74D435EEBE90", "kind": "pozitiv", "description": "Pohled na Václavské náměstí a ústí Vodičkovy ulice. Vlevo část domu čp. 792, uprostřed dům čp. 791 (U Lhotků) krátce před zbořením. Vpravo dům čp. 788 na Novém Městě.", "date_label": "kol.1912", "start_date": "1912-01-01", "end_date": "1912-12-31", "author": "Bufka, Vladimír Jindřich", "note": "", "views": "65x", "geolocation_type": "regional.address"}}, {"type": "Feature", "geometry": {"type": "Point", "coordinates": [14.41873, 50.08783]}, "properties": {"id": "829983D2808B11E4AAB4406186009F3A", "kind": "pozitiv", "description": "Pohled na fragmenty gotické výzdoby v domě čp. 16 na Starém Městě (Andělská kolej) v Mikulášské ulici (dnes náměstí Franze Kafky).", "date_label": "1909", "start_date": "1909-01-01", "end_date": "1909-12-31", "author": "Kříženecký, Jan (1868-1921)", "note": "", "views": "28x", "geolocation_type": "regional.address"}}, {"type": "Feature", "geometry": {"type": "Point", "coordinates": [14.51723, 50.0348]}, "properties": {"id": "83425353549F11E6B6CF406186009F3A", "kind": "pozitiv", "description": "Panoramatický pohled na základní školu v ulici Květnového vítězství (dům čp. 1554 na Chodově) z domu čp. 1635 v ulici Markušova. První část dvoudílného panoramatu.", "date_label": "1982", "start_date": "1982-01-01", "end_date": "1982-12-31", "author": "Jelínková, Jana (1951-)", "note": "", "views": "70x", "geolocation_type": "regional.address"}}, {"type": "Feature", "geometry": {"type": "Point", "coordinates": [14.4068, 50.08266]}, "properties": {"id": "83B87725744811E2A9206C626D41E503", "kind": "negativ", "description": "Pohled na dřevěný můstek přes Čertovku u jejího začátku. Vpravo zadní část domu čp. 539 na malé Straně.", "date_label": "", "start_date": "", "end_date": "", "author": "Reach, Zikmund (1859-1935)", "note": "", "views": "86x", "geolocation_type": "regional.address"}}, {"type": "Feature", "geometry": {"type": "Point", "coordinates": [14.419, 50.07337]}, "properties": {"id": "83B88CAFE44311E4BE0074D435EEBE90", "kind": "pozitiv", "description": "Pohled na část průčelí \"Faustova domu\" (dům čp. 502 na Novém Městě) do Vyšehradské ulice - poškozeném po náletu spojenců v únoru 1945. V popředí zničená zahradní zeď kostela sv. Jana Na Skalce při odklízení sutin.", "date_label": "únor 1945", "start_date": "1945-02-01", "end_date": "1945-02-28", "author": "", "note": "", "views": "75x", "geolocation_type": "regional.address"}}, {"type": "Feature", "geometry": {"type": "Point", "coordinates": [14.42139, 50.09178]}, "properties": {"id": "83FA2EB7712611E2BF15525400E46D25", "kind": "negativ", "description": "Pohled do ulice U Milosrdných při asanaci. Zleva domy čp. 852, čp. 851 a čp. 850 na Starém Městě. Vpravo část průčelí kostela sv. Šimona a Judy.", "date_label": "25.1.1905", "start_date": "1905-01-25", "end_date": "1905-01-25", "author": "Eckert, Jindřich (1833-1905)", "note": "", "views": "38x", "geolocation_type": "regional.address"}}, {"type": "Feature", "geometry": {"type": "Point", "coordinates": [14.41873, 50.08783]}, "properties": {"id": "84501BBF808D11E4AAB4406186009F3A", "kind": "pozitiv", "description": "Pohled na gotické trámy nalezené při bourání domu čp. 16 na Starém Městě (Andělská kolej) v Mikulášské ulici (dnes náměstí Franze Kafky).", "date_label": "25.2.1909", "start_date": "1909-02-25", "end_date": "1909-02-25", "author": "Kříženecký, Jan (1868-1921)", "note": "", "views": "28x", "geolocation_type": "regional.address"}}, {"type": "Feature", "geometry": {"type": "Point", "coordinates": [14.42518, 50.08654]}, "properties": {"id": "84A9ADEA711D11E2BF15525400E46D25", "kind": "pozitiv", "description": "Pohled na průčelí domu čp. 573 na Ovocný trh na Starém Městě.", "date_label": "1926", "start_date": "1926-01-01", "end_date": "1926-12-31", "author": "Vojta, Tomáš (1885-1934)", "note": "", "views": "32x", "geolocation_type": "regional.address"}}, {"type": "Feature", "geometry": {"type": "Point", "coordinates": [14.44531, 50.09841]}, "properties": {"id": "84F9268576B211E2BF17525400E46D25", "kind": "negativ", "description": "Pohled do interiéru budovy burzy a restaurace v areálu pražských Ústředních jatek v Holešovicích (dům čp. 306) - restaurace s prostřenými stoly.", "date_label": "1895", "start_date": "1895-01-01", "end_date": "1895-12-31", "author": "Eckert, Jindřich (1833-1905)", "note": "", "views": "79x", "geolocation_type": "regional.address"}}, {"type": "Feature", "geometry": {"type": "Point", "coordinates": [14.66995, 50.00801]}, "properties": {"id": "84fbd041f4c04024b142b66bd16cbc89", "kind": "pozitiv", "description": "Pohled do Platnéřské ulice z Mariánského náměstí k východu. Zleva domy čp. 104, čp. 106, čp. 108, ústí Žatecké ulice, čp. 110, čp. 112, čp. 113, čp. 115, čp. 117. Vpravo dům čp. 109 na Starém Městě.", "date_label": "16.5.1908", "start_date": "1908-05-16", "end_date": "1908-05-16", "author": "Kříženecký, Jan (1868-1921)", "note": "podpis fotografa", "views": "14x", "geolocation_type": "regional.address"}}, {"type": "Feature", "geometry": {"type": "Point", "coordinates": [14.42773, 50.10268]}, "properties": {"id": "8583C59F669011E481D7D4BED94BB14D", "kind": "pozitiv", "description": "Celkový pohled na dům čp. 850 v Holešovicích (obecná a měšťanská škola U Studánky) na nároží ulic U Studánky a Umělecké.", "date_label": "1908", "start_date": "1908-01-01", "end_date": "1908-12-31", "author": "Fink, František (1854-1935)", "note": "", "views": "61x", "geolocation_type": "regional.address"}}, {"type": "Feature", "geometry": {"type": "Point", "coordinates": [14.43056, 50.07918]}, "properties": {"id": "858BC10281A511E2BF1C525400E46D25", "kind": "negativ", "description": "Celkový pohled na novou fontánu před budovou Národního muzea (dům čp. 1700 na Novém městě) na Václavském náměstí.", "date_label": "1890", "start_date": "1890-01-01", "end_date": "1890-12-31", "author": "Eckert, Jindřich (1833-1905)", "note": "", "views": "35x", "geolocation_type": "regional.address"}}, {"type": "Feature", "geometry": {"type": "Point", "coordinates": [14.40648, 50.02408]}, "properties": {"id": "85DCFAA5D19511E69F29406186009F3A", "kind": "pozitiv", "description": "Pohled na dům čp. 4 v ulici Pod Kopcem v Hodkovičkách.", "date_label": "1958", "start_date": "1958-01-01", "end_date": "1958-12-31", "author": "", "note": "", "views": "32x", "geolocation_type": "regional.address"}}, {"type": "Feature", "geometry": {"type": "Point", "coordinates": [14.42862, 50.06983]}, "properties": {"id": "86027F78A3F611E1BEEB000C766D2371", "kind": "negativ", "description": "Pohled na stavbu nalezince na Karlově (dům čp. 455 na Novém Městě).", "date_label": "kol.1900", "start_date": "1900-01-01", "end_date": "1900-12-31", "author": "Eckert, Jindřich (1833-1905)", "note": "", "views": "19x", "geolocation_type": "regional.address"}}, {"type": "Feature", "geometry": {"type": "Point", "coordinates": [14.42276, 50.07944]}, "properties": {"id": "861F00F4717D11E59BDB406186009F3A", "kind": "pozitiv", "description": "Pohled do dvora domu čp. 681 ve Vodičkově ulici na Novém Městě s autodílnou.", "date_label": "kol. 1919", "start_date": "", "end_date": "", "author": "", "note": "", "views": "38x", "geolocation_type": "regional.address"}}, {"type": "Feature", "geometry": {"type": "Point", "coordinates": [14.40488, 50.0899]}, "properties": {"id": "86B8ED4CD5A811E18CF36C626D41E503", "kind": "pozitiv", "description": "Pohled na Valdštejnské náměstí s Ledeburským palácem (dům čp. 162 na Malé Straně). Vlevo část domu čp. 16 s podloubím. V pozadí část Pražského hradu.", "date_label": "9.7.1933", "start_date": "1933-07-09", "end_date": "1933-07-09", "author": "Alexander, Antonín (1892-působnost do 1948)", "note": "", "views": "25x", "geolocation_type": "regional.address"}}, {"type": "Feature", "geometry": {"type": "Point", "coordinates": [14.41739, 50.08739]}, "properties": {"id": "8708beafe9794523913d3c2a8b257427", "kind": "pozitiv", "description": "Celkový pohled na budovu Ústřední knihovny hlavního města Prahy (dům čp. 98 na Starém Městě) na Mariánském náměstí.", "date_label": "", "start_date": "", "end_date": "", "author": "", "note": "", "views": "11x", "geolocation_type": "regional.address"}}, {"type": "Feature", "geometry": {"type": "Point", "coordinates": [14.40739, 50.08615]}, "properties": {"id": "870BC8E004FA11E3A4F66C626D41E503", "kind": "pozitiv", "description": "Pohled na renesanční portál domu čp. 490 (palác Metychů z Čečova - Hrzánský) na Velkopřevorském náměstí na Malé Straně.", "date_label": "25.9.1907", "start_date": "1907-09-25", "end_date": "1907-09-25", "author": "Klíma, Alois, Ing. (1873-1955)", "note": "", "views": "46x", "geolocation_type": "regional.address"}}, {"type": "Feature", "geometry": {"type": "Point", "coordinates": [14.44868, 50.10248]}, "properties": {"id": "8721AF44880111E2BF21525400E46D25", "kind": "negativ", "description": "Pohled do interiéru domu čp. 515 v Holešovicích (Opatrovna a mateřská škola Na Maninách - dnes Tusarova 27) - oddělení pro nejmenší děti.", "date_label": "1901", "start_date": "1901-01-01", "end_date": "1901-12-31", "author": "Eckert, Jindřich (1833-1905)", "note": "", "views": "49x", "geolocation_type": "regional.address"}}, {"type": "Feature", "geometry": {"type": "Point", "coordinates": [14.42154, 50.08305]}, "properties": {"id": "872828A3E34A11E8966E74D435EEBE90", "kind": "pozitiv", "description": "Pohled do Národní třídy s průvodem fiakristů při Národopisné výstavě v Praze 1895. Vpravo dům čp. 365 na Starém Městě na nároží Perlové ulice.", "date_label": "1895", "start_date": "1895-01-01", "end_date": "1895-12-31", "author": "Mulač, Jan", "note": "", "views": "67x", "geolocation_type": "regional.address"}}, {"type": "Feature", "geometry": {"type": "Point", "coordinates": [14.43704, 50.09958]}, "properties": {"id": "875B70F95D5D11E6A54F000C76270B94", "kind": "pozitiv", "description": "Pohled na stavbu Bubenského nábřeží. V pozadí domy ve Vltavské ulici - zleva dům čp. 437 (bubenský pivovar, pivovarská restaurace s Dělnickým divadlem) a domy čp. 436, 422, 423 a 421 v Holešovicích.", "date_label": "7.12.1908", "start_date": "1908-12-07", "end_date": "1908-12-07", "author": "", "note": "", "views": "103x", "geolocation_type": "regional.address"}}, {"type": "Feature", "geometry": {"type": "Point", "coordinates": [14.42708, 50.0821]}, "properties": {"id": "87B895278B0A11E2BF22525400E46D25", "kind": "negativ", "description": "Pohled do interiéru novostavby hotelu \"Arcivévoda Štěpán\" na Václavském náměstí (dům čp. 826 na Novém Městě - později \"Grandhotel Šroubek\" - dnes \"Grandhotel Evropa\") - kavárna v přízemí.", "date_label": "8.-12.8.1905", "start_date": "", "end_date": "", "author": "Eckert-ateliér", "note": "", "views": "55x", "geolocation_type": "regional.address"}}, {"type": "Feature", "geometry": {"type": "Point", "coordinates": [14.419, 50.07337]}, "properties": {"id": "881460B7E44111E4BE0074D435EEBE90", "kind": "pozitiv", "description": "Celkový pohled \"Faustův dům\" (dům čp. 502 na Novém Městě) na Karlově náměstí na Novém Městě.", "date_label": "", "start_date": "", "end_date": "", "author": "", "note": "", "views": "57x", "geolocation_type": "regional.address"}}, {"type": "Feature", "geometry": {"type": "Point", "coordinates": [14.42009, 50.087]}, "properties": {"id": "886963A290C111E8B3B474D435EEBE90", "kind": "negativ", "description": "Pohled na část orloje Staroměstské radnice (dům čp. 1 na Starém Městě) na Staroměstském náměstí při opravě.", "date_label": "kol.1910", "start_date": "1910-01-01", "end_date": "1910-12-31", "author": "", "note": "", "views": "21x", "geolocation_type": "regional.address"}}, {"type": "Feature", "geometry": {"type": "Point", "coordinates": [14.38224, 50.08528]}, "properties": {"id": "886EC7ECBB7911E594BE74D435EEBE90", "kind": "pozitiv", "description": "Pohled na dům čp. 1069 (hostinec U Vonásků - U Zelené brány) v Bělohorské ulici v Břevnově - s nízkými domky.", "date_label": "kol.1935", "start_date": "1935-01-01", "end_date": "1935-12-31", "author": "Dub, Václav (dokumenty 1928-1983)", "note": "", "views": "47x", "geolocation_type": "regional.address"}}, {"type": "Feature", "geometry": {"type": "Point", "coordinates": [14.40467, 50.10332]}, "properties": {"id": "887FAB115BF111E79925406186009F3A", "kind": "negativ", "description": "Celkový pohled na dům čp. 592 v ulici Českomalínská v Bubenči. Vlevo dům čp. 528.", "date_label": "po 1923", "start_date": "1924-01-01", "end_date": "2000-12-31", "author": "Vojta, Tomáš (1885-1934)", "note": "", "views": "32x", "geolocation_type": "regional.address"}}, {"type": "Feature", "geometry": {"type": "Point", "coordinates": [14.40454, 50.08495]}, "properties": {"id": "88D2DEECD5A311E18CF36C626D41E503", "kind": "pozitiv", "description": "Pohled do Karmelitské ulice s domem čp. 388 na Malé Straně (četnická kasárna).", "date_label": "26.1.1938", "start_date": "1938-01-26", "end_date": "1938-01-26", "author": "Alexander, Antonín (1892-působnost do 1948)", "note": "", "views": "64x", "geolocation_type": "regional.address"}}, {"type": "Feature", "geometry": {"type": "Point", "coordinates": [14.41883, 50.06985]}, "properties": {"id": "8949E5BDC0FC11E5A6A974D435EEBE90", "kind": "pozitiv", "description": "Pohled na jižní řídlo domu čp. 427 ve Vyšehradské ulici na Novém Městě - prostřední část původního chorobince sv. Bartoloměje adaptovaná pro ministerstvo spravedlnosti.", "date_label": "1939-1945", "start_date": "1939-01-01", "end_date": "1945-12-31", "author": "", "note": "", "views": "68x", "geolocation_type": "regional.address"}}, {"type": "Feature", "geometry": {"type": "Point", "coordinates": [14.39803, 50.08729]}, "properties": {"id": "899806FE8C9D11E2BF24525400E46D25", "kind": "negativ", "description": "Pohled do interiéru Lobkovického paláce čp. 347 (Černínský-Přehořovský palác) na Malé Straně - pracovna.", "date_label": "27.4.1909", "start_date": "1909-04-27", "end_date": "1909-04-27", "author": "Eckert-ateliér", "note": "", "views": "21x", "geolocation_type": "regional.address"}}, {"type": "Feature", "geometry": {"type": "Point", "coordinates": [14.43581, 50.03852]}, "properties": {"id": "89B37155157811E39CC26C626D41E503", "kind": "pozitiv", "description": "Celkový pohled na dům čp. 404 (Stará rychta) na nároží ulic Rytířské (v popředí) a Na Můstku na Starém Městě.", "date_label": "1926", "start_date": "1926-01-01", "end_date": "1926-12-31", "author": "Vojta, Tomáš (1885-1934)", "note": "", "views": "44x", "geolocation_type": "regional.address"}}, {"type": "Feature", "geometry": {"type": "Point", "coordinates": [14.42112, 50.08823]}, "properties": {"id": "89BFD586800F11E2BF1B525400E46D25", "kind": "negativ", "description": "Pohled na spodní část průčelí novostavby domu čp. 932 na Staroměstském náměstí (lékárna \"U Říšského orla\").", "date_label": "3.4.1902", "start_date": "1902-04-03", "end_date": "1902-04-03", "author": "Eckert, Jindřich (1833-1905)", "note": "", "views": "26x", "geolocation_type": "regional.address"}}, {"type": "Feature", "geometry": {"type": "Point", "coordinates": [14.42213, 50.08248]}, "properties": {"id": "8a423a039e1f4e14ab0d046caa047e52", "kind": "pozitiv", "description": "Celkový pohled na dům čp. 36 (Thunovský palác) na Novém Městě na nároží Jungmannovy ulice a Národní třídy.", "date_label": "", "start_date": "", "end_date": "", "author": "", "note": "", "views": "17x", "geolocation_type": "regional.address"}}, {"type": "Feature", "geometry": {"type": "Point", "coordinates": [14.40131, 50.08733]}, "properties": {"id": "8A4A239F79F811E3B274406186009F3A", "kind": "pozitiv", "description": "Kamna v Schönbornském paláci - domě čp. 365 na Malé Straně.", "date_label": "červen 1931", "start_date": "1931-06-01", "end_date": "1931-06-30", "author": "Vojta, Tomáš (1885-1934)", "note": "", "views": "23x", "geolocation_type": "regional.address"}}, {"type": "Feature", "geometry": {"type": "Point", "coordinates": [14.39243, 50.13299]}, "properties": {"id": "8A9097C9FE3611E483F974D435EEBE90", "kind": "pozitiv", "description": "Pohled na nárožní dům čp. 2 v Sedlci (hostinec \"U Lva\") v ulici V Sedlci.", "date_label": "1958", "start_date": "1958-01-01", "end_date": "1958-12-31", "author": "Hnilička, Eduard (1887-1967)", "note": "", "views": "40x", "geolocation_type": "regional.address"}}, {"type": "Feature", "geometry": {"type": "Point", "coordinates": [14.42767, 50.08708]}, "properties": {"id": "8AB0395EC5AE11E5B8BE406186009F3A", "kind": "negativ", "description": "Reprodukce grafického listu \"Příchod Prusův do Prahy dne 8. července 1866\".", "date_label": "", "start_date": "", "end_date": "", "author": "Reach, Zikmund (1859-1935)", "note": "", "views": "62x", "geolocation_type": "regional.address"}}, {"type": "Feature", "geometry": {"type": "Point", "coordinates": [14.42211, 50.08746]}, "properties": {"id": "8AB0395FC5AE11E5B8BE406186009F3A", "kind": "negativ", "description": "Reprodukce grafického listu \"Prusové na Staroměstském náměstí v Praze dne 8. července 1866\".", "date_label": "", "start_date": "", "end_date": "", "author": "Reach, Zikmund (1859-1935)", "note": "", "views": "36x", "geolocation_type": "regional.address"}}, {"type": "Feature", "geometry": {"type": "Point", "coordinates": [14.41347, 50.08126]}, "properties": {"id": "8B114FB817E211E891E8406186009F3A", "kind": "pozitiv", "description": "Pohled přes Vltavu na osvětlené Národní divadlo (dům čp. 223 na Novém Městě) při příležitosti 10. výročí samostatnosti Československé republiky.", "date_label": "28.10.1928", "start_date": "1928-10-28", "end_date": "1928-10-28", "author": "Vopravil, Josef (1902-1972)", "note": "Autorství J. Vopravila není jisté.", "views": "48x", "geolocation_type": "regional.address"}}, {"type": "Feature", "geometry": {"type": "Point", "coordinates": [14.50735, 50.05291]}, "properties": {"id": "8B98D72758FF11E89D7C74D435EEBE90", "kind": "pozitiv", "description": "Pohled na práčský zámeček (dnes dům čp. 1881) v Záběhlicích.", "date_label": "říjen 1959", "start_date": "1959-10-01", "end_date": "1959-10-31", "author": "Hnilička, Eduard (1887-1967)", "note": "", "views": "74x", "geolocation_type": "regional.address"}}, {"type": "Feature", "geometry": {"type": "Point", "coordinates": [14.42009, 50.087]}, "properties": {"id": "8BD2F6FDE28911E89F1B74D435EEBE90", "kind": "pozitiv", "description": "Pohled na jižní a východní průčelí Staroměstské radnice (dům čp. 1 na Starém Městě). Uprostřed část věže s orlojem a s arkýřem.", "date_label": "13.6.1902", "start_date": "1902-06-13", "end_date": "1902-06-13", "author": "Dvořák, František (dokumenty 1901-1908)", "note": "", "views": "46x", "geolocation_type": "regional.address"}}, {"type": "Feature", "geometry": {"type": "Point", "coordinates": [14.42817, 50.07019]}, "properties": {"id": "8BFA5F5E87DF11E2BF21525400E46D25", "kind": "negativ", "description": "Pohled do posluchárny Fyzikálního ústavu České univerzity na Albertově (dům čp. 2026 na Novém Městě) - směrem k tabuli.", "date_label": "29.7.1908", "start_date": "1908-07-29", "end_date": "1908-07-29", "author": "Eckert-ateliér", "note": "", "views": "30x", "geolocation_type": "regional.address"}}, {"type": "Feature", "geometry": {"type": "Point", "coordinates": [14.42037, 50.07983]}, "properties": {"id": "8BFDB25F87EB11E2BF21525400E46D25", "kind": "negativ", "description": "Pohled na průčelí domu čp. 47 do Vladislavovy ulice (Německá obecná škola pro chlapce) na Novém Městě.", "date_label": "kol.1890", "start_date": "1890-01-01", "end_date": "1890-12-31", "author": "Eckert, Jindřich (1833-1905)", "note": "", "views": "35x", "geolocation_type": "regional.address"}}, {"type": "Feature", "geometry": {"type": "Point", "coordinates": [14.40657, 50.09523]}, "properties": {"id": "8c3f2903103d46fb8ba132d75706c219", "kind": "diapozitiv", "description": "Celkový pohled na zahradní průčelí domu čp. 421 na nároží ulic Mickiewiczova a U Písecké brány na Hradčanech.", "date_label": "", "start_date": "", "end_date": "", "author": "Brejcha, Jaroslav, JUDr.", "note": "", "views": "11x", "geolocation_type": "regional.address"}}, {"type": "Feature", "geometry": {"type": "Point", "coordinates": [14.41783, 50.08711]}, "properties": {"id": "8c6f848a2516474299d6fbcec46b0ae9", "kind": "pozitiv", "description": "Pohled na stavbu budovy Magistrátu hlavního města Prahy (dům čp. 2) na Mariánském náměstí na Starém Městě. V pozadí věže kostela sv. Mikuláše a P. Marie před Týnem.", "date_label": "", "start_date": "", "end_date": "", "author": "", "note": "", "views": "9x", "geolocation_type": "regional.address"}}, {"type": "Feature", "geometry": {"type": "Point", "coordinates": [14.41521, 50.09017]}, "properties": {"id": "8CAB6FA95A6711E7A69B406186009F3A", "kind": "pohlednice", "description": "Pohled na adaptaci jeviště koncertního sálu Rudolfina (dům čp. 79 na Starém Městě) na tribunu Národního shromáždění.", "date_label": "26.8.1924", "start_date": "1924-08-26", "end_date": "1924-08-26", "author": "Kříženecký, Rudolf (dokument 1897-1931)", "note": "", "views": "33x", "geolocation_type": "regional.address"}}, {"type": "Feature", "geometry": {"type": "Point", "coordinates": [14.40131, 50.08733]}, "properties": {"id": "8CBC34F27D2211E3BE26406186009F3A", "kind": "pozitiv", "description": "Vrchol dřevěného schodiště v Schönbornském paláci - domě čp. 365 na Malé Straně.", "date_label": "červen 1931", "start_date": "1931-06-01", "end_date": "1931-06-30", "author": "Vojta, Tomáš (1885-1934)", "note": "", "views": "19x", "geolocation_type": "regional.address"}}, {"type": "Feature", "geometry": {"type": "Point", "coordinates": [14.44123, 50.09021]}, "properties": {"id": "8D12D56C310B11E9978874D435EEBE90", "kind": "negativ", "description": "Celkový pohled na hlavní průčelí domu čp. 283 v Karlíně (divadlo) v Palackého ulici (dnes Křižíkova). V pozadí vlevo část viaduktu.", "date_label": "kol.1900", "start_date": "1900-01-01", "end_date": "1900-12-31", "author": "Bellmann-ateliér", "note": "", "views": "60x", "geolocation_type": "regional.address"}}, {"type": "Feature", "geometry": {"type": "Point", "coordinates": [14.39535, 50.08934]}, "properties": {"id": "8d54f5a8aa15462886ec69a12d1fb39a", "kind": "pozitiv", "description": "Pohled z Hradčanského náměstí k 1. nádvoří Pražského hradu. V popředí brána se sochami zápasících Gigantů. Vlevo část Arcibiskupského paláce.", "date_label": "1904", "start_date": "1904-01-01", "end_date": "1904-12-31", "author": "Langhans, J. F.", "note": "", "views": "9x", "geolocation_type": "regional.address"}}, {"type": "Feature", "geometry": {"type": "Point", "coordinates": [14.42228, 50.09158]}, "properties": {"id": "8D7B73B3968911E49A5E406186009F3A", "kind": "pozitiv", "description": "Pohled na průchod domu čp. 803 v ulici U Obecního dvora na Starém Městě.", "date_label": "1908", "start_date": "1908-01-01", "end_date": "1908-12-31", "author": "Klíma, Alois, Ing. (1873-1955)", "note": "", "views": "69x", "geolocation_type": "regional.address"}}, {"type": "Feature", "geometry": {"type": "Point", "coordinates": [14.42428, 50.08045]}, "properties": {"id": "8DDC49B88B3311E2BF22525400E46D25", "kind": "negativ", "description": "Pohled do interiéru obchodního domu \"U Nováků\" (dům čp. 699 na Novém Městě) ve Vodičkově ulici - prodejna hraček.", "date_label": "21.11.1906", "start_date": "1906-11-21", "end_date": "1906-11-21", "author": "Eckert-ateliér", "note": "", "views": "53x", "geolocation_type": "regional.address"}}, {"type": "Feature", "geometry": {"type": "Point", "coordinates": [14.37789, 50.10489]}, "properties": {"id": "8DDEF402274F11E287E86C626D41E503", "kind": "pozitiv", "description": "Pohled na dům čp. 168 v ulici Na Hanspaulce. Vpravo novostavba sokolovny (dům čp. 166) v Dejvicích.", "date_label": "16.11.1943", "start_date": "1943-11-16", "end_date": "1943-11-16", "author": "Alexander, Antonín (1892-působnost do 1948)", "note": "", "views": "71x", "geolocation_type": "regional.address"}}, {"type": "Feature", "geometry": {"type": "Point", "coordinates": [14.42009, 50.087]}, "properties": {"id": "8DFBB42590B511E8B3B474D435EEBE90", "kind": "negativ", "description": "Pohled na orloj Staroměstské radnice (dům čp. 1 na Starém Městě) na Staroměstském náměstí. V popředí stanice tramvaje č. 5.", "date_label": "", "start_date": "", "end_date": "", "author": "", "note": "Reprodukce původní fotografie.", "views": "36x", "geolocation_type": "regional.address"}}, {"type": "Feature", "geometry": {"type": "Point", "coordinates": [14.40739, 50.08615]}, "properties": {"id": "8E20714B05B511E389696C626D41E503", "kind": "pozitiv", "description": "Pohled na dům čp. 490 (palác Metychů z Čečova - Hrzánský) na Velkopřevorském náměstí na Malé Straně s renesančním portálem.", "date_label": "19.10.1927", "start_date": "1927-10-19", "end_date": "1927-10-19", "author": "Alexander, Antonín (1892-působnost do 1948)", "note": "", "views": "24x", "geolocation_type": "regional.address"}}, {"type": "Feature", "geometry": {"type": "Point", "coordinates": [14.42265, 50.07965]}, "properties": {"id": "8E24F2C6B90611E0BE75000C766D2371", "kind": "pozitiv", "description": "Pohled na bourání (Braunova) domu čp. 730 na nároží Vodičkovy a Jungmannovy ulice na Novém Městě.", "date_label": "23.9.1911", "start_date": "1911-09-23", "end_date": "1911-09-23", "author": "Kříženecký, Jan (1868-1921)", "note": "", "views": "56x", "geolocation_type": "regional.address"}}, {"type": "Feature", "geometry": {"type": "Point", "coordinates": [14.42009, 50.087]}, "properties": {"id": "8E66B9A290C211E8B3B474D435EEBE90", "kind": "negativ", "description": "Pohled na část jižního průčelí Staroměstské radnice s portálem a s orlojem (dům čp. 1 na Starém Městě) na Staroměstském náměstí.", "date_label": "", "start_date": "", "end_date": "", "author": "", "note": "", "views": "23x", "geolocation_type": "regional.address"}}, {"type": "Feature", "geometry": {"type": "Point", "coordinates": [14.42036, 50.13226]}, "properties": {"id": "8E79FC9B1C0911E6A449406186009F3A", "kind": "pozitiv", "description": "Pohled na Základní školu Ústavní (dům čp. 400 v Bohnicích).", "date_label": "1977", "start_date": "1977-01-01", "end_date": "1977-12-31", "author": "Jelínková, Jana (1951-)", "note": "", "views": "92x", "geolocation_type": "regional.address"}}, {"type": "Feature", "geometry": {"type": "Point", "coordinates": [14.40131, 50.08733]}, "properties": {"id": "8E7E7E0D79DD11E3B274406186009F3A", "kind": "pozitiv", "description": "Pohled na západní stranu západního dvoru Schönbornského paláce - domu čp. 365 na Malé Straně.", "date_label": "", "start_date": "", "end_date": "", "author": "Vojta, Tomáš (1885-1934)", "note": "Autorství T. Vojty není jisté.", "views": "27x", "geolocation_type": "regional.address"}}, {"type": "Feature", "geometry": {"type": "Point", "coordinates": [14.40739, 50.08615]}, "properties": {"id": "8E99AAAE04F111E3A4F66C626D41E503", "kind": "pozitiv", "description": "Pohled na dům čp. 490 (palác Metychů z Čečova - Hrzánský) na Velkopřevorském náměstí na Malé Straně.", "date_label": "25.3.1908", "start_date": "1908-03-25", "end_date": "1908-03-25", "author": "Kříženecký, Jan (1868-1921)", "note": "", "views": "26x", "geolocation_type": "regional.address"}}, {"type": "Feature", "geometry": {"type": "Point", "coordinates": [14.40739, 50.08615]}, "properties": {"id": "8EA9A17004FB11E3A4F66C626D41E503", "kind": "pozitiv", "description": "Pohled na dům čp. 490 (palác Metychů z Čečova - Hrzánský) na Velkopřevorském náměstí na Malé Straně.", "date_label": "kol.1910", "start_date": "1910-01-01", "end_date": "1910-12-31", "author": "Fink, František (1854-1935)", "note": "", "views": "30x", "geolocation_type": "regional.address"}}, {"type": "Feature", "geometry": {"type": "Point", "coordinates": [14.40739, 50.08615]}, "properties": {"id": "8F12B6D005B911E389696C626D41E503", "kind": "pozitiv", "description": "Pohled na renesanční portál domu čp. 490 (palác Metychů z Čečova - Hrzánský) na Velkopřevorském náměstí na Malé Straně.", "date_label": "kol.1915", "start_date": "1915-01-01", "end_date": "1915-12-31", "author": "", "note": "", "views": "21x", "geolocation_type": "regional.address"}}, {"type": "Feature", "geometry": {"type": "Point", "coordinates": [14.40254, 50.08766]}, "properties": {"id": "8F20CC37D1AF11E18F8C6C626D41E503", "kind": "pozitiv", "description": "Pohled na část průčelí s portálem domu čp. 260 na Malé Straně.", "date_label": "19.9.1947", "start_date": "1947-09-19", "end_date": "1947-09-19", "author": "Poustecký, Josef", "note": "", "views": "16x", "geolocation_type": "regional.address"}}, {"type": "Feature", "geometry": {"type": "Point", "coordinates": [14.42095, 50.0867]}, "properties": {"id": "8F5C5BBB00B711E69BA4406186009F3A", "kind": "pozitiv", "description": "Pohled do dvora domu čp. 480 na Starém Městě s barokní nikou a sochou sv. Jana Nepomuckého od Ignáce Františka Platzera.", "date_label": "1958", "start_date": "1958-01-01", "end_date": "1958-12-31", "author": "Hnilička, Eduard (1887-1967)", "note": "", "views": "12x", "geolocation_type": "regional.address"}}, {"type": "Feature", "geometry": {"type": "Point", "coordinates": [14.41873, 50.08783]}, "properties": {"id": "8F6C8034808A11E4AAB4406186009F3A", "kind": "pozitiv", "description": "Pohled na gotické ostění domu čp. 16 na Starém Městě (Andělská kolej) v Mikulášské ulici (dnes náměstí Franze Kafky).", "date_label": "11.3.1909", "start_date": "1909-03-11", "end_date": "1909-03-11", "author": "Kříženecký, Jan (1868-1921)", "note": "", "views": "32x", "geolocation_type": "regional.address"}}, {"type": "Feature", "geometry": {"type": "Point", "coordinates": [14.53171, 50.03367]}, "properties": {"id": "8FB4E8CD1C0C11E6A449406186009F3A", "kind": "pozitiv", "description": "Panoramatický pohled na Hviezdoslavovu ulici se Základní školou Mendelova (dům čp. 550 na Hájích). První část dvoudílného panoramatu.", "date_label": "1982", "start_date": "1982-01-01", "end_date": "1982-12-31", "author": "Jelínková, Jana (1951-)", "note": "", "views": "50x", "geolocation_type": "regional.address"}}, {"type": "Feature", "geometry": {"type": "Point", "coordinates": [14.42156, 50.078]}, "properties": {"id": "8FDFBF5A7C4411E2BF19525400E46D25", "kind": "negativ", "description": "Pohled do interiéru domu čp. 671 na Karlově náměstí na Novém Městě (Salmovský palác) - budoár.", "date_label": "kol.1900", "start_date": "1900-01-01", "end_date": "1900-12-31", "author": "Eckert, Jindřich (1833-1905)", "note": "", "views": "36x", "geolocation_type": "regional.address"}}, {"type": "Feature", "geometry": {"type": "Point", "coordinates": [14.42009, 50.087]}, "properties": {"id": "9008966D90E911E8B3B474D435EEBE90", "kind": "pozitiv", "description": "Pohled na část astronomického ciferníku ve střední části orloje Staroměstské radnice (dům čp. 1 na Starém Městě) na Staroměstském náměstí při restaurování. Vlevo sochy Marnivce a Lakomce.", "date_label": "19.9.1911", "start_date": "1911-09-19", "end_date": "1911-09-19", "author": "Kříženecký, Jan (1868-1921)", "note": "", "views": "37x", "geolocation_type": "regional.address"}}, {"type": "Feature", "geometry": {"type": "Point", "coordinates": [14.44531, 50.09841]}, "properties": {"id": "902FBFA6921811E2BF28525400E46D25", "kind": "negativ", "description": "Pohled do interiéru jatek vepřového dobytka v areálu pražských Ústředních jatek v Holešovicích (dům čp. 306).", "date_label": "1895", "start_date": "1895-01-01", "end_date": "1895-12-31", "author": "Eckert, Jindřich (1833-1905)", "note": "", "views": "41x", "geolocation_type": "regional.address"}}, {"type": "Feature", "geometry": {"type": "Point", "coordinates": [14.4186, 50.0808]}, "properties": {"id": "908BDCF6923011E2BF28525400E46D25", "kind": "negativ", "description": "Pohled do 1. dvora domu čp. 126 na Novém Městě v Ostrovní ulici - proti hlavnímu vchodu.", "date_label": "kol.1900", "start_date": "1900-01-01", "end_date": "1900-12-31", "author": "Eckert, Jindřich (1833-1905)", "note": "", "views": "14x", "geolocation_type": "regional.address"}}, {"type": "Feature", "geometry": {"type": "Point", "coordinates": [14.65102, 50.17658]}, "properties": {"id": "908E33778B0611E2BF22525400E46D25", "kind": "negativ", "description": "Pohled do interiéru hotelu Paříž (dům čp. 1080 na Starém Městě) - kavárna.", "date_label": "16.-17.10.1905", "start_date": "", "end_date": "", "author": "Eckert-ateliér", "note": "", "views": "43x", "geolocation_type": "regional.address"}}, {"type": "Feature", "geometry": {"type": "Point", "coordinates": [14.41783, 50.08711]}, "properties": {"id": "90AD52CC4DA211E1A9526C626D41E503", "kind": "pozitiv", "description": "Pohled na budovu Magistrátu hlavního města Prahy (dům čp. 2) na Starém Městě na Mariánském náměstí.", "date_label": "1949", "start_date": "1949-01-01", "end_date": "1949-12-31", "author": "", "note": "", "views": "20x", "geolocation_type": "regional.address"}}, {"type": "Feature", "geometry": {"type": "Point", "coordinates": [14.39071, 50.08877]}, "properties": {"id": "910103C057EC11E7A695406186009F3A", "kind": "pozitiv", "description": "Pohled na severní průčelí Černínského paláce (dům čp. 101) na Hradčanech se vojenskými stájemi v zahradě.", "date_label": "", "start_date": "", "end_date": "", "author": "", "note": "", "views": "36x", "geolocation_type": "regional.address"}}, {"type": "Feature", "geometry": {"type": "Point", "coordinates": [14.40957, 50.09228]}, "properties": {"id": "9102E87587EC11E2BF21525400E46D25", "kind": "negativ", "description": "Pohled do interiéru domu čp. 132 na Malé Straně (kasárna pod Bruskou) - jídelna.", "date_label": "kol.1890", "start_date": "1890-01-01", "end_date": "1890-12-31", "author": "Eckert, Jindřich (1833-1905)", "note": "", "views": "21x", "geolocation_type": "regional.address"}}, {"type": "Feature", "geometry": {"type": "Point", "coordinates": [14.39151, 50.08925]}, "properties": {"id": "910437069B8611E2BF2D525400E46D25", "kind": "pozitiv", "description": "Pohled na kapli P. Marie (Svatá chýše - Santa casa) na nádvoří Lorety (dům čp. 100 na Hradčanech) na Loretánském náměstí - štuková výzdoba levé části severní strany.", "date_label": "kol.1895", "start_date": "1895-01-01", "end_date": "1895-12-31", "author": "Eckert, Jindřich (1833-1905)", "note": "", "views": "19x", "geolocation_type": "regional.address"}}, {"type": "Feature", "geometry": {"type": "Point", "coordinates": [14.43056, 50.07918]}, "properties": {"id": "91174246D85111E89C7B74D435EEBE90", "kind": "pozitiv", "description": "Průhled Václavským náměstím od Můstku. V pozadí Národní muzeum (dům čp. 1700 na Novém Městě). Vlevo domy východní strany náměstí.", "date_label": "1901-1902", "start_date": "1901-01-01", "end_date": "1902-12-31", "author": "Bellmann-ateliér", "note": "", "views": "60x", "geolocation_type": "regional.address"}}, {"type": "Feature", "geometry": {"type": "Point", "coordinates": [14.42788, 50.08949]}, "properties": {"id": "913EF6BC161111E390486C626D41E503", "kind": "pozitiv", "description": "Pohled na část prostranství po zbořeném domě čp. 655 na Starém Městě (Ústav šlechtičen) při Revoluční třídě (vpravo). Uprostřed zbytek sklepení a střední chodby traktu a zbytky hradebního příkopu (zcela vlevo).", "date_label": "15.3.1928", "start_date": "1928-03-15", "end_date": "1928-03-15", "author": "Alexander, Antonín (1892-působnost do 1948)", "note": "", "views": "72x", "geolocation_type": "regional.address"}}, {"type": "Feature", "geometry": {"type": "Point", "coordinates": [14.40977, 50.09009]}, "properties": {"id": "9163233DD63811E18B876C626D41E503", "kind": "pozitiv", "description": "Pohled na dům čp. 526 na nároží Klárova a Letenské ulice (průhled vlevo). V pozadí Pražský hrad.", "date_label": "1939-1945", "start_date": "1939-01-01", "end_date": "1945-12-31", "author": "", "note": "", "views": "77x", "geolocation_type": "regional.address"}}, {"type": "Feature", "geometry": {"type": "Point", "coordinates": [14.42009, 50.087]}, "properties": {"id": "9192CF0290C311E8B3B474D435EEBE90", "kind": "negativ", "description": "Pohled na část jižního průčelí Staroměstské radnice s portálem a s orlojem (dům čp. 1 na Starém Městě) na Staroměstském náměstí.", "date_label": "", "start_date": "", "end_date": "", "author": "", "note": "", "views": "22x", "geolocation_type": "regional.address"}}, {"type": "Feature", "geometry": {"type": "Point", "coordinates": [14.45608, 50.05573]}, "properties": {"id": "9196373476F011E38AA26C626D41E503", "kind": "pozitiv", "description": "Panoramatický pohled od Reitknechtky (dům čp. 121 v Michli) na Michli.", "date_label": "7.5.1927", "start_date": "1927-05-07", "end_date": "1927-05-07", "author": "Alexander, Antonín (1892-působnost do 1948)", "note": "", "views": "143x", "geolocation_type": "regional.address"}}, {"type": "Feature", "geometry": {"type": "Point", "coordinates": [14.41426, 50.08298]}, "properties": {"id": "91C04D5E81D611E3B4B96C626D41E503", "kind": "pozitiv", "description": "Pohled na portál domu čp. 320 v ulici Karoliny Světlé na Starém Městě.", "date_label": "6.11.1927", "start_date": "1927-11-06", "end_date": "1927-11-06", "author": "Alexander, Antonín (1892-působnost do 1948)", "note": "", "views": "32x", "geolocation_type": "regional.address"}}, {"type": "Feature", "geometry": {"type": "Point", "coordinates": [14.39803, 50.08729]}, "properties": {"id": "91D4ADA88C9E11E2BF24525400E46D25", "kind": "negativ", "description": "Pohled do interiéru Lobkovického paláce čp. 347 (Černínský-Přehořovský palác) na Malé Straně - salon.", "date_label": "27.4.1909", "start_date": "1909-04-27", "end_date": "1909-04-27", "author": "Eckert-ateliér", "note": "", "views": "17x", "geolocation_type": "regional.address"}}, {"type": "Feature", "geometry": {"type": "Point", "coordinates": [14.42009, 50.087]}, "properties": {"id": "91EA777E90E211E8B3B474D435EEBE90", "kind": "pozitiv", "description": "Pohled na sochu anděla nad středem orloje Staroměstské radnice při restaurování (dům čp. 1 na Starém Městě) na Staroměstském náměstí.", "date_label": "11.9.1911", "start_date": "1911-09-11", "end_date": "1911-09-11", "author": "Kříženecký, Jan (1868-1921)", "note": "", "views": "42x", "geolocation_type": "regional.address"}}, {"type": "Feature", "geometry": {"type": "Point", "coordinates": [14.41397, 50.0855]}, "properties": {"id": "9208B07A81E311E3B4B96C626D41E503", "kind": "pozitiv", "description": "Pohled ze Smetanova nábřeží (v popředí) na Novotného lávku s věží staroměstské vodárny a domem čp. 198 (Karlovy lázně) na Starém Městě.", "date_label": "1985", "start_date": "1985-01-01", "end_date": "1985-12-31", "author": "Rameš, František", "note": "", "views": "53x", "geolocation_type": "regional.address"}}, {"type": "Feature", "geometry": {"type": "Point", "coordinates": [14.41873, 50.08783]}, "properties": {"id": "9244CE8D808811E4AAB4406186009F3A", "kind": "pozitiv", "description": "Pohled na zbytky románského zdiva nalezeného při bourání domu čp. 16 na Starém Městě (Andělská kolej) v Mikulášské ulici (dnes náměstí Franze Kafky) .", "date_label": "1909", "start_date": "1909-01-01", "end_date": "1909-12-31", "author": "Kříženecký, Jan (1868-1921)", "note": "", "views": "35x", "geolocation_type": "regional.address"}}, {"type": "Feature", "geometry": {"type": "Point", "coordinates": [14.40395, 50.08915]}, "properties": {"id": "92578E795A4711E7A69B406186009F3A", "kind": "pozitiv", "description": "Pohled na shromážděný dav při vyhlášení Československé republiky při první schůzi Národního shromáždění před domem čp. 176 (sněmovna) ve Sněmovní ulici na Malé Straně.", "date_label": "14.11.1918", "start_date": "1918-11-14", "end_date": "1918-11-14", "author": "Reach, Zikmund (1859-1935)", "note": "", "views": "93x", "geolocation_type": "regional.address"}}, {"type": "Feature", "geometry": {"type": "Point", "coordinates": [14.41521, 50.09017]}, "properties": {"id": "9289C891124511E8A338406186009F3A", "kind": "pozitiv", "description": "Pohled na osvětlené Rudolfinum (dům čp. 79 Starém Městě) při příležitosti 10. výročí samostatnosti Československé republiky.", "date_label": "28.10.1928", "start_date": "1928-10-28", "end_date": "1928-10-28", "author": "Vopravil, Josef (1902-1972)", "note": "", "views": "34x", "geolocation_type": "regional.address"}}, {"type": "Feature", "geometry": {"type": "Point", "coordinates": [14.40131, 50.08733]}, "properties": {"id": "929632697D3911E3BE26406186009F3A", "kind": "pozitiv", "description": "Detail vrcholně barokní štukové výzdoby stropu Schönbornského paláce - domu čp. 365 na Malé Straně.", "date_label": "", "start_date": "", "end_date": "", "author": "", "note": "", "views": "14x", "geolocation_type": "regional.address"}}, {"type": "Feature", "geometry": {"type": "Point", "coordinates": [14.40131, 50.08733]}, "properties": {"id": "92DE20A879E511E3B274406186009F3A", "kind": "pozitiv", "description": "Interiér piana nobile s dveřmi v Schönbornském paláci - domě čp. 365 na Malé Straně.", "date_label": "červen 1931", "start_date": "1931-06-01", "end_date": "1931-06-30", "author": "Vojta, Tomáš (1885-1934)", "note": "", "views": "22x", "geolocation_type": "regional.address"}}, {"type": "Feature", "geometry": {"type": "Point", "coordinates": [14.44531, 50.09841]}, "properties": {"id": "92F47BD076B311E2BF17525400E46D25", "kind": "negativ", "description": "Pohled na budovu strojovny pražských Ústředních jatek v Holešovicích (dům čp. 306).", "date_label": "1895", "start_date": "1895-01-01", "end_date": "1895-12-31", "author": "Eckert, Jindřich (1833-1905)", "note": "", "views": "48x", "geolocation_type": "regional.address"}}, {"type": "Feature", "geometry": {"type": "Point", "coordinates": [14.39375, 50.08878]}, "properties": {"id": "93052C29748511E4A81F406186009F3A", "kind": "pozitiv", "description": "Pohled do zahrady domu čp. 180 na Hradčanech (bývalý Trautmannsdorfský palác). V pozadí věže Lorety.", "date_label": "před 1926", "start_date": "1800-01-01", "end_date": "1925-12-31", "author": "Vojta, Tomáš (1885-1934)", "note": "", "views": "22x", "geolocation_type": "regional.address"}}, {"type": "Feature", "geometry": {"type": "Point", "coordinates": [14.41872, 50.06875]}, "properties": {"id": "936076E9768811E2BF17525400E46D25", "kind": "negativ", "description": "Celkový pohled na dům čp. 1937 (\"Unie\") v ulici Na Děkance na Novém Městě.", "date_label": "4.5.1902", "start_date": "1902-05-04", "end_date": "1902-05-04", "author": "Eckert, Jindřich (1833-1905)", "note": "", "views": "18x", "geolocation_type": "regional.address"}}, {"type": "Feature", "geometry": {"type": "Point", "coordinates": [14.41719, 50.07215]}, "properties": {"id": "936609AC76C011E2BF17525400E46D25", "kind": "negativ", "description": "Pohled do interiéru kláštera Na Slovanech (v Emauzích) - dům čp. 320 na Novém Městě - chodba v 1. patře.", "date_label": "kol.1895", "start_date": "1895-01-01", "end_date": "1895-12-31", "author": "Eckert, Jindřich (1833-1905)", "note": "", "views": "24x", "geolocation_type": "regional.address"}}, {"type": "Feature", "geometry": {"type": "Point", "coordinates": [14.42601, 50.07543]}, "properties": {"id": "936A4B0081A111E2BF1C525400E46D25", "kind": "negativ", "description": "Pohled do interiéru školy čp. 517 v Ječné ulici na Novém Městě (česká státní reálka) - exhortní sál.", "date_label": "kol.1890", "start_date": "1890-01-01", "end_date": "1890-12-31", "author": "Eckert, Jindřich (1833-1905)", "note": "", "views": "49x", "geolocation_type": "regional.address"}}, {"type": "Feature", "geometry": {"type": "Point", "coordinates": [14.42678, 50.08486]}, "properties": {"id": "93A4AD687F8111E88359406186009F3A", "kind": "negativ", "description": "Pohřební průvod legionářů popravených během 1. světové války. V pozadí domy čp. (zprava) 856, 857, 858 a 859 v ulici Na Příkopě na Novém Městě.", "date_label": "24.4.1921", "start_date": "1921-04-24", "end_date": "1921-04-24", "author": "Reach, Zikmund (1859-1935)", "note": "", "views": "41x", "geolocation_type": "regional.address"}}, {"type": "Feature", "geometry": {"type": "Point", "coordinates": [14.42009, 50.087]}, "properties": {"id": "93F3710490B311E8B3B474D435EEBE90", "kind": "negativ", "description": "Pohled na orloj Staroměstské radnice (dům čp. 1 na Starém Městě) na Staroměstském náměstí. V popředí stanice tramvaje č. 5.", "date_label": "", "start_date": "", "end_date": "", "author": "", "note": "Reprodukce původní fotografie.", "views": "39x", "geolocation_type": "regional.address"}}, {"type": "Feature", "geometry": {"type": "Point", "coordinates": [14.49575, 50.05134]}, "properties": {"id": "9464DD36590211E89D7C74D435EEBE90", "kind": "pozitiv", "description": "Pohled na část záběhlického zámku (dnes dům čp. 46) v Záběhlicích.", "date_label": "1958", "start_date": "1958-01-01", "end_date": "1958-12-31", "author": "Hnilička, Eduard (1887-1967)", "note": "", "views": "61x", "geolocation_type": "regional.address"}}, {"type": "Feature", "geometry": {"type": "Point", "coordinates": [14.40535, 50.09003]}, "properties": {"id": "948472A05F5811E8A52374D435EEBE90", "kind": "pozitiv", "description": "Celkový pohled na hlavní průčelí Valdštejnského paláce (dům čp. 17 na Malé Straně) na Valdštejnském náměstí.", "date_label": "kol.1890", "start_date": "1890-01-01", "end_date": "1890-12-31", "author": "", "note": "", "views": "30x", "geolocation_type": "regional.address"}}, {"type": "Feature", "geometry": {"type": "Point", "coordinates": [14.42573, 50.08795]}, "properties": {"id": "9491AAE1F23111E39D34406186009F3A", "kind": "pozitiv", "description": "Pohled z výšky na Králodvorská kasárna (dům čp. 654 - kadetní škola) na Josefském náměstí (náměstí Republiky) při bourání. V pozadí Prašná brána.", "date_label": "1903", "start_date": "1903-01-01", "end_date": "1903-12-31", "author": "", "note": "", "views": "104x", "geolocation_type": "regional.address"}}, {"type": "Feature", "geometry": {"type": "Point", "coordinates": [14.38547, 50.07583]}, "properties": {"id": "94BF0104922D11E2BF28525400E46D25", "kind": "negativ", "description": "Pohled do interiéru budovy Ústavu pro zaopatřování slepců Francisco Josephinum (dům čp. 737 na Smíchově - Palata) - kuchyně.", "date_label": "1893", "start_date": "1893-01-01", "end_date": "1893-12-31", "author": "Eckert, Jindřich (1833-1905)", "note": "", "views": "31x", "geolocation_type": "regional.address"}}, {"type": "Feature", "geometry": {"type": "Point", "coordinates": [14.41759, 50.08865]}, "properties": {"id": "94EB62DB81C211E2BF1D525400E46D25", "kind": "negativ", "description": "Pohled na severní stranu Mariánského náměstí po vybourání původních domů. Uprostřed vlevo dům čp. 98 (původní budova městské knihovny). Nad ní domy v Kaprově ulici. Vlevo novostavby ve Valentinské ulici, vpravo domy v Žatecké ulici. V pozadí Uprostřed dům čp. 17 v Josefově (původně dům čp. 48) na nároží ulic Kaprovy a Žatecké.", "date_label": "1914", "start_date": "1914-01-01", "end_date": "1914-12-31", "author": "Eckert-ateliér", "note": "", "views": "55x", "geolocation_type": "regional.address"}}, {"type": "Feature", "geometry": {"type": "Point", "coordinates": [14.40954, 50.08875]}, "properties": {"id": "950038F0769B11E2BF17525400E46D25", "kind": "negativ", "description": "Pohled do zahrady domu čp. 43 na Malé Straně (klášter Bosých karmelitánek - Anglických panen). Dnes Vojanovy sady.", "date_label": "kol.1880", "start_date": "1880-01-01", "end_date": "1880-12-31", "author": "Eckert, Jindřich (1833-1905)", "note": "", "views": "36x", "geolocation_type": "regional.address"}}, {"type": "Feature", "geometry": {"type": "Point", "coordinates": [14.40447, 50.10336]}, "properties": {"id": "9507A5545BEC11E79925406186009F3A", "kind": "negativ", "description": "Celkový pohled na dům čp. 592 v ulici Českomalínská v Bubenči.", "date_label": "po 1923", "start_date": "1924-01-01", "end_date": "2000-12-31", "author": "Vojta, Tomáš (1885-1934)", "note": "", "views": "42x", "geolocation_type": "regional.address"}}, {"type": "Feature", "geometry": {"type": "Point", "coordinates": [14.43056, 50.07918]}, "properties": {"id": "954CB7EDD85711E89C7B74D435EEBE90", "kind": "pozitiv", "description": "Průhled Václavským náměstím od Můstku. V pozadí Národní muzeum (dům čp. 1700 na Novém Městě). Po obou stranách domy náměstí.", "date_label": "1900", "start_date": "1900-01-01", "end_date": "1900-12-31", "author": "Bellmann-ateliér", "note": "", "views": "59x", "geolocation_type": "regional.address"}}, {"type": "Feature", "geometry": {"type": "Point", "coordinates": [14.41783, 50.08711]}, "properties": {"id": "9566f4b15155424cb7fcb18e19efefe6", "kind": "pozitiv", "description": "Pohled na stavbu budovy Magistrátu hlavního města Prahy (dům čp. 2) na Mariánském náměstí na Starém Městě. V pozadí Platnéřská ulice.", "date_label": "1909-1910", "start_date": "1909-01-01", "end_date": "1910-12-31", "author": "", "note": "", "views": "11x", "geolocation_type": "regional.address"}}, {"type": "Feature", "geometry": {"type": "Point", "coordinates": [14.42732, 50.08641]}, "properties": {"id": "95796E8F955C11E2BF29525400E46D25", "kind": "negativ", "description": "Pohled do interiéru domu čp. 859 na Novém Městě (Německý dům - kasino, Slovanský dům) - zrcadlový sál vyzdobený při slavnosti císaře Viléma.", "date_label": "1897", "start_date": "1897-01-01", "end_date": "1897-12-31", "author": "Eckert, Jindřich (1833-1905)", "note": "", "views": "18x", "geolocation_type": "regional.address"}}, {"type": "Feature", "geometry": {"type": "Point", "coordinates": [14.42009, 50.087]}, "properties": {"id": "95CD7F1D90EA11E8B3B474D435EEBE90", "kind": "pozitiv", "description": "Socha Kronikáře a Filozofa z orloje v jižním průčelí Staroměstské radnice (dům čp. 1 na Starém Městě) na Staroměstském náměstí před restaurováním.", "date_label": "21.9.1911", "start_date": "1911-09-21", "end_date": "1911-09-21", "author": "Kříženecký, Jan (1868-1921)", "note": "", "views": "37x", "geolocation_type": "regional.address"}}, {"type": "Feature", "geometry": {"type": "Point", "coordinates": [14.39071, 50.08877]}, "properties": {"id": "95EE1980DC5111DFBD60000C766D2371", "kind": "pozitiv", "description": "Reprodukce skicy nástěnné malby (č. 10) v interiéru Černínského paláce (dům čp. 101 na Hradčanech).", "date_label": "1891", "start_date": "1891-01-01", "end_date": "1891-12-31", "author": "Eckert, Jindřich (1833-1905)", "note": "", "views": "25x", "geolocation_type": "regional.address"}}, {"type": "Feature", "geometry": {"type": "Point", "coordinates": [14.42009, 50.087]}, "properties": {"id": "95F24A5D917811E8B9E274D435EEBE90", "kind": "pozitiv", "description": "Socha Filosofa a Kronikáře z orloje v jižním průčelí Staroměstské radnice (dům čp. 1 na Starém Městě) na Staroměstském náměstí po restaurování.", "date_label": "18.12.1911", "start_date": "1911-12-18", "end_date": "1911-12-18", "author": "Kříženecký, Jan (1868-1921)", "note": "", "views": "36x", "geolocation_type": "regional.address"}}, {"type": "Feature", "geometry": {"type": "Point", "coordinates": [14.41783, 50.08711]}, "properties": {"id": "963573faef9c46a5a853222f8862115d", "kind": "pozitiv", "description": "Pohled na novostavbu budovy Magistrátu hlavního města Prahy (dům čp. 2) na Mariánském náměstí na Starém Městě z náměstí Franze Kafky.", "date_label": "1910-1911", "start_date": "1910-01-01", "end_date": "1911-12-31", "author": "", "note": "", "views": "10x", "geolocation_type": "regional.address"}}, {"type": "Feature", "geometry": {"type": "Point", "coordinates": [14.42403, 50.08418]}, "properties": {"id": "96369237C98311E4A4AD406186009F3A", "kind": "pozitiv", "description": "Pohled na novostavbu domu čp. 846 (palác Koruna) na Novém Městě na nároží Václavského náměstí a ulice Na Příkopě.", "date_label": "", "start_date": "", "end_date": "", "author": "", "note": "", "views": "60x", "geolocation_type": "regional.address"}}, {"type": "Feature", "geometry": {"type": "Point", "coordinates": [14.40444, 50.08544]}, "properties": {"id": "9682EE578D6611E2BF25525400E46D25", "kind": "negativ", "description": "Pohled do interiéru domu čp. 386 na Malé Straně (Rohanský palác) - sál s exponáty při výstavě parohů.", "date_label": "1893", "start_date": "1893-01-01", "end_date": "1893-12-31", "author": "Eckert, Jindřich (1833-1905)", "note": "", "views": "33x", "geolocation_type": "regional.address"}}, {"type": "Feature", "geometry": {"type": "Point", "coordinates": [14.41783, 50.08711]}, "properties": {"id": "969082c1902144ab9faebebf756375ee", "kind": "pozitiv", "description": "Pohled na stavbu budovy Magistrátu hlavního města Prahy (dům čp. 2) na Mariánském náměstí na Starém Městě.", "date_label": "5.7.1910", "start_date": "1910-07-05", "end_date": "1910-07-05", "author": "", "note": "", "views": "8x", "geolocation_type": "regional.address"}}, {"type": "Feature", "geometry": {"type": "Point", "coordinates": [14.44063, 50.09065]}, "properties": {"id": "96A39BBED94A11E99D14406186009F3A", "kind": "negativ", "description": "Průhled ulicí Za Poříčskou bránou v Karlíně s domy čp. (zprava) 334, 256, 257, 315 a 214. V pozadí Negrelliho viadukt.", "date_label": "", "start_date": "", "end_date": "", "author": "Bellmann-ateliér", "note": "", "views": "69x", "geolocation_type": "regional.address"}}, {"type": "Feature", "geometry": {"type": "Point", "coordinates": [14.42009, 50.087]}, "properties": {"id": "96DDDC7990B811E8B3B474D435EEBE90", "kind": "negativ", "description": "Pohled na vyobrazení měsíců Josefa Mánesa (znamení Býk) na orloji Staroměstské radnice (dům čp. 1 na Starém Městě) na Staroměstském náměstí.", "date_label": "", "start_date": "", "end_date": "", "author": "", "note": "", "views": "21x", "geolocation_type": "regional.address"}}, {"type": "Feature", "geometry": {"type": "Point", "coordinates": [14.42009, 50.087]}, "properties": {"id": "96F9A45ED64711E5A67174D435EEBE90", "kind": "pozitiv", "description": "Pohled na vystavené hodinové stroje orloje na Staroměstské radnice (dům čp. 1 na Starém Městě) na Staroměstském náměstí během opravy orloje v letech 1865-1866.", "date_label": "1865", "start_date": "1865-01-01", "end_date": "1865-12-31", "author": "Fridrich, František (1829-1892)", "note": "", "views": "72x", "geolocation_type": "regional.address"}}, {"type": "Feature", "geometry": {"type": "Point", "coordinates": [14.42903, 50.08791]}, "properties": {"id": "96FCD8D2174911EABE1274D435EEBE90", "kind": "pozitiv", "description": "Celkový pohled na Hybernský palác (dům čp. 1037 na Novém Městě) na náměstí Republiky.", "date_label": "kol.1930", "start_date": "1930-01-01", "end_date": "1930-12-31", "author": "", "note": "", "views": "46x", "geolocation_type": "regional.address"}}, {"type": "Feature", "geometry": {"type": "Point", "coordinates": [14.39375, 50.08878]}, "properties": {"id": "96FF10DA748711E4A81F406186009F3A", "kind": "pozitiv", "description": "Pohled do zahrady domu čp. 180 na Hradčanech (bývalý Trautmannsdorfský palác) - \"práce na výkopu válečného vodního bazénu\". V pozadí část západního průčelí domu čp. 180, vpravo část kapličky při Loretánské ulici.", "date_label": "5.6.1944", "start_date": "1944-06-05", "end_date": "1944-06-05", "author": "Alexander, Antonín (1892-působnost do 1948)", "note": "", "views": "36x", "geolocation_type": "regional.address"}}, {"type": "Feature", "geometry": {"type": "Point", "coordinates": [14.41783, 50.08711]}, "properties": {"id": "98006427891f46019722e0c24e9a9faf", "kind": "pozitiv", "description": "Pohled na stavbu budovy Magistrátu hlavního města Prahy (dům čp. 2) na Mariánském náměstí na Starém Městě.", "date_label": "", "start_date": "", "end_date": "", "author": "", "note": "", "views": "8x", "geolocation_type": "regional.address"}}, {"type": "Feature", "geometry": {"type": "Point", "coordinates": [14.419, 50.07337]}, "properties": {"id": "980E3AD4E43E11E4BE0074D435EEBE90", "kind": "pozitiv", "description": "Celkový pohled \"Faustův dům\" (dům čp. 502 na Novém Městě) na Karlově náměstí na Novém Městě.", "date_label": "", "start_date": "", "end_date": "", "author": "", "note": "", "views": "57x", "geolocation_type": "regional.address"}}, {"type": "Feature", "geometry": {"type": "Point", "coordinates": [14.42555, 50.08793]}, "properties": {"id": "983ADC47A3F111E1BEEB000C766D2371", "kind": "negativ", "description": "Pohled do Kozí ulice s domem čp. 747 na Starém Městě před zbořením roku 1898.", "date_label": "před 1898", "start_date": "1800-01-01", "end_date": "1897-12-31", "author": "Eckert, Jindřich (1833-1905)", "note": "", "views": "21x", "geolocation_type": "regional.address"}}, {"type": "Feature", "geometry": {"type": "Point", "coordinates": [14.38996, 50.08783]}, "properties": {"id": "986F91AE532911EABE1674D435EEBE90", "kind": "pozitiv", "description": "Pohled na skupinu bývalých chovanců sirotčince arcivévodkyně Gisely při sjezdu na dvoře domu čp. 111 na Hradčanech na Pohořelci.", "date_label": "8.9.1912", "start_date": "1912-09-08", "end_date": "1912-09-08", "author": "Bruner-Dvořák, Rudolf (1864-1921)", "note": "", "views": "5x", "geolocation_type": "regional.address"}}, {"type": "Feature", "geometry": {"type": "Point", "coordinates": [14.41783, 50.08711]}, "properties": {"id": "9883eb71c07e4087aa8348f781b29d62", "kind": "pozitiv", "description": "Pohled na stavbu budovy Magistrátu hlavního města Prahy (dům čp. 2) na Mariánském náměstí na Starém Městě. V pozadí Linhartská ulice.", "date_label": "1909-1910", "start_date": "1909-01-01", "end_date": "1910-12-31", "author": "", "note": "", "views": "9x", "geolocation_type": "regional.address"}}, {"type": "Feature", "geometry": {"type": "Point", "coordinates": [14.44408, 50.09084]}, "properties": {"id": "98C6F7FD305E11E99E6A74D435EEBE90", "kind": "negativ", "description": "Pohled na severní a část západního průčelí domu čp. 20 v Karlíně (Ferdinandova kasárna) v Palackého ulici (dnes Křižíkova) na nároží Vinohradské ulice (dnes Prvního pluku).", "date_label": "kol.1900", "start_date": "1900-01-01", "end_date": "1900-12-31", "author": "Bellmann-ateliér", "note": "", "views": "76x", "geolocation_type": "regional.address"}}, {"type": "Feature", "geometry": {"type": "Point", "coordinates": [14.40131, 50.08733]}, "properties": {"id": "98CF685D7D0611E3BE26406186009F3A", "kind": "pozitiv", "description": "Detail klenutého interiéru přízemí v Schönbornském paláci - domě čp. 365 na Malé Straně.", "date_label": "červen 1931", "start_date": "1931-06-01", "end_date": "1931-06-30", "author": "Vojta, Tomáš (1885-1934)", "note": "", "views": "23x", "geolocation_type": "regional.address"}}, {"type": "Feature", "geometry": {"type": "Point", "coordinates": [14.41321, 50.08173]}, "properties": {"id": "98D23B2F87DA11E2BF21525400E46D25", "kind": "negativ", "description": "Pohled do interiéru domu čp. 1012 na Starém Městě na Národní třídě (kavárna Slávia) - kulečník.", "date_label": "7.10.1905", "start_date": "1905-10-07", "end_date": "1905-10-07", "author": "Eckert-ateliér", "note": "", "views": "58x", "geolocation_type": "regional.address"}}, {"type": "Feature", "geometry": {"type": "Point", "coordinates": [14.41115, 50.10049]}, "properties": {"id": "98D4E4FDEAFB11E3AA09406186009F3A", "kind": "pozitiv", "description": "Pohled na dům čp. 43 (\"Zátorka\") v Bubenči. Před domem majitelé Hana a Edvard Benešovi.", "date_label": "1926", "start_date": "1926-01-01", "end_date": "1926-12-31", "author": "Vojta, Tomáš (1885-1934)", "note": "", "views": "74x", "geolocation_type": "regional.address"}}, {"type": "Feature", "geometry": {"type": "Point", "coordinates": [14.46209, 50.05774]}, "properties": {"id": "98F22800063011E2AC506C626D41E503", "kind": "pozitiv", "description": "Pohled z Bohdalce od domu čp. 262 v Michli (vlevo) k jihu. Uprostřed michelská plynárna.", "date_label": "22.7.1927", "start_date": "1927-07-22", "end_date": "1927-07-22", "author": "Alexander, Antonín (1892-působnost do 1948)", "note": "", "views": "196x", "geolocation_type": "regional.address"}}, {"type": "Feature", "geometry": {"type": "Point", "coordinates": [14.41873, 50.08783]}, "properties": {"id": "9912C2DF808B11E4AAB4406186009F3A", "kind": "pozitiv", "description": "Pohled na fragmenty gotické výzdoby v domě čp. 16 na Starém Městě (Andělská kolej) v Mikulášské ulici (dnes náměstí Franze Kafky).", "date_label": "1909", "start_date": "1909-01-01", "end_date": "1909-12-31", "author": "Kříženecký, Jan (1868-1921)", "note": "", "views": "27x", "geolocation_type": "regional.address"}}, {"type": "Feature", "geometry": {"type": "Point", "coordinates": [14.43615, 50.09932]}, "properties": {"id": "9920B630E69311E89E7C74D435EEBE90", "kind": "pozitiv", "description": "Pohled na dům čp. 424 v Holešovicích při bourání.", "date_label": "kol.1930", "start_date": "1930-01-01", "end_date": "1930-12-31", "author": "", "note": "", "views": "34x", "geolocation_type": "regional.address"}}, {"type": "Feature", "geometry": {"type": "Point", "coordinates": [14.42491, 50.09733]}, "properties": {"id": "995CAEF0274411E287E86C626D41E503", "kind": "pozitiv", "description": "Pohled na budovu Národního technického muzea na Letné (dům čp. 1320 v Holešovicích) v Kostelní ulici.", "date_label": "kol.1955", "start_date": "1955-01-01", "end_date": "1955-12-31", "author": "Zeman, Josef", "note": "", "views": "75x", "geolocation_type": "regional.address"}}, {"type": "Feature", "geometry": {"type": "Point", "coordinates": [14.43056, 50.07918]}, "properties": {"id": "996001C394E311E4B4BB6C626D41E503", "kind": "pozitiv", "description": "Malování nápisu \"SMRT BARBARŮM\" na budově Národního muzea v srpnu 1968 (dům čp. 1700 na Novém Městě).", "date_label": "srpen 1968", "start_date": "1968-08-01", "end_date": "1968-08-31", "author": "", "note": "", "views": "71x", "geolocation_type": "regional.address"}}, {"type": "Feature", "geometry": {"type": "Point", "coordinates": [14.41987, 50.10017]}, "properties": {"id": "997DCB1D81B711E2BF1D525400E46D25", "kind": "negativ", "description": "Pohled na jednu z budov vodárny na Letné (dům čp. 1000 v Bubenči).", "date_label": "1890-1891", "start_date": "1890-01-01", "end_date": "1891-12-31", "author": "Eckert, Jindřich (1833-1905)", "note": "", "views": "58x", "geolocation_type": "regional.address"}}, {"type": "Feature", "geometry": {"type": "Point", "coordinates": [14.39455, 50.07247]}, "properties": {"id": "999FA827DCB011E6B80F406186009F3A", "kind": "negativ", "description": "Pohled na kapli sv. Rocha na Malostranském hřbitově směrem od hřbitova ke křižovatce ulic U Trojice a Plzeňská na Smíchově. V pozadí domy čp. 934, 545 a 354.", "date_label": "9.5.1950", "start_date": "1950-05-09", "end_date": "1950-05-09", "author": "Vopravil, Josef (1902-1972)", "note": "", "views": "76x", "geolocation_type": "regional.address"}}, {"type": "Feature", "geometry": {"type": "Point", "coordinates": [14.39762, 50.0876]}, "properties": {"id": "99EC1CE66BA111E2AB7F6C626D41E503", "kind": "pozitiv", "description": "Pohled do interiéru kaple P. Marie a sv. Jana Boromejského při Vlašském špitále (dům čp. 335) na Malé Straně - v pozadí oltář.", "date_label": "17.9.1904", "start_date": "1904-09-17", "end_date": "1904-09-17", "author": "Eckert, Jindřich (1833-1905)", "note": "", "views": "45x", "geolocation_type": "regional.address"}}, {"type": "Feature", "geometry": {"type": "Point", "coordinates": [14.40204, 50.11]}, "properties": {"id": "99F3D0677C3F11E2BF19525400E46D25", "kind": "negativ", "description": "Pohled na kanalizační čistící stanici v Bubenči (dům čp. 199).", "date_label": "kol.1900", "start_date": "1900-01-01", "end_date": "1900-12-31", "author": "Eckert, Jindřich (1833-1905)", "note": "", "views": "38x", "geolocation_type": "regional.address"}}, {"type": "Feature", "geometry": {"type": "Point", "coordinates": [14.43566, 50.09927]}, "properties": {"id": "9A600311698511E49A11406186009F3A", "kind": "pozitiv", "description": "Pohled na Strossmayerovo náměstí. Vpravo část novostavby Elektrických podniků hl. m. Prahy (dům čp. 1477). Zleva domy čp. 990, čp. 1385 na Strossmayerově náměstí. Dále domy v Antonínské ulici čp. 424, čp. 425 v Holešovicích.", "date_label": "31.8.1937", "start_date": "1937-08-31", "end_date": "1937-08-31", "author": "Alexander, Antonín (1892-působnost do 1948)", "note": "", "views": "65x", "geolocation_type": "regional.address"}}, {"type": "Feature", "geometry": {"type": "Point", "coordinates": [14.42233, 50.08309]}, "properties": {"id": "9A72DDBBE29011E89F1B74D435EEBE90", "kind": "pozitiv", "description": "Pohled na průčelí domu čp. 761 v Ovocné ulice na Novém Městě (dnes ulice 28. října).", "date_label": "1905", "start_date": "1905-01-01", "end_date": "1905-12-31", "author": "Bruner-Dvořák, Rudolf (1864-1921)", "note": "", "views": "20x", "geolocation_type": "regional.address"}}, {"type": "Feature", "geometry": {"type": "Point", "coordinates": [14.42583, 50.08822]}, "properties": {"id": "9AA3E0CD157B11E39CC26C626D41E503", "kind": "pozitiv", "description": "Pohled na dům čp. 649 na Starém Městě (restaurace Kobylka) na nároží ulic Jakubské a Templové (vpravo).", "date_label": "28.4.1913", "start_date": "1913-04-28", "end_date": "1913-04-28", "author": "", "note": "", "views": "38x", "geolocation_type": "regional.address"}}, {"type": "Feature", "geometry": {"type": "Point", "coordinates": [14.40339, 50.09134]}, "properties": {"id": "9AA4F364D59E11E18CF36C626D41E503", "kind": "pozitiv", "description": "Celkový pohled na hlavní vchod do bývalého Tereziánského ústavu šlechtičen na Pražském hradě (dům čp. 2 na Hradčanech) - na náměstí U Sv. Jiří na Pražském hradě.", "date_label": "kol.1915", "start_date": "1915-01-01", "end_date": "1915-12-31", "author": "Fink, František (1854-1935)", "note": "", "views": "38x", "geolocation_type": "regional.address"}}, {"type": "Feature", "geometry": {"type": "Point", "coordinates": [14.4186, 50.0808]}, "properties": {"id": "9AD9C48A908711E2BF26525400E46D25", "kind": "negativ", "description": "Pohled do 2. dvora domu čp. 126 na Novém Městě v Ostrovní ulici.", "date_label": "kol.1900", "start_date": "1900-01-01", "end_date": "1900-12-31", "author": "Eckert, Jindřich (1833-1905)", "note": "", "views": "18x", "geolocation_type": "regional.address"}}, {"type": "Feature", "geometry": {"type": "Point", "coordinates": [14.40813, 50.08733]}, "properties": {"id": "9B32B3F996C711E2BF2B525400E46D25", "kind": "negativ", "description": "Pohled přes lávku přes Čertovku na domy čp. 84 (před demolicí) a čp. 85 v Lužické ulici (dnes U Lužického semináře). Vlevo část domu čp. 83 na Malé Straně.", "date_label": "1904", "start_date": "1904-01-01", "end_date": "1904-12-31", "author": "Eckert, Jindřich (1833-1905)", "note": "", "views": "42x", "geolocation_type": "regional.address"}}, {"type": "Feature", "geometry": {"type": "Point", "coordinates": [14.41783, 50.08711]}, "properties": {"id": "9b55c195be984781aa661c9fa8c4b373", "kind": "pozitiv", "description": "Reprodukce návrhu stavebního úřadu městského odboru 6 (arch. Nevole) na novostavbu úřední městské budovy při nové budově Magistrátu (dům čp. 2) na Mariánském náměstí na Starém Městě - na nároží ulic Platnéřské a Kaprovy. Pohled z náměstí Franze Kafky.", "date_label": "1910-1911", "start_date": "1910-01-01", "end_date": "1911-12-31", "author": "", "note": "", "views": "19x", "geolocation_type": "regional.address"}}, {"type": "Feature", "geometry": {"type": "Point", "coordinates": [14.43309, 50.09917]}, "properties": {"id": "9BC6A9F2698311E49A11406186009F3A", "kind": "pozitiv", "description": "Pohled na severní stranu Strossmayerova náměstí směrem od kostela sv. Antonína k západu. Zprava domy čp. 978 (\"Plzeňský restaurant\"), čp. 977, čp. 976 a čp. 691 v Holešovicích.", "date_label": "31.8.1937", "start_date": "1937-08-31", "end_date": "1937-08-31", "author": "Alexander, Antonín (1892-působnost do 1948)", "note": "", "views": "72x", "geolocation_type": "regional.address"}}, {"type": "Feature", "geometry": {"type": "Point", "coordinates": [14.44868, 50.10248]}, "properties": {"id": "9C0D89FE955511E2BF29525400E46D25", "kind": "negativ", "description": "Pohled do interiéru domu čp. 515 v Holešovicích (Opatrovna a mateřská škola Na Maninách - dnes Tusarova 27) - oddělení s \"kruhem pro učedníky v chůzi\".", "date_label": "kol.1900", "start_date": "1900-01-01", "end_date": "1900-12-31", "author": "Eckert, Jindřich (1833-1905)", "note": "", "views": "38x", "geolocation_type": "regional.address"}}, {"type": "Feature", "geometry": {"type": "Point", "coordinates": [14.38967, 50.08671]}, "properties": {"id": "9C14DB7F474011E180176C626D41E503", "kind": "pozitiv", "description": "Lebka sv. Norberta ve Strahovském klášteře (dům čp. 132 na Hradčanech).", "date_label": "27.6.1916", "start_date": "1916-06-27", "end_date": "1916-06-27", "author": "Pantoflíček, Jaroslav", "note": "", "views": "32x", "geolocation_type": "regional.address"}}, {"type": "Feature", "geometry": {"type": "Point", "coordinates": [14.40562, 50.02342]}, "properties": {"id": "9C1A6D86D1C811E69F29406186009F3A", "kind": "pozitiv", "description": "Pohled na rybník v Hodkovičkách. V pozadí domy čp. 9, 44 a 10 v ulici V Hodkovičkách.", "date_label": "1958", "start_date": "1958-01-01", "end_date": "1958-12-31", "author": "", "note": "", "views": "39x", "geolocation_type": "regional.address"}}, {"type": "Feature", "geometry": {"type": "Point", "coordinates": [14.40739, 50.08615]}, "properties": {"id": "9C22986404F611E3A4F66C626D41E503", "kind": "pozitiv", "description": "Celkový pohled na dům čp. 490 (palác Metychů z Čečova - Hrzánský) na Velkopřevorském náměstí na Malé Straně.", "date_label": "kol.1910", "start_date": "1910-01-01", "end_date": "1910-12-31", "author": "Bellmann", "note": "", "views": "40x", "geolocation_type": "regional.address"}}, {"type": "Feature", "geometry": {"type": "Point", "coordinates": [14.42825, 50.08762]}, "properties": {"id": "9C35AC67E83A11E4BB7A0024BE7CD9AC", "kind": "pozitiv", "description": "Pohled na schodiště v interiéru domu čp. 1090 (Obecní dům) na Starém Městě.", "date_label": "kol. 1915", "start_date": "", "end_date": "", "author": "Štenc", "note": "", "views": "21x", "geolocation_type": "regional.address"}}, {"type": "Feature", "geometry": {"type": "Point", "coordinates": [14.41783, 50.08711]}, "properties": {"id": "9c366c319cf74f9a9e06dbfb2c96ddd8", "kind": "pozitiv", "description": "Pohled na novostavbu budovy Magistrátu hlavního města Prahy (dům čp. 2) na Mariánském náměstí na Starém Městě z náměstí Franze Kafky.", "date_label": "1910-1911", "start_date": "1910-01-01", "end_date": "1911-12-31", "author": "", "note": "", "views": "11x", "geolocation_type": "regional.address"}}, {"type": "Feature", "geometry": {"type": "Point", "coordinates": [14.44357, 50.14932]}, "properties": {"id": "9C446852DD1511E480FB74D435EEBE90", "kind": "pozitiv", "description": "Pohled na statek čp. 15 v Dolních Chabrech z Bíleneckého náměstí.", "date_label": "1968", "start_date": "1968-01-01", "end_date": "1968-12-31", "author": "Vopravil, Josef (1902-1972)", "note": "", "views": "38x", "geolocation_type": "regional.address"}}, {"type": "Feature", "geometry": {"type": "Point", "coordinates": [14.42825, 50.08762]}, "properties": {"id": "9CB63DF2E83711E4BB7A0024BE7CD9AC", "kind": "pozitiv", "description": "Pohled na část Šalounova sousoší nad průčelím domu čp. 1090 (Obecní dům) na Starém Městě.", "date_label": "kol. 1915", "start_date": "", "end_date": "", "author": "Štenc", "note": "", "views": "23x", "geolocation_type": "regional.address"}}, {"type": "Feature", "geometry": {"type": "Point", "coordinates": [14.4028, 50.02379]}, "properties": {"id": "9D042A82D29E11E6BE58406186009F3A", "kind": "pozitiv", "description": "Pohled na křižovatku ulic V Náklích a Modřanské v Hodkovičkách s kaplí sv. Bartoloměje. V pozadí dům čp. 7 a 6.", "date_label": "22.8.1959", "start_date": "1959-08-22", "end_date": "1959-08-22", "author": "Hnilička, Eduard (1887-1967)", "note": "", "views": "44x", "geolocation_type": "regional.address"}}, {"type": "Feature", "geometry": {"type": "Point", "coordinates": [14.43614, 50.05042]}, "properties": {"id": "9D240E78D3B211E4BF0774D435EEBE90", "kind": "pozitiv", "description": "Pohled na budovu Motokovu (City Empiria) - dům čp. 1716/2b ve Hvězdově ulici v Nuslích.", "date_label": "1978", "start_date": "1978-01-01", "end_date": "1978-12-31", "author": "Jelínková, Jana (1951-)", "note": "", "views": "73x", "geolocation_type": "regional.address"}}, {"type": "Feature", "geometry": {"type": "Point", "coordinates": [14.42156, 50.078]}, "properties": {"id": "9E09013C85B211E2BF1F525400E46D25", "kind": "negativ", "description": "Pohled do interiéru domu čp. 671 na Karlově náměstí na Novém Městě (Salmovský palác) - salon.", "date_label": "kol.1900", "start_date": "1900-01-01", "end_date": "1900-12-31", "author": "Eckert, Jindřich (1833-1905)", "note": "", "views": "38x", "geolocation_type": "regional.address"}}, {"type": "Feature", "geometry": {"type": "Point", "coordinates": [14.40473, 50.02294]}, "properties": {"id": "9E22B796D19411E69F29406186009F3A", "kind": "pozitiv", "description": "Pohled na obchod se smíšeným zbožím v domě čp. 12 na návsi v Hodkovičkách (dnes Modřanská ulice). Vlevo rybník a v pozadí domy čp. 8 a 9 v ulici V Hodkovičkách.", "date_label": "", "start_date": "", "end_date": "", "author": "Bellmann-ateliér", "note": "", "views": "64x", "geolocation_type": "regional.address"}}, {"type": "Feature", "geometry": {"type": "Point", "coordinates": [14.40473, 50.02294]}, "properties": {"id": "9E779FBCD29311E6BE58406186009F3A", "kind": "pozitiv", "description": "Celkový pohled na kapli sv. Bartoloměje v Hodkovičkách. V pozadí domy čp. 12 a 14 v Modřanské ulici.", "date_label": "1958", "start_date": "1958-01-01", "end_date": "1958-12-31", "author": "", "note": "", "views": "47x", "geolocation_type": "regional.address"}}, {"type": "Feature", "geometry": {"type": "Point", "coordinates": [14.42009, 50.087]}, "properties": {"id": "9F20A2C290C111E8B3B474D435EEBE90", "kind": "negativ", "description": "Pohled na část jižního průčelí Staroměstské radnice při restaurování orloje (dům čp. 1 na Starém Městě) na Staroměstském náměstí. Dveře na levé straně orloje vedoucí na galerii.", "date_label": "", "start_date": "", "end_date": "", "author": "Kříženecký, Jan (1868-1921)", "note": "Reprodukce původní fotografie.", "views": "24x", "geolocation_type": "regional.address"}}, {"type": "Feature", "geometry": {"type": "Point", "coordinates": [14.41719, 50.07215]}, "properties": {"id": "9F4D1DED17E311E891E8406186009F3A", "kind": "pozitiv", "description": "Pohled na osvětlený kostel P. Marie v Emauzích a kapli sv. Kosmy a Damiána na Novém Městě při příležitosti 10. výročí samostatnosti Československé republiky. V popředí domy čp. 375 a 376.", "date_label": "28.10.1928", "start_date": "1928-10-28", "end_date": "1928-10-28", "author": "Vopravil, Josef (1902-1972)", "note": "", "views": "80x", "geolocation_type": "regional.address"}}, {"type": "Feature", "geometry": {"type": "Point", "coordinates": [14.41832, 50.08461]}, "properties": {"id": "9F580B87ECD711DFBD7B000C766D2371", "kind": "pozitiv", "description": "Pohled do dvora domu čp. 236 na Starém Městě - zahradní restaurace \"U Vocílků\" (\"U Vocelků\") - lodžie vpravo před přestavbou.", "date_label": "11.7.1926", "start_date": "1926-07-11", "end_date": "1926-07-11", "author": "Alexander, Antonín (1892-působnost do 1948)", "note": "", "views": "36x", "geolocation_type": "regional.address"}}, {"type": "Feature", "geometry": {"type": "Point", "coordinates": [14.38996, 50.08783]}, "properties": {"id": "9F7D56DF8AFA11E2BF22525400E46D25", "kind": "negativ", "description": "Pohled do zahrady domu čp. 111 (sirotčinec arcivévodkyně Gisely) na Pohořelci na Hradčanech - hřiště dívek. V popředí bazén.", "date_label": "kol.1890", "start_date": "1890-01-01", "end_date": "1890-12-31", "author": "Eckert, Jindřich (1833-1905)", "note": "", "views": "35x", "geolocation_type": "regional.address"}}, {"type": "Feature", "geometry": {"type": "Point", "coordinates": [14.419, 50.07337]}, "properties": {"id": "9FA0BF20E43111E4BE0074D435EEBE90", "kind": "pozitiv", "description": "Interiér \"Faustova domu\" (dům čp. 502 na Novém Městě) - poškozeném po náletu spojenců v únoru 1945.", "date_label": "15.2.1945", "start_date": "1945-02-15", "end_date": "1945-02-15", "author": "", "note": "", "views": "30x", "geolocation_type": "regional.address"}}, {"type": "Feature", "geometry": {"type": "Point", "coordinates": [14.41832, 50.08461]}, "properties": {"id": "9FC63E5CECD811DFBD7B000C766D2371", "kind": "pozitiv", "description": "Pohled do Husovy ulice s domem čp. 236 \"U Vocílků\" (\"U Vocelků\") na Starém Městě - po provedeném podloubí, kdy ještě nebyla odbourána dvorní zeď.", "date_label": "14.11.1926", "start_date": "1926-11-14", "end_date": "1926-11-14", "author": "Alexander, Antonín (1892-působnost do 1948)", "note": "", "views": "28x", "geolocation_type": "regional.address"}}, {"type": "Feature", "geometry": {"type": "Point", "coordinates": [14.42189, 50.08506]}, "properties": {"id": "9FD1A714038411E0BDA5000C766D2371", "kind": "pozitiv", "description": "Pohled do Havelské ulice. Uprostřed kostel sv. Havla, vpravo budova Městské spořitelny (dům čp. 536 na Starém Městě) - zakreslen návrh přístavby 3. patra.", "date_label": "", "start_date": "", "end_date": "", "author": "Langhans, J. F.", "note": "", "views": "3x", "geolocation_type": "regional.address"}}, {"type": "Feature", "geometry": {"type": "Point", "coordinates": [14.53137, 50.05134]}, "properties": {"id": "9FFA7B99A4EF11E1BEEC000C766D2371", "kind": "negativ", "description": "Pohled do sálu na Slovanském ostrově při Všeobecné zahradnické výstavě 1898 na Slovanském ostrově (dům čp. 226 na Novém Městě - Palác Žofín) - \"Orchidejová síň Dittrich\" - detaily.", "date_label": "1898", "start_date": "1898-01-01", "end_date": "1898-12-31", "author": "Eckert, Jindřich (1833-1905)", "note": "", "views": "33x", "geolocation_type": "regional.address"}}, {"type": "Feature", "geometry": {"type": "Point", "coordinates": [14.40526, 50.09394]}, "properties": {"id": "A01D8E105F5A11E8A52374D435EEBE90", "kind": "pozitiv", "description": "Pohled na Belveder (Letohrádek královny Anny) - dům čp. 52 na Hradčanech. V popředí Zpívající fontána.", "date_label": "kol.1900", "start_date": "1900-01-01", "end_date": "1900-12-31", "author": "Deport a Panzer", "note": "", "views": "56x", "geolocation_type": "regional.address"}}, {"type": "Feature", "geometry": {"type": "Point", "coordinates": [14.40739, 50.08615]}, "properties": {"id": "A07AE8EE04F411E3A4F66C626D41E503", "kind": "pozitiv", "description": "Pohled na renesanční portál domu čp. 490 (palác Metychů z Čečova - Hrzánský) na Velkopřevorském náměstí na Malé Straně.", "date_label": "25.3.1908", "start_date": "1908-03-25", "end_date": "1908-03-25", "author": "Kříženecký, Jan (1868-1921)", "note": "", "views": "25x", "geolocation_type": "regional.address"}}, {"type": "Feature", "geometry": {"type": "Point", "coordinates": [14.39535, 50.08934]}, "properties": {"id": "a0b85a3fa86a441ba16d72e39a750fad", "kind": "pozitiv", "description": "Pohled na Hradčanské náměstí s částí Toskánského paláce.", "date_label": "1984", "start_date": "1984-01-01", "end_date": "1984-12-31", "author": "Hudeček, Jan", "note": "", "views": "9x", "geolocation_type": "regional.address"}}, {"type": "Feature", "geometry": {"type": "Point", "coordinates": [14.42251, 50.07933]}, "properties": {"id": "A0C4F429B67611DF820F00166F1163D4", "kind": "pozitiv", "description": "Pohled na vstupní portál domu čp. 680 (dům U zlatého sloupu) ve Vodičkově ulici na Novém Městě.", "date_label": "10.5.1906", "start_date": "1906-05-10", "end_date": "1906-05-10", "author": "", "note": "", "views": "24x", "geolocation_type": "regional.address"}}, {"type": "Feature", "geometry": {"type": "Point", "coordinates": [14.41889, 50.086]}, "properties": {"id": "A0C4F432B67611DF820F00166F1163D4", "kind": "negativ", "description": "Pohled do dvora domu čp. 147 (\"Červený dům\") v Karlově ulici na Starém Městě.", "date_label": "10.6.1906", "start_date": "1906-06-10", "end_date": "1906-06-10", "author": "Eckert-ateliér", "note": "", "views": "19x", "geolocation_type": "regional.address"}}, {"type": "Feature", "geometry": {"type": "Point", "coordinates": [14.40526, 50.09394]}, "properties": {"id": "A0C4F43BB67611DF820F00166F1163D4", "kind": "pozitiv", "description": "Pohled na část plastické výzdoby Belvederu (Letohrádek královny Anny) - dům čp. 52 na Hradčanech - hlavice sloupu s řádem Zlatého rouna.", "date_label": "31.5.1907", "start_date": "1907-05-31", "end_date": "1907-05-31", "author": "Eckert-ateliér", "note": "", "views": "14x", "geolocation_type": "regional.address"}}, {"type": "Feature", "geometry": {"type": "Point", "coordinates": [14.60255, 50.0269]}, "properties": {"id": "A0C4F440B67611DF820F00166F1163D4", "kind": "negativ", "description": "Pohled do Templové ulice s domy čp. 649 (Kopmanka - restaurace Kobylka) před zbořením. V pozadí čp. 588 na Starém Městě.", "date_label": "červen 1913", "start_date": "1913-06-01", "end_date": "1913-06-30", "author": "Eckert-ateliér", "note": "", "views": "29x", "geolocation_type": "regional.address"}}, {"type": "Feature", "geometry": {"type": "Point", "coordinates": [14.40853, 50.08554]}, "properties": {"id": "A0C4F445B67611DF820F00166F1163D4", "kind": "pozitiv", "description": "Pohled na část domu čp. 506 (Lichtenštejnský palác) na Kampě na Malé Straně.", "date_label": "kol.1915", "start_date": "1915-01-01", "end_date": "1915-12-31", "author": "", "note": "", "views": "44x", "geolocation_type": "regional.address"}}, {"type": "Feature", "geometry": {"type": "Point", "coordinates": [14.47574, 50.10217]}, "properties": {"id": "A0C4F448B67611DF820F00166F1163D4", "kind": "negativ", "description": "Pohled na část průčelí domu čp. 513 v Sokolovské ulici v Libni - opatrovna a mateřská škola.", "date_label": "kol.1905", "start_date": "1905-01-01", "end_date": "1905-12-31", "author": "Eckert-ateliér", "note": "", "views": "62x", "geolocation_type": "regional.address"}}, {"type": "Feature", "geometry": {"type": "Point", "coordinates": [14.41521, 50.09017]}, "properties": {"id": "A0C4F45BB67611DF820F00166F1163D4", "kind": "pozitiv", "description": "Rudá armáda v Praze v květnu 1945 - vojáci na tanku před Rudolfinem v květnu 1945 (\"první sovětské tanky v Praze\").", "date_label": "květen 1945", "start_date": "1945-05-01", "end_date": "1945-05-31", "author": "Zeman, Josef", "note": "", "views": "62x", "geolocation_type": "regional.address"}}, {"type": "Feature", "geometry": {"type": "Point", "coordinates": [14.40231, 50.08767]}, "properties": {"id": "A0C4F461B67611DF820F00166F1163D4", "kind": "pozitiv", "description": "Pohled do ulice Tržiště s domem čp. 259 na Malé Straně.", "date_label": "27.7.1930", "start_date": "1930-07-27", "end_date": "1930-07-27", "author": "Alexander, Antonín (1892-působnost do 1948)", "note": "", "views": "25x", "geolocation_type": "regional.address"}}, {"type": "Feature", "geometry": {"type": "Point", "coordinates": [14.40131, 50.08733]}, "properties": {"id": "A0C4F463B67611DF820F00166F1163D4", "kind": "pozitiv", "description": "Pohled na nádvoří Schönbornského paláce (dům čp. 365 na Malé Straně) ze schodiště terasy k průjezdu na Tržiště.", "date_label": "13.10.1907", "start_date": "1907-10-13", "end_date": "1907-10-13", "author": "Klíma, Alois, Ing. (1873-1955)", "note": "", "views": "37x", "geolocation_type": "regional.address"}}, {"type": "Feature", "geometry": {"type": "Point", "coordinates": [14.40012, 50.08735]}, "properties": {"id": "A0C4F466B67611DF820F00166F1163D4", "kind": "pozitiv", "description": "Pohled na vstupní portál domu čp. 358 (\"U bílého lva\") s domovním znamením ve Vlašské ulici na Malé Straně.", "date_label": "13.7.1906", "start_date": "1906-07-13", "end_date": "1906-07-13", "author": "", "note": "", "views": "16x", "geolocation_type": "regional.address"}}, {"type": "Feature", "geometry": {"type": "Point", "coordinates": [14.41423, 50.08154]}, "properties": {"id": "A0C4F477B67611DF820F00166F1163D4", "kind": "negativ", "description": "Pohled od domu čp. 1012 (kavárna Slavie) na Národní třídu, vlevo budova Akademie věd ČR (dům čp. 1009 na Starém Městě), vpravo dům čp. 139 na Novém Městě, kostel sv. Voršily a stavba Nové scény ND (dům čp. 1393 na Novém Městě).", "date_label": "kol.1977", "start_date": "1977-01-01", "end_date": "1977-12-31", "author": "Chalupníček, Miroslav -, Chalupníčková, Věra (dokument 1941-1948)", "note": "", "views": "95x", "geolocation_type": "regional.address"}}, {"type": "Feature", "geometry": {"type": "Point", "coordinates": [14.48451, 50.077]}, "properties": {"id": "A0C4F486B67611DF820F00166F1163D4", "kind": "pozitiv", "description": "Celkový pohled na strašnické krematorium (Vinohradská 2509/214).", "date_label": "kol.1935", "start_date": "1935-01-01", "end_date": "1935-12-31", "author": "", "note": "", "views": "118x", "geolocation_type": "regional.address"}}, {"type": "Feature", "geometry": {"type": "Point", "coordinates": [14.40417, 50.08629]}, "properties": {"id": "A0C4F493B67611DF820F00166F1163D4", "kind": "pozitiv", "description": "Pohled na portál domu čp. 379 (\"U černého lva\") v Karmelitské ulici na Malé Straně.", "date_label": "18.6.1906", "start_date": "1906-06-18", "end_date": "1906-06-18", "author": "", "note": "", "views": "16x", "geolocation_type": "regional.address"}}, {"type": "Feature", "geometry": {"type": "Point", "coordinates": [14.45836, 50.09311]}, "properties": {"id": "A0C4F499B67611DF820F00166F1163D4", "kind": "pozitiv", "description": "Pohled detail fasády školy (dům čp. 460) na Lyčkově náměstí v Karlíně (dříve Riegrovy sady).", "date_label": "3.10.1935", "start_date": "1935-10-03", "end_date": "1935-10-03", "author": "Alexander, Antonín (1892-působnost do 1948)", "note": "", "views": "101x", "geolocation_type": "regional.address"}}, {"type": "Feature", "geometry": {"type": "Point", "coordinates": [14.39762, 50.0876]}, "properties": {"id": "A0C4F49BB67611DF820F00166F1163D4", "kind": "pozitiv", "description": "Pohled na portál domu čp. 335 (\"Vlašský špitál\") ve Vlašské ulici na Malé Straně.", "date_label": "19.5.1906", "start_date": "1906-05-19", "end_date": "1906-05-19", "author": "", "note": "", "views": "30x", "geolocation_type": "regional.address"}}, {"type": "Feature", "geometry": {"type": "Point", "coordinates": [14.53259, 50.10708]}, "properties": {"id": "A0C4F49CB67611DF820F00166F1163D4", "kind": "negativ", "description": "Pohled z lávky na Slovanský ostrov na Riegrovo nábřeží (dnes Masarykovo). Zleva ulice Na Struze, domy čp. 224, 236, 235, 234, 233, 239... na Novém Městě.", "date_label": "9.11.1906", "start_date": "1906-11-09", "end_date": "1906-11-09", "author": "Eckert-ateliér", "note": "", "views": "38x", "geolocation_type": "regional.address"}}, {"type": "Feature", "geometry": {"type": "Point", "coordinates": [14.40396, 50.08425]}, "properties": {"id": "A0C4F4A9B67611DF820F00166F1163D4", "kind": "negativ", "description": "Pohled do ulice Újezd s domy (zprava) čp. 394, 396, 397, 398, 399 na Malé Straně.", "date_label": "1899", "start_date": "1899-01-01", "end_date": "1899-12-31", "author": "Eckert, Jindřich (1833-1905)", "note": "", "views": "32x", "geolocation_type": "regional.address"}}, {"type": "Feature", "geometry": {"type": "Point", "coordinates": [14.41975, 50.07936]}, "properties": {"id": "A0C4F4ACB67611DF820F00166F1163D4", "kind": "pozitiv", "description": "Celkový pohled na dům \"Diamant\"na nároží Spálené a Lazarské ulice (dům čp. 82 na Novém Městě).", "date_label": "", "start_date": "", "end_date": "", "author": "Vojta, Tomáš (1885-1934)", "note": "Autorství T. Vojty není jisté.", "views": "73x", "geolocation_type": "regional.address"}}, {"type": "Feature", "geometry": {"type": "Point", "coordinates": [14.40131, 50.08733]}, "properties": {"id": "A0C4F4B9B67611DF820F00166F1163D4", "kind": "pozitiv", "description": "Pohled na detail štukového stropu v interiéru Schönbornského paláce - domu čp. 365 na Malé Straně.", "date_label": "červen 1931", "start_date": "1931-06-01", "end_date": "1931-06-30", "author": "Vojta, Tomáš (1885-1934)", "note": "Autorství T. Vojty není jisté.", "views": "23x", "geolocation_type": "regional.address"}}, {"type": "Feature", "geometry": {"type": "Point", "coordinates": [14.40477, 50.08832]}, "properties": {"id": "A0C4F4C3B67611DF820F00166F1163D4", "kind": "pozitiv", "description": "Celkový pohled na dům čp. 35 (radnice) na Malostranském náměstí.", "date_label": "1983", "start_date": "1983-01-01", "end_date": "1983-12-31", "author": "Javorský, Jiří", "note": "", "views": "41x", "geolocation_type": "regional.address"}}, {"type": "Feature", "geometry": {"type": "Point", "coordinates": [14.39762, 50.0876]}, "properties": {"id": "A0C4F4CCB67611DF820F00166F1163D4", "kind": "negativ", "description": "Pohled do nádvoří domu čp. 335 (Vlašský sirotčinec) s kašnou ve Vlašské ulici a Malé Straně.", "date_label": "17.6.1906", "start_date": "1906-06-17", "end_date": "1906-06-17", "author": "Eckert-ateliér", "note": "", "views": "38x", "geolocation_type": "regional.address"}}, {"type": "Feature", "geometry": {"type": "Point", "coordinates": [14.53451, 50.05826]}, "properties": {"id": "A0C4F4ECB67611DF820F00166F1163D4", "kind": "pozitiv", "description": "Panoramatický pohled na Hostivař z lomu jihozápadně nad cihelnou (dům čp. 78 v popředí). V pozadí hostivařský hřbitov. Čtvrtá část šestidílného panoramatu.", "date_label": "8.6.1930", "start_date": "1930-06-08", "end_date": "1930-06-08", "author": "Alexander, Antonín (1892-působnost do 1948)", "note": "", "views": "76x", "geolocation_type": "regional.address"}}, {"type": "Feature", "geometry": {"type": "Point", "coordinates": [14.52656, 50.05119]}, "properties": {"id": "A0C4F4F1B67611DF820F00166F1163D4", "kind": "pozitiv", "description": "Pohled do Hostivařské ulice (dříve Husova) s domy (zleva) čp. 119 a 125 (bývalý obecní úřad) v Hostivaři.", "date_label": "5.7.1930", "start_date": "1930-07-05", "end_date": "1930-07-05", "author": "Alexander, Antonín (1892-působnost do 1948)", "note": "", "views": "103x", "geolocation_type": "regional.address"}}, {"type": "Feature", "geometry": {"type": "Point", "coordinates": [14.42408, 50.08478]}, "properties": {"id": "A0C4F4F3B67611DF820F00166F1163D4", "kind": "pozitiv", "description": "Pohled na průčelí domu čp. 391 v ulici Na Příkopě na Starém Městě před zbořením.", "date_label": "kol.1900", "start_date": "1900-01-01", "end_date": "1900-12-31", "author": "", "note": "", "views": "33x", "geolocation_type": "regional.address"}}, {"type": "Feature", "geometry": {"type": "Point", "coordinates": [14.41704, 50.06846]}, "properties": {"id": "A0C4F4FAB67611DF820F00166F1163D4", "kind": "negativ", "description": "Celkový pohled na dům čp. 415 (hostinec \"U Pěti králů\") ve Vyšehradské ulici na Novém Městě.", "date_label": "kol.1900", "start_date": "1900-01-01", "end_date": "1900-12-31", "author": "Eckert, Jindřich (1833-1905)", "note": "", "views": "53x", "geolocation_type": "regional.address"}}, {"type": "Feature", "geometry": {"type": "Point", "coordinates": [14.39071, 50.08877]}, "properties": {"id": "A0C4F4FCB67611DF820F00166F1163D4", "kind": "negativ", "description": "Panoramatický pohled na Nový Svět na Hradčanech. V pozadí vlevo část chrámu sv. Víta, vpravo část Černínského paláce (dům čp. 101 na Hradčanech).", "date_label": "kol.1900", "start_date": "1900-01-01", "end_date": "1900-12-31", "author": "Eckert, Jindřich (1833-1905)", "note": "", "views": "44x", "geolocation_type": "regional.address"}}, {"type": "Feature", "geometry": {"type": "Point", "coordinates": [14.39669, 50.09028]}, "properties": {"id": "A0C4F500B67611DF820F00166F1163D4", "kind": "pozitiv", "description": "Pohled do interiéru Šternberského paláce (Ernestinum - dům čp. 57 na Hradčanech) - čínský kabinet. Nový pozitiv z původního negativu.", "date_label": "5.5.1903 (1913)", "start_date": "", "end_date": "", "author": "Eckert-ateliér", "note": "", "views": "24x", "geolocation_type": "regional.address"}}, {"type": "Feature", "geometry": {"type": "Point", "coordinates": [14.39151, 50.08925]}, "properties": {"id": "A0C4F513B67611DF820F00166F1163D4", "kind": "pozitiv", "description": "Pohled na kapli P. Marie (Svatá chýše - Santa casa) na nádvoří Lorety (dům čp. 100 na Hradčanech) na Loretánském náměstí. Vpravo část kostela Narození Páně. V popředí vpravo sousoší Nanebevzetí P. Marie.", "date_label": "", "start_date": "", "end_date": "", "author": "Centropress Praha XII.", "note": "", "views": "35x", "geolocation_type": "regional.address"}}, {"type": "Feature", "geometry": {"type": "Point", "coordinates": [14.42091, 50.08566]}, "properties": {"id": "A0C4F521B67611DF820F00166F1163D4", "kind": "pozitiv", "description": "Část průčelí domu čp. 471 na Starém Městě do Melantrichovy ulice.", "date_label": "1893", "start_date": "1893-01-01", "end_date": "1893-12-31", "author": "", "note": "", "views": "32x", "geolocation_type": "regional.address"}}, {"type": "Feature", "geometry": {"type": "Point", "coordinates": [14.40538, 50.08645]}, "properties": {"id": "A0C4F524B67611DF820F00166F1163D4", "kind": "negativ", "description": "Pohled na dům čp. 291 (\"U Zlatého kohouta\") na nároží Maltézského náměstí a Lázeňské ulice na Malé Straně.", "date_label": "25.2.1906", "start_date": "1906-02-25", "end_date": "1906-02-25", "author": "Eckert-ateliér", "note": "", "views": "26x", "geolocation_type": "regional.address"}}, {"type": "Feature", "geometry": {"type": "Point", "coordinates": [14.41925, 50.06214]}, "properties": {"id": "A0C4F532B67611DF820F00166F1163D4", "kind": "pozitiv", "description": "Pohled na Podolské nábřeží se sanatoriem (dům čp. 157 v Podolí). V pozadí kostel sv. Petra a Pavla na Vyšehradě.", "date_label": "17.2.1914", "start_date": "1914-02-17", "end_date": "1914-02-17", "author": "Kříženecký, Jan (1868-1921)", "note": "", "views": "121x", "geolocation_type": "regional.address"}}, {"type": "Feature", "geometry": {"type": "Point", "coordinates": [14.41687, 50.0883]}, "properties": {"id": "A0C4F54AB67611DF820F00166F1163D4", "kind": "negativ", "description": "Pohled na západní stranu domu čp. 52 v Kaprově ulici na Starém Městě krátce před zbořením.", "date_label": "12.2.1907", "start_date": "1907-02-12", "end_date": "1907-02-12", "author": "Eckert-ateliér", "note": "", "views": "35x", "geolocation_type": "regional.address"}}, {"type": "Feature", "geometry": {"type": "Point", "coordinates": [14.42428, 50.08045]}, "properties": {"id": "A0C4F54BB67611DF820F00166F1163D4", "kind": "pozitiv", "description": "Pohled do Vodičkovy ulice (zprava) s domy čp. 699, 700, 701, 702 na Novém Městě.", "date_label": "8.5.1910", "start_date": "1910-05-08", "end_date": "1910-05-08", "author": "Kříženecký, Jan (1868-1921)", "note": "", "views": "102x", "geolocation_type": "regional.address"}}, {"type": "Feature", "geometry": {"type": "Point", "coordinates": [14.40131, 50.08733]}, "properties": {"id": "A0C4F552B67611DF820F00166F1163D4", "kind": "pozitiv", "description": "Pohled na detail štukového stropu v interiéru Schönbornského paláce - domu čp. 365 na Malé Straně.", "date_label": "červen 1931", "start_date": "1931-06-01", "end_date": "1931-06-30", "author": "Vojta, Tomáš (1885-1934)", "note": "Autorství T. Vojty není jisté.", "views": "23x", "geolocation_type": "regional.address"}}, {"type": "Feature", "geometry": {"type": "Point", "coordinates": [14.41783, 50.08711]}, "properties": {"id": "A0C4F557B67611DF820F00166F1163D4", "kind": "pozitiv", "description": "Zasedání pléna Národního výboru hl. m. Prahy v zasedací síni budovy Magistrátu hlavního města Prahy (dům čp. 2) na Starém Městě.", "date_label": "", "start_date": "", "end_date": "", "author": "Šára, Jan", "note": "", "views": "49x", "geolocation_type": "regional.address"}}, {"type": "Feature", "geometry": {"type": "Point", "coordinates": [14.42159, 50.08432]}, "properties": {"id": "A0C4F558B67611DF820F00166F1163D4", "kind": "pozitiv", "description": "Pohled do interiéru domu čp. 406 na Starém Městě (Staroměstská tržnice) v Rytířské ulici - strojovna.", "date_label": "16.12.1910", "start_date": "1910-12-16", "end_date": "1910-12-16", "author": "Kříženecký, Jan (1868-1921)", "note": "", "views": "39x", "geolocation_type": "regional.address"}}, {"type": "Feature", "geometry": {"type": "Point", "coordinates": [14.42009, 50.087]}, "properties": {"id": "A0C4F55FB67611DF820F00166F1163D4", "kind": "pozitiv", "description": "VIII. sokolský slet 1926 - slavnostní shromáždění na Staroměstském náměstí před Staroměstskou radnicí.", "date_label": "1926", "start_date": "1926-01-01", "end_date": "1926-12-31", "author": "", "note": "", "views": "122x", "geolocation_type": "regional.address"}}, {"type": "Feature", "geometry": {"type": "Point", "coordinates": [14.35655, 50.06696]}, "properties": {"id": "A0C4F569B67611DF820F00166F1163D4", "kind": "pozitiv", "description": "Pohled do zahrady usedlosti Cibulka v Košířích (dům čp. 118) - od Jupiterovy studánky k čínskému pavilonu.", "date_label": "říjen 1924", "start_date": "1924-10-01", "end_date": "1924-10-31", "author": "Vojta, Tomáš (1885-1934)", "note": "", "views": "58x", "geolocation_type": "regional.address"}}, {"type": "Feature", "geometry": {"type": "Point", "coordinates": [14.38996, 50.08783]}, "properties": {"id": "A0C4F572B67611DF820F00166F1163D4", "kind": "negativ", "description": "Pohled na domy čp. 111 (sirotčinec arcivévodkyně Gisely) a 112 na Pohořelci na Hradčanech. Vlevo empírová kašna.", "date_label": "kol.1890", "start_date": "1890-01-01", "end_date": "1890-12-31", "author": "Eckert, Jindřich (1833-1905)", "note": "", "views": "34x", "geolocation_type": "regional.address"}}, {"type": "Feature", "geometry": {"type": "Point", "coordinates": [14.40526, 50.09394]}, "properties": {"id": "A0C4F573B67611DF820F00166F1163D4", "kind": "negativ", "description": "\"Tycho Brahe v Praze\" - výročí 1901. T.II. Belveder - Letohrádek královny Anny (dům čp. 52 na Hradčanech).", "date_label": "1901", "start_date": "1901-01-01", "end_date": "1901-12-31", "author": "Eckert, Jindřich (1833-1905)", "note": "", "views": "17x", "geolocation_type": "regional.address"}}, {"type": "Feature", "geometry": {"type": "Point", "coordinates": [14.42854, 50.09225]}, "properties": {"id": "A0C4F574B67611DF820F00166F1163D4", "kind": "pozitiv", "description": "Pohled na Nové mlýny na Novém Městě. Vlevo Šebelův mlýn (dům čp. 1293), Sudův mlýn (dům čp. 1292) a dům čp. 1528. Vlevo od Novomlýnské vodárenské věže je Vávrův mlýn (dům čp. 1239 na Novém Městě).", "date_label": "2.8.1910", "start_date": "1910-08-02", "end_date": "1910-08-02", "author": "Eckert-ateliér", "note": "", "views": "35x", "geolocation_type": "regional.address"}}, {"type": "Feature", "geometry": {"type": "Point", "coordinates": [14.39886, 50.07673]}, "properties": {"id": "A0C4F58BB67611DF820F00166F1163D4", "kind": "pozitiv", "description": "Pohled na hlavní průčelí Kinského vily čp. 98 v zahradě Kinských na Smíchově.", "date_label": "", "start_date": "", "end_date": "", "author": "", "note": "", "views": "31x", "geolocation_type": "regional.address"}}, {"type": "Feature", "geometry": {"type": "Point", "coordinates": [14.43681, 50.09865]}, "properties": {"id": "A0C4F58CB67611DF820F00166F1163D4", "kind": "pozitiv", "description": "Celkový pohled na novostavbu Elektrických podniků hl. m. Prahy v Holešovicích (dům čp. 1477).", "date_label": "1935-1939", "start_date": "1935-01-01", "end_date": "1939-12-31", "author": "Pařík", "note": "", "views": "58x", "geolocation_type": "regional.address"}}, {"type": "Feature", "geometry": {"type": "Point", "coordinates": [14.37226, 50.07276]}, "properties": {"id": "A0C4F590B67611DF820F00166F1163D4", "kind": "pozitiv", "description": "Pohled na usedlost Klikovku (dům čp. 118, 119) na Smíchově.", "date_label": "5.5.1925", "start_date": "1925-05-05", "end_date": "1925-05-05", "author": "Alexander, Antonín (1892-působnost do 1948)", "note": "", "views": "119x", "geolocation_type": "regional.address"}}, {"type": "Feature", "geometry": {"type": "Point", "coordinates": [14.41889, 50.086]}, "properties": {"id": "A0C4F59BB67611DF820F00166F1163D4", "kind": "pozitiv", "description": "Pohled na portál domu čp. 147 (\"U Košků\") v Karlově ulici na Starém Městě.", "date_label": "12.7.1906", "start_date": "1906-07-12", "end_date": "1906-07-12", "author": "", "note": "", "views": "12x", "geolocation_type": "regional.address"}}, {"type": "Feature", "geometry": {"type": "Point", "coordinates": [14.40374, 50.07224]}, "properties": {"id": "A0C4F5A3B67611DF820F00166F1163D4", "kind": "pozitiv", "description": "Průhled Kinského třídou (dnes Štefánikova ulice) od Nádražní ulice. Vlevo dům čp. 23, vpravo čp. 284 na Smíchově.", "date_label": "kol.1905", "start_date": "1905-01-01", "end_date": "1905-12-31", "author": "Bellmann-ateliér", "note": "", "views": "168x", "geolocation_type": "regional.address"}}, {"type": "Feature", "geometry": {"type": "Point", "coordinates": [14.4186, 50.0808]}, "properties": {"id": "A0C4F5A5B67611DF820F00166F1163D4", "kind": "negativ", "description": "Pohled na portál domu čp. 126 na Novém Městě v Ostrovní ulici.", "date_label": "kol.1900", "start_date": "1900-01-01", "end_date": "1900-12-31", "author": "Eckert, Jindřich (1833-1905)", "note": "", "views": "24x", "geolocation_type": "regional.address"}}, {"type": "Feature", "geometry": {"type": "Point", "coordinates": [14.36152, 50.08598]}, "properties": {"id": "A0C4F5ACB67611DF820F00166F1163D4", "kind": "pozitiv", "description": "Pohled na severní konec Malého náměstí (dnes Břevnovská ulice) v Břevnově. Zleva domy čp. 28, 29. V pozadí dům čp. 8 na křižovatce s Markétskou ulicí.", "date_label": "4.9.1943", "start_date": "1943-09-04", "end_date": "1943-09-04", "author": "Alexander, Antonín (1892-působnost do 1948)", "note": "", "views": "46x", "geolocation_type": "regional.address"}}, {"type": "Feature", "geometry": {"type": "Point", "coordinates": [14.43263, 50.08071]}, "properties": {"id": "A0C4F5BDB67611DF820F00166F1163D4", "kind": "negativ", "description": "Pohled do interiéru divadla (Německé - Smetanovo - Státní opera - dům čp. 101 na Vinohradech) - jeviště s oponou.", "date_label": "kol.1890", "start_date": "1890-01-01", "end_date": "1890-12-31", "author": "Eckert, Jindřich (1833-1905)", "note": "", "views": "54x", "geolocation_type": "regional.address"}}, {"type": "Feature", "geometry": {"type": "Point", "coordinates": [14.4189, 50.08615]}, "properties": {"id": "A0C4F5C1B67611DF820F00166F1163D4", "kind": "pozitiv", "description": "Pohled na portál domu čp. 146 (\"U Adama a Evy\") v Karlově ulici na Starém Městě.", "date_label": "1909", "start_date": "1909-01-01", "end_date": "1909-12-31", "author": "", "note": "", "views": "14x", "geolocation_type": "regional.address"}}, {"type": "Feature", "geometry": {"type": "Point", "coordinates": [14.38967, 50.08671]}, "properties": {"id": "A0C4F5C4B67611DF820F00166F1163D4", "kind": "negativ", "description": "Pohled na bránu do nádvoří Strahovského kláštera (vnější strana) - dům čp. 132 na Hradčanech.", "date_label": "11.6.1898", "start_date": "1898-06-11", "end_date": "1898-06-11", "author": "Eckert, Jindřich (1833-1905)", "note": "", "views": "21x", "geolocation_type": "regional.address"}}, {"type": "Feature", "geometry": {"type": "Point", "coordinates": [14.32461, 50.03792]}, "properties": {"id": "A0C4F5C5B67611DF820F00166F1163D4", "kind": "pozitiv", "description": "Pohled na část horního patra domu čp. 920 ve Švédské ulici na Smíchově při demolici.", "date_label": "1986", "start_date": "1986-01-01", "end_date": "1986-12-31", "author": "Jelínková, Jana (1951-)", "note": "", "views": "38x", "geolocation_type": "regional.address"}}, {"type": "Feature", "geometry": {"type": "Point", "coordinates": [14.39151, 50.08925]}, "properties": {"id": "A0C4F5C9B67611DF820F00166F1163D4", "kind": "pozitiv", "description": "Pohled na kapli P. Marie (Svatá chýše - Santa casa) na nádvoří Lorety (dům čp. 100 na Hradčanech) na Loretánském náměstí - štuková výzdoba levé části jižní strany.", "date_label": "kol.1895", "start_date": "1895-01-01", "end_date": "1895-12-31", "author": "Eckert, Jindřich (1833-1905)", "note": "", "views": "16x", "geolocation_type": "regional.address"}}, {"type": "Feature", "geometry": {"type": "Point", "coordinates": [14.40535, 50.09003]}, "properties": {"id": "A0C4F5CDB67611DF820F00166F1163D4", "kind": "negativ", "description": "Pohled do interiéru Valdštejnského paláce (dům čp. 17 na Malé Straně) - Rytířská síň.", "date_label": "", "start_date": "", "end_date": "", "author": "Eckert, Jindřich (1833-1905)", "note": "", "views": "40x", "geolocation_type": "regional.address"}}, {"type": "Feature", "geometry": {"type": "Point", "coordinates": [14.39741, 50.07628]}, "properties": {"id": "A0C4F5CEB67611DF820F00166F1163D4", "kind": "pozitiv", "description": "Celkový pohled na dům čp. 104 v Holečkově ulici (ústav hluchoněmých) na Smíchově.", "date_label": "", "start_date": "", "end_date": "", "author": "", "note": "", "views": "29x", "geolocation_type": "regional.address"}}, {"type": "Feature", "geometry": {"type": "Point", "coordinates": [14.40131, 50.08733]}, "properties": {"id": "A0C4F5DDB67611DF820F00166F1163D4", "kind": "pozitiv", "description": "Pohled na vstupní portál domu čp. 365 (\"palác Schönbornský\") v ulici Tržiště na Malé Straně.", "date_label": "11.6.1907", "start_date": "1907-06-11", "end_date": "1907-06-11", "author": "", "note": "", "views": "15x", "geolocation_type": "regional.address"}}, {"type": "Feature", "geometry": {"type": "Point", "coordinates": [14.42269, 50.08469]}, "properties": {"id": "A0C4F5DFB67611DF820F00166F1163D4", "kind": "pozitiv", "description": "Pohled na vstupní portál domu čp. 384 (\"U zlaté lopaty\") v ulici Na Můstku na Starém Městě.", "date_label": "15.8.1913", "start_date": "1913-08-15", "end_date": "1913-08-15", "author": "", "note": "", "views": "12x", "geolocation_type": "regional.address"}}, {"type": "Feature", "geometry": {"type": "Point", "coordinates": [14.42369, 50.08722]}, "properties": {"id": "A0C4F5E0B67611DF820F00166F1163D4", "kind": "pozitiv", "description": "Pohled na vstupní portál domu čp. 598 (\"Dům u zlatého jelena\") v Štupartské ulici na Starém Městě.", "date_label": "25.4.1906", "start_date": "1906-04-25", "end_date": "1906-04-25", "author": "", "note": "", "views": "8x", "geolocation_type": "regional.address"}}, {"type": "Feature", "geometry": {"type": "Point", "coordinates": [14.41577, 50.08777]}, "properties": {"id": "A0C4F5E1B67611DF820F00166F1163D4", "kind": "pozitiv", "description": "Pohled do Veleslavínovy ulice s domy čp. 96 a 97.", "date_label": "8.11.1944", "start_date": "1944-11-08", "end_date": "1944-11-08", "author": "Alexander, Antonín (1892-působnost do 1948)", "note": "", "views": "59x", "geolocation_type": "regional.address"}}, {"type": "Feature", "geometry": {"type": "Point", "coordinates": [14.42091, 50.08566]}, "properties": {"id": "A0C4F5E5B67611DF820F00166F1163D4", "kind": "pozitiv", "description": "Pohled na vstupní portál bývalého domu čp. 471 (\"Melantrichův dům\") v Melantrichově ulici na Starém Městě, který byl zbořen v1893.", "date_label": "1893", "start_date": "1893-01-01", "end_date": "1893-12-31", "author": "", "note": "", "views": "21x", "geolocation_type": "regional.address"}}, {"type": "Feature", "geometry": {"type": "Point", "coordinates": [14.42422, 50.08601]}, "properties": {"id": "A0C4F5E7B67611DF820F00166F1163D4", "kind": "pozitiv", "description": "Celkový pohled na dům čp. 580 (\"U Hroznu\") na nároží Ovocného trhu a Havířské ulice na Starém Městě. Vlevo dům čp. 579 (Kolovratský palác). Zcela vlevo část Tylova divadla.", "date_label": "1899", "start_date": "1899-01-01", "end_date": "1899-12-31", "author": "Eckert, Jindřich (1833-1905)", "note": "", "views": "54x", "geolocation_type": "regional.address"}}, {"type": "Feature", "geometry": {"type": "Point", "coordinates": [14.40775, 50.06562]}, "properties": {"id": "A0C4F5EDB67611DF820F00166F1163D4", "kind": "pozitiv", "description": "Celkový pohled na dům čp. 349 v Nádražní ulici na Smíchově.", "date_label": "7.11.1926", "start_date": "1926-11-07", "end_date": "1926-11-07", "author": "Alexander, Antonín (1892-působnost do 1948)", "note": "", "views": "62x", "geolocation_type": "regional.address"}}, {"type": "Feature", "geometry": {"type": "Point", "coordinates": [14.39408, 50.08858]}, "properties": {"id": "A0C4F5F5B67611DF820F00166F1163D4", "kind": "pozitiv", "description": "Pohled do ateliéru Hrzánského paláce (dům čp. 177 na Hradčanech).", "date_label": "kol.1925", "start_date": "1925-01-01", "end_date": "1925-12-31", "author": "Vojta, Tomáš (1885-1934)", "note": "", "views": "26x", "geolocation_type": "regional.address"}}, {"type": "Feature", "geometry": {"type": "Point", "coordinates": [14.40535, 50.09003]}, "properties": {"id": "A0C4F5F9B67611DF820F00166F1163D4", "kind": "negativ", "description": "Pohled do zahrady a na salu terrenu Valdštejnského paláce (dům čp. 17 na Malé Straně).", "date_label": "23.9.1907", "start_date": "1907-09-23", "end_date": "1907-09-23", "author": "Eckert-ateliér", "note": "", "views": "22x", "geolocation_type": "regional.address"}}, {"type": "Feature", "geometry": {"type": "Point", "coordinates": [14.42495, 50.07406]}, "properties": {"id": "A0C4F5FCB67611DF820F00166F1163D4", "kind": "pozitiv", "description": "Pohled na vstupní portál domu čp. 468 v Kateřinské ulici na Novém Městě.", "date_label": "15.5.1906", "start_date": "1906-05-15", "end_date": "1906-05-15", "author": "", "note": "", "views": "58x", "geolocation_type": "regional.address"}}, {"type": "Feature", "geometry": {"type": "Point", "coordinates": [14.42332, 50.08323]}, "properties": {"id": "A0C4F5FEB67611DF820F00166F1163D4", "kind": "pozitiv", "description": "Pohled na vstupní portál domu čp. 755 (\"U Pinkasů\") na Jungmannově náměstí na Novém Městě.", "date_label": "1907", "start_date": "1907-01-01", "end_date": "1907-12-31", "author": "", "note": "", "views": "18x", "geolocation_type": "regional.address"}}, {"type": "Feature", "geometry": {"type": "Point", "coordinates": [14.42894, 50.07574]}, "properties": {"id": "A0C4F602B67611DF820F00166F1163D4", "kind": "pozitiv", "description": "Pohled na severozápadní stranu dnešního náměstí I. P. Pavlova (Petra Osvoboditele, Komenského) s domy zprava čp. 1787 a 1662 na nároží Ječné ulice na Novém Městě.", "date_label": "", "start_date": "", "end_date": "", "author": "", "note": "", "views": "85x", "geolocation_type": "regional.address"}}, {"type": "Feature", "geometry": {"type": "Point", "coordinates": [14.42559, 50.08243]}, "properties": {"id": "A0C4F606B67611DF820F00166F1163D4", "kind": "negativ", "description": "Celkový pohled na průčelí domu čp. 791 (\"U Lhotků\") na nároží Václavského náměstí a Vodičkovy ulice na Novém Městě těsně před zbořením. Vpravo čp. 788 na Novém Městě.", "date_label": "16.7.1913", "start_date": "1913-07-16", "end_date": "1913-07-16", "author": "Eckert-ateliér", "note": "", "views": "76x", "geolocation_type": "regional.address"}}, {"type": "Feature", "geometry": {"type": "Point", "coordinates": [14.41139, 50.09203]}, "properties": {"id": "A0C4F61FB67611DF820F00166F1163D4", "kind": "pozitiv", "description": "Pohled na Železnou lávku při demolici. V pozadí Strakovo nábřeží s domem čp. 128 a s vojenskou plovárnou na Malé Straně.", "date_label": "1914", "start_date": "1914-01-01", "end_date": "1914-12-31", "author": "", "note": "", "views": "58x", "geolocation_type": "regional.address"}}, {"type": "Feature", "geometry": {"type": "Point", "coordinates": [14.42215, 50.08953]}, "properties": {"id": "A0C4F623B67611DF820F00166F1163D4", "kind": "pozitiv", "description": "Pohled do dvora domu čp. 922 na Starém Městě s pavlačí a arkýřem.", "date_label": "kol.1900", "start_date": "1900-01-01", "end_date": "1900-12-31", "author": "Svoboda, Josef ml. (dokument 1914-1920)", "note": "", "views": "20x", "geolocation_type": "regional.address"}}, {"type": "Feature", "geometry": {"type": "Point", "coordinates": [14.40131, 50.08733]}, "properties": {"id": "A0C4F629B67611DF820F00166F1163D4", "kind": "pozitiv", "description": "Pohled do nádvoří Schönbornského paláce - domu čp. 365 na Malé Straně.", "date_label": "červen 1931", "start_date": "1931-06-01", "end_date": "1931-06-30", "author": "Vojta, Tomáš (1885-1934)", "note": "Autorství T. Vojty není jisté.", "views": "26x", "geolocation_type": "regional.address"}}, {"type": "Feature", "geometry": {"type": "Point", "coordinates": [14.50071, 50.05335]}, "properties": {"id": "A0C4F636B67611DF820F00166F1163D4", "kind": "pozitiv", "description": "Pohled na část domu čp. 159 (škola) v Záběhlicích v Práčské ulici.", "date_label": "1940-1945", "start_date": "1940-01-01", "end_date": "1945-12-31", "author": "", "note": "", "views": "74x", "geolocation_type": "regional.address"}}, {"type": "Feature", "geometry": {"type": "Point", "coordinates": [14.3966, 50.0892]}, "properties": {"id": "A0C4F63BB67611DF820F00166F1163D4", "kind": "pozitiv", "description": "Celkový pohled na Schwarzenberský (Lobkovický) palác na Hradčanském náměstí (dům čp. 185) na Hradčanech.", "date_label": "", "start_date": "", "end_date": "", "author": "Vojta, Tomáš (1885-1934)", "note": "", "views": "28x", "geolocation_type": "regional.address"}}, {"type": "Feature", "geometry": {"type": "Point", "coordinates": [14.4202, 50.08848]}, "properties": {"id": "A0C4F63CB67611DF820F00166F1163D4", "kind": "negativ", "description": "Pohled na štukovou výzdobu okna prvního patra průčelí Krenova domu čp. 936 na Staroměstském náměstí při bourání.", "date_label": "1901", "start_date": "1901-01-01", "end_date": "1901-12-31", "author": "Eckert, Jindřich (1833-1905)", "note": "", "views": "24x", "geolocation_type": "regional.address"}}, {"type": "Feature", "geometry": {"type": "Point", "coordinates": [14.41521, 50.09017]}, "properties": {"id": "A0C4F647B67611DF820F00166F1163D4", "kind": "pozitiv", "description": "Celkový pohled na Rudolfinum (dům čp. 79 na Starém Městě) od jihovýchodu - od křižovatky dnešního Palachova náměstí a Sanytrové ulice (dnes ulice 17. listopadu) na Starém Městě.", "date_label": "kol.1885", "start_date": "1885-01-01", "end_date": "1885-12-31", "author": "Eckert, Jindřich (1833-1905)", "note": "", "views": "41x", "geolocation_type": "regional.address"}}, {"type": "Feature", "geometry": {"type": "Point", "coordinates": [14.52523, 50.05169]}, "properties": {"id": "A0C4F64BB67611DF820F00166F1163D4", "kind": "pozitiv", "description": "Pohled na dům čp. 129 (Obecná škola) na Komenského náměstí v Hostivaři, v popředí sýpka.", "date_label": "9.6.1930", "start_date": "1930-06-09", "end_date": "1930-06-09", "author": "Alexander, Antonín (1892-působnost do 1948)", "note": "", "views": "62x", "geolocation_type": "regional.address"}}, {"type": "Feature", "geometry": {"type": "Point", "coordinates": [14.42553, 50.08197]}, "properties": {"id": "A0C4F64EB67611DF820F00166F1163D4", "kind": "pozitiv", "description": "Pohled do dvora domu U Lhotků na Václavském náměstí čp. 791 na Novém Městě.", "date_label": "7.7.1913", "start_date": "1913-07-07", "end_date": "1913-07-07", "author": "Kříženecký, Jan (1868-1921)", "note": "", "views": "50x", "geolocation_type": "regional.address"}}, {"type": "Feature", "geometry": {"type": "Point", "coordinates": [14.4171, 50.08824]}, "properties": {"id": "A0C4F651B67611DF820F00166F1163D4", "kind": "negativ", "description": "Pohled na část průčelí domu v Kaprově ulici \"U Tří kaprů\" s domovním znamením (čp. 49 na Starém Městě) při bourání.", "date_label": "1896", "start_date": "1896-01-01", "end_date": "1896-12-31", "author": "Eckert, Jindřich (1833-1905)", "note": "", "views": "53x", "geolocation_type": "regional.address"}}, {"type": "Feature", "geometry": {"type": "Point", "coordinates": [14.40696, 50.09058]}, "properties": {"id": "A0C4F658B67611DF820F00166F1163D4", "kind": "pozitiv", "description": "Pohled do průjezdu domu čp. 153 (Fürstenberský palác) na Malé Straně.", "date_label": "1926", "start_date": "1926-01-01", "end_date": "1926-12-31", "author": "Vojta, Tomáš (1885-1934)", "note": "", "views": "39x", "geolocation_type": "regional.address"}}, {"type": "Feature", "geometry": {"type": "Point", "coordinates": [14.39803, 50.08729]}, "properties": {"id": "A0C4F65BB67611DF820F00166F1163D4", "kind": "negativ", "description": "Pohled do interiéru Lobkovického paláce čp. 347 (Černínský-Přehořovský palác) na Malé Straně.", "date_label": "kol.1900", "start_date": "1900-01-01", "end_date": "1900-12-31", "author": "Eckert, Jindřich (1833-1905)", "note": "", "views": "22x", "geolocation_type": "regional.address"}}, {"type": "Feature", "geometry": {"type": "Point", "coordinates": [14.40084, 50.08849]}, "properties": {"id": "A0C4F669B67611DF820F00166F1163D4", "kind": "pozitiv", "description": "Pohled do Ostruhové ulice (dnes Nerudova) uprostřed s domem čp. 256 na Malé Straně (Morzinský palác).", "date_label": "kol.1885", "start_date": "1885-01-01", "end_date": "1885-12-31", "author": "Eckert, Jindřich (1833-1905)", "note": "", "views": "34x", "geolocation_type": "regional.address"}}, {"type": "Feature", "geometry": {"type": "Point", "coordinates": [14.41321, 50.08173]}, "properties": {"id": "A0C4F66BB67611DF820F00166F1163D4", "kind": "pozitiv", "description": "Pohled z mostu Františka I. (Legií) na na Národní divadlo (dům čp. 223 na Novém Městě). Vlevo část domu čp. 1012 na Starém Městě (kavárna Slavia).", "date_label": "26.4.1914", "start_date": "1914-04-26", "end_date": "1914-04-26", "author": "Kříženecký, Jan (1868-1921)", "note": "", "views": "131x", "geolocation_type": "regional.address"}}, {"type": "Feature", "geometry": {"type": "Point", "coordinates": [14.42048, 50.08805]}, "properties": {"id": "A0C4F670B67611DF820F00166F1163D4", "kind": "pozitiv", "description": "Pohled na kostel sv. Mikuláše od Kaprovy ulice na Starém Městě po odbourání staré prelatury kostela sv. Mikuláše (dům čp. 27). V pozadí novostavba domu čp. 934 v Pařížské ulici.", "date_label": "15.6.1900", "start_date": "1900-06-15", "end_date": "1900-06-15", "author": "Eckert, Jindřich (1833-1905)", "note": "", "views": "36x", "geolocation_type": "regional.address"}}, {"type": "Feature", "geometry": {"type": "Point", "coordinates": [14.41783, 50.08711]}, "properties": {"id": "A0C4F672B67611DF820F00166F1163D4", "kind": "pozitiv", "description": "Pohled na průčelí budovy Magistrátu hlavního města Prahy (dům čp. 2) do Platnéřské ulice na Starém Městě.", "date_label": "1939-1940", "start_date": "1939-01-01", "end_date": "1940-12-31", "author": "", "note": "", "views": "23x", "geolocation_type": "regional.address"}}, {"type": "Feature", "geometry": {"type": "Point", "coordinates": [14.42009, 50.087]}, "properties": {"id": "A0C4F679B67611DF820F00166F1163D4", "kind": "pozitiv", "description": "Uložení ostatků neznámého vojína padlého v bitvě u Zborova do kaple Staroměstské radnice (dům čp. 1 na Starém Městě) - vojáci před Staroměstskou radnicí (část východního křídla).", "date_label": "1.7.1922", "start_date": "1922-07-01", "end_date": "1922-07-01", "author": "", "note": "", "views": "76x", "geolocation_type": "regional.address"}}, {"type": "Feature", "geometry": {"type": "Point", "coordinates": [14.42009, 50.087]}, "properties": {"id": "A0C4F684B67611DF820F00166F1163D4", "kind": "pozitiv", "description": "Pražské povstání - květen 1945 - provizorní pomník na Staroměstském náměstí - kříž postavený 13.5.1945 z trámů křídla Staroměstské radnice po požáru 8.5.1945. Pomník se jmény obránců radničních budov a městského rozhlasu padlých 5. - 9. května 1945. Sbírka na padlé a raněné obránce.", "date_label": "květen 1945", "start_date": "1945-05-01", "end_date": "1945-05-31", "author": "", "note": "", "views": "159x", "geolocation_type": "regional.address"}}, {"type": "Feature", "geometry": {"type": "Point", "coordinates": [14.41406, 50.08641]}, "properties": {"id": "A0C4F68DB67611DF820F00166F1163D4", "kind": "negativ", "description": "Pohled do nádvoří domu čp. 191 na Starém Městě (Křižovnický klášter) - část starého budovy při bourání.", "date_label": "13.11.1910", "start_date": "1910-11-13", "end_date": "1910-11-13", "author": "Eckert-ateliér", "note": "", "views": "23x", "geolocation_type": "regional.address"}}, {"type": "Feature", "geometry": {"type": "Point", "coordinates": [14.40362, 50.08528]}, "properties": {"id": "A0C4F692B67611DF820F00166F1163D4", "kind": "pozitiv", "description": "Pohled z ulice Pod Bruskou na dům čp. 529 na Malé Straně po odbourání domu čp. 149 (skladiště). V pozadí Pražský hrad.", "date_label": "1919-1924", "start_date": "1919-01-01", "end_date": "1924-12-31", "author": "Vojta, Tomáš (1885-1934)", "note": "", "views": "43x", "geolocation_type": "regional.address"}}, {"type": "Feature", "geometry": {"type": "Point", "coordinates": [14.39071, 50.08877]}, "properties": {"id": "A0C4F696B67611DF820F00166F1163D4", "kind": "negativ", "description": "Celkový pohled na hlavní průčelí Černínského paláce (dům čp. 101 na Hradčanech) na Loretánském náměstí.", "date_label": "kol.1890", "start_date": "1890-01-01", "end_date": "1890-12-31", "author": "Eckert, Jindřich (1833-1905)", "note": "", "views": "28x", "geolocation_type": "regional.address"}}, {"type": "Feature", "geometry": {"type": "Point", "coordinates": [14.40454, 50.07204]}, "properties": {"id": "A0C4F6B0B67611DF820F00166F1163D4", "kind": "pozitiv", "description": "Pohled na spodní část průčelí nárožního domu čp. 66 na Smíchově (Velkoobchod Petr F. Krejčí).", "date_label": "", "start_date": "", "end_date": "", "author": "", "note": "", "views": "46x", "geolocation_type": "regional.address"}}, {"type": "Feature", "geometry": {"type": "Point", "coordinates": [14.40365, 50.08922]}, "properties": {"id": "A0C4F6B9B67611DF820F00166F1163D4", "kind": "pozitiv", "description": "Pohled do Thunovské ulice s domy čp. 181 (uprostřed) a čp. 177 (vpravo) na Malé Straně.", "date_label": "10.7.1911", "start_date": "1911-07-10", "end_date": "1911-07-10", "author": "Kříženecký, Jan (1868-1921)", "note": "", "views": "58x", "geolocation_type": "regional.address"}}, {"type": "Feature", "geometry": {"type": "Point", "coordinates": [14.4062, 50.0759]}, "properties": {"id": "A0C4F6C2B67611DF820F00166F1163D4", "kind": "pozitiv", "description": "Pohled na Arbesovo náměstí s domy zprava čp. 1107, 753, 781, 782, 742 na Smíchově.", "date_label": "1940-1945", "start_date": "1940-01-01", "end_date": "1945-12-31", "author": "Vopravil, Josef (1902-1972)", "note": "", "views": "124x", "geolocation_type": "regional.address"}}, {"type": "Feature", "geometry": {"type": "Point", "coordinates": [14.41471, 50.07955]}, "properties": {"id": "A0C4F6D4B67611DF820F00166F1163D4", "kind": "negativ", "description": "Pohled na dům čp. 228 (Nové lázně) v ulici Na Struze na Novém Městě před zbořením v roce 1903.", "date_label": "21.10.1903", "start_date": "1903-10-21", "end_date": "1903-10-21", "author": "Eckert, Jindřich (1833-1905)", "note": "", "views": "28x", "geolocation_type": "regional.address"}}, {"type": "Feature", "geometry": {"type": "Point", "coordinates": [14.39501, 50.08833]}, "properties": {"id": "A0C4F6D6B67611DF820F00166F1163D4", "kind": "pozitiv", "description": "Pohled na dolní průčelí domu čp. 161 (\"U zrcadla\") v ulici Úvoz na Hradčanech.", "date_label": "16.7.1906", "start_date": "1906-07-16", "end_date": "1906-07-16", "author": "", "note": "", "views": "26x", "geolocation_type": "regional.address"}}, {"type": "Feature", "geometry": {"type": "Point", "coordinates": [14.35655, 50.06696]}, "properties": {"id": "A0C4F6DDB67611DF820F00166F1163D4", "kind": "pozitiv", "description": "Pohled na umělou romantickou zříceninu (rozhlednu) v zahradě usedlosti Cibulka v Košířích (dům čp. 118) zdálky.", "date_label": "kol.1955", "start_date": "1955-01-01", "end_date": "1955-12-31", "author": "Hnilička, Eduard (1887-1967)", "note": "", "views": "50x", "geolocation_type": "regional.address"}}, {"type": "Feature", "geometry": {"type": "Point", "coordinates": [14.3937, 50.06407]}, "properties": {"id": "A0C4F6E5B67611DF820F00166F1163D4", "kind": "pozitiv", "description": "Pohled na dům čp. 177 (Malvazinka) na Smíchově.", "date_label": "březen 1959", "start_date": "1959-03-01", "end_date": "1959-03-31", "author": "Hnilička, Eduard (1887-1967)", "note": "", "views": "77x", "geolocation_type": "regional.address"}}, {"type": "Feature", "geometry": {"type": "Point", "coordinates": [14.41925, 50.06214]}, "properties": {"id": "A0C4F6EAB67611DF820F00166F1163D4", "kind": "negativ", "description": "Pohled na sanatorium (dům čp. 157 v Podolí) na Podolském nábřeží. Vpravo v pozadí věže kostela sv. Petra a Pavla na Vyšehradě.", "date_label": "kol.1915", "start_date": "1915-01-01", "end_date": "1915-12-31", "author": "", "note": "", "views": "65x", "geolocation_type": "regional.address"}}, {"type": "Feature", "geometry": {"type": "Point", "coordinates": [14.41443, 50.07796]}, "properties": {"id": "A0C4F6F0B67611DF820F00166F1163D4", "kind": "negativ", "description": "Pohled na Šítkovské mlýny k jihu. Zprava domy čp. 253 (Trnkův mlýn), 252, 251 (Vávrův mlýn), 250 (Kopeckého), 249 (Novotného), 248 (mlýnská budova) na Novém Městě. V pozadí věž Šítkovské vodárny.", "date_label": "kol.1900", "start_date": "1900-01-01", "end_date": "1900-12-31", "author": "Eckert, Jindřich (1833-1905)", "note": "", "views": "39x", "geolocation_type": "regional.address"}}, {"type": "Feature", "geometry": {"type": "Point", "coordinates": [14.39151, 50.08925]}, "properties": {"id": "A0C4F6F6B67611DF820F00166F1163D4", "kind": "pozitiv", "description": "Pohled na hlavní průčelí Lorety (dům čp. 100 na Hradčanech) na Loretánském náměstí.", "date_label": "29.3.1907", "start_date": "1907-03-29", "end_date": "1907-03-29", "author": "Klíma, Alois, Ing. (1873-1955)", "note": "", "views": "68x", "geolocation_type": "regional.address"}}, {"type": "Feature", "geometry": {"type": "Point", "coordinates": [14.40506, 50.0789]}, "properties": {"id": "A0C4F6F8B67611DF820F00166F1163D4", "kind": "pozitiv", "description": "Pohled na náměstí Kinských (Štefánikovo) vlevo s domy čp. 601, čp. 600, vpravo část domu čp. 234 na Smíchově (Štefánikova - kasárna - původně dům čp. 416 na Malé Straně, dnes dům čp. 234 na Smíchově).", "date_label": "kol.1905", "start_date": "1905-01-01", "end_date": "1905-12-31", "author": "", "note": "", "views": "137x", "geolocation_type": "regional.address"}}, {"type": "Feature", "geometry": {"type": "Point", "coordinates": [14.44484, 50.07974]}, "properties": {"id": "A0C4F6FDB67611DF820F00166F1163D4", "kind": "pozitiv", "description": "Přejmenování ulice U Riegrových sadů na Vinohradech na Chopinova. V pozadí dům čp. 1474 na Vinohradech.", "date_label": "1965", "start_date": "1965-01-01", "end_date": "1965-12-31", "author": "Šára, Jan", "note": "", "views": "87x", "geolocation_type": "regional.address"}}, {"type": "Feature", "geometry": {"type": "Point", "coordinates": [14.42052, 50.08568]}, "properties": {"id": "A0C4F70CB67611DF820F00166F1163D4", "kind": "pozitiv", "description": "Pohled na vstupní portál domu čp. 463 (\"Teyflův dům\") v Michalské ulici na Starém Městě.", "date_label": "29.4.1908", "start_date": "1908-04-29", "end_date": "1908-04-29", "author": "", "note": "", "views": "20x", "geolocation_type": "regional.address"}}, {"type": "Feature", "geometry": {"type": "Point", "coordinates": [14.41678, 50.07444]}, "properties": {"id": "A0C4F71DB67611DF820F00166F1163D4", "kind": "pozitiv", "description": "Pohled do Kočičí ulice s domy čp. 339 (Svatováclavské lázně - část vlevo) a čp. 344 (část vpravo) na nároží ulice Pod Slovany na Novém Městě.", "date_label": "prosinec 1899", "start_date": "1899-12-01", "end_date": "1899-12-31", "author": "Eckert, Jindřich (1833-1905)", "note": "", "views": "68x", "geolocation_type": "regional.address"}}, {"type": "Feature", "geometry": {"type": "Point", "coordinates": [14.42009, 50.087]}, "properties": {"id": "A0C4F71FB67611DF820F00166F1163D4", "kind": "pozitiv", "description": "Pohled na západní stranu Staroměstského náměstí se Staroměstskou radnicí (dům čp. 1) a Krenovým domem (dům čp. 936). Vlevo mariánský sloup.", "date_label": "1890-1895", "start_date": "1890-01-01", "end_date": "1895-12-31", "author": "Bellmann-ateliér", "note": "", "views": "422x", "geolocation_type": "regional.address"}}, {"type": "Feature", "geometry": {"type": "Point", "coordinates": [14.40131, 50.08733]}, "properties": {"id": "A0C4F725B67611DF820F00166F1163D4", "kind": "pozitiv", "description": "Pohled do dvora Schönbornského paláce - domu čp. 365 na Malé Straně.", "date_label": "červen 1931", "start_date": "1931-06-01", "end_date": "1931-06-30", "author": "", "note": "", "views": "29x", "geolocation_type": "regional.address"}}, {"type": "Feature", "geometry": {"type": "Point", "coordinates": [14.42861, 50.10242]}, "properties": {"id": "A0C4F72BB67611DF820F00166F1163D4", "kind": "negativ", "description": "Celkový pohled na dům čp. 851 v Holešovicích (opatrovna U Studánky).", "date_label": "12.7.1903", "start_date": "1903-07-12", "end_date": "1903-07-12", "author": "Eckert, Jindřich (1833-1905)", "note": "", "views": "62x", "geolocation_type": "regional.address"}}, {"type": "Feature", "geometry": {"type": "Point", "coordinates": [14.53137, 50.05134]}, "properties": {"id": "A0C4F72CB67611DF820F00166F1163D4", "kind": "negativ", "description": "Hlavní průčelí restaurace (dům čp. 226 na Novém Městě - Palác Žofín) na Slovanském ostrově po přestavbě roku 1885.", "date_label": "kol.1890", "start_date": "1890-01-01", "end_date": "1890-12-31", "author": "Eckert, Jindřich (1833-1905)", "note": "", "views": "21x", "geolocation_type": "regional.address"}}, {"type": "Feature", "geometry": {"type": "Point", "coordinates": [14.4169, 50.06518]}, "properties": {"id": "A0C4F732B67611DF820F00166F1163D4", "kind": "pozitiv", "description": "Pohled na vstupní portál domu čp. 69 (Vyšehradské probošství) ve Štulcově ulici na Vyšehradě.", "date_label": "1909", "start_date": "1909-01-01", "end_date": "1909-12-31", "author": "", "note": "", "views": "47x", "geolocation_type": "regional.address"}}, {"type": "Feature", "geometry": {"type": "Point", "coordinates": [14.35757, 49.98663]}, "properties": {"id": "A0C4F73BB67611DF820F00166F1163D4", "kind": "pozitiv", "description": "Pohled na dům čp. 62 (Perucka) na Vinohradech.", "date_label": "29.9.1929", "start_date": "1929-09-29", "end_date": "1929-09-29", "author": "Alexander, Antonín (1892-působnost do 1948)", "note": "", "views": "41x", "geolocation_type": "regional.address"}}, {"type": "Feature", "geometry": {"type": "Point", "coordinates": [14.40597, 50.03164]}, "properties": {"id": "A0C4F73FB67611DF820F00166F1163D4", "kind": "pozitiv", "description": "Pohled na ledárnu v Braníku (dům čp. 238 v Braníku).", "date_label": "kol.1920", "start_date": "1920-01-01", "end_date": "1920-12-31", "author": "Vojta, Tomáš (1885-1934)", "note": "", "views": "62x", "geolocation_type": "regional.address"}}, {"type": "Feature", "geometry": {"type": "Point", "coordinates": [14.40696, 50.09058]}, "properties": {"id": "A0C4F744B67611DF820F00166F1163D4", "kind": "negativ", "description": "Pohled do Fürstenberské zahrady na Malé Straně - uprostřed kašna.", "date_label": "kol.1900", "start_date": "1900-01-01", "end_date": "1900-12-31", "author": "Eckert, Jindřich (1833-1905)", "note": "", "views": "25x", "geolocation_type": "regional.address"}}, {"type": "Feature", "geometry": {"type": "Point", "coordinates": [14.32073, 50.10005]}, "properties": {"id": "A0C4F74AB67611DF820F00166F1163D4", "kind": "pozitiv", "description": "Pohled na usedlost Dívčí skok (dům čp. 41) v Liboci - východní průčelí s freskou \"Ctirad a Šárka\".", "date_label": "15.4.1944", "start_date": "1944-04-15", "end_date": "1944-04-15", "author": "Alexander, Antonín (1892-působnost do 1948)", "note": "", "views": "112x", "geolocation_type": "regional.address"}}, {"type": "Feature", "geometry": {"type": "Point", "coordinates": [14.44836, 50.09326]}, "properties": {"id": "A0C4F752B67611DF820F00166F1163D4", "kind": "pozitiv", "description": "Pohled do Královské třídy (dnes Sokolovská) z Jungmannova (dnes Karlínské) náměstí k východu. Uprostřed nárožní dům čp. 145 v Karlíně.", "date_label": "kol.1900", "start_date": "1900-01-01", "end_date": "1900-12-31", "author": "Bellmann-ateliér", "note": "", "views": "309x", "geolocation_type": "regional.address"}}, {"type": "Feature", "geometry": {"type": "Point", "coordinates": [14.40038, 50.08859]}, "properties": {"id": "A0C4F753B67611DF820F00166F1163D4", "kind": "pozitiv", "description": "Pohled do vestibulu Thunovského paláce - domu čp. 214 na Malé Straně v Nerudově ulici.", "date_label": "kol.1925", "start_date": "1925-01-01", "end_date": "1925-12-31", "author": "Vojta, Tomáš (1885-1934)", "note": "", "views": "45x", "geolocation_type": "regional.address"}}, {"type": "Feature", "geometry": {"type": "Point", "coordinates": [14.41925, 50.06214]}, "properties": {"id": "A0C4F76EB67611DF820F00166F1163D4", "kind": "pozitiv", "description": "Celkový pohled na sanatorium (dům čp. 157 v Podolí) na Podolském nábřeží v Podolí.", "date_label": "", "start_date": "", "end_date": "", "author": "Eckert-ateliér", "note": "Autorství ateliéru Eckert není jisté.", "views": "73x", "geolocation_type": "regional.address"}}, {"type": "Feature", "geometry": {"type": "Point", "coordinates": [14.4084, 50.08754]}, "properties": {"id": "A0C4F770B67611DF820F00166F1163D4", "kind": "pozitiv", "description": "Pohled na dům čp. 90 na nároží ulic Lužické (dnes U Lužického semináře) a Míšeňské (vpravo) na Malé Straně.", "date_label": "25.9.1907", "start_date": "1907-09-25", "end_date": "1907-09-25", "author": "Klíma, Alois, Ing. (1873-1955)", "note": "", "views": "28x", "geolocation_type": "regional.address"}}, {"type": "Feature", "geometry": {"type": "Point", "coordinates": [14.42352, 50.08646]}, "properties": {"id": "A0C4F77AB67611DF820F00166F1163D4", "kind": "pozitiv", "description": "Celkový pohled na Karolinum s arkýřovou kaplí (dům čp. 541 na Starém Městě) na nároží Železné ulice (vlevo) a Ovocného trhu (vpravo).", "date_label": "kol.1905", "start_date": "1905-01-01", "end_date": "1905-12-31", "author": "", "note": "", "views": "38x", "geolocation_type": "regional.address"}}, {"type": "Feature", "geometry": {"type": "Point", "coordinates": [14.42329, 50.07379]}, "properties": {"id": "A0C4F798B67611DF820F00166F1163D4", "kind": "pozitiv", "description": "Celkový pohled na budovu Chemického ústavu bývalé Německé univerzity - dům čp. 478 na Novém Městě na nároží ulic U Nemocnice a Lípové.", "date_label": "kol.1890", "start_date": "1890-01-01", "end_date": "1890-12-31", "author": "", "note": "", "views": "48x", "geolocation_type": "regional.address"}}, {"type": "Feature", "geometry": {"type": "Point", "coordinates": [14.40131, 50.08733]}, "properties": {"id": "A0C4F79AB67611DF820F00166F1163D4", "kind": "pozitiv", "description": "Pohled na hlavní průčelí Schönbornského paláce (dům čp. 365) v ulici Tržiště na Malé Straně.", "date_label": "9.8.1907", "start_date": "1907-08-09", "end_date": "1907-08-09", "author": "Klíma, Alois, Ing. (1873-1955)", "note": "", "views": "42x", "geolocation_type": "regional.address"}}, {"type": "Feature", "geometry": {"type": "Point", "coordinates": [14.43056, 50.07918]}, "properties": {"id": "A0C4F7A2B67611DF820F00166F1163D4", "kind": "negativ", "description": "Pohled do interiéru Národního muzea (dům čp. 1700 na Novém Městě) - výstavní sál s exponáty (zoologie).", "date_label": "20.11.1902", "start_date": "1902-11-20", "end_date": "1902-11-20", "author": "Eckert, Jindřich (1833-1905)", "note": "", "views": "39x", "geolocation_type": "regional.address"}}, {"type": "Feature", "geometry": {"type": "Point", "coordinates": [14.41925, 50.06214]}, "properties": {"id": "A0C4F7BAB67611DF820F00166F1163D4", "kind": "negativ", "description": "Celkový pohled na sanatorium (dům čp. 157 v Podolí) na Podolském nábřeží. V pozadí vlevo věže kostela sv. Petra a Pavla na Vyšehradě, v popředí zelinářská zahrada, vlevo silnice na nábřeží.", "date_label": "kol.1915", "start_date": "1915-01-01", "end_date": "1915-12-31", "author": "", "note": "", "views": "69x", "geolocation_type": "regional.address"}}, {"type": "Feature", "geometry": {"type": "Point", "coordinates": [14.43697, 50.07606]}, "properties": {"id": "A0C4F7BDB67611DF820F00166F1163D4", "kind": "pozitiv", "description": "Pohled na budovu Městského divadla na náměstí Míru na Královských Vinohradech (dům čp. 1450) - (reprodukce nákresu arch. Aloise Čenského z roku 1904)", "date_label": "kol.1905", "start_date": "1905-01-01", "end_date": "1905-12-31", "author": "", "note": "", "views": "44x", "geolocation_type": "regional.address"}}, {"type": "Feature", "geometry": {"type": "Point", "coordinates": [14.44424, 50.07068]}, "properties": {"id": "A0C4F7BFB67611DF820F00166F1163D4", "kind": "pozitiv", "description": "Pohled na část domu čp. 59b (vinné sklepy) na Vinohradech.", "date_label": "1940-1945", "start_date": "1940-01-01", "end_date": "1945-12-31", "author": "", "note": "", "views": "36x", "geolocation_type": "regional.address"}}, {"type": "Feature", "geometry": {"type": "Point", "coordinates": [14.42363, 50.085]}, "properties": {"id": "A0C4F7C8B67611DF820F00166F1163D4", "kind": "pozitiv", "description": "Pohled na spodní část domu čp. 401 v Rytířské ulici na Starém Městě (obchodní dům \"Wolf a Schleim\").", "date_label": "", "start_date": "", "end_date": "", "author": "Bruner-Dvořák, Rudolf (1864-1921)", "note": "", "views": "37x", "geolocation_type": "regional.address"}}, {"type": "Feature", "geometry": {"type": "Point", "coordinates": [14.44316, 50.07522]}, "properties": {"id": "A0C4F7D0B67611DF820F00166F1163D4", "kind": "negativ", "description": "Pohled na průčelí domů čp. 1031 a 1058 v Korunní ulici na Vinohradech.", "date_label": "29.7.-3.9.1906", "start_date": "", "end_date": "", "author": "Eckert-ateliér", "note": "", "views": "48x", "geolocation_type": "regional.address"}}, {"type": "Feature", "geometry": {"type": "Point", "coordinates": [14.36851, 50.07335]}, "properties": {"id": "A0C4F7D2B67611DF820F00166F1163D4", "kind": "pozitiv", "description": "Pohled na dům čp. 120 (\"Skalka\") na Smíchově.", "date_label": "1958", "start_date": "1958-01-01", "end_date": "1958-12-31", "author": "", "note": "", "views": "51x", "geolocation_type": "regional.address"}}, {"type": "Feature", "geometry": {"type": "Point", "coordinates": [14.4062, 50.09097]}, "properties": {"id": "A0C4F7E1B67611DF820F00166F1163D4", "kind": "pozitiv", "description": "Pohled do Malé Fürstenberské zahrady na Malé Straně s pavilonem a s terasami.", "date_label": "kol.1900", "start_date": "1900-01-01", "end_date": "1900-12-31", "author": "Eckert, Jindřich (1833-1905)", "note": "", "views": "26x", "geolocation_type": "regional.address"}}, {"type": "Feature", "geometry": {"type": "Point", "coordinates": [14.41164, 50.09047]}, "properties": {"id": "A0C4F802B67611DF820F00166F1163D4", "kind": "pozitiv", "description": "Pohled na Strakovo nábřeží s domem čp. 554 na Malé Straně (původně domek výběrčího mýta na Železné lávce) a s částí Vojenské plovárny. V pozadí dům čp. 127 a část domu čp. 128 (Strakova akademie) na Malé Straně.", "date_label": "1929", "start_date": "1929-01-01", "end_date": "1929-12-31", "author": "Gubčevský, A.", "note": "", "views": "40x", "geolocation_type": "regional.address"}}, {"type": "Feature", "geometry": {"type": "Point", "coordinates": [14.65102, 50.17658]}, "properties": {"id": "A0C4F806B67611DF820F00166F1163D4", "kind": "pozitiv", "description": "Celkový pohled na hotel Paříž (dům čp. 1080) od křižovatky ulic Rybné, Králodvorské a U obecního domu na Starém Městě.", "date_label": "1939-1945", "start_date": "1939-01-01", "end_date": "1945-12-31", "author": "", "note": "", "views": "25x", "geolocation_type": "regional.address"}}, {"type": "Feature", "geometry": {"type": "Point", "coordinates": [14.40506, 50.0789]}, "properties": {"id": "A0C4F80BB67611DF820F00166F1163D4", "kind": "pozitiv", "description": "Celkový pohled na Medvědí kašnu před Albrechtskými kasárnami (Štefánikova - původně dům čp. 416 na Malé Straně, dnes dům čp. 234 na Smíchově) na dnešním náměstí Kinských.", "date_label": "1912", "start_date": "1912-01-01", "end_date": "1912-12-31", "author": "Fink, František (1854-1935)", "note": "", "views": "75x", "geolocation_type": "regional.address"}}, {"type": "Feature", "geometry": {"type": "Point", "coordinates": [14.40535, 50.09003]}, "properties": {"id": "A0C4F80FB67611DF820F00166F1163D4", "kind": "negativ", "description": "Pohled do zahrady Valdštejnského paláce s grottou a voliérou (dům čp. 17 na Malé Straně).", "date_label": "", "start_date": "", "end_date": "", "author": "Eckert-ateliér", "note": "", "views": "23x", "geolocation_type": "regional.address"}}, {"type": "Feature", "geometry": {"type": "Point", "coordinates": [14.4202, 50.08848]}, "properties": {"id": "A0C4F820B67611DF820F00166F1163D4", "kind": "negativ", "description": "Pohled na část průčelí Krenova domu čp. 936 na Staroměstském náměstí krátce před zbořením.", "date_label": "1901", "start_date": "1901-01-01", "end_date": "1901-12-31", "author": "Eckert, Jindřich (1833-1905)", "note": "", "views": "26x", "geolocation_type": "regional.address"}}, {"type": "Feature", "geometry": {"type": "Point", "coordinates": [14.43554, 50.09229]}, "properties": {"id": "A0C4F826B67611DF820F00166F1163D4", "kind": "pozitiv", "description": "Pohled na dům čp. 1220 na Novém Městě (Helmův - Kubešův mlýn) na nábřeží Nového Města. Vpravo dům čp. 1219 na nároží ulic Klimentské a Půtovy.", "date_label": "19.7.1909", "start_date": "1909-07-19", "end_date": "1909-07-19", "author": "Eckert-ateliér", "note": "", "views": "51x", "geolocation_type": "regional.address"}}, {"type": "Feature", "geometry": {"type": "Point", "coordinates": [14.4202, 50.08848]}, "properties": {"id": "A0C4F82CB67611DF820F00166F1163D4", "kind": "negativ", "description": "Pohled na štukovou výzdobu okna Krenova domu čp. 936 na Staroměstském náměstí při bourání.", "date_label": "1901", "start_date": "1901-01-01", "end_date": "1901-12-31", "author": "Eckert, Jindřich (1833-1905)", "note": "", "views": "24x", "geolocation_type": "regional.address"}}, {"type": "Feature", "geometry": {"type": "Point", "coordinates": [14.42091, 50.08566]}, "properties": {"id": "A0C4F83FB67611DF820F00166F1163D4", "kind": "pozitiv", "description": "Celkový pohled na Melantrichův dům (čp. 471 na Starém Městě - \"U Dvou velbloudů\") v Sirkové ulici (Melantrichova).", "date_label": "kol.1890", "start_date": "1890-01-01", "end_date": "1890-12-31", "author": "Eckert, Jindřich (1833-1905)", "note": "", "views": "39x", "geolocation_type": "regional.address"}}, {"type": "Feature", "geometry": {"type": "Point", "coordinates": [14.42009, 50.087]}, "properties": {"id": "A0C4F851B67611DF820F00166F1163D4", "kind": "pozitiv", "description": "Pohled na jihozápadní stranu Staroměstského náměstí s mariánským sloupem, radniční věží a domy na jižní straně náměstí kolem ústí Melantrichovy ulice.", "date_label": "16.6.1900", "start_date": "1900-06-16", "end_date": "1900-06-16", "author": "Eckert, Jindřich (1833-1905)", "note": "", "views": "58x", "geolocation_type": "regional.address"}}, {"type": "Feature", "geometry": {"type": "Point", "coordinates": [14.41925, 50.06214]}, "properties": {"id": "A0C4F854B67611DF820F00166F1163D4", "kind": "negativ", "description": "Pohled na sanatorium (dům čp. 157 v Podolí) na Podolském nábřeží. Vpravo v pozadí věže kostela sv. Petra a Pavla na Vyšehradě.", "date_label": "kol.1915", "start_date": "1915-01-01", "end_date": "1915-12-31", "author": "", "note": "", "views": "68x", "geolocation_type": "regional.address"}}, {"type": "Feature", "geometry": {"type": "Point", "coordinates": [14.41783, 50.08711]}, "properties": {"id": "A0C4F857B67611DF820F00166F1163D4", "kind": "pozitiv", "description": "Pohled na odstraňování Šalounovy sochy rabbiho Löwa z nároží budovy Magistrátu hlavního města Prahy (dům čp. 2) na Mariánském náměstí na Starém Městě.", "date_label": "duben 1940", "start_date": "1940-04-01", "end_date": "1940-04-30", "author": "Alexander, Antonín (1892-působnost do 1948)", "note": "", "views": "72x", "geolocation_type": "regional.address"}}, {"type": "Feature", "geometry": {"type": "Point", "coordinates": [14.4253, 50.0905]}, "properties": {"id": "A0C4F85CB67611DF820F00166F1163D4", "kind": "pozitiv", "description": "Pohled na vstupní portál domu čp. 733 (\"U opic\") se sochou Immaculaty v Dlouhé ulici na Starém Městě.", "date_label": "26.4.1906", "start_date": "1906-04-26", "end_date": "1906-04-26", "author": "", "note": "", "views": "18x", "geolocation_type": "regional.address"}}, {"type": "Feature", "geometry": {"type": "Point", "coordinates": [14.47608, 50.10575]}, "properties": {"id": "A0C4F860B67611DF820F00166F1163D4", "kind": "pozitiv", "description": "Průhled ulicí Na hrázi v Libni. Vpravo dům čp. 276. Vlevo dům 326/24, kde bydlel Bohumil Hrabal.", "date_label": "1973", "start_date": "1973-01-01", "end_date": "1973-12-31", "author": "Michálek, Ladislav", "note": "", "views": "83x", "geolocation_type": "regional.address"}}, {"type": "Feature", "geometry": {"type": "Point", "coordinates": [14.60251, 50.02718]}, "properties": {"id": "A0C4F863B67611DF820F00166F1163D4", "kind": "pozitiv", "description": "Celkový pohled na kostel sv. Mikuláše na Staroměstském náměstí z ochozu kostela P. Marie před Týnem. Vlevo dům čp. 19, vpravo dům čp. 934 na Starém Městě. V pozadí Pražský hrad.", "date_label": "23.5.1913", "start_date": "1913-05-23", "end_date": "1913-05-23", "author": "Kříženecký, Jan (1868-1921)", "note": "", "views": "68x", "geolocation_type": "regional.address"}}, {"type": "Feature", "geometry": {"type": "Point", "coordinates": [14.40389, 50.07594]}, "properties": {"id": "A0C4F865B67611DF820F00166F1163D4", "kind": "negativ", "description": "Celkový pohled na dům čp. 339 na Smíchově (Občanská záložna).", "date_label": "kol.1895", "start_date": "1895-01-01", "end_date": "1895-12-31", "author": "Eckert, Jindřich (1833-1905)", "note": "", "views": "51x", "geolocation_type": "regional.address"}}, {"type": "Feature", "geometry": {"type": "Point", "coordinates": [14.38547, 50.07583]}, "properties": {"id": "A0C4F86DB67611DF820F00166F1163D4", "kind": "pozitiv", "description": "Pohled část hlavního průčelí budovy Ústavu pro zaopatřování slepců (Dolní Palata) - dům čp. 737 na Smíchově.", "date_label": "kol.1950", "start_date": "1950-01-01", "end_date": "1950-12-31", "author": "Pacovský, Jaroslav", "note": "", "views": "65x", "geolocation_type": "regional.address"}}, {"type": "Feature", "geometry": {"type": "Point", "coordinates": [14.4168, 50.08091]}, "properties": {"id": "A0C4F877B67611DF820F00166F1163D4", "kind": "pozitiv", "description": "Pohled na vstupní portál domu čp. 130 (palác Deymův) ve Voršilské ulici na Novém Městě.", "date_label": "4.5.1906", "start_date": "1906-05-04", "end_date": "1906-05-04", "author": "", "note": "", "views": "21x", "geolocation_type": "regional.address"}}, {"type": "Feature", "geometry": {"type": "Point", "coordinates": [14.52677, 50.04957]}, "properties": {"id": "A0C4F879B67611DF820F00166F1163D4", "kind": "pozitiv", "description": "Pohled na severovýchodní (uliční) průčelí domu čp. 19 v Havlíčkově ulici v Hostivaři.", "date_label": "5.7.1930", "start_date": "1930-07-05", "end_date": "1930-07-05", "author": "Alexander, Antonín (1892-působnost do 1948)", "note": "", "views": "50x", "geolocation_type": "regional.address"}}, {"type": "Feature", "geometry": {"type": "Point", "coordinates": [14.40491, 50.08866]}, "properties": {"id": "A0C4F87CB67611DF820F00166F1163D4", "kind": "pozitiv", "description": "Pohled na jihovýchodní stranu Malostranského náměstí s domy čp. 518 a 27 na Malé Straně. V pozadí část kostela sv. Tomáše s věží.", "date_label": "24.7.1910", "start_date": "1910-07-24", "end_date": "1910-07-24", "author": "Kříženecký, Jan (1868-1921)", "note": "", "views": "57x", "geolocation_type": "regional.address"}}, {"type": "Feature", "geometry": {"type": "Point", "coordinates": [14.40425, 50.09022]}, "properties": {"id": "A0C4F87FB67611DF820F00166F1163D4", "kind": "negativ", "description": "Pohled do Sněmovní ulice (Pětikostelní náměstí) s domy zprava čp. 164, 165 na Malé Straně. V pozadí Pražský hrad.", "date_label": "4.5.1902", "start_date": "1902-05-04", "end_date": "1902-05-04", "author": "Eckert, Jindřich (1833-1905)", "note": "", "views": "28x", "geolocation_type": "regional.address"}}, {"type": "Feature", "geometry": {"type": "Point", "coordinates": [14.4247, 50.08373]}, "properties": {"id": "A0C4F881B67611DF820F00166F1163D4", "kind": "pozitiv", "description": "Pohled na vstupní portál bývalého domu čp. 840 (\"U zlatého beránka\") na Václavském náměstí na Novém Městě.", "date_label": "1912", "start_date": "1912-01-01", "end_date": "1912-12-31", "author": "", "note": "", "views": "33x", "geolocation_type": "regional.address"}}, {"type": "Feature", "geometry": {"type": "Point", "coordinates": [14.3971, 50.10084]}, "properties": {"id": "A0C4F884B67611DF820F00166F1163D4", "kind": "negativ", "description": "Detail nároží ulice Československé armády a Vítězného náměstí v Dejvicích (dům čp. 828 / Bubeneč).", "date_label": "kol.1950", "start_date": "1950-01-01", "end_date": "1950-12-31", "author": "Chalupníček, Miroslav -, Chalupníčková, Věra (dokument 1941-1948)", "note": "", "views": "85x", "geolocation_type": "regional.address"}}, {"type": "Feature", "geometry": {"type": "Point", "coordinates": [14.41188, 50.09042]}, "properties": {"id": "A0C4F886B67611DF820F00166F1163D4", "kind": "pozitiv", "description": "Pohled na Železnou lávku směrem od Rudolfina při stavbě Mánesova mostu. Vpravo dům čp. 554 (domek výběrčího mýta na Železné lávce) na Malé Straně. V pozadí Pražský hrad.", "date_label": "23.10.1911", "start_date": "1911-10-23", "end_date": "1911-10-23", "author": "Kříženecký, Jan (1868-1921)", "note": "", "views": "50x", "geolocation_type": "regional.address"}}, {"type": "Feature", "geometry": {"type": "Point", "coordinates": [14.32008, 50.0925]}, "properties": {"id": "A0C4F888B67611DF820F00166F1163D4", "kind": "pozitiv", "description": "Pohled na portál domu čp. 503 na Karlově náměstí na Novém Městě.", "date_label": "19.5.1906", "start_date": "1906-05-19", "end_date": "1906-05-19", "author": "", "note": "", "views": "32x", "geolocation_type": "regional.address"}}, {"type": "Feature", "geometry": {"type": "Point", "coordinates": [14.39812, 50.08854]}, "properties": {"id": "A0C4F88DB67611DF820F00166F1163D4", "kind": "pozitiv", "description": "Pohled na vstupní portál domu čp. 222 (\"Judenfeidovský\") v Nerudově ulici na Malé Straně.", "date_label": "31.8.1906", "start_date": "1906-08-31", "end_date": "1906-08-31", "author": "", "note": "", "views": "24x", "geolocation_type": "regional.address"}}, {"type": "Feature", "geometry": {"type": "Point", "coordinates": [14.42832, 50.07865]}, "properties": {"id": "A0C4F88FB67611DF820F00166F1163D4", "kind": "pozitiv", "description": "Detail průčelí domu čp. 1362 na Novém Městě s portálem a deskou (P. J. Šafařík).", "date_label": "kol.1925", "start_date": "1925-01-01", "end_date": "1925-12-31", "author": "Vojta, Tomáš (1885-1934)", "note": "", "views": "615x", "geolocation_type": "regional.address"}}, {"type": "Feature", "geometry": {"type": "Point", "coordinates": [14.41783, 50.08711]}, "properties": {"id": "A0C4F892B67611DF820F00166F1163D4", "kind": "pozitiv", "description": "Pohled na novostavbu budovy Magistrátu hlavního města Prahy (dům čp. 2) na Starém Městě na Mariánském náměstí. Vlevo prázdné prostranství po zboření domů této části Platnéřské ulice. V pozadí část kostela sv. Mikuláše.", "date_label": "10.3.1913", "start_date": "1913-03-10", "end_date": "1913-03-10", "author": "Kříženecký, Jan (1868-1921)", "note": "", "views": "64x", "geolocation_type": "regional.address"}}, {"type": "Feature", "geometry": {"type": "Point", "coordinates": [14.42825, 50.08762]}, "properties": {"id": "A0C4F89BB67611DF820F00166F1163D4", "kind": "pozitiv", "description": "Pohled do Smetanovy síně Obecního domu při zahájení akce \"Listopad - měsíc československo-sovětského přátelství\" ÚNV hl.m.Prahy za předsednictví primátora V. Vacka 2.11.1951 (dům čp. 1090 na Starém Městě).", "date_label": "2.11.1951", "start_date": "1951-11-02", "end_date": "1951-11-02", "author": "", "note": "", "views": "45x", "geolocation_type": "regional.address"}}, {"type": "Feature", "geometry": {"type": "Point", "coordinates": [14.40643, 50.09055]}, "properties": {"id": "A0C4F89EB67611DF820F00166F1163D4", "kind": "negativ", "description": "Pohled do Valdštejnské ulice s domem čp. 154 (Kolovratský palác) na Malé Straně.", "date_label": "kol.1900", "start_date": "1900-01-01", "end_date": "1900-12-31", "author": "Eckert, Jindřich (1833-1905)", "note": "", "views": "17x", "geolocation_type": "regional.address"}}, {"type": "Feature", "geometry": {"type": "Point", "coordinates": [14.41948, 50.09233]}, "properties": {"id": "A0C4F8A1B67611DF820F00166F1163D4", "kind": "pozitiv", "description": "Pohled na severozápadní stranu Mariánského náměstí s domy čp. 190, 1040 (Klementinum), 99, 100, 103 (zleva) na Starém Městě.", "date_label": "", "start_date": "", "end_date": "", "author": "Eckert, Jindřich (1833-1905)", "note": "Eckert, Jindřich - Jelínková, Jana (repro)", "views": "155x", "geolocation_type": "regional.address"}}, {"type": "Feature", "geometry": {"type": "Point", "coordinates": [14.40277, 50.06864]}, "properties": {"id": "A0C4F8A4B67611DF820F00166F1163D4", "kind": "pozitiv", "description": "Pohled na hlavní budovu v areálu Pražské obecní plynárny (dům čp. 253 mezi ulicemi Ostrovského, Stroupežnického, Radlická a Za Ženskými domovy) na Smíchově.", "date_label": "kol.1930", "start_date": "1930-01-01", "end_date": "1930-12-31", "author": "Posselt, Jan", "note": "", "views": "102x", "geolocation_type": "regional.address"}}, {"type": "Feature", "geometry": {"type": "Point", "coordinates": [14.40535, 50.09003]}, "properties": {"id": "A0C4F8B2B67611DF820F00166F1163D4", "kind": "pozitiv", "description": "Pohled na část průčelí Valdštejnského paláce (dům čp. 17 na Malé Straně) do Valdštejnské ulice.", "date_label": "", "start_date": "", "end_date": "", "author": "", "note": "", "views": "15x", "geolocation_type": "regional.address"}}, {"type": "Feature", "geometry": {"type": "Point", "coordinates": [14.42491, 50.09733]}, "properties": {"id": "A0C4F8B9B67611DF820F00166F1163D4", "kind": "negativ", "description": "Pohled na dům čp. 1320 (Národní technické muzeum) v Holešovicích, v pozadí ulice Letohradská.", "date_label": "kol.1970", "start_date": "1970-01-01", "end_date": "1970-12-31", "author": "Chalupníček, Miroslav -, Chalupníčková, Věra (dokument 1941-1948)", "note": "", "views": "40x", "geolocation_type": "regional.address"}}, {"type": "Feature", "geometry": {"type": "Point", "coordinates": [14.38729, 50.08789]}, "properties": {"id": "A0C4F8BAB67611DF820F00166F1163D4", "kind": "pozitiv", "description": "Pohled na pamětní desku na zbytky domu, kde bydlel a zemřel Tycho de Brahe v novostavbě domu čp. 118 na Hradčanech (škola).", "date_label": "8.4.1933", "start_date": "1933-04-08", "end_date": "1933-04-08", "author": "Vojta, Tomáš (1885-1934)", "note": "", "views": "27x", "geolocation_type": "regional.address"}}, {"type": "Feature", "geometry": {"type": "Point", "coordinates": [14.42135, 50.08837]}, "properties": {"id": "A0C4F8BCB67611DF820F00166F1163D4", "kind": "pozitiv", "description": "Pohled část domů čp. 932 (Pohřební ústav hlav. města Prahy) a čp. 930 (První pomoc - Záchranná stanice) na Staroměstském náměstí.", "date_label": "kol.1920", "start_date": "1920-01-01", "end_date": "1920-12-31", "author": "", "note": "", "views": "73x", "geolocation_type": "regional.address"}}, {"type": "Feature", "geometry": {"type": "Point", "coordinates": [14.40131, 50.08733]}, "properties": {"id": "A0C4F8BFB67611DF820F00166F1163D4", "kind": "pozitiv", "description": "Pohled na vstupní portál domu čp. 365 (\"palác Schönbornský\") v ulici Tržiště na Malé Straně.", "date_label": "31.5.1906", "start_date": "1906-05-31", "end_date": "1906-05-31", "author": "", "note": "", "views": "24x", "geolocation_type": "regional.address"}}, {"type": "Feature", "geometry": {"type": "Point", "coordinates": [14.41652, 50.08266]}, "properties": {"id": "A0C4F8C0B67611DF820F00166F1163D4", "kind": "pozitiv", "description": "Pohled na průčelí domu čp. 306 na Starém Městě v Bartolomějské ulici.", "date_label": "7.11.1927", "start_date": "1927-11-07", "end_date": "1927-11-07", "author": "Alexander, Antonín (1892-působnost do 1948)", "note": "", "views": "35x", "geolocation_type": "regional.address"}}, {"type": "Feature", "geometry": {"type": "Point", "coordinates": [14.40131, 50.08849]}, "properties": {"id": "A0C4F8C7B67611DF820F00166F1163D4", "kind": "pozitiv", "description": "Pohled na vstupní portál domu čp. 257 (\"U kominíčka\") v Nerudově ulici na Malé Straně.", "date_label": "3.8.1907", "start_date": "1907-08-03", "end_date": "1907-08-03", "author": "", "note": "", "views": "21x", "geolocation_type": "regional.address"}}, {"type": "Feature", "geometry": {"type": "Point", "coordinates": [14.42481, 50.08808]}, "properties": {"id": "A0C4F8E3B67611DF820F00166F1163D4", "kind": "pozitiv", "description": "Pohled do dvora domu čp. 647 (\"U Štupartů\") na nároží ulic Štupartské a Jakubské na Starém Městě.", "date_label": "", "start_date": "", "end_date": "", "author": "Štenc-ateliér", "note": "", "views": "14x", "geolocation_type": "regional.address"}}, {"type": "Feature", "geometry": {"type": "Point", "coordinates": [14.41701, 50.08534]}, "properties": {"id": "A0C4F8E4B67611DF820F00166F1163D4", "kind": "pozitiv", "description": "Pohled do spodního prostoru domu pánů z Kunštátu a Poděbrad - čp. 222 v Řetězové ulici na Staré Městě.", "date_label": "", "start_date": "", "end_date": "", "author": "", "note": "", "views": "20x", "geolocation_type": "regional.address"}}, {"type": "Feature", "geometry": {"type": "Point", "coordinates": [14.41528, 50.07429]}, "properties": {"id": "A0C4F8E5B67611DF820F00166F1163D4", "kind": "negativ", "description": "Pohled do Podskalské ulice s domem čp. 336 na Novém Městě před zbořením v letech 1906-1908.", "date_label": "1899", "start_date": "1899-01-01", "end_date": "1899-12-31", "author": "Eckert, Jindřich (1833-1905)", "note": "", "views": "37x", "geolocation_type": "regional.address"}}, {"type": "Feature", "geometry": {"type": "Point", "coordinates": [14.35655, 50.06696]}, "properties": {"id": "A0C4F8ECB67611DF820F00166F1163D4", "kind": "negativ", "description": "Pohled na usedlost Cibulka (dům čp. 118) v Košířích, záběr na vstupní bránu.", "date_label": "1974", "start_date": "1974-01-01", "end_date": "1974-12-31", "author": "Chalupníček, Miroslav -, Chalupníčková, Věra (dokument 1941-1948)", "note": "", "views": "53x", "geolocation_type": "regional.address"}}, {"type": "Feature", "geometry": {"type": "Point", "coordinates": [14.39762, 50.0876]}, "properties": {"id": "A0C4F8EDB67611DF820F00166F1163D4", "kind": "pozitiv", "description": "Pohled na portál domu čp. 335 (\"Vlašský špitál\") ve Vlašské ulici na Malé Straně.", "date_label": "19.5.1906", "start_date": "1906-05-19", "end_date": "1906-05-19", "author": "", "note": "", "views": "22x", "geolocation_type": "regional.address"}}, {"type": "Feature", "geometry": {"type": "Point", "coordinates": [14.40365, 50.08922]}, "properties": {"id": "A0C4F8FEB67611DF820F00166F1163D4", "kind": "pozitiv", "description": "Celkový pohled na dům čp. 177 (fara) na nároží ulic Sněmovní a Thunovské (vlevo) na Malé Straně.", "date_label": "", "start_date": "", "end_date": "", "author": "Vojta, Tomáš (1885-1934)", "note": "", "views": "35x", "geolocation_type": "regional.address"}}, {"type": "Feature", "geometry": {"type": "Point", "coordinates": [14.42225, 50.08197]}, "properties": {"id": "A0C4F8FFB67611DF820F00166F1163D4", "kind": "pozitiv", "description": "Neuskutečněný projekt (se zachováním pozdně barokního paláce) P. Janáka na přestavbu domů čp. 35 a 41 na Novém Městě.", "date_label": "kol.1925", "start_date": "1925-01-01", "end_date": "1925-12-31", "author": "", "note": "", "views": "106x", "geolocation_type": "regional.address"}}, {"type": "Feature", "geometry": {"type": "Point", "coordinates": [14.52378, 50.05098]}, "properties": {"id": "A0C4F902B67611DF820F00166F1163D4", "kind": "pozitiv", "description": "Pohled na dům čp. 10 v Pražské ulici v Hostivaři.", "date_label": "1970", "start_date": "1970-01-01", "end_date": "1970-12-31", "author": "Vopravil, Josef (1902-1972)", "note": "", "views": "39x", "geolocation_type": "regional.address"}}, {"type": "Feature", "geometry": {"type": "Point", "coordinates": [14.40284, 50.08938]}, "properties": {"id": "A0C4F90FB67611DF820F00166F1163D4", "kind": "negativ", "description": "Pohled na Pražský hrad z okna Thunovského paláce (dům čp. 180) na Malé Straně. V popředí palácová zahrada.", "date_label": "30.3.1907", "start_date": "1907-03-30", "end_date": "1907-03-30", "author": "Eckert-ateliér", "note": "", "views": "52x", "geolocation_type": "regional.address"}}, {"type": "Feature", "geometry": {"type": "Point", "coordinates": [14.41506, 50.07472]}, "properties": {"id": "A0C4F910B67611DF820F00166F1163D4", "kind": "negativ", "description": "Pohled z výšky na dům čp. 334 (\"U Císařských\") v Podskalské ulici na Novém Městě.", "date_label": "21.11.1908", "start_date": "1908-11-21", "end_date": "1908-11-21", "author": "Eckert-ateliér", "note": "", "views": "31x", "geolocation_type": "regional.address"}}, {"type": "Feature", "geometry": {"type": "Point", "coordinates": [14.35655, 50.06696]}, "properties": {"id": "A0C4F913B67611DF820F00166F1163D4", "kind": "negativ", "description": "Pohled na usedlost Cibulka (dům čp. 118) v Košířích, záběr na dvůr se zvonicí.", "date_label": "1974", "start_date": "1974-01-01", "end_date": "1974-12-31", "author": "Chalupníček, Miroslav -, Chalupníčková, Věra (dokument 1941-1948)", "note": "", "views": "55x", "geolocation_type": "regional.address"}}, {"type": "Feature", "geometry": {"type": "Point", "coordinates": [14.57249, 50.12628]}, "properties": {"id": "A0C4F914B67611DF820F00166F1163D4", "kind": "pozitiv", "description": "Průhled ulicí Pod Poštou s domem čp. 91 (vlevo) v Satalicích.", "date_label": "1977", "start_date": "1977-01-01", "end_date": "1977-12-31", "author": "Hudeček, Jan", "note": "", "views": "50x", "geolocation_type": "regional.address"}}, {"type": "Feature", "geometry": {"type": "Point", "coordinates": [14.41521, 50.09017]}, "properties": {"id": "A0C4F92EB67611DF820F00166F1163D4", "kind": "negativ", "description": "Pohled z Karlova mostu na Kampu a Železnou lávku. V pozadí Letná, vpravo Alšovo nábřeží s Rudolfinem.", "date_label": "kol.1900", "start_date": "1900-01-01", "end_date": "1900-12-31", "author": "Eckert, Jindřich (1833-1905)", "note": "", "views": "41x", "geolocation_type": "regional.address"}}, {"type": "Feature", "geometry": {"type": "Point", "coordinates": [14.39071, 50.08877]}, "properties": {"id": "A0C4F939B67611DF820F00166F1163D4", "kind": "negativ", "description": "Reprodukce skicy nástěnné malby (č. 13) v interiéru Černínského paláce (dům čp. 101 na Hradčanech).", "date_label": "1891", "start_date": "1891-01-01", "end_date": "1891-12-31", "author": "Eckert, Jindřich (1833-1905)", "note": "", "views": "26x", "geolocation_type": "regional.address"}}, {"type": "Feature", "geometry": {"type": "Point", "coordinates": [14.41325, 50.08204]}, "properties": {"id": "A0C4F941B67611DF820F00166F1163D4", "kind": "negativ", "description": "Pohled z mostu Legií na Masarykovo nábřeží, v popředí domy čp. 334 a čp. 995 na Starém Městě.", "date_label": "kol.1977", "start_date": "1977-01-01", "end_date": "1977-12-31", "author": "Chalupníček, Miroslav -, Chalupníčková, Věra (dokument 1941-1948)", "note": "", "views": "27x", "geolocation_type": "regional.address"}}, {"type": "Feature", "geometry": {"type": "Point", "coordinates": [14.42504, 50.09208]}, "properties": {"id": "A0C4F94DB67611DF820F00166F1163D4", "kind": "pozitiv", "description": "Pohled do ulice Řásnovka s domem čp. 779 (uprostřed) a kostelem sv. Salvátora (vpravo). Zcela vpravo část čp. 1039 na Starém Městě.", "date_label": "30.3.1940", "start_date": "1940-03-30", "end_date": "1940-03-30", "author": "Alexander, Antonín (1892-působnost do 1948)", "note": "", "views": "64x", "geolocation_type": "regional.address"}}, {"type": "Feature", "geometry": {"type": "Point", "coordinates": [14.40477, 50.08832]}, "properties": {"id": "A0C4F95AB67611DF820F00166F1163D4", "kind": "negativ", "description": "Pohled na severovýchodní stranu Malostranského náměstí s ústím Letenské a Tomášské ulice. Zleva domy s podloubím čp. 7 a čp. 518, vpravo malostranská radnice (dům čp. 35 na Malé Straně). Uprostřed v pozadí kostel sv. Tomáše.", "date_label": "1905", "start_date": "1905-01-01", "end_date": "1905-12-31", "author": "Eckert-ateliér", "note": "", "views": "60x", "geolocation_type": "regional.address"}}, {"type": "Feature", "geometry": {"type": "Point", "coordinates": [14.41321, 50.08173]}, "properties": {"id": "A0C4F960B67611DF820F00166F1163D4", "kind": "negativ", "description": "Pohled přes Vltavu na Národní divadlo (dům čp. 223 na Novém Městě) s mostem Legií. Vlevo na Smetanově nábřeží část domu čp. 1012 na Starém Městě.", "date_label": "27.3.1904", "start_date": "1904-03-27", "end_date": "1904-03-27", "author": "Eckert, Jindřich (1833-1905)", "note": "", "views": "51x", "geolocation_type": "regional.address"}}, {"type": "Feature", "geometry": {"type": "Point", "coordinates": [14.40477, 50.08832]}, "properties": {"id": "A0C4F964B67611DF820F00166F1163D4", "kind": "negativ", "description": "Pohled na východní stranu Malostranského náměstí s malostranskou radnicí (dům čp. 35) a domy čp. 36, čp. 37, čp. 38 na Malé Straně. Vlevo pohled do Letenské ulice.", "date_label": "1893", "start_date": "1893-01-01", "end_date": "1893-12-31", "author": "Eckert, Jindřich (1833-1905)", "note": "", "views": "50x", "geolocation_type": "regional.address"}}, {"type": "Feature", "geometry": {"type": "Point", "coordinates": [14.41987, 50.10017]}, "properties": {"id": "A0C4F970B67611DF820F00166F1163D4", "kind": "pozitiv", "description": "Pohled na Letenskou vodárenskou věž (dům čp. 1000 v Bubenči) z ulice Na výšinách.", "date_label": "3.4.1934", "start_date": "1934-04-03", "end_date": "1934-04-03", "author": "Alexander, Antonín (1892-působnost do 1948)", "note": "", "views": "121x", "geolocation_type": "regional.address"}}, {"type": "Feature", "geometry": {"type": "Point", "coordinates": [14.42168, 50.08832]}, "properties": {"id": "A0C4F971B67611DF820F00166F1163D4", "kind": "negativ", "description": "Pohled na severovýchodní stranu Staroměstského náměstí s domy čp. 608 a 609 na Starém Městě před zbořením roku 1905.", "date_label": "1902", "start_date": "1902-01-01", "end_date": "1902-12-31", "author": "Eckert, Jindřich (1833-1905)", "note": "", "views": "22x", "geolocation_type": "regional.address"}}, {"type": "Feature", "geometry": {"type": "Point", "coordinates": [14.42352, 50.08646]}, "properties": {"id": "A0C4F991B67611DF820F00166F1163D4", "kind": "pozitiv", "description": "Pohled na jižní stranu Karolina s arkýřovou kaplí (dům čp. 541 na Starém Městě) na Ovocném trhu.", "date_label": "5.8.1927", "start_date": "1927-08-05", "end_date": "1927-08-05", "author": "Jelínková, Jana (1951-)", "note": "", "views": "44x", "geolocation_type": "regional.address"}}, {"type": "Feature", "geometry": {"type": "Point", "coordinates": [14.38505, 50.06972]}, "properties": {"id": "A0C4F996B67611DF820F00166F1163D4", "kind": "pozitiv", "description": "Pohled z prvního dvora na severní křídlo domu čp. 2 (pivovar) v Košířích.", "date_label": "4.2.1957", "start_date": "1957-02-04", "end_date": "1957-02-04", "author": "", "note": "", "views": "48x", "geolocation_type": "regional.address"}}, {"type": "Feature", "geometry": {"type": "Point", "coordinates": [14.40535, 50.09003]}, "properties": {"id": "A0C4F9A1B67611DF820F00166F1163D4", "kind": "pozitiv", "description": "Pohled do interiéru Valdštejnského paláce (dům čp. 17 na Malé Straně) - audienční síň.", "date_label": "", "start_date": "", "end_date": "", "author": "Eckert-ateliér", "note": "", "views": "17x", "geolocation_type": "regional.address"}}, {"type": "Feature", "geometry": {"type": "Point", "coordinates": [14.42156, 50.08709]}, "properties": {"id": "A0C4F9A7B67611DF820F00166F1163D4", "kind": "pozitiv", "description": "Pohled na jihovýchodní stranu Staroměstského náměstí s mariánským sloupem. Zleva domy čp. 604, 603, 552, 551, 550, 549 na Starém Městě.", "date_label": "červen 1902", "start_date": "1902-06-01", "end_date": "1902-06-30", "author": "Dvořák, František (dokumenty 1901-1908)", "note": "", "views": "53x", "geolocation_type": "regional.address"}}, {"type": "Feature", "geometry": {"type": "Point", "coordinates": [14.3937, 50.04296]}, "properties": {"id": "A0C4F9A8B67611DF820F00166F1163D4", "kind": "pozitiv", "description": "Pohled na dům čp. 25 a skálu v ulici Ke Hřbitovu v Hlubočepích.", "date_label": "21.5.1943", "start_date": "1943-05-21", "end_date": "1943-05-21", "author": "Alexander, Antonín (1892-působnost do 1948)", "note": "", "views": "71x", "geolocation_type": "regional.address"}}, {"type": "Feature", "geometry": {"type": "Point", "coordinates": [14.40038, 50.08859]}, "properties": {"id": "A0C4F9A9B67611DF820F00166F1163D4", "kind": "pozitiv", "description": "Pohled na portál domu čp. 214 (\"Thunovský palác\") v Nerudově ulici na Malé Straně.", "date_label": "26.7.1907", "start_date": "1907-07-26", "end_date": "1907-07-26", "author": "", "note": "", "views": "25x", "geolocation_type": "regional.address"}}, {"type": "Feature", "geometry": {"type": "Point", "coordinates": [14.41423, 50.08154]}, "properties": {"id": "A0C4F9BAB67611DF820F00166F1163D4", "kind": "negativ", "description": "Pohled z Národní třídy na palác Praha (dům čp. 1011 na Starém Městě) a budovu Akademie věd ČR (dům čp. 1009 na Starém Městě).", "date_label": "kol.1977", "start_date": "1977-01-01", "end_date": "1977-12-31", "author": "Chalupníček, Miroslav -, Chalupníčková, Věra (dokument 1941-1948)", "note": "", "views": "38x", "geolocation_type": "regional.address"}}, {"type": "Feature", "geometry": {"type": "Point", "coordinates": [14.46582, 50.11682]}, "properties": {"id": "A0C4F9BEB67611DF820F00166F1163D4", "kind": "pozitiv", "description": "Chovanci z vychovatelny v Libni (dům čp. 830) při cvičení na zahradě.", "date_label": "15.4.1910", "start_date": "1910-04-15", "end_date": "1910-04-15", "author": "Kříženecký, Jan (1868-1921)", "note": "", "views": "78x", "geolocation_type": "regional.address"}}, {"type": "Feature", "geometry": {"type": "Point", "coordinates": [14.42233, 50.08309]}, "properties": {"id": "A0C4F9C3B67611DF820F00166F1163D4", "kind": "pozitiv", "description": "Průhled Národní třídou při oslavě 50. let zavedení koňky v Praze (1. jízda 23.9.1875). V pozadí dům čp. 761 na Novém Městě.", "date_label": "28.9.1925", "start_date": "1925-09-28", "end_date": "1925-09-28", "author": "", "note": "", "views": "143x", "geolocation_type": "regional.address"}}, {"type": "Feature", "geometry": {"type": "Point", "coordinates": [14.50051, 50.07516]}, "properties": {"id": "A0C4F9C4B67611DF820F00166F1163D4", "kind": "pozitiv", "description": "Pohled na budovu Patologicko-anatomického ústavu bývalé Německé univerzity - dům čp. 497 na Novém Městě.", "date_label": "kol.1900", "start_date": "1900-01-01", "end_date": "1900-12-31", "author": "", "note": "", "views": "39x", "geolocation_type": "regional.address"}}, {"type": "Feature", "geometry": {"type": "Point", "coordinates": [14.4198, 50.09012]}, "properties": {"id": "A0C4F9C5B67611DF820F00166F1163D4", "kind": "negativ", "description": "Pohled na průčelí domů čp. 12, 13 do Sanytrové ulice v Josefově krátce před zbořením.", "date_label": "23.4.1907", "start_date": "1907-04-23", "end_date": "1907-04-23", "author": "Eckert-ateliér", "note": "", "views": "44x", "geolocation_type": "regional.address"}}, {"type": "Feature", "geometry": {"type": "Point", "coordinates": [14.41925, 50.08848]}, "properties": {"id": "A0C4F9D1B67611DF820F00166F1163D4", "kind": "negativ", "description": "Pohled do interiéru domu čp. 27 na Starém Městě (prelatura kostela sv. Mikuláše).", "date_label": "kol.1895", "start_date": "1895-01-01", "end_date": "1895-12-31", "author": "Kříženecký, Rudolf (dokument 1897-1931)", "note": "", "views": "17x", "geolocation_type": "regional.address"}}, {"type": "Feature", "geometry": {"type": "Point", "coordinates": [14.41139, 50.09203]}, "properties": {"id": "A0C4F9DAB67611DF820F00166F1163D4", "kind": "negativ", "description": "Pohled na původní dům čp. 128 na Malé Straně \"letní dům Jezuitů\" v Jezuitské zahradě na Malé Straně při úpravě terénu pro stavbu Strakovy akademie. V pozadí břeh s Rudolfinem a panorama Starého Města.", "date_label": "kol.1893", "start_date": "1893-01-01", "end_date": "1893-12-31", "author": "Eckert, Jindřich (1833-1905)", "note": "", "views": "27x", "geolocation_type": "regional.address"}}, {"type": "Feature", "geometry": {"type": "Point", "coordinates": [14.43637, 50.10853]}, "properties": {"id": "A0C4F9ECB67611DF820F00166F1163D4", "kind": "negativ", "description": "Pohled na stavbu ústřední elektrárny v Holešovicích (dům čp. 1).", "date_label": "1899", "start_date": "1899-01-01", "end_date": "1899-12-31", "author": "Fischer?", "note": "", "views": "72x", "geolocation_type": "regional.address"}}, {"type": "Feature", "geometry": {"type": "Point", "coordinates": [14.41925, 50.08848]}, "properties": {"id": "A0C4F9EEB67611DF820F00166F1163D4", "kind": "negativ", "description": "Pohled do refektáře v 1. patře domu čp. 27 na Starém Městě (prelatura kostela sv. Mikuláše).", "date_label": "18.11.1897", "start_date": "1897-11-18", "end_date": "1897-11-18", "author": "Kříženecký, Rudolf (dokument 1897-1931)", "note": "", "views": "12x", "geolocation_type": "regional.address"}}, {"type": "Feature", "geometry": {"type": "Point", "coordinates": [14.42184, 50.08564]}, "properties": {"id": "A0C4F9FFB67611DF820F00166F1163D4", "kind": "pozitiv", "description": "Celkový pohled na dům čp. 500 na Starém Městě v Havelské ulici.", "date_label": "kol.1925", "start_date": "1925-01-01", "end_date": "1925-12-31", "author": "Pařík a spol.", "note": "", "views": "16x", "geolocation_type": "regional.address"}}, {"type": "Feature", "geometry": {"type": "Point", "coordinates": [14.43118, 50.08732]}, "properties": {"id": "A0C4FA18B67611DF820F00166F1163D4", "kind": "pozitiv", "description": "Pohled na portál domu čp. 1033 (Palác Losyů z Losinthalu, Kinských, Lidový dům) v Hybernské ulici na Novém Městě.", "date_label": "22.4.1909", "start_date": "1909-04-22", "end_date": "1909-04-22", "author": "", "note": "", "views": "31x", "geolocation_type": "regional.address"}}, {"type": "Feature", "geometry": {"type": "Point", "coordinates": [14.43637, 50.10853]}, "properties": {"id": "A0C4FA1BB67611DF820F00166F1163D4", "kind": "pozitiv", "description": "Pohled na stavbu ústřední elektrárny v Holešovicích (dům čp. 1) - interiér haly.", "date_label": "1899", "start_date": "1899-01-01", "end_date": "1899-12-31", "author": "Fischer?", "note": "", "views": "69x", "geolocation_type": "regional.address"}}, {"type": "Feature", "geometry": {"type": "Point", "coordinates": [14.41783, 50.08711]}, "properties": {"id": "A0C4FA34B67611DF820F00166F1163D4", "kind": "pozitiv", "description": "Generál Dwight David Eisenhower na návštěvě v Praze - přijetí Dr. Petrem Zenklem na pražské radnici11.10.1945. V pozadí JUDr. Ladislav Pičman (třetí osoba zleva), druhý náměstek primátora, a Rúžena Pelantová, čtvrtá náměstkyně primátora.", "date_label": "11.10.1945", "start_date": "1945-10-11", "end_date": "1945-10-11", "author": "", "note": "", "views": "70x", "geolocation_type": "regional.address"}}, {"type": "Feature", "geometry": {"type": "Point", "coordinates": [14.40471, 50.08788]}, "properties": {"id": "A0C4FA3DB67611DF820F00166F1163D4", "kind": "negativ", "description": "Pohled na bourání domu čp. 37 na Starém Městě mezi Kaprovou a Úzkou ulicí (Maiselova). Vpravo část Maiselovy synagogy.", "date_label": "27.5.1906", "start_date": "1906-05-27", "end_date": "1906-05-27", "author": "Eckert-ateliér", "note": "", "views": "60x", "geolocation_type": "regional.address"}}, {"type": "Feature", "geometry": {"type": "Point", "coordinates": [14.42481, 50.08808]}, "properties": {"id": "A0C4FA41B67611DF820F00166F1163D4", "kind": "negativ", "description": "Pohled do dvora domu čp. 647 (\"U Štupartů\") na nároží ulic Malé Štupartské a Jakubské (vlevo) na Starém Městě před zbořením.", "date_label": "16.3.1911", "start_date": "1911-03-16", "end_date": "1911-03-16", "author": "Eckert-ateliér", "note": "", "views": "20x", "geolocation_type": "regional.address"}}, {"type": "Feature", "geometry": {"type": "Point", "coordinates": [14.35655, 50.06696]}, "properties": {"id": "A0C4FA44B67611DF820F00166F1163D4", "kind": "negativ", "description": "Pohled na usedlost Cibulka (dům čp. 118) v Košířích, záběr na čínský pavilon.", "date_label": "1974", "start_date": "1974-01-01", "end_date": "1974-12-31", "author": "Chalupníček, Miroslav -, Chalupníčková, Věra (dokument 1941-1948)", "note": "", "views": "64x", "geolocation_type": "regional.address"}}, {"type": "Feature", "geometry": {"type": "Point", "coordinates": [14.39885, 50.08844]}, "properties": {"id": "A0C4FA59B67611DF820F00166F1163D4", "kind": "pozitiv", "description": "Pohled na vstupní portál domu čp. 243 (\"U zlatého klíče\") s domovním znamením v Nerudově ulici na Malé Straně.", "date_label": "30.8.1906", "start_date": "1906-08-30", "end_date": "1906-08-30", "author": "", "note": "", "views": "22x", "geolocation_type": "regional.address"}}, {"type": "Feature", "geometry": {"type": "Point", "coordinates": [14.41714, 50.08604]}, "properties": {"id": "A0C4FA5EB67611DF820F00166F1163D4", "kind": "pozitiv", "description": "Celkový pohled od Letné na most císaře Františka Josefa I. (Štefánikův). V pozadí Nové mlýny, dům čp. 170 na Starém Městě.", "date_label": "kol.1900", "start_date": "1900-01-01", "end_date": "1900-12-31", "author": "", "note": "", "views": "72x", "geolocation_type": "regional.address"}}, {"type": "Feature", "geometry": {"type": "Point", "coordinates": [14.42091, 50.08566]}, "properties": {"id": "A0C4FA61B67611DF820F00166F1163D4", "kind": "negativ", "description": "Pohled do dvora Melantrichova domu (čp. 471 na Starém Městě - \"U Dvou velbloudů\") - loggie.", "date_label": "kol.1890", "start_date": "1890-01-01", "end_date": "1890-12-31", "author": "Eckert, Jindřich (1833-1905)", "note": "", "views": "22x", "geolocation_type": "regional.address"}}, {"type": "Feature", "geometry": {"type": "Point", "coordinates": [14.40425, 50.09022]}, "properties": {"id": "A0C4FA65B67611DF820F00166F1163D4", "kind": "pozitiv", "description": "Pohled do Sněmovní ulice (Pětikostelní náměstí) s domy zprava čp. 164, 165 na Malé Straně. V pozadí Pražský hrad.", "date_label": "4.5.1902", "start_date": "1902-05-04", "end_date": "1902-05-04", "author": "Eckert, Jindřich (1833-1905)", "note": "", "views": "38x", "geolocation_type": "regional.address"}}, {"type": "Feature", "geometry": {"type": "Point", "coordinates": [14.4148, 50.08126]}, "properties": {"id": "A0C4FA93B67611DF820F00166F1163D4", "kind": "pozitiv", "description": "Pohled na novostavbu Nové scény Národního divadla (dům čp. 1393 na Novém Městě) a na Národní divadlo (dům čp. 223 na Novém Městě).", "date_label": "1984", "start_date": "1984-01-01", "end_date": "1984-12-31", "author": "Doležal, Michal", "note": "", "views": "52x", "geolocation_type": "regional.address"}}, {"type": "Feature", "geometry": {"type": "Point", "coordinates": [14.42377, 50.08981]}, "properties": {"id": "A0C4FA96B67611DF820F00166F1163D4", "kind": "negativ", "description": "Průhled Dlouhou ulicí. Vpravo dům čp. 706 na Starém Městě (pivovar U Celestýnů, \"U Kamenného orla\") při bourání.", "date_label": "1900", "start_date": "1900-01-01", "end_date": "1900-12-31", "author": "Eckert, Jindřich (1833-1905)", "note": "", "views": "38x", "geolocation_type": "regional.address"}}, {"type": "Feature", "geometry": {"type": "Point", "coordinates": [14.43637, 50.10853]}, "properties": {"id": "A0C4FA9DB67611DF820F00166F1163D4", "kind": "pozitiv", "description": "Pohled na stavbu ústřední elektrárny v Holešovicích (dům čp. 1).", "date_label": "1899", "start_date": "1899-01-01", "end_date": "1899-12-31", "author": "Fischer?", "note": "", "views": "67x", "geolocation_type": "regional.address"}}, {"type": "Feature", "geometry": {"type": "Point", "coordinates": [14.42334, 50.09144]}, "properties": {"id": "A0C4FAA0B67611DF820F00166F1163D4", "kind": "pozitiv", "description": "Pohled do dvora domu čp. 800 na Starém Městě (obecní dvůr).", "date_label": "", "start_date": "", "end_date": "", "author": "Pařík", "note": "", "views": "28x", "geolocation_type": "regional.address"}}, {"type": "Feature", "geometry": {"type": "Point", "coordinates": [14.41948, 50.09233]}, "properties": {"id": "A0C4FAA7B67611DF820F00166F1163D4", "kind": "negativ", "description": "Pohled na spodní část domu čp. 100 na Mariánském náměstí na Starém Městě při bourání.", "date_label": "10.11.1904", "start_date": "1904-11-10", "end_date": "1904-11-10", "author": "Eckert, Jindřich (1833-1905)", "note": "", "views": "26x", "geolocation_type": "regional.address"}}, {"type": "Feature", "geometry": {"type": "Point", "coordinates": [14.4189, 50.0826]}, "properties": {"id": "A0C4FAB1B67611DF820F00166F1163D4", "kind": "pozitiv", "description": "4 kresby patníků na Starém a Novém Městě. 1. patník u domu čp. 352 na Starém Městě. 2. patník u domu čp. 342 na Starém Městě. 3. patník v Husově ulici u kostela sv. Jiljí 4. patník u domu čp. 897 na Novém Městě.", "date_label": "kol.1900", "start_date": "1900-01-01", "end_date": "1900-12-31", "author": "", "note": "", "views": "26x", "geolocation_type": "regional.address"}}, {"type": "Feature", "geometry": {"type": "Point", "coordinates": [14.41347, 50.08126]}, "properties": {"id": "A0C4FABEB67611DF820F00166F1163D4", "kind": "pozitiv", "description": "Pohled z řetězového mostu Františka I. přes Vltavu na Národní divadlo (dům čp. 223 na Novém Městě).", "date_label": "kol.1895", "start_date": "1895-01-01", "end_date": "1895-12-31", "author": "", "note": "", "views": "75x", "geolocation_type": "regional.address"}}, {"type": "Feature", "geometry": {"type": "Point", "coordinates": [14.41497, 50.07885]}, "properties": {"id": "A0C4FAC4B67611DF820F00166F1163D4", "kind": "pozitiv", "description": "Pohled do interiéru domu čp. 216 (Obecná a měšťanská dívčí škola u sv. Vojtěcha) ve Vojtěšské ulici na Novém Městě - tělocvična.", "date_label": "5.6.1907", "start_date": "1907-06-05", "end_date": "1907-06-05", "author": "Kříženecký, Jan (1868-1921)", "note": "", "views": "33x", "geolocation_type": "regional.address"}}, {"type": "Feature", "geometry": {"type": "Point", "coordinates": [14.41521, 50.09017]}, "properties": {"id": "A0C4FAC6B67611DF820F00166F1163D4", "kind": "negativ", "description": "Celkový pohled na sloup veřejného osvětlení (pětiramenný plynový kandelábr) před Rudolfinem (dům čp. 79).", "date_label": "", "start_date": "", "end_date": "", "author": "", "note": "", "views": "38x", "geolocation_type": "regional.address"}}, {"type": "Feature", "geometry": {"type": "Point", "coordinates": [14.40178, 50.08868]}, "properties": {"id": "A0C4FAEEB67611DF820F00166F1163D4", "kind": "pozitiv", "description": "Pohled na vstupní portál domu čp. 206 (\"U zlaté kotvy\") v Nerudově ulici na Malé Straně.", "date_label": "23.8.1906", "start_date": "1906-08-23", "end_date": "1906-08-23", "author": "", "note": "", "views": "23x", "geolocation_type": "regional.address"}}, {"type": "Feature", "geometry": {"type": "Point", "coordinates": [14.42805, 50.07564]}, "properties": {"id": "A0C4FB02B67611DF820F00166F1163D4", "kind": "negativ", "description": "Pohled z Vojtěšské ulice do Šítkovské. Zleva domy čp. 246, 245, 244, 243 na Novém Městě před zbořením v letech 1903 - 1904.", "date_label": "23.6.1903", "start_date": "1903-06-23", "end_date": "1903-06-23", "author": "Eckert, Jindřich (1833-1905)", "note": "", "views": "32x", "geolocation_type": "regional.address"}}, {"type": "Feature", "geometry": {"type": "Point", "coordinates": [14.42369, 50.08722]}, "properties": {"id": "A0C4FB04B67611DF820F00166F1163D4", "kind": "kresba tužkou", "description": "Pohled na vstupní portál domu čp. 598 (\"Dům u zlatého jelena\") v Celetné ulici na Starém Městě.", "date_label": "kol.1900", "start_date": "1900-01-01", "end_date": "1900-12-31", "author": "", "note": "", "views": "16x", "geolocation_type": "regional.address"}}, {"type": "Feature", "geometry": {"type": "Point", "coordinates": [14.44293, 50.09871]}, "properties": {"id": "A0C4FB07B67611DF820F00166F1163D4", "kind": "pozitiv", "description": "Pohled na dům čp. 702 na nároží Bubenského nábřeží a Argentinské ulice v Holešovicích.", "date_label": "20.9.1935", "start_date": "1935-09-20", "end_date": "1935-09-20", "author": "Alexander, Antonín (1892-působnost do 1948)", "note": "", "views": "81x", "geolocation_type": "regional.address"}}, {"type": "Feature", "geometry": {"type": "Point", "coordinates": [14.42481, 50.08808]}, "properties": {"id": "A0C4FB3BB67611DF820F00166F1163D4", "kind": "pozitiv", "description": "Pohled na průčelí domu čp. 647 (\"U Štupartů\") na Starém Městě do Jakubské ulice.", "date_label": "", "start_date": "", "end_date": "", "author": "Štenc-ateliér", "note": "", "views": "18x", "geolocation_type": "regional.address"}}, {"type": "Feature", "geometry": {"type": "Point", "coordinates": [14.46141, 50.06774]}, "properties": {"id": "A0C4FB3EB67611DF820F00166F1163D4", "kind": "negativ", "description": "Panoramatický pohled na Vršovice ze stanoviště na Bohdalci, v popředí Vršovická ulice, budova Koh-i-nooru (dům čp. 478).", "date_label": "kol.1960", "start_date": "1960-01-01", "end_date": "1960-12-31", "author": "Chalupníček, Miroslav -, Chalupníčková, Věra (dokument 1941-1948)", "note": "", "views": "78x", "geolocation_type": "regional.address"}}, {"type": "Feature", "geometry": {"type": "Point", "coordinates": [14.36867, 50.07049]}, "properties": {"id": "A0C4FB44B67611DF820F00166F1163D4", "kind": "pozitiv", "description": "Průhled kaštanovou alejí vedoucí k západnímu průčelí domu čp. 130 (usedlost Zámečnice) na Smíchově v ulici Nad Zámečnicí.", "date_label": "30.3.1923", "start_date": "1923-03-30", "end_date": "1923-03-30", "author": "Bernau, Karel, Ing. (1880-1948)", "note": "", "views": "68x", "geolocation_type": "regional.address"}}, {"type": "Feature", "geometry": {"type": "Point", "coordinates": [14.66719, 50.09343]}, "properties": {"id": "A0C4FB4FB67611DF820F00166F1163D4", "kind": "negativ", "description": "Pohled od domu čp. 1012 (kavárna Slavie) na Národní třídu, v popředí stavba Nové scény Národního divadla (dům čp. 1393 na Novém Městě), v pozadí dům čp. 139 na Novém Městě.", "date_label": "kol.1977", "start_date": "1977-01-01", "end_date": "1977-12-31", "author": "Chalupníček, Miroslav -, Chalupníčková, Věra (dokument 1941-1948)", "note": "", "views": "57x", "geolocation_type": "regional.address"}}, {"type": "Feature", "geometry": {"type": "Point", "coordinates": [14.36851, 50.07335]}, "properties": {"id": "A0C4FB50B67611DF820F00166F1163D4", "kind": "pozitiv", "description": "Celkový pohled na dům čp. 120 (\"Skalka\") na Smíchově.", "date_label": "březen 1959", "start_date": "1959-03-01", "end_date": "1959-03-31", "author": "Hnilička, Eduard (1887-1967)", "note": "", "views": "53x", "geolocation_type": "regional.address"}}, {"type": "Feature", "geometry": {"type": "Point", "coordinates": [14.42281, 50.08741]}, "properties": {"id": "A0C4FB55B67611DF820F00166F1163D4", "kind": "pozitiv", "description": "Pohled na Týnskou faru (dům čp. 601 na Starém Městě) - přízemí východní průčelí do Štupartské ulice.", "date_label": "23.4.1934", "start_date": "1934-04-23", "end_date": "1934-04-23", "author": "Alexander, Antonín (1892-působnost do 1948)", "note": "", "views": "23x", "geolocation_type": "regional.address"}}, {"type": "Feature", "geometry": {"type": "Point", "coordinates": [14.35655, 50.06696]}, "properties": {"id": "A0C4FB5EB67611DF820F00166F1163D4", "kind": "pozitiv", "description": "Pohled z čínského pavilonu do zahrady usedlosti Cibulka v Košířích (dům čp. 118) - v pozadí umělá romantická zřícenina (rozhledna). Součást panoramatu.", "date_label": "říjen 1924", "start_date": "1924-10-01", "end_date": "1924-10-31", "author": "Vojta, Tomáš (1885-1934)", "note": "", "views": "59x", "geolocation_type": "regional.address"}}, {"type": "Feature", "geometry": {"type": "Point", "coordinates": [14.42355, 50.08384]}, "properties": {"id": "A0C4FB67B67611DF820F00166F1163D4", "kind": "pozitiv", "description": "Celkový pohled na dům čp. 772 na Novém Městě na Václavském náměstí (kavárna Kaiserova). Vlevo dům čp. 773 na Novém Městě.", "date_label": "kol.1900", "start_date": "1900-01-01", "end_date": "1900-12-31", "author": "", "note": "", "views": "96x", "geolocation_type": "regional.address"}}, {"type": "Feature", "geometry": {"type": "Point", "coordinates": [14.42907, 50.0856]}, "properties": {"id": "A0C4FB68B67611DF820F00166F1163D4", "kind": "pozitiv", "description": "Pohled na průčelí domu čp. 869 (\"U Tří jezdců\") na Senovážné náměstí na Novém Městě.", "date_label": "19.1.1906", "start_date": "1906-01-19", "end_date": "1906-01-19", "author": "Eckert-ateliér", "note": "", "views": "49x", "geolocation_type": "regional.address"}}, {"type": "Feature", "geometry": {"type": "Point", "coordinates": [14.38971, 50.06627]}, "properties": {"id": "A0C4FB6DB67611DF820F00166F1163D4", "kind": "pozitiv", "description": "Pohled na dům čp. 171 (Cihlářka, vila Mimosa) v ulici U Mrázovky na Smíchově.", "date_label": "březen 1959", "start_date": "1959-03-01", "end_date": "1959-03-31", "author": "Hnilička, Eduard (1887-1967)", "note": "", "views": "232x", "geolocation_type": "regional.address"}}, {"type": "Feature", "geometry": {"type": "Point", "coordinates": [14.42481, 50.08808]}, "properties": {"id": "A0C4FB7DB67611DF820F00166F1163D4", "kind": "negativ", "description": "Pohled na dům čp. 647 (\"U Štupartů\") na nároží ulic Malé Štupartské a Jakubské (vlevo) na Starém Městě před zbořením.", "date_label": "11.3.1911", "start_date": "1911-03-11", "end_date": "1911-03-11", "author": "Eckert-ateliér", "note": "", "views": "28x", "geolocation_type": "regional.address"}}, {"type": "Feature", "geometry": {"type": "Point", "coordinates": [14.40339, 50.09134]}, "properties": {"id": "A0C4FB7EB67611DF820F00166F1163D4", "kind": "pozitiv", "description": "Pohled do dvora bývalého Tereziánského ústavu šlechtičen na Pražském hradě (dům čp. 2 na Hradčanech).", "date_label": "před 1926", "start_date": "1800-01-01", "end_date": "1925-12-31", "author": "Vojta, Tomáš (1885-1934)", "note": "", "views": "55x", "geolocation_type": "regional.address"}}, {"type": "Feature", "geometry": {"type": "Point", "coordinates": [14.38497, 50.06891]}, "properties": {"id": "A0C4FB80B67611DF820F00166F1163D4", "kind": "pozitiv", "description": "Pohled na část domu čp. 215 na Smíchově (\"Popelka\").", "date_label": "", "start_date": "", "end_date": "", "author": "Korba, Jaroslav", "note": "", "views": "257x", "geolocation_type": "regional.address"}}, {"type": "Feature", "geometry": {"type": "Point", "coordinates": [14.42404, 50.09215]}, "properties": {"id": "A0C4FB84B67611DF820F00166F1163D4", "kind": "pozitiv", "description": "Pohled na dům čp. 840 Na nábřeží na Františku při bourání. Za ním kostel sv. Salvátora - součást Anežského kláštera na Starém Městě.", "date_label": "1958", "start_date": "1958-01-01", "end_date": "1958-12-31", "author": "Roleček, Jiří", "note": "", "views": "84x", "geolocation_type": "regional.address"}}, {"type": "Feature", "geometry": {"type": "Point", "coordinates": [14.40535, 50.09003]}, "properties": {"id": "A0C4FB94B67611DF820F00166F1163D4", "kind": "negativ", "description": "Pohled do Astronomicko-astrologické chodby v 2. poschodí Valdštejnského paláce (dům čp. 17 na Malé Straně).", "date_label": "", "start_date": "", "end_date": "", "author": "Eckert-ateliér", "note": "", "views": "18x", "geolocation_type": "regional.address"}}, {"type": "Feature", "geometry": {"type": "Point", "coordinates": [14.39608, 50.08989]}, "properties": {"id": "A0C4FB97B67611DF820F00166F1163D4", "kind": "pozitiv", "description": "Pohled na část průčelí s portálem domu čp. 61 na Hradčanském náměstí na Hradčanech.", "date_label": "27.7.1906", "start_date": "1906-07-27", "end_date": "1906-07-27", "author": "", "note": "", "views": "17x", "geolocation_type": "regional.address"}}, {"type": "Feature", "geometry": {"type": "Point", "coordinates": [14.52699, 50.04963]}, "properties": {"id": "A0C4FB9AB67611DF820F00166F1163D4", "kind": "pozitiv", "description": "Pohled od jihozápadu na dům čp. 44 v Havlíčkově ulici v Hostivaři.", "date_label": "8.6.1930", "start_date": "1930-06-08", "end_date": "1930-06-08", "author": "Alexander, Antonín (1892-působnost do 1948)", "note": "", "views": "44x", "geolocation_type": "regional.address"}}, {"type": "Feature", "geometry": {"type": "Point", "coordinates": [14.41521, 50.09017]}, "properties": {"id": "A0C4FB9BB67611DF820F00166F1163D4", "kind": "pozitiv", "description": "Celkový pohled na sloup veřejného osvětlení (pětiramenný plynový kandelábr) před Rudolfinem (dům čp. 79 na Starém Městě).", "date_label": "", "start_date": "", "end_date": "", "author": "", "note": "", "views": "55x", "geolocation_type": "regional.address"}}, {"type": "Feature", "geometry": {"type": "Point", "coordinates": [14.42211, 50.08746]}, "properties": {"id": "A0C4FB9DB67611DF820F00166F1163D4", "kind": "negativ", "description": "Pohled na východní stranu Staroměstského náměstí s mariánským sloupem, s domy čp. 606, 605, 604, 603 a věžemi kostela P. Marie před Týnem. Vpravo ústí Celetné ulice a několik domů jižní strany náměstí.", "date_label": "kol.1880", "start_date": "1880-01-01", "end_date": "1880-12-31", "author": "Eckert, Jindřich (1833-1905)", "note": "", "views": "51x", "geolocation_type": "regional.address"}}, {"type": "Feature", "geometry": {"type": "Point", "coordinates": [14.40522, 50.06038]}, "properties": {"id": "A0C4FB9EB67611DF820F00166F1163D4", "kind": "pozitiv", "description": "Celkový pohled na dům čp. 189 (usedlost Koulka) na Smíchově - od severu. V popředí hlavní vjezd do usedlosti.", "date_label": "10.10.1931", "start_date": "1931-10-10", "end_date": "1931-10-10", "author": "Alexander, Antonín (1892-působnost do 1948)", "note": "", "views": "62x", "geolocation_type": "regional.address"}}, {"type": "Feature", "geometry": {"type": "Point", "coordinates": [14.42013, 50.08651]}, "properties": {"id": "A0C4FBA1B67611DF820F00166F1163D4", "kind": "pozitiv", "description": "Pohled na portál domu čp. 460 (Vila Voračických z Paběnic) v ulici Ke Karlovu na Novém Městě.", "date_label": "15.5.1906", "start_date": "1906-05-15", "end_date": "1906-05-15", "author": "", "note": "", "views": "17x", "geolocation_type": "regional.address"}}, {"type": "Feature", "geometry": {"type": "Point", "coordinates": [14.5266, 50.05026]}, "properties": {"id": "A0C4FBAEB67611DF820F00166F1163D4", "kind": "pozitiv", "description": "Pohled od můstku přes potok Botič na Husově náměstí v Hostivaři. Vpravo ohradní zeď zahrady domu čp. 47.", "date_label": "5.7.1930", "start_date": "1930-07-05", "end_date": "1930-07-05", "author": "Alexander, Antonín (1892-působnost do 1948)", "note": "", "views": "61x", "geolocation_type": "regional.address"}}, {"type": "Feature", "geometry": {"type": "Point", "coordinates": [14.60353, 50.02439]}, "properties": {"id": "A0C4FBBDB67611DF820F00166F1163D4", "kind": "negativ", "description": "Pohled na novostavbu domu čp. 494 na nároží ulic Železné a Havelské na Starém Městě (\"U Goliáše\" ). Vlevo dům čp. 539.", "date_label": "1904", "start_date": "1904-01-01", "end_date": "1904-12-31", "author": "Eckert, Jindřich (1833-1905)", "note": "", "views": "32x", "geolocation_type": "regional.address"}}, {"type": "Feature", "geometry": {"type": "Point", "coordinates": [14.41347, 50.08126]}, "properties": {"id": "A0C4FBCAB67611DF820F00166F1163D4", "kind": "pozitiv", "description": "Pohled z řetězového mostu Františka I. přes Vltavu na Národní divadlo (dům čp. 223 na Novém Městě).", "date_label": "kol.1895", "start_date": "1895-01-01", "end_date": "1895-12-31", "author": "Bellmann", "note": "", "views": "102x", "geolocation_type": "regional.address"}}, {"type": "Feature", "geometry": {"type": "Point", "coordinates": [14.60206, 50.02789]}, "properties": {"id": "A0C4FBCDB67611DF820F00166F1163D4", "kind": "pozitiv", "description": "Pohled do Pařížské ulice. Zprava domy čp. 120, 119 na Starém Městě, ústí Široké ulice, 125 v Josefově a další.", "date_label": "1986", "start_date": "1986-01-01", "end_date": "1986-12-31", "author": "Rameš, František", "note": "", "views": "90x", "geolocation_type": "regional.address"}}, {"type": "Feature", "geometry": {"type": "Point", "coordinates": [14.4213, 50.08637]}, "properties": {"id": "A0C4FBD1B67611DF820F00166F1163D4", "kind": "pozitiv", "description": "Pohled na jižní stranu Staroměstského náměstí s domy čp. 481, 480, 479, 478 na Starém Městě.", "date_label": "1923", "start_date": "1923-01-01", "end_date": "1923-12-31", "author": "Vojta, Tomáš (1885-1934)", "note": "", "views": "91x", "geolocation_type": "regional.address"}}, {"type": "Feature", "geometry": {"type": "Point", "coordinates": [14.38967, 50.08671]}, "properties": {"id": "A0C4FBD9B67611DF820F00166F1163D4", "kind": "pozitiv", "description": "Pohled na vstupní portál kostela sv. Rocha v areálu kláštera Premonstrátů na Strahově.", "date_label": "11.7.1907", "start_date": "1907-07-11", "end_date": "1907-07-11", "author": "", "note": "", "views": "18x", "geolocation_type": "regional.address"}}, {"type": "Feature", "geometry": {"type": "Point", "coordinates": [14.4242, 50.0871]}, "properties": {"id": "A0C4FBF7B67611DF820F00166F1163D4", "kind": "kresba tužkou", "description": "Pohled na vstupní portál domu čp. 562 (\"Dům Buquoyský\") v Celetné ulici na Starém Městě.", "date_label": "kol.1900", "start_date": "1900-01-01", "end_date": "1900-12-31", "author": "", "note": "", "views": "19x", "geolocation_type": "regional.address"}}, {"type": "Feature", "geometry": {"type": "Point", "coordinates": [14.4219, 50.08718]}, "properties": {"id": "A0C4FC0EB67611DF820F00166F1163D4", "kind": "pohlednice", "description": "Pražské povstání - 8.5.1945. Staroměstské náměstí navečer po podepsání kapitulace. Pražané pracují na záchraně hořících budov čp. 552 (Štorchův) a čp. 551 (\"U Kamenného beránka\") a poražení němečtí vojáci opouštějí Prahu. Kolona nákladních aut směřuje od Celetné ulice přes náměstí a Pařížskou ulicí přes Čechův most.", "date_label": "8.5.1945", "start_date": "1945-05-08", "end_date": "1945-05-08", "author": "", "note": "", "views": "151x", "geolocation_type": "regional.address"}}, {"type": "Feature", "geometry": {"type": "Point", "coordinates": [14.37932, 50.07154]}, "properties": {"id": "A0C4FC17B67611DF820F00166F1163D4", "kind": "pozitiv", "description": "Pohled do zahrady domu čp. 154 (usedlost Klamovka) na Smíchově - skleník (dříve zahradní pavilon)", "date_label": "1959 březen", "start_date": "1959-03-01", "end_date": "1959-03-31", "author": "Hnilička, Eduard (1887-1967)", "note": "", "views": "58x", "geolocation_type": "regional.address"}}, {"type": "Feature", "geometry": {"type": "Point", "coordinates": [14.41792, 50.0913]}, "properties": {"id": "A0C4FC1AB67611DF820F00166F1163D4", "kind": "negativ", "description": "Pohled do Fialkové ulice (zleva) s domy čp. 207 a 279 (v pozadí čp. 208) v Josefově krátce před zbořením.", "date_label": "1.4.1905", "start_date": "1905-04-01", "end_date": "1905-04-01", "author": "Eckert-ateliér", "note": "", "views": "45x", "geolocation_type": "regional.address"}}, {"type": "Feature", "geometry": {"type": "Point", "coordinates": [14.41907, 50.06375]}, "properties": {"id": "A0C4FC1EB67611DF820F00166F1163D4", "kind": "pozitiv", "description": "Pohled na vstupní portál domu čp. 14 (Kanovnický dům) v Soběslavově ulici na Vyšehradě.", "date_label": "kol.1905", "start_date": "1905-01-01", "end_date": "1905-12-31", "author": "", "note": "", "views": "34x", "geolocation_type": "regional.address"}}, {"type": "Feature", "geometry": {"type": "Point", "coordinates": [14.41595, 50.07864]}, "properties": {"id": "A0C4FC27B67611DF820F00166F1163D4", "kind": "pozitiv", "description": "Pohled z Pštrossovy ulice na zvonici a kostel sv. Vojtěcha. Vpravo dům čp. 201 na Novém Městě.", "date_label": "10.5.1914", "start_date": "1914-05-10", "end_date": "1914-05-10", "author": "Kříženecký, Jan (1868-1921)", "note": "", "views": "85x", "geolocation_type": "regional.address"}}, {"type": "Feature", "geometry": {"type": "Point", "coordinates": [14.39577, 50.08991]}, "properties": {"id": "A0C4FC2AB67611DF820F00166F1163D4", "kind": "pozitiv", "description": "Pohled na zazděný portál domu čp. 62 (\"Kapitulní dům\") na Hradčanském náměstí na Hradčanech.", "date_label": "27.7.1906", "start_date": "1906-07-27", "end_date": "1906-07-27", "author": "", "note": "", "views": "19x", "geolocation_type": "regional.address"}}, {"type": "Feature", "geometry": {"type": "Point", "coordinates": [14.40535, 50.09003]}, "properties": {"id": "A0C4FC2CB67611DF820F00166F1163D4", "kind": "pozitiv", "description": "Pohled do hlavního sálu Valdštejnského paláce - jižní strana s krbem (dům čp. 17 na Malé Straně).", "date_label": "", "start_date": "", "end_date": "", "author": "Eckert, Jindřich (1833-1905)", "note": "", "views": "16x", "geolocation_type": "regional.address"}}, {"type": "Feature", "geometry": {"type": "Point", "coordinates": [14.42403, 50.08418]}, "properties": {"id": "A0C4FC4CB67611DF820F00166F1163D4", "kind": "pozitiv", "description": "Průhled ulicí Na Příkopě s novostavbou nárožního domu čp. 846 na Novém Městě (palác Koruna).", "date_label": "kol.1920", "start_date": "1920-01-01", "end_date": "1920-12-31", "author": "Vojta, Tomáš (1885-1934)", "note": "", "views": "112x", "geolocation_type": "regional.address"}}, {"type": "Feature", "geometry": {"type": "Point", "coordinates": [14.42867, 50.07957]}, "properties": {"id": "A0C4FC56B67611DF820F00166F1163D4", "kind": "pozitiv", "description": "Pohled do Krakovské ulice s domem čp. 1256 na Novém Městě.", "date_label": "kol.1910", "start_date": "1910-01-01", "end_date": "1910-12-31", "author": "", "note": "", "views": "43x", "geolocation_type": "regional.address"}}, {"type": "Feature", "geometry": {"type": "Point", "coordinates": [14.42169, 50.08331]}, "properties": {"id": "A0C4FC66B67611DF820F00166F1163D4", "kind": "pozitiv", "description": "Celkový pohled na dům čp. 371 v Perlové ulici na Starém Městě.", "date_label": "7.5.1933", "start_date": "1933-05-07", "end_date": "1933-05-07", "author": "Alexander, Antonín (1892-působnost do 1948)", "note": "", "views": "98x", "geolocation_type": "regional.address"}}, {"type": "Feature", "geometry": {"type": "Point", "coordinates": [14.36081, 50.08356]}, "properties": {"id": "A0C4FC7EB67611DF820F00166F1163D4", "kind": "pozitiv", "description": "Pohled na hlavní průčelí hostince U kaštanu - dům čp. 201 v Břevnově.", "date_label": "", "start_date": "", "end_date": "", "author": "", "note": "", "views": "33x", "geolocation_type": "regional.address"}}, {"type": "Feature", "geometry": {"type": "Point", "coordinates": [14.40365, 50.08922]}, "properties": {"id": "A0C4FC95B67611DF820F00166F1163D4", "kind": "pozitiv", "description": "Pohled na portál domu čp. 177 (Fara u sv. Mikuláše) ve Sněmovní ulici na Malé Straně.", "date_label": "21.7.1906", "start_date": "1906-07-21", "end_date": "1906-07-21", "author": "", "note": "", "views": "19x", "geolocation_type": "regional.address"}}, {"type": "Feature", "geometry": {"type": "Point", "coordinates": [14.42827, 50.08961]}, "properties": {"id": "A0C4FC9FB67611DF820F00166F1163D4", "kind": "pozitiv", "description": "Pohled na severní stranu náměstí Republiky s domy čp. 655 (dům pojišťovny Kotva) na Starém Městě a čp. 1080 na Novém Městě. Mezi nimi průhled do Revoluční třídy.", "date_label": "únor 1930", "start_date": "1930-02-01", "end_date": "1930-02-28", "author": "Vojta, Tomáš (1885-1934)", "note": "", "views": "155x", "geolocation_type": "regional.address"}}, {"type": "Feature", "geometry": {"type": "Point", "coordinates": [14.31567, 50.08289]}, "properties": {"id": "A0C4FCA0B67611DF820F00166F1163D4", "kind": "pozitiv", "description": "Pohled na Ruzyňský mlýn (dům čp. 32 v Ruzyni).", "date_label": "1912", "start_date": "1912-01-01", "end_date": "1912-12-31", "author": "Fink, František (1854-1935)", "note": "", "views": "55x", "geolocation_type": "regional.address"}}, {"type": "Feature", "geometry": {"type": "Point", "coordinates": [14.43056, 50.07918]}, "properties": {"id": "A0C4FCA8B67611DF820F00166F1163D4", "kind": "negativ", "description": "Pohled do interiéru Národního muzea (dům čp. 1700 na Novém Městě) - výstavní sál s exponáty.", "date_label": "kol.1900", "start_date": "1900-01-01", "end_date": "1900-12-31", "author": "Eckert, Jindřich (1833-1905)", "note": "", "views": "30x", "geolocation_type": "regional.address"}}, {"type": "Feature", "geometry": {"type": "Point", "coordinates": [14.45723, 50.10912]}, "properties": {"id": "A0C4FCB2B67611DF820F00166F1163D4", "kind": "pozitiv", "description": "Stavba veřejného skladiště (dům čp. 1366) v holešovickém přístavu.", "date_label": "1927", "start_date": "1927-01-01", "end_date": "1927-12-31", "author": "Bruner-Dvořák, Rudolf (1864-1921)", "note": "", "views": "185x", "geolocation_type": "regional.address"}}, {"type": "Feature", "geometry": {"type": "Point", "coordinates": [14.39995, 50.09041]}, "properties": {"id": "A0C4FCB9B67611DF820F00166F1163D4", "kind": "pozitiv", "description": "Celkový pohled na Staré proboštství na 3. nádvoří Pražského hradu (dům čp. 48 na Hradčanech).", "date_label": "kol.1885", "start_date": "1885-01-01", "end_date": "1885-12-31", "author": "Eckert, Jindřich (1833-1905)", "note": "", "views": "31x", "geolocation_type": "regional.address"}}, {"type": "Feature", "geometry": {"type": "Point", "coordinates": [14.63407, 50.12262]}, "properties": {"id": "A0C4FCD4B67611DF820F00166F1163D4", "kind": "negativ", "description": "Pohled na křižovatku ulic Valentinské a Veleslavínovy s domem čp. 58 na Starém Městě před zbořením roku 1898. Vlevo roh domu čp. 60.", "date_label": "kol.1895", "start_date": "1895-01-01", "end_date": "1895-12-31", "author": "Eckert, Jindřich (1833-1905)", "note": "", "views": "33x", "geolocation_type": "regional.address"}}, {"type": "Feature", "geometry": {"type": "Point", "coordinates": [14.41598, 50.08168]}, "properties": {"id": "A0C4FCD5B67611DF820F00166F1163D4", "kind": "negativ", "description": "Pohled od paláce Dunaj na dům čp. 339 na Starém Městě na nároží ulice Karoliny Světlé a Národní třídy.", "date_label": "kol.1977", "start_date": "1977-01-01", "end_date": "1977-12-31", "author": "Chalupníček, Miroslav -, Chalupníčková, Věra (dokument 1941-1948)", "note": "", "views": "36x", "geolocation_type": "regional.address"}}, {"type": "Feature", "geometry": {"type": "Point", "coordinates": [14.41513, 50.08594]}, "properties": {"id": "A0C4FCDDB67611DF820F00166F1163D4", "kind": "kresba tužkou", "description": "Pohled na vstupní portál domu čp. 186 (Pöttingský palác) v Karlově ulici na Starém Městě.", "date_label": "kol.1900", "start_date": "1900-01-01", "end_date": "1900-12-31", "author": "", "note": "", "views": "13x", "geolocation_type": "regional.address"}}, {"type": "Feature", "geometry": {"type": "Point", "coordinates": [14.41844, 50.08972]}, "properties": {"id": "A0C4FCE6B67611DF820F00166F1163D4", "kind": "pozitiv", "description": "Pohled do Rabínské (dnes Maiselovy) ulice v Josefově se Staronovou synagogou a Židovskou radnicí (dům čp. 250).", "date_label": "kol.1885", "start_date": "1885-01-01", "end_date": "1885-12-31", "author": "", "note": "", "views": "108x", "geolocation_type": "regional.address"}}, {"type": "Feature", "geometry": {"type": "Point", "coordinates": [14.50244, 50.10743]}, "properties": {"id": "A0C4FCE7B67611DF820F00166F1163D4", "kind": "pozitiv", "description": "Celkový pohled na jižní a východní průčelí domu čp. 1 (pivovar) ve Vysočanech.", "date_label": "15.10.1942", "start_date": "1942-10-15", "end_date": "1942-10-15", "author": "Alexander, Antonín (1892-působnost do 1948)", "note": "", "views": "181x", "geolocation_type": "regional.address"}}, {"type": "Feature", "geometry": {"type": "Point", "coordinates": [14.41726, 50.09011]}, "properties": {"id": "A0C4FCEBB67611DF820F00166F1163D4", "kind": "negativ", "description": "Pohled na dům čp. 42 v Kaprově ulici. Zleva a zprava části domů čp. 40 a 44 na Starém Městě krátce před zbořením.", "date_label": "30.8.1906", "start_date": "1906-08-30", "end_date": "1906-08-30", "author": "Eckert-ateliér", "note": "", "views": "25x", "geolocation_type": "regional.address"}}, {"type": "Feature", "geometry": {"type": "Point", "coordinates": [14.41979, 50.08642]}, "properties": {"id": "A0C4FCF2B67611DF820F00166F1163D4", "kind": "pozitiv", "description": "Pohled na vstupní portál domu čp. 459 (\"Richterův dům\") na Malém náměstí na Starém Městě.", "date_label": "18.7.1906", "start_date": "1906-07-18", "end_date": "1906-07-18", "author": "", "note": "", "views": "24x", "geolocation_type": "regional.address"}}, {"type": "Feature", "geometry": {"type": "Point", "coordinates": [14.36867, 50.07049]}, "properties": {"id": "A0C4FCF5B67611DF820F00166F1163D4", "kind": "pozitiv", "description": "Pohled na dům čp. 130 (Zámečnice) v osadě Buďánka na Smíchově.", "date_label": "1930-1935", "start_date": "1930-01-01", "end_date": "1935-12-31", "author": "Reach, Zikmund (1859-1935)", "note": "Autorství Z. Reacha není jisté.", "views": "140x", "geolocation_type": "regional.address"}}, {"type": "Feature", "geometry": {"type": "Point", "coordinates": [14.42334, 50.09144]}, "properties": {"id": "A0C4FD02B67611DF820F00166F1163D4", "kind": "pozitiv", "description": "Pohled do dvora domu čp. 800 na Starém Městě (obecní dvůr).", "date_label": "", "start_date": "", "end_date": "", "author": "", "note": "", "views": "30x", "geolocation_type": "regional.address"}}, {"type": "Feature", "geometry": {"type": "Point", "coordinates": [14.43056, 50.07918]}, "properties": {"id": "A0C4FD10B67611DF820F00166F1163D4", "kind": "pozitiv", "description": "Pohled na stavbu metra a budovy Národního shromáždění (dům čp. 52 na Vinohradech). Vpravo Národní muzeum (dům čp. 1700 na Novém Městě).", "date_label": "březen 1970", "start_date": "1970-03-01", "end_date": "1970-03-31", "author": "Vopravil, Josef (1902-1972)", "note": "", "views": "86x", "geolocation_type": "regional.address"}}, {"type": "Feature", "geometry": {"type": "Point", "coordinates": [14.42481, 50.08808]}, "properties": {"id": "A0C4FD16B67611DF820F00166F1163D4", "kind": "pozitiv", "description": "Pohled do dvora domu čp. 647 (\"U Štupartů\") na nároží ulic Štupartské a Jakubské na Starém Městě.", "date_label": "", "start_date": "", "end_date": "", "author": "Štenc-ateliér", "note": "", "views": "13x", "geolocation_type": "regional.address"}}, {"type": "Feature", "geometry": {"type": "Point", "coordinates": [14.41139, 50.09203]}, "properties": {"id": "A0C4FD1AB67611DF820F00166F1163D4", "kind": "pozitiv", "description": "Pohled od Letné na malostranské střechy a Vltavu s mosty. Vlevo nový Mánesův most. V popředí dům čp. 128 na Malé Straně, v pozadí Alšovo nábřeží.", "date_label": "kol.1920", "start_date": "1920-01-01", "end_date": "1920-12-31", "author": "Bellmann-ateliér", "note": "", "views": "106x", "geolocation_type": "regional.address"}}, {"type": "Feature", "geometry": {"type": "Point", "coordinates": [14.40535, 50.09003]}, "properties": {"id": "A0C4FD2CB67611DF820F00166F1163D4", "kind": "pozitiv", "description": "Sala terrena Valdštejnského paláce (dům čp. 17 na Malé Straně) - interiér.", "date_label": "", "start_date": "", "end_date": "", "author": "Eckert, Jindřich (1833-1905)", "note": "", "views": "25x", "geolocation_type": "regional.address"}}, {"type": "Feature", "geometry": {"type": "Point", "coordinates": [14.39225, 50.02436]}, "properties": {"id": "A0C4FD30B67611DF820F00166F1163D4", "kind": "pozitiv", "description": "Pohled na dům čp. 15 (škola) a kostel Narození P. Marie v Malé Chuchli.", "date_label": "25.3.1942", "start_date": "1942-03-25", "end_date": "1942-03-25", "author": "Alexander, Antonín (1892-působnost do 1948)", "note": "", "views": "46x", "geolocation_type": "regional.address"}}, {"type": "Feature", "geometry": {"type": "Point", "coordinates": [14.41556, 50.13557]}, "properties": {"id": "A0C4FD32B67611DF820F00166F1163D4", "kind": "pozitiv", "description": "Pohled z pravého břehu při dynamitce (dům čp. 50 v Bohnicích - uprostřed) ve vltavském údolí mezi Roztoky a bohnickým hradištěm Na Zámkách. Součást dvoudílného panoramatu.", "date_label": "27.8.1924", "start_date": "1924-08-27", "end_date": "1924-08-27", "author": "Alexander, Antonín (1892-působnost do 1948)", "note": "", "views": "107x", "geolocation_type": "regional.address"}}, {"type": "Feature", "geometry": {"type": "Point", "coordinates": [14.40492, 50.08882]}, "properties": {"id": "A0C4FD43B67611DF820F00166F1163D4", "kind": "negativ", "description": "Pohled na část průčelí domu čp. 26 v Tomášské ulici na Malé Straně s domovním znamením (sv. Hubert z domu \"U Zlatého jelena\") .", "date_label": "5.1.1909", "start_date": "1909-01-05", "end_date": "1909-01-05", "author": "Eckert-ateliér", "note": "", "views": "13x", "geolocation_type": "regional.address"}}, {"type": "Feature", "geometry": {"type": "Point", "coordinates": [14.41719, 50.07215]}, "properties": {"id": "A0C4FD49B67611DF820F00166F1163D4", "kind": "pozitiv", "description": "Pohled na Rašínovo nábřeží s částmi domů čp. 375 a 376. V pozadí nově opravený kostel P. Marie v Emauzích s klášterem.", "date_label": "1970", "start_date": "1970-01-01", "end_date": "1970-12-31", "author": "Vopravil, Josef (1902-1972)", "note": "", "views": "120x", "geolocation_type": "regional